data,url_noticia,url_noticia_curto,titulo,conteudo_noticia,assunto,assunto_ex,titulo_ex,subtitulo_ex,local_ex,artigo_ex,n_paragrafos
2020-03-17,https://web.archive.org/web/20200317045948/https://g1.globo.com/economia/noticia/2020/03/16/mercado-reduz-para-168percent-previsao-de-alta-do-pib-de-2020.ghtml,https://g1.globo.com/economia/noticia/2020/03/16/mercado-reduz-para-168percent-previsao-de-alta-do-pib-de-2020.ghtml,"Com avanço do coronavírus, mercado reduz para 1,68% previsão de alta do PIB de 2020"," Diante do avanço do novo coronavírus, os analistas do mercado financeiro reduziram novamente a estimativa de crescimento da economia brasileira neste ano, que passou de 1,99% para 1,68% de alta. Essa foi a quinta queda consecutiva no indicador.  Ao mesmo tempo, eles também passaram a prever um corte da taxa básica de juros nesta semana, dos atuais 4,25% para 4% ao ano. O Comitê de Política Monetária (Copom) se reúne nesta terça e quarta-feiras (17 e 18). A decisão será anunciada às 18h da próxima quarta.  As projeções fazem parte do boletim de mercado, conhecido como relatório ""Focus"", divulgado nesta segunda-feira (16) pelo Banco Central (BC). Os dados foram levantados na semana passada com mais de 100 instituições financeiras.  A redução na previsão de crescimento da economia, e de corte dos juros nesta semana, acontecem em meio aos efeitos da pandemia do coronavírus na economia mundial.  Neste domingo (15), o Federal Reserve (Fed, banco central dos Estados Unidos) promoveu, após reunião emergencial, um corte de 1 ponto percentual nas taxas de juros do país. Agora, a taxa de juros dos Estados Unidos varia de 0% a 0,25%.  A instituição também anunciou a compra de US$ 500 bilhões em títulos do Tesouro e de US$ 200 bilhões em valores hipotecários.  O Produto Interno Bruto (PIB) é a soma de todos os bens e serviços feitos no país, independentemente da nacionalidade de quem os produz, e serve para medir o comportamento da economia brasileira.  Para o próximo ano, a previsão de crescimento do Produto Interno Bruto (PIB) permaneceu em 2,50%.  Segundo o relatório divulgado pelo BC, os analistas do mercado financeiro reduziram a estimativa de inflação para 2020 de 3,20% para 3,10%.  A expectativa de inflação do mercado para este ano segue abaixo da meta central, de 4%. O intervalo de tolerância do sistema de metas varia de 2,5% a 5,5%.  A meta de inflação é fixada pelo Conselho Monetário Nacional (CMN). Para alcançá-la, o Banco Central eleva ou reduz a taxa básica de juros da economia (Selic).  Para 2021, o mercado financeiro baixou a estimativa de inflação de 3,75% para 3,65%. No ano que vem, a meta central de inflação é de 3,75% e será oficialmente cumprida se o índice oscilar de 2,25% a 5,25%. ",economia,,,,,,
2020-03-17,https://web.archive.org/web/20200317045948/https://g1.globo.com/economia/noticia/2020/03/16/ultimas-noticias-sobre-os-mercados-em-16-de-marco.ghtml,https://g1.globo.com/economia/noticia/2020/03/16/ultimas-noticias-sobre-os-mercados-em-16-de-marco.ghtml,Últimas notícias sobre os mercados em 16 de março," As principais bolsas do mundo enfrentaram mais um dia de forte queda nesta segunda-feira (16), após dados mostrarem um forte tombo na economia chinesa e com o novo corte surpresa na taxa de juros dos EUA não conseguindo acalmar os mercados.  Nesta segunda, a turbulência nos mercados provocou a interrupção das negociações tanto no Brasil quanto nos Estados Unidos, onde as quedas atingiram o limite para o acionamento do chamado 'circuit breaker' – aqui, a primeira interrupção acontece quando o Ibovespa cai mais de 10%; nos EUA, quando os índices recuam 7%.  O dólar teve forte alta, e fechou acima de R$ 5 pela primeira vez, enquanto a Bovespa caiu quase 14%. Já as principais bolsas europeias fecharam com quedas de cerca de 5%.  Veja os principais destaques do dia:  Atualizado às 17h40 ",economia,,,,,,
2020-03-17,https://web.archive.org/web/20200317045948/https://g1.globo.com/economia/noticia/2020/03/16/nao-ha-risco-de-falta-de-produtos-nos-supermercados-diz-abras.ghtml,https://g1.globo.com/economia/noticia/2020/03/16/nao-ha-risco-de-falta-de-produtos-nos-supermercados-diz-abras.ghtml,"Não há risco de falta de produtos nos supermercados, diz Abras"," A Associação Brasileira de Supermercados (Abras) informou nesta segunda-feira (16), em nota, que não há problemas de desabastecimento de produtos nas lojas do setor, mas sim “[problemas] de reposição”, devido ao maior número de clientes em algumas unidades no fim de semana.  Isso ocorre quando há lentidão para repor as mercadorias que estão nos estoques das lojas para as gôndolas.  “Essa situação se concentrou mais em supermercados da capital paulista e em bairros das classes A e B”, informou a associação, no comunicado.  A entidade afirma que os produtos mais adquiridos nessas lojas nos últimos dias foram macarrão, molho de tomate, azeite, sal, bolacha, torrada, creme de leite, leite condensado, açúcar, achocolatado em pó, café, leite, água, suco, produtos de limpeza e higiene, com destaque para o papel higiênico e álcool gel.  O Valor havia antecipado, mais cedo, que as redes superaram a meta de vendas desses itens de mercearia entre sexta-feira (13) e domingo (15), e que a indústria tem garantido às cadeias o fornecimento para reposição. O prazo de estoque varia de 45 a 60 dias, a depender da rede e do item.  A Abras afirma que está atuando, por meio de um comitê, na elaboração de ações de comunicação que possam conscientizar a população sobre a importância da prevenção dentro e fora das lojas, conforme orientação do Ministério da Saúde. ",economia,,,,,,
2020-03-20,https://web.archive.org/web/20200320213922/https://g1.globo.com/economia/noticia/2020/03/20/bovespa.ghtml,https://g1.globo.com/economia/noticia/2020/03/20/bovespa.ghtml,Bovespa volta a cair após trégua na véspera," O principal índice da bolsa de valores brasileira, a B3, encerrou essa sexta-feira (20) em queda, após ter ensaiado recuperação ao longo do dia, acompanhando os movimentos dos mercados no exterior.  Os temores com os impactos da pandemia do coronavírus sobre a economia ainda toma conta do mercado, diante da expectativa de uma recessão global, mesmo com os estímulos de banco centrais e governos.  O Ibovespa caiu 1,85%, a 67.069 pontos. Veja mais cotações. Na mínima do dia, o índice chegou a 72.247 pontos. Na semana, a bolsa brasileira acumula baixa de 18,88%, a maior desde 10 de outubro de 2008, época da crise financeira nos EUA, segundo a Economatica.  Já o dólar fechou em queda, mas acima de R$ 5.  Azul (+15,29) e Gol (+16,48%), por outro lado, tiveram alta e conseguiram recuperar parte das fortes perdas recentes. Embraer (-12,95%) e Sabesp (-11,83%) tiveram as maiores baixas desta sexta.  Na quinta-feira (20), o Ibovespa fechou em alta de 2,15%, a 68.331 pontos, em uma trégua nas fortes quedas recentes, que fizeram o índice tocar mínima intradia desde julho de 2017 mais cedo na sessão da véspera. Na semana, porém, o índice acumula perda de cerca de 17%, com o desempenho no ano negativo em mais de 40%.  No Brasil, o governo federal reduziu em menos de dez dias a sua projeção para o crescimento do Produto Interno Bruto (PIB) deste ano. Após revisar de 2,4% para 2,1% a sua expectativa, o governo baixou novamente a estimativa e passou a prever uma expansão de apenas 0,02% para este ano, ou seja, uma estabilidade.  O governo chegou a anunciar na véspera que planeja pagar um auxílio para os trabalhadores que recebem até dois salários mínimos e forem afetados pela redução de jornada e salários proposta nesta semana pelo governo federal. Também anunciou que pretende pagar os primeiros 15 dias de afastamento se o trabalhador tiver contraído o coronavírus.  Para a agência de classificação de risco Moody´s, uma forte contração da economia global, pelo menos no segundo trimestre, se mostra praticamente certa. ""A incerteza permanecerá por pelo menos vários meses quanto ao tempo necessário para conter a propagação do vírus e como as empresas e as famílias vão lidar com as perdas financeiras resultantes"", destacou. ",economia,,,,,,
2020-03-20,https://web.archive.org/web/20200320213922/https://g1.globo.com/economia/noticia/2020/03/18/inss-fgts-ir-emprestimos-compras-o-que-muda-e-o-que-nao-muda-na-sua-vida-com-a-pandemia.ghtml,https://g1.globo.com/economia/noticia/2020/03/18/inss-fgts-ir-emprestimos-compras-o-que-muda-e-o-que-nao-muda-na-sua-vida-com-a-pandemia.ghtml,"INSS, FGTS, IR, empréstimos, contas: o que muda e o que não muda na sua vida com a pandemia "," Diante da pandemia de Covid-19, as medidas restritivas para conter a disseminação do coronavírus que estão sendo tomadas no Brasil nos âmbitos nacional, estadual e municipal estão impactando a economia e a rotina dos brasileiros.  Alguns serviços e benefícios sociais estão sendo suspensos ou alterados de modo a garantir a quarentena da população e evitar a aglomeração de pessoas. Há impactos tanto no setor público quanto no privado, com restrições de funcionamento, suspensões, proibições e adiamentos.  Veja abaixo o que mudou até agora e o que não mudou:  O Instituto Nacional do Seguro Social (INSS) suspendeu o atendimento presencial nas agências até 30 de abril, como medida de enfrentamento da epidemia do coronavírus, e esse prazo poderá ser prorrogado.  No período em que as agências estiverem fechadas, os pedidos de serviços previdenciários e assistenciais deverá ser feito, exclusivamente, por meio de dois canais: pela internet, em Meu INSS, e por telefone, na central de atendimento 135.  Segurados que fizerem requerimentos de auxílio-doença e Benefício de Prestação Continuada (BPC) para pessoa com deficiência devem enviar o atestado médico pelo Meu INSS. O documento será recepcionado pela perícia médica, que fará as devidas verificações.  Os agendamentos estão suspensos, inclusive de reabilitação profissional e serviço social, devendo ser reagendados apenas quando o atendimento nas agências for retomado. O INSS diz que está garantida, no entanto, a observância da data de entrada do requerimento.  O governo decidiu suspender, por 120 dias, a prova de vida dos beneficiários do INSS. A medida começou a valer em março e seguirá até meados de setembro.  A lei prevê que, todos os anos, beneficiários do INSS precisam comprovar ao governo que estão vivos. A medida evita fraudes e pagamento indevido dos benefícios. Essa comprovação é sempre presencial e pode ser feita em uma agência do INSS, em embaixadas e consulados ou na casa de aposentados e pensionistas com dificuldade de locomoção.  O Instituto Nacional do Seguro Social (INSS) autorizou a antecipação de um salário mínimo (R$ 1.045) mensal, durante o período de 3 meses, para trabalhadores que estão na fila do auxílio-doença ou que solicitarem o benefício.  Em razão do regime de plantão reduzido nas agências do INSS, os trabalhadores poderão solicitar o auxílio-doença mediante apenas apresentação de atestado médico, sem a necessidade de agendar ou realizar perícia médica federal.  O prazo para pagamento de contas de serviço não foi adiado e elas precisam ser pagas em dia para evitar a cobrança de multa e juros.  As agências bancárias dos principais bancos do país seguem funcionando em horário normal. Mas, diante da recomendação das autoridades sanitárias de evitar a aglomeração de pessoas, a orientação é para que a população priorize o uso de canais alternativos para pagamento, como aplicativos para celular ou internet banking.  O governo publicou uma medida provisória que isenta os consumidores de baixa renda do pagamento da contas de luz por 3 meses. A isenção valerá para unidades que consomem até 220 quilowatts-hora (kWh) por mês e que estejam incluídas na Tarifa Social.  Por decisão da Agência Nacional de Energia Elétrica (Aneel), as concessionárias estão proibidas de cortar o fornecimento de energia elétrica em caso de falta de pagamento dos consumidores. A medida vale por 90 dias.  O Banco Central autorizou os bancos a alterarem seus horários de atendimento. Com isso, elas ficam dispensadas de cumprir o horário mínimo de expediente para o público de cinco horas diárias ininterruptas e do atendimento obrigatório no período de 12h às 15h.  A Caixa limitou o funcionamento de suas agências para o horário entre 10h e 14h – restrito aos casos que não podem ser tratados pelo atendimento telefônico ou pelos aplicativos do banco para celular e demais serviços digitais. Para atendimento aos clientes que estão no chamado grupo de risco, como os idosos, além de limitar o fluxo de pessoas no interior das unidades de atendimento, 1.619 agências abrirão uma hora mais cedo.  O Bradesco também restringe o horário de atendimento entre 10h e 14h para o público em geral. Para aposentados e pensionistas do INSS, o atendimento começa uma hora antes e, nos dias de pagamento desse público, a abertura das agências acontecerá às 8h.  O Santander informou que vai fechar parte de suas agências a partir de 24 de março nas regiões metropolitanas de São Paulo e do Rio de Janeiro. Todas as demais agências do país terão seu horário de atendimento reduzido em duas horas, das 10h às 14h. O fluxo de pessoas também será limitado. Agências com grande concentração de clientes idosos poderão abrir uma hora mais cedo para atendimento dessas pessoas.  O Banco do Brasil informou que as suas agências irão funcionar em horário reduzido a partir de 24 de março, das 10h às 14h. O atendimento presencial será prestado somente em casos essenciais, como nas situações de desbloqueio de senha, desbloqueio de cartão, saques de benefícios sociais sem cartão, atendimento referente aos programas sociais destinados a aliviar as consequências econômicas do novo coronavírus e a pessoas com doenças graves.  O BB também selecionou outro grupo de agências com grande fluxo de beneficiários e viabiliza a abertura das Salas de Autoatendimento das 06h às 22h.  Diante da pandemia do coronavírus, a ordem é ficar em casa. É possível fazer quase todas as transações bancárias sem precisar ir a uma agência bancária. Basta ter acesso a telefone ou internet.  Para usar os canais digitais de cada banco, no entanto, é necessário fazer um cadastro prévio. Cada banco tem regras específicas para autorizar os clientes a fazerem as transações eletrônicas, seja pelo atendimento telefônico, internet ou aplicativo.  O primeiro passo para quem não tem acesso digital é ligar para a Central de Relacionamento ou para o Serviço de Atendimento ao Cliente (SAC) do banco - o número do telefone vem informado no verso do cartão bancário. A partir desta ligação o cliente será informado sobre o passo a passo para cadastramento de senhas e uso dos serviços eletrônicos.  A Federação Brasileira de Bancos (Febraban) anunciou que os cinco maiores bancos brasileiros atenderão pedidos de prorrogação, por ao menos 60 dias, dos vencimentos de dívidas de clientes pessoas físicas e micro e pequenas empresas, para os contratos vigentes e que estejam com o pagamento em dia.  A Caixa Econômica Federal anunciou redução dos juros em diversas linhas e a possibilidade de suspensão, por até 90 dias, nos pagamentos de prestações de contratos de empréstimo acertados por pessoas físicas e jurídicas, incluindo os habitacionais.  No Banco do Brasil, micro e pequenas empresas poderão prorrogar as próximas duas parcelas de financiamentos junto ao banco para o final do cronograma de pagamento das dívidas. Nessa opção, entretanto, a incidência de juros será diluída ao longo do financiamento.  A prorrogação, entretanto, nem sempre é automática. Os pedidos costumam ser avaliados caso a caso, de acordo com o relacionamento e histórico de cada cliente. A opção não é oferecida, por exemplo, para quem já tenha contratado outras linhas de crédito nas últimas semanas, como cheque especial.  No Santander, clientes com parcelas de dívidas vencidas e não pagas desde o último dia 16 de março, ou que tenham prestações a vencer até 15 de maio, poderão ter o prazo para o pagamento automaticamente prorrogado por até 60 dias, sem qualquer acréscimo. Além da carência, o valor das parcelas será mantido inalterado até o final do financiamento.  As distribuidoras vão poder adotar medidas alternativas para apurar o consumo de energia de seus clientes, em substituição à prática tradicional que consiste em enviar funcionários aos endereços para fazer a leitura dos medidores.  Uma das possibilidades é a de permitir que os próprios consumidores façam a leitura. Neste caso, porém, as distribuidoras terão oferecer os meios para que os clientes informem os dados.  É através da leitura dos medidores que as distribuidoras registram o consumo e geram as contas de luz que são enviadas às casas e empresas.  O governo vai prorrogar, por 6 meses, o prazo para pagamento dos tributos federais no âmbito do Simples Nacional. A medida se aplica também aos Microempreendedores Individuais (MEI). A mudança não se aplica, porém, aos tributos de fevereiro, que vencem no dia 20 de março.  O pacote anunciado pelo governo vai permitir também que as empresas adiem, em três meses, o pagamento do Simples Nacional e o depósito do Fundo de Garantia por Tempo de Serviço (FGTS) dos trabalhadores. Já as contribuições ao Sistema S serão reduzidas pela metade.  Foi prorrogado para o dia 30 de junho o prazo de apresentação da Declaração de Informações Socioeconômicas e Fiscais (Defis) para as empresas do Simples Nacional e da Declaração Anual Simplificada para o Microempreendedor Individual (DASN-Simei) referentes ao ano calendário de 2019.  Caso o prazo não fosse prorrogado, a Defis teria de ser entregue até 31 de março, e a da DASN-Simei até o dia 31 de maio.  O Ministério da Economia anunciou que vai pagar, em abril, a primeira metade do 13º salário de aposentados e pensionistas do INSS. Essa parcela, em geral, é paga em julho. Já a segunda parcela será antecipada para maio.  O governo reduziu o teto dos juros do empréstimo consignado dos aposentados e pensionistas do Instituto Nacional do Seguro Social (INSS). A taxa máxima passou de 2,08% para 1,80% ao mês. Para operações realizadas pelo cartão de crédito, o teto dos juros recuou de 3% para 2,70% mensais.  Além disso, o prazo para quitar o consignado dos aposentados e pensionistas ficou maior. Agora, quem contrair o empréstimo terá até sete anos para saldar a dívida, e não mais prazo de 6 anos.  O Ministério da Economia anunciou que vai antecipar o pagamento de todo o abono salarial para junho. A medida faz parte do pacote que também antecipa o 13º salário dos aposentados pelo INSS.  Outra medida incluída no mesmo pacote é o reforço ao programa Bolsa Família, com a inclusão de mais 1 milhão de beneficiários.  O concurso público do Instituto Brasileiro de Geografia e Estatística (IBGE) com a oferta de 208 mil vagas para a realização do Censo foi suspenso. O governo decidiu adiar o Censo para 2021.  Os candidatos que já fizeram o pagamento da inscrição serão reembolsado.  A Receita Federal prorrogou o prazo de entrega da declaração de Imposto de Renda da Pessoa Física (IRPF) por 60 dias. Ele passou para 30 de junho (antes era 30 de abril).  Todos os empregadores, inclusive o empregador de trabalhador doméstico, poderão se beneficiar da medida que autorizou adiar e parcelar o depósito do Fundo de Garantia por Tempo de Serviço (FGTS).  Pela nova regra, fica suspensa a obrigatoriedade do recolhimento referente aos períodos de março, abril e maio, com vencimento em abril, maio e junho, e o pagamento poderá ser feito só a partir de julho, em 6 parcelas fixas.  A maioria dos shoppings do país está fechada, segundo a Associação Brasileira de Shopping Centers (Abrasce). A entidade aponta que 95% dos empreendimentos do país estão fechados, um total de 550 shoppings entre os quase 580 centros de compras.  Na maioria dos estados está autorizado o funcionamento apenas de serviços considerados essenciais como supermercados, farmácias e postos de gasolina.  No Estado de São Paulo, a quarentena foi prorrogada até 22 de abril. Com isso, ficarão abertos apenas os serviços considerados essenciais.  Postos de gasolina continuam abertos – no entanto, a Agência Nacional do Petróleo, Gás Natural e Biocombustíveis (ANP) flexibilizou o horário de funcionamento dos postos de combustíveis no país. A partir de agora, os revendedores deverão funcionar, no mínimo, de segunda-feira a sábado, das 7h às 19h. Até então o horário mínimo de funcionamento era das 6h às 20h.  Diversas companhias aéreas anunciaram a suspensão de voos. A Gol, por exemplo, cancelou todas as suas operações internacionais entre a próxima segunda (23) e o dia 30 de junho. Já a Azul reduziu sua capacidade de 20% a 25% no mês de março, e entre 35% a 50% em abril e meses seguintes.  No transporte rodoviário, estados como o Rio de Janeiro proibiram viagens interestaduais.  Já a Agência Nacional de Transporte Terrestres (ANTT) suspendeu todas as viagens internacionais por ônibus. A proibição vale também para o transporte de fretamento, e semiurbano em região de fronteira, realizada por empresas brasileiras e estrangeiras.  Todas as unidades do Trabalho nas 27 unidades da Federação estão com atendimento presencial suspenso. Durante o período em que o atendimento presencial estiver interrompido, a recomendação é para que os trabalhadores busquem o portal de serviços do governo federal ou o telefone 158 (Alô Trabalho). O que não puder ser resolvido por estes canais ficará temporariamente suspenso.  Confira abaixo os serviços disponíveis para o trabalhador :  Carteira de Trabalho – não é mais necessário se deslocar a uma unidade do Trabalho para obter a carteira de trabalho. Ela pode ser acessada pela plataforma de serviços do governo federal no site www.gov.br/trabalho ou ao baixar pela loja de aplicativos do telefone. O nome do aplicativo é Carteira de Trabalho Digital e o ícone é o brasão da República branco em um fundo azul.  Seguro-desemprego – o seguro-desemprego pode ser solicitado diretamente no aplicativo da Carteira de Trabalho Digital ou pelo portal de serviços do governo federal www.gov.br  Após triagem por atendentes do número 158, os serviços de seguro-desemprego que não estão contemplados nas plataformas digitais serão encaminhados para as superintendências do respectivo estado para tratamento.  Registro Profissional – o cadastro inicial deverá ser feito por este link  e a documentação, encaminhada neste link, não sendo necessário nenhum tipo de agendamento ou entrega de documento presencial.  Plantão trabalhista – para dúvidas ou denúncias em relação ao cumprimento de legislação trabalhista, a referência é o canal de serviços 158. A ligação é gratuita de telefone fixo de todo o país.  Para o empregador, o atendimento Rais e Caged ocorre pelo portal de serviços www.gov.br.  Comunicação de trabalho temporário – a empresa deve encaminhar via SEI no link com certificação digital.  Processos de auto de infração – não serão recebidas documentações, e os prazos ficam suspensos enquanto durar a vigência da suspensão do atendimento presencial.  Para os sindicatos, a atualização de registro sindical deve ser encaminhada via SEI com certificação digital. Os serviços de mediação estão temporariamente suspensos.  As empresas de turismo e cultura foram autorizadas a não precisam fazer o reembolso imediato de serviços cancelados por causa da pandemia do novo coronavírus.  Segundo um medida provisória do governo, em vez de devolver o dinheiro, a empresa poderá optar por remarcar os serviços, as reservas ou os eventos cancelados, disponibilizar crédito para uso ou abatimento na compra de outros serviços das mesmas empresas, ou firmar outro acordo com o consumidor.  A MP estabelece que a prestação do serviço – uma hospedagem ou um show, por exemplo – poderá ser remarcada em até um ano após o fim da situação de calamidade pública. ",economia,,,,,,
