data,url_noticia,url_noticia_curto,titulo,conteudo_noticia,assunto,assunto_ex,titulo_ex,subtitulo_ex,local_ex,artigo_ex,n_paragrafos
2020-02-20,https://web.archive.org/web/20200220040013/https://globoesporte.globo.com/futebol/times/flamengo/noticia/preocupacao-no-flamengo-bruno-henrique-faz-gol-se-machuca-em-dividida-com-goleiro-e-e-substituido.ghtml?utm_source=Twitter&utm_medium=Social&utm_campaign=ge_flamengo,https://globoesporte.globo.com/futebol/times/flamengo/noticia/preocupacao-no-flamengo-bruno-henrique-faz-gol-se-machuca-em-dividida-com-goleiro-e-e-substituido.ghtml?utm_source=Twitter&utm_medium=Social&utm_campaign=ge_flamengo," Bruno Henrique é avaliado, caminha com auxílio de muletas, mas médico descarta fratura: ""Grande susto"""," Bruno Henrique deu ""grande susto"" no departamento médico do Flamengo e chegou a virar motivo de preocupação. No empate em 2 a 2 com o Del Valle, em Quito, logo no lance do gol de empate em 1 a 1, o atacante se chocou com o goleiro Pinos e nem conseguiu levantar para comemorar. Com muitas dores na perna direita, precisou deixar o campo de maca e foi levado para o hospital.  >>> De igual para igual: Flamengo busca virada, mas cede empate ao Del Valle no fim <<<  Após os exames, a sensação foi de alívio, pois os exames não apontaram fratura no local.  - O Bruno teve um trauma importante no jogo, na dividida do goleiro. Um trauma da perna dele com a perna do goleiro. Estava com muita dor no momento do gol, não conseguiu comemorar, nem ficar em pé, já pediu substituição. A gente na avaliação, numa possibilidade de fratura, a gente levou para o hospital direto, fizemos radiografia e não constatou nenhum tipo de fratura. Ele está tratando, está medicado e vamos avaliando durante a semana.  De acordo com o médico, a avaliação para a presença de Bruno Henrique no jogo de volta na quarta-feira, no Maracanã, ainda é precoce. Do hospital de volta ao estádio, o jogador apareceu com uma bota no pé direito e caminhou com auxílio de muletas.  - A bota é precaução, a bola e a muleta, para não estressar uma região que já está estressada. Colocou mais para proteger de qualquer tipo de dor maior - disse o doutor.  Após o susto e já de volta com o grupo, o jogador, através das redes sociais, agradeceu o carinho dos torcedores e companheiros.  Outra baixa médica durante a partida foi a saída do zagueiro Rodrigo Caio, que pediu para deixar o campo com um problema na coxa esquerda.  Em 2019, também no Equador, o Flamengo perdeu o meia Diego, lesionado, em duelo da Libertadores contra o Emelec. O jogador ficou três meses parado com fratura no tornozelo esquerdo. ",esportes,,,,,,
2020-02-20,https://web.archive.org/web/20200220040013/https://globoesporte.globo.com/futebol/libertadores/noticia/na-luta-por-vaga-no-grupo-do-flamengo-barcelona-vence-cerro-porteno-no-equador.ghtml,https://globoesporte.globo.com/futebol/libertadores/noticia/na-luta-por-vaga-no-grupo-do-flamengo-barcelona-vence-cerro-porteno-no-equador.ghtml,"Na luta por vaga no grupo do Flamengo, Barcelona vence Cerro Porteño no Equador"," O Barcelona-EQU saiu na frente do Cerro Porteño na luta por uma vaga no Grupo A da Libertadores, o mesmo do campeão Flamengo. O time equatoriano recebeu os paraguaios em Guayaquil e venceu por 1 a 0, com a marca do artilheiro da competição.  + VEJA A TABELA DA LIBERTADORES  Fidel Martínez fez o único gol da partida, aos 25 minutos do primeiro tempo, em bela cobrança de falta com a canhota da intermediária. Foi o sexto gol em cinco jogos na competição continental. Com tal marca, o atacante equatoriano, de 30 anos, já seria vice-artilheiro da edição passada, atrás apenas de Gabigol, que terminou com nove gols.  Com o resultado, o Barcelona pode empatar no Paraguai que conquistará a vaga na fase de grupos. Caso marquem um gol, os equatorianos avançam até mesmo com uma derrota por um gol de diferença. O jogo de volta será em Assunção, na próxima quarta-feira, no Nueva Olla.  Quem passar entra no Grupo A da Libertadores, que tem Flamengo, Independiente del Valle e Junior Barranquilla. ",esportes,,,,,,
2020-02-21,https://web.archive.org/web/20200221000041/https://globoesporte.globo.com/sp/campinas-e-regiao/futebol/noticia/com-r-737-milhoes-de-debitos-corinthians-e-o-clube-que-mais-deve-a-uniao-veja-a-lista.ghtml,https://globoesporte.globo.com/sp/campinas-e-regiao/futebol/noticia/com-r-737-milhoes-de-debitos-corinthians-e-o-clube-que-mais-deve-a-uniao-veja-a-lista.ghtml,"Com R$ 737 milhões de débitos, Corinthians é o clube que mais deve à União; veja a lista "," Um levantamento divulgado nesta quinta-feira pelo Valor Econômico mostra que o Corinthians é o clube que mais deve à União, com R$ 737,7 milhões de débitos - sem incluir o financiamento para a construção da arena. As informações são da Procuradoria-Geral da Fazenda Nacional (PGFN) e foram obtidas pela publicação por meio da Lei de Acesso à Informação.  Atlético-MG, Vasco, Botafogo, Flamengo, Confederação Brasileira de Vela e Motor, Fluminense, Guarani, Internacional e Palmeiras completam a lista dos dez primeiros. Veja abaixo o valor que cada um deve:  Os valores, segundo a reportagem, levam em conta débitos em situações irregular (em processo de cobrança efetiva) e regular (garantidos, parcelados ou suspensos por decisão judicial).  Segundo dados referentes a novembro, são mais de 3,5 mil clubes esportivos e sociais que, ao todo, devem quase R$ 5,3 bilhões à União, entre não pagamento de impostos, contribuição previdenciária e Fundo de Garantia do Tempo de Serviço (FGTS).  A publicação do Valor Econômico diz que o Corinthians não reconhece boa parte dos valores por considerar ser isento de tributos federais. Apenas uma cobrança de 2019 soma R$ 597 milhões.  O advogado do clube, Juliano Di Pietro, disse ao Valor Econômico que o Conselho Administrativo de Recursos Fiscais (Carf) já extinguiu cobranças similares de outros clubes, como Imposto de Renda Pessoa Jurídica, Cofins, PIS e Contribuição Social sobre o Lucro Líquido.  Os clubes voltaram a contrair dívidas mesmo depois de terem sido beneficiados com programas de renegociações com a União, como o Profut, em 2015, e o Programa Especial de Regularização Tributária, de 2017. Existe um projeto de lei no Congresso para a transformação de clubes sem fins lucrativos em empresas com o atrativo de um novo parcelamento dos débitos em até 60 meses, além de descontos nos juros, multas e encargos.  O Corinthians divulgou uma nota oficial sobre o assunto. Leia na íntegra abaixo:   ""O Sport Club Corinthians Paulista em atenção à reportagem publicada hoje (20/2) à pg. B9 no Jornal Valor Econômico, “Clubes devem R$ 5,3 bi à União”, esclarece que o Tribunal Regional Federal da Terceira Região suspendeu a exigibilidade da suposta dívida no valor de R$597 milhões, por meio de uma decisão que determina que o CARF julgue o recurso sobre a isenção da agremiação em relação a IRPJ, CSLL, PIS e COFINS, nos termos da firme jurisprudência daquela Corte Administrativa em favor dos clubes. Se levada em conta a decisão supracitada, o Corinthians ocuparia a 9ª posição no ranking elaborado pela reportagem que não obteria a mesma repercussão. Vale salientar que a mesma reportagem cita brevemente que a situação atual do clube é “regular”."" ",esportes,,,,,,
2020-02-21,https://web.archive.org/web/20200221000041/https://globoesporte.globo.com/futebol/times/flamengo/noticia/del-valle-x-flamengo-conmebol-divulga-audios-de-var-e-aprova-decisoes-do-arbitro.ghtml,https://globoesporte.globo.com/futebol/times/flamengo/noticia/del-valle-x-flamengo-conmebol-divulga-audios-de-var-e-aprova-decisoes-do-arbitro.ghtml,Del Valle x Flamengo: Conmebol divulga áudios de VAR e aprova decisões do árbitro," Apesar dos questionamentos sobre a atuação do árbitro Leodan Franklin Gonzalez Cabrera no empate em 2 a 2 entre Independiente Del Valle e Flamengo, na quarta-feira, a Conmebol considerou corretas as decisões tomadas pelo juiz na partida.  Em resumo divulgado nesta quinta-feira, a entidade mostrou áudios das conversas de Leodan com o árbitro de vídeo em dois lances capitais da partida: o gol anulado de Bruno Henrique por impedimento e o pênalti cometido por Rafinha em Murillo.  O debate no lance de Bruno Henrique durou quatro minutos. Os próprios árbitros de vídeo consideraram a decisão extremamente difícil. Em dado momento, eles divergem sobre a marcação. No fim, com o uso de uma linha, veem o ombro do atacante do Flamengo adiantado em relação à linha do meio-campo e ratificam o impedimento.  Confira uma parte do diálogo:  VAR 1: Não recomece, Leo.   Árbitro: Estão checando o factual?  VAR 1: Espere a confirmação.  Árbitro: Estão checando o impedimento factual?  VAR 1: Sim.  Árbitro: Têm a linha?  VAR 1: Está difícil.  VAR 2: Está habilitado.  VAR 1: O ombro está em impedimento.  Árbitro (para os jogadores): Confiem no sistema, está difícil. Estão colocando a linha.   VAR 1: O ombro está em impedimento.  No pênalti marcado para o Del Valle, aos 46 minutos do segundo tempo, Rafinha disputou a bola com Murillo, que caiu na área. O árbitro Leodan Cabrera afirmou ter visto contato na jogada. Após checagem, o árbitro de vídeo confirmou a informação.  Árbitro: Há contato de Rafinha com o camisa 9. Há contato de perna com perna.  VAR 1: Faça todo o procedimento, Leo. Estamos checando.  Árbitro: É um contato que impacta o jogador.   VAR 1: Leo, decisão correta.   Árbitro: Perfeito.  ",esportes,,,,,,
2020-02-21,https://web.archive.org/web/20200221000041/https://globoesporte.globo.com/basquete/nba/noticia/kyrie-irving-fara-cirurgia-no-ombro-direito-e-esta-fora-do-restante-da-temporada.ghtml,https://globoesporte.globo.com/basquete/nba/noticia/kyrie-irving-fara-cirurgia-no-ombro-direito-e-esta-fora-do-restante-da-temporada.ghtml,Kyrie Irving fará cirurgia no ombro direito e está fora do restante da temporada da NBA," O armador do Brooklyn Nets, Kyrie Irving, vai passar por uma artroscopia no ombro direito e está fora do resto da temporada. O gerente geral do Brooklyn Nets, Sean Marks, fez o anúncio na noite dessa quarta-feira, em uma coletiva de imprensa na Filadélfia, onde o time de Nova York enfrenta os 76ers. Kyrie não vinha atuando desde o dia 1º de fevereiro, tendo perdido um total de 25 partidas na atual temporada por causa da recorrente lesão no ombro e também de uma torção no joelho. Com a ausência do astro dos Nets, o armador Spencer Diwnwiddie e o ala-armador Caris LaVert devem acumular maiores responsabilidades no setor ofensivo da equipe.  + Confira em tempo real o que de melhor acontece na NBA+ Veja a classificação das equipes no Leste e no Oeste+ Acompanhe as transmissões do SporTV para a temporada 2019-2020 da NBA  Desde janeiro, Kyrie Irving vinha recebendo injeções de cortisona para aliviar as dores na região do ombro direito. As especulações sobre a necessidade de uma intervenção cirúrgica cresceram após Kyrie agravar a lesão ao longo de treinamentos, nas últimas semanas. Segundo o técnico Kenny Atkinson, a lesão não surgiu após um lance ou treino específico.  Nas 20 partidas em que atuou nessa temporada, o armador contribuiu com médias de 27.4 pontos, 5.2 rebotes e 6.4 assistências. O Brooklyn Nets ocupa a sétima posição da Conferência Leste, e sem o sua grande referência ofensiva, vê sua corrida pelos playoffs ameaçada.  + NBA League Pass: assine e assista onde estiver+ Veja os produtos oficiais dos times na Loja NBA.com ",esportes,,,,,,
2020-02-22,https://web.archive.org/web/20200222040020/https://globoesporte.globo.com/sportv/programas/selecao-sportv/noticia/ranking-do-pvc-comentarista-estreia-quadro-e-poe-flamengo-em-primeiro-veja-a-lista-completa.ghtml,https://globoesporte.globo.com/sportv/programas/selecao-sportv/noticia/ranking-do-pvc-comentarista-estreia-quadro-e-poe-flamengo-em-primeiro-veja-a-lista-completa.ghtml,Ranking do PVC: comentarista estreia quadro e põe Flamengo em primeiro; veja a lista completa," O Seleção SporTV desta sexta-feira estreou o quadro ""Ranking do PVC"".  O comentarista analisará semanalmente no programa o momento vivido pelos 20 clubes que disputam a Série A do Campeonato Brasileiro.  No primeiro comparativo, a liderança pertence ao Flamengo. O Sport aparece em último.  Assista no vídeo acima os critérios e a avaliação completa de PVC. ",esportes,,,,,,
2020-02-22,https://web.archive.org/web/20200222040020/https://globoesporte.globo.com/futebol/times/flamengo/noticia/libertadores-sub-20-mesmo-com-derrota-flamengo-se-classifica-para-a-semifinal-da-competicao.ghtml,https://globoesporte.globo.com/futebol/times/flamengo/noticia/libertadores-sub-20-mesmo-com-derrota-flamengo-se-classifica-para-a-semifinal-da-competicao.ghtml,"Libertadores sub-20: mesmo com derrota, Flamengo se classifica para a semifinal da competição "," Mesmo perdendo para o Puerto Cabello por 1 a 0 nesta sexta-feira, o Flamengo garantiu presença na semifinal da Libertadores sub-20. Avançou como líder do Grupo A. As vitórias anteriores por 3 a 1 e 5 a 1 sobre Nacional-URU e Sporting Cristal, respectivamente, fizeram com que o Rubro-Negro entrasse em campo com vantagem.  Apesar disso, o Flamengo buscou a vitória durante todo o jogo. Começou a partida pressionando muito a equipe venezuelana, mas as investidas não surtiram efeito. Na segunda oportunidade que teve, o Puerto Cabello marcou seu primeiro - e único - gol da partida. Depois de cobrança lateral, a bola sobrou na área, e Martinez converteu.  O jogo continuou, e o Flamengo seguiu apertando e tentando criar jogadas. A pressão rubro-negra era tanta que já nos três primeiros minutos do segundo tempo o time já tinha batido dois escanteios. Mas não foi suficiente.  Mesmo com a derrota, o Flamengo ocupa a segunda das quatro vagas das semifinais da Libertadores sub-20 e aguarda seu adversário.  O Independiente del Valle é o líder do Grupo C com seis pontos e dois gols de saldo. Na próxima rodada enfrenta o Jorge Wilstermann, lanterna do grupo sem nenhum ponto somado.  Colo-Colo e Libertad, segundo e terceiro colocados respectivamente - ambos com três pontos -, se enfrentam. A equipe chilena também tem dois gols de saldo enquanto a equipe paraguaia tem sete. Caso o Independiente perca, o vencedor dessa partida será o adversário do Flamengo.  Apesar de não ter conseguido a classificação direta hoje, a vitória deixou o Puerto Cabello em boa situação. Para o time se classificar como melhor segundo colocado e enfrentar o River Plate, Libertad e Colo-Colo precisam empatar ou Independiente del Valle perder. ",esportes,,,,,,
2020-02-22,https://web.archive.org/web/20200222040020/https://globoesporte.globo.com/futebol/futebol-internacional/futebol-ingles/noticia/jornal-city-paga-r-113-mil-por-dia-a-advogado-para-tentar-se-livrar-de-punicao-da-uefa.ghtml,https://globoesporte.globo.com/futebol/futebol-internacional/futebol-ingles/noticia/jornal-city-paga-r-113-mil-por-dia-a-advogado-para-tentar-se-livrar-de-punicao-da-uefa.ghtml,Jornal: City paga R$ 113 mil por dia a advogado para tentar se livrar de punição da Uefa ," O clube que gastou quase 1 bilhão de euros para montar o atual elenco não mediria esforços para se manter na principal competição de clubes do mundo. Segundo o jornal ""Daily Mirror"", o Manchester City contratou o advogado David Pannick para se livrar da punição imposta pela Uefa. Pannick é famoso por ter barrado o processo do Brexit duas vezes.  O preço? Cerca de 20 mil libras por dia (R$ 113 mil, na cotação atual). O valor dá pouco mais de 100 mil libras (R$ 568 mil) por semana que, de acordo com o Mirror, é o mesmo valor recebido pelo zagueiro Stones e o atacante Gabriel Jesus.  + Guardiola garante permanência no City mesmo sem Champions: “Por que eu deveria sair?”+ CEO do City nega acusações da Uefa, cita punição ""política"" e busca solução até o meio do ano+ VEJA TUDO SOBRE O MANCHESTER CITY  David Pannick, de 63 anos, é um dos advogados mais conhecidos da Inglaterra. Ele representou a empresária Gina Miller por duas ocasiões contra o processo de separação do Reino Unido da União Europeia, o Brexit, desafiando a ex-Primeira Ministra Theresa May e o atual Boris Johnson.  O Manchester City foi excluído pela Uefa de todas as competições europeias pelas próximas duas temporadas (2020/21 e 2021/22) e multado em 30 milhões de euros (R$ 140 milhões). O clube foi acusado pela entidade de violar regras do Fair Play Financeiro ao inflacionar de forma falsa os valores de seus patrocínios no período entre 2012 e 2016.  + Caso Manchester City: entenda o Fair Play Financeiro e por que o PSG não foi punido+ Jogadores, dinheiro, visibilidade... veja o que o Manchester City pode perder fora da Champions  O clube vai recorrer ao Tribunal Arbitral do Esporte (TAS), instância máxima da justiça desportiva, para tentar absolvição ou diminuição da pena. A contratação de David Pannick, segundo o Mirror, é uma tentativa para que isso ocorra antes do meio do ano e garanta a equipe na próxima edição da Liga dos Campeões.  De acordo com o Mirror, o City também não descarta tentar recorrer ao Tribunal Federal da Suíça, na justiça comum. A investida seria semelhante ao que fez o atacante peruano Paolo Guerrero, em seu processo contra a punição por doping imposta pelo TAS, quando conseguiu a liberação para disputar a Copa do Mundo. ",esportes,,,,,,
2020-02-22,https://web.archive.org/web/20200222040020/https://globoesporte.globo.com/sportv/programas/troca-de-passes/noticia/petkovic-se-junta-a-cassio-e-defende-regras-de-tiago-nunes-no-corinthians-totalmente-normal.ghtml,https://globoesporte.globo.com/sportv/programas/troca-de-passes/noticia/petkovic-se-junta-a-cassio-e-defende-regras-de-tiago-nunes-no-corinthians-totalmente-normal.ghtml,"Petkovic se junta a Cássio e defende regras de Tiago Nunes no Corinthians: ""Totalmente normal"""," O capitão do Corinthians, Cássio, defendeu Tiago Nunes após a repercussão da cartilha apresentada ao elenco pelo treinador corintiano, situação revelada por reportagem do GloboEsporte.com. Durante o Troca de Passes desta sexta-feira, o comentarista Petkovic concordou com o goleiro e disse que ""alguém está querendo criar tumulto"" dentro do ambiente alvinegro.  +Tiago Nunes agrada por treinos, mas novas regras incomodam jogadores do Corinthians  +Cássio defende regras de Tiago Nunes no Corinthians e acredita que repercussão foi desnecessária  - Não é nova cultura. Cumprir horário não é nova cultura, sempre teve, até na época em que eu jogava. Aqui, na Europa e em qualquer canto do mundo em que joguei. É exatamente isso, concordo e acho que alguém está querendo criar tumulto. Cada um tem os seus costumes, regulamentos e regras. Você tem o manual de instruções do carro. O time também tem o seu comando.  - Essa coisa do horário é totalmente normal. No Real Madrid tem isso. Você chega lá, todo mundo espera, senta na mesa. A única coisa lá que é melhor é que tem uma garrafa de vinho na mesa, e a gente toma (risos). Você cria ambiente, união e sinergia entre os jogadores.  Pet destacou que Jorge Jesus e Vanderlei Luxemburgo também têm suas respectivas regras, mas que em nenhum momento perdem o respeito de seus comandados por conta disso.  - Tem treinador que diz: ""Não posso dizer nada ao Pet, mas ao Fred (Ring, apresentador) eu posso"". Existe isso, mas não vejo isso no Tiago. Quando os resultados não aparecem, dizem que tem problema no grupo, muitas regras. Quem tem mais regras é o Luxemburgo. Teve muitas regras no Vasco e não teve problema. Tem tanta regra no Palmeiras, e no momento é o melhor time paulista. E bota suas regras.  - O Jorge Jesus tem regras? Tem algum problema? Tem, dentro do campo, mas não fora. Dentro é o Flamengo, a instituição. Cobra, tem estilo, mas não é injusto. A gente até cobrou: ""Poxa, gritou com Reinier, gritou não sei o que, foi desnecessário..."". É o estilo dele. Desde que não falte respeito na cobrança, não tem problema. Aí existe o comandante. ",esportes,,,,,,
2020-02-23,https://web.archive.org/web/20200223040011/https://globoesporte.globo.com/combate/noticia/marcos-pezao-arrasa-mini-roy-nelson-ben-sosoli-no-primeiro-round-no-ufc-auckland.ghtml,https://globoesporte.globo.com/combate/noticia/marcos-pezao-arrasa-mini-roy-nelson-ben-sosoli-no-primeiro-round-no-ufc-auckland.ghtml,"Marcos Pezão arrasa ""mini Roy Nelson"" Ben Sosoli no primeiro round no UFC Auckland"," No jargão do mundo das lutas, a expressão ""ligou o ventilador"" se aplica aos atletas que distribuem golpes sem parar nos adversários. E foi exatamente o que o peso-pesado Marcos Pezão fez diante do gordinho australiano Ben Sosoli, que é bastante parecido com o veterano Roy Nelson, no card principal do UFC Auckland. Mostrando muita vontade de se recuperar da derrota diante de Stefan Struve há um ano, em Praga, o brasileiro não deu chances ao rival e conquistou um empolgante nocaute em apenas 1m28s de disputa no primeiro round.  - Há um ano eu estava nesse cage em Praga, contra o Struve, e agora estou de volta. Treinei muito isso na American Top Team. Plantamos isso tudo, e agora estamos colhendo os frutos. Dana White, essa é a minha divisão - disse Pezão após a luta.  O brasileiro começou a luta de forma muito agressiva, buscando os chutes altos e os golpes fortes, que abalaram momentaneamente Sosoli. Com uma envergadura muito maior, Pezão mantinha o australiano à distância, e aplicava verdadeiras bombas com cruzados seguidos. Um deles atingiu em cheio a cabeça do australiano, que caiu sem sentidos imediatamente. Após a interrupção do árbitro, Sosoli ainda chegou a dizer que tinha condições de continuar, mas pouco depois aceitou a derrota.  No co-evento principal do UFC Auckland, o peso-meio-pesado Jimmy Crute deu uma verdadeira aula de luta de chão ao polonês Michal Oleksiejczuk e o finalizou com uma kimura aos 3m29s do primeiro round.  O começo da luta foi uma clínica de wrestling de Crute para Oleksiejczuk. O australiano dominou os movimentos por metade do primeiro round, e impôs a sua luta agarrada ao polonês, que não conseguia se livrar do australiano. Com muita habilidade, Crute dominou Oleksiejczuk no chão após cansá-lo, e após aplicar a montada, encaixou uma kimura que obrigou o polonês a desistir do combate.  A luta entre os pesos-leves Brad Riddell, da Nova Zelândia, e Magomed Mustafaev, da Rússia, foi uma das mais disputadas do UFC Auckland. Enquanto Riddell foi melhor em pé, Mustafaev mostrou força no wrestling daguestanês junto à grade. No fim, vitória por decisão dividida dos juízes (29-28, 28-29 e 29-28) para Riddell.  O combate foi muito movimentado, com intensas trocas de liderança de parte a parte. Riddell foi melhor na trocação durante toda a luta, enquanto Mustafaev usava o controle do adversário junto à grade para tentar pontuar. Mas o neozelandês foi mais eficiente nos momentos decisivos, e mesmo quando esteve em posição de desvantagem na grade, sempre buscou livrar-se do russo para voltar a atacar. Mesmo no último round, quando ambos estavam cansados, a movimentação continuou frenética, e Riddell aproveitou os momentos de cansaço do russo para pedir que a torcida gritasse, no que foi atendido imediatamente.  Confira todos os resultados do eventoCARD PRINCIPALDan Hooker venceu Paul Felder por decisão dividida (48-47, 47-48 e 48-47)Jimmy Crute venceu Michal Oleksiejczuk por finalização aos 3m29s do R1Yan Xiaonan venceu Karolina Kowalkiewicz por decisão unânime (triplo 30-26)Marcos Pezão venceu Ben Sosoli por nocaute a 1m28s do R1Brad Riddell venceu Magomed Mustafaev por decisão dividida (29-28, 29-29 e 29-28)CARD PRELIMINARZubaira Tukhugov venceu Kevin Aguilar por nocaute técnico aos 3m21s do R1Jalin Turner venceu Josh Culibao por nocaute técnico aos 3m01s do R2Jake Matthews venceu Emil Meek por decisão unânime (triplo 29-28)Kenan Song venceu Callan Potter por nocaute aos 2m20s do R1Kai Kara-France venceu Tyson Nam por decisão unânime (triplo 30-27)Angela Hill venceu Loma Lookboonmee por decisão unânime (30-27, 29-28 e 29-28)Priscila Pedrita venceu Shana Dobson por nocaute aos 40s do R1  Assine o Combate Play e assista ao Combate em qualquer lugar ",esportes,,,,,,
