data,url_noticia,url_noticia_curto,titulo,conteudo_noticia,assunto,assunto_ex,titulo_ex,subtitulo_ex,local_ex,artigo_ex,n_paragrafos
2020-04-08,https://web.archive.org/web/20200408000019/https://globoesporte.globo.com/futebol/futebol-internacional/noticia/depois-de-32-dias-ronaldinho-troca-cadeia-por-prisao-domiciliar-no-paraguai.ghtml,https://globoesporte.globo.com/futebol/futebol-internacional/noticia/depois-de-32-dias-ronaldinho-troca-cadeia-por-prisao-domiciliar-no-paraguai.ghtml,"Juiz concede prisão domiciliar, e Ronaldinho Gaúcho deixa cadeia no Paraguai após 32 dias"," Depois de passar 32 dias em uma cadeia de Assunção, o ex-jogador Ronaldinho Gaúcho e seu irmão Assis conseguiram nesta terça-feira a mudança de regime para prisão domiciliar. Eles passarão a viver em um hotel na capital do Paraguai, enquanto esperam o desenrolar do processo ao qual respondem por terem entrado no país com documentos adulterados, no início de março.  A defesa dos irmãos declarou que tentarão agora a liberação definitiva de Ronaldinho e Assis. A decisão de reversão da prisão dos dois foi do juiz Gustavo Amarilla, em uma audiência realizada em Assunção. Os dois brasileiros já tinham tido três recursos negados no processo.  + Vídeo mostra recado de Ronaldinho Gaúcho a família de colega de prisão: ""Meu atacante""  O ex-jogador deixou a prisão onde estava na noite desta terça, cerca de três horas após a decisão. Ele e o irmão foram até uma delegacia em frente ao local e seriam levados pela polícia ao hotel onde cumprirão a prisão domiciliar. Ao deixar a delegacia, ele foi abordado por um torcedor e autografou uma camisa do Grêmio.  Ronaldinho deixa a prisão no Paraguai e autografa camisa do Grêmio (veja o vídeo abaixo):  Ronaldinho e Assis estavam desde o dia 6 de março presos na Agrupación Especializada, quartel da Polícia Nacional do Paraguai transformado em cadeia de segurança máxima. O juiz determinou que os dois irmãos tenham custódia policial permanente no hotel.  A defesa ofereceu uma caução de 1,6 milhão de dólares (R$ 8,3 milhões), que já foram depositados no Banco Nacional de Fomento. O valor foi pago em juízo, como garantia de que os dois brasileiros não deixarão o hotel. Em caso de fuga, o dinheiro será resgatado pela Justiça paraguaia.  - O valor da fiança foi importante. Antes haviam apresentado como garantia uma casa que não estava nem no nome dos dois, agora a defesa abriu uma conta corrente no nome deles e fez o depósito dos valores - afirmou o promotor Osmar Legal após a audiência.  Após a audiência, os advogados de defesa foram até a Agrupación Especializada, de onde Ronaldinho e Assis participaram de uma videoconferência, aceitando as condições pactuadas no Palácio de Justiça.  Depois que os termos foram aceitos de ambas as partes, Ronaldinho se despediu do juiz Gustavo Amarilla com seu cumprimento autêntico: um hangloose <U+0001F919><U+0001F3FE><U+0001F919><U+0001F3FE>  (veja no vídeo abaixo).  Ronaldinho e Assis serão transferidos para o Hotel Palmaroga, um edifício construído no início do século XX, no centro histórico de Assunção. O hotel, cotado como quatro estrelas pelas publicações especializadas, possui 107 quartos, com diária média no valor de 64 dólares. O local fica a 3,3 km da cadeia onde Ronaldinho e Assis passaram os últimos 32 dias. A direção do hotel já aceitou recebê-los, seguindo as condições impostas pelo juiz.  + Série Ronaldinho 40 anos  A perícia nos telefones celulares de Ronaldinho e Assis, que começou no dia 18 de março, finalmente foi concluída. O Ministério Público do Paraguai informou ao GloboEsporte.com que ""continua trabalhando na produção de provas"" sobre o caso, que já teve 15 pessoas presas.  Após chegarem no Paraguai no dia 4 de março, Ronaldinho e Assis receberam no hotel a visita de autoridades paraguaias à noite. Passaram a noite sob custódia e, no dia seguinte, contaram ao Ministério Público tudo o que sabiam. Admitiram que tentaram entrar no país com aqueles documentos, mas que não sabiam serem falsos. O MP paraguaio enquadrou os irmãos Assis numa figura jurídica chamada ""critério de oportunidade"", que a grosso modo permite aos réus não serem acusados formalmente pelos crimes que cometeram, desde que consigam reparar o dano causado. Na prática: Ronaldinho e Assis seriam submetidos a uma ""pena social"" – uma doação para uma ONG, por exemplo – e poderiam deixar o Paraguai.  Na audiência em que seria definida o tamanho dessa ""pena social"", houve uma reviravolta. A justiça não aceitou dar o ""critério de oportunidade"" para Ronaldinho e Roberto. O Ministério Público mudou sua posição e pediu a prisão preventiva dos irmãos Assis. Às 22h de sexta-feira, 6 de março, quando estavam num hotel próximo ao aeroporto, os irmãos Assis foram detidos e levados para a Agrupación Especializada. Desde então três recursos apresentados pela defesa de Ronaldinho foram negados pela Justiça. Os advogados de defesa não conseguiram nem mudar os irmãos Assis para uma prisão domiciliar, e nem anular a prisão preventiva, que no Paraguai pode durar até seis meses. O argumento para mantê-los presos foi sempre o mesmo: soltá-los poderia prejudicar o andamento das investigações.  O último desses recursos foi negado numa sexta-feira 13, uma semana depois da prisão. Desde então, o sistema judicial do Paraguai passou a funcionar com restrições por causa da pandemia do coronavírus. Outros recursos só serão apresentados pela defesa após o fim do recesso – que não tem data prevista. No dia 18 de março, uma terça-feira, teve início uma perícia nos telefones celulares de Ronaldinho e Assis. Quase três semanas depois, esse procedimento ainda não foi concluído. A defesa dos brasileiros diz acreditar que o resultado dessa perícia será importante para provar que eles não fizeram nada além de terem entrado no país com aqueles documentos.  Mas o que Ronaldinho foi fazer no Paraguai? A resposta passa obrigatoriamente por Roberto Assis, irmão do craque e seu agente desde sempre. Assis aceitou uma proposta apresentada por um amigo, Wilmondes Souza Lira, de abrir uma empresa para fazer negócios no Paraguai. Wilmondes é casado com Paula Lira, que por sua vez é (ou era) amiga da paraguaia Dalia Lopez, que financiou tanto a confecção dos passaportes falsificados quanto a própria viagem de Ronaldinho e Assis no Paraguai.  O ""projeto"" que unia Dalia Lopez, o casal Lira e os irmãos Assis era mambembe, para dizer o mínimo: transformar ônibus em ""clínicas móveis"", que atenderiam crianças carentes no Paraguai. Os veículos teriam a imagem do craque brasileiro. A ONG que viabilizaria o projeto não tem site na internet e nem endereço físico. Segundo o GloboEsporte.com apurou, ao aceitar o convite para viajar ao Paraguai, Roberto Assis não consultou nem os advogados brasileiros com quem trabalha há anos.  Dalia Lopez é uma empresária do ramo de exportação, alvo de uma investigação por parte do Ministério da Tributação, iniciada em setembro de 2019, e sigilosa até a chegada de Ronaldinho ao Paraguai. Ela é acusada de desviar pelo menos US$ 10 milhões em um esquema de sonegação de impostos e lavagem de dinheiro. O MP do Paraguai pediu a prisão de Dalia Lopez no dia 7 de março, um sábado. Desde então, ela está foragida, apesar de seus advogados já terem declarado que ela iria se entregar.  Wilmondes Souza Lira, o empresário amigo de Assis, está preso no Paraguai. Sua mulher, Paula Lira, que também teria sua prisão pedida, fez um acordo com o Ministério Público do Paraguai. Ela contou tudo o que sabia sobre o esquema, entregou documentos e mensagens de celular. Em troca, pôde deixar o Paraguai e voltar ao Brasil. Ela foi escoltada, de carro, até Foz do Iguaçu.  Enquanto a investigação avança a passos muito lentos, Ronaldinho e Assis seguem presos em Assunção. A rotina dos dois mudou ao longo desse mês. Nos primeiros dias, o assédio era intenso. Ronaldinho recebeu a visita de astros do futebol paraguaio, como Gamarra, e de outros jogadores ganhou presentes que deixaram menos dura sua vida na cadeia, como televisão, ar-condicionado, camas, frigobar. Foi alvo de tietagem de policiais e de gente que visitava o local mesmo sem ter nenhum parente preso; foi motivo de disputa entre outros presos, que o queriam como reforço para o campeonato de futebol interno. Viralizaram vídeos em que ele aparece jogando futsal e futevôlei. ",esportes,,,,,,
2020-04-08,https://web.archive.org/web/20200408000019/https://globoesporte.globo.com/futebol/times/atletico-mg/noticia/atletico-mg-tem-keno-na-mira-e-alexandre-mattos-pode-ser-super-trunfo-no-negocio-entenda.ghtml,https://globoesporte.globo.com/futebol/times/atletico-mg/noticia/atletico-mg-tem-keno-na-mira-e-alexandre-mattos-pode-ser-super-trunfo-no-negocio-entenda.ghtml,"Atlético-MG tem Keno na mira, e Alexandre Mattos pode ser ""supertrunfo"" no negócio"," O Atlético-MG quer reforçar seu setor ofensivo para a continuidade da temporada 2020, e uma das prioridades é a contratação de um atacante velocista, que atue pelos lados do campo. Keno, ex-Palmeiras, é um nome na mira do Galo. O interesse atleticano no jogador de 30 anos foi noticiado pela Rádio Itatiaia e confirmado pelo GloboEsporte.com, que apurou detalhes.  + Notícias do Atlético  Por enquanto, não há negociação. Isso porque o futebol mundial está parado em função da pandemia do novo coronavírus. Houve uma consulta do Atlético. Keno pertence ao Pyramids, do Egito, mas está emprestado ao Al Jazira, dos Emirados Árabes, até junho deste ano. O contrato com o clube egípcio, por sua vez, vai até o meio da próxima temporada.  Keno não pretende seguir no Pyramids, e o clube egípcio quer negociá-lo. Um postulante à compra é o próprio Al Jazira, que tem prioridade em uma possível transação e, além disso, é parceiro do Pyramids. Isso significa dizer que, em caso de propostas equivalentes, o clube árabe leva o jogador.  Quando foi vendido pelo Palmeiras, Keno custou, aos egípcios, 10 milhões de dólares (cerca de R$ 37,8 milhões na cotação da época). O GloboEsporte.com apurou, porém, que a próxima negociação do jogador deve ser realizada por menos da metade desse valor (em dólares). No início do ano, por exemplo, o Grêmio chegou a fazer uma proposta pouco superior a 4 milhões de dólares. O valor chegou a ser aceito pelo Pyramids, mas outros detalhes (forma de pagamento e salário) impediram o negócio.  O Galo, portanto, já sabe - ou pelo menos tem uma ideia - de quanto precisa desembolsar para comprar Keno. O principal desafio em uma negociação, caso ela seja aberta, é a questão salarial. A reportagem apurou que o salário atual de Keno é absolutamente fora da realidade do futebol brasileiro. Segundo uma fonte ligada ao jogador, caso Keno voltasse ao Brasil recebendo o que ganha na Arábia, ele seria, ""com folga"", o dono do maior salário do futebol nacional. Ainda segundo a apuração, o salário proposto pelo Grêmio na negociação do início do ano não chegou sequer a 50% do valor recebido pelo atacante nos Emirados.  Todos esses elementos dificultam o negócio, mas o Galo tem um ""supertrunfo"" em mãos. E ele tem nome e sobrenome: Alexandre Mattos. O diretor de futebol foi o responsável por levar o atacante ao Palmeiras, em 2017, e também foi peça fundamental na negociação que selou a transferência de Keno ao Egito, em 2018.  Ainda segundo a apuração, um retorno ao futebol brasileiro dependeria de um forte convencimento por parte do clube pretendente, até porque significaria, com certeza, uma grande redução salarial. À reportagem, uma fonte citou que ""poucas pessoas no Brasil conseguiriam convencê-lo, mas uma delas é Alexandre Mattos, por toda a gratidão que Keno tem por ele"".  Por enquanto, vale reiterar: houve apenas uma consulta. O Galo, assim como todo o mundo da bola, aguarda a normalização do mercado para atuar de forma mais incisiva na busca por reforços. Os próximos capítulos não têm data marcada.  Conheça os novos planos e faça o seu ",esportes,,,,,,
2020-04-08,https://web.archive.org/web/20200408000019/https://globoesporte.globo.com/futebol/noticia/clubes-reforcam-desejo-de-brasileiro-com-38-rodadas-e-cbf-diz-nao-ver-motivo-para-propor-mudancas.ghtml,https://globoesporte.globo.com/futebol/noticia/clubes-reforcam-desejo-de-brasileiro-com-38-rodadas-e-cbf-diz-nao-ver-motivo-para-propor-mudancas.ghtml,"Clubes reforçam desejo de Brasileiro com 38 rodadas, e CBF diz não ver motivo para propor mudanças"," Enquanto não há nenhuma solução para quando a paralisação dos campeonatos terminará, clubes e CBF seguem destacando pontos de interesse e como pretendem lidar com a crise. O episódio mais recente foi nesta terça-feira, em reunião por vídeo-conferência, quando Andrés Sanchez, presidente do Corinthians, com a concordância dos demais clubes, que o Campeonato Brasileiro deverá ter 38 rodadas. A Confederação concorda com a posição e não enxerga nenhuma necessidade de mudar o calendário até agora.  A CBF ainda analisa o avanço das decisões dos órgãos de saúde para definir o que fazer mês a mês. Rogério Caboclo, presidente da entidade, afirmou que a Confederação tem cenários estipulados para cada um dos meses do ano, a depender de quando será permitido o retorno das partidas de futebol. Segundo ele, nada será decidido antes das autoridades.  A intenção do presidente da CBF também é garantir que os contratos dos jogadores com os clubes sejam cumpridos. Apesar disso, no fim de março, o GloboEsporte.com noticiou que os times das Séries A e B não entraram em um consenso sobre negociação conjunta dos salários dos atletas e já afirmavam a intenção de cumprir o calendário. ",esportes,,,,,,
2020-04-09,https://web.archive.org/web/20200409000011/https://globoesporte.globo.com/futebol/futebol-internacional/noticia/ifab-muda-regra-de-mao-na-bola-para-202021-e-toque-no-inicio-do-braco-nao-sera-mais-infracao.ghtml,https://globoesporte.globo.com/futebol/futebol-internacional/noticia/ifab-muda-regra-de-mao-na-bola-para-202021-e-toque-no-inicio-do-braco-nao-sera-mais-infracao.ghtml,"IFAB muda regra de mão na bola para 2020/21, e toque no início do braço não será mais infração "," A International Board (IFAB) divulgou na última terça-feira as mudanças nas regras do futebol para a temporada 2020/21. Entre as diversas orientações para os árbitros, chama a atenção a alteração na regra de mão na bola: a partir de junho, o toque no começo do braço (junção com a axila) não será mais considerado infração.  - Com a finalidade de determinar com clareza a infração de mão, se estabelece o limite do braço no ponto inferior da axila - diz o comunicado da IFAB.  Relembre um exemplo de lance que seria válido com a nova regra: o gol anulado de Hulk nas oitavas de final da Copa do Mundo de 2014, contra o Chile:  A organização - responsável por mudanças ou manutenções nas normas do esporte - também indica que, na nova regra, o toque de mão involuntário no ataque só deve ser assinalado caso leve diretamente a um gol ou a uma ""ocasião manifesta de gol"". Isso muda diretamente a última recomendação, que pedia que os árbitros marcassem falta em qualquer toque da bola na mão na fase ofensiva das jogadas.  Outra mudança importante diz respeito às cobranças de pênaltis. A IFAB orienta agora que uma infração do goleiro (como adiantar-se antes da cobrança) só deve ser punida caso a ação influencie diretamente o resultado final. Por exemplo: se o goleiro se adiantar, mas o atacante chutar a bola no travessão ou para fora, a cobrança não deve ser repetida.  Caso o arqueiro seja punido, e a cobrança repetida, ele será advertido. O cartão amarelo só deve ser mostrado no caso de o goleiro cometer uma nova infração.  Além disso, os cartões amarelos mostrados durante os jogos não contarão mais em uma disputa direta de pênaltis. Se um atleta for punido durante o tempo normal e, depois, novamente na disputa de pênaltis, deverá ser relatado na súmula como dois cartões amarelos - e não como uma expulsão. E, caso cobrador e goleiro cometam infrações simultâneas, o cobrador é quem deve ser punido.  O documento da IFAB também traz uma orientação importante com relação ao VAR, sistema de árbitro assistente de vídeo. A organização aponta que agora ""sempre que o incidente revisado seja suscetível a considerações subjetivas, o árbitro deve revisá-lo no monitor à beira do campo"".  As mudanças na regra entrarão em vigor de forma obrigatória no dia 1º de junho em todo o mundo. As competições que começam (ou começariam) antes desta data podem escolher se implementam as orientações neste ano ou apenas na edição seguinte. O Brasileirão, a princípio, se encaixaria neste caso. Os torneios paralisados por conta da pandemia do COVID-19 tem duas opções: concluir a disputa com as regras da temporada 2019/20 ou adotar, imediatamente, as normas para 2020/21. ",esportes,,,,,,
2020-04-09,https://web.archive.org/web/20200409000011/https://globoesporte.globo.com/futebol/futebol-internacional/noticia/kroos-diz-que-foi-mal-interpretado-e-garante-que-apoia-o-corte-salarial-no-elenco-do-real-madrid.ghtml,https://globoesporte.globo.com/futebol/futebol-internacional/noticia/kroos-diz-que-foi-mal-interpretado-e-garante-que-apoia-o-corte-salarial-no-elenco-do-real-madrid.ghtml,Kroos diz que foi mal interpretado e garante que apoia o corte salarial no elenco do Real Madrid," A discussão sobre cortes de salários nos grandes clubes do futebol mundial ganhou um personagem inesperadamente controverso esta semana, o meia alemão Toni Kroos. Avesso a declarações polêmicas, o campeão mundial de 2014 se viu no centro do furacão após sua participação em um podcast do site SWR Sport, do seu país, em que se disse contrário à redução salarial dos jogadores.  Nesta quarta, um dia após a entrevista de Kroos, o Real Madrid anunciou uma redução voluntária dos salários do elenco, de 10% a 20%. Também nesta quarta, à noite, Kroos usou o Twitter para explicar sua posição sobre o assunto: disse que foi mal interpretado e garantiu ser favorável ao corte.  - É possível que não se tenha traduzido corretamente (a entrevista) ou que alguns não queiram entender. Desde o primeiro momento, minha opinião, vocês me conhecem bem, é esta: se podemos ajudar aos trabalhadores e áreas do clube, vejo como lógico renunciar a parte do nosso salário, algo que se pôde comprovar hoje - escreveu ele.  No site da SWR Sport, a matéria sobre a participação de Toni Kroos no podcast ""Steil Extra!"" reproduz uma das declarações do meia: ""Uma renúncia de salários é como uma doação a nada, ou para o clube"". A frase foi muito criticada pela imprensa espanhola. ",esportes,,,,,,
2020-04-09,https://web.archive.org/web/20200409000011/https://globoesporte.globo.com/futebol/times/corinthians/noticia/ex-e-atuais-jogadores-do-corinthians-compram-mais-de-2-mil-cestas-basicas-para-doacao.ghtml,https://globoesporte.globo.com/futebol/times/corinthians/noticia/ex-e-atuais-jogadores-do-corinthians-compram-mais-de-2-mil-cestas-basicas-para-doacao.ghtml,Ex e atuais jogadores do Corinthians compram mais de 2 mil cestas básicas para doação," Jogadores do atual elenco do Corinthians e outros que passaram recentemente pelo clube compraram mais de 2 mil cestas básicas para serem doadas a famílias pobres de São Paulo. O objetivo é ajudar pessoas que foram afetadas economicamente pela pandemia do novo coronavírus.  Participam da ação os zagueiros Gil, Pedro Henrique e Danilo Avelar, o lateral Michel Macedo, os meias Jadson e Ramiro e os atacantes Janderson, Everaldo, Madson, Lucca e Malcom.  + CLIQUE AQUI e veja mais notícias do Corinthians  Além deles, Nando Carandina, do Santo André, Luan, do Palmeiras, Gabriel, do Lille, e os empresários Fernando Garcia e Eduardo Cornacini entraram na campanha. Outros jogadores fizeram doações, mas preferiram permanecer anônimos.  A iniciativa e organização da ação solidária foi de uma dupla amigos dos atletas, André Santos e Emerson Queiroz.  – Eu tive a ideia de ajudar quem estava precisando e comecei a falar com alguns conhecidos. Eles abraçaram, e a campanha tomou uma proporção que eu não imaginava. Cada um doou o quanto pôde, alguns 500, outros 100, 50. Também estamos tendo ajuda de pessoas ""comuns"", não só jogadores – conta André Santos.  A distribuição das cestas básicas deve começar nesta sexta-feira no Parque Novo Mundo, Zona Norte de São Paulo, e depois será expandida para outras regiões da capital. Para isso, os organizadores atuarão em parceria com associações de moradores e ONGs já definidas.  Para divulgar o projeto e angariar mais doadores, foi criada uma página no Instagram: @juntoscontraafome2020.  + Corinthians celebra dois anos de título na casa do Palmeiras, e torcida faz provocações na web ",esportes,,,,,,
