data,url_noticia,url_noticia_curto,titulo,conteudo_noticia,assunto,assunto_ex,titulo_ex,subtitulo_ex,local_ex,artigo_ex,n_paragrafos
2020-02-15,https://web.archive.org/web/20200215000008/https://globoesporte.globo.com/futebol/times/cruzeiro/noticia/em-audiencia-cruzeiro-e-rafael-acertam-rescisao-de-contrato-e-goleiro-fica-livre-no-mercado.ghtml,https://globoesporte.globo.com/futebol/times/cruzeiro/noticia/em-audiencia-cruzeiro-e-rafael-acertam-rescisao-de-contrato-e-goleiro-fica-livre-no-mercado.ghtml,"Em audiência, Cruzeiro e Rafael acertam rescisão de contrato, e goleiro fica livre no mercado"," Rafael e o Cruzeiro chegaram a um acordo nesta sexta-feira e rescindiram o contrato de trabalho depois de uma audiência na 19ª Vara do Trabalho de Belo Horizonte. O goleiro movia ação contra o clube desde o fim do mês passado. O processo seguia em segredo de Justiça, mas o valor da causa era de R$ 9.373.685,12 milhões, segundo apurou o GloboEsporte.com.  + Notícias do Cruzeiro   O goleiro esteve no Tribunal Regional do Trabalho acompanhado por seu advogado, João Chiminazzo, um de seus assessores, pelo seu pai e seu irmão. O Cruzeiro foi representado pela advogada Fernanda Saade. A juíza do caso foi June Bayao Gomes Guerra.  O clima da audiência foi tranquilo, com momentos de descontração, sendo possível ouvir risos em diversos momentos do encontro, que durou cerca de duas horas. Após o fim da audiência, Chiminazzo foi o único a falar com a imprensa.  - Foi uma rescisão de contrato. As partes chegaram a um acordo. Rafael está livre, ele entendeu a situação do Cruzeiro, o Cruzeiro entendeu a situação do Rafael. Ele está livre. O processo depende de acerto de uns valores que o Cruzeiro precisa fazer com o Rafael. Mas já está tudo acertado. Ele já sai livre - completou o advogado.  João Chiminazzo optou por não divulgar os valores acordados entre as partes, mas tratou a situação como ""razoável para ambos"".  - Na verdade, eu prefiro não falar em valor. Foi um acordo razoável para as duas partes, tanto para o Rafael, tanto para o Cruzeiro. Esse era o mais importante no momento. Para que todo mundo saísse com a melhor alternativa.  A carreira do Rafael pode seguir bem perto de onde sempre foi até agora. É que o Atlético-MG é o principal interessado nele e só esperava a rescisão do goleiro com o Cruzeiro para poder negociar efetivamente com ele. Como Fábio Mello, empresário de Rafael, não esteve na audiência, João Chiminazzo foi questionado sobre o assunto, mas se esquivou.  A ação do goleiro Rafael contra o clube foi ajuizada no dia 23 de janeiro deste ano. O jogador e seu estafe tomaram atitude após tentativas frustradas de acordo com a diretoria para sair do clube. Aos 30 anos, o atleta tem o desejo de uma sequência como titular, o que não conseguiu no Cruzeiro em função da presença de Fábio.  Na Justiça, o jogador cobrava o pagamento dos atrasos, referentes a salários, direito de imagem e outras verbas trabalhistas que estavam atrasadas. A rescisão indireta do contrato de trabalho também era pleiteada pelo atleta na ação. Na pauta exposta na sala da 19ª Vara do Trabalho constava o valor da causa como aproximadamente R$ 9 milhões.  Rafael estava no Cruzeiro desde as categorias de base, tendo subido ao profissional em 2008. No clube, foi bicampeão da Copa do Brasil (2017 e 2018), bicampeão do Brasileirão (2013 e 2014), e seis vezes campeão do Mineiro (2008, 2009, 2011, 2014, 2018 e 2019). Foram 112 jogos e 120 gols sofridos defendendo a camisa do Cruzeiro como profissional.  Além de Rafael, outros quatro jogadores acionaram o Cruzeiro na Justiça para conseguir a saída da Toca. Fabrício Bruno acabou chegando a um acordo extrajudicial e foi para o Bragantino; Thiago Neves conseguiu rescindir e foi para o Grêmio; David também teve liminar favorável à rescisão, foi para o Fortaleza, mas depois chegou a um acordo com o Cruzeiro, retirando a ação, assim como aconteceu com Éderson.  Aceitar a missão - Quero ser Sócio 5 Estrelas do Cruzeirão Cabuloso ",esportes,,,,,,
2020-02-15,https://web.archive.org/web/20200215000008/https://globoesporte.globo.com/futebol/times/flamengo/noticia/com-drone-vetado-e-acesso-liberado-flamengo-faz-primeiro-treino-em-brasilia-para-supercopa.ghtml,https://globoesporte.globo.com/futebol/times/flamengo/noticia/com-drone-vetado-e-acesso-liberado-flamengo-faz-primeiro-treino-em-brasilia-para-supercopa.ghtml,"Com drone vetado e acesso liberado, Flamengo faz primeiro treino em Brasília para Supercopa"," Olho no ""espião"", festa para os aliados. O Flamengo teve um treinamento badalado na tarde desta sexta-feira em Brasília. Durante a atividade, um drone chamou a atenção de Jorge Jesus, que solicitou o auxílio de seguranças para evitar registros de seus trabalhos. No fim, cerca de 200 rubro-negros na Capital Federal foram surpreendidos com a liberação para acompanhar os ídolos.  Com 45 mil ingressos vendidos, Mané Garrincha ganha a cara da Supercopa do Brasil; fotosConfirmado: pena de Gustavo Henrique é convertida, e Flamengo terá zagueiro na Supercopa  A Rede Globo transmite a partida com narração de Galvão Buenos e comentários de Casagrande e Júnior. No Sportv, Luiz Carlos Jr. comanda ao lado de Lédio Carmona e Petkovic.  Foi a primeira atividade do Flamengo na sede da Supercopa do Brasil, que será disputada domingo, às 11h (de Brasília), no Mané Garrincha, contra o Athlético-PR. Como de hábito, a imprensa foi liberada somente para acompanhar o aquecimento no CT do Brasiliense. Durante a parte fechada do treinamento, um drone chamou a atenção do Mister.  A mando de Jesus, um dos seguranças foi até o homem que operava o objeto para pedir que parasse a filmagem. Foi atendido prontamente.  Pouco depois, o treinador surpreendeu e liberou para que todos entrassem no centro de treinamento e pudessem ficar próximos do elenco. Os torcedores acompanharam um trabalho de finalizações e vibraram a cada gol. Gabigol fez a festa dos fãs ao fazer sua tradicional comemoração ao marcar.  Na manhã deste sábado, o Flamengo faz o último treinamento antes da final. A torcida, desta vez, não poderá entrar no CT. ",esportes,,,,,,
2020-02-16,https://web.archive.org/web/20200216000007/https://globoesporte.globo.com/combate/noticia/raulian-paiva-abre-ufc-rio-rancho-com-nocaute-em-de-la-rosa-e-vence-a-primeira-no-ultimate.ghtml,https://globoesporte.globo.com/combate/noticia/raulian-paiva-abre-ufc-rio-rancho-com-nocaute-em-de-la-rosa-e-vence-a-primeira-no-ultimate.ghtml,Raulian Paiva abre UFC Rio Rancho com nocaute em De la Rosa e vence a primeira no Ultimate," A corda estava no pescoço dos dois, e Raulian Paiva foi quem ganhou sobrevida no Ultimate. Na abertura do UFC Rio Rancho, neste sábado, pelo peso-mosca (até 57kg), o brasileiro venceu Mark de la Rosa por nocaute aos 4m42s do segundo assalto, vencendo pela primeira vez desde que foi contratado pela companhia. O lutador havia perdido seus dois primeiros confrontos na organização e chegou ao evento em situação semelhante a do americano, que vinha de dois reveses seguidos também.  + Confira a programação do UFC para 2020  A luta  O início foi de pouca ação. Após mais de um minuto e meio de estudo, Raulian clinchou, mas não evoluiu a posição na grade. Ao se desvencilhar, De la Rosa colocou bons golpes, mas recebeu um contra-ataque na saída. O duelo ficou mais aberto, e o brasileiro cresceu, sempre dominando o centro do octógono. Cauteloso, De la Rosa circulava, enquanto tentava encontrar uma brecha para tocar o rival. Na reta final do round, eles trocaram golpes na curta distância e absorveram bem alguns socos no rosto.  Pouco mudou no começo do segundo assalto. Raulian voltou a ter um bom momento de controle posicional na grade, mas não sustentou o rival ali por muito tempo. Perto da metade do round, o americano passou a ser mais agressivo e variar combinações, utilizando mais chutes e ganchos na linha de cintura. O brasileiro prosseguiu andando para a frente e também conectava alguns golpes, aproveitando-se da vantagem de envergadura para colocar seus jabs e diretos. E foi justamente com uma combinação de jab e direto que Raulian fez De la Rosa beijar a lona e conquistar o nocaute.  Ao pisar no octógono neste sábado, Jim Miller igualou Donald Cerrone como lutador com mais lutas na história do Ultimate. Foi a 34ª vez que o lutador atuou na companhia, mas o que poderia ser motivo de festa, virou decepção para o veterano. Diante de Scott Holtzman, o peso-leve (até 70kg) foi dominado nos dois últimos rounds e perdeu por decisão unânime (30-27, 29-28 e 29-28).  O revés encerrou uma sequência de duas vitórias de Miller, enquanto Holtzman venceu a segunda consecutiva.  Na penúltima luta do card preliminar, John Dodson bateu Nathaniel Wood por nocaute técnico aos 16s do terceiro round, pelo peso-galo (até 61kg). O americano superou a envergadura do rival e bateu a promessa inglesa com uma potente canhota de encontro logo no início do último assalto, em confronto que era equilibrado até o momento do golpe derradeiro.  Dodson vinha de duas derrotas seguidas e recupera-se na companhia. Wood, por sua vez, não havia perdido ainda no Ultimate, tendo batido seus três adversários na companhia até então.  No encerramento do card preliminar, Daniel Rodriguez surpreendeu o veterano Tim Means ao batê-lo por finalização com uma guilhotina aos 3m37s do segundo assalto. O estreante quase nocauteou no fim do primeiro round, mas Means foi salvo pelo gongo. Na volta, não resistiu ao ímpeto do rival, que agora possui cartel de 11 triunfos e uma derrota  Resultados do UFC Rio Rancho:  CARD PRINCIPAL:Jan Blachowicz venceu Corey Anderson por nocaute aos 3m08s do R1Diego Sanchez venceu Michel Pereira por desqualificação aos 3m09s do R3Montana de la Rosa venceu Mara Romero Borella por decisão unânime (triplo 30-27)Brok Weaver venceu Rodrigo Vargas por desqualificação aos 4m02s do R1Ray Borg venceu Rogério Bontorin por decisão unânime (30-27, 30-27 e 30-25)Lando Vannata venceu Yancy Medeiros por decisão unânime (triplo 30-27)CARD PRELIMINAR:Daniel Rodriguez venceu Tim Means por finalização aos 3m37s do R2John Dodson venceu Nathaniel Wood por nocaute técnico aos 16s do R3Scott Holtzman venceu Jim Miller por decisão unânime (30-27, 29-28 e 29-28)Devin Clark venceu Dequan Townsend por decisão unânime (30-27, 30-26 e 30-26)Merab Dvalishvili venceu Casey Kenney por decisão unânime (30-27, 30-25 e 29-28)Macy Chiasson venceu Shanna Young por decisão unânime (triplo 30-26)Raulian Paiva venceu Mark de la Rosa por nocaute aos 4m42s do R2  Assine o Combate Play e assista ao Combate em qualquer lugar ",esportes,,,,,,
2020-02-16,https://web.archive.org/web/20200216000007/https://globoesporte.globo.com/futebol/times/sao-paulo/noticia/arbitro-interrompe-sao-paulo-x-corinthians-apos-grito-homofobico-no-morumbi.ghtml,https://globoesporte.globo.com/futebol/times/sao-paulo/noticia/arbitro-interrompe-sao-paulo-x-corinthians-apos-grito-homofobico-no-morumbi.ghtml,Árbitro interrompe São Paulo x Corinthians após grito homofóbico no Morumbi," O árbitro Douglas Marques das Flores interrompeu o clássico entre São Paulo e Corinthians, neste sábado, no Morumbi, depois de gritos homofóbicos da torcida do Tricolor (assista acima).  O jogo foi parado aos três minutos do primeiro tempo após um tiro de meta cobrado pelo goleiro Cássio. Torcedores são-paulinos gritaram ""bicha"" assim que o jogador bateu na bola.  Douglas Marques das Flores comunicou à delegada da partida, mas os gritos reapareceram pouco depois, em outro tiro de meta cobrado por Cássio.  – Douglas Marques identificou o grito, comunicou capitães e delegada. É preciso ter alguma ação que pare isso –afirmou o comentarista de arbitragem Sálvio Spinola, na Central do Apito.  Aos oito minutos, o sistema de som do Morumbi avisou aos torcedores que os gritos são proibidos. Pouco depois, um aviso foi exibido nos telões do estádio. Veja abaixo: ",esportes,,,,,,
2020-02-16,https://web.archive.org/web/20200216000007/https://globoesporte.globo.com/sp/tem-esporte/volei/noticia/sesi-bauru-vence-osasco-ultrapassa-rival-e-entra-no-g-4-da-superliga-feminina.ghtml,https://globoesporte.globo.com/sp/tem-esporte/volei/noticia/sesi-bauru-vence-osasco-ultrapassa-rival-e-entra-no-g-4-da-superliga-feminina.ghtml,"Sesi-Bauru vence Osasco, ultrapassa rival e entra no G-4 da Superliga feminina "," O Sesi-Bauru venceu o Osasco por 3 sets a 0 (parciais de 21/25, 18/25 e 24/26), na noite deste sábado, no ginásio José Liberatti, em Osasco. O duelo foi válido pela sétima rodada do returno da Superliga feminina.  A oposta Polina Rahimova foi a maior pontuadora da partida, com 21 pontos. Dani Lins foi a vencedora do troféu Viva Vôlei.  + Tabela e classificação da Superliga feminina  Com a vitória o Sesi-Bauru ultrapassa o Osasco, ficando na quarta posição com 36 pontos. O time da Grande São Paulo fica em quinto com 35 pontos.  O Osasco encara o Flamengo na próxima quinta-feira, às 20h, no ginásio José Liberatti, em Osasco. O Sesi-Bauru enfrenta o Minas pela nona rodada do returno – o jogo da oitava rodada está adiado –, no dia 28 de fevereiro (sexta-feira), às 20h, na Arena Minas, em Belo Horizonte. ",esportes,,,,,,
2020-02-17,https://web.archive.org/web/20200217000020/https://globoesporte.globo.com/futebol/times/palmeiras/noticia/sonho-dos-dois-lados-e-convite-de-diretor-como-hulk-foi-parar-em-um-camarote-do-palmeiras.ghtml,https://globoesporte.globo.com/futebol/times/palmeiras/noticia/sonho-dos-dois-lados-e-convite-de-diretor-como-hulk-foi-parar-em-um-camarote-do-palmeiras.ghtml,Sonho dos dois lados e convite de diretor: como Hulk foi parar em um camarote do Palmeiras," Sem atividades no futebol chinês, o atacante Hulk esteve neste domingo na arena do Palmeiras para acompanhar a vitória de seu time de coração sobre o Mirassol, de virada, por 3 a 1. Esteve, mais precisamente, em um dos camarotes destinados ao clube.  Não significa que o jogador de 33 anos, com passagem pela seleção brasileira, esteja próximo de vestir a camisa alviverde. Por outro lado, sua presença no estádio é, sim, mais um indicativo do desejo das duas partes de que isso um dia aconteça.  + Leia mais notícias do Palmeiras  Hulk foi ao jogo a convite de João Paulo Sampaio, coordenador geral das categorias de base do Palmeiras e seu velho conhecido dos tempos de Vitória. O hoje dirigente foi seu treinador no clube de Salvador, quando o então lateral virou atacante e subiu ao profissional, antes de fazer carreira no exterior.  Foi por meio dessa boa relação que recentemente a diretoria fez uma consulta para saber a situação do jogador no Shangai SIPG, da China. Ele, porém, recebe atualmente um salário considerado ""astronômico"", e ainda com possibilidade de renovação do contrato que se encerra ao final deste ano.  A consulta foi motivada pela paralisação das atividades do futebol chinês diante da epidemia de coronavírus, surto que já provocou mais de 1,6 mil mortes no país. Hulk está no Brasil enquanto aguarda uma decisão sobre o andamento das competições.  Ao menos por enquanto, diante do entrave financeiro, o Palmeiras dá como descartada uma negociação, a não ser que algo mude em relação à situação na China. Mas mantém esperanças de que, num futuro não tão distante, as duas partes possam se acertar.  Até o momento, o único reforço contratado foi Matías Viña, lateral-esquerdo que fez sua estreia justamente neste domingo, na vitória sobre o Mirassol. Além de um atacante, o clube busca também mais um lateral-direito. ",esportes,,,,,,
2020-02-17,https://web.archive.org/web/20200217000020/https://globoesporte.globo.com/futebol/times/palmeiras/noticia/campo-artificial-ajudou-o-palmeiras-veja-o-que-jogadores-e-luxa-acharam-do-novo-gramado.ghtml,https://globoesporte.globo.com/futebol/times/palmeiras/noticia/campo-artificial-ajudou-o-palmeiras-veja-o-que-jogadores-e-luxa-acharam-do-novo-gramado.ghtml,Campo artificial ajudou o Palmeiras? Veja o que jogadores e Luxa acharam do novo gramado," O Palmeiras estreou o gramado artificial de seu estádio na vitória por 3 a 1 sobre o Mirassol, neste domingo, pelo Campeonato Paulista. Foi o primeiro jogo da equipe no novo campo, depois de três treinos realizados no local.  + Leia mais notícias do Palmeiras  Para o técnico Vanderlei Luxemburgo, a grama ajudou o Verdão a vencer o adversário, que saiu na frente, mas levou a virada em poucos minutos.  – A qualidade do jogo ficou boa com o gramado. Dá para jogar futebol, não atrapalha. O que muda é o ritmo do jogo. Isso teremos que ter uma adaptação, que é natural. A rotação de 30 minutos na grama natural é uma coisa, na artificial, onde a bola molhada caminha mais rápida, é maior. O desgaste é maior. Mas a qualidade melhora, você não tem buracos. É uma questão de ajustar a essa realidade. Eu gostei do que a equipe fez. Tivemos a qualidade do gramado para sair atrás e continuar o jogo de futebol, sem muito erro de passe. O gramado também ajudou a gente a ter a virada. Agora vai ter um ajuste que teremos que fazer nessa situação nova. Mas achei muito positivo, não atrapalhou em nada a qualidade o jogo, achei muito boa – avaliou.  Bruno Henrique  – Muda um pouquinho, principalmente a mudança de direção. Acho que deixa o jogo bem dinâmico, coisa que gostamos. A bola mais rápida deixa o jogo melhor para nós. Ficamos felizes. A gente vem em um processo de adaptação, mas acredito que vai ser uma coisa muito importante para jogarmos em casa – analisou Bruno Henrique.  Felipe Melo  – Foi melhor do que eu imaginava, sendo bem sincero. Claro que tem muito o que melhorar, algumas coisas foram conversadas. As borrachas, quanto mais se treina e joga, vão abaixando um pouco. Mas achei muito bom, a bola rola bastante – disse Felipe Melo.  Weverton  – Foi muito bom, acho que o mais legal hoje foi voltar pra casa, sentir o carinho do nosso torcedor de novo, hoje o gramado novo, diferente do que estamos acostumados, mas muito bom. No primeiro jogo, foi muito bom. Lógico que requer uma adaptação, hoje choveu muito antes do jogo, no primeiro tempo estava mais molhado, depois mais seco. Mas acho que a adaptação foi muito rápida, não tem problema de buraco, a bola anda bem. Estamos muito felizes de voltar pra nossa casa com esse campo.  – Quando está chovendo, a bola vai andar mesmo, a água fica na superfície, depois ela vai descendo com a drenagem, aí vai ficando parecido com a natural. Mas acho que foi bacana, uma oportunidade bem legal de jogar em casa e saber que temos de nos adaptar o mais rápido possível, fazer disso o diferencial. Com o apoio do torcedor e um campo bom para jogar, tem tudo pra conseguirmos muitas vitórias aqui dentro. ",esportes,,,,,,
2020-02-17,https://web.archive.org/web/20200217000020/https://globoesporte.globo.com/futebol/futebol-internacional/futebol-portugues/noticia/marega-se-revolta-com-ofensas-racistas-de-torcida-rival-e-abandona-jogo-em-vitoria-do-porto.ghtml,https://globoesporte.globo.com/futebol/futebol-internacional/futebol-portugues/noticia/marega-se-revolta-com-ofensas-racistas-de-torcida-rival-e-abandona-jogo-em-vitoria-do-porto.ghtml,"Marega se revolta com ofensas racistas, abandona jogo do Porto e desabafa: ""Vá se f..."""," O Porto venceu o Vitória de Guimarães por 2 a 1 fora de casa e esquentou de vez a briga pelo título do Campeonato Português. Mas esse não foi o principal fato deste domingo no estádio Dom Afonso Henriques, em Guimarães. Revoltado com os insultos racistas da torcida mandante, o atacante Marega, autor do gol do triunfo dos Dragões, decidiu deixar o campo (veja no vídeo acima). Após a partida, ele publicou um desabafo nas redes sociais (veja mais abaixo).  O malinês é ex-jogador do Vitória de Guimarães, onde atuou na temporada 2016/17, emprestado pelo Porto. Ele foi provocado pelos torcedores locais a cada vez que tocava na bola, segundo relatos de quem estava no estádio. Parte da torcida em Guimarães fez gritos imitando macaco.  + VEJA A TABELA DO PORTUGUÊS+ Vitória vai investigar racismo a Marega, mas presidente critica atitude de atacante do Porto  + Benfica perde em casa para o Braga e pode ver Porto diminuir a diferença para um ponto  Aos 15 minutos do segundo tempo, Marega recebeu a bola pelo lado direito da área e, com uma cavadinha, marcou um belo gol, que garantiu a vitória por 2 a 1. Ao comemorar, o jogador se dirigiu à arquibancada apontando para o seu braço. Os torcedores responderam atirando vários objetos no gramado, inclusive algumas cadeiras do estádio.  O jogador se revoltou, provocou a torcida ao colorar um dos assentos atirados no gramado acima de sua cabeça. E depois levou cartão amarelo por causa das provocações. Na sequência, os insultos dos torcedores do Vitória de Guimarães não cessaram, e Marega foi ao limite. Decidiu deixar o campo e fez sinais negativos com as mãos na direção das arquibancadas.  Alguns companheiros e até mesmo jogadores do time de Guimarães tentaram acalmá-lo, sem sucesso. Após sete minutos de paralisação, o técnico Sérgio Conceição substituiu o africano por Wilson Manafá. A partida, então, recomeçou e seguiu normalmente - com o placar se mantendo em 2 a 1 para os visitantes.  Após a partida, Marega usou as redes sociais para desabafar. Ele escreveu contra os torcedores do Vitória de Guimarães e também contra o árbitro do jogo, Luis Godinho, que lhe deu um cartão amarelo pela reação após marcar seu gol.  – Gostaria apenas de dizer a esses idiotas que vêm ao estádio fazer gritos racistas ... vá se f... E também agradeço aos árbitros por não me defenderem e por terem me dado um cartão amarelo porque defendo minha cor da pele. Espero nunca mais encontrá-lo em um campo de futebol! VOCÊ É UMA VERGONHA !!!! – desabafou o jogador (veja acima).  Em meio à polêmica, o triunfo faz com que o Porto volte a ficar na cola do Benfica na tabela do Campeonato Português. Os Dragões chegam a 53 pontos, ficando apenas um atrás dos Encarnados - que perderam para o Braga, em casa, no último sábado - apenas uma semana depois de serem derrotados pelo próprio Porto.  O triunfo começou a ser construído aos 10 minutos de jogo, quando Douglas Jesus abriu o placar para o Porto. O Vitória de Guimarães chegou ao empate aos quatro minutos da etapa final, e Marega fez o gol da vitória antes do episódio de discriminação. ",esportes,,,,,,
2020-02-17,https://web.archive.org/web/20200217000020/https://globoesporte.globo.com/rj/serra-lagos-norte/futebol/times/boavista/noticia/tecnico-do-boavista-bonamigo-projeta-final-com-flamengo-vamos-enfrentar-o-grande-clube-do-mundo.ghtml,https://globoesporte.globo.com/rj/serra-lagos-norte/futebol/times/boavista/noticia/tecnico-do-boavista-bonamigo-projeta-final-com-flamengo-vamos-enfrentar-o-grande-clube-do-mundo.ghtml,"Técnico do Boavista, Bonamigo projeta final com Flamengo: ""Vamos enfrentar o grande clube do mundo"""," A festa do Boavista pela classificação à final da Taça Guanabara começou no gramado do Elcyr Resende e continuou até a coletiva do técnico Paulo Bonamigo. Interrompido por pelo menos duas vezes por jogadores, o treinador elogiou o desempenho da equipe, lamentou chances perdidas e disse que o Flamengo, rival pelo título do primeiro turno do Carioca, é o atual grande time do mundo.  O Boavista chegou à decisão após o 1 a 1 com o Volta Redonda neste domingo - jogou pela vantagem do empate. Antes de encarar o Rubro-Negro no próximo sábado, tem o desafio de receber, na quarta-feira, a Chapecoense pela Copa do Brasil.  - Temos de trabalhar em cima da eficiência. Futebol hoje nos permitiu desperdiçar essas chances, mérito também do goleiro deles. É uma outra atmosfera, decisão sempre tem situações peculiares. A motivação será a maior possível. Vamos enfrentar o grande clube do mundo hoje, o Flamengo não é só nível nacional. É de nível internacional, então, temos de continuar trabalhando, descansar e colocar todo mundo comprometido nos próximos desafios - disse o técnico.  Neste sábado, o Flamengo ganhou a Supercopa do Brasil. No ano passado, conquistou o Carioca, a Libertadores e o Brasileirão.  Campanha  Na fase classificatória, tivemos bons jogos. Perdemos um jogo para o VAsco no último minuto. Fizemos uma grande partida. Hoje foi um jogo, toda a semifinal é difícil. Estava muito calor, os dois times sentiram o ritmo. Tinha de quebrar a intensidade do jogo com a posse de bola e nós conseguimos fazer isso. Tivemos controle e chances para ganhar. O importante foi classificar.  Correções a serem feitas  O próximo jogo é a Chapecoense. Vamos jogar pela Copa do Brasil. Não estou nem pensando no Flamengo. A Copa do Brasil tem importância até pelos valores envolvidos. O grupo é muito comprometido, então, vamos tentar fazer um bom jogo. A Chape é um time de primeira linha. Vamos pensar em fazer um jogo de alto nível, é a exigência. Tem de ser intenso, ter qualidade e estar inspirado para fazer a diferença. ",esportes,,,,,,
