data,url_noticia,url_noticia_curto,titulo,conteudo_noticia,assunto,assunto_ex,titulo_ex,subtitulo_ex,local_ex,artigo_ex,n_paragrafos
2018-04-19,https://web.archive.org/web/20180419080728/https://gshow.globo.com/Famosos/noticia/pedro-carvalho-conta-sobre-sua-rotina-no-rio-de-janeiro-e-diz-que-esta-aprendendo-a-surfar-mandando-muito-tombo.ghtml,https://gshow.globo.com/Famosos/noticia/pedro-carvalho-conta-sobre-sua-rotina-no-rio-de-janeiro-e-diz-que-esta-aprendendo-a-surfar-mandando-muito-tombo.ghtml,Pedro Carvalho conta sobre sua rotina no Rio de Janeiro e diz que está aprendendo a surfar: ‘Mandando muito tombo’ ," É quase um ano morando no Rio de Janeiro – e sem voltar a Portugal, cabe frisar. Essa imersão na cidade que escolheu para viver e decolar na carreia de ator no Brasil tem deixado Pedro Carvalho cada vez mais carioca. Sim! E esta é a opinião dos seus colegas de O Outro Lado do Paraíso, novela na qual interpreta Amaro.  “Outro dia a gente estava almoçando no estúdio, e a galera começou a me zoar: ‘Cara, você já está muito carioca’”, conta ele, que explica: “Tenho um estilo muito europeu de me vestir: botina, calça, camisa. Aqui é mais camiseta, chinelo e tal, e eu adotei isso no dia a dia”.  Da cidade, ele já escolheu seu canto preferido: “A praia da Joatinga. Acho muito bonita, parece que foi desenhada”. E já está até com hábitos de “Carioguês” (ou seria “Porturioca”?).  “No fim de semana, eu sempre faço uma coisa que é: acordo, como rápido, vou correr no calçadão, dou um mergulho na água e volto. Isso para mim é um acordar!”.  “Gosto muito de fazer trilha, sou muito ligado à natureza. Depois, como eu faço corrida e tudo mais, coloco um fone com música e vou conhecendo os lugares”.  Um lugar novo para o português é Santa Teresa, na região central do Rio de Janeiro. Junto com ele, o Gshow foi dar um passeio pelo bairro.  “Santa Teresa eu nunca tinha ouvido falar. Mas depois, lendo a história [do Parque das Ruínas], é muito legal!”, diz ele, referindo-se ao centro cultural que, no século XIX e início do XX foi um palacete por onde passaram muitos artistas e intelectuais da época.  A novidade na vida desse mais novo carioca é que ele está aprendendo a surfar!  “Comecei a experimentar, mas ainda está no início. Eu estou mandando muito tombo na água!”, diverte-se ele, que chegou a praticar outra modalidade de surf, o bodyboard, quando mais novo, em Portugal.  Na alimentação, ele também abrasileirou. Pelo menos quando o assunto é sobremesa.  “Eu não faço dietas porque eu sou muito esquisito para comer. O Brasil não tem me ajudado muito, porque vocês têm uma doceria maravilhosa - doce de leite, brigadeiro - e eu sou uma formiga autêntica”.  O Brasil – principalmente o Rio de Janeiro – já é a sua casa, e a Europa virou destino de férias após o fim da novela das 21h.  Agradecimento: Centro Cultural Municipal Parque das Ruínas ",famosos,,,,,,
2018-04-26,https://web.archive.org/web/20180426081823/https://gshow.globo.com/Famosos/noticia/dhonata-augusto-faz-rap-exclusivo-e-diz-o-que-norteia-sua-carreira-dedicacao-e-sonhos.ghtml,https://gshow.globo.com/Famosos/noticia/dhonata-augusto-faz-rap-exclusivo-e-diz-o-que-norteia-sua-carreira-dedicacao-e-sonhos.ghtml,Dhonata Augusto faz rap exclusivo e diz o que norteia sua carreira: 'Dedicação e sonhos' ," Tudo o que Dhonata Augusto conquistou até hoje foi através de muito suor. Mas, ao mesmo tempo, sempre teve muita calma. Aos 21 anos, o Leandro, de Malhação: Vidas Brasileiras, tem uma paciência e determinação que poucas pessoas têm nessa idade. E, para todo papel que se compromete a fazer, o pensamento é o mesmo.  Essa possibilidade de ser muitas pessoas foi justamente o que o conquistou para a profissão de ator. Mas quem deu o empurrãozinho inicial nessa trajetória foi mesmo sua mãe, que não queria que o filho ficasse parado depois da escola.  ""Ela me inscreveu no Nós do Morro e foi a partir daí que comecei a me interessar pelo teatro. Nunca tinha planejado nada, mas sempre fui muito palhaço em casa. Brincava de interpretar e imitar os outros"", relembra.  Nascido em Santa Cruz da Serra, Duque de Caxias, Dhonata foi ainda criança para o Vidigal, comunidade do Rio de Janeiro, em que vive até hoje. Sente muito orgulho do lugar de onde vem, mas já sentiu algumas perdas de perto.  ""Muitos dos meus amigos foram para o caminho errado e já perdi alguns também"", resume, sem entrar muito no assunto.  O Nós do Morro foi o impulso necessário para que ele corresse atrás de seus objetivos, mas acabou virando também um lugar onde encontrou pessoas especiais. ""O Guti Fraga (fundador) foi o pai que eu não tive. Não sei como, acho que pela minha mãe, mas meu boletim sempre chegava nas mãos dele"", ri com a lembrança. ""Ele sempre me deu muitos conselhos e até hoje, quando saio de uma gravação, passo na sala dele para trocar uma ideia"", conta.  Uma outra característica sua é o fato de ser bastante curioso e interessado em descobrir coisas novas. A própria dança, ele aprendeu sozinho na frente da TV.  Esse lado também o ajudou em situações profissionais, ainda mais quando nem sabia que direção seguir.  ""Uma vez fiz preparação para ser um cachorro numa peça. Eu pensei: 'Como eu vou fazer um cachorro? Comecei, então, a observar o meu. Fiz o laboratório e cheguei a receber críticas bem positivas"", conta.  Mas foi no cinema que teve o papel mais marcante até agora, principalmente por tudo que representou. Dhonata integrou o elenco do filme 'Bach in Brazil', co-produção entre Brasil e Alemanha, gravada em 2014 e lançada no país em junho do ano passado.  Ele conta mais como foi a experiência: ""Quando tinha 14 anos, pensei: 'Preciso muito sair do Brasil', mas não sabia como e não tinha possibilidade. E depois acabou acontecendo! A lei da atração funcionou na minha vida. Utilizo ela em tudo"".  Com trabalhos como Totalmente Demais e Cidade dos Homens no currículo, Dhonata dá vida agora a Leandro. ""O processo do personagem foi bastante curioso. Foi logo depois de Cidade dos Homens. Em um, eu era um bandido, lidava com armas, e logo depois estava eu, no Colégio Sapiência, sorridente e cheio de sonhos"", conta.  Além das gravações, o ator se dedica sempre que consegue ao rap, uma outra paixão. Usa as situações do dia a dia como inspiração para suas letras, e há dois anos, formou um grupo com amigos. Se apresentam e viajam de vez em quando para fazer shows.  Mas ele não para por aí e revela alguns de seus desejos. A meta deste ano? ""Tocar violão e cantar"". E o sonho para o futuro? ""Quero muito viver do cinema, do teatro e da música. Quem sabe também uma carreira internacional?""  Se alguém duvida que ele vai conseguir, está aqui uma frase que pode ser a resposta:  DHONATA E A DANÇA:   Confira mais o trabalho de Dhonata em Malhação: Vidas Brasileiras.  ",famosos,,,,,,
2018-04-26,https://web.archive.org/web/20180426081823/https://gshow.globo.com/Famosos/noticia/marcos-pitombo-admite-ser-um-homem-romantico-gosto-de-uma-vida-a-dois.ghtml,https://gshow.globo.com/Famosos/noticia/marcos-pitombo-admite-ser-um-homem-romantico-gosto-de-uma-vida-a-dois.ghtml,Marcos Pitombo admite ser um homem romântico: 'Gosto de uma vida a dois'," A cada personagem que vive na TV, Marcos Pitombo se transforma – mas todos eles acabam tendo o romantismo como algo em comum. Depois de brilhar como Felipe, em Haja Coração (2016), e arrebatar a torcida do público pelo casal #Shirlipe, vivido ao lado de Sabrina Petraglia, o ator já conquistou os telespectadores de Orgulho e Paixão, que torcem pelo romance do jovem Rômulo com Cecília, interpretada por Anaju Dorigon.  Apesar das semelhanças entre os perfis de seus dois últimos personagens, Marcos chama a atenção para as diferenças evidentes entre os dois. ""É completamente diferente a partir do momento que se trata de uma novela de época. O Rômulo tem outros costumes, outras formas de se relacionar com o corpo, com os outros personagens e com a mulher que ele ama"", destaca o ator, que ainda completa: ""Ele tem traços distintos do Felipe. Era um bon vivant e, até então, não tinha se apaixonado de verdade. Mas, curiosamente, a partir do momento que encontra a Cecília, é como se estivesse descobrindo o primeiro amor"".  Expert em viver verdadeiros príncipes na televisão, Marcos – que estreou na TV em 2006, como o Siri, em Malhação – admite que também tem essa característica longe das câmeras. ""Confesso que também sou romântico, um pouco tradicional. Talvez empreste isso para os meus personagens"", conta.  Exibindo um novo visual na novela das 6, com os cabelos mais longos, Marcos conta que a escolha deste corte para o personagem aconteceu por acaso. ""Gravei um filme em setembro do ano passado no Sul e, por conta disso, deixei o cabelo crescer. Quando cheguei nas primeiras leituras aqui nos Estúdios Globo, a equipe viu o physique que eu estava e resolveu aproveitar"", explica.  Ele lembra que a concepção de caracterização de Rômulo era completamente diferente: ""Era um bigodinho e um cabelo mais curto. Mas aplicamos esse visual um pouco mais de príncipe mesmo, mas ao mesmo tempo de playboy, um cara que não é ditado pelas regras. Porque naquela época o normal era um cabelo mais batidinho"", conta.  O filme em questão, aliás, foi gravado ao lado de um colega de elenco de Orgulho e Paixão. Murilo Rosa também estará no longa 'A Cabeça de Gumercindo Saraiva', de Tabajara Ruas. Com estreia prevista para o segundo semestre, a produção se passa no final da Revolução Federalista (1893-1895). Marcos vive um maragato, nome dado aos sulistas que iniciaram o levante contra o governo. ""Foi bem legal, porque o Murilo faz um republicano e eu um maragato. Então éramos rivais nessa história"", conta ele sobre a oportunidade de viver um papel diferente do que costuma fazer na TV.  A participação no longa também foi útil na preparação para seu personagem na novela. ""É um filme de ação, gravei muito em cima de cavalo. Então quando cheguei aqui para a nossa preparação já montava sem cela, superconfiante. Hoje faço bastantes cenas a cavalo bem à vontade por conta desse filme"", conclui.  Relembre papéis marcantes de Marcos Pitombo na TV Globo: ",famosos,,,,,,
2018-04-26,https://web.archive.org/web/20180426081823/https://gshow.globo.com/Famosos/noticia/roberto-carlos-faz-aniversario-e-ganha-homenagem-de-amigos-famosos.ghtml,https://gshow.globo.com/Famosos/noticia/roberto-carlos-faz-aniversario-e-ganha-homenagem-de-amigos-famosos.ghtml,Roberto Carlos faz aniversário e ganha homenagem de amigos famosos ," Todo mundo tem uma música do Roberto Carlos para chamar de sua, não é? Agora imagina que honra ter uma canção do REI feita especialmente para você? É muita onda! Isis Valverde chama de Gratidão. Ela foi presenteada quando interpretou Ritinha, em A Força do Querer, e teve ""Sereia"" composta para sua personagem.  No especial do Roberto Carlos do ano passado, eles dividiram o palco e se emocionaram juntos. Com exclusividade para o Gshow, nesta quinta-feira,19/4, dia em que o Rei completa 76 anos, ela manda seu recado:  “Para mim, estar ao lado do Rei foi um presente duplo: profissional e pessoal. Estar no palco ao lado de alguém que canta com a alma foi um dos maiores presentes que pude ganhar.""  Emoção: Roberto e Isis choraram juntos! Foi lindo e vale relembrar!  Como não amar Roberto Carlos?   Tiago Abravanel, participante do Show dos Famosos, conta que construiu uma amizade e admiração com Roberto digna de trilha sonora:  ""Tive a honra de conhecer o Roberto quando o convidei para assistir o especial do Tim Maia. Ele foi em uma das minhas últimas apresentações e tem uma história com o Tim. Foi muito emocionante!"".  ""Depois, ele me convidou para ir em um show que ele faria dois dias depois. Fui para São Paulo e meu voo atrasou. Ia ligando para a produção avisando que estava a caminho. Ele reservou a mesa na frente, bem no meio para eu sentar com minha mãe e a produção falou: 'posso começar o show?''  Na época, o Rei elogiou a interpretação de Tiago como Tim Maia:  ""Ele falou que tinha visto uma das coisas mais emocionantes da vida dele. Ver Tim Maia interpretado por um artista que ele estava adorando conhecer. Me jogou uma rosa do palco e depois recebi o convite para cantar com ele no especial. Há 3 anos canto no navio dele. Minha relação com ele é muito especial. Sou grato ao carinho e apoio que ele sempre me deu e admiro demais o artista e pessoa que ele é.""  Ana Maria Braga lembra do Rei em sua infância:  ""Cumprimentar Roberto por mais um ano de aniversário, graças a Deus, me remete aos meus aniversários e lembranças de Joaquim da Barra, quando ganhei minha primeira vitrolinha cor de rosa com primeiro disquinho e conheci Roberto Carlos.""  A apresentadora revelou, às gargalhadas, sua paixão platônica pelo cantor:  Tom Cavalcante, amigo de longa data, deixou um recado como se estivesse mandando uma mensagem pelo celular 📱 :  ""Querido irmão de fé RC é o Tom e estou pegando uma carona com a galera do Gshow e já já chegando aí no teu ap para comemoramos seu niver. Avisa aí na portaria, por favor! Sem querer quebrar a surpresa, estamos levando aquele vinho e aquele sorvete de coco que você mais ama. Vai ser demais!""  O humorista ainda simulou uma resposta do aniversariante:  ""Bicho! Vocês são uns amores! Obrigado de coração, mas saí para comemorar o meu niver no meu barco em alto mar."" ",famosos,,,,,,
2018-05-03,https://web.archive.org/web/20180503083115/https://gshow.globo.com/Famosos/noticia/fernanda-souza-fala-de-nova-fase-em-sao-paulo-como-apresentadora-me-senti-livre-para-morar-em-qualquer-lugar.ghtml,https://gshow.globo.com/Famosos/noticia/fernanda-souza-fala-de-nova-fase-em-sao-paulo-como-apresentadora-me-senti-livre-para-morar-em-qualquer-lugar.ghtml,"Fernanda Souza fala de nova fase em São Paulo: 'Como apresentadora, me senti livre para morar em qualquer lugar'"," Depois de 18 anos morando no Rio de Janeiro, Fernanda Souza percebeu que estava na hora de 'voltar para casa'. Nascida e criada até os 12 anos em São Paulo, a atriz e apresentadora abriu as portas do seu novo cantinho paulista para o Gshow. ""Toda minha família é de São Paulo e a do Thi (Thiaguinho) também, então a gente não tinha ninguém no Rio. Estávamos ao léu lá, jogados no Rio"", brinca.  Ela explica que sempre morou no Rio por causa das novelas que estava fazendo, mas agora, se dedicando mais ao seu canal de vídeos na internet e ao programa Vai, Fernandinha, do Multishow, ela decidiu voltar para sua cidade natal.  Com a decisão tomada, chegou a hora de fazer a mudança. Fernanda brinca que foi uma loucura. Afinal, precisou mudar toda sua casa do Rio de Janeiro para um apartamento em São Paulo. ""Foi uma mudança bem cansativa, eu quase enlouqueci!"", lembra. Mas, com ajuda de amigos e parceiros, deu tudo certo.  A decoração da casa de Fernanda e Thiaguinho é bem clean, com objetos de decoração de arte que remetem a música e à história do casal. ""Nesse apartamento tive que fazer pouca coisa, só tive que realocar as coisas do apartamento antigo"", conta.  Apesar da mudança tumultuada, a atriz e apresentadora conta que voltar para São Paulo foi mais fácil do que imaginava, pois cresceu andando pelo centro da cidade. ""Voltar nesses lugares me deixa muito emocionada. São Bento, Ladeira Porto Geral, 25 de Março, Santa Efigênia, sabe? Aquilo tudo dali é a minha área"", destaca. A atriz diz que leva uma vida muito normal na capital paulista e que vai a todos os lugares sem nenhum problema.  Com a mudança para São Paulo, Fernanda adquiriu novos hábitos - dentre eles, a meditação. A atriz conheceu o método da Meditação Transcendental há dois meses e revela que a técnica mudou sua vida.  Como boa geminiana, ela brinca que precisa meditar por muitos anos para ficar um pouco mais decidida na vida. Mas quem está de fora percebe que Fernanda é, sim, muito decidida. É preciso apenas cinco minutos de conversa com a paulista para sentir que a personalidade é forte.  Detalhista, Fernanda participa de todos os processos de seus projetos e não seria diferente na escolha do figurino ao receber um convidado no seu programa. A atriz contou que sempre se preocupa em escolher um look que tenha a ver com a pessoa e guarda as roupas com muito carinho.  Agradecimentos: Marcos Mazini, Belisa Taam e Fernanda Jorge  Tratamento de imagens: Raphael Dias ",famosos,,,,,,
2018-05-03,https://web.archive.org/web/20180503083115/https://gshow.globo.com/Famosos/noticia/juliana-caldas-de-diverte-com-elenco-de-o-outro-lado-em-maratona-do-comida-di-buteco.ghtml,https://gshow.globo.com/Famosos/noticia/juliana-caldas-de-diverte-com-elenco-de-o-outro-lado-em-maratona-do-comida-di-buteco.ghtml,Elenco de 'O Outro Lado do Paraíso' se diverte em maratona do Comida Di Buteco," Todo mundo tem um “dia de lixo”, quando é permitido comer de tudo sem culpa, não é? Neste final de semana, foi a vez de parte do elenco de O Outro Lado do Paraíso deixar a dieta de lado e aproveitar esse momento.  Juliana Caldas, Giovana Cordeiro, Gabriella Mustafá, Patrícia Elizardo e Anderson Tomazini se juntaram aos atores Marcos Oliveira, o Heráclito de Deus Salvei o Rei, e Polly Marinho, a Tenória de Orgulho e Paixão, e encararam uma maratona de restaurantes para curtir a 11ª edição do Comida Di Buteco Rio. As receitas criativas disputam o título de petisco favorito no concurso anual e podem ser votadas até 13 de maio.  Já Patrícia Elizardo explica que, no dia a dia, gosta, sim, de seguir a dieta. E, de vez em quando, a atriz se permitir comer algo mais calórico e 'enfiar o pé na jaca': ""Tem que escolher um dia para isso, o dia do lixo, como costumo fazer. Pode ser no final de semana, que a gente libera mais e acaba aproveitando, saindo para jantar"", ensina. ",famosos,,,,,,
2018-05-03,https://web.archive.org/web/20180503083115/https://gshow.globo.com/Famosos/noticia/agildo-ribeiro-relembre-a-carreira-do-artista.ghtml,https://gshow.globo.com/Famosos/noticia/agildo-ribeiro-relembre-a-carreira-do-artista.ghtml,Agildo Ribeiro: relembre a carreira do artista na TV Globo," Agildo Ribeiro vai deixar saudade. O humorista, que tinha completado 86 anos no dia 26/4, nos deixou neste sábado, 28/4. Ele sofria de problemas cardíacos. O ator George Sauma elogiou o amigo:  ""Agildo era um gênio. Dono de um timing de comédia único e especial que nos influenciará para sempre. Tive a honra de contracenar com ele no primeiro ano do novo Zorra. Era incrível sua generosidade e parceria. Levarei no meu coração essa experiência e agradeço eternamente por ele existir e pela oportunidade que tive de conviver com essa lenda. Muito obrigado, Agildo.""  Marcos Veras dividiu cena com humorista durante dois anos no Zorra:  A atriz Debora Lamm prestou sua homenagem:  Recentemente, Agilldo esteve no Vídeo Show e revisitou sua carreira no quadro 'Meu Vídeo É um Show'. Relembre alguns trabalhos memoráveis do humorista.  Sua última participação na telinha foi no Tá no Ar. O programa, que foi exibido há 10 dias, prestou homenagem aos mestres dos programas de humor e o artista fez parte de um dos esquetes. Reveja seu último trabalho a ir ao ar na TV Globo:  O ator Bernardo Schlegel, do Zorra também mandou sua mensagem :  Paulo Mathias, do Zorra, admirava muito o ator:  Em entrevista ao Vídeo Show, Agildo falou sobre programa com Topo Gigio:  'Vídeo Show' relembrou sua imitação de Clodovil   O amigo Marcius Melhem o homenageou no 'Vídeo Show'  Jô relembra entrevista com o humorista   Agildo fez muita gente rir no 'Zorra' ",famosos,,,,,,
2018-05-03,https://web.archive.org/web/20180503083115/https://gshow.globo.com/Famosos/noticia/amor-de-bicho-maria-joana-apresenta-akim-e-declara-seu-amor-pelo-cachorrinho-meu-melhor-amigo.ghtml,https://gshow.globo.com/Famosos/noticia/amor-de-bicho-maria-joana-apresenta-akim-e-declara-seu-amor-pelo-cachorrinho-meu-melhor-amigo.ghtml,Amor de Bicho': Maria Joana apresenta Akim e declara seu amor pelo cachorrinho: 'Meu melhor amigo'," Quem acompanha as redes sociais de Maria Joana com certeza já prestou atenção em um personagem peludo que vez por outra aparece em alguns dos cliques que ela compartilha: é o fofíssimo Akim, o cachorrinho de estimação da atriz.  Aos 8 anos, o cãozinho é o xodó da família. Dá play no vídeo e confira!  Segundo a atriz, o bichinho entrou de repente em sua vida. ""Lembro que, uma vez, minha mãe falou que não tinha mais idade para ser mãe, só para ser avó (risos). Um pouco depois, uma amiga dela deu de presente o Akim, que chegou para alegrar as nossas vidas"", conta.  Maria Joana também faz questão de defender a adoção de animais: ""Sou muito a favor de adotar os bichinhos. Minha irmã tem uma gatinha adotada que se chama Vida e eu só levo o Akim para se tratar com a veterinária lá na Suipa (Sociedade Protetora dos Animais). Para quem não conhece, é uma instituição que cuida dos animais que são abandonados e todo o dinheiro arrecadado com esses atendimentos é revertido para ajudar os bichinhos"", explica. ",famosos,,,,,,
2018-05-10,https://web.archive.org/web/20180510085620/https://gshow.globo.com/Famosos/noticia/marcos-veras-faz-aniversario-e-lembra-de-comemoracao-que-quase-acabou-em-furada.ghtml,https://gshow.globo.com/Famosos/noticia/marcos-veras-faz-aniversario-e-lembra-de-comemoracao-que-quase-acabou-em-furada.ghtml,Marcos Veras faz aniversário e lembra comemoração que quase acabou em furada," Com uma carreira marcada pela versatilidade, Marcos Veras já mostrou que sabe se virar bem em qualquer situação. Ator, humorista, apresentador e locutor de rádio, ele tem o improviso como um dom que pode salvá-lo até nas situações mais inusitadas. No dia em que completa 38 anos, Veras lembra ao Gshow uma comemoração que tinha tudo para ser a maior furada. Assista!  ""Todos os aniversários são inesquecíveis, mas nesse aconteceram algumas coisas engraçadas"", começa ele, ao lembrar a comemoração que aconteceu em um bar há alguns anos. ""Era um bar de cervejas, e o gerente falou: 'Veras, faz aqui dentro porque lá fora vai chover'"", conta o ator, que, teimoso, se recusou a seguir o conselho. O resultado? ""Caiu um dilúvio no Rio de Janeiro!"" ☔  A solução para seguir com a festa foi improvisar: ""Começou a ir todo mundo para debaixo de um toldo, mas não coube todo mundo. O que a gente fez? Nós fomos numa obra do metrô na esquina e imploramos para o pessoal emprestar um toldo deles. Ou seja, passamos o aniversário debaixo de um toldo da Prefeitura, do lado de fora. Felizes, porém, molhados"", completa.  Com perrengue ou sem perrengue, o Veras está sempre de parabéns! Feliz aniversário e sucesso! 👏👏👏  Relembre trabalhos marcantes de Marcos Veras: ",famosos,,,,,,
2018-05-10,https://web.archive.org/web/20180510085620/https://gshow.globo.com/Famosos/noticia/regiane-alves-fica-loirissima-para-a-nova-novela-das-7-ainda-me-acostumando.ghtml,https://gshow.globo.com/Famosos/noticia/regiane-alves-fica-loirissima-para-a-nova-novela-das-7-ainda-me-acostumando.ghtml,Regiane Alves fica loiríssima para a nova novela das 7: 'Ainda me acostumando'," Regiane Alves como você nunca viu antes: a atriz está loiríssima! Ela, que estava morena desde seu papel na série Cidade Proibida, volta para as novelas platinada como Maria Carla, na próxima trama das 7, O Tempo Não Para.  A mudança radical na cor do cabelo foi longa, viu?! ""O processo durou 6 horas"", conta Regiane.  O Tempo Não Para é a nova novela das 7. Escrita por Mario Teixeira, a trama conta com colaboração de Bíbi Da Pieve, Marcos Lazarini e Tarcísio Lara Puiati, pesquisa de texto Yara Eleodora, direção artística de Leonardo Nogueira e direção geral de Marcelo Travesso e Adriano Melo. Estreia dia 31/7. ",famosos,,,,,,
