data,url_noticia,url_noticia_curto,titulo,conteudo_noticia,assunto,assunto_ex,titulo_ex,subtitulo_ex,local_ex,artigo_ex,n_paragrafos
2018-09-03,https://web.archive.org/web/20180903030615/https://globoesporte.globo.com/futebol/times/palmeiras/noticia/felipao-poe-palmeiras-na-briga-pelo-titulo-brasileiro-anuncia-reservas-contra-corinthians-e-da-recado-a-felipe-melo.ghtml,https://globoesporte.globo.com/futebol/times/palmeiras/noticia/felipao-poe-palmeiras-na-briga-pelo-titulo-brasileiro-anuncia-reservas-contra-corinthians-e-da-recado-a-felipe-melo.ghtml,"Felipão põe Palmeiras na briga pelo título brasileiro, anuncia reservas contra Corinthians e dá recado a Felipe Melo"," O técnico Luiz Felipe Scolari, o Felipão, vai escalar os reservas do Palmeiras no clássico contra o Corinthians, no próximo domingo, às 16h, na arena do Verdão, pelo Campeonato Brasileiro.  Após a vitória por 2 a 1 sobre a Chapecoense, neste domingo, em Santa Catarina, o Palmeiras ficou apenas seis pontos atrás do líder São Paulo. Felipão disse o time vai brigar pelo título nacional, mas, neste momento, dará prioridade os mata-matas na Copa do Brasil e Taça Libertadores.  – Estamos disputando o Brasileiro com a intenção de chegar lá na frente, mesmo que às vezes eu altere cinco ou seis posições. Temos jogadores que jogam muito bem. Vamos brigar pelo Brasileiro, sim, mas desde já quero dizer a vocês que, no jogo antes de Copa do Brasil e Libertadores, que são mata-matas, vamos mudar a equipe. Vamos jogar com o Corinthians com uma equipe diferente da que vamos jogar contra o Cruzeiro. Minha torcida já sabe e os dirigentes já sabem como é que vamos fazer no Brasileiro, na Copa do Brasil e na Libertadores – explicou Felipão.  + CLIQUE AQUI e leia mais sobre o Palmeiras  O Palmeiras chegou aos 40 pontos, em quinto lugar, com a vitória por 2 a 1 sobre a Chapecoense. Dos rivais diretos, apenas o Grêmio, também com 40, venceu na rodada. O São Paulo empatou com o Fluminense e foi a 46. O Internacional ficou no 0 a 0 com o Cruzeiro e subiu para 43, enquanto o Flamengo perdeu para o Ceará e parou nos 41.  + CLIQUE AQUI e veja a tabela do Brasileirão  Scolari falou pela primeira vez sobre a polêmica que envolveu Felipe Melo, expulso logo aos três minutos da partida contra o Cerro Porteño, pela Libertadores. O técnico reforçou que espera que o meio-campista apenas jogue futebol, como fez contra a Chape, dando assistência para Hyoran abrir o placar.  – Felipe Melo é um grande jogador. Vamos conversar sempre que pudermos para que ele jogue futebol e que apresente essa condição técnica que apresentou no jogo de hoje. É isso que o Palmeiras necessita. Não queremos mais que o Felipe seja lembrado por isso ou aquilo, mas, sim, pelo futebol. Tomara que continue e que a gente tenha essa sintonia com ele. ",esportes,,,,,,
2018-09-03,https://web.archive.org/web/20180903030615/https://globoesporte.globo.com/futebol/selecao-brasileira/noticia/militao-e-convocado-para-amistosos-do-brasil-na-vaga-de-fagner-cortado.ghtml,https://globoesporte.globo.com/futebol/selecao-brasileira/noticia/militao-e-convocado-para-amistosos-do-brasil-na-vaga-de-fagner-cortado.ghtml,"Militão é convocado para amistosos do Brasil na vaga de Fágner, cortado"," Após bom começo de ano com o São Paulo, Éder Militão chamou a atenção de Tite e agora vai receber uma oportunidade na seleção brasileira. O lateral-direito, que agora está no Porto, foi convocado para a vaga de Fágner, cortado, para os amistosos diante dos Estados Unidos e El Salvador, nos dias 7 e 11 de setembro, nos Estados Unidos.  Militão vai substituir Fágner, que havia sido convocado anteriormente. O lateral do Corinthians foi diagnosticado com uma lesão no músculo posterior da coxa esquerda e, dessa maneira, não teria condições de se estar presente nos compromissos da seleção.  Antes de se transferir para o Porto, o lateral-direito estava fazendo um bom Campeonato Brasileiro com o São Paulo. Agora no clube português, Militão mantém as boas atuações. Neste domingo, inclusive, o jogador participou de um gol na vitória do Porto sobre o Moreirense.  Neste fim de semana, a Seleção Brasileira já começou a se apresentar em Nova Jérsei, nos Estados Unidos, local do amistoso diante dos americanos, no dia 7. Logo na sequência, quatro dias depois, os comandados de Tite encaram o El Salvador, em Washington. ",esportes,,,,,,
2018-09-03,https://web.archive.org/web/20180903030615/https://globoesporte.globo.com/futebol/times/sao-paulo/noticia/sao-paulo-fara-reclamacao-formal-a-cbf-contra-o-arbitro-que-expulsou-diego-souza.ghtml,https://globoesporte.globo.com/futebol/times/sao-paulo/noticia/sao-paulo-fara-reclamacao-formal-a-cbf-contra-o-arbitro-que-expulsou-diego-souza.ghtml,São Paulo fará reclamação formal à CBF contra o árbitro que expulsou Diego Souza," O São Paulo vai fazer uma reclamação formal na CBF pela atuação do árbitro Dewson Freitas da Silva no empate por 1 a 1 com o Fluminense, neste domingo, no Morumbi, pelo Campeonato Brasileiro.  A diretoria do São Paulo considera que o árbitro exagerou ao expulsar Diego Souza aos 33 minutos do primeiro tempo por uma cotovelada em Léo. O camisa 9 recebeu o vermelho direto (veja o lance abaixo).  Tanto o técnico Diego Aguirre quanto os jogadores do São Paulo acreditam que a expulsão, considerada injusta por eles, atrapalhou os planos do time no jogo.  Depois de sair em desvantagem com gol contra de Anderson Martins, o São Paulo conseguiu o empate em gol de cabeça de Tréllez, no segundo tempo.  Ainda líder do Brasileirão, agora com 46 pontos, o São Paulo se prepara para encarar o Atlético-MG, em Belo Horizonte, na próxima quarta-feira, às 21h45.  + CLIQUE AQUI e leia mais sobre o São Paulo ",esportes,,,,,,
2018-09-03,https://web.archive.org/web/20180903030615/https://globoesporte.globo.com/pr/futebol/times/atletico-pr/noticia/tiago-nunes-elogia-atuacao-consistente-do-atletico-pr-contra-o-bahia.ghtml,https://globoesporte.globo.com/pr/futebol/times/atletico-pr/noticia/tiago-nunes-elogia-atuacao-consistente-do-atletico-pr-contra-o-bahia.ghtml,"Tiago Nunes elogia atuação ""consistente"" do Atlético-PR contra o Bahia"," O técnico Tiago Nunes gostou do resultado de 2 a 0 sobre o Bahia, na tarde deste domingo, mas também do comportamento do Atlético-PR. Para ele, o time teve consistência em todos os setores, que se traduz no domínio ofensivo, além de poucas dificuldades na parte defensiva.  O treinador também lembrou que o Atlético-PR não teve queda de rendimento no segundo tempo, quando fez as substituições. Um dos reservas, inclusive, fez o segundo gol do time. Rony, em seu primeiro jogo, marcou após receber o passe de Pablo.  - Uma das partidas mais consistentes. Sofremos pouco defensivamente e vamos ganhando de uma maneira boa. Tivemos boas substituições também, e isso para o treinador é muito bom, disse Tiago Nunes após a partida.  Veja como foi o jogo no Tempo Real  Confira a tabela completa do Brasileirão  Os números também atestam que o Atlético-PR foi muito superior ao Bahia durante todo o jogo. A equipe teve mais posse de bola: 61% a 39% e teve mais que o triplo de finalizações, com 25 tentativas contra apenas sete do adversário.  As bolas levantadas - 17 a 8 - também demontram que o Atlético-PR procurou mais esse tipo de jogada e que se destaca pela atuação dos laterais. Quando o Rubro-Negro iniciou a partida, o Bahia pressionava pelo meio, dificultava na marcação, mas não conseguiu conter os laterais Renan Lodi e Jonathan, que apoiaram o ataque com bolas levantadas e também finalizaram.  - A gente tem o Renan um jogador mais agressivo, e o Jonathan, um atleta mais experiente, que atua mais como um armador, um articulador, avaliou o treinador.  Tiago Nunes ainda completou com um elogio a Renan Lodi e demonstrou preocupação em que o lateral chame muita atenção de outras equipes.  - Renan é um expoente, mas não vou elogiar muito, porque daqui a pouco alguém leva ele embora, brincou.  Mais notícias do esporte paranaense no globoesporte.com/pr ",esportes,,,,,,
2018-09-03,https://web.archive.org/web/20180903030615/https://globoesporte.globo.com/motor/formula-1/livio-oricchio/noticia/lewis-hamilton-e-mercedes-vencem-com-ampla-ajuda-de-vettel-e-da-ferrari.ghtml,https://globoesporte.globo.com/motor/formula-1/livio-oricchio/noticia/lewis-hamilton-e-mercedes-vencem-com-ampla-ajuda-de-vettel-e-da-ferrari.ghtml,Lewis Hamilton e Mercedes vencem com ampla ajuda de Vettel e da Ferrari," Há quem pense ser fácil apontar erros de uma equipe de F1 depois das corridas. Verdade. Mas é importante trazer a público os equívocos identificados por profissionais da F1. Muitas vezes eles justificam plenamente o resultado.  Esse é o caso, sem dúvida, da Ferrari no GP da Itália neste domingo, com o Autódromo de Monza lotado, por acreditar que, diante da superioridade técnica do carro italiano, seus pilotos, Kimi Raikkonen ou Sebastian Vettel, primeiro e segundo no grid, celebraria a vitória, de grande importância na luta pelo título com Lewis Hamilton, da Mercedes.  Pois o que o novo presidente da Ferrari, John Elkhann, seu diretor, Louis Camilleri e o sócio e filho do fundador, Piero Lardi Ferrari, viram em Monza da largada à bandeirada, no fim da 53ª volta, foi um show de eficiência de Hamilton e sua escuderia. E uma sucessão impressionante de falhas do grupo da Ferrari como um todo.  Resultado: o piloto inglês venceu, com Raikkonen apenas em segundo, e, pior, Vettel, adversário de Hamilton na disputa do título, fora do pódio, quarto. O companheiro de Hamilton, o finlandês Valtteri Bottas, completou o pódio, em terceiro.  O GloboEsporte.com ouviu em Monza, por exemplo, Nico Rosberg, o único piloto a vencer Hamilton na luta pelo mundial. Foi em 2016, quando compartilharam a Mercedes.  - Não é assim que se ganha um campeonato, principalmente quando o adversário é Lewis (Hamilton). Sebastian precisa rever sua forma de enfrentá-lo. Hoje, como em outras ocasiões, Sebastian demonstrou não saber perder uma posição na corrida. Lewis já o havia ultrapassado quando se tocaram. Com o carro que tinha, Sebastian poderia ter caído para terceiro e manter ainda chances de vitória.  A mobilização e o desgaste de Rosberg para conquistar o título de 2016 foram tantos que ele, para grande surpresa de todos, até da direção da Mercedes, decidiu abandonar a F1.  Manobra decisiva  Rosberg se referia ao comportamento de Vettel, logo depois da largada, na segunda chicane da pista de 5.793 metros, a Variante della Roggia, com uma breve curva lenta para a esquerda e outra semelhante, em seguida, para a direita. Raikkonen estava em primeiro, Vettel, segundo, e Hamilton, terceiro. Como Vettel se posicionou por dentro para tomar a primeira curva, Hamilton foi por fora. Ele ficaria com a vantagem para a segunda curva da chicane, por ser à direita, onde estaria.  Raikkonen contornou a primeira curva sozinho e, logo atrás dele, Vettel e Hamilton fizeram o mesmo, mas lado a lado. Hamilton já tinha parte da sua Mercedes na frente da Ferrari de Vettel, em situação privilegiada para contornar por dentro a segunda curva e assumir o segundo lugar.  Mas o alemão, como descreveu Rosberg, se perde emocionalmente nessas horas. Tentou fechar a porta em uma situação onde não era mais possível, consequentemente colidiu seu aerofólio dianteiro na lateral esquerda da Mercedes de Hamilton, levando-o a rodar. Hamilton não teve nenhum dano maior no seu W09 e prosseguiu na corrida, agora em segundo. Vettel precisou regressar aos boxes para substitui o aerofólio dianteiro.  Sua sorte foi o safety car entrar na pista por causa de um acidente envolvendo Brendon Hartley, da STR, Marcus Ericsson, Sauber, e Stoffel Vandoorne, McLaren. Não fosse o ritmo mais lento de todos, Vettel dificilmente chegaria em quarto.  Curiosamente, Jackie Stewart, piloto três vezes campeão do mundo, disse ter conversado com Vettel antes da largada. Para o GloboEsporte.com, o escocês disse:  - Sebastian precisa entender que não precisa arriscar tudo em certos momentos, principalmente com o carro que tem nas mãos. Ele já havia feito algo semelhante antes.  Retrospecto comprometedor  De fato, este ano, no GP da Alemanha, Vettel liderava com boa vantagem. Hamilton, com problemas hidráulicos, havia largado em 14º. Mas a chuva e o safety car o ajudaram a encostar no pelotão da frente. Vettel não corria risco de ser atacado por Hamilton, em condições normais, mas sozinho atrasou demais a freada na segunda curva mais lenta de Hockenheim, no asfalto úmido, e colidiu contra a barreira de pneus. Jogou a vitória literalmente pela janela. Hamilton não apenas venceu como reassumiu a liderança do mundial.  No GP da França, Vettel avaliou mal a freada da primeira curva e bateu na traseira da Mercedes de Bottas. Os dois precisaram ir para os boxes. Vettel recebeu a bandeirada em quinto em outra vitória de Hamilton. No GP do Azerbaijão, na relargada do safety car, tentou ganhar, de uma vez, as colocações de Max Verstappen e Daniel Ricciardo, da RBR, no fim da grande reta. Atrasou tanto a freada que seguiu em frente. Tinha carro para vencer. Acabou em quarto.  Está claro, portanto, que o primeiro erro da Ferrari veio de Vettel, na sua pior temporada na F1 depois da de 2014, quando perdeu a disputa para Daniel Ricciardo, na RBR, por boa margem.  Outra opção da Ferrari no mínimo questionável foi não intervir na disputa entre os seus pilotos. O GloboEsporte.com perguntou ao próprio Raikkonen se houve alguma orientação da equipe quanto a como se comportar na primeira chicane, depois da largada, ou primeira volta. Fazer o jogo de equipe que a Mercedes fez e ajudou bastante Hamilton vencer neste domingo.  - Nós temos regras claras, sabemos o que podemos e não podemos fazer.  Inocência italiana  A resposta de Raikkonen demonstra não ter havido nenhum pedido quanto a ele e Vettel disputarem a liderança em seguida à largada.  O finlandês travou os pneus para se manter em primeiro. Não em razão da ameaça de Hamilton, mas de Vettel. O esboço do alemão de tentar ultrapassar Raikkonen o levou a não contornar a primeira chicane na trajetória e velocidade ideais e possíveis. Hamilton, terceiro, aproveitou-se disso para entrar no vácuo da Ferrari e tentar a ultrapassagem na próxima freada, na Variante della Roggia, como acabou acontecendo.  Enquanto a direção da Ferrari, sob a liderança de Maurizio Arrivabene, não impôs ordem de equipe para Vettel e Raikkonen na largada, a Mercedes não escondeu de ninguém sua estratégia. O especialista do time, James Vowles, pediu no rádio a Bottas para fazer o possível para manter Raikkonen atrás de si.  Foi quando Hamilton fez seu pit stop, na 28ª volta. Raikkonen havia parado na 20ª volta e Bottas, ainda não. Com pneus macios novos, o finlandês se aproximava de Bottas. Hamilton saiu dos boxes depois de Raikkonen. A diferença entre eles era de 6s425 na volta seguinte.  Bottas executou a ordem de equipe com perfeição. Quando ele entrou nos boxes para o seu pit stop, na 36ª volta, Hamilton estava somente 1s009 atrás de Raikkonen. A luta valia a liderança do GP da Itália, diante de 90 mil torcedores, a maioria fanática pela Ferrari, do líder Raikkonen.  Recapitulando: os dois haviam largado com os pneus supermacios usados na classificação. Raikkonen fez seu pit stop na 20ª volta, 33 antes da bandeirada, e voltou à pista com os pneus macios novos. A Pirelli distribuiu em Monza os médios também. Hamilton, parou na 28ª volta e tinha agora, também, macios novos. Estamos na volta 36 e restam 17 para o final.  Repare que enquanto o jogo de equipe levou Hamilton a se posicionar para tentar a ultrapassagem em Raikkonen e vencer o GP da Itália, a Ferrari, que tanto gosta de ordem de equipe, não a adotou entre Raikkonen e Vettel na largada, por exemplo. Se Vettel passa para primeiro na primeira chicane, Raikkonen não reage à tentativa do companheiro, as chances de vitória de Vettel eram enormes. O ritmo que ele impôs depois de parar no fim da primeira volta, para substituir o aerofólio dianteiro, foi impressionante.  Representaria um atentado ao esporte? Sim, inquestionavelmente. Mas o regulamento permite e a Mercedes usou o jogo de equipe para vencer e Hamilton ampliar a diferença de 17 para 30 pontos entre ele, ainda mais líder do mundial, e Vettel: 256 a 226. A vantagem começa a se tornar preocupante, pois mesmo que no GP de Singapura, próximo do ano, 15º do calendário, dia 16, Vettel vença e Hamilton não faça pontos, o inglês da Mercedes mantém-se em primeiro. Há 25 pontos em jogo e a diferença, como mencionado, é de 30.  Ainda não acabou  Ok, Vettel errou e a Ferrari não explorou a ordem de equipe como a Mercedes. Mas por que Raikkonen, que tinha o carro mais rápido do fim de semana, de repente perdeu performance para a Mercedes?  Hamilton o ultrapassou na freada da primeira chicane, na 45ª volta, com o uso do DRS, o flap móvel.  Àquela altura da prova, Raikkonen digladiava com sua Ferrari SF71H por conta de haver evidentes blisters (bolhas) nos pneus traseiros, notadamente no esquerdo. Perdia desempenho a cada volta. Nunca é demais lembrar que Raikkonen se caracteriza por submeter os pneus a esforços menores que a maioria. Se ele enfrentou a dificuldade, com outros pilotos sua manifestação seria ainda mais severa.  Raikkonen explicou o motivo:  - Problema com o acerto (ajuste para a pista) do carro.  Um dos pontos de força do modelo atual da Ferrari, com já era o de 2017, é a forma equilibrada como explora as características dos pneus Pirelli. Não foram poucas as corridas em que os italianos venceram por conta dessa eficiência, bem ao contrário da Mercedes, o calcanhar de Aquiles de seu projeto no ano passado, em especial quanto aos mais macios. Este ano evoluíram, sem resolver totalmente o problema.  Neste domingo, na casa da Ferrari, o grupo de engenheiros de Raikkonen, liderado por Carlo Santi, não realizou um bom trabalho. O finlandês tinha boas chances de vencer se não tivesse blisters nos pneus traseiros, decorrente de um ajuste mecânico e aerodinâmico não eficiente, como o de Vettel, por exemplo, com o mesmo carro.  Fez as contas? Pilotos que já venceram o campeonato apontaram erro de Vettel na colisão com Hamilton na primeira volta. O desenvolvimento da corrida evidenciou que a não adoção do jogo de equipe, como fez a Mercedes, da mesma forma interveio diretamente no resultado. Por fim, a definição do acerto mecânico-aerodinâmico do carro de Raikkonen o levou a degradar os pneus.  Além de Vettel se distanciar de Hamilton, a Ferrari também ficou um pouco mais longe da Mercedes no Mundial de Construtores. A diferença cresceu 10 pontos, está agora 415 a 390.  Piloto, sempre fundamental  O que estamos assistindo este ano na temporada é uma prova, definitiva, de que a importância do piloto na F1, diferentemente do que muitos pensam, ainda é bastante grande. Decisiva. E a gestão da equipe, também, tem peso enorme na possibilidade de conquistas.  Hamilton, quatro vezes campeão, está no seu melhor ano na F1. Vettel, tetracampeão, em um dos seus piores, conforme os números mostram.  Não explorar o que as regras permitem, sem entrar no mérito da sua esportividade, como fez a Mercedes, e até o erro no carro de Raikkonen, na hora mais inapropriada possível, expõe a gestão deficiente da Ferrari.  Mas ainda há muito chão pela frente, sete etapas. E, como Hamilton sabe, a vantagem técnica da Ferrari é considerável. Sua missão nas próximas corridas não será diferente da que estamos assistindo desde o GP do Canadá, sétimo do ano: posicionar-se o mais perto possível de Vettel e aproveitar todas as oportunidades que surgirem para surpreendê-lo. Não foi de outra forma que Hamilton venceu, desde então, na França, Alemanha, Hungria e neste domingo, Itália.  Quando Vettel e a Ferrari exploraram o que têm nas mãos, o excepcional chassi SF71H, equipado com uma unidade motriz notável, como no Canadá, Inglaterra e Bélgica, Hamilton não teve chance alguma. Vettel foi primeiro nas três.  Os carros voltam à pista, agora, dia 14, no primeiro treino livre do GP de Cingapura, prova noturna do calendário, sempre sob calor intenso e elevada possibilidade de chuva. ",esportes,,,,,,
2018-09-04,https://web.archive.org/web/20180904053123/https://sportv.globo.com/site/programas/bem-amigos/noticia/paqueta-por-dentro-richarlison-de-9-auxiliar-de-tite-analisa-novatos-da-selecao.ghtml,https://sportv.globo.com/site/programas/bem-amigos/noticia/paqueta-por-dentro-richarlison-de-9-auxiliar-de-tite-analisa-novatos-da-selecao.ghtml,Paquetá por dentro? Richarlison de 9? Auxiliar de Tite analisa novatos da Seleção," A segunda-feira marcou o novo ciclo da seleção brasileira. Em Nova Jersey, nos Estados Unidos, Tite recebeu o grupo cheio de novidades. Mas a pergunta é: qual a ideia da comissão técnica a respeito dos jovens jogadores que serão observados nos dois amistosos?  Durante participação no ""Bem, Amigos!"" desta segunda, Cleber Xavier, auxiliar de Tite, conversou com Mauro Naves e analisou os quatro estreantes que já deram coletiva com a camisa da Seleção: Andreas Pereira, Éverton, Lucas Paquetá e Richarlison.  - Esses meninos que vieram hoje, que deram entrevitas, estão num grande momento. Éverton Paquetá... O Andreas é um meia trabalhando como primeiro, num desenho do Mourinho semelhante ao nosso. Gostamos das autações dele, por isso está aqui. Richarlison já jogou por dentro e joga muito pelo lado. Grande estreia e jogos no Everton. Pode trabalhar nas duas funções, mas a princípio a gente coloca para trabalhar por dentro - disse Cleber.  O auxiliar ainda destacou uma comparação em especial: Philippe Coutinho e Lucas Paquetá. Na ideia da comissão, segundo Cleber, o jogador do Flamengo chega para jogar por dentro.  - (Coutinho e Paquetá) são dois jogadores, um que já provou e um que está surgindo, têm condições de jogar nos mesmos espaços, embora com características diferentes. Podem jogar pelo lado, como interno pelo lado esquerdo como Coutinho joga com a gente, jogou no Liverpool e está agora no Barcelona. Entendemos manter o Coutinho ali, e também o Paquetá, por dentro. ",esportes,,,,,,
