data,url_noticia,url_noticia_curto,titulo,conteudo_noticia,assunto,assunto_ex,titulo_ex,subtitulo_ex,local_ex,artigo_ex,n_paragrafos
2020-02-17,https://web.archive.org/web/20200217000020/https://globoesporte.globo.com/futebol/futebol-internacional/futebol-espanhol/noticia/antes-apresentacao-oficial-reinier-acompanha-empate-do-real-madrid-no-santiago-bernabeu.ghtml,https://globoesporte.globo.com/futebol/futebol-internacional/futebol-espanhol/noticia/antes-apresentacao-oficial-reinier-acompanha-empate-do-real-madrid-no-santiago-bernabeu.ghtml,"Antes de apresentação oficial, Reinier acompanha empate do Real Madrid no Santiago Bernabéu"," Menos de 24 horas depois de desembarcar em Madri, Reinier foi se ambientar com o local onde será sua casa nos próximos anos. O ex-meia-atacante do Flamengo acompanhou o empate por 2 a 2 entre Real Madrid e Celta de Vigo nas tribunas do estádio Santiago Bernabéu, na capital espanhola.  + VEJA A TABELA DO ESPANHOL  O jovem, de 18 anos, estava acompanhado do pai, Mauro Brasília, a mãe, Suzana Jesus, e a irmã, Júlia. Contratado por 30 milhões de euros (R$ 139 milhões, na cotação atual) junto ao Flamengo, Reinier será apresentado oficialmente na próxima terça-feira com o protocolo normal: entrevista coletiva e portões abertos no Santiago Bernabéu para a torcida.  Reinier usará a camisa 19 no novo clube, mas seguirá o mesmo caminho de Vinicius Junior e Rodrygo. Começará no Castilla, time B do Real Madrid, treinado pelo ex-atacante Raúl.  O brasileiro, inclusive, acompanhou na televisão o jogo deste sábado do Castilla contra o Rayo Majadahonda, pela Terceira Divisão da Espanha e postou nas redes sociais uma comemoração do primeiro gol da equipe merengue.  O ex-jogador do Flamengo deve estrear pelo Castilla no próximo domingo, contra o San Sebastián de los Reyes, no estádio Alfredo di Stéfano, em Valdebebas, no centro de treinamentos do Real Madrid. ",esportes,,,,,,
2020-02-18,https://web.archive.org/web/20200218000009/https://globoesporte.globo.com/futebol/futebol-internacional/liga-dos-campeoes/noticia/imprevisivel-champions-retorna-nas-oitavas-de-final-sem-favoritacos-ao-titulo.ghtml,https://globoesporte.globo.com/futebol/futebol-internacional/liga-dos-campeoes/noticia/imprevisivel-champions-retorna-nas-oitavas-de-final-sem-favoritacos-ao-titulo.ghtml,Imprevisível: Champions retorna nas oitavas de final sem favoritaços ao título," Após pouco mais de dois meses de espera, a Liga dos Campeões está finalmente de volta. Borussia Dortmund x PSG e Atlético de Madrid x Liverpool abrem as oitavas de final nesta terça-feira. Por sinal, uma das edições mais imprevisíveis dos últimos tempos. Listamos oito motivos para mostrar que é difícil apontar um favorito ao título nesta temporada e que o começo do mata-mata já pode “bugar” casas de apostas pelo mundo.  + VEJA A TABELA DA CHAMPIONS  Nós não conseguimos. E as casas de apostas também parecem reticentes. Analisamos três em que há cotações para o campeão neste momento da temporada – em duas o Manchester City é visto como o favorito, pagando 5 reais para cada real investido. Mas a diferença para o segundo é praticamente irrisória: o atual campeão Liverpool aparece com a cotação de 5.50 para um.  Em seguida aparecem o Barcelona de Messi (7/1), o Paris Saint-Germain de Neymar (8/1), o Bayern de Lewandowski (8/1), a Juventus de Cristiano Ronaldo (11/1), o papa-títulos Real Madrid (17/1), o vice-campeão Tottenham (23/1) e por aí vai, até chegar à maior zebra de todas, o Lyon (251/1). Pelo custo-benefício da aposta, em quem você colocaria dinheiro neste momento? Difícil, né?  O Barcelona vive uma de suas piores crises institucionais nos últimos tempos. Há poucas semanas, Messi fez a poeira subir ao postar nas redes sociais uma resposta a um comentário do secretário-técnico Abidal, que sugeriu corpo mole por parte dos jogadores no fim da Era Valverde.  Na segunda-feira, a rádio ""Cadena SER"" fez a denúncia de que a diretoria teria contratado uma empresa para defender o presidente Josep Maria Bartomeu e criticar alguns jogadores nas redes sociais.  Tudo veio depois de a diretoria não contratar nenhum atacante mesmo após a grave lesão de Suárez. Para piorar, Dembélé também se machucou, e o Barça terá até o fim da temporada apenas 16 jogadores do elenco principal aptos para jogar, precisando recorrer a jovens do time B para completar o banco.  Com as opções contadas, Quique Setién precisará fazer o time jogar muito mais para pleitear este título – ou Messi jogar ainda melhor do que na temporada passada, quando quase carregou o clube à decisão. Nenhuma das duas opções parece muito provável neste momento.  O Real Madrid parece ter menos problemas e mais soluções que o seu arquirrival, mas ainda não inspira tanta confiança – você pode argumentar que, em pelo menos dois dos três anos de títulos, o cenário não era lá muito diferente. Ok. Ainda assim, a impressão é que Zidane não pode rodar tanto o seu elenco que o desempenho cai. Ter todos os titulares contra o Manchester City será fundamental.  É bem verdade que o Liverpool lidera o Campeonato Inglês com 25 pontos de vantagem sobre o Manchester City (e um jogo a mais). E também que o título deve ser confirmado em março, antes mesmo das quartas de final. Mas o fator “prioridade” é fundamental nesta análise.  O Liverpool nunca venceu uma Premier League (criada em 1992). Não ganha um Campeonato Inglês desde 1990. Neste período, faturou duas Champions, em 2005 e 2019. Ninguém vai reclamar se faturar os dois troféus, é claro, mas na escala de preferências para esta temporada, o torneio nacional vem acima.  Além disso, há diversos recordes em jogo, um deles de invencibilidade em todas as rodadas, para transformar a campanha em algo ainda mais histórico e eterno (veja nesta matéria do início do mês).  O Liverpool tem 103 pontos dos últimos 105 disputados na Premier League, contando a temporada passada. É sua obsessão.  Falar sobre imprevisibilidade é falar também sobre azar. E sorte. Você diria que a Atalanta, com um ponto na quarta rodada da primeira fase, passaria? Pois avançou e agora pega o Valencia que, ao lado do Lyon, são os times em pior fase entre os 16 das oitavas. O time de Bérgamo venceu três de seus últimos quatro jogos no Italiano e é o quarto no torneio.   O Leipzig estreia no mata-mata da Liga dos Campeões também como um azarão. Mas com o peso de ser um dos candidatos a desbancar a hegemonia do Bayern de Munique na Alemanha. E com os 25 gols de Timo Werner na temporada. Pega o atual vice-campeão Tottenham, comandado por um técnico ""especial"" e bicampeão da Champions: José Mourinho.  Imagine que Atalanta e Leipzig passam. E que o sorteio das quartas de final os coloque juntos. Um deles já estaria na semifinal. Pode acontecer.  Toda a cautela do PSG tem motivo: pela primeira vez, o clube pode ter Neymar inteiro no mata-mata da Liga dos Campeões.  Em 2018, o brasileiro se lesionou depois do jogo de ida das oitavas com o Real Madrid. Em 2019, ele sequer esteve em campo contra o United. Agora, por conta de dores na costela, foi poupado de quatro jogos. Tudo para jogar nesta terça contra o Dortmund.  Com Neymar e Mbappé, o Paris tem uma dupla de ataque dos sonhos. E pode sonhar alto. Até porque o brasileiro faz sua segunda melhor temporada desde que chegou à Europa: tem um gol ou passe para gol a cada 64 minutos.  A média só é pior do que 2017/18, no primeiro ano em Paris, quando tinha uma participação em gol a cada 60 minutos. É a chance de ouro para o brasileiro ser protagonista. E para o PSG se infiltrar entre os gigantes do continente.  Neymar nesta temporada:  É difícil eleger um grande favorito. Mas é fácil apontar quem está mais pressionado pelo título: Pep Guardiola. Em sua quarta temporada no Manchester City, esta deve ser a última chance para o treinador espanhol dar o título inédito ao clube. E ele admite que o cargo seria ameaçado com uma eliminação.  A pressão já era alta. Aumentou na última semana, quando os Citizens foram punidos pela Uefa e excluídos da Liga dos Campeões das duas próximas temporadas. O contrato de Guardiola com a equipe vai até 2021 e, com a sanção, ele dificilmente renovará.  O tricampeonato seguido da Premier League é (quase) impossível. O City está mordido após a punição imposta pela Uefa. Chegou a hora de fazer uma campanha grandiosa no continente.  Semifinalista de quatro das últimas seis edições, o Bayern de Munique nunca pode ser descartado. O time alemão trocou de técnico no meio da temporada (Hansi Flick no lugar de Niko Kovac), assumiu a ponta na Bundesliga e aos poucos retoma sua rotina.  Mas falta uma campanha de destaque na Liga dos Campeões. No ano passado, caiu nas oitavas para o campeão Liverpool. Desta vez, os bávaros passaram com a melhor campanha da história na fase de grupos e têm Lewandowski em sua (eterna?) grande fase, com 36 gols em 31 jogos na temporada.  O rival não é simples, mas vive um ano de reconstrução. O Chelsea assume uma nova cara com Lampard, aposta em jovens, não pôde contratar na última janela do verão europeu e se prepara para o futuro. Mesmo assim, está no G-4 do Inglês.  Duvide de quem não considerar a Juventus uma das favoritas por conta de seu desempenho coletivo hesitante. E claro que qualquer argumento a favor da Velha Senhora passa por Cristiano Ronaldo. O maior artilheiro da história da Liga dos Campeões está em sua melhor fase desde que chegou a Turim.  Ele está a quatro gols de atingir sua marca da temporada passada. E ainda estamos na metade. São 18 gols nos últimos 14 jogos. Mas, por enquanto, o camisa 7 tem apenas dois no torneio continental. Em 2017 ele chegou ao mata-mata com a mesma quantidade... E terminou com 12 gols. E campeão.  Cristiano Ronaldo é o primeiro jogador a marcar por 10 jogos consecutivos em duas das cinco maiores ligas da Europa.  Cristiano Ronaldo é o único jogador a fazer isso na Liga dos Campeões. ",esportes,,,,,,
2020-02-18,https://web.archive.org/web/20200218000009/https://globoesporte.globo.com/futebol/times/flamengo/noticia/sem-gabigol-e-leo-pereira-flamengo-divulga-relacionados-para-recopa-sul-americana-veja-lista.ghtml,https://globoesporte.globo.com/futebol/times/flamengo/noticia/sem-gabigol-e-leo-pereira-flamengo-divulga-relacionados-para-recopa-sul-americana-veja-lista.ghtml,"Sem Gabigol e Léo Pereira, Flamengo divulga relacionados para Recopa Sul-Americana; veja lista"," O Flamengo divulgou na tarde desta segunda-feira a lista de relacionados para a primeira partida contra o Independiente del Valle, na quarta, válida pela Recopa Sul-Americana. Ao todo, 25 jogadores viajam para Quito, no Equador.  Gabigol e Léo Pereira são os dois únicos desfalques para o confronto. O atacante terá que cumprir suspensão pela expulsão na final da Libertadores do ano passado, contra o River Plate. E o zagueiro se recupera de uma lesão na parte posterior da coxa esquerda. Ambos retornaram para o Rio de Janeiro nesta segunda.  + Com carinho da torcida, Flamengo embarca para Quito  Além deles, os atletas Hugo Souza, Rafael Santos, Hugo Moura, Lucas Silva, Pepê e Berrío ficaram fora da lista por opção da comissão técnica.  Flamengo e Independiente del Valle se enfrentam nesta quarta-feira, às 21h30 (de Brasília), em Quito. O jogo de volta está marcado para o dia 26, no Maracanã.  Veja os relacionados: ",esportes,,,,,,
2020-02-18,https://web.archive.org/web/20200218000009/https://globoesporte.globo.com/futebol/times/flamengo/noticia/tjd-rj-julgara-o-flamengo-na-proxima-quinta-feira-por-gritos-homofobicos-contra-o-fluminense.ghtml,https://globoesporte.globo.com/futebol/times/flamengo/noticia/tjd-rj-julgara-o-flamengo-na-proxima-quinta-feira-por-gritos-homofobicos-contra-o-fluminense.ghtml,TJD-RJ julgará o Flamengo na próxima quinta-feira por gritos homofóbicos contra o Fluminense," O Tribunal de Justiça Desportiva do Estado do Rio de Janeiro (TJD-RJ) julgará às 16h da próxima quinta-feira o Flamengo pelos gritos homofóbicos no clássico contra o Fluminense do dia 12 de fevereiro, válido pela semifinal da Taça Guanabara.  + Flamengo será o primeiro clube julgado por cântico homofóbico no Rio  A denúncia foi realizada pelo procurador Luís César, e o Flamengo foi enquadrado nos artigos 243-G e 191(três vezes: pela violação ao Regulamento Geral das Competições, ao Código Disciplinar da Fifa e pelo Estatuto do Torcedor) do Código Brasileiro de Justiça Desportiva (CBJD), que dizem: ",esportes,,,,,,
2020-02-19,https://web.archive.org/web/20200219023543/https://globoesporte.globo.com/futebol/times/botafogo/noticia/com-presenca-de-montenegro-botafogo-tentara-acerto-com-yaya-toure-em-reuniao-em-paris.ghtml,https://globoesporte.globo.com/futebol/times/botafogo/noticia/com-presenca-de-montenegro-botafogo-tentara-acerto-com-yaya-toure-em-reuniao-em-paris.ghtml,"Com presença de Montenegro, Botafogo tentará acerto com Yaya Touré em reunião em Paris"," A cidade de Paris será palco da reunião que pode terminar com Yaya Touré assinando contrato com o Botafogo. Clube e jogador irão se encontrar na capital da França na próxima quinta-feira para tentar selar o acordo. As conversas serão lideradas pelo ex-presidente Carlos Augusto Montenegro.  Touré já tem em mãos a proposta do Botafogo e estuda os números junto dos representantes. O Botafogo espera que a reunião de quinta seja definitiva e está otimista por um acerto. Mas, ainda não há posição clara por parte do jogador, que está livre no mercado.  + Opinião: por mais Hondas e Yayas  Porém, alguns sinais animam a diretoria. Como o papo entre Touré e o técnico Paulo Autuori. O volante conversou com o possível novo chefe e, segundo pessoas próximas, gostou do que ouviu sobre o clube. Também anima a parceria com outro jogador de fama internacional, o japonês Keisuke Honda.  Montenegro passa férias na Ásia, de onde seguirá direto para a capital francesa especialmente para o encontro com o volante de 36 anos. Para fechar com Touré, o Botafogo contará com a ajuda de investidores para bancar a transação. Entre eles o youtuber Felipe Neto e o humorista Marcelo Adnet.  O modelo que está na mesa é bem parecido com o que seduziu Honda. O clube não consegue pagar um salário fixo alto, mas oferece variáveis que podem deixar o contrato gordo. O que inclui participação em patrocínios, venda de camisas e aumento do número de sócios-torcedores. Touré, no entanto, pediu mais do que o japonês recebe.  Da parte alvinegra, a conversa é liderada por Montenegro e pelo vice-presidente comercial e de marketing do clube, Ricardo Rotenberg. Ambos fazem parte do Comitê Executivo de Futebol, que ainda inclui o presidente Nelson Mufarrej e outros membros da diretoria.  TUA ESTRELA SOLITÁRIA NOS CONDUZ... FAÇA PARTE: CLIQUE AQUI! ",esportes,,,,,,
2020-02-19,https://web.archive.org/web/20200219023543/https://globoesporte.globo.com/futebol/futebol-internacional/liga-dos-campeoes/noticia/haaland-atinge-novo-recorde-na-champions-e-comemora-atuacao-contra-o-psg-zensacional.ghtml,https://globoesporte.globo.com/futebol/futebol-internacional/liga-dos-campeoes/noticia/haaland-atinge-novo-recorde-na-champions-e-comemora-atuacao-contra-o-psg-zensacional.ghtml,"Haaland atinge novo recorde na Champions e comemora atuação contra o PSG: ""ZENsacional"" "," Ele ofuscou Neymar e Mbappé. O brasileiro até voltou aos campos pelo PSG após quatro jogos com gol. Mas só se fala em Haaland. E não é para menos. A joia norueguesa do Borussia Dortmund marcou os dois gols da vitória contra os franceses por 2 a 1, pelas oitavas de final da Liga dos Campeões, e atingiu novo recorde: é o jogador mais rápido da história a atingir 10 gols no torneio.  O atacante precisou de sete jogos para chegar aos seus 10 gols. Ele superou Adriano Imperador, Firmino e Mané, que detinham o recorde anterior. Os dois brasileiros e o senegalês marcaram 10 gols na Liga dos Campeões em 11 partidas.  + Ele acorda todos os dias com o hino da Champions: conheça mais sobre Haaland  Haaland agora divide a artilharia da atual edição da Liga dos Campeões com Lewandowski, do Bayern de Munique. A noite mágica rendeu um post para o atacante norueguês de 19 anos:  + VEJA A TABELA DA LIGA DOS CAMPEÕES+ Neymar revela insatisfação por ter sido poupado pelo PSG: ""Acaba sendo ruim para mim""  A comemoração, que virou uma marca, tem explicação. Ele é praticante da meditação. Haaland chegou aos 11 gols em sete jogos com a camisa do Borussia Dortmund. São 11 gols em 440 minutos jogados no clube, o que lhe dá uma média de um gol a cada 40 minutos no time alemão.  Ele tornou-se o primeiro jogador da história a marcar por duas equipes diferentes em uma mesma temporada da Liga dos Campeões. Ele anotou oito gols pelo RB Salzburg na fase de grupos e marcou mais dois com o Dortmund nesta terça. Até 2018, a Uefa não permitia que um atleta atuasse em uma mesma edição de um torneio por duas equipes distintas.  Confira alguns números do atacante, que é o artilheiro da Europa na temporada:  Carreira profissional de Erling Haaland em números até agora:  Uma máquina de fazer gols  Erling Haalnd marcou 39 gols por todas as competições que disputou até agora.  Erling Haaland é o primeiro jogador da história a marcar um gol por duas equipes diferentes na mesma temporada na Liga dos Campeões ",esportes,,,,,,
2020-02-19,https://web.archive.org/web/20200219023543/https://globoesporte.globo.com/futebol/libertadores/noticia/libertadores-independiente-vence-atletico-tucuman-em-medellin-e-sai-em-vantagem.ghtml,https://globoesporte.globo.com/futebol/libertadores/noticia/libertadores-independiente-vence-atletico-tucuman-em-medellin-e-sai-em-vantagem.ghtml,Libertadores: Independiente vence Atlético Tucumán em Medellín e sai em vantagem," O Independiente Medellín largou na frente na briga com o Atlético Tucumán por uma vaga no Grupo H da Libertadores. A equipe colombiana recebeu o time argentino na noite desta terça-feira no Atanasio Girardot, em Medellín, e venceu pelo placar mínimo: 1 a 0.  + VEJA A TABELA DA LIBERTADORES  O gol da vitória do DIM saiu aos 15 minutos do primeiro tempo, nos pés do capitão, o camisa 10 Recaurte. Ele recebeu bom passe de Gómez, dominou na entrada da área e finalizou bem com a perna esquerda.  Com o resultado, o Independiente Medellín joga por um empate no jogo de volta para ficar com a vaga. Caso marquem um gol na Argentina, os colombianos avançam mesmo com derrota por um gol de diferença.  O jogo de volta é na próxima terça, dia 25, no Monumental José Fierro, em Tucumán, na Argentina. Quem se classificar entra no Grupo H da Libertadores, que conta com Boca Juniors, Caracas e Libertad. ",esportes,,,,,,
2020-02-20,https://web.archive.org/web/20200220040013/https://globoesporte.globo.com/futebol/times/botafogo/noticia/apos-classificacao-do-botafogo-autuori-dedica-triunfo-a-espinosa-e-valentim-eu-nao-fiz-nada.ghtml?utm_source=Twitter&utm_medium=Social&utm_campaign=ge_botafogo,https://globoesporte.globo.com/futebol/times/botafogo/noticia/apos-classificacao-do-botafogo-autuori-dedica-triunfo-a-espinosa-e-valentim-eu-nao-fiz-nada.ghtml?utm_source=Twitter&utm_medium=Social&utm_campaign=ge_botafogo,"Autuori confirma conversa e revela empolgação de Yaya Touré com o Botafogo: ""Muito animado"""," O técnico Paulo Autuori confirmou nesta quarta-feira que conversou com o volante Yaya Touré, possível reforço do Botafogo. No contato, informado pelo GloboEsporte.com, o treinador revelou que o marfinense ""está muito animado"" com a possibilidade de jogar no Brasil, mas também ouviu sobre os problemas do nosso futebol.  - Falei com ele. É importante o treinador falar com o jogador. Assim como quando estava no Athletico-PR também conversei com o Lucho González. Para trazer um jogador desses, é importante o treinador mostrar que confia, que vai vir para jogar. Tirando isso, só vou falar dele quando estiver concretizado - disse.  Após o contato, Autuori espera pelo desfecho da negociação, que pode sair nesta quinta-feira. Representante do Botafogo, o ex-presidente Carlos Augusto Montenegro está a caminho de Paris, onde tem encontro marcado com Touré e os representantes do atleta. Cresceu o otimismo na diretoria, que espera que o contrato seja assinado nas próximas horas.  A confirmação da conversa entre técnico e possível comandado foi dada por Autuori após a classificação do Botafogo à terceira fase da Copa do Brasil. Depois do empate contra o Náutico, no Estádio dos Aflitos, o comandante dedicou a conquista da vaga ao gerente de futebol Valdir Espinosa e ao ex-técnico do clube Alberto Valentim, demitido há duas semanas.  - Quero dedicar essa passagem a duas pessoas. Primeiro ao nosso querido Valdir Espinosa. Campeão, é sua. Feliz em saber que está bem. Esperamos você. A outra é Alberto Valentim. Eu não fiz absolutamente nada, apenas aproveitei o que o Alberto fez de bom. Todo treinador, esteja a ganhar ou não, deixa coisas positivas.  Com atenções voltadas para Touré e a classificação na bagagem, o Botafogo volta ao Rio de Janeiro na tarde desta quinta-feira. O próximo jogo é no dia 1º de março, contra o Boavista, pela primeira rodada da Taça Rio. Na Copa do Brasil, ainda sem data confirmada, o Alvinegro terá pela frente o vencedor do duelo entre Paraná e Bahia de Feira.  Análise do jogo  Jogo difícil. Já sabíamos. O Náutico está animado por tudo que tem feito. Sabíamos que é uma equipe competitiva, que joga com algumas movimentações que já sabíamos. Não podemos tomar aquele gol, pois já sabíamos que ia acontecer. Sofremos, mas gostei da equipe. Subiu a marcação, foi agressiva. Tentou finalizar mais do que tem feito. Jogou mais no campo do adversário.  Pênaltis  Estava tudo definido. Jamais entro em uma situação como essa no ""vamos, vamos"". Temos os batedores, os outros que podem bater. Com o Gatito, o Flavio (Tênius, preparador de goleiros) informou tudo a ele. Parabéns a ele e à equipe, foi um jogo difícil.  Cícero no ataque  Tínhamos uma estratégia clara e era um jogo importante. Precisava de alguém com força mental, vivência, experiência. Se entra um jovem, pode ser julgado. Assim é o futebol brasileiro, acontece esse desperdício.  Estreia de Honda  Elogio ao time  Eles me mostraram algumas coisas que a gente tentou orientar. Foi pouco tempo para treino. Tinham alguns dias, e colocam o jogo em uma data como essa, que quase não temos voos por conta do Carnaval. Fizeram de uma hora para outra. Essas coisas precisam ser faladas. Só falar se o jogador jogou bem ou jogou mal ou se o técnico mexeu bem ou mexeu mal é fácil. É preciso tocar em pontos importantes.  Avanço na Copa do Brasil  Importante para o clube. Os valores envolvidos na Copa do Brasil são significativos. Como a maioria dos clubes está em dificuldade, a Copa do Brasil fica ainda mais importante. E acho lindo que estamos desacreditados. Temos que trabalhar, e eles trabalharam. Ainda precisamos agregar mais coisas. Se não mudarem outra data, só vamos jogar contra o Boavista.  TUA ESTRELA SOLITÁRIA NOS CONDUZ... FAÇA PARTE: CLIQUE AQUI! ",esportes,,,,,,
