data,url_noticia,url_noticia_curto,titulo,conteudo_noticia,assunto,assunto_ex,titulo_ex,subtitulo_ex,local_ex,artigo_ex,n_paragrafos
2018-08-30,https://web.archive.org/web/20180830024849/https://g1.globo.com/politica/noticia/2018/08/29/ministro-joao-otavio-de-noronha-toma-posse-como-novo-presidente-do-stj.ghtml,https://g1.globo.com/politica/noticia/2018/08/29/ministro-joao-otavio-de-noronha-toma-posse-como-novo-presidente-do-stj.ghtml,Ministro João Otávio de Noronha toma posse como novo presidente do STJ," O ministro João Otávio de Noronha tomou posse nesta quarta-feira (29) como novo presidente do Superior Tribunal de Justiça (STJ).  Na mesma cerimônia, a ministra Maria Thereza de Assis Moura tomou posse como nova vice-presidente do tribunal.  Com a posse, João Otávio de Noronha e Maria Thereza de Assis Moura também assumiram a direção do Conselho da Justiça Federal (CJF).  Noronha e Maria Thereza comandarão o STJ até 2020 e substituirão, respectivamente, Laurita Vaz e Humberto Martins (novo corregedor nacional do Conselho Nacional de Justiça).  João Otávio de Noronha é ministro do STJ desde dezembro de 2002. Nascido em 30 de agosto de 1956 em Três Corações (MG), fez carreira como advogado do Banco do Brasil, tendo exercido o cargo de diretor jurídico da instituição. É casado e tem dois filhos.  No STJ, integrou a Primeira e da Segunda Seção e ocupou o cargo de presidente da Segunda, da Terceira e da Quarta Turmas.  O novo presidente do STJ também foi corregedor-geral da Justiça Federal, corregedor-geral eleitoral no Tribunal Superior Eleitoral e diretor-geral da Escola Nacional de Formação e Aperfeiçoamento de Magistrados (Enfam). Até assumir a presidência do STJ, era o corregedor nacional no Conselho Nacional de Justiça (CNJ).  Além da carreira na magistratura, o ministro também é professor de direito civil e processual civil no Centro Universitário Iesb.  Noronha será o 18º presidente do STJ e estará à frente do tribunal quando ele completar 30 anos de instalação (criada pela Constituição de 1988, a Corte foi oficialmente instalada em 7 de abril de 1989).  Nascida em São Paulo, Maria Thereza de Assis Moura é mestre e doutora em direito processual penal pela Faculdade de Direito da Universidade de São Paulo (USP). É ministra do STJ desde 2006, quando tomou posse em vaga destinada à advocacia.  No STJ, integrou a Sexta Turma e a Terceira Seção, especializadas em direito penal. Ela também atua na Corte Especial e, antes de chegar à vice-presidência do tribunal, ocupou o cargo de diretora-geral da Enfam.  Maria Thereza de Assis Moura também ocupou os cargos de ministra e de corregedora-geral eleitoral do Tribunal Superior Eleitoral.  Além das atividades na magistratura, a ministra é professora da USP e membro do Instituto Brasileiro de Ciências Criminais e do Instituto Brasileiro de Direito Processual. Possui diversos livros e artigos científicos publicados em periódicos brasileiros e internacionais. ",politica,,,,,,
2018-09-06,https://web.archive.org/web/20180906034058/https://g1.globo.com/politica/noticia/2018/09/05/gilmar-mendes-manda-soltar-ex-presidente-do-banco-prosper-preso-na-lava-jato.ghtml,https://g1.globo.com/politica/noticia/2018/09/05/gilmar-mendes-manda-soltar-ex-presidente-do-banco-prosper-preso-na-lava-jato.ghtml,Gilmar Mendes manda soltar ex-presidente do banco Prosper preso na Lava Jato," O ministro Gilmar Mendes, do Supremo Tribunal Federal (STF), mandou soltar nesta quarta-feira (5) Edson Figueiredo Menezes, ex-presidente do banco Prosper e ex-presidente da Bolsa de Valores do Rio de Janeiro.  Menezes foi preso no mês passado pela Polícia Federal na Operação Golias, um desdobramento da Lava Jato no Rio.  Ele é investigado por suposta propina para ser beneficiado no processo de licitação da administração da folha de pagamento do estado.  No Rio, os processos da Lava Jato são analisados pelo juiz Marcelo Bretas, da 7ª Vara Federal. Gilmar Mendes é o relator dos processos no STF.  Ao pedir para Menezes ser solto, a defesa argumentou no recurso que os fatos são antigos e ocorreram entre 2008 e 2009.  Ao analisar o caso, Gilmar Mendes considerou que a motivação do juiz para determinar a prisão não foi suficiente.  Mendes criticou, então, o que chamou de ""fragilidade de fundamentação adotada pelos juízes de primeiro grau para a decretação de prisões preventivas, especialmente nos chamados crimes de colarinho branco"".  Gilmar acrescentou, também, que o juiz precisa demonstrar a necessidade, de forma concreta, da prisão preventiva (decretada antes de condenação).  O ministro destacou, também, que ""ninguém questiona"" que a corrupção é nociva para a sociedade, mas disse que isso pode ser combatido sem desrespeitar o direito à presunção da inocência.  Edson Menezes foi o 37º investigado na Lava Jato do Rio solto por Gilmar Mendes.  Ao mandar soltar o ex-presidente do banco Prosper, Gilmar Mendes determinou as seguintes medidas cautelares: ",politica,,,,,,
2018-09-06,https://web.archive.org/web/20180906034058/https://g1.globo.com/politica/noticia/2018/09/05/pf-ve-indicios-de-que-temer-recebeu-vantagem-indevida-da-odebrecht.ghtml,https://g1.globo.com/politica/noticia/2018/09/05/pf-ve-indicios-de-que-temer-recebeu-vantagem-indevida-da-odebrecht.ghtml,PF afirma em relatório haver indícios de que Temer recebeu vantagem indevida da Odebrecht," A Polícia Federal (PF) enviou um relatório ao Supremo Tribunal Federal (STF) no qual afirma ter encontrado indícios de que o presidente Michel Temer recebeu vantagem indevida da construtora Odebrecht.  No documento, o delegado Thiago Delabary aponta, ainda, suspeitas de que Temer cometeu os crimes de corrupção passiva e lavagem de dinheiro.  Procurada, a assessoria de Temer enviou a seguinte resposta à TV Globo:  ""A conclusão do inquérito pela Polícia Federal é um atentado à lógica e à cronologia dos fatos. Jantar ocorrido no final de maio, segundo os próprios delatores, tratou de pedido de apoio formal para campanhas eleitorais, o que ocorreu realmente dentro de todos ditames legais. Todos os registros foram feitos em contas do PMDB e declarados ao TSE. Agora, sem conseguir comprovar irregularidades nas doações, o delegado aponta supostos pagamentos ocorridos em março como prova dos crimes, ou seja, dois meses antes do jantar. A investigação se mostra a mais absoluta perseguição ao presidente, ofendendo aos princípios mais elementares da conexão entre causa e efeito.""  O inquérito no qual o relatório foi enviado se refere a um jantar no Palácio do Jaburu, em maio de 2014, em que se teria acertado o repasse ilícito de R$ 10 milhões ao MDB.  De acordo os delatores da Odebrecht, teriam participado da reunião Eliseu Padilha (atual ministro da Casa Civil), o então presidente da empreiteira Marcelo Odebrecht, o ex-executivo Cláudio Melo Filho e o então vice-presidente Michel Temer  Procurado, o advogado de Padilha, Daniel Gerber, informou que o ministro não comentará o assunto. ""Se for o caso, se manifestará apenas nos autos"", acrescentou.  Conforme o delegado Delabary, há indícios de repasses de R$ 1.438.000,00 a Temer após pedidos de Moreira Franco (atual ministro de Minas e Energia).  ""Michel Miguel Elias Temer recebeu, em razão da função, por intermédío de João Baptista Lima Filho, em São Paulo/SP, R$ 500.000,00 em 19/03/2014, R$ 500.000,00 em 20/03/2014 e R$ 438.000,00 em 21/03/2014, totalizando R$ 1.438.000,00, decorrentes da solicitação dirigida por Moreira Franco a executivos da Odebrecht, além de ser o possível destinatário dos valores recebidos por José Yunes em 04/09/2014, em seu escritório de advocacia, fatos que, somados ao invariável emprego de dinheiro em espécie e de pessoas interpostas, espelham as condutas insculpidas no artigo 317 (corrupção passiva) do Código Penal e no artigo 1° da lei 9.613/98 (lavagem de dinheiro"", diz a PF.  Procurado, Moreira Franco enviou a seguinte resposta à TV Globo: ""Não participei da reunião no Palácio do jaburu. Não solicitei absolutamente nada a executivos desta empresa nem de nenhuma outra. A Odebrecht arrematou a concessão do Galeão por R$ 19,3 bi e não por atendimento de interesses. As conclusões da autoridade policial se baseiam em investigação marcada pela inconsistência.""  Agora, o relator do inquérito, ministro Luiz Edson Fachin, deverá encaminhar o caso para análise da Procuradoria Geral da República, que decidirá se denuncia ou não o presidente.  No relatório, o delegado afirma que não tem relevância o fato de que o dinheiro pode ter sido pedido para campanha, uma vez que o montante se mistura nas mãos dos políticos.  ""Quanto à destinação dada aos valores oriundos da Odebrecht, ou seja, se empregados ou não em campanha eleitoral, trata-se de aspecto de menor relevância. A casuística - cada vez mais volumosa - explicita que os pedidos de dinheiro, no mais das vezes, se processam com motivos de destinação eleitoral e suavizados pelos mais variados eufemismos. Fato é que, quando o dinheiro ingressa na esfera de disponibilidade do agente político, desfaz-se qualquer controle sobre a sua real aplicação, aspecto que se torna um atrativo"", diz o delegado.  Na delação premiada, Cláudio Melo Filho afirmou ao Ministério Público Federal (MPF) que, no encontro, Temer pediu ""direta e pessoalmente"" a Marcelo Odebrecht apoio financeiro para as campanhas do MDB em 2014.  O repasse do dinheiro, segundo depoimentos dos delatores da Odebrecht, seria uma forma de pagar pelos interesses da empresa atendidos pela Secretaria de Aviação Civil, comandada entre 2013 e 2015 por Eliseu Padilha e Moreira Franco, ambos do MDB.  ""Do total de R$ 10 milhões prometido por Marcelo Odebrecht em atendimento ao pedido de Michel Temer, Eliseu Padilha ficou responsável por receber e alocar R$ 4 milhões. Compreendi que os outros R$ 6 milhões, por decisão de Marcelo Odebrecht, seriam alocados para o Sr. Paulo Skaf"", falou, à época, o delator.  Skaf afirmou, durante agenda de campanha a governador nesta quinta, que todas as doações da sua campanha foram legais.  Sobre esse assunto, o presidente já admitiu que houve o jantar, mas sempre disse que não falaram de valores.  Quando este depoimento se tornou conhecido, o Palácio do Planalto divulgou nota informando que o presidente Michel Temer ""repudia com veemência"" o conteúdo da delação de Melo Filho.  Saiba abaixo o que a PF diz em outros trechos do relatório:  'Complexo sistema'  No relatório, a Polícia Federal afirma que, durante as investigações, ficou comprovado um ""complexo sistema de pagamento"" voltado para ocultação e dissimulação da origem dos recursos.  ""O conjunto de fatos acima expostos não se limita, simplesmente, à solicitação de vantagem e colocação da mesma à disposição dos agentes públicos. À evidência, há uma cadeia de fatos ligados à solicitação dos valores, seguida de um complexo sistema de pagamento voltado não apenas à ocultação do dinheiro, mas também à dissimulação de sua origem, natureza ou mesmo a propriedade, de tal sorte que a análise acurada desse conjunto de indícios não indica outra conclusão senão a prática autônoma de lavagem de ativos"".  Segundo o delegado, trata-se de ""esquema deliberadamente voltado ao trato de dinheiro marginal"" e tentativa de desassociar da ""origem espúria"".  ""Aqui, o que se vê é um esquema deliberadamente voltado ao trato de dinheiro marginal, o que serve à necessidade de desassociá-Io de sua origem espúria, conferindo-lhe, por sua própria fungibilidade, aptidão às mais amplas possibilidades de fruição, inclusive em campanhas eleitorais"", afirmou o relatório.  A Polícia Federal individualizou as condutas de 13 pessoas, entre elas Michel Temer e os ministros Moreira Franco e Eliseu Padilha, apontando suspeitas de corrupção passiva, corrupção ativa e lavagem de dinheiro.  Corretora  De acordo com o relatório da PF, a Odebrecht utiizava a empresa Hoya Corretora de Valores e Câmbio para pagar a maior parte da propina. A Hoya, por sua vez, usava as empresas TV Transnacional Transporte de Valores Segurança e Vigilância, para as entregas realizadas em São Paulo, e a empresa Transexpert Vigilância e Transporte, para operações efetuadas no Rio de Janeiro, informou a PF.  Uma parte do montante (R$ 500 mil), segundo o relatório, foi entregue a “João”, identificado no documento como sendo João Batista Lima Filho, o coronel amigo do presidente Michel Temer em março de 2014. O endereço apontado na entrega é a sede da Argeplan, empresa do coronel.  “Resta claro que, em 19/03/2014, os ""agentes"" da TRANSNACIONAL compareceram ao endereço Rua Juatuba, 68, com o intento de entregar R$ 500.000,00 (quinhentos mil reais) a ""JOÃO"", porém, como este não estava no local, houve a necessidade de aguardar o seu retorno. De salientar, também, que ""JOÃO"", após ter chegado ao endereço de entrega, não dispunha da correspondente senha, sendo dispensado de apresentá-Ia pela central de operações, posto que o ""cliente"" teria autorizado o repasse dos valores mesmo sem a senha”, diz o documento.  A Polícia Federal apresenta dados da quebra de sigilo telefônico de João Baptista, ligações feitas por ele, para afirmar que há indícios de que ele combinou a entrega dos valores. ",politica,,,,,,
2018-09-06,https://web.archive.org/web/20180906034058/https://g1.globo.com/politica/noticia/2018/09/05/senado-aprova-projeto-que-assegura-em-lei-ajuda-financeira-a-pacientes-do-sus-que-fazem-tratamento-em-outra-cidade.ghtml,https://g1.globo.com/politica/noticia/2018/09/05/senado-aprova-projeto-que-assegura-em-lei-ajuda-financeira-a-pacientes-do-sus-que-fazem-tratamento-em-outra-cidade.ghtml,Senado aprova projeto que assegura em lei ajuda financeira a pacientes do SUS que fazem tratamento em outra cidade," O Senado aprovou nesta quarta-feira (5) um projeto que assegura em lei ajuda financeira aos pacientes do Sistema Único de Saúde (SUS) que precisam deixar a cidade onde moram para fazer algum tipo de tratamento em outro município.  Atualmente, a ajuda de custo já é prevista em uma portaria do Ministério da Saúde, mas não tem força de lei.  Com a aprovação do projeto pelo Senado, o texto seguirá para análise da Câmara.  De acordo com o texto, o SUS ficará responsável por custear o transporte (aéreo, terrestre ou fluvial) e as diárias para alimentação e hospedagem do paciente.  No caso das diárias, o texto estabelece que a distância entre as duas cidades precisa ser igual ou superior a 50 quilômetros.  A ajuda será concedida em caso de:  A proposta também estabelece que:  De acordo com o projeto, o dinheiro será repassado pela União e ""se necessário"" será complementado por estados e municípios.  Os valores pagos pela União, diz o texto, serão padronizados nacionalmente e deverão ser ajustados anualmente conforme a inflação.  Também nesta quarta-feira, o Senado aprovou um projeto que cria o Programa Bicicleta Brasil (PBB).  A proposta altera o Código de Trânsito Brasileiro e prevê que 15% do valor arrecadado a partir das multas de trânsito seja revertido para o programa. O projeto vai à sanção presidencial.  O PBB dará apoio a estados e municípios para:  O programa que incentiva o uso da bicicleta como meio de transporte deve ser implementado em cidades com mais de 20 mil habitantes ",politica,,,,,,
2018-09-07,https://web.archive.org/web/20180908074424/https://g1.globo.com/politica/noticia/2018/09/07/fachin-mantem-prisao-de-ex-deputado-denunciado-por-ajudar-parlamentares-em-suposta-obstrucao-a-lava-jato.ghtml,https://g1.globo.com/politica/noticia/2018/09/07/fachin-mantem-prisao-de-ex-deputado-denunciado-por-ajudar-parlamentares-em-suposta-obstrucao-a-lava-jato.ghtml,Fachin mantém prisão de ex-deputado denunciado por ajudar parlamentares em suposta obstrução à Lava Jato," O ministro Luiz Edson Fachin, do Supremo Tribunal Federal (STF), decidiu manter a prisão do ex-deputado Márcio Junqueira.  Junqueira foi denunciado pelo Ministério Público porque teria ajudado o presidente do PP, senador Ciro Nogueira (PP-PI), e o deputado Eduardo da Fonte (PP-PE) a supostamente obstruir as investigações da Operação Lava Jato - os dois parlamentares também foram denunciados.  Conforme a acusação do Ministério Público, Ciro Nogueira e Eduardo da Fonte ordenaram que Márcio Junqueira pressionasse um ex-assessor e motorista a desmentir depoimentos prestados à Polícia Federal. A defesa do senador e a do deputado sempre negaram qualquer envolvimento com o caso.  Fachin, que determinou a prisão de Junqueira em abril, afirmou que ele continua preso pelo menos até a Segunda Turma decidir se recebe ou não a denúncia da Procuradoria. Ainda não há data para isso, mas, na ocasião, os ministros poderão deliberar sobre a necessidade da manutenção da prisão, entendeu o ministro.  ""Mantenho a prisão preventiva decretada em desfavor de Márcio Henrique Junqueira Pereira, sem prejuízo de novo exame quando da deliberação colegiada acerca do recebimento, ou não, da denúncia"", afirmou o ministro.  Segundo a PGR, o assessor pressionado foi José Expedito Rodrigues. Relata a denúncia que, em setembro de 2016, José Expedito confessou os crimes à PF.  Ainda de acordo com a PGR, em 2017, a mando de Ciro Nogueira e de Eduardo da Fonte, Márcio Junqueira passou a exigir de José Expedito uma ""retratação"" das revelações que fez nos depoimentos.  A Procuradoria disse que Expedito é um ""arquivo vivo"" porque trabalhou para Ciro e Eduardo da Fonte por mais de dez anos, sendo ""pessoa próxima e de confiança"" dos parlamentares, incumbido de transportar dinheiro para eles em diversas ocasiões.  ""A mando dos parlamentares, a partir de outubro de 2017, nos termos retratados nesta denúncia, Márcio Junqueira ameaçou José Expedito de morte, exigiu dele uma retratação em cartório do conteúdo dos depoimentos que prestou à PF em 2016, prometeu-lhe cargo público, casa, pagou-lhe despesas e fez entregas de dinheiro —, tudo para comprar seu silêncio e, assim, prejudicar investigações em curso"", diz a denúncia. ",politica,,,,,,
2018-09-07,https://web.archive.org/web/20180908074424/https://g1.globo.com/politica/noticia/2018/09/07/raquel-dodge-pede-ao-stf-para-arquivar-inquerito-sobre-paulinho-da-forca.ghtml,https://g1.globo.com/politica/noticia/2018/09/07/raquel-dodge-pede-ao-stf-para-arquivar-inquerito-sobre-paulinho-da-forca.ghtml,Raquel Dodge pede ao STF para arquivar inquérito sobre Paulinho da Força," A procuradora-geral da República, Raquel Dodge, pediu ao Supremo Tribunal Federal (STF) para arquivar o inquérito que investiga o deputado Paulo Pereira da Silva (SD-SP), conhecido como Paulinho da Força. A decisão caberá ao ministro Dias Toffoli.  O inquérito foi aberto em março do ano passado após as delações de ex-executivos da Odebrecht e apura supostos repasses da empreiteira ao parlamentar.  Ao enviar o pedido ao Supremo, Raquel Dodge argumentou que não há elementos mínimos para oferecer uma eventual denúncia contra o deputado nem para o prosseguimento da investigação.  ""Todas as diligências requeridas pela Procuradoria Geral da República e autorizadas pelo Supremo Tribunal Federal foram cumpridas, não havendo mais linha investigativa a se seguir. A única providência a ser tomada na espécie, portanto, é o arquivamento do inquérito"", afirma Dodge.  Paulinho da Força é investigado por corrupção passiva e lavagem de dinheiro porque teria recebido R$ 200 mil em vantagens indevidas para campanha eleitoral de 2010, sem declaração à Justiça Eleitoral, além de doação oficial de R$ 500 mil para campanha de 2012.  A contrapartida seria ajuda à empresa para solução de greves em obras e ajuda no comitê do FI-FGTS, que liberava recursos e tinha representação sindical.  Na época da abertura do inquérito, Paulo Pereira negou irregularidades e disse que havia declarado todas as doações.  Afirmou que, como líder sindical, ajuda em conflitos em grandes obras. Em depoimento no inquérito, o deputado voltou a refutar irregularidades, conforme a procuradora.  A Polícia Federal havia solicitado mais tempo para análise dos sistemas internos da Odebrecht no qual as supostas propinas eram registradas, o ""Drousys"" e o ""Mywebday"".  Mas Raquel Dodge entendeu que os elementos coletados não permitiam o avanço das investigações. Segundo ela, não foram encontrados registros de pessoas ligadas a Paulo Pereira nos hoteis utilizados pelo doleiro Álvaro Novis para entregas de valores.  Ainda segundo ela, houve registro de duas doações oficiais em 2010 das empresas Leyroz Caxias Indústria e Praiamar Indústria, que somaram R$ 200 mil, embora os registros de pagamento ao deputado estivessem no sistema interno.  Um dos delatores confirmou que o repasse indevido foi feito por meio dessas doações, mas, segundo a procuradora, isso não prova que ele soubesse da "" dissimulação da origem dos recursos"".  ""Embora o pagamento esteja registrado no sistema de contabilidade paralela da Odebrecht, o colaborador Alexandrino Alencar esclareceu que o referido repasse foi realizado por meio das empresas PRAIAMAR e LEYROZ via doação oficial em favor do Diretório Estadual do PDT-SP, como forma de dissimular o pagamento da vantagem indevida. Em outras palavras, não está devidamente comprovado que o parlamentar sabia da dissimulação da origem dos recursos destinados ao pagamento clandestino de vantagens para fins eleitorais"", afirmou.  Para Raquel Dodge, não se pode inferir que houve repasse indevido apenas com base no sistema interno da Odebrecht.  ""Não há como ter um juízo de probabilidade do pagamento exclusivamente a partir dos registros nos sistemas paralelos da empresa e declarações dos colaboradores. É preciso dados probatórios adicionais, que, apesar das diligências empreendidas, não foram obtidos. Nesse contexto, imperioso reconhecer que não há elementos suficientes que possam fundamentar a continuidade da investigação no ponto"", completou.  Sobre a doação oficial de R$ 500 mil em 2012 que teria sido uma forma de maquiar propina, ela disse que não foi constatada nenhuma doação de empresas da Odebrecht. Segundo ela, ""não se logrou êxito na coleta de dados concretos e elementos aptos de comprovação"" em relação às palavras dos delatores. ",politica,,,,,,
2018-09-13,https://web.archive.org/web/20180913045022/https://g1.globo.com/politica/noticia/2018/09/12/venezuela-informou-que-nao-cortara-energia-fornecida-a-rr-diz-ministro.ghtml,https://g1.globo.com/politica/noticia/2018/09/12/venezuela-informou-que-nao-cortara-energia-fornecida-a-rr-diz-ministro.ghtml,"Venezuela informou que não cortará energia fornecida a RR, diz ministro"," O ministro da Defesa, Joaquim Silva e Luna, informou nesta quarta-feira (12) que o governo da Venezuela disse que não cortará a energia fornecida ao estado de Roraima.  Silva e Luna esteve na Venezuela nesta terça (11) e se reuniu com o ministro da Defesa do país, general Vladimir Padriño, e relatou a conversa ao presidente Michel Temer, nesta quarta-feira.  Atualmente, o estado de Roraima é o único que não está integrado ao Sistema Interligado Nacional (SIN) e, com isso, depende da energia fornecida pela Venezuela.  No último dia 24, o governo venezuelano ameaçou cortar a energia fornecida a Roraima em razão de uma dívida de US$ 30 milhões.  Diante disso, a governadora do estado, Suely Campos, pediu nesta terça-feira ao ministro de Minas e Energia, Moreira Franco, que a Eletrobras comece a fazer a manutenção da linha de transmissão de energia que liga o estado à usina venezuelana de Guri.  Atualmente, 85% da energia consumida em Roraima é importada da Venezuela. Mas, com a crise que atinge o país vizinho, a qualidade do fornecimento caiu e o estado sofre com os constantes apagões.  Segundo Joaquim Silva e Luna, o governo de Nicolás Maduro também fez um apelo para que o Brasil continue ajudando os imigrantes venezuelanos.  Diante da crise econômica, política e social que o país enfrenta, milhares de Venezuelanos têm cruzado a fronteira em busca de melhores oportunidades. A principal rota de entrada no Brasil é a fronteira com Pacaraima (RR).  A governadora Suely Campos chegou a pedir ao Supremo Tribunal Federal (STF) que determine o fechamento da fronteira com a Venezuela, mas a ministra Rosa Weber negou o pedido, afirmando que a decisão cabe ao presidente da República.  Michel Temer, por sua vez, já disse que o fechamento da fronteira é ""incogitável"" e ""inegociável"". ",politica,,,,,,
