data,url_noticia,url_noticia_curto,titulo,conteudo_noticia,assunto,assunto_ex,titulo_ex,subtitulo_ex,local_ex,artigo_ex,n_paragrafos
2020-04-03,https://web.archive.org/web/20200403000010/https://globoesporte.globo.com/noticia/jornalistas-elegem-a-maior-rivalidade-de-todos-os-tempos-no-esporte-veja-o-ranking.ghtml,https://globoesporte.globo.com/noticia/jornalistas-elegem-a-maior-rivalidade-de-todos-os-tempos-no-esporte-veja-o-ranking.ghtml,Jornalistas elegem a maior rivalidade de todos os tempos no esporte; veja o ranking ," Dos diversos ingredientes que afloram a paixão pelo esporte, seja ele qual for, um mexe com o imaginário: a rivalidade. São vários os confrontos e comparações entre atletas durante os anos que estão marcados na história.  +++ Ronaldo? Ronaldinho? Romário? Jornalistas elegem a maior contratação do futebol brasileiro  *O GloboEsporte.com colocou, entre as opções na enquete para os internautas, todas as rivalidades mencionadas pelos jornalistas  Mas qual a maior rivalidade de todos os tempos?   Para responder a pergunta, a reportagem ouviu a opinião de 100 jornalistas. A missão era simples: montar o top-3 com os principais embates entre atletas que duelaram na mesma época ou são comparados pelos feitos e relevância na sua modalidade.  Dentro dos critérios de pontuação, a briga foi acirrada, mas levou a melhor o confronto entre dois nomes ainda em atividade, mas já eternizados nas principais páginas do futebol.  *Ao fim da reportagem você navega pelos votos de todos os jornalistas que participaram da eleição ",esportes,,,,,,
2020-04-03,https://web.archive.org/web/20200403000010/https://globoesporte.globo.com/futebol/futebol-internacional/noticia/reuniao-nesta-sexta-deve-ampliar-tempo-de-paralisacao-da-premier-league.ghtml,https://globoesporte.globo.com/futebol/futebol-internacional/noticia/reuniao-nesta-sexta-deve-ampliar-tempo-de-paralisacao-da-premier-league.ghtml,Reunião nesta sexta deve ampliar tempo de paralisação da Premier League," Com praticamente um mês de antecedência, os clubes ingleses devem anunciar nesta sexta-feira que não será possível retomar a Premier League no dia 30 de abril, data prevista inicialmente, quando os jogos na Inglaterra foram interrompidos, na segunda semana de março.  De acordo com reportagem no site da ""BBC"", os 20 clubes da Premier League vão se reunir por videoconferência nesta sexta e decidir pelo adiamento da data de retorno ao futebol.  A dúvida é se os clubes escolherão outra possível data, provavelmente no fim de maio, ou se farão como as ligas nacionais da Espanha e da França, que interromperam suas partidas por um período indefinido, à espera da diminição da pandemia de coronavírus.  Já a Itália, país europeu mais atingido pela doença, ainda mantém uma previsão de retorno do futebol no fim de maio, prazo cada vez menos provável de ser cumprido.  No último relatório da Organização Mundial de Saúde (OMS), o Reino Unido registrou 29.478 casos de Covid-19, com 2.532 mortes, até esta quinta-feira.  Se a volta da Premier League for adiada, afirma a reportagem, os clubes ingleses poderão ceder seus estádios, equipamentos e até funcionários dos departamentos médicos para ajudar o sistema público de saúde inglês no combate à pandemia, já que não haverá risco de retorno às atividades esportivas em curto prazo. ",esportes,,,,,,
2020-04-03,https://web.archive.org/web/20200403000010/https://globoesporte.globo.com/futebol/times/botafogo/noticia/botafogo-anuncia-que-nao-fara-cortes-nos-salarios-de-funcionarios-e-jogadores-em-marco-e-abril.ghtml,https://globoesporte.globo.com/futebol/times/botafogo/noticia/botafogo-anuncia-que-nao-fara-cortes-nos-salarios-de-funcionarios-e-jogadores-em-marco-e-abril.ghtml,Botafogo anuncia que não fará cortes nos salários de funcionários e atletas em março e abril," O Botafogo anunciou nesta quinta-feira, por nota oficial, que não fará cortes nos salários de funcionários e atletas nos próximos dois meses. Mesmo com o futebol parado por conta da pandemia do novo coronavírus, o clube garante que pagará integralmente os vencimentos correspondentes a março e abril.  O Alvinegro garante que a medida será revista apenas se o cenário atual, com o calendário do futebol parado, não mudar a partir de maio. A decisão foi tomada pelo presidente Nelson Mufarrej após reunião por videoconferência com os demais membros do Comitê Executivo de Futebol.  - Neste momento, a prioridade máxima no Botafogo é preservar seus atletas, funcionários, sócios e a sociedade como um todo, seguindo à risca todas as orientações das autoridades de saúde para mitigar a propagação do vírus. É tempo de cuidar de si e do próximo - informa o clube.  O debate sobre a remuneração dos jogadores acontece desde que o futebol parou devido ao combate à Covid-19. Na última semana, foi descartado acordo coletivo entre clubes e atletas, que não aceitam redução salarial. Ficou definida apenas férias de 20 dias, o que também acontece no Botafogo.  ""O Botafogo de Futebol e Regatas informa que, após reunião realizada na tarde desta quinta-feira (2/4), por meio de videoconferência, o Presidente Nelson Mufarrej e os demais membros do Comitê Executivo de Futebol definiram que os salários dos atletas e funcionários referentes aos meses de março e abril serão integralmente pagos pelo Clube, sem cortes. O Botafogo entende que para enfrentar o momento de adversidade é necessária a união de todos.  Os efeitos da propagação da COVID-19 estão sendo constantemente monitorados pelo Comitê Executivo de Futebol junto aos profissionais envolvidos e o Clube segue em contato permanente com as entidades esportivas, acompanhando os desmembramentos da situação existente.  Caso a paralisação das atividades perdure também a partir de maio, a decisão poderá ser reavaliada para os meses subsequentes.  Neste momento, a prioridade máxima no Botafogo é preservar seus atletas, funcionários, sócios e a sociedade como um todo, seguindo à risca todas as orientações das autoridades de saúde para mitigar a propagação do vírus. É tempo de cuidar de si e do próximo.   Nada é mais importante que o bem-estar coletivo. O Clube não medirá esforços em promover iniciativas nesse sentido e reitera a disponibilidade da infraestrutura do Estádio Nilton Santos para utilização pelos órgãos de saúde.   O Botafogo agradece aos seus patrocinadores, parceiros comerciais e, fundamentalmente, seus sócios e torcedores, por estarem próximos do Clube nesse momento tão delicado.""   TUA ESTRELA SOLITÁRIA NOS CONDUZ... FAÇA PARTE: CLIQUE AQUI! ",esportes,,,,,,
2020-04-04,https://web.archive.org/web/20200404000033/https://globoesporte.globo.com/futebol/noticia/qual-o-gol-mais-bonito-da-historia-do-seu-time-vote-para-atletico-mg-cruzeiro-bahia-sport-ceara-e-fortaleza.ghtml,https://globoesporte.globo.com/futebol/noticia/qual-o-gol-mais-bonito-da-historia-do-seu-time-vote-para-atletico-mg-cruzeiro-bahia-sport-ceara-e-fortaleza.ghtml,"Qual o gol mais bonito da história do seu time? Vote para Atlético-MG, Cruzeiro, Bahia, Sport, Ceará e Fortaleza"," Sem bola rolando em quase todo o mundo por conta da pandemia de coronavírus, o GloboEsporte.com aproveita para fazer uma votação histórica com 18 diferentes torcidas brasileiras. Na semana em que Puskás - lenda do futebol que virou sinônimo de golaço - completaria 93 anos de idade, queremos saber: qual o gol mais bonito da história do seu time?  + Vídeos, podcasts e mais: GE lista produtos para você maratonar na quarentena do coronavírus  As redações do esporte da Globo selecionaram 10 opções para votação em cada clube - claro, de lances que tenham registros em vídeo. Vale lembrar: está em questão apenas a beleza dos gols, independentemente do autor ou da relevância da partida.  No quarto dia de votação, abrimos para seis clubes: Atlético-MG, Cruzeiro, Bahia, Ceará, Fortaleza e Sport. Os resultados saem na segunda-feira, dia 6 de abril (veja no fim da matéria o cronograma completo).  Reinaldo, Guilherme, Marques, Danilinho, Ronaldinho Gaúcho (duas vezes), Jô, Dátolo, Cazares e Otero são os concorrentes. Veja todos os vídeos na enquete abaixo:  Bobô, Naldinho, Lima, Jajá, Preto Casagrande, Nonato, Sérgio Alves, Viola, Danilo Rios e Gilberto são os concorrentes. Veja todos os vídeos na enquete abaixo:  Cláudio Adão, Eron, Zezinho, Lelê, Eusébio, Magno Alves, Arthur e Leandro Carvalho. Veja todos os vídeos na enquete abaixo:  Joãozinho, Geraldão, Ronaldo, Alex (duas vezes), Henrique, Wallyson, Everton Ribeiro, Marcelo Moreno e Arrascaeta são os concorrentes. Veja todos os vídeos na enquete abaixo:  Clodoaldo, Dude, Lúcio, Rinaldo, Maranhão, Zé Carlos, Edinho e Osvaldo são os concorrentes. Veja todos os vídeos na enquete abaixo:  Dedé, Wellington, Rivaldo, Neto Baiano, Marlone, Maikon Leite, Everton Felipe e Diego Souza (três vezes) são os concorrentes. Veja todos os vídeos na enquete abaixo: ",esportes,,,,,,
2020-04-04,https://web.archive.org/web/20200404000033/https://globoesporte.globo.com/rs/futebol/times/internacional/noticia/inter-supera-boca-e-sao-paulo-fatura-r-4-milhoes-com-adidas-mas-ja-preve-perdas.ghtml,https://globoesporte.globo.com/rs/futebol/times/internacional/noticia/inter-supera-boca-e-sao-paulo-fatura-r-4-milhoes-com-adidas-mas-ja-preve-perdas.ghtml,"Inter supera Boca e São Paulo, fatura R$ 4 milhões com Adidas, mas já prevê perdas"," O Inter se prepara para enfrentar os efeitos da crise devido à pandemia do coronavírus em todas as frentes e espera uma queda brusca nas receitas com vendas de uniformes e produtos licenciados. Mas os primeiros três meses da parceria com a Adidas já renderam frutos. O clube faturou um valor próximo a R$ 4 milhões com royalties no primeiro semestre de 2020.  + Veja como é o contrato do Inter com a Adidas  A mudança de fornecedora foi bem recebida de imediato pelos torcedores. O clube recebeu R$ 3 milhões dos royalties das vendas de uniformes e demais artigos esportivos nos dois primeiros meses do ano. Mesmo já sob os efeitos da pandemia do coronavírus, março rendeu mais R$ 1 milhão aos cofres do clube.  O formato do contrato com a Adidas, porém, faz o clube estimar uma queda acentuada nas receitas, de cerca de R$ 1 milhão mensais até que a pandemia do coronavírus seja contida. A estimativa é feita com base nos números já apresentados até abril. Há expectativa de que a normalização da situação em todo o mundo dê um impulso nas receitas.  Ao trocar de fornecedora, o Inter alterou também os moldes do acordo, que é de fornecimento de material esportivo, sem uma cota fixa de patrocínio a ser recebida pelo clube - ao contrário do que ocorria com a Nike.  O Colorado tem direito a 27% do valor das vendas de produtos licenciados, por royalties, além de 40 mil peças para uso no futebol masculino, futebol feminino e categorias de base.  A aceitação da Adidas foi tanta que o clube superou até Boca Juniors e São Paulo nas vendas e só ficou atrás do Flamengo na América do Sul. A empresa alemã preparava o lançamento de camisas pré-jogo e agasalhos especiais, mas tudo isso foi cancelado por ora. Ao todo, serão 27 peças licenciadas, mas não há previsão de novidades nas lojas.  O cenário é de incerteza. Após o primeiro semestre, muitas lojas fizeram novas encomendas para repor estoque, a ser confirmadas na hora do pagamento para o envio das peças. Mas todos os pedidos estão suspensos devido à pandemia e não se sabe se serão mantidos.  Transforme sua paixão em amor para a vida toda. Associe-se agora ",esportes,,,,,,
2020-04-04,https://web.archive.org/web/20200404000033/https://globoesporte.globo.com/futebol/times/palmeiras/noticia/do-penalti-defendido-por-prass-ao-chapeu-de-dudu-relembre-vitoria-do-palmeiras-no-derbi-de-2016.ghtml,https://globoesporte.globo.com/futebol/times/palmeiras/noticia/do-penalti-defendido-por-prass-ao-chapeu-de-dudu-relembre-vitoria-do-palmeiras-no-derbi-de-2016.ghtml,Do pênalti defendido por Prass ao chapéu de Dudu: relembre vitória do Palmeiras no Dérbi de 2016," A vitória de 1 a 0 do Palmeiras sobre o Corinthians no Paulistão de 2016 foi relembrada pelo clube alviverde nesta sexta-feira. Em uma rede social, o Verdão classificou o triunfo diante do rival como ""de tirar o chapéu"".  + Leia mais notícias do Palmeiras  A provocação tem explicação. Aos 32 minutos do segundo tempo, Dudu ganhou pelo alto do goleiro Cássio e, de cabeça, fez o único gol do jogo disputado naquele 3 de abril, no Pacaembu. Na comemoração, ele pegou o boné do jornalista Wanderley Nogueira para festejar.  Em 2015, Dudu foi contratado pelo Palmeiras depois de negociar com Corinthians e São Paulo. Na época, torcedores brincaram que o Verdão deu um chapéu nos rivais ao acertar com o camisa 7.  Em participação do podcast GE Palmeiras no ano passado, o atacante relembrou sua chegada ao clube palmeirense e também sobre o Dérbi de 2016. Ele se recuperava de lesão e voltou a sentir o problema muscular durante aquele jogo, mas saiu de campo como herói.  Um pouco antes do gol de Dudu, Fernando Prass brilhou ao defender cobrança de pênalti de Lucca.  Reveja as entrevistas depois do clássico entre Palmeiras e Corinthians e os lances do Dérbi válido pela primeira fase do Campeonato Paulista de 2016: ",esportes,,,,,,
2020-04-05,https://web.archive.org/web/20200405000014/https://globoesporte.globo.com/futebol/times/flamengo/noticia/estreia-no-profissional-amizades-e-novos-ares-como-o-flamengo-entrou-na-vida-de-gustavo-henrique.ghtml,https://globoesporte.globo.com/futebol/times/flamengo/noticia/estreia-no-profissional-amizades-e-novos-ares-como-o-flamengo-entrou-na-vida-de-gustavo-henrique.ghtml,"Estreia no profissional, amizades e novos ares: como o Flamengo entrou na vida de Gustavo Henrique"," O Flamengo entrou na vida de Gustavo Henrique muito antes de ele vestir a camisa rubro-negra. Em 2012, com apenas 19 anos, o zagueiro fez sua estreia como profissional, ainda pelo Santos, justamente num jogo contra o time carioca. Na ocasião, uma equipe reserva do Peixe foi derrotada no estádio Nilton Santos por 1 a 0.  - Foi meu primeiro jogo como profissional. Na época o Santos estava na semifinal da Libertadores, e eu já estava participando dos treinos. Na época era o professor Muricy. Ele me deu oportunidade, jogou um time chamado reserva. Eu lembro que a gente perdeu de 1 a 0, mas eu fiz um grande jogo, marcando o Vagner Love. Recebi vários elogios do Muricy. Tomamos gol aos 45 do segundo tempo, de pênalti - contou Gustavo, em entrevista ao canal oficial do Flamengo na Internet.  Oito anos depois, o Flamengo voltou com força à vida de Gustavo. Decidido a deixar o Santos, ele viu na proposta rubro-negra a chance de respirar novos ares. Mas nem tudo era novidade no Rio de Janeiro: no novo clube, ele reencontrou amigos, como Gabigol, Thiago Maia, Rodrigo Caio e Bruno Henrique.  - Foi muito bacana. Eu pude jogar com eles (Gabriel e Thiago) no Santos, vendo o crescimento deles também. Já vi que eram dois ótimos jogadores, muito promissores, que buscaram seu espaço com muita humildade. Hoje estão ai não é à toa, porque ralaram muito. São amigos meus, que levo até hoje. Estamos podendo jogar juntos no mesmo time, esperamos conquistar cada vez mais.  Segundo Gustavo, desde que soube do interesse do Flamengo, a prioridade foi do Rubro-Negro. E uma série de fatores justifica a decisão do zagueiro:  - Foi o primeiro clube que demonstrou interesse, e eu fiquei muito feliz. Dei prioridade por causa da torcida, do Maracanã lotado, o elenco que tem. Tudo isso te motiva cada vez mais. Eu precisava sair, de novos ares. Já estava decidido. Não ia deixar essa chance passar - completou.  Até o momento, Gustavo Henrique tem 10 partidas pelo Flamengo, todas como titular. Ele fez um gol, na vitória sobre o Barcelona de Guayaquil, pela Libertadores.  Quarentena  - A gente recebeu férias. Vai ter que alongar o calendário. Sempre importante manter o condicionamento físico. Procuro fazer um trabalho à parte dentro de casa mesmo. Monto um espaço aqui, com uns pesos, faço trabalho de mobilidade e força. Para que quando a gente voltar, não tenha perdido este condicionamento inteiro, para que a gente possa manter uma boa base para não sofrer lá na frente.  Apoio da torcida e emoção com primeiro gol  - Sensação muito especial entrar num campo histórico como o Maracanã. Todo jogador sonha com isso, eu não sou diferente. Você entra e sente o calor da torcida. Isso nos anima e motiva cada vez mais para que a gente possa dar cada vez mais felicidade para eles. A sensação de marcar um gol com 60, 70 mil pessoas é inexplicável. Eu fiz esse gol e fiquei muito feliz, muito emocionado. Estava buscando muito esse gol.  Inspiração em Rodrigo Caio  - Joguei com ele na seleção. É um grande jogador. Perguntei a ele como foi essa mudança, se realmente era bom o ambiente de trabalho. Ele falou que podia vir de olhos fechados. Isso me deixou mais tranquilo. É um exemplo, porque ele siau de um clube onde jogou muito tempo. Chega uma hora que você precisa buscar novos ares. Só espero neste novo clube dar muita alegria para a torcida. ",esportes,,,,,,
2020-04-05,https://web.archive.org/web/20200405000014/https://globoesporte.globo.com/futebol/futebol-internacional/noticia/possivel-transferencia-de-neymar-do-psg-para-o-barcelona-volta-a-estampar-jornais-da-espanha.ghtml,https://globoesporte.globo.com/futebol/futebol-internacional/noticia/possivel-transferencia-de-neymar-do-psg-para-o-barcelona-volta-a-estampar-jornais-da-espanha.ghtml,Possível transferência de Neymar do PSG para o Barcelona volta a estampar capas na Espanha," A novela voltou. A possível transferência de Neymar do PSG para o Barcelona é assunto novamente nos dois principais jornais esportivos da Catalunha. Neste sábado e nas edições deste domingo, o “Mundo Deportivo” e o “Sport” estamparam o atacante brasileiro na capa e dizem que o jogador prepara seu retorno à equipe espanhola.  Em sua primeira página deste domingo, o ""Sport"" diz que Neymar quer concretizar sua transferência para o Barcelona. O diário ainda afirma que o PSG trata a saída de seu principal jogador como inevitável e prepara uma estratégia para a venda.  + Você sabe tudo da carreira de Neymar? Então prove neste quiz  Na edição deste sábado, o ""Mundo Deportivo"" publicou que o brasileiro teria feito um acordo com o Barcelona para evitar sua ida para o Real Madrid durante a janela de transferências do verão europeu em 2019.  O diário ainda diz que o atacante prometeu ao clube catalão que concluiria sua saída de Paris em 2020. O ""Mundo Deportivo"" até citou um hotel de Barcelona, onde o pacto entre Neymar e o Barça teria sido feito.  Na última janela de transferências do verão europeu, entre julho e agosto de 2019, o possível retorno de Neymar ao Barça foi a maior novela do período. O assunto estampou 93 capas dos quatro principais jornais espanhóis desde o início das especulações até o fim da negociação, no início de setembro.  Diante da incerteza sobre seu futuro, o camisa 10 estreou pelo PSG na atual temporada apenas no dia 14 de setembro, após o fim da janela. Ele fez 22 jogos, fez 18 gols e anotou nove assistências. ",esportes,,,,,,
2020-04-05,https://web.archive.org/web/20200405000014/https://globoesporte.globo.com/futebol/times/corinthians/noticia/empresa-que-cuida-do-futebol-de-7-do-corinthians-desiste-de-convidar-prior-para-jogar.ghtml,https://globoesporte.globo.com/futebol/times/corinthians/noticia/empresa-que-cuida-do-futebol-de-7-do-corinthians-desiste-de-convidar-prior-para-jogar.ghtml,Empresa que cuida do futebol de 7 do Corinthians desiste de convidar Prior para jogar," O ex-BBB Felipe Prior não jogará pela equipe de futebol de 7 do Corinthians. Depois das acusações de estupro contra o arquiteto, publicadas na sexta-feira pela revista Marie Claire, a empresa responsável por gerir a equipe do Timão anunciou que desistiu de convidá-lo para fazer parte do elenco.  Na última segunda-feira, Pablo Rossi, gestor da categoria, afirmou que o clube faria um convite a Prior, torcedor do Timão e zagueiro nas horas vagas. Na terça, ele deixou o BBB após ser eliminado.  Segundo a publicação da Marie Claire, Felipe Prior tem duas acusações de estupro e uma de tentativa de estupro. Ele nega.  Leia abaixo a nota divulgada pela empresa que gerencia o Fut 7 do Corinthians:   ""A MSJ Representações, empresa licenciada pelo Corinthians que é responsável pela equipe do Corinthians Fut 7 vem a público esclarecer fatos recentemente divulgados sobre o convite informal realizado para o atleta Felipe Prior integrar a equipe masculina da modalidade de Futebol 7.  Responsável pela administração da equipe a MSJ Representações tem o objetivo de realizar as contratações avaliando sempre a parte técnica e comportamental de seus jogadores para que tenhamos sempre uma equipe competitiva que dispute os principais títulos da modalidade.  Entretanto, devido as últimas notícias recentemente divulgados sobre o referido atleta, o Corinthians F7 decidiu por não efetivar o convite e aguarda o esclarecimento dos fatos para se pronunciar posteriormente"". ",esportes,,,,,,
2020-04-06,https://web.archive.org/web/20200406000024/https://globoesporte.globo.com/futebol/futebol-internacional/noticia/jornal-pausa-por-pandemia-anula-chances-de-saidas-de-neymar-e-mbappe-do-psg.ghtml,https://globoesporte.globo.com/futebol/futebol-internacional/noticia/jornal-pausa-por-pandemia-anula-chances-de-saidas-de-neymar-e-mbappe-do-psg.ghtml,Jornal: pausa por pandemia anula chances de saídas de Neymar e Mbappé do PSG," Não será em 2020 que Neymar deixará o PSG. Tampouco Mbappé deve sair do clube. Ao menos é o que garante o jornal francês “L'Equipe”. O diário estampa em sua capa da edição desta segunda-feira que a pausa no calendário por conta da pandemia do novo coronavírus deixa o cenário favorável para que o Paris consiga manter suas duas principais estrelas.  A informação vai na contramão do que foi publicado recentemente pelos dois maiores jornais esportivos da Catalunha, “Sport” e “Mundo Deportivo”. Ambos reafirmaram que Neymar ainda planeja voltar ao Barcelona ao término da atual temporada.  O “L'Equipe”, por sua vez, reitera que o PSG não pretende se desfazer dos dois jogadores. Especialmente porque espera tê-los focados nos meses de junho a agosto, quando os campeonatos podem voltar a ser disputados. A equipe estaria na reta decisiva das principais competições, especialmente a Liga dos Campeões, após a classificação para as quartas de final.  A Fifa antecipou que deve alterar as datas da janela de transferências. Inicialmente, o período para negociações internacionais no verão da França será entre 11 de junho e 2 de setembro, e na Espanha entre o início de julho e o início de setembro.  O jornal francês reitera que o presidente do PSG, Nasser Al-Khelaifi, nunca pretendeu negociar Mbappé, atacante desejado pelo Real Madrid. No caso de Neymar, as possibilidades também são remotas.  O “L'Equipe” cita que, ao cumprir seu terceiro ano de contrato, o atacante brasileiro pode rescindir seu vínculo com o Paris unilateralmente. Tal possibilidade existe devido a um mecanismo validado pela Fifa, e no caso de Neymar, o valor da multa baixaria para 180 milhões de euros (R$ 1 bilhão, na cotação atual), 42 milhões de euros a menos que o montante pago pelo clube francês para ter o jogador.  O preço, no entanto, é inviável ao Barcelona no momento. O jornal fracês lembra que o time catalão luta para reduzir suas despesas e fez um acordo com o elenco para reduzir os salários dos jogadores em 70% enquanto a Espanha continuar em estado de alarme.  Neymar e Mbappé têm contrato com o PSG até o final de junho de 2022. Na atual temporada, o brasileiro fez 22 jogos, marcou 18 gols e anotou nove assistências. O francês atuou 31 vezes, fez 26 gols e deu 11 passes para gol. ",esportes,,,,,,
