data,url_noticia,url_noticia_curto,titulo,conteudo_noticia,assunto,assunto_ex,titulo_ex,subtitulo_ex,local_ex,artigo_ex,n_paragrafos
2018-09-07,https://web.archive.org/web/20180907001030/https://globoesporte.globo.com/futebol/selecao-brasileira/noticia/neymar-sera-o-capitao-da-selecao-contra-os-estados-unidos-no-inicio-do-novo-ciclo.ghtml,https://globoesporte.globo.com/futebol/selecao-brasileira/noticia/neymar-sera-o-capitao-da-selecao-contra-os-estados-unidos-no-inicio-do-novo-ciclo.ghtml,Fim do rodízio: Neymar volta a ser o capitão da Seleção no novo ciclo de Tite," ''Acabou o rodízio. Neymar passa a ser nosso capitão número 1'', avisou Tite, ao abrir a coletiva desta quinta-feira, véspera do primeiro compromisso do novo ciclo do treinador à frente da seleção brasileira. Por ser o escolhido para usar a braçadeira no duelo desta sexta com os Estados Unidos, em Nova Jersey, o camisa 10 deu entrevista ao lado do treinador e disse um pouco da sensação de recuparar o posto que havia deixado de forma oficial com a conquista do ouro nos Jogos do Rio.  Tite seguiu na mesma linha após o anúncio de que Neymar reassumirá o ciclo de forma definitiva com o fim do rodízio.  - O tempo passa, as pessoas crescem e amadurecem. Esse tempo todo que estivemos com o Neymar, tivemos situações importantes que ele teve consciência e discernimento. Então ele tem sim essa condição de dar esse passo a frente - explicou o treinador.  Será a segunda vez que o camisa 10 ocupa o posto sob o comando do treinador. Desde que Tite assumiu e deu início ao rodízio (encerrado nesta quinta-feira), 16 jogadores usaram a braçadeira. Neymar foi capitão apenas contra o Paraguai, em março de 2017, no jogo que garantiu a classificação do Brasil para o Mundial da Rússia. Agora, volta a vestir a braçadeira justamente no estádio no qual fez sua estreia e o primeiro gol pela Seleção.  - De volta a esse grande estádio, onde tenho uma memória maravilhosa. Foi o começo de tudo aqui. Fico muito feliz de estar de volta. Oito anos se passaram, muitas coisas boas, algumas ruins e muitos aprendizados. Me sinto com uma responsabilidade ainda maior. Para mim é um grande prazer, uma grande honra ser nomeado o capitão. Vou fazer de tudo para exercer essa função ajudando meus companheiros e ajudando a Seleção a vencer - disse Neymar, ao falar do estádio em que atuou pela primeira vez na Seleção, em 2010.  A imprensa só acompanhou os primeiros 15 minutos do treino desta quinta. Foi possível ver apenas o aquecimento e o início do ''treino fantasma'', onde o técnico Tite posiciona a equipe titular e trabalha a movimentação sem um adversário do outro lado. Na atividade, o comandante repetiu o time titular com Alisson, Fabinho, Marquinhos, Thiago Silva e Filipe Luís; Casemiro; Douglas Costa, Fred, Philippe Coutinho e Neymar; Roberto Firmino.  Foi um momento ruim na minha carreira. Se machucar é horrível e fiz um esforço muito grande para estar na Copa. Me dediquei para estar na Seleção, defendendo meu país e fui ao meu máximo na competição. Claro que eu queria estar melhor, queria estar 100% como estou hoje. Fui no meu máximo, em busca de tudo para me entregar naquele momento. Saio de cabeça erguida. Eu lutei e busquei ao lado dos meus companheiros. Não temos que abaixar a cabeça. Faz parte ter 10 ou 15 minutos ruins, isso que aprendemos na Copa. Deixamos de jogar 15 minutos e fomos eliminados. Faz parte e vamos aprender isso.  Não tenho o que falar de cai-cai. Pego a bola 10 vezes e em 11 vou pra cima. Sou mais rápido, um pouco mais leve e sofro as faltas. Não vão me deixar passar sem me dar uma porradinha. Não adianta pedir licença. Sofri muitas faltas na Copa, mas não era isso que eu queria. É outro aprendizado que levo para mim. Vou buscar melhorar a cada dia meu futebol, minhas coisas dentro do campo e fora dele.  Vou reconquistar os torcedores jogando futebol. Claro que a responsabilidade hoje é ainda maior por causa da braçadeira. Não adianta nada ter ela e não jogar futebol. Peço desculpa a quem ficou chateado com a gente. Perder é muito ruim. Tínhamos esse gostinho de que dava, mas não foi dessa vez. A gente buscou, fez de tudo para alcançar a melhor posição. Procuramos esquecer o que passou, temos um jogo muito importante amanhã. Temos um desafio contra uma grande seleção.  Toda vez que venho para a Seleção é diferente. Falei para o Tite que a alegria de estar de volta é enorme, algo único. Difícil descrever a felicidade de vestir essa camisa. É diferente de 2010, de 2014. Estou mais velho, mais experiente. É uma sensação diferente e temos que nos preparar para passar nossa mentalidade aos mais novos. Cada vez mais nos unindo, nos fechando em campo, buscando vencer sempre e o melhor para a Seleção. Temos que nos acostumar a ser melhor do que ontem, melhorando a cada dia mais.  Não temos que pensar no futuro, temos que pensar no agora, nos Estados Unidos. Temos que fazer por onde agora para chegar na Copa de 2022. O jogo começou há três dias, não amanhã. É assim que eu penso, que o Tite e o grupo pensam. Em quatro anos eu não sei quem vai estar aqui. Melhoramos ontem, temos que melhorar amanhã.  ESTADOS UNIDOS X BRASIL  Data e horário: sexta-feira, às 21h05 (de Brasília).Local: MetLife Stadium, Nova Jersey.Escalação do Brasil: Alisson, Fabinho, Marquinhos, Thiago Silva e Filipe Luís; Casemiro; Douglas Costa, Fred, Philippe Coutinho e Neymar; Roberto Firmino.Arbitragem: Fernando Guerrero apita a partida, auxiliado por Alberto Morin e Andres Hernandez Delgado, todos do México.Transmissão: TV Globo (com Luis Roberto, Junior, Roger Flores e Arnaldo Cezar Coelho) e SporTV (com Luiz Carlos Jr. , Lédio Carmona e Muricy Ramalho). ",esportes,,,,,,
2018-09-07,https://web.archive.org/web/20180907001030/https://globoesporte.globo.com/futebol/selecao-brasileira/noticia/brasil-vai-enfrentar-arabia-saudita-e-argentina-em-outubro.ghtml,https://globoesporte.globo.com/futebol/selecao-brasileira/noticia/brasil-vai-enfrentar-arabia-saudita-e-argentina-em-outubro.ghtml,"Sem finalistas da Copa do Brasil, Seleção vai pegar Arábia e Argentina em outubro"," A CBF revelou na noite desta quinta-feira os compromissos da seleção brasileira para a próxima data Fifa, em outubro. Tite, Neymar e companhia vão à Arábia Saudita para enfrentar a equipe da casa e a Argentina, nos dias 12 e 16, respectivamente. Já a convocação para os amistosos será daqui a duas semanas, dia 21 de setembro, às 11h, na sede da CBF, no Rio de Janeiro, e não terá atletas envolvidos na final da Copa do Brasil.  - Enquanto para os amistosos de setembro a comissão técnica optou pelo equilíbrio, ao convocar apenas um atleta por equipe brasileira, para esses dois jogos na Arábia Saudita, o técnico Tite não convocará jogadores dos times classificados para a finalíssima da Copa do Brasil 2018 - informou a CBF.  Argentina começa novo ciclo da seleção sem Messi, sem técnico, sem rumo  Ou seja, dos convocados para os amistosos de setembro contra Estados Unidos e El Salvador, Paquetá e Dedé não estarão na nova lista caso Flamengo e Cruzeiro avancem para a decisão da Copa do Brasil. O corintiano Fagner também estaria com o grupo atual, mas foi cortado por lesão.  O Brasil, porém, não deve encontrar Messi na Arábia Saudita. Ele pediu para não ser convocado para defender a Argentina nos amistosos restantes de 2018. O craque do Barcelona, inclusive, teria decidido até dar um passo quase definitivo, mas, por ora, vale o acordo com o presidente Claudio Tapia e o treinador interino Lionel Scaloni: ficar fora até o ano que vem.  Otamendi e Di María seguiram o mesmo caminho. Esse afastamento de grandes nomes da equipe forçou uma convocação com muitas novidades, entre elas o zagueiro Kannemann e o atacante Giovanni Simeone, filho de Diego Simeone, para os próximos amistosos contra Guatemala (8/9) e Colômbia (11/9). Da lista, apenas oito atletas estiveram na última Copa. ",esportes,,,,,,
2018-09-07,https://web.archive.org/web/20180907001030/https://globoesporte.globo.com/futebol/times/corinthians/noticia/corinthians-volta-de-fortaleza-com-loss-em-silencio-jair-deve-comandar-treino-na-sexta.ghtml,https://globoesporte.globo.com/futebol/times/corinthians/noticia/corinthians-volta-de-fortaleza-com-loss-em-silencio-jair-deve-comandar-treino-na-sexta.ghtml,Corinthians volta de Fortaleza com Osmar Loss em silêncio; Jair Ventura deve comandar treino na sexta," O desembarque do Corinthians depois da derrota por 2 a 1 para o Ceará foi emblemático. No fim da tarde desta quinta-feira, o agora ex-técnico Osmar Loss, sozinho, foi o primeiro a passar pelo saguão do Aeroporto Internacional de Guarulhos. Mais atrás, dirigentes do Corinthians corriam para uma reunião com o presidente Andrés Sanchez e o novo treinador, Jair Ventura.  Duílio Monteiro Alves e Alessandro Nunes foram ao encontro de Andrés para definir detalhes do contrato de Jair, que chegará a São Paulo também nesta quinta para assinar com o Corinthians. Ele deve trazer para sua comissão apenas o auxiliar Emílio Faro.  A ideia, portanto, é que Jair comande seu primeiro treino na manhã desta sexta-feira. no CT Joaquim Grava, e faça sua estreia no domingo, contra o Palmeiras, na arena do rival, em jogo da 24ª rodada do Campeonato Brasileiro.  Há, também, outras duas questões a serem resolvidas:  Ninguém deu entrevistas no desembarque. Com 30 pontos, o Corinthians é o oitavo colocado no Campeonato Brasileiro. ",esportes,,,,,,
2018-09-08,https://web.archive.org/web/20180908051250/https://globoesporte.globo.com/futebol/selecao-brasileira/noticia/esse-processo-vai-ser-retomado-de-forma-natural-diz-tite-sobre-novo-ciclo.ghtml,https://globoesporte.globo.com/futebol/selecao-brasileira/noticia/esse-processo-vai-ser-retomado-de-forma-natural-diz-tite-sobre-novo-ciclo.ghtml,"Tite prevê mudanças contra El Salvador e resume novo ciclo: ""Retomando em cima de uma dor"""," Tite iniciou seu novo ciclo à frente da seleção nesta sexta-feira com vitória. Mesmo sem uma atuação brilhante, o Brasil fez o suficiente para vencer os Estados Unidos com justiça por 2 a 0. Na coletiva após o triunfo em Nova Jersey, o treinador falou sobre esse momento ainda sem deixar de citar a eliminação para a Bélgica na Copa do Mundo.  - Estamos retomando em cima de uma dor e de uma frustração. Tem um aspecto emocional. Equipe que teve Douglas Costa iniciando apenas a sua segunda partida (em 2018 pela Seleção). Me perguntaram sobre os novatos antes do jogo, mas também temos que dar mais oportunidades para quem já estava aqui. Como Firmino, Douglas Costa, Fred. E depois sim os novatos.  A Seleção embarcou para Washington logo após o jogo. No treino deste sábado foi cancelado e oa jogadores serão liberados ao meio-dia. A reapresentação está marcada para às 10h de domingo.  O Brasil volta a campo na próxima terça-feira, às 21h30 (de Brasília), em Washington, para enfrentar El Salvador. Os amistosos de outubro também já foram anunciados: Arábia Saudita e Argentina, nos dias 12 e 16. Ambos os jogos serão realizados na Arábia Saudita.  Confira abaixo mais declarações do Tite na coletiva:  Vocês vão estar sempre com os olhos voltados para o Neymar. Quero falar pouco, mas ser cúmplice do comportamento dele e das atitudes. Sem perder a audácia, sem tirar o último drible no terço final do campo. É a característica do jogador brasileiro. Os seus comportamentos e atitudes vão falar por si só. Neymar tem liderança técnica. Se pegar toda a carreira, principalmente nos quatro últimos anos, ele é Top-3. Não adianta falar, é o comportamento em campo. Daqui a pouco vão bater e falar que ele se jogou. Mas do que os outros falaram ou disseram. Foi um jogo limpo. Sobre o Neymar temos que avaliar o comportamento, não adianta continuar falando.  Tento ser justo sem prejudicar o trabalho da Seleção. Não me permiti tirar dois jogadores de uma mesma equipe. E oportunizá-los como fiz hoje. É importante nessa etapa. Não queria prejudicar os clubes, mas sei que acaba prejudicando. E favoreceu o Palmeiras, também sei disso. Mas tenho que pesar o que é importante para a Seleção e arcar com as críticas.  Não tive presente nos outros recomeços. Mas depois de uma Copa se criar expectativa pela campanha nas eliminatórias, pelo que jogamos no Mundial, é normal. Esse processo vai ser retomado de forma natural, tal qual o resultado e o desempenho.  Vamos fazer algumas mudanças no time titular sim. Com os jogadores que não iniciaram. Não vou falar quem, mas vamos oportunizar sim.  Primeiro tempo se readaptando à função. Segundo tempo soltou mais, qualidade do passe, iniciação. Eu falava para botar o Fabinho no jogo. Participar gera confiança. Depois fluiu, inclusive no lance do pênalti. Tem a bola aérea, tem a composição da linha de quatro. É um jogador mais posicional, com boa qualidade de passe. Tem essas virtudes. ",esportes,,,,,,
2018-09-08,https://web.archive.org/web/20180908051250/https://globoesporte.globo.com/cartola-fc/dicas/noticia/receita-caseira-dicas-tecnicas-24-apostam-so-em-mandantes-para-a-rodada.ghtml,https://globoesporte.globo.com/cartola-fc/dicas/noticia/receita-caseira-dicas-tecnicas-24-apostam-so-em-mandantes-para-a-rodada.ghtml,Receita caseira! Dicas técnicas #24 apostam só em mandantes para a rodada," As dicas técnicas para a rodada #24 estão bem caseiras: todas as nossas sugestões são em cima de jogadores que vão atuar em casa. Focamos, principalmente, em atletas com boas médias como mandantes e que recebem visitantes com campanhas ruins neste Brasileirão. Confira: são duas opções por posição! E, claro, não deixe de escalar o seu time - o mercado fecha neste sábado (08), às 14h (de Brasília).  + Confira as Dicas Econômicas #24: time por C$ 84+ Seja PRO e concorra a prêmios em todas as rodadas!  Ronaldo (Vitória) - C$ 5.91  Alguns são os motivos para apostarmos em Ronaldo. Primeiro, a zaga do Vitória, bastante vazada na competição, começou a se encaixar e já não sofre gols há três jogos. Segundo, em casa, o goleiro tem média surpreendente: de 9,12 pontos em seis partidas disputadas. E, por fim, o adversário da vez é o Vasco, que, longe de São Januário, ainda não venceu e marcou apenas seis vezes (em 10 duelos).  Adversário: Vasco, no Barradão.  Victor (Atlético-MG) - C$ 12.43  A média de Victor como mandante é de 4,93 pontos - nada de muito atraente, é verdade. Mas ultimamente, ele tem subido bastante de produção quando joga em casa. Sua média nas últimas três partidas - atuando no Horto - é de 8,67 e, nas últimas cinco, de 10,04. Além disso, o Furacão é mais uma equipe que ainda não venceu como visitante neste Brasileirão - com apenas três gols marcados em 11 jogos.  Adversário: Atlético-PR, no Independência.  Renê (Flamengo) - C$ 12.81  Dificilmente, Renê pontua mal quando joga no Maracanã. Pelo contrário. Além de ter média de 7,01 pontos como mandante, nunca negativou - mesmo quando não recebeu o SG. Nesta rodada, joga contra a Chape, que, como visitante, ainda não venceu e marcou apenas oito gols em 12 jogos. E, apesar do Flamengo vir de uma derrota inesperada contra o Ceará, segue sendo o melhor mandante da competição - com apenas quatro gols sofridos.  Adversário: Chapecoense, no Maracanã.  Sander (Sport) - C$ 11.99  Enquanto você lia essa frase, Sander roubou mais uma bola! O cara não deixa passar uma! E esse é o principal motivo para apostarmos nele: já são 74 RBs em 21 jogos (média de 3,50). Em casa, então, sua média de RBs aumenta um pouquinho - para quatro por partida (acumula 40 em 10 confrontos). Para fechar, recebe um Cruzeiro misto - de olho no primeiro jogo da semifinal da Copa do Brasil, na próxima quarta-feira, Mano Menezes deve poupar alguns titulares.  Adversário: Cruzeiro, na Ilha do Retiro.  Bruno Alves (São Paulo) - C$ 10.54  A média de Bruno Alves, como mandante, é quase de 5,00 pontos por jogo (mais precisamente 4,96). Não é ruim pensando em defensores, que costumam pontuar menos com finalizações, assistências e gol. Fora isso, o São Paulo vai enfrentar o Bahia - pouco ""agressivo"" como visitante. O Tricolor baiano acumula apenas cinco gols fora de casa. Interessante pensando no saldo de gol!  Adversário: Bahia, no Morumbi.  Leonardo Silva (Atlético-MG) - C$ 10.41  Como já citado, o Furacão, adversário da vez, tem sido presa fácil quando atua fora de casa - apenas três gols marcados e nenhuma vitória em 11 partidas. Esses números, pensando em SG, são atraentes. Junto a isso, vale destacar a boa média de Leonardo Silva como mandante: 7,40 pontos em seis jogos. Tem tudo para corresponder bem na rodada!  Adversário: Atlético-PR, no Independência.  Diego (Flamengo) - C$ 9.89  Tem bom retrospecto contra a Chape: atuando pelo Fla, já marcou quatro gols. Mas o favoritismo rubro-negro é o principal motivo do camisa 10 aparecer por aqui. Joga no Maraca - o Flamengo é a equipe que mais pontuou como mandante - contra um adversário que ainda não venceu como visitante. Por fim, vem descansado, já que estava suspenso na última rodada, e precisa assumir mais protagonismo no meio-campo, uma vez que Paquetá não joga (está com a Seleção Brasileira).  Adversário: Chapecoense, no Maracanã.  Nenê (São Paulo) - C$ 9.99  Líder do campeonato, mandante na rodada... o São Paulo tem tudo para ser uma boa! Pensando nisso, apostar em Nenê (e/ou Diego Souza) pode ser uma boa. Falando especificamente do camisa 10, já tem oito gols e duas assistências - além de ser o homem das bolas paradas do Tricolor paulista. Por fim, o Bahia é mais um que não faz boa campanha como visitante: 11 duelos, apenas uma vitória, cinco gols marcados e 17 sofridos.   Adversário: Bahia, no Morumbi.  Neilton (Vitória) - C$ 12.27  Vem descansado, após não ter jogado no meio da semana - estava suspenso. E enfrenta o Vasco, que ainda não venceu fora de casa. No Barradão, Neilton fez quatro dos cinco gols que tem neste Brasileirão e tem boa média - de 6,34 pontos. Os últimos dois jogos que disputou em casa, o Vitória venceu - além de ter empatado na última rodada, longe de seus domínios. Ou seja, vive uma boa fase!  Adversário: Vasco, no Barradão.  Ricardo Oliveira (Atlético-MG) - C$ 12.39  Em casa, o atacante tem brilhado muito! 11 jogos e média de 8,42 pontos. Difícil fugir dele quando o Galo é mandante - ainda mais nesta rodada, quando enfrenta o Furacão, adversário que não vem bem como visitante. Em todo Brasileirão, já tem nove gols, seis assistências e 46 finalizações (duas na trave, 22 defendidas e 22 para fora).   Adversário: Atlético-PR, no Independência.  Sábado, 08/09Sport x CruzeiroSão Paulo x BahiaFlamengo x Chapecoense  Domingo, 09/09América-MG x CearáFluminense x BotafogoPalmeiras x CorinthiansInternacional x GrêmioParaná x SantosVitória x Vasco  Segunda-feira, 10/09Atlético-MG x Atlético-PR ",esportes,,,,,,
2018-09-08,https://web.archive.org/web/20180908051250/https://globoesporte.globo.com/futebol/times/flamengo/noticia/juan-sofre-ruptura-no-tendao-de-aquiles-e-precisa-passar-por-cirurgia.ghtml,https://globoesporte.globo.com/futebol/times/flamengo/noticia/juan-sofre-ruptura-no-tendao-de-aquiles-e-precisa-passar-por-cirurgia.ghtml,Juan sofre ruptura do tendão de Aquiles e precisa passar por cirurgia," O ano de 2018 tem sido muito complicado para o zagueiro Juan. O defensor do Flamengo sofreu uma ruptura do tendão de Aquiles do tornozelo direito, ao fim do treino desta sexta-feira, no Ninho do Urubu. O jogador foi levado para um hospital e, após a realização de exames de ressonância magnética, ficou definida a necessidade de cirurgia.  O Flamengo ainda não confirmou a data da cirurgia, mas ela deve ser realizada na semana que vem. Após o procedimento, o clube irá informar sobre prognóstico e previsão de tempo de recuperação.  Essa é mais uma lesão enfrentada por Juan na temporada. Em fevereiro, o zagueiro sofreu com dores nas costas, mais precisamente na região lombar, e ficou fora de alguns jogos, como a decisão da Taça Guanabara. Depois, em maio, foi constatado um problema muscular na coxa direita.  Em 2018, Juan disputou apenas 14 jogos pelo Flamengo: cinco pelo Campeonato Carioca, cinco pela Copa Libertadores e quatro pelo Campeonato Brasileiro. A última partida foi a derrota para o Grêmio, por 2 a 0, pelo Brasileirão. Ele tem contrato com o clube até o fim do ano. Essa nova lesão pode antecipar a decisão da aposentadoria, aos 39 anos. ",esportes,,,,,,
2018-09-09,https://web.archive.org/web/20180909060149/https://sportv.globo.com/site/combate/noticia/tyron-woodley-da-show-e-finaliza-darren-till-no-segundo-round-no-ufc-228.ghtml,https://sportv.globo.com/site/combate/noticia/tyron-woodley-da-show-e-finaliza-darren-till-no-segundo-round-no-ufc-228.ghtml,Tyron Woodley dá show e finaliza Darren Till no segundo round no UFC 228," O peso-meio-médio definitivamente tem um dono. Com uma atuação precisa e muito empolgante, Tyron Woodley não deu chances ao desafiante, o inglês Darren Till e, após um duro castigo, encaixou um triângulo de mão e conseguiu a vitória por finalização aos 4m19s do segundo round, encerrando uma invencibilidade de 18 lutas do rival e defendendo o cinturão pela quarta vez. Com a vitória, Tyron Woodley chega a 19 vitórias em 23 lutas como profissional.  A luta começou com Woodley partindo para a luta, aplicando dois golpes e encurtando a distância imediatamente, travando Till na grade. O árbitro não deixou que o impasse se prolongasse e separou os dois. De volta à luta na longa distância, os dois lutadores mantiveram-se cautelosos, mas Woodley tomou a iniciativa do ataque, primeiro com dois golpes, e depois tentando buscar a perna de Till, e depois levando a luta novamente para a grade, travando o inglês e aplicando joelhadas nas suas pernas. Till se afastou e tentou chutes altos, que pararam na guarda do americano.  No segundo round, Woodley conseguiu uma importante vantagem ao acertar um golpe de encontro em Till e derrubá-lo. Vendo a chance do nocaute , o campeão partiu para cima do inglês e desferiu cotoveladas e golpes de cima para baixo que acertaram em cheio o rosto de Till. O desafiante se defendia como podia, mostrando muita resistência. Woodley não dava espaço e mantinha a pressão sobre o rival, mantendo-se por cima no chão e golpeando seguidamente. Aos poucos, Woodley viu a brecha para encaixar um triângulo de mão. Quando o fez, Till não teve outra opção a não ser bater em desistência, cedendo a vitória ao campeão.  Confira os resultados das demais lutas do evento:  CARD PRINCIPALJéssica Bate-Estaca venceu Karolina Kowalkiewicz por nocaute a 1m58s do R1Zabit Magomedsharipov venceu Brandon Davis por finalização aos 3m46s do R2Jimmie Rivera venceu John Dodson por decisão unânime (30-27, 30-27 e 29-28)Abdul Razak Alhassan venceu Niko Price por nocaute aos 43s do R1CARD PRELIMINARTatiana Suárez venceu Carla Esparza por nocaute técnico aos 4m33s do R3Aljamain Sterling venceu Cody Stamann por finalização aos 3m42s do R2Geoff Neal venceu Frank Camacho por nocaute a 1m23s do R2Darren Stewart venceu Charles Byrd por nocaute técnico aos 2m17s do R2Diego Sanchez venceu Craig White por decisão unânime (triplo 30-27)Jim Miller venceu Alex White por finalização a 1m29s do R1Irene Aldana venceu Lucie Pudilova por decisão dividida (29-28, 28-29 e 29-28)Jarred Brooks venceu Roberto Sanchez por decisão dividida (29-28, 28-29 e 29-28)  Assine o Combate Play e assista ao Combate em qualquer lugar ",esportes,,,,,,
