data,url_noticia,url_noticia_curto,titulo,conteudo_noticia,assunto,assunto_ex,titulo_ex,subtitulo_ex,local_ex,artigo_ex,n_paragrafos
2020-03-31,https://web.archive.org/web/20200331060831/https://g1.globo.com/economia/noticia/2020/03/30/mercado-preve-retracao-de-048percent-no-pib-deste-ano-e-novo-corte-de-juros-em-maio.ghtml,https://g1.globo.com/economia/noticia/2020/03/30/mercado-preve-retracao-de-048percent-no-pib-deste-ano-e-novo-corte-de-juros-em-maio.ghtml,"Mercado prevê retração de 0,48% no PIB deste ano e novo corte nos juros em maio"," Os economistas do mercado financeiro reduziram de novo a estimativa para o crescimento do PIB neste ano e passaram a prever contração para o ano de 2020, assim como também passaram a esperar um novo corte na taxa básica de juros, a Selic, em maio.  As projeções fazem parte do boletim de mercado, conhecido como relatório ""Focus"", divulgado nesta segunda-feira (30) pelo Banco Central (BC). Os dados foram levantados na semana passada em pesquisa com mais de 100 instituições financeiras.  As reduções da expectativa para o nível de atividade acontecem em meio à pandemia do coronavírus, que tem derrubado a economia mundial e colocado o mundo no caminho de uma recessão.  Para o Produto Interno Bruto (PIB) de 2020, a previsão, que antes era de um crescimento de 1,48%, passou a ser uma queda de 0,48%. Essa foi a sétima queda consecutiva do indicador.  O PIB é a soma de todos os bens e serviços produzidos no país e serve para medir a evolução da economia.  Nas últimas semanas, tanto o Ministério da Economia quanto o Banco Central também revisaram suas estimativas e passaram a prever estabilidade (sem alta, mas também sem contração) do PIB neste ano.  Em 2019, segundo dados do Instituto Brasileiro de Geografia e Estatística (IBGE), o PIB cresceu 1,1%. Foi o desempenho mais fraco em três anos.  Para o próximo ano, a previsão de crescimento do Produto Interno Bruto (PIB) foi mantida em 2,50%.  O mercado financeiro também passou a prever um novo corte na taxa básica de juros da economia, a Selic, atualmente na mínima histórica de 3,75% ao ano.  A expectativa dos economistas dos bancos é de que, na próxima reunião do Comitê de Política Monetária (Copom) do Banco Central, no começo de maio, a taxa seja reduzida em 0,25 ponto percentual, para 3,5% ao ano - e que assim permaneça até o fim de 2020.  Para o fechamento de 2021, a expectativa do mercado para a taxa Selic recuou de 5,25% para 5% ao ano, o que pressupõe alta do juro no ano que vem.  Segundo o relatório divulgado pelo BC, os analistas do mercado financeiro reduziram a estimativa de inflação para 2020 de 3,04% para 2,94%.  A expectativa de inflação do mercado para este ano segue abaixo da meta central, de 4%. O intervalo de tolerância do sistema de metas varia de 2,5% a 5,5%.  A meta de inflação é fixada pelo Conselho Monetário Nacional (CMN). Para alcançá-la, o Banco Central eleva ou reduz a taxa básica de juros da economia (Selic).  Para 2021, o mercado financeiro baixou a estimativa de inflação de 3,60% para 3,57%. No ano que vem, a meta central de inflação é de 3,75% e será oficialmente cumprida se o índice oscilar de 2,25% a 5,25%. ",economia,,,,,,
2020-03-31,https://web.archive.org/web/20200331060831/https://g1.globo.com/economia/noticia/2020/03/31/fgts-trabalhador-tem-ate-esta-terca-para-fazer-saque-imediato-de-ate-r-998-retirada-por-ser-feita-por-app.ghtml,https://g1.globo.com/economia/noticia/2020/03/31/fgts-trabalhador-tem-ate-esta-terca-para-fazer-saque-imediato-de-ate-r-998-retirada-por-ser-feita-por-app.ghtml,FGTS: trabalhador tem até esta terça para fazer saque imediato de até R$ 998; retirada pode ser feita por app," Termina nesta terça-feira (31) o prazo para os saques imediatos do Fundo de Garantia do Tempo de Serviço (FGTS) de até R$ 998 por conta.  ""A partir desta data, os valores não sacados serão devolvidos à conta do FGTS do trabalhador, com as remunerações devidas no período, sem nenhum ônus para o titular da conta"", informa a Caixa Econômica Federal.  A Caixa lembra que o saque FGTS de todas as modalidades pode ser realizado pelo Aplicativo FGTS, de forma totalmente digital e gratuita. Os valores podem ser transferidos para uma conta bancária de titularidade do trabalhador em qualquer instituição financeira, sem nenhum custo, evitando-se o deslocamento até uma agência, segundo o presidente da Caixa Econômica Federal, Pedro Guimarães.  O saque imediato não tem relação com o saque-aniversário, que só começa a ser pago em abril de 2020 (veja mais informações abaixo).  Segundo o último balanço divulgado pela Caixa, 60 milhões dos 96 milhões de trabalhadores tinham retirado os recursos até o dia 24 de março. Além disso, foram pagos R$ 28 bilhões do total de R$ 42,6 bilhões liberados. Ou seja, 63% dos trabalhadores sacaram 66% dos recursos.  Caso o saque não seja feito até o final deste mês, os valores retornam para as contas do FGTS, com a devida atualização monetária e juros correspondentes ao período em que estiveram disponíveis para saque.  Os correntistas da Caixa que não quiserem fazer a retirada - o dinheiro cai automaticamente na conta poupança - têm até o dia 30 de abril de 2020 para informar ao banco que preferem manter o dinheiro no Fundo de Garantia. Nesse caso, mesmo que o crédito tenha sido feito na conta, a Caixa tem até 60 dias para retornar os valores para a conta vinculada de FGTS.  Essa liberação abrange contas vinculadas do FGTS que ainda estão recebendo depósitos do empregador atual e também de empregos anteriores, as chamadas contas inativas.  O valor sacado será de até R$ 500 por conta vinculada de titularidade do trabalhador, limitado ao valor do saldo tanto das contas ativas como inativas, para as contas que, em 24 de julho de 2019, tinham mais de R$ 998.  Por exemplo: se ele tiver duas contas, uma com saldo de R$ 1.000 e outra com saldo de R$ 2.000, ele poderá sacar R$ 500 de cada uma delas. Se tiver R$ 70 na conta, poderá retirar o valor total. Veja mais exemplos abaixo:  Para as contas que na mesma data tinham até R$ 998, será possível fazer o saque do valor total.  Para agilizar o atendimento, a Caixa recomenda que o trabalhador leve a sua Carteira de Trabalho.  O saque imediato não impede o direito do trabalhador ao saque do FGTS por motivo de rescisão contratual nem tira o direito a receber a multa dos 40% sobre o valor, bem como não impede o saque para as demais modalidades como aposentadoria, aquisição da casa própria e doença grave.  Ninguém é obrigado a sacar o dinheiro do FGTS. Se não houver a retirada, o dinheiro permanece no fundo, ganhando rentabilidade. No ano passado, por exemplo, as contas do FGTS renderam 6,18% com os juros fixos de 3% ao ano mais TR e a distribuição de 100% do lucro líquido do fundo (R$ 12,2 bilhões, pagos em agosto deste ano, sobre o saldo de dezembro de 2018). Portanto, as contas do FGTS renderam mais que a poupança e o CDB, que em 2018 tiveram rendimentos de 4,62% e 6,06%, respectivamente.  O recebimento do saque imediato não gera adesão ao saque-aniversário. Os trabalhadores nascidos em março têm até o fim deste mês para aderir ao saque-aniversário para receber um percentual do saldo do Fundo de Garantia do Tempo de Serviço (FGTS) ainda neste ano.  Da mesma forma, os beneficiários devem informar sua escolha até o fim do mês de seu aniversário para receber no mesmo ano de adesão. Quem perder o prazo pode fazer a adesão, como os nascidos em janeiro e fevereiro, mas só passará a receber no ano que vem.   Nesse caso, os saques serão anuais e começarão em abril, de acordo com o mês em que o beneficiário nasceu.   Veja o calendário do saque-aniversário:  Até o dia 24 de março, mais de 2,9 milhões de pessoas haviam aderido ao saque-aniversário - a adesão começou no dia 1º de outubro do ano passado.  O valor do saque anual será um percentual do saldo de todas as contas do trabalhador. Para contas com até R$ 500, será liberado 50% do saldo, percentual que vai se reduzindo quanto maior for o valor em conta. Para as contas com mais de R$ 500, os saques serão acrescidos de uma parcela fixa. Portanto, os cotistas com saldo menor poderão sacar anualmente percentuais maiores.  O trabalhador ficará impedido de retirar o valor integral do FGTS na rescisão do contrato de trabalho. No entanto, ele continua tendo direito ao pagamento da multa dos 40% em cima do valor total. Em caso de arrependimento, o trabalhador só poderá retornar ao chamado saque-rescisão após dois anos a partir da data de adesão ao saque-aniversário.  No entanto, o trabalhador que optar pelo saque-aniversário continuará tendo direito à retirada o saldo do FGTS para a casa própria, em caso de doenças graves, de aposentadoria e de falecimento do titular e para as demais hipóteses previstas em lei para o saque.  O banco disponibilizou os canais de atendimento para que o trabalhador com conta do FGTS, ativa ou inativa, realize a opção. Eles são os seguintes:  Site da Caixa permite simular valor e aderir ao saque-aniversário; saiba como fazer  Quem tem conta poupança ou conta corrente na Caixa ou em qualquer outro banco pode solicitar o crédito em conta. Em caso de necessidade de transferência de um banco para outro, não é permitido cobrar pela operação. ",economia,,,,,,
2020-03-31,https://web.archive.org/web/20200331060831/https://g1.globo.com/economia/noticia/2020/03/30/petrobras-faz-importacao-adicional-de-gas-de-cozinha-e-reduz-preco-em-10.ghtml,https://g1.globo.com/economia/noticia/2020/03/30/petrobras-faz-importacao-adicional-de-gas-de-cozinha-e-reduz-preco-em-10.ghtml,Petrobras faz importação adicional de gás de cozinha e reduz preço em 10%," A Petrobras informou nesta segunda-feira (30) que contratou a importação adicional de Gás Liquefeito de Petróleo (GLP), num momento em que consumidores em alguns pontos do país realizaram uma corrida às compras do chamado gás de cozinha, em meio a preocupações com a oferta devido a medidas de controle do coronavírus.  A Petrobras anunciou a importação de três navios carregados com GLP, cada um com capacidade de 20 milhões de quilos, ou o equivalente a 1,6 milhão de botijões de cozinha, para reforçar o abastecimento do país, segundo nota da companhia.  O primeiro navio está programado para chegar nesta segunda-feira, enquanto os outros dois em 6 e 10 de abril.  A petroleira destacou, dessa forma, que ""não há qualquer necessidade de estocar GLP neste momento, pois não haverá falta de produto para abastecer a população"".  O ponto mais crítico sofrido com atraso na reposição do produto para a venda nos últimos dias foi o município de São Paulo, onde as compras chegaram a subir 20%, segundo cálculos do Sindicato Nacional das Empresas Distribuidoras de Gás Liquefeito de Petróleo (Sindigás).  Segundo o presidente do Sindigás, Sergio Bandeira de Mello, a situação deverá ser totalmente normalizada em uma semana, no máximo.  ""A gente não percebe um aumento do consumo de GLP, a gente percebe neste momento uma antecipação de compra"", disse Bandeira de Mello à Reuters, destacando que estão sendo realizadas campanhas para estimular o consumo consciente e solidário durante o período de isolamento social.  Bandeira de Mello pontuou que agentes do setor de GLP haviam se preparado para enfrentar o atual momento de combate ao coronavírus e garantiu que toda a logística necessária para o abastecimento está funcionando normalmente. Atualmente, 96% dos lares brasileiros consomem gás de cozinha, acrescentou.  O presidente do Sindigás disse ainda que cálculos preliminares feitos por distribuidoras indicaram que não haverá um aumento importante do consumo de GLP no Brasil durante o período de isolamento social para o combate ao novo coronavírus, apesar de uma possível mudança no perfil do consumo.  Isso porque enquanto as residências podem elevar o consumo de GLP, com uma presença maior das pessoas em casa, indústria e comércio devem reduzir sua demanda.  Em paralelo, a Petrobras reduzirá em 10%, para R$ 21,85, o preço médio do botijão de 13 kg de GLP, utilizado em residências, a partir de terça-feira. No acumulado do ano, a redução é de cerca de 21%.  ""A Petrobras conta com as distribuidoras e revendedores para que essas reduções do preço do botijão de gás cheguem até o consumidor final"", disse a empresa em nota.  À Reuters, Bandeira de Mello destacou que está pedindo aos consumidores que denunciem qualquer tipo abuso de preços para que as medidas necessárias possam ser tomadas. ",economia,,,,,,
2020-04-01,https://web.archive.org/web/20200401210934/https://g1.globo.com/economia/noticia/2020/04/01/parei-de-mandar-dinheiro-para-minha-mae-cortei-a-internet-como-os-brasileiros-estao-lidando-com-a-queda-na-renda.ghtml,https://g1.globo.com/economia/noticia/2020/04/01/parei-de-mandar-dinheiro-para-minha-mae-cortei-a-internet-como-os-brasileiros-estao-lidando-com-a-queda-na-renda.ghtml,"Parei de mandar dinheiro para minha mãe', 'cortei a internet'; como os brasileiros estão lidando com a queda na renda "," Brasileiros afetados pelo desemprego e queda ou interrupção nas suas atividades em decorrência da quarentena devido ao avanço do novo coronavírus já começaram a refazer seus gastos para enfrentar a queda abrupta da renda.  Entre as medidas relatadas estão interrupção do pagamento do cartão de crédito, corte nas compras do supermercado e de pedidos de entrega de comida e até de internet.  Veja abaixo os relatos de uma desempregada, de um motorista de aplicativo que teve corte de 90% nas corridas e de uma vendedora em férias coletivas.  A vendedora Dede Bezerra, de 44 anos, está em férias coletivas desde a semana passada. Esta foi a alternativa encontrada pela empresa para atender à determinação de quarentena na cidade de São Paulo.  Ela continua recebendo o salário, mas o dinheiro da comissão das vendas – que tem a maior proporção na renda – não vai entrar no período. Além disso, o baixo movimento na loja nas últimas semanas antes de ser decretada a quarentena em São Paulo também refletiu na queda das suas comissões.  A vendedora não colocou as contas no papel, mas já está repensando todos os seus gastos. Nem a ajuda financeira que dava para sua mãe será poupada dos cortes. Dede conta que vai priorizar o pagamento do aluguel e das contas de água, luz, gás e internet. “Agora que estou mais em casa, vai aumentar o valor, então tenho que estar preparada para isso”, prevê.  Além disso, ela já começou a diminuir as compras do supermercado. Só levará para casa arroz, feijão e “alguma mistura que seja mais barata”. Ela diminuiu até a compra de produtos de limpeza. “Então nem dá para pensar em fazer estoque”. Dede passará ainda a comprar rações de marcas mais baratas para os dois cachorros. Os pedidos de comida por aplicativo também foram suspensos. E quando voltar a trabalhar decidiu que levará marmita todos os dias.  Os pagamentos de suas dívidas terão de ser interrompidos. E ela decidiu que vai parcelar o que deve no cartão de crédito.  A vendedora afirma que não poderá mais mandar dinheiro para a mãe que mora no Ceará – a irmã vai cobrir a parte dela e, quando sua renda voltar ao normal, pagará os valores devidos. “Nem minha mãinha foi poupada”, lamenta.  Dede tinha férias marcadas para abril, mas seu voo foi cancelado. Ela até se animou com a possibilidade de conseguir logo o dinheiro de volta, mas a empresa aérea deu como opção o estorno em até 12 meses ou a remarcação do voo.  Se não voltar a trabalhar no próximo dia 8, que é quando terminam as férias coletivas, não sabe o que a espera. “Porque eles não podem cortar o salário, mas o dinheiro da comissão não vai entrar, aí vou ter que pensar em cortar mais coisas”, afirma.  O motorista de aplicativo Cleber Antonio de Lima, de 42 anos, está amargando a perda de 90% no número de corridas. “Cheguei a trabalhar das 6h à 1h da manhã na semana passada para fazer sete corridas”, conta.  A queda na demanda fez com que o motorista reduzisse seu tempo na rua – se antes ele ficava 16 horas fazendo corridas, agora ele trabalha das 6h30 às 16h. “Tive que tomar essa decisão porque não tem corrida e não dá para ficar gastando gasolina”, justifica.  Ele conta que tirava cerca de R$ 3 mil por mês, descontados os custos com o carro. Agora acredita que vai tirar ao redor de R$ 400. Como era o responsável pela maior parte da renda dentro de casa, agora ele conta com o dinheiro que vem das encomendas de bolos que a mulher faz para fora. Os R$ 300 que tinha guardado já foram gastos com as compras de supermercado.  Neste mês já pagou as contas de consumo e aluguel, mas no mês que vem não sabe se vai ter o dinheiro e já avisou o dono da casa que poderá ficar devendo. “Estou fazendo o possível para ter o dinheiro do aluguel. Até então estava tudo organizado” conta.  O motorista de aplicativo diz que cortou o possível das compras e, no mês que vem, seguirá a mesma prática. “Comprei só o necessário, porque ninguém vai morrer comendo só arroz e feijão. Tenho arroz, feijão, óleo e sal para dois meses. E cortei os supérfluos, não peço mais pizza nem esfiha em casa. Cortei até o pão, comprava 10 por dia, agora compro cinco. Reduzi as frutas também”, diz.  A esposa não pega mais transporte por aplicativo: Lima é quem está fazendo todas as corridas com ela, principalmente as entregas dos bolos. Outra decisão foi deixar de pagar o cartão de crédito. A dívida chega a R$ 8 mil, incluindo os juros. “Não tem nem como refinanciar as dívidas”, afirma.  A mulher de Lima trabalha como cuidadora há quase 15 anos tomando conta de uma pessoa com deficiência. Mas foi dispensada por 15 dias.  “Minha esposa me ajuda, se ela não estivesse trabalhando ficaria muito mais difícil, então ela completa o que falta. Embora ela ganhe pouco também”.  Segundo Lima, as encomendas de bolo aumentaram neste momento em que as pessoas não estão saindo de casa. “Se melhorar mais e eu conseguir abrir um comércio para ela, com certeza eu paro com o transporte por aplicativo”, comenta.  O motorista diz que optou pelas corridas por aplicativo após perder o emprego de supervisor de estacionamento. No começo de março, ele havia sido contratado como eletricista, mas foi dispensado após uma semana de trabalho porque um funcionário da empresa contraiu a Covid-19.  Como supervisor de estacionamento, sua renda era três vezes maior. Então teve de adequar seus gastos ao que passou a ganhar como motorista de aplicativo. Esta é a segunda vez que Lima terá de mexer em seu orçamento para conseguir viver com o dinheiro que tem.  A promotora de vendas Gleice Regina dos Santos perdeu o emprego após 1 ano e meio como contratada. Ela conta que a justificativa da empresa foi que não teria condições de pagar os funcionários que iriam ficar em casa após a interrupção das atividades.  “Então agora tudo vai ficar mais difícil, pagar o aluguel e sustentar meus filhos de 3 e 7 anos. Sou responsável pela maior parte da renda”, afirma.  O marido teve que fechar seu salão de cabeleireiro por causa da quarentena. Os dois agora contam com o que ainda têm no banco. Gleice já planeja não pagar o que deve no cartão de crédito – a dívida é de R$ 2,5 mil. “Vou cortar até a internet de casa. E os celulares só terão internet quando realmente precisar”, diz.  Os passeios em família também estão suspensos. Ela afirma que só manterá o pagamento do aluguel e vai reservar uma parte para comprar comida, mas “só o básico”. “Os pedidos de costume como pizza aos finais de semana tive que cortar. Não vou mais pagar também a escola de balé da minha filha de 7 anos”, conta.  O marido está há duas semanas sem trabalhar. ""Ele está muito bravo, porque agora vai atrasar o pagamento de todas as dívidas do salão, as de antes e as próximas, incluindo aluguel e contas de água e luz. Ele improvisou um salãozinho no quintal de casa e está cortando um ou dois cabelos por dia”, diz Gleice.  A família estava com viagem de férias programada para o Rio em agosto. ""Estava tudo bem, e do nada aconteceu isso. A gente não esperava. Tomara que isso passe logo porque eu ganhava bem, salário mais comissões, fora vale-refeição em dinheiro”, lamenta. ",economia,,,,,,
