data,url_noticia,url_noticia_curto,titulo,conteudo_noticia,assunto,assunto_ex,titulo_ex,subtitulo_ex,local_ex,artigo_ex,n_paragrafos
2018-09-14,https://web.archive.org/web/20180913172126/https://globoesporte.globo.com/futebol/times/cruzeiro/noticia/pelo-fim-da-polemica-fabio-garante-ter-sofrido-falta-e-pede-respeito-ao-cruzeiro.ghtml,https://globoesporte.globo.com/futebol/times/cruzeiro/noticia/pelo-fim-da-polemica-fabio-garante-ter-sofrido-falta-e-pede-respeito-ao-cruzeiro.ghtml,Pelo fim da polêmica: Fábio garante ter sofrido falta e pede respeito ao Cruzeiro," O último lance de Palmeiras 0 x 1 Cruzeiro causou uma disputa de versões. De um lado, os jogadores do time mandante pediam uso do árbitro de vídeo para ter chance de o gol do zagueiro Antônio Carlos ser validado. Do outro, os jogadores da Raposa queriam a marcação da falta de Edu Dracena no goleiro Fábio, o que acabou ocorrendo (veja no vídeo abaixo). Fato que rendeu muitas reclamações por parte do Palmeiras.  + Cruzeiro é outra vez cirúrgico fora de casa e repete filmes anteriores de 2018  Personagem do jogo, não só pelo lance da falta, mas por uma atuação impecável, o goleiro Fábio pediu que a vitória do Cruzeiro por 1 a 0, na casa do adversário, não fosse desvalorizada por causa de um lance que, segundo ele, foi de infração.  Confira a análise do comentarista Marcio Rezende Freitas a respeito do lance:  Momentos antes do gol, Fábio fez uma defesa milagrosa em jogada do próprio companheiro. Egídio tentou cortar o cruzamento, mas mandou uma bola com veneno no canto. O poder de reação do goleiro do Cruzeiro foi determinante para evitar que a bola entrasse (veja no vídeo abaixo).  - Foi num momento difícil. O Egídio foi tentar tirar, mas a bola saiu errada do pé dele. Mesmo assim, consegui fazer a defesa.  Seja Sócio do Time do Povo - clique aqui ",esportes,,,,,,
2018-09-14,https://web.archive.org/web/20180913172126/https://globoesporte.globo.com/futebol/times/flamengo/noticia/braco-cabeca-e-lingua-uribe-cumpre-mais-um-jogo-de-isolamento-e-agonia-no-fla.ghtml,https://globoesporte.globo.com/futebol/times/flamengo/noticia/braco-cabeca-e-lingua-uribe-cumpre-mais-um-jogo-de-isolamento-e-agonia-no-fla.ghtml,"Uribe pede, sinaliza, mas fica isolado e cumpre mais um jogo de agonia no Fla"," A cena se repetiu durante boa parte dos 72 minutos em que Fernando Uribe ficou em campo no empate sem gols com o Corinthians, nessa noite de quarta-feira no Maracanã. Entre os zagueiros Henrique e Léo Santos, o jogador colombiano aponta para o companheiro onde quer receber a bola. Levanta o braço e pede o cruzamento. Sai da área, toca para a lateral, corre e... nada.  Num elenco com cinco estrangeiros, nenhum se sente tão solitário quanto Uribe. E não é apenas a barreira da língua - que o colombiano já até supera com desenvoltura em pouco mais de dois meses de Flamengo. O fato é que meias, atacantes e laterais pouco procuram Uribe em campo - o que também acontece, por vezes, com Henrique Dourado em campo.  Mais uma vez Uribe tocou pouco na bola. Sua única finalização levou perigo - no desvio no primeiro pau após escanteio cobrado por Diego, no primeiro tempo. E foi pelo alto que mostrou mais utilidade. Em outros dois lances, tentou ajeitar de peito para Vitinho e ganhou pelo alto para a bola chegar no camisa 14, com a zaga corintiano levando a vantagem na sequência do lance.  >>> Veja o que Barbieri falou sobre Uribe e sobre o empate com o Corinthians  >>> Análise: Fla volta a escancarar fragilidade na criação e trava no burocrático Corinthians  Em rara entrevista desde sua chegada - Uribe falou depois de marcar o seu único gol em 12 jogos, diante do Sport (4 a 1) -, o centroavante colombiano, que ostentou média de 0,51 gol por partida no Toluca, em sua última temporada, transpareceu frustração com seu início e admitiu a dificuldade no entendimento com seus novos companheiros.  - O início é difícil, mas estamos trabalhando para melhorar. Sei da responsabilidade, o que ""la gente"" quer... Ainda precisa melhorar muitas coisas. Estou em processo de conhecer os companheiros, o que eles fazem, mas eu que quero quero melhorar - disse o jogador.  O entrosamento - ou a falta dele - foi nítido em algumas jogadas do empate dessa noite de quarta. Éverton Ribeiro buscou lançamento para Uribe no primeiro tempo, mas o colombiano errou o tempo da bola. Vitinho cruzou por cima e pelo alto e o centroavante não alcançou a bola em mais de uma oportunidade. Rodinei foi na ponta e chutou a gol ao invés de buscar o companheiro. Esta foi a tônica do isolamento de Uribe em campo.  Repare na sequência abaixo.  Cena 1 - Rodinei recebe na ponta direita. Uribe está no centro da área.  Cena 2 - Uribe se posiciona mais à frente, mas Rodinei arrisca o chute...  Uribe foi titular em dois jogos consecutivos, o que não aconteceu com nenhum dos outros atacantes nos últimos jogos. Foi questionado sobre a influência desse rodízio em suas atuações e na confiança para crescer no seu início no Flamengo. Ele evitou se aprofundar no assunto:  - Difícil falar disso, mas é decisão do corpo técnico, tem que respeitar. Temos que trabalhar para que quem jogue faça o melhor para a equipe. O centroavante ganha confiança quando joga. Se joga e faz gol é muito melhor. Precisamos pegar alguns jogos em que a gente crie mais opções de gol para fazer nosso trabalho. Ajudar a equipe a ganhar, jogar bem e depois deixar a decisão para o corpo técnico - pediu o jogador colombiano.  Na parte final da partida, Henrique Dourado e Lincoln entraram, mas mantiveram o ""ritmo"". Viram poucas bolas passarem na área e não finalizaram uma vez a gol. ",esportes,,,,,,
2018-09-14,https://web.archive.org/web/20180913172126/https://globoesporte.globo.com/futebol/times/sao-paulo/noticia/video-brenner-da-toque-de-letra-entre-as-pernas-de-carneiro-em-treino-do-sao-paulo.ghtml,https://globoesporte.globo.com/futebol/times/sao-paulo/noticia/video-brenner-da-toque-de-letra-entre-as-pernas-de-carneiro-em-treino-do-sao-paulo.ghtml,Vídeo: Brenner dá toque de letra entre as pernas de Carneiro em treino do São Paulo," Brenner, do São Paulo, não tem sido aproveitado pelo técnico Diego Aguirre, mas continua ativo nos treinos.  Na última quarta-feira, Brenner acertou belo toque de letra entre as pernas de Gonzalo Carneiro durante a atividade no CT da Barra Funda (veja abaixo a imagem captada pela ""SPFCtv"").  Revelado em Cotia, Brenner não atua desde o dia 2 de agosto, na derrota por 1 a 0 para o Colón, pela Sul-Americana. Na ocasião, o atacante entrou aos 42 minutos do segundo tempo, no lugar de Rojas, e foi expulso aos 48.  O próximo duelo do São Paulo é contra o Santos, domingo, às 16h, na Vila Belmiro. O time tem 49 pontos, mesmo número do Internacional, mas é o segundo colocado do Brasileirão pela diferença no saldo de gols (18 a 17).  + CLIQUE AQUI e leia mais notícias do São Paulo  + SEJA SÓCIO TORCEDOR! Ganhe vantagens exclusivas e ajude o São Paulo a ser ainda maior. Clique aqui e se cadastre ",esportes,,,,,,
2018-09-14,https://web.archive.org/web/20180913172126/https://globoesporte.globo.com/tiro-esportivo/noticia/na-coreia-do-sul-julio-almeida-vence-e-fatura-ouro-no-mundial-de-tiro-esportivo.ghtml,https://globoesporte.globo.com/tiro-esportivo/noticia/na-coreia-do-sul-julio-almeida-vence-e-fatura-ouro-no-mundial-de-tiro-esportivo.ghtml,"Na Coreia do Sul, Júlio Almeida vence e fatura ouro no Mundial de Tiro Esportivo "," Júlio Almeida conquistou nesta quinta-feira o Campeonato Mundial de Tiro Esportivo em Changwon, na Coreia do Sul. O brasileiro superou o campeão olímpico Christian Reitz e levou o ouro na prova de Fogo Central. Júlio marcou 591 pontos, contra 588 do alemão. Já o bronze ficou com Pavlo Korostylov (586) da Ucrânia.  Júlio tem 48 anos e já representou o Time Brasil em duas edições de Jogos Olímpicos. No currículo, o brasileiro já acumula outras quatro medalhas em Mundiais. Em Munique 2010, ele faturou uma prata e um bronze, além de um ouro por equipes. Em Granada 2014, ele ficou com um bronze.  - Estou muito feliz, venho praticando este esporte como hobby há 30 anos e o coloquei como uma das minhas prioridades onze anos atrás quando me classifiquei pra minha primeira Olimpíada - disse. ",esportes,,,,,,
2018-09-14,https://web.archive.org/web/20180913172126/https://globoesporte.globo.com/rj/serra-lagos-norte/futebol/noticia/clube-que-revelou-ronaldo-luta-para-sobreviver-e-sonha-com-ajuda-do-craque.ghtml,https://globoesporte.globo.com/rj/serra-lagos-norte/futebol/noticia/clube-que-revelou-ronaldo-luta-para-sobreviver-e-sonha-com-ajuda-do-craque.ghtml,Clube que revelou Ronaldo luta para sobreviver e sonha com ajuda do craque," O São Cristóvão não é um clube qualquer. E nunca será. É o futebol brasileiro na raiz, o campeão carioca de 1926 e um baú repleto de histórias.  O tempo causou marcas ao longo dos 119 anos de existência, machucou a estrutura de quem prometia ser gigante no início do século passado, mas de jeito algum apagará a tradição do lugar que já foi a casa de Carlos Alberto Parreira e Leônidas da Silva, por exemplo. (Confira um pouco da história do São Cristóvão no vídeo acima).  Nem mesmo o letreiro envelhecido, desgastado pelo tempo, na fachada do estádio da Rua Figueira de Melo fará com que se esqueçam de onde surgiu um dos maiores de todos os tempos.  - O Ronaldo foi um cara que saiu daqui para o mundo. Um cara diferenciado. Tive o prazer de ver que ele começou aqui e ver onde chegou. Isso é gratificante. Isso não tem dinheiro que compre. É a história, e a história não se apaga - conta Renato, gerente administrativo e o funcionário mais antigo do clube.  Mas aquele São Cristóvão que orgulha-se dos feitos e das glórias do passado hoje vive uma incerteza sobre o futuro. Como será o amanhã?  Crises financeiras e más administrações levaram o São Cri-Cri à terceira divisão do Rio em 2017. A duas rodadas do fim da competição, agora briga para evitar uma segunda queda consecutiva e escapar do fundo do poço do futebol estadual - está a três pontos da zona de rebaixamento.  Com a escassez de recursos, sobrevive no limite e paga literalmente o preço do passado - soma hoje aproximadamente 28 dívidas trabalhistas, segundo a direção. E o pior de tudo: periga deixar o futebol profissional em 2019.  - O risco existe. Se não conseguirmos patrocinador para o ano que vem tocar o futebol, isso existe. Há um risco de parar com o futebol. Mas essa é a última das hipóteses que a gente pensa - diz o presidente da Assembleia Geral e diretor de futebol, João Machado.  Sem patrocinadores, o São Cristóvão vive basicamente de recursos próprios, além de doações e inúmeras permutas. Aluga o espaço de três outdoors, além do seu campo de grama sintética, o ginásio e a sede náutica. Conta, também, com a mensalidade de cerca de 300 sócios.  No entanto, não consegue sequer lucrar com o aluguel do estacionamento do Estádio Ronaldo Nazário para a Prefeitura do Rio - as verbas foram antecipadas pela antiga gestão e uma nova quantia só entrará nos cofres a partir de janeiro de 2019, de acordo com a atual diretoria.  A direção calcula um orçamento de R$ 70 mil mensais para tocar o futebol profissional, mas, segundo João Machado, o clube só tem conseguido arrecadar 50% desse valor (cerca de R$ 35 mil). O que não é o suficiente para manter as contas em dia.  - O que podemos falar é que pode parar o futebol. Há um consenso no conselho de que, se parar com o futebol, o clube se toca com a sede náutica, se toca com os aluguéis, permutas, e o clube fica maravilhoso. Mas você perde a essência. O que é o São Cristóvão? O que é Figueira de Melo? Aqui se respira futebol - conta João Machado, que se aposentou da carreira de bancário e se dedica ao clube desde o início do ano.  A dificuldade é tanta que praticamente todos os jogadores do elenco profissional do São Cristóvão recebem um salário mínimo e possuem um trabalho à parte. Há motoristas de aplicativo de viagens e comerciantes, por exemplo.  Na luta para sobreviver, o São Cristóvão agora estuda alternativas para não fechar as portas do futebol profissional em 2019 e sonha, quem sabe, com a ajuda de Ronaldo, que recentemente comprou o Valladolid, da Espanha, por cerca de R$ 140 milhões.  - Se for só a imagem dele já nos ajuda, nos traz patrocinador. É só usar a imagem do Ronaldo. Tinha um projeto, não sei se é verdade, que o Ronald, filho dele, queria fazer um outdoor aqui dele com várias camisas por onde ele passou, como São Cristóvão, PSV, Barcelona, Real Madrid... Não sei porque não foi para frente. Tudo pode ser feito, mas tem que ser conversado. Mas acredito que a vida dele hoje é na Espanha - afirma João Machado.  Segundo o cartola, as portas estão e sempre estarão abertas ao Fenômeno para qualquer tipo de ajuda: desde uma simples visita até a sede na Figueira de Melo ou, de repente, uma parceria para a gestão do clube.  - Estamos de portas abertas. Esperamos ele aqui. Se tiver uma parceria de qualquer sentido... O São Cristóvão hoje até depende do Ronaldo. O Ronaldo hoje é grande, e o São Cristóvão está ""pequenininho"". Se quiser ser o gestor, trazer o marketing dele para cá... Se quiser fazer um novo clube aqui no Brasil, estamos aqui para fazer novos ""Ronaldos"".  Funcionário mais antigo em atividade no São Cristóvão, o diretor Renato Campos acompanhou os primeiros passos de Ronaldo no clube e foi, inclusive, o responsável por criar a frase ""Aqui nasceu o Fenômeno"", que fica no muro interno do Estádio Ronaldo Nazário, fundado em 1916 e considerado o mais antigo do Rio de Janeiro.  Estádio que, aliás, foi rebatizado em homenagem ao ex-atacante em 2013, mas que sequer pode receber jogos devido à falta dos laudos do Corpo de Bombeiros e da Vigilância Sanitária - atualmente, o clube manda suas partidas na Rua Bariri, do Olaria, graças a uma permuta feita pela diretoria do São Cristóvão, que, em troca, permite treinos da base do rival na sua sede náutica.  Renato sonha, um dia, com o retorno do ex-craque à velha casa, onde visitou pela última vez em 2014.  - A obrigação dele de ajudar é nenhuma... A gente quer que ele venha nos visitar para ele ver a mudança. Todo mundo dessa nova administração pensa em trazer ele para ver que as coisas caminham de outro jeito.  - Qualquer ajuda que venha dele seria bom, mas a gente torce para ele ganhar ainda mais na carreira dele, mais sucesso na profissão dele. Não tem aquela história do cara que onde ele coloca a mão vira ouro? É a história dele. Quem sabe ele não coloca a mão aqui? - sonha o dirigente.  Com o futuro comprometido nos gramados e uma série de questões a serem resolvidas, apenas uma certeza permanece na Rua Figueira de Melo: a história não se apagará, custe o que custar, pelo menos no que depender da paixão de Renato.  - Tive a felicidade de ser avô. O primeiro bolo do meu neto foi com o escudo do São Cristóvão. A história na minha família vai dar continuidade. No dia que eu partir, meu neto vai saber que existe o São Cristóvão e que ele teve uma festa do São Cristóvão. E o aniversário de dois anos dele vai ser assim, já estou preparando... Ninguém na minha família não torce para o São Cristóvão - encerra. ",esportes,,,,,,
2018-09-15,https://web.archive.org/web/20180915014854/https://globoesporte.globo.com/al/futebol/times/csa/noticia/walter-e-indiciado-em-alagoas-por-crime-de-ameaca-a-funcionarios-da-eletrobras.ghtml,https://globoesporte.globo.com/al/futebol/times/csa/noticia/walter-e-indiciado-em-alagoas-por-crime-de-ameaca-a-funcionarios-da-eletrobras.ghtml,Walter é indiciado em Alagoas por crime de ameaça a funcionários da Eletrobras," Atacante do CSA, Walter vai ter que enfrentar os tribunais. Ele foi indiciado pelo crime de ameaça e agora vai precisar se explicar no 11º juizado criminal de Maceió por apontar uma arma falsa para dois funcionários da Eletrobras.  + Walter faz trabalho forte na academia e posta vídeo  Com base no Termo Circunstanciado de Ocorrência (TCO), assinado na delegacia de flagrantes, Walter foi indiciado pela Polícia Civil de Alagoas. Os nomes dos dois eletricistas ameaçados pelo jogador estão sob sigilo.  A companhia energética de Alagoas emitiu nota oficial nesta sexta e informou que prestou total assistência aos dois eletricistas que estiveram no apartamento do jogador para efetuar o corte no fornecimento de energia elétrica e reiterou que considera as ameaças inadmissíveis (confira a íntegra da nota logo abaixo).  Ameaça a colaboradores da Eletrobras  A Eletrobras Distribuição Alagoas informa que deu assistência necessária aos dois prestadores de serviço que foram ameaçados na sexta-feira (31) com uma arma de brinquedo, ao realizarem uma suspensão de fornecimento de energia no apartamento do jogador Walter Henrique da Silva, localizado no bairro da Ponta Verde. Neste dia, os eletricistas foram à Central de Flagrantes prestar os esclarecimentos sobre o caso à Polícia. A Eletrobras considera inadmissíveis ameaças a colaboradores e sempre atuará no combate desse tipo de atitude.  No CSA, Walter ganhou uma segunda chance e nesta sexta-feira se reapresentou ao clube. Ao contrário do que tinha divulgado em nota oficial, quando da detenção de Walter, a diretoria azulina preferiu não conversar com o atleta para definir o seu futuro.  Assim, o atacante continua o tratamento da lesão no joelho esquerdo, sofrida na partida contra o Fortaleza, dia 20 de julho. Nesta sexta, Walter deu voltas ao redor do campo no CT Gustavo Paiva, foi ao departamento médico e depois liberado para trabalhar numa academia fora do Mutange. Durante o fim de semana, o atacante deve fazer novamente trabalho particular.  Presidente do CSA, Rafael Tenório explicou a situação do jogador.  - Assim que houve aquele incidente com o Walter, ele solicitou e foi liberado para se recuperar da lesão no joelho lá em Goiânia. ",esportes,,,,,,
2018-09-15,https://web.archive.org/web/20180915014854/https://sportv.globo.com/site/programas/redacao-sportv/noticia/vasco-entra-na-zona-de-rebaixamento-e-barreto-define-possivel-queda-como-tragedia-dificil-de-recuperar.ghtml,https://sportv.globo.com/site/programas/redacao-sportv/noticia/vasco-entra-na-zona-de-rebaixamento-e-barreto-define-possivel-queda-como-tragedia-dificil-de-recuperar.ghtml,"Com Vasco no Z-4, Barreto define possível queda como ""tragédia difícil de recuperar"""," A vitória da Chapecoense sobre o Atlético-PR por 2 a 1 em jogo válido pela 20ª rodada do Campeonato Brasileiro - partida que tinha sido remarcada para esta quinta-feira - fez com que o Vasco, com um jogo a menos, entrasse na zona de rebaixamento. E essa movimentação na tabela foi assunto para os jornalistas do Redação SporTV analisarem questões do clube no Brasileirão do ano passado e deste ano.  Ao comparar os três grandes clubes cariocas que na visão dos jornalistas vivem problemas financeiros, o convidado Tim Vickery questionou os presentes na bancada sobre o futuro próximo desses times: ""Você preferia ser Vasco, Botafogo ou Fluminense? Em qual situação atual você preferia estar?""  O apresentador Marcelo Barreto reformulou a pergunta e respondeu que atualmente os torcedores do Vasco são os que mais precisam se preocupar. Ele ainda se mostrou aflito com a possibilidade de um clube grande na Série B:  - Eu acho que o Vasco tem maior condição de se recuperar a longo prazo, mas a situação de hoje com crise política financeira, o clube entrando na zona de rebaixamento... Já são quatro em uma década. O primeiro dos grandes que cair e não voltar imediatamente, a gente não sabe o que pode acontecer.  O prazo de recuperação na colocação do campeonato foi o gancho para a comparação do clube nas primeiras rodadas do Brasileiro de 2017, em retorno à Série A, e no deste ano. Na estreia do torneio do ano passado, o Cruz-Maltino perdeu para o Palmeiras por 4 a 0, não teve um bom início de campeonato, mas conseguiu se recuperar a ponto de conseguir disputar a Libertadores desse ano. Em 2018, mesmo com um jogo a menos, a queda para essa zona se deu na 24ª rodada, bem mais perto do fim da competição.  Como possível recuperação no pequeno prazo que ainda resta, Barreto, Tim Vickery e Arthur Dapieve concordaram que a crise pode ser um combustível para sair dessa situação e ainda colocaram na própria instituição vascaína a responsabilidade de empurrar o time com algum tipo de mobilização: ""Alguma coisa que tire o Vasco dessa draga aí"", disse Barreto. ",esportes,,,,,,
2018-09-15,https://web.archive.org/web/20180915014854/https://globoesporte.globo.com/sp/santos-e-regiao/futebol/times/santos/noticia/diretor-e-consultor-de-presidente-do-santos-sao-ameacados-e-registram-boletins-de-ocorrencia.ghtml,https://globoesporte.globo.com/sp/santos-e-regiao/futebol/times/santos/noticia/diretor-e-consultor-de-presidente-do-santos-sao-ameacados-e-registram-boletins-de-ocorrencia.ghtml,Diretor e consultor de presidente do Santos são ameaçados e registram boletins de ocorrência," O diretor jurídico do Santos, Rodrigo Gama, registrou boletim de ocorrência para relatar ameaças de morte recebidas por um aplicativo de celular. Além dele, Guilherme Prado, consultor do presidente José Carlos Peres, e uma filha do dirigente também receberam mensagens de teor semelhante.  As ameaças foram enviadas de três números diferentes, dois deles com DDD de São Paulo, e outro de Santos, entre a madrugada e o começo da tarde desta sexta-feira.  Gama registrou boletim de ocorrência na tarde desta sexta-feira, em Curitiba, sua cidade natal. Prado prestou queixa numa delegacia em São José dos Campos. A filha de Peres procurou o Deic (Departamento Estadual de Investigações Criminais).  Veja as mensagens:  Nesta semana, o Conselho Deliberativo do Santos aprovou dois pareceres que recomendam o impeachment de José Carlos Peres. A definição será dos sócios do Santos, em Assembleia Geral marcada para o dia 29 de setembro.  Na última quinta-feira, Peres e o vice-presidente do Santos, Orlando Rollo, que estão em lados opostos no processo, trocaram farpas em entrevistas coletivas realizadas com minutos de diferença entre uma e outra.  Peres acusa o vice de participar do movimento que levou ao desgaste de sua administração e, agora, à possibilidade de impedimento. Rollo negou, atacou o presidente, e se disse ""preparado"" para ocupar o cargo caso ele fique vago.  Prado vê relação entre as ameaças e o conturbado momento político do Santos:  – Foram ameçadas, mais ou menos no mesmo horário, só pessoas próximas a Peres. De forma coordenada e todos com relação de alguma forma com o presidente do clube. Hoje fomos eu, o advogado do clube e a filha do presidente. O ato fala por si só – afirmou.  Ele diz que teme pela segurança dele e dos filhos:  – Por mim e pelos meus dois filhos, que estão comigo boa parte das vezes que não estou em casa ou no trabalho.  A reportagem ligou para os três números que aparecem nas mensagens. Todas as chamadas caíram na caixa postal, diretamente. ",esportes,,,,,,
