data,url_noticia,url_noticia_curto,titulo,conteudo_noticia,assunto,assunto_ex,titulo_ex,subtitulo_ex,local_ex,artigo_ex,n_paragrafos
2019-01-05,https://web.archive.org/web/20190105165600/https://g1.globo.com/economia/tecnologia/noticia/2019/01/03/acoes-da-apple-tem-maior-queda-em-5-anos-impactando-mercados-globais.ghtml,https://g1.globo.com/economia/tecnologia/noticia/2019/01/03/acoes-da-apple-tem-maior-queda-em-5-anos-impactando-mercados-globais.ghtml,"Ações da Apple têm maior queda em 5 anos e empresa perde US$ 72,4 bilhões"," As ações da Apple caíram 9,96% nesta quinta-feira (3). É o maior recuo da empresa no mercado acionário desde janeiro de 2013, quando os papéis caíram 12,35%.  Segundo a provedora de informações financeiras Economática, a companhia perdeu US$ 72,4 bilhões com a queda, montante superior ao valor de mercado do banco Bradesco, que é US$ 68,6 bilhões.  O pessimismo foi motivado pela redução da perspectiva de faturamento para o último trimestre de 2018.  A Apple afirmou após o fechamento dos mercados na última quarta-feira (2) que o último trimestre de 2018 terá vendas 7,6% abaixo do esperado inicialmente, para US$ 84 bilhões. O quarto trimestre do ano é o de maior faturamento para a empresa.  Em outubro de 2018, a Apple ainda era a companhia mais valiosa do mundo, quando atingiu um valor de mercado de US$ 1,12 trilhão no dia 3. De lá pra cá, a companhia perdeu mais de US$ 446,1 bilhões, segundo dados da Economatica — esse valor é o equivalente a 47,4 % de todas as empresas brasileiras com capital aberto na bolsa no fechamento desta quinta-feira.  A Apple deixou de ser a empresa com maior valor de mercado no dia 5 de dezembro, quando foi ultrapassada pela Microsoft. Depois, foi ultrapassada também pela Amazon. Com a queda desta quinta, perdeu a 3ª colocação no ranking das empresas mais valiosas, sendo superada pela Alphabet. Os dados são da Economatica.  Microsoft, Amazon e Google também tiveram queda nas ações, 3,68%, 2,52% e 2,77%, respectivamente, mas não perderam tanto quanto a Apple.  A queda da Apple impactou outras empresas e o mercado financeiro nos Estados Unidos. Por lá, o índice Dow Jones fechou em queda de 2,83% e a Nasdaq, bolsa em que estão as principais empresas de tecnologia, caiu 3,04%. O índice S&P 500 registrou recuo de 2,48%.  A empresa afirmou que ""não preveu a magnitude da desaceleração da economia, em especial na Grande China"" e nos mercados emergentes.  O presidente da Apple, Tim Cook, também demonstrou preocupação, em entrevista, com a guerra comercial entre China e Estados Unidos. “As tensões comerciais colocam pressão adicional na economia desses países”, disse Cook à rede de TV CNBC na quarta-feira (2).  Segundo Kevin Hassett, presidente do Conselho Econômico da Casa Branca, afirmou em entrevista à rede CNN que a Apple é apenas uma das primeiras empresas a apresentar resultados negativos por conta da guerra comercial entre EUA e China.  “Não vai ser só a Apple. Muitas empresas americanas que têm vendas fortes na China irão ver seus resultados financeiros cair até que tenhamos fechado um acordo com os chineses”, disse.  Outras grandes empresas já haviam sentido o baque da redução da economia chinesa e da guerra comercial. Em novembro, a montadora Ford afirmou que as vendas na China estavam 30% menores nos primeiros 11 meses de 2018 do que no mesmo período de 2017. ",tecnologia,,,,,,
2019-01-05,https://web.archive.org/web/20190105165600/https://g1.globo.com/economia/tecnologia/blog/altieres-rohr/post/2019/01/03/programas-de-espionagem-de-celular-sao-seguros.ghtml,https://g1.globo.com/economia/tecnologia/blog/altieres-rohr/post/2019/01/03/programas-de-espionagem-de-celular-sao-seguros.ghtml,Programas de espionagem de celular são seguros?," Se você tem alguma dúvida sobre segurança da informação (antivírus, invasões, cibercrime, roubo de dados etc.) vá até o fim da reportagem e utilize o espaço de comentários ou envie um e-mail para g1seguranca@globomail.com. A coluna responde perguntas deixadas por leitores no pacotão, às quintas-feiras.  Gostaria de instalar um programa da empresa www.flexispy.com . Vocês sabem informar se é um programa seguro que apenas faz o que promete ou pode ser alguma fraude para gravar, por exemplo, dados bancários entre outros? — Fabio  Exceto em algumas situações muito específicas (para monitorar filhos ou sistemas corporativos, quando isto está previsto no contrato de trabalho), o monitoramento de um equipamento pode ser enquadrado como crime de interceptação telemática ou até de invasão de sistema. Correr o risco de acabar no banco dos réus é até pior do que cair em uma fraude, não é mesmo?  Nos dois casos (monitoramento de crianças e de funcionários), existem soluções muito mais adequadas: o Google oferece o Family Link para Android (com controle de aplicativos e rastreamento GPS) e o Windows dispõe de controles dos pais (incluindo monitoramento de atividade e bloqueio de sites e aplicativos) adicionando uma criança no grupo de família, nas configurações. Em empresas, existem soluções de monitoramento corporativas centralizadas, adequadas para a gestão de um grande número de equipamentos.  No mais, é como diz o ditado: quem brinca com fogo pode se queimar.  No caso específico do FlexiSpy, a empresa foi vítima de hackers em 2017. Os invasores conseguiram acesso a diversos sistemas da empresa e derrubaram o serviço. A companhia nunca veio a público para admitir o ocorrido, explicando as quedas do sistema com ""problemas técnicos"". Os hackers, porém, divulgaram um documento detalhando todo o processo de invasão e justificaram o ato afirmando serem contra programas de vigilância e monitoramento.  Também foram encontrados documentos que sugerem que o FlexiSpy foi recomendado para espionar o marido ou a esposa dos clientes, o que é ilegal.  De modo geral, você não tem nenhuma garantia de que essas empresas não vão utilizar seus dados de maneira indevida, ou mesmo que os dados capturados estão protegidos de forma adequada.  Diversas empresas que oferecem esses serviços foram invadidas. Em agosto, por exemplo, um hacker descobriu que 280 gigabytes de fotos ficaram expostas por causa de fragilidades no sistema da Family Orbit, outra fabricante de softwares de monitoramento. Casos semelhantes também ocorreram com a mSpy e com a Retina-X.  O blog não recomenda esse tipo de software.  Realizei uma compra em uma loja física de pisos e porcelanatos e recebi o boleto de pagamento e nota fiscal por e-mail, baixei o boleto e fiz o pagamento. Uma semana depois, precisei comprar mais material. Fiz o pedido e recebi novamente o boleto e nota fiscal por e-mail, no qual realizei o procedimento da mesma forma: baixei imediatamente o boleto e fiz o pagamento. Porém, alguns dias depois fui informada que não havia pago este último boleto.  Verifiquei na conta o valor e comprovante de pagamento e informei a empresa que havia efetuado o pagamento. Porém, eles me pediram para reenviar o e-mail que recebi deles e me disseram que o boleto enviado havia sido adulterado, que o banco que eles recebem é o Banco do Brasil e este boleto saiu para o Banco Bradesco. Neste caso, é possível que um hacker tenha alterado um boleto (em arquivo PDF) no meu e-mail com todos os dados da empresa e meus ou o hacker pode ter agido na empresa que me enviou o boleto em arquivo PDF por e-mail? — Sandra  Sandra, embora ambas as suas hipóteses sejam viáveis, normalmente o que ocorre não é uma alteração no seu e-mail, mas sim no download. Os vírus monitoram os arquivos abertos substituem os dados do boleto. Em alguns casos, os dados podem também ser substituídos no momento do pagamento.  Você pode tirar essa dúvida com certa facilidade: tente abrir o boleto a partir de um celular. Se o boleto for idêntico no celular, então a modificação não está ocorrendo no seu computador e o arquivo está adulterado já no seu e-mail. Se o boleto for diferente, então o problema definitivamente está no seu computador.  Caso seja constatado que o boleto chegou já adulterado no seu e-mail, ficam abertas as duas hipóteses que você levantou. Se um criminoso instalou um vírus no seu computador, eles podem ter monitorado seu acesso ao e-mail, capturado sua senha e apagado o e-mail original do boleto, substituindo por uma mensagem nova com o boleto falso. Também é possível que a invasão tenha ocorrido no sistema da loja e que o boleto tenha sido adulterado já no envio.  É possível analisar os dados técnicos (ou ""cabeçalhos"") da mensagem para identificar a verdadeira origem do e-mail. Se a mensagem realmente partiu da loja, os cabeçalhos devem condizer com os sistemas da loja. Se os criminosos enviaram um e-mail fajuto, isso também deve constar.  Você não especificou seu provedor de e-mail, então fica mais difícil de fornecer instruções precisas. Porém, a opção para ver os cabeçalhos normalmente consta como ""Mostrar original"" (Gmail) ou ""Ver origem da mensagem"" (Outlook). Você precisa procurar pelas informações do cabeçalho ""Received"". Não é fácil de interpretar esses cabeçalhos e pode ser necessário pedir ajuda de um técnico.  O pacotão da coluna Segurança Digital vai ficando por aqui. Não se esqueça de deixar sua dúvida na área de comentários, logo abaixo, ou enviar um e-mail para g1seguranca@globomail.com. Você também pode seguir a coluna no Twitter em @g1seguranca. Até a próxima! ",tecnologia,,,,,,
2019-01-08,https://web.archive.org/web/20190108091603/https://g1.globo.com/economia/tecnologia/ces/2019/noticia/2019/01/07/ces-2019-tem-televisao-que-pode-ser-enrolada.ghtml,https://g1.globo.com/economia/tecnologia/ces/2019/noticia/2019/01/07/ces-2019-tem-televisao-que-pode-ser-enrolada.ghtml,CES 2019: LG vai lançar neste ano TV que pode ser enrolada; Samsung mostra tela de 219 polegadas," A LG apresentou nesta segunda-feira (7), na CES 2019, maior feira de tecnologia do mundo, a versão que chegará às lojas da televisão 4K OLED que pode ser ""enrolada"" quando desligada, cabendo em uma caixa retangular de altura inferior a um terço do monitor.  Ela funciona de forma parecida com uma tela para projetar slides ou mesmo uma persiana (só que se recolhe de cima para baixo).  A Signature OLED TV R é uma versão melhorada e terminada do protótipo com a qual a empresa sul-coreana surpreendeu na edição do ano passado da feira. Ela deve ser lançada no segundo semestre deste ano; o preço não foi divulgado.  A tela mostrada na CES nesta segunda tem 65 polegadas e é feita com material OLED de 4K, brilhante e de alto contraste.  O aparelho tem três modos diferentes de exibição: vista completa, com a tela toda aberta, vista linear, na qual parte da tela segue enrolada e a outra mostra apenas os controles de música, relógio, informação tecnológica, e a vista fechada.  A LG anunciou ainda que todos os novos televisores OLED da LG contarão com os assessores virtuais Google Assistant e Amazon Alexa, assim como com o o software Apple AirPlay, mais uma parceria da empresa para levar seu conteúdo além da Apple TV.  Por outro lado, a Samsung apresentou uma versão ainda maior de sua TV The Wall, mostrada na CES 2018 com 146 polegadas. Agora a tela tem 219, com resolução 6K.  Ela também é feita com a tecnologia que a marca batizou de Micro LED, evolução da sua QLED. , já apresentada na CES passada. Ela promete imagem mais nítida e permite montar telas usando mais de um painel, como se fosse Lego.  Outra novidade da sul-coreana foi a TV QLED de 8K, apresentada em tela de 98 polegadas.  Assim, como a LG, a Samsung anunciou uma parceria com a Apple. No caso, a sul-coreana vai oferecer os conteúdos do iTunes nos televisores da marca, o que antes era restrito a quem tinha a Apple TV. ",tecnologia,,,,,,
2019-01-08,https://web.archive.org/web/20190108091603/https://g1.globo.com/economia/tecnologia/ces/2019/noticia/2019/01/07/apple-faz-acordo-com-samsung-para-distribuir-programas-em-tvs-da-marca.ghtml,https://g1.globo.com/economia/tecnologia/ces/2019/noticia/2019/01/07/apple-faz-acordo-com-samsung-para-distribuir-programas-em-tvs-da-marca.ghtml,Apple faz acordo com Samsung para distribuir programas em TVs da marca," Grandes rivais no campo dos smartphones, Apple e Samsung surpreenderam ao anunciar uma parceria voltada para TVs. A marca sul-coreana vai adicionar um aplicativo em seus televisores que permitirá aos usuários navegar e reproduzir filmes e programas de TV existentes no iTunes, da Apple, além de compra ou aluguel de novos conteúdos.  O anúncio foi feito durante a CES, maior feira de tecnologia do mundo, que não conta com a Apple entre seus expositores.  No mesmo evento, a LG divulgou que seus televisores passarão a ser compatíveis com Apple AirPlay, que permite transferir conteúdo do iPhone para a TV, além do HomeKit e do AirPlay Audio.  As parcerias com fabricantes de TVs apontam são um possível primeiro sinal de que a Apple está procurando distribuir seu futuro serviço de televisão para dispositivos produzidos por outras empresas.  Até então, o conteúdo que ela produzia só era acessível pela Apple TV, sistema comercializado pela empresa.  Os acordos são parte de uma mudança contínua de estratégia da fabricante do iPhone, que está enfrentando fracas vendas na China e um saturado mercado global de smartphones, em que os usuários estão permanecendo por mais tempo com seus aparelhos e impactando os negócios da empresa.  Como resultado, a Apple está se apoiando cada vez mais em seu segmento de serviços, que inclui negócios como o sistema de armazenamento iCloud, além de seus empreendimentos nas áreas de música e televisão.  A empresa anunciou vários acordos de alto nível para criar conteúdos originais de televisão, incluindo um programa com Oprah Winfrey, mas ainda não disse como planeja distribuir esse conteúdo ou quando o serviço será lançado.  Segundo a agência Reuters, muitos acordos que já existem envolvem um pagamento das empresas de conteúdo para os fabricantes dos televisores pelo direito de aparecer em seus dispositivos.  A Apple e a Samsung se recusaram a comentar se a Apple está pagando alguma taxa ou um percentual das vendas feitas nos televisores sob o novo acordo. ",tecnologia,,,,,,
2019-01-08,https://web.archive.org/web/20190108091603/https://g1.globo.com/economia/tecnologia/ces/2019/noticia/2019/01/07/fora-da-ces-apple-cutuca-empresas-envolvidas-em-escandalos-de-privacidade-de-dados.ghtml,https://g1.globo.com/economia/tecnologia/ces/2019/noticia/2019/01/07/fora-da-ces-apple-cutuca-empresas-envolvidas-em-escandalos-de-privacidade-de-dados.ghtml,"Fora da CES, Apple 'cutuca' empresas envolvidas em escândalos de privacidade de dados"," A Apple não está entre os expositores da maior feira de tecnologia do mundo, a CES, que abriu para a imprensa nesta segunda (7), mas isso não impediu a fabricante do iPhone de dar um recado aos presentes em um outdoor gigante.  ""O que acontece em seu iPhone fica no seu iPhone"", afirma a Apple na mensagem, que será vista pelas dezenas de milhares de pessoas que participarão do evento. A frase brinca com um tradicional slogan de Las Vegas, nos Estados Unidos, onde ocorre a CES.  A brincadeira foi feita em um contexto de preocupação entre fabricantes pelos escândalos com a proteção de dados e, em muitos casos, de tentativas de demostrar preocupação com a privacidade.  Na feira, a startup holandesa Scalys vai expor seu Trustbox, roteador que busca proteger a conexão do usuário, assim como os dispositivos que o utilizam.  Outro equipamento da empresa Winston, com sede em Chicago, controla o rastreio e a vigilância e pode bloquear avisos e geolocalização.  Os escândalos de vazamento de dados são ""como presentes de Natal para nós"", pois estimulam consumidores a buscar uma segurança melhor, afirmou Richard Stokes, fundador da Winston.  ""Ao ver como cada vez há mais coisas conectadas, acho que sem dúvida se escutará muito mais gente falar de segurança e estar atenta a como se protege a informação"", avaliou a analista Carolina Milanesi, da Creative Strategies.  ""Mais empresas farão uma espécie de fila para fazer o tipo de marketing que a Apple está fazendo"", acrescentou.  Estima-se que cerca de 74 milhões de americanos têm assistentes virtuais inteligentes, segundo a empresa de pesquisa eMarketer, com Amazon e Google na liderança do mercado.  Um dos temores dos consumidores é que esses dispositivos fiquem escutando o tempo inteiro - o que seria um risco a sua privacidade.  Será apresentado no CES um dispositivo chamado Mute, da startup Smarte, que cria uma camada de proteção para impedir que os aparelhos coletem conversas.  A startup francesa Snips oferecerá seu próprio assistente digital, que pode ser instalado em um dispositivo sem conexão com a internet.  ""Os consumidores estão recorrendo a nós porque não querem depender das Big Tech"", explicou o fundador da Snips, Rand Hindi.  Hindi disse que o argumento das grandes empresas tecnológicas de que precisam dos dados dos usuários para funcionar é falso.  ""A única razão por que precisam de sua informação é para te tornar o alvo máximo (da publicidade)"", disse.  O analista Bob O'Donnell, da Technalysis Researchers, disse que cada vez mais empresas estão começando a tomar consciência dos temas ligados à privacidade e à proteção de dados diante da série de revelações sobre o Facebook e outros nos últimos anos.  ""Lamentavelmente, todos começamos a nos dar conta do quão grande e de amplo alcance é o problema da privacidade da informação"", disse O'Donnell. ",tecnologia,,,,,,
2019-01-08,https://web.archive.org/web/20190108091603/https://g1.globo.com/economia/tecnologia/noticia/2019/01/07/o-truque-de-um-empresario-japones-para-criar-o-tuite-mais-compartilhado-da-historia.ghtml,https://g1.globo.com/economia/tecnologia/noticia/2019/01/07/o-truque-de-um-empresario-japones-para-criar-o-tuite-mais-compartilhado-da-historia.ghtml,O truque de um empresário japonês para criar o tuíte mais compartilhado da história," O japonês Yusaku Maezawa gosta de desafios. O mais recente deles tem a ver com o Twitter. A postagem que Maezawa publicou no último 5 se tornou a mais compartilhada da rede social, sendo retuitada mais de quatro milhões de vezes.  Na mensagem ele celebra que seu site Zozotown alcançou um volume de vendas de 10 bilhões de yenes japoneses (US$ 92 milhões) na época do Natal. Mas não foi só isso. Maezawa também ofereceu um incentivo para que as pessoas compartilhassem seu post: prometeu distribuir 100 milhões de yenes (cerca de US$ 920 mil) aleatoriamente entre 100 pessoas que retuitassem a mensagem.  ""Para participar, tudo que você tem que fazer é me seguir e dar RT nesse tuíte"", explicou na rede social.  Com essa estratégia, Maezawa superou o recorde anterior, conquistado em maio de 2017 por Carter Wilkinson, um jovem americano que fez uma perguntou a uma rede fast food americana quantos retuítes seriam necessários para que ele ganhasse nuggets de frango grátis durante um ano. A resposta da empresa foi: 18 milhões.  Wilkinson pediu no Twitter que as pessoas o ajudassem a bater a meta. Acabou conseguindo 3,5 milhões de retuítes - e os nuggets grátis, apesar do número inferior ao objetivo inicial.  Antes de Wilkinson, o recorde de retuítes pertenceu por três anos à atriz e apresentadora americana Ellen DeGeneres, com a selfie que postou durante a cerimônia do Oscar de 2014.  Maezawa ganhou fama no Japão há alguns anos como baterista da banda de punk Switch Style. Mas foi no mundo da moda que fez fortuna, como proprietário da loja de roupas virtual Zozotown. Também ganhou notoriedade por ter pago cifras recordes por obras de arte contemporânea.  Além disso, alguns meses atrás, apareceu na imprensa internacional ao anunciar que seria o primeiro turista a viajar para a Lua com a empresa SpaceX, do americano Elon Musk. Em seguida, o próprio Musk publicou uma foto sua junto com Maezawa.  O preço pago por Maezawa não foi divulgado. Musk disse apenas que era ""muito dinheiro"". A fortuna pessoal de Maezawa está estimada em cerca de US$ 3 bilhões (cerca de R$ 11 bilhões). ",tecnologia,,,,,,
