data,url_noticia,url_noticia_curto,titulo,conteudo_noticia,assunto,assunto_ex,titulo_ex,subtitulo_ex,local_ex,artigo_ex,n_paragrafos
2018-05-24,https://web.archive.org/web/20180524092701/https://g1.globo.com/politica/noticia/camara-aprova-texto-base-de-projeto-da-reoneracao-que-elimina-pis-cofins-sobre-diesel-ate-o-fim-de-2018.ghtml,https://g1.globo.com/politica/noticia/camara-aprova-texto-base-de-projeto-da-reoneracao-que-elimina-pis-cofins-sobre-diesel-ate-o-fim-de-2018.ghtml,Câmara aprova projeto da reoneração que elimina cobrança de PIS-Cofins sobre diesel até o fim de 2018," A Câmara dos Deputados aprovou na noite desta quarta-feira (23), em votação simbólica, o projeto que elimina a cobrança de PIS-Cofins sobre o diesel até o fim de 2018. Todos os destaques (propostas de alteração do texto) foram rejeitados. A proposta ainda precisa ser analisada pelo Senado, antes de seguir para a sanção presidencial.  Incluída no projeto que reonera a folha de pagamento das empresas de 28 setores da economia, a medida foi aprovada para tentar conter a paralisação de caminhoneiros após várias reuniões de representantes do governo com a categoria.  Nos últimos dias, caminhoneiros têm bloqueado rodovias em todo o país em protesto contra os sucessivos aumentos no preço do diesel, motivados pela política de preços da Petrobras, que determina o valor da venda dos combustíveis aos distribuidores com base na oscilação do preço do petróleo no mercado internacional e na variação do dólar.  A Petrobras já informou que não mudará a política de reajustes. Mas na noite desta quarta anunciou uma redução de 10% por 15 dias no preço do diesel vendido pelas refinarias como um ""gesto de boa vontade"" para dar solução à crise motivada pelo movimento dos caminhoneiros.  De acordo com o relator da proposta aprovada na Câmara, deputado Orlando Silva (PCdoB-SP), a estimativa é que a reoneração da folha das empresas vai significar uma arrecadação adicional para o governo de R$ 3 bilhões.  Segundo ele, essa quantia compensará a perda com retirada do PIS-Cofins do preço do diesel, estimada no mesmo valor.  ""A redução do preço do diesel seria de 14%, ou seja, significativa. E o governo vai arrecadar com a reoneração. E tem estudos que mostram que o governo está arrecadando mais. Então, ele tem, sim, margem para adotar medidas para estimular a economia"", afirmou o relator.  A inclusão no projeto da reoneração da renúncia ao PIS-Cofins foi articulada pelo presidente da Câmara, deputado Rodrigo Maia (DEM-RJ).  A iniciativa de Maia contrariou o governo, que pretendia retirar da composição de preço do diesel somente a parcela referente à Contribuição de Intervenção no Domínio Econômico (Cide).  O ministro da Secretaria do Governo, Carlos Marun (MDB-MS), esteve no plenário durante a discussão da proposta e contestou os números apresentados pelo relator Orlando Silva.  Segundo Marun, o governo deixará de arrecadar entre R$ 11 bilhões e R$ 14 bilhões com a retirada do tributo sobre o diesel.  ""Estou fazendo o cálculo de cabeça. Tem que ter cuidado com isso, responsabilidade. Vai sair de onde?"", indagou. Ele afirmou que o governo tentará ""corrigir"" a proposta em acordo com os senadores.  No fim da votação, Rodrigo Maia contestou o ministro do governo, confirmando os números apresentados pelo relator.  ""Eu passei os números para o deputado Orlando. Então, tem que se tomar um pouquinho mais de cuidado. Porque ele [Marun] não é líder do governo nem líder da confusão, ele é ministro do governo. Porque aqui está trabalhando todo mundo de forma séria e querendo ajudar"", afirmou.  O projeto aprovado pelos deputados promove a reoneração de 28 setores do comércio varejista, hoteleiro, e industrial, medicamentos, pães, massas, fabricação de navios, brinquedos e pneus.  Esses setores voltarão a contribuir para o Instituto Nacional do Seguro Social (INSS) sobre a folha de pagamento, com alíquota de 20%. Pela lei atual, esses segmentos contribuem sobre o valor da receita bruta.  A mudança nas alíquotas para as empresas reoneradas será feita 90 dias depois da publicação da lei, cumprindo a chamada ""noventena"", prevista na Constituição.  A proposta também define quais setores terão mantida a contribuição sobre a receita bruta, ou seja, que continuam desonerados. São 28 do total de 56 que originalmente eram beneficiados pela desoneração.  Entre esses setores, estão os de empresas de transporte de passageiros (transporte rodoviário, ferroviário e metroviário), comunicação, construção civil, obras de infraestrutura, têxtil, calçados e móveis. Para esses setores, a alíquota será de 2%.  O projeto prevê ainda que o benefício da desoneração da folha acabará em 2020 para todos os setores. ",politica,,,,,,
2018-05-24,https://web.archive.org/web/20180524092701/https://g1.globo.com/politica/noticia/temer-diz-que-pediu-tregua-de-dois-ou-tres-dias-a-caminhoneiros-para-encontrar-solucao-satisfatoria.ghtml,https://g1.globo.com/politica/noticia/temer-diz-que-pediu-tregua-de-dois-ou-tres-dias-a-caminhoneiros-para-encontrar-solucao-satisfatoria.ghtml,Temer diz que pediu 'trégua' de dois ou três dias a caminhoneiros para encontrar 'solução satisfatória'," O presidente Michel Temer afirmou nesta quarta-feira (23) que pediu ""trégua"" de dois ou três dias aos caminhoneiros para encontrar uma ""solução satisfatória"" sobre o preço dos combustíveis.  Temer deu a declaração após participar de um evento no Palácio do Planalto. Enquanto ele falava com a imprensa, acontecia, também no palácio, uma reunião da Casa Civil com representantes de caminhoneiros.  Caminhoneiros têm feito atos em todos o país há três dias contra o aumento no preço do diesel. A Petrobras já anunciou que a política de reajustes não mudará.  ""Desde domingo, estamos trabalhando nesse tema para dar tranquilidade não só ao brasileiro, que não quer ver paralisado o abastecimento, e tentando encontrar uma solução que facilite a vida dos caminhoneiros"", afirmou o presidente.  ""Até estou solicitando e pedi que nesta reunião [na Casa Civil, entre representantes do governo e dos caminhoneiros] se solicite uma espécie de trégua para que, em dois ou três dias, possamos encontrar uma solução satisfatória para os caminhoneiros e para o povo brasileiro"", completou.  Diante da paralisação dos caminhoneiros, o governo anunciou nesta terça (22) um acordo com o Congresso Nacional para eliminar um dos tributos que incidem sobre o diesel quando o Poder Legislativo aprovar o projeto de reoneração da folha de pagamento das empresas - a votação ainda não tem data confirmada.  Na prática, se Câmara e Senado aprovarem a proposta da reoneração, a União terá aumento nas receitas e, em troca, irá zerar a Cide que incide sobre o diesel. Segundo o Ministério da Fazenda, a atual alíquota do tributo representa R$ 0,05 por litro do diesel.  Após a reunião com os ministros Eliseu Padilha (Casa Civil), Carlos Marun (Secretaria de Governo) e Valter Casimiro (Transportes), o presidente da Confederação Nacional dos Transportadores Autônomos (CNTA), Diumar Bueno, afirmou que o governo não apresentou uma proposta concreta.  O encontro, de acordo com a Casa Civil, reuniu 10 entidades nesta quarta. Segundo Diumar Bueno, ficou acertada uma nova reunião nesta quinta (24), também no Palácio do Planalto.  ""O governo não ofereceu nada até agora. A proposta foi pedir um prazo para nós para que eles se posicionem amanhã [quinta, 24] às 14h"", disse o presidente da CNTA.  Ainda de acordo com o presidente da entidade, os ministros na reunião explicaram a ""impossibilidade"" de atender às reivindicações da categoria.  Sobre a possível eliminação da Cide sobre o diesel, Bueno declarou: ""Isso só é insuficiente, porque isso representa R$ 0,05 no preço, se for passado para as bombas"".  Questionado sobre se a categoria atenderá ao pedido de ""trégua"" do governo, Diumar afirmou que ficou apenas estabelecido o prazo para a nova reunião.  ""Não se trata de trégua, ele pediu um prazo para nos dar uma reposta, e o que foi estabelecido hoje foi esse prazo até amanhã às 14h"", declarou. ""Infelizmente, o governo está condicionando a paralisação nacional dos caminhoneiros permanecer por mais um dia"", completou.  Diumar também destacou que a confederação avisou o governo sobre a insatisfação da categoria com o preço do diesel, além do pedido pelo fim da cobrança de pedágio de caminhões que trafegam vazios e com os eixos suspensos. ",politica,,,,,,
2018-05-30,https://web.archive.org/web/20180530104416/https://g1.globo.com/politica/noticia/temer-afirma-que-pode-reexaminar-politica-de-precos-da-petrobras.ghtml,https://g1.globo.com/politica/noticia/temer-afirma-que-pode-reexaminar-politica-de-precos-da-petrobras.ghtml,Temer afirma que pode reexaminar política de preços da Petrobras," O presidente Michel Temer afirmou nesta terça-feira (29), durante entrevista à emissora pública TV Brasil, que pode reexaminar a política de preços da Petrobras.  Na entrevista, Temer primeiro afirma não querer alterar a política da estatal. Em seguida, se refere à possibilidade de reexaminá-la. Mas a fala do presidente deixa dúvida se ele disse ""não podemos reexaminá-la"" ou ""nós podemos reexaminá-la"". Consultada, a assessoria de comunicação do Palácio do Planalto informou que ele disse ""nós"".  ""Convenhamos, a Petrobras se recuperou ao longo destes dois anos. Estava em uma situação, digamos, economicamente desastrosa há muito tempo. Mas nós não queremos, digamos, alterar a política da Petrobras. Nós podemos reexaminá-la, mas com muito cuidado"", declarou o presidente na entrevista (veja no vídeo acima).  Os frequentes e até diários reajustes nos preços dos combustíveis, decorrentes dessa política, estiveram entre os principais fatores que motivaram a greve dos caminhoneiros. Desde julho do ano passado, a Petrobras promove os reajustes com base na variação do dólar e dos preços do petróleo no mercado internacional.  Tanto Temer quanto o presidente da Petrobras, Pedro Parente, vêm afirmando que a empresa tem autonomia para determinar os preços dos combustíveis, sem interferência do governo.  Mas, na quarta-feira da semana passada (23), após a deflagração da greve dos caminhoneiros, Parente anunciou uma redução de 10% no preço do diesel durante 15 dias como ""uma medida de caráter excepcional"".  Segundo ele, essa decisão não representava mudança na política de preços da estatal nem tinha sido motivada por pressão do governo. Mesmo assim, no dia seguinte, o mercado reagiu negativamente, e o valor das ações da Petrobras caiu mais de 13%.  No domingo (27), em nova tentativa de dar fim à greve, o governo fez uma proposta aos caminhoneiros que incluía uma redução de R$ 0,46 no preço do litro do diesel por 60 dias. Para manter o subsídio durante esse período, vai usar recursos públicos a fim de compensar a Petrobras.  Nesta terça-feira, em teleconferência com investidores, Pedro Parente voltou a afirmar que a autonomia da empresa para determinar a política de preços estava mantida. ""Está mantida, sim, independente da periodicidade, a nossa prerrogativa"", declarou. ",politica,,,,,,
2018-05-30,https://web.archive.org/web/20180530104416/https://g1.globo.com/politica/noticia/camara-aprova-projeto-que-define-regras-para-protecao-de-dados-pessoais.ghtml,https://g1.globo.com/politica/noticia/camara-aprova-projeto-que-define-regras-para-protecao-de-dados-pessoais.ghtml,Câmara aprova projeto que define regras para proteção de dados pessoais," A Câmara dos Deputados aprovou nesta terça-feira (29) um projeto que define regras para proteção de dados pessoais. A proposta segue para análise do Senado.  Na prática, o texto define o tratamento desses dados por empresas e órgãos públicos com o objetivo de resguardar a privacidade das pessoas, inclusive na internet.  A proposta ganhou impulso na Câmara após entrar em vigor na União Europeia, na última sexta (25), uma lei que protege dados pessoais.  A legislação foi uma resposta à espionagem do governo dos Estados Unidos, que compartilhava informações com outros países. O caso foi revelado em 2013 por Edward Snowden, ex-analista da CIA.  Segundo o relator, Orlando Silva (PCdoB-SP), foram realizados durante dois anos inúmeros encontros com agentes econômicos, representantes de universidade e do governo para construir um texto ""que dá segurança"" aos dados dos brasileiros.  ""O projeto vai dar segurança a população brasileira, para que seus dados não sejam manipulados e que para quem o faça, seja responsabilizado"", afirmou o deputado.  Entenda abaixo os principais pontos do projeto: ",politica,,,,,,
2018-05-30,https://web.archive.org/web/20180530104416/https://g1.globo.com/politica/noticia/fachin-autoriza-joesley-e-wesley-batista-a-pagar-multa-de-r-110-milhoes-cada-referente-ao-acordo-de-delacao.ghtml,https://g1.globo.com/politica/noticia/fachin-autoriza-joesley-e-wesley-batista-a-pagar-multa-de-r-110-milhoes-cada-referente-ao-acordo-de-delacao.ghtml,Fachin autoriza Joesley e Wesley Batista a pagar multa de R$ 110 milhões cada referente ao acordo de delação," O ministro Luiz Edson Fachin, do Supremo Tribunal Federal (STF), autorizou os empresários Joesley e Wesley Batista, do grupo J&F, a pagar a multa de R$ 110 milhões cada referente ao acordo de delação premiada.  Relator da Lava Jato, Fachin autorizou o início do pagamento da multa (em 10 parcelas anuais) ressaltando que será ""por conta e risco"" de Joesley e Wesley.  Isso porque os acordos de delação dos empresários estão suspensos, por determinação da Procuradoria Geral da República (PGR). A rescisão, contudo, ainda depende de decisão de Fachin.  Joesley e Wesley Batista são suspeitos de omitir informações nos depoimentos prestados ao Ministério Público no âmbito da Operação Lava Jato.  As suspeitas são de que Joesley omitiu ter sido orientado por um ex-procurador da República enquanto ele ainda atuava pelo Ministério Público. Wesley é suspeito de ""omitir fatos criminosos dos quais tinha conhecimento"".  Os dois empresários negam as acusações e pediram ao Supremo para começar a pagar a multa de R$ 110 milhões.  ""Como se sabe, há controvérsia ainda pendente de decisão homologatória por parte desta Suprema Corte a respeito da rescisão da avença pleiteada pela Procuradoria-Geral da República. A despeito disso, autorizo, em caráter condicionado à futura decisão sobre a rescisão em trâmite, que Joesley Mendonça Batista, Wesley Mendonça Batista e Ricardo Saud depositem, por conta e risco de cada qual, o que entendem devido a título de multa"", escreveu Fachin na decisão. ",politica,,,,,,
2018-05-30,https://web.archive.org/web/20180530104416/https://g1.globo.com/politica/noticia/senado-aprova-projeto-que-elimina-pis-cofins-sobre-diesel-ate-o-fim-de-2018.ghtml,https://g1.globo.com/politica/noticia/senado-aprova-projeto-que-elimina-pis-cofins-sobre-diesel-ate-o-fim-de-2018.ghtml,"Senado aprova projeto que elimina PIS-Cofins sobre diesel até o fim de 2018; Temer deve vetar, diz líder"," O Senado aprovou nesta terça-feira (29) o projeto que elimina a cobrança de PIS-Cofins sobre o óleo diesel até o fim deste ano.  A proposta foi incluída num texto que já tramitava no Congresso Nacional e prevê a reoneração da folha de pagamento de 28 setores da economia.  Como já foi aprovado pela Câmara, o texto seguirá para análise do presidente Michel Temer, que poderá sancionar, sancionar parcialmente ou vetar (entenda o projeto da reoneração mais abaixo).  Embora os senadores tenham aprovado a eliminação do PIS-Cofins, o líder do governo no Senado, Romero Jucá (MDB-RR), já informou Temer deverá vetar esse trecho, sancionando apenas a parte referente à reoneração.  Em substituição, Jucá disse que o governo editará um decreto para garantir o acordo de redução de R$ 0,46 no litro do diesel.  ""O governo vai procurar outros caminhos, mas vai honrar o compromisso que fez com os caminhoneiros"", disse Jucá.  ""O governo vai vetar, mas vamos honrar o compromisso tirando recursos de outras ações para cumprir o acordo feito"", acrescentou.  A eliminação da cobrança do PIS-Cofins foi uma reivindicação de caminhoneiros que protestam há nove dias em todo o país contra o aumento do preço do diesel.  A greve dos caminhoneiros provocou uma crise de abastecimento no país. Falta gasolina em postos de todo o país, aeroportos estão sem querosene e faltam diversos produtos nos supermercados.  No último domingo (27), Temer anunciou cinco medidas para os caminhoneiros, entre as quais a redução de R$ 0,46 no preço do litro do diesel.  O presidente também editou medidas provisórias (MPs) para atender a pedidos dos caminhoneiros – essas MPs já estão em vigor, mas precisam ser aprovadas pelo Congresso para virar leis em defintivo.  As medidas definem:  As entidades que se reuniram com Temer antes do anúncio disseram ter ficado satisfeitas com as medidas e chegaram a assinar uma ata se comprometendo a suspender a paralisação.  Mas, nesta terça, caminhoneiros continuaram nas estradas de todo o país.  Segundo o presidente da Associação Brasileira de Caminhoneiros (Abcam), José da Fonseca Lopes, os caminhoneiros querem voltar ao trabalho, mas estão sendo impedidos por ""intervencionistas"" que, segundo ele, ""querem derrubar o governo"".  O governo federal já informou publicamente que as negociações estão finalizadas e agora espera o retorno dos caminhoneiros ao trabalho.  A discussão sobre a eliminação do PIS-Cofins foi incluída, pela Câmara dos Deputados, no projeto que põe fim à desoneração da folha de pagamentos de 28 segmentos da economia.  Atualmente, 56 setores têm direito à desoneração, o que foi estabelecido durante o governo Dilma Rousseff sob o argumento de que a medida preservaria empregos.  Entre os setores que serão reonerados ainda neste ano estão empresas de comércio varejista (exceto calçados), hoteleiras e de medicamentos, entre outras.  Esses setores voltarão a contribuir para o Instituto Nacional do Seguro Social (INSS) sobre a folha de pagamento, com alíquota de 20%.  Pela lei atual, esses segmentos contribuem sobre o valor da receita bruta, com alíquotas específicas para cada setor, o que pode ser mais vantajoso para as empresas.  A mudança nas alíquotas para as empresas reoneradas será feita 90 dias depois da publicação da lei, cumprindo a chamada ""noventena"", prevista na Constituição.  A proposta também define quais setores terão mantida a contribuição sobre a receita bruta, ou seja, que continuam desonerados. São 28 do total de 56 que originalmente eram beneficiados pela desoneração.  Entre esses setores, estão os de empresas de transporte de passageiros (transporte rodoviário, ferroviário e metroviário), comunicação, construção civil, obras de infraestrutura, têxtil, calçados e móveis.  O projeto prevê ainda que o benefício da desoneração da folha acabará no final de 2020 para todos os setores.  Defensores da reoneração dizem que a medida pode gerar uma arrecadação adicional de cerca de R$ 3 bilhões.  O senador Ricardo Ferraço (PSDB-ES), que relatou o projeto no Senado, afirmou, contudo, que essa quantia não é suficiente para bancar o desconto de R$ 0,46 no preço do litro do diesel. ",politica,,,,,,
2018-05-31,https://web.archive.org/web/20180531095651/https://g1.globo.com/politica/noticia/litro-do-diesel-devera-estar-r-046-mais-barato-nos-postos-a-partir-de-1-de-junho-diz-ministro.ghtml,https://g1.globo.com/politica/noticia/litro-do-diesel-devera-estar-r-046-mais-barato-nos-postos-a-partir-de-1-de-junho-diz-ministro.ghtml,"Litro do diesel deverá estar R$ 0,46 mais barato nos postos a partir de 1º de junho, diz ministro"," O ministro da Secretaria de Governo, Carlos Marun, afirmou nesta quarta-feira (30) que o ""Diário Oficial"" deverá publicar, nesta quinta (31), as regras que o governo adotará para assegurar que o preço do litro do diesel nos postos, a partir de sexta (1º), seja R$ 0,46 menor que o praticado em 21 de maio, quando começou a greve dos caminhoneiros.  Marun deu a informação após uma reunião do grupo de ministros que monitora a greve da categoria e o reabastecimento de produtos pelo país.  Segundo o ministro, o desconto valerá a partir do momento em que o posto for abastecido.  ""O desconto será obrigatoriamente repassado. Se no dia 21 de maio, no posto de combustíveis, o caminhoneiro abasteceu um litro de diesel por R$ 3,46, por exemplo, obrigatoriamente, a partir do momento que o posto for abastecido, [o litro] terá de ser R$ 3,00. Terá que haver o desconto"", disse Marun.  ""Os postos de abastecimento de combustíveis terão que aficcionar uma placa onde constará o valor praticado em 21 de maio, o desconto e o preço atual. O desconto pode até ser maior que R$ 0,46, mas, no mínimo, terá que ser de R$ 0,46"", acrescentou.  De acordo com Carlos Marun, a redução de R$ 0,46 no preço do litro do diesel corresponde ao percentual incidente de PIS-Cofins e Cide sobre o combustível.  A redução no preço do diesel faz parte da proposta de acordo apresentada no último fim de semana pelo governo aos caminhoneiros.  A categoria está parada há dez dias e protesta contra o aumento no preço do diesel.  Além da redução no preço do diesel, outro ponto acordado pelo governo com os caminhoneiros foi a formulação de uma tabela com os preços mínimos dos fretes por tipo de carga.  Os valores foram definidos nesta quarta pela Agência Nacional de Transportes Terrestres e deverão ser publicados no ""Diário Oficial da União"" desta quinta.  De acordo com o governo federal, a tabela tem ""caráter obrigatório para o mercado de fretes do país"".  Ainda de acordo com o Palácio do Planalto, os valores dos fretes estabelecidos pela ANTT são válidos até 20 de janeiro de 2019. Os valores serão atualizados no ano que vem.  ""Novas tabelas deverão ser publicadas até os dias 20 de janeiro e 20 de julho de cada ano e serão válidas para o semestre em que forem editadas"", acrescentou a Presidência.  Na mesma entrevista de Carlos Marun, o ministro Raul Jungmann (Segurança Pública) foi indagado sobre uma declaração do presidente do Congresso Nacional, senador Eunício Oliveira (MDB-CE), na qual o parlamentar afirmou ser preciso debater a atual política de preços da Petrobras.  Para Jungmann, o mercado de distribuição de combustíveis ""precisa ser regulado de forma diferente, precisa passar por uma reforma"".  ""Isso que aconteceu [greve dos caminhoneiros] pode voltar a acontecer de novo. Uma das lições que temos de ter é rever o mercado e sua regulação"", afirmou. ",politica,,,,,,
2018-05-31,https://web.archive.org/web/20180531095651/https://g1.globo.com/politica/noticia/pgr-pede-arquivamento-de-inquerito-que-apura-se-aloysio-nunes-cometeu-crimes-de-caixa-2-e-lavagem-de-dinheiro.ghtml,https://g1.globo.com/politica/noticia/pgr-pede-arquivamento-de-inquerito-que-apura-se-aloysio-nunes-cometeu-crimes-de-caixa-2-e-lavagem-de-dinheiro.ghtml,PGR pede arquivamento de inquérito que apura se Aloysio Nunes cometeu crimes de caixa 2 e lavagem de dinheiro," A procuradora-geral da República, Raquel Dodge, pediu nesta quarta-feira (30) o arquivamento de inquérito que apura se o ministro das Relações Exteriores, Aloysio Nunes (PSDB0-SP), cometeu crime de falsidade ideológica eleitoral - o chamado caixa dois - e lavagem de dinheiro.  A investigação é desdobramento da Operação Lava Jato e foi aberta em setembro de 2015, com base na delação premiada do empresário Ricado Pessoa, da UTC. A procuradora apontou que não foi possível comprovar as suspeitas apontadas na delação.  O parecer será analisado agora pelo relator do caso, ministro Celso de Mello. O entendimento consolidado no STF é de que, quando a Procuradoria pede arquivamento, o Supremo arquiva.  Ricardo Pessoa relatou na delação premiada que acertou diretamente com o senador doação de R$ 500 mil para campanha ao Senado em 2010, sendo que R$ 300 mil seria feito mediante doação odicial e R$ 200 mil em dinheiro vivo, por fora, o chamado caixa dois.  Segundo Raquel Dodge, Ricardo Pessoa e Walmir Pinheiro, da UTC, confirmaram pagamento de R$ 200 mil por fora por meio de pessoa chamada Marco Moro. O senador disse que essa pessoa foi designada para discutir doações oficiais. Ele chegou a ser ouvido, mas faleceu em agosto do ano passado.  Para Dodge, o falecimento dificulta o prosseguimento da apuração.  ""Ressalte-se que o seu falecimento aumenta a dificuldade na descoberta de novas provas, uma vez que ele era apontado como o elo entre os colaboradores e demais depoentes e o político investigado, na suposta entrega de doação extraoficial à campanha de Aloysio Nunes ao Senado Federal em 2010. Assim, todas as diligências requeridas pela Procuradoria Geral da República e autorizadas pelo Supremo Tribunal Federal foram cumpridas, não havendo mais linha investigativa a seguir"", disse.  De acordo com a procuradora, diversos depoimentos foram colhidos, além de coleta de outras provas, mas as suspeitas ""não foram corroboradas por outros elementos de prova suficientes a comprovar a materialidade e a autoria das infrações investigadas"". ",politica,,,,,,
