data,url_noticia,url_noticia_curto,titulo,conteudo_noticia,assunto,assunto_ex,titulo_ex,subtitulo_ex,local_ex,artigo_ex,n_paragrafos
2018-07-26,https://web.archive.org/web/20180726004700/https://g1.globo.com/politica/noticia/2018/07/25/em-reuniao-com-carmen-lucia-entidades-defendem-reajuste-salarial-para-magistrados-e-integrantes-do-mp.ghtml,https://g1.globo.com/politica/noticia/2018/07/25/em-reuniao-com-carmen-lucia-entidades-defendem-reajuste-salarial-para-magistrados-e-integrantes-do-mp.ghtml,"Em reunião com Cármen Lúcia, entidades defendem reajuste salarial para magistrados e integrantes do MP"," Lideranças de entidades representativas de juízes e do Ministério Público pediram reajuste salarial durante encontro nesta quarta-feira (25) com a presidente do Supremo Tribunal Federal (STF), Cármen Lúcia, no Palácio do Planalto.  Cármen Lúcia está no exercício da Presidência da República porque o presidente Michel Temer cumpre agenda na África do Sul e os presidentes da Câmara, Rodrigo Maia (DEM-RJ), e do Senado, Eunício Oliveira (MDB-CE), também viajaram para o exterior.  Presente à reunião, o presidente da Associação Nacional dos Procuradores da República (ANPR), José Robalinho Cavalcanti, afirmou que as categorias pedem um “remanejamento” na proposta de orçamento de 2019 que contemple um reajuste de 16,38%.  O STF e o Conselho Superior do Ministério Público Federal aprovam as propostas de orçamento a serem enviadas ao Executivo. Os valores deverão ser incluídos no projeto de Orçamento da União e 2019, a ser enviado ao Congresso até 31 de agosto deste ano.  “Estamos pedindo é um remanejamento orçamentário, que abra espaço para que nós tenhamos nosso reajuste, sem qualquer aumento de gasto público, ou seja, dentro do teto [de gastos públicos]”, disse.  Segundo Robalinho, o reajuste não resultaria em aumento de despesas, em razão do teto de gastos públicos. Assim, segundo ele, o reajuste seria possível com o remanejamento de valores do orçamento, por meio da redução de despesas de outras áreas.  O presidente da ANPR explicou que o percentual de 16,38% é o mesmo previsto em um projeto enviado ao Congresso em 2015 e que ainda não foi apreciado pelo Senado.  Robalinho afirmou que a procuradora-geral da República, Raquel Dodge, já recebeu o mesmo pedido. As entidades vão procurar os demais ministros do STF para discutir o assunto.  No caso do STF, a Corte deve decidir em agosto, em sessão administrativa com data a ser marcada, sobre a proposta de orçamento de 2019.  No ano passado, a inclusão de elevação da remuneração dos ministros foi rejeitada pela maioria, levando em conta a conjuntura econômica do país e o “efeito cascata” que o valor do subsídio, usado como teto para o funcionalismo público, levaria ao governo federal e aos estados.  De acordo com Robalinho, magistrados e integrantes do MP não têm reajustes desde 2015, enquanto outras categorias do serviço público tiveram reajuste salarial.  “Nós não temos desde 2015, e o reajuste que nós tivemos em 2015 repôs a inflação só até dezembro de 2013. Não conheço categoria no Brasil, pública ou privada, que esteja há cinco anos sem reajuste”, afirmou.  Procurada pelo G1, a assessoria de Cármen Lúcia informou que a ministra recebeu um documento com as propostas das entidades e “limitou-se a ouvir” os argumentos.  Cármen Lúcia resiste à proposta de reajuste para os vencimentos dos ministros do STF, que servem de referência para o limite salarial do serviço público.  De acordo com o Palácio do Planalto, participaram da reunião com Cármen Lúcia representantes das seguintes entidades: ",politica,,,,,,
2018-07-26,https://web.archive.org/web/20180726004700/https://g1.globo.com/politica/noticia/2018/07/25/doze-dias-depois-de-aprovada-pelo-congresso-lei-de-diretrizes-orcamentarias-chega-ao-planalto-para-sancao-de-temer.ghtml,https://g1.globo.com/politica/noticia/2018/07/25/doze-dias-depois-de-aprovada-pelo-congresso-lei-de-diretrizes-orcamentarias-chega-ao-planalto-para-sancao-de-temer.ghtml,"Doze dias depois de aprovada pelo Congresso, Lei de Diretrizes Orçamentárias chega ao Planalto para sanção de Temer"," Quase duas semanas depois de aprovada pelo Congresso Nacional, a Lei de Diretrizes Orçamentárias (LDO) chegou somente na tarde desta quarta-feira (25) ao Palácio do Planalto para ser submetida à sanção do presidente Michel Temer.  Referência para a elaboração da proposta com as despesas e receitas do governo federal no ano seguinte, a LDO de 2019 foi aprovada por deputados e senadores na madrugada do último dia 12 de julho.  Mas, sem a assinatura do presidente do Congresso, senador Eunício Oliveira (MDB-CE), a lei não podia ser encaminhada ao Executivo. Eunício está em viagem a Miami desde 16 de julho, data em que o texto final da LDO chegou à Secretaria do Congresso Nacional.  A assessoria de Eunício afirmou que, na ausência do senador, a atribuição de assinar passou ao primeiro vice-presidente do Senado, Cássio Cunha Lima (PSDB-PB).  Segundo a assessoria de Cunha Lima, ele está no exercício da presidência desde esta segunda-feira (23), e por isso somente nesta terça (24) teria enviado ao Planalto a LDO e demais projetos pendentes de sanção presidencial.  A Secretaria de Governo da Presidência da República informou que o projeto chegou na tarde desta quarta (25), 12 dias depois da aprovação.  Agora, o presidente Michel Temer tem prazo de 15 dias consecutivos para vetar ou sancionar a proposta. Sancionada, o governo terá de mandar ao Congresso a proposta de Orçamento de 2019, feita de acordo com os critérios estipulados na LDO, até 31 de agosto.  A última vez em que o documento demorou tanto tempo para cruzar a Praça dos Três Poderes tinha sido em 2013. Na ocasião, a LDO de 2014, aprovada em 20 de novembro, seguiu para o Planalto em 4 de dezembro, 14 dias depois.  De acordo com a Constituição, a aprovação da LDO é referência para o início do recesso parlamentar, que termina na próxima terça (31). Deputados e senadores devem voltar ao trabalho na próxima quarta (1º de agosto).  A votação da matéria no prazo previsto chegou a ser comemorada pelo presidente do Senado na sessão. “Estamos saindo agora para um recesso parlamentar constitucionalmente adequado, ou seja, nós vamos para um recesso acobertado pela Constituição brasileira. Portanto, nós votamos a LDO, votamos o orçamento”, disse na ocasião.  A votação da LDO foi concluída em meio a polêmicas sobre reajuste de servidores e corte de despesas.  No texto inicial, o relator, senador Dalírio Beber (PSDB-SC), propôs medidas de austeridade, como o corte nas despesas de custeio de 10% e a proibição de que os servidores obtivessem reajustes nos salários no ano que vem.  O texto inicial do relator previa também que não seriam criados novos cargos públicos no ano que vem. Todas essas medidas foram derrubadas quando o texto passou por votação no plenário do Congresso.  Os principais pontos da lei aprovada pelo Congresso ",politica,,,,,,
2018-07-26,https://web.archive.org/web/20180726004700/https://g1.globo.com/politica/noticia/2018/07/25/mp-suspeita-que-operador-de-cunha-esteja-se-escondendo-e-pede-providencias-a-justica.ghtml,https://g1.globo.com/politica/noticia/2018/07/25/mp-suspeita-que-operador-de-cunha-esteja-se-escondendo-e-pede-providencias-a-justica.ghtml,MP suspeita que suposto operador de Eduardo Cunha esteja se escondendo e pede providências à Justiça," A Procuradoria da República no Distrito Federal pediu à Justiça Federal em Brasília nova citação de Sidney Noberto Szabo apontado por investigadores como operador do ex-deputado Eduardo Cunha, preso desde 2016 no Complexo Médico-Penal de Pinhais, no Paraná.  Sidney Szabo é suspeito de atuar no ""quadrilhão do MDB"" e investigado neste processo, onde políticos do MDB da Câmara dos Deputados são acusados de integrar uma organização criminosa.  A TV Globo teve acesso ao pedido do Ministério Público à Justiça. O MP pede nova citação de Sidney Szabo sob pena de prisão, caso ele não seja localizado. O MP suspeita que o operador esteja se escondendo.  Os procuradores do caso relatam que no dia 23 de maio oficiais de Justiça foram ao endereço atribuído ao operador e receberam a informação da ex-mulher dele de que ela não sabia onde ele estava e que Szabo não morava mais no local.  ""Essa informação (de que desconhece o lugar em que se encontra o réu), dita pela ex-esposa do citando, traz os elementos necessários para se suspeitar de que o réu oculta-se para não receber a citação"", afirma o MP no pedido à Justiça.  Segundo o Ministério Público, após ""diversas tentativas frustradas de citar o réu"", ""se conseguiu achar alguém no local, esta pessoa não sabe nenhuma informação sobre o paradeiro do réu, apesar de ser ex-esposa"".  O MP suspeita de que a ex-mulher de Sidney tenha sido orientada a não dar informações sobre o paradeiro do operador.  No pedido, o MP requer a ""citação por hora certa"", modalidade introduzida no Código de Processo Penal (CPP). Segundo o MP, essa modalidade ""é utilizada quando há suspeita de que o réu vem se ocultando com o objetivo de não compor a triangulação processual penal. Para tanto, age de forma maliciosa, no sentido de que a conduta realizada pelo citando é deliberada para turbar o regular trâmite processual"", diz a petição.  A TV Globo apurou que na ""citação por hora certa"" se dá quando o juiz autoriza o oficial de Justiça a ir ao local onde estaria o réu, em hora determinada, deixando avisado aos moradores locais previamente sobre o procedimento, para que o réu esteja presente na hora e local estipulados em petição. Na prática, uma espécie de última chance para que ele se apresente no processo a que responde.  Se isso não ocorrer, o MP pede a prisão preventiva. ""Por fim, caso não se logre êxito na citação pessoal (real) do réu, em razão da efetiva manobra empreendida e, tendo em vista a presença de elementos de autoria e materialidade de crime doloso com pena superior a 4 (quatro) anos de reclusão, manifesta-se o Ministério Público Federal, desde já, ocorrendo a hipótese supramencionada (fato novo), para que seja decretada, inclusive ex officio, a prisão preventiva de Sidney Noberto Szabo"", diz o documento.  O juiz do caso é da 12ª Vara da Justiça Federal, Marcus Vinicius Reis.  O processo em questão, no qual há dificuldades para localizar Sidney Szabo, foi aberto no início de abril. O juiz federal Marcus Vinicius Reis, da 12ª Vara da Justiça Federal em Brasília, aceitou denúncia por organização criminosa contra Szabo e amigos do presidente Michel Temer, como o advogado José Yunes, ex-assessor da Presidência, e o coronel aposentado da Polícia Militar de São Paulo João Baptista Lima Filho.  Eles foram acusados de integrar o grupo que ficou conhecido como o ""quadrilhão do MDB"". Segundo o Ministério Público Federal, o grupo cometia crimes contra empresas e órgãos públicos. ",politica,,,,,,
2018-08-02,https://web.archive.org/web/20180802005837/https://g1.globo.com/politica/noticia/2018/08/01/barroso-autoriza-prorrogacao-de-inquerito-que-investiga-michel-temer.ghtml,https://g1.globo.com/politica/noticia/2018/08/01/barroso-autoriza-prorrogacao-de-inquerito-que-investiga-michel-temer.ghtml,Ministro Luís Roberto Barroso autoriza pela terceira vez prorrogação de inquérito que investiga Michel Temer," O ministro Luís Roberto Barroso, do Supremo Tribunal Federal (STF), autorizou nesta quarta-feira (1º) a prorrogação pela terceira vez de um dos inquéritos que investiga o presidente Michel Temer.  O inquérito foi prorrogado pela primeira vez em fevereiro deste ano. Houve nova prorrogação em maio.  Em junho, Barroso já havia autorizado a Polícia Federal a prosseguir com a investigação até tomar uma decisão final sobre o terceiro pedido de prorrogação.  Agora, o prazo, que acabaria oficialmente em 8 de julho, foi estendido até setembro.  A Presidência da República informou que não comentará o assunto.  O inquérito foi aberto no ano passado a partir de depoimentos de executivos do grupo J&F que fecharam acordo de delação premiada com o Ministério Público Federal.  A investigação apura se um decreto editado por Temer tinha por objetivo beneficar empresas específicas que atuam no porto de Santos (SP).  Desde o início das investigações, o presidente nega que o decreto tivesse essa finalidade. Empresas alvo do inquérito também negam o pagamento de propina.  Ao analisar o caso em junho, Luís Roberto Barroso estabeleceu que nenhum superior hierárquico poderá retirar o delegado Cleyber Malta Lopes do caso sem justificativas, como prevê a lei que trata de investigação criminal por delegados.  A procuradora-geral da República, Raquel Dodge, pediu nesta quarta (1 º) ao Supremo Tribunal Federal para incluir no inquérito dos portos depoimento de um dos delatores da J&F, Florisvaldo Caetano de Oliveira, que cita supostos repasses ao presidente Michel Temer.  Dodge quer investigar os repasses apontados pela J&F no inquérito que já está em andamento sobre o decreto dos portos.  No depoimento, Oliveira disse que realizou em 2014, junto com outro diretor da J&F (Demilton Castro) entrega de R$ 1 milhão em dinheiro vivo no escritório do coronel João Batista Lima Filho, o coronel Lima, amigo de Temer.  Segundo o depoimento, o diretor da J&F Ricardo Saud orientou a entrega e teria pedido agilidade ""diante da importância de seu destinatário"".  Desde que as delações de executivos da J&F se tornaram conhecidas, o presidente tem negado todas as acusações.  Em maio, Raquel Dodge pediu que o ministro Fachin autorizasse a inclusão do trecho do depoimento em um procedimento separado para ela avaliar.  Dodge poderia ter pedido abertura de novo inquérito, arquivamento do caso ou inclusão em alguma das apurações já abertas em relação ao presidente – agora, decidiu que quer investigar junto com o inquérito dos portos. ",politica,,,,,,
2018-08-02,https://web.archive.org/web/20180802005837/https://g1.globo.com/politica/noticia/2018/08/01/edson-fachin-arquiva-inquerito-que-investigava-deputada-jandira-feghali.ghtml,https://g1.globo.com/politica/noticia/2018/08/01/edson-fachin-arquiva-inquerito-que-investigava-deputada-jandira-feghali.ghtml, Edson Fachin arquiva inquérito que investigava deputada Jandira Feghali," O ministro Luiz Edson Fachin, do Supremo Tribunal Federal (STF), determinou nesta quarta-feira (1º) o arquivamento de um inquérito que investigava a deputada Jandira Feghali (PCdoB-RJ).  Ao decidir pelo arquivamento, Fachin rejeitou, consequentemente, enviar o caso à primeira instância da Justiça do Rio de Janeiro, como havia pedido a Procuradoria Geral da República (PGR).  Após a decisão do ministro, Jandira Feghali divulgou a seguinte declaração: ""A falta de crime só poderia ter um destino, o arquivamento"".  Na avaliação do relator dos processos da Lava Jato no Supremo, a PGR não indicou medidas para aprofundamento das investigações sobre a parlamentar nem conseguiu levantar elementos contra Jandira.  ""À míngua de qualquer indicação de medidas investigativas que, não levadas a efeito no decorrer do período de tramitação deste caderno apuratório, poderiam elucidar ou corroborar os fatos atribuídos à requerente, o arquivamento das investigações é medida que se amolda às garantias constitucionais dispostas em favor dos investigados"", escreveu o ministro.  O inquérito foi aberto em março de 2016 com base na delação premiada do ex-senador e ex-presidente da Transpetro Sérgio Machado.  No depoimento, Machado afirmou que Jandira Feghali recebeu R$ 100 mil em vantagem indevida como doação oficial na campanha dela à Prefeitura do Rio em 2012.  Segundo a PGR, os fatos teriam ocorrido quando ela era secretária de Cultura, entre 2009 e 2010, e, portanto, deveriam ser apurados pela primeira instância da Justiça.  Para Fachin, apesar da insistência da PGR na continuidade das investigações, ficou evidente o ""incontestável vazio investigatório em relação ao suposto fato delituoso a ser descortinado, especialmente aquele imputado em desfavor da deputada federal Jandira Feghali"".  Fachin destacou, ainda, que outros parlamentares investigados no mesmo inquérito foram denunciados, mas nada se apurou em relação à deputada.  O ministro considerou que o caso é diferente de outros arquivamentos determinados em desdobramentos da Lava Jato, nos quais ministros arquivaram mediante pedidos da Procuradoria Geral da República para mais prazo para investigar. ",politica,,,,,,
2018-08-02,https://web.archive.org/web/20180802005837/https://g1.globo.com/politica/noticia/2018/08/01/pgr-diz-ao-supremo-ser-a-favor-de-manter-com-moro-acao-sobre-lula-no-caso-do-sitio-de-atibaia.ghtml,https://g1.globo.com/politica/noticia/2018/08/01/pgr-diz-ao-supremo-ser-a-favor-de-manter-com-moro-acao-sobre-lula-no-caso-do-sitio-de-atibaia.ghtml,PGR diz ao Supremo ser a favor de manter com Moro ação sobre Lula no caso do sítio de Atibaia," A Procuradoria Geral da República (PGR) enviou uma manifestação ao Supremo Tribunal Federal (STF) na qual afirmou ser a favor de manter com o juiz Sérgio Moro a ação sobre o ex-presidente Luiz Inácio Lula da Silva no caso do sítio de Atibaia (SP).  Sérgio Moro é responsável pelos processos da Lava Jato em primeira instância e, para a defesa de Lula, como o caso do sítio não tem relação com a operação, deveria deixar a 13ª Vara Federal de Curitiba.  Na ação, Lula é réu por corrupção e lavagem de dinheiro. O Ministério Público afirma que ele ocultou a propriedade de um sítio reformado pela Odebrecht.  Desde que as investigações começaram, a defesa do ex-presidente afirma que o sítio não é dele, acrescentando que Lula não cometeu crimes antes, durante ou depois da Presidência da República.  Na manifestação, a procuradora-geral, Raquel Dodge, afirma que o sítio foi reformado pela Odebrecht porque Lula atuou para beneficiar a empreiteira.  ""Em suma, em virtude de toda atuação de Lula em benefício do Grupo Odebrecht, aí incluída a Braskem, é que os executivos do grupo efetuaram o pagamento de vantagens indevidas em favor do ex-presidente, consubstanciadas em reformas no Sítio de Atibaia"", argumentou a PGR.  Segundo a procuradora, ""o Juízo da 13ª Vara"", ou seja, Sérgio Moro, ""é aquele que tem maior conhecimento e mais proximidade com as provas até então colhidas"".  ""O juízo da 13ª Vara Federal de Curitiba é prevento para toda a Operação Lava Jato, dentro dos limites reconhecidos em diversas oportunidades pelo STF, que, sem espaço para dúvida, alcançam a ação penal em exame"", completou Raquel Dodge.  Raquel Dodge argumentou, ainda, que o fato de o Supremo ter decidido retirar de Sérgio Moro trechos das delações da Odebrecht sobre Lula não muda a competência de juiz.  Para a procuradora, há uma tentativa da defesa do ex-presidente de ""burlar"" o rito do Poder Judiciário, já que as instâncias inferiores devem analisar primeiro a questão.  O relator do caso é o ministo Dias Toffoli, autor do voto vencedor na Segunda Turma no julgamento no qual os ministros tiraram de Moro os trechos das delações.  Na decisão, os processos não foram retirados do magistrado. A defesa de Lula tenta tirar de Moro a análise do caso. ",politica,,,,,,
2018-08-09,https://web.archive.org/web/20180809013346/https://g1.globo.com/politica/noticia/2018/08/08/rosa-weber-suspende-decreto-de-roraima-que-restringiu-acesso-de-venezuelanos-a-servicos-publicos.ghtml,https://g1.globo.com/politica/noticia/2018/08/08/rosa-weber-suspende-decreto-de-roraima-que-restringiu-acesso-de-venezuelanos-a-servicos-publicos.ghtml,Rosa Weber suspende decreto de Roraima que restringiu acesso de venezuelanos a serviços públicos," A ministra Rosa Weber, do Supremo Tribunal Federal (STF), suspendeu nesta quarta-feira (8) um decreto do governo de Roraima que, na prática, restringiu o acesso de venezuelanos a serviços públicos no estado.  O decreto está suspenso desde o último fim de semana por decisão do juiz Helder Girão Barreto, da 1ª Vara da Federal de Roraima. Nesta terça (7), o governo do estado informou ter acatado a decisão.  Diante da crise política, econômica e social na Venezuela, milhares de cidadãos têm deixado o país em direção ao Brasil.  O fluxo migratório levou o governo de Roraima a pedir ao STF para fechar a fronteira e a cobrar da União o ressarcimento de R$ 180 milhões.  Na última segunda (6), Rosa Weber negou o pedido do governo estadual para fechar a fronteira com a Venezuela.  Entre outros pontos, o decreto passou a exigir passaporte válido para venezuelanos terem acesso a serviços públicos estaduais. O objetivo do governo seria filtrar a demanda e evitar o colapso no atendimento.  Diante do que definiu o texto, a Advocacia Geral da União (AGU) pediu ao STF a suspensão do decreto.  Rosa Weber atendeu ao pedido da AGU por verificar indícios de indevida interferência do decreto no processo sobre o fechamento da fronteira.  ""A negativa de fechamento da fronteira se alicerça em princípios voltados à fruição plena de garantias individuais dos migrantes. [...] Extraio indícios de que seu teor [do decreto] pode inviabilizar tais garantias e interferir negativamente na fruição plena dos direitos cuja decisão, embora de cunho negativo, busca resguardar"", considerou.  A ministra decidiu, ainda, fazer uma nova tentativa de conciliação entre a União, contrária ao fechamento, e o estado, que quer barrar a entrada dos venezuelanos. A data, no entanto, ainda não foi marcada. ",politica,,,,,,
2018-08-09,https://web.archive.org/web/20180809013346/https://g1.globo.com/politica/noticia/2018/08/08/maioria-do-stf-decide-incluir-reajuste-salarial-de-1638-para-ministros-no-orcamento-de-2019.ghtml,https://g1.globo.com/politica/noticia/2018/08/08/maioria-do-stf-decide-incluir-reajuste-salarial-de-1638-para-ministros-no-orcamento-de-2019.ghtml,"STF decide incluir aumento de 16,38% para ministros no orçamento de 2019"," O Supremo Tribunal Federal (STF) decidiu nesta quarta-feira (8), por 7 votos a 4, incluir no orçamento de 2019 a previsão de reajuste salarial de 16,38% para os ministros da Corte.  Atualmente em R$ 33,7 mil, o salário dos ministros poderá ultrapassar R$ 39 mil a partir do ano que vem.  O salário dos ministros do STF é o teto do salário do servidor público e serve como base para os salários de todos os magistrados do país.  De acordo com a Secretaria Geral do STF, o impacto da proposta aprovada é de R$ 2,87 milhões para o STF em 2019.  De acordo com dados divulgados em 2015 pelo Supremo, o impacto em todo o Poder Judiciário federal chegará a R$ 717,1 milhões.  O orçamento do STF aprovado nesta quarta será encaminhado ao Ministério do Planejamento, responsável por consolidar o Orçamento Geral da União.  Em seguida, caberá ao ministério enviar a proposta ao Congresso Nacional. O texto aprovado pelo Legislativo seguirá, então, para sanção do presidente da República.  Além do efeito-cascata no Judiciário, também pode haver impacto nos três poderes, uma vez que servidores públicos que recebem salário acima dos ministros do STF, em razão de benefícios, são alvos do abate-teto. Com reajuste no salário do STF, o abate-teto sobe.  A presidente do STF, Cármen Lúcia, havia sugerido a não inclusão do reajuste no orçamento em razão do efeito-cascata.  Ricardo Lewandowski, contudo, abriu a divergência para que o aumento fosse incluído, e a decisão final sobre o reajuste, tomada pelo Congresso.  Durante a sessão desta quarta, a presidente do Supremo, Cármen Lúcia, apresentou o orçamento de 2019 e sugeriu a não inclusão do reajuste nos gastos do tribunal.  O ministro Ricardo Lewandowski, então, abriu divergência para sugerir a inclusão do projeto enviado na gestão dele em 2015 para o Congresso – leia detalhes mais abaixo.  O decano do Supremo, Celso de Mello, disse que o STF estava diante de uma ""escolha trágica"", entre uma pretensão justa de aumento e a falta de recursos. Mas que não se poderia ignorar a crise fiscal e, por isso, foi contra a inclusão.  O ministro Luís Roberto Barroso concordou com a inclusão, mas frisou que caberia ao Congresso decidir.  Já Gilmar Mendes, que também concordou, falou que é preciso discutir com urgência os efeitos dos aumentos no STF.  Dias Toffoli, eleito novo presidente do STF, concordou com a inclusão do aumento e afirmou que é preciso destacar que não será retirado dinheiro de áreas essenciais para reajustar os salários.  A proposta de reajuste foi encaminhada ao Congresso em 2015 pelo então presidente do STF, Ricardo Lewandowski.  Um ano depois, a Câmara aprovou o reajuste, mas o aumento não foi analisado pelo Senado porque não havia previsão orçamentária sobre a origem do gasto a mais. ",politica,,,,,,
