data,url_noticia,url_noticia_curto,titulo,conteudo_noticia,assunto,assunto_ex,titulo_ex,subtitulo_ex,local_ex,artigo_ex,n_paragrafos
2018-08-09,https://web.archive.org/web/20180809013346/https://g1.globo.com/politica/noticia/2018/08/08/conselho-de-etica-da-camara-marca-para-terca-depoimento-de-ex-assessor-de-lucio-vieira-lima.ghtml,https://g1.globo.com/politica/noticia/2018/08/08/conselho-de-etica-da-camara-marca-para-terca-depoimento-de-ex-assessor-de-lucio-vieira-lima.ghtml,Conselho de Ética da Câmara marca para terça depoimento de ex-assessor de Lúcio Vieira Lima," O Conselho de Ética da Câmara dos Deputados marcou para a próxima terça-feira (14) o depoimento de Job Ribeiro Brandão, ex-assessor do deputado Lúcio Vieira Lima (MDB-BA).  Ele será ouvido na condição de testemunha no processo que pede a cassação do parlamentar no caso dos R$ 51 milhões apreendidos pela Polícia Federal em um apartamento em Salvador (BA).  O ex-assessor teve as digitais encontradas em parte do dinheiro. A polícia investiga se as malas pertenciam ao ex-ministro Geddel Vieira Lima (MDB-BA), irmão de Lúcio, e que também teve as digitais encontradas em cédulas.  O deputado é réu no Supremo Tribunal Federal (STF) pelos crimes de lavagem de dinheiro e associação criminosa.  Segundo o Ministério Público Federal, o dinheiro tem como possíveis origens propinas da construtora Odebrecht; repasses do operador financeiro Lúcio Funaro; e desvios de políticos do MDB.  Lúcio Vieira Lima ainda é suspeito de ter se apropriado de parte dos salários de dois funcionários de seu gabinete e de usar servidores para serviços privados.  Ao STF, Job Ribeiro enviou uma manifestação na qual disse que devolvia até 80% do salário dele ao parlamentar e ao ex-ministro.  O ex-assessor chegou a ser preso temporariamente, mas foi solto após pagar fiança e agora responde ao processo em liberdade.  Job Ribeiro faz parte do rol de testemunhas indicadas pelo PSOL e Rede, partidos autores da representação.  Ele é o único da lista de testemunhas de acusação que aceitou comparecer à Câmara. O ex-gerente da Odebrecht Cláudio Melo Filho foi um dos convidados, mas, por meio de seu advogado, informou que tudo o que teria para falar já foi dito em seu acordo de delação premiada.  Após Job Ribeiro ser ouvido, deverão ser marcados os depoimentos das testemunhas indicadas pela defesa.  Em seguida, o relator terá até 10 dias úteis para entregar o seu parecer para ser votado no conselho. ",politica,,,,,,
2018-08-09,https://web.archive.org/web/20180809013346/https://g1.globo.com/politica/noticia/2018/08/08/comissao-da-camara-aprova-permissao-para-que-entidades-de-municipios-questionem-constituicao-no-stf.ghtml,https://g1.globo.com/politica/noticia/2018/08/08/comissao-da-camara-aprova-permissao-para-que-entidades-de-municipios-questionem-constituicao-no-stf.ghtml,Comissão da Câmara aprova permissão para que entidades de municípios questionem Constituição no STF," Uma comissão especial da Câmara dos Deputados aprovou nesta quarta-feira (8) parecer que amplia a lista de quem pode questionar no Supremo Tribunal Federal (STF) pontos da Constituição Federal.  A proposta de emenda à Constituição (PEC) que passou na comissão autoriza entidades de âmbito nacional representantivas de municípios a propor as chamadas ação direta de inconstitucionalidade (ADI) e ação declaratória de constitucionalidade (ADC).  As ADIs permitem contestar a validade de um ponto específico da Constituição. As ADCs pedem que o Supremo confirme a constitucionalidade de uma lei.  Hoje, somente podem propor esses dois tipos de ação:  A comissão especial da Câmara aprovou sem alterações um texto que já tinha tramitado no Senado. Agora, a medida tem que ser analisada pelo plenário da Câmara.  No entanto, enquanto vigorar a intervenção federal na área de segurança pública do Rio de Janeiro, a tramitação de PECs no plenário da Câmara está suspensa, conforme determina a Constituição.  O prazo da intervenção no Rio vai até o dia 31 de dezembro deste ano.  Relator na comissão especial, o deputado Hildo Rocha (MDB-MA) afirmou que, apesar de serem um dos três entes autônomos da federação brasileira, os municípios não têm o amparo jurídico para discutir, perante o Supremo, a inconstitucionalidade de leis federais que firam sua autonomia ou causem prejuízos financeiros.  No parecer, Rocha relacionou as entidades que atualmente representam os municípios: Confederação Nacional dos Municípios, Associação Brasileira dos Municípios, Frente Nacional dos Prefeitos e União dos Vereadores do Brasil.  “Não há por que deixá-las à margem do processo, e não pode o legislador, tendo em vista o primado do princípio federativo, operar para pulverizar a unidade nacional dos municípios”, escreveu Rocha no relatório. ",politica,,,,,,
2018-08-16,https://web.archive.org/web/20180816020939/https://g1.globo.com/politica/noticia/2018/08/15/decisao-da-2a-turma-do-stf-abre-discussao-sobre-se-prova-apresentada-por-delator-e-valida-para-abertura-de-acao-penal.ghtml,https://g1.globo.com/politica/noticia/2018/08/15/decisao-da-2a-turma-do-stf-abre-discussao-sobre-se-prova-apresentada-por-delator-e-valida-para-abertura-de-acao-penal.ghtml,Decisão da 2ª Turma do STF abre discussão sobre validade de prova apresentada por delator," O arquivamento de uma denúncia contra o senador Ciro Nogueira (PP-PI) abriu uma discussão no Supremo Tribunal Federal (STF): se a palavra de um delator e as provas produzidas por ele são suficientes para embasar a abertura de uma ação penal.  Nesta terça-feira (14), a Segunda Turma do STF rejeitou, por três votos a um, uma denúncia oferecida pela Procuradoria Geral da República (PGR) contra o parlamentar do Piauí.  Presidente do PP, Nogueira foi acusado pela PGR de corrupção passiva e lavagem de dinheiro por supostamente pedir R$ 2 milhões em 2014 ao então dono da construtora UTC, Ricardo Pessoa. Em troca, segundo o Ministério Público, o senador prometeu favorecer a empresa em contratos de obras pagas pelo Ministério das Cidades (controlado pelo PP à época) no estado do Piauí.  À época em que a denúncia foi oferecida, Ciro Nogueira prestou depoimento e negou ter recebido qualquer valor.  Em relatório, a Polícia Federal cita que o delator Ricardo Pessoa disse que Ciro Nogueira, no segundo semestre do ano de 2013, solicitou-lhe a quantia de R$ 2 milhões para fazer frente a despesas médicas decorrentes da internação de um familiar seu, aduzindo que tal solicitação lhe fora feita mediante o aceno com contrapartidas.  Segundo o relatório, o valor foi parcialmente pago em três vezes, em dinheiro, no montante total de R$ 1.400.000,00.  Os investigadores receuperaram datas de voos dos emissários que teriam levado a propina até o senador Ciro Nogueira.  Além do depoimento, o delator entregou ao ministério público alguns documentos:  Relator da Lava Jato no STF, o ministro Edson Fachin considerou que as provas eram suficientes para abertura de uma ação penal.  No entanto, em junho, o ministro Dias Toffoli abriu divergência. Ele disse que as provas produzidas pelo delator não eram suficientes para justificar a abertura da ação.  Nesta terça, na retomada do julgamento, o ministro Gilmar Mendes seguiu o entendimento de Toffoli e votou contra o recebimento da denúncia.  ""A previsão de que não haverá condenação baseada apenas nas declarações do colaborador, é o que tá na lei, artigo quarto parágrafo dezesseis da Lei 12.850, e o reconhecimento legal de que a prova produzida de forma interessada tem valor limitado. Muito embora a legislação seja expressa em atribuir pouco valor à prova oral produzida pelo colaborador, todos os atos de colaboração têm valor probatório limitado"", declarou Gilmar.  O ministro Ricardo Lewandowski também entendeu que as provas apresentadas pelo delator não eram suficientes para se abrir uma ação penal.  ""Verifico que o rigor no recebimento de denúncias nas quais os colaboradores são réus e que não estão lastreados em elementos externos de colaboração é uma medida que se impõe nos dias atuais justamente para evitar que os delatores sejam tratados ainda que de modo transverso como se fossem testemunhas dos crimes descritos na peça acusatória gerando consequências distorções na valorização desses depoimento"", disse.  Nesta terça, Edson Fachin voltou a defender a abertura da ação penal baseada nas provas apresentadas por delator.  ""Exigir uma prova acima de qualquer dúvida razoável , um elemento de corroboração acima de qualquer dúvida razoável, com todas as vênias, é antecipar para a fase do recebimento da denúncia o juízo de condenação. Eu procurei me ater ao parágrafo dezesseis do artigo quarto da lei 12.580, e que foi aqui repetido, embora com uma percepção hermenêutica diferente, segundo o qual nenhuma sentença condenatória será proferida apenas com fundamento apenas nas declarações de agente colaborador. A colaboração meio de obtenção de provas"", disse Fachin.  ""Estamos de acordo com essas percepções que aliás constituem discurso normativo expresso. Mas, se nenhuma sentença condenatória será proferida, em meu modo de ver, isso não obsta diante da valoração da prova e de elementos de corroboração o recebimento da denúncia"", completou.  Celso de Mello, um dos cinco ministros da Segunda Turma, não compareceu ao julgamento, que terminou em 3 a 1 pelo arquivamento da denúncia.  A Procuradoria Geral da República já reagiu. Em outro processo, contra o deputado Eduardo da Fonte (PP-PE), acusado de corrupção passiva, a maioria da Segunda Turma rejeitou denúncia também por entender que se baseou apenas em elementos obtidos por meio de delação.  Mas, em março, a procuradora-geral Raquel Dodge recorreu citando um vídeo obtido por indicação de delator que mostraria um acerto de propina. O recurso ainda será julgado.  O presidente da Associação de Delegados da PF, Edivandir Paiva, disse que a delação premiada foi criada como fonte de prova.  ""A lógica é o colaborador trazer documentos e trazer elementos para aquela investigação para que a quadrilha, pra que a organização criminosa seja desbaratada. Por exemplo, se ele traz esses elementos não é porque ele trouxe que a investigação ou que o processo não deve seguir, deve seguir sim, o que não pode ocorrer é que o processo seja instaurado apenas com base na versão, nas palavras trazidas pelo colaborador"", afirmou. ",politica,,,,,,
2018-08-16,https://web.archive.org/web/20180816020939/https://g1.globo.com/politica/noticia/2018/08/15/governo-suico-envia-ao-stf-documentos-que-segundo-a-pgr-reforcam-suspeitas-de-caixa-dois-na-campanha-de-serra-em-2006.ghtml,https://g1.globo.com/politica/noticia/2018/08/15/governo-suico-envia-ao-stf-documentos-que-segundo-a-pgr-reforcam-suspeitas-de-caixa-dois-na-campanha-de-serra-em-2006.ghtml,"Governo suíço envia documentos que, segundo PGR, reforçam suspeitas de caixa dois na campanha de Serra em 2006"," O governo da Suíça enviou documentos que reforçam suspeitas de caixa dois na campanha do senador José Serra (PSDB) ao governo de São Paulo, em 2006. Os documentos chegaram ao Brasil no fim de julho e segundo a procuradora-geral da República, Raquel Dodge, abrem espaço para que as investigações sobre a suspeita de caixa dois continuem.  O inquérito que investiga Serra está no STF, mas a PGR solicitou que seja remetido para a Justiça Federal de São Paulo porque os atos investigados não têm relação com o mandato de senador.  Um dos documentos enviados ao país é um email de novembro de 2007 no qual a filha de José Serra, Verônica Allende Serra, autoriza a substituição do administrador de uma conta do banco suíço Arner, a conta Firenze 3026.  Essa conta, segundo os documentos enviados pelo governo suíço, pertencia a uma empresa offshore do Panamá, a Dormunt International Inc. Quando a conta foi criada, Veronica Serra recebeu uma procuração para gerenciar os recursos - o passaporte dela está entre os documentos vinculados à conta.  Procurado, o senador José Serra declarou que rejeita a possibilidade de haver qualquer ilegalidade envolvendo o nome da filha. Disse ainda que jamais recebeu vantagem indevida ao longo da carreira política e que espera que o caso seja esclarecido para evitar que prosperem acusações falsas.  Verônica serra declarou que não faria comentários por não ter ciência dos documentos e dos pretensos fatos, mas disse que considera injustiça e equívoco a menção ao nome dela.  Um dos delatores da Odebrecht, Pedro Novis, que já ocupou a presidência da empresa, detalhou em depoimento os supostos repasses a José Serra.  As doações supostamente ilegais teriam sido feitas quando Serra deixou a Prefeitura de São Paulo para concorrer ao governo do estado.  ""Em 2006 e 2007 [...] foram doados R$ 4,5 milhões, valores históricos que correspondiam a 1,6 milhão de euros para a campanha de José Serra ao governo do estado. Em 2006, era a própria campanha, e em 2007 [houve] uma nova solicitação que ele fez para quitar dividas da campanha. E os pagamentos foram realizados entre junho e dezembro de 2006 e entre julho e outubro de 2007 por meio de depósitos em contas correntes bancárias no exterior"", disse Novis.  Um documento entregue pela Odebrecht registra a transferência entre uma empresa offshore, usada pela empreiteira para pagamentos no exterior, e a Circle Tecnical Company Inc., no valor de 46.971,00 euros. A Circle aparece nos documentos anexados pela PGR.  Um registro de transferência no valor de 251 mil euros feita pela empresa está no extrato da conta Firenze do banco suíço Arner - a mesma que Verônica Serra tinha procuração para gerenciar. ",politica,,,,,,
2018-08-16,https://web.archive.org/web/20180816020939/https://g1.globo.com/politica/noticia/2018/08/15/stf-reafirma-que-transexuais-e-transgeneros-podem-mudar-registro-civil-sem-necessidade-de-cirurgia.ghtml,https://g1.globo.com/politica/noticia/2018/08/15/stf-reafirma-que-transexuais-e-transgeneros-podem-mudar-registro-civil-sem-necessidade-de-cirurgia.ghtml,STF reafirma que transexuais e transgêneros podem mudar registro civil sem necessidade de cirurgia," O Supremo Tribunal Federal (STF) reafirmou nesta quarta-feira (15) decisão que permitiu que transexuais e transgêneros possam alterar seu nome no registro civil sem a necessidade de realização de cirurgia de mudança de sexo.  O entendimento já havia sido firmado no dia 1º de março deste ano, por unanimidade, quando o Supremo julgou uma ação mais ampla. Mas um recurso tinha ficado pendente de análise na Corte.  O recurso questionava se o entendimento que havia sido fixado em março valeria para casos concretos que aguardam decisão nas justiças estaduais. Nesta quarta, os ministros decidiram que a tese valerá para todos os casos pendentes.  Além de decidir pela ausência de necessidade de cirurgia, a maioria dos ministros tanbém decidiu também que não será preciso autorização judicial para que o transexual requisite a alteração no documento, que poderá ser feita em cartório. ",politica,,,,,,
2018-08-20,https://web.archive.org/web/20180820225107/https://g1.globo.com/politica/noticia/2018/08/20/marun-governo-ve-dificuldade-mas-admite-hipotese-de-fechar-fronteira-com-venezuela-de-forma-temporaria.ghtml,https://g1.globo.com/politica/noticia/2018/08/20/marun-governo-ve-dificuldade-mas-admite-hipotese-de-fechar-fronteira-com-venezuela-de-forma-temporaria.ghtml,"Marun: governo vê ‘dificuldades’, mas admite hipótese de fechar fronteira com Venezuela de forma temporária"," O ministro da Secretaria de Governo, Carlos Marun, afirmou nesta segunda-feira (20) que o governo vê ""grandes dificuldades"", mas admite a possibilidade de fechar a fronteira com Venezuela temporariamente.  Marun deu a declaração após ser questionado sobre uma mensagem publicada no Twitter pelo líder do governo no Senado, Romero Jucá (MDB-RR), na qual o parlamentar disse ter proposto ao presidente Michel Temer a ""suspensão temporária"" da fronteira entre Pacarima (RR) e a Venezuela.  No sábado (18), Pacaraima registrou tumulto com atos de violência e destruição em acampamentos de imigrantes venezuelanos.  Nesta segunda, o governo de Roraima pediu ao Supremo Tribunal Federal (STF) para suspender temporariamente a imigração na fronteira com a Venezuela. Pediu, também, que os imigrantes no estado sejam levados a outras unidades da federação.  Um pedido semelhante já havia sido apresentado pela governadora, Suely Campos, mas foi negado pela ministra Rosa Weber.  Ao analisar a situação de Roraima, Carlos Marun ressaltou nesta segunda-feira que acordos internacionais firmados pelo Brasil, além da ""tradição de acolhimento"" do país, dificultam o fechamento da fronteira para venezuelanos em Roraima.  Marun explicou que o presidente Michel Temer aguardará o retorno da comitiva de representantes de ministérios que foi nesta segunda a Roraima para tomar uma decisão.  Segundo o líder do governo no Senado, Romero Jucá (MDB-RR), Temer ""determinou"" um estudo ""imediato"" sobre a suspensão da entrada de venezuelanos por Roraima.  ""Não estamos fechando as fronteiras para os venezuelanos, que poderão ingressar por qualquer outro lugar que não seja Roraima"", afirmou o senador.  Jucá também informou ter apresentado um projeto para que o país defina cotas de imigrantes que possam entrar no Brasil. Indagado sobre o assunto, o ministro Carlos Marun afirmou que o tema deve ser debatido no Congresso Nacional.  ""Não é uma decisão para ser tomada com a rapidez que a atual situação de Roraima exige"", afirmou Marun. ",politica,,,,,,
2018-08-23,https://web.archive.org/web/20180823022551/https://g1.globo.com/politica/noticia/2018/08/22/nao-ha-motivo-para-governo-enviar-agora-mais-recursos-para-roraima-diz-ministro.ghtml,https://g1.globo.com/politica/noticia/2018/08/22/nao-ha-motivo-para-governo-enviar-agora-mais-recursos-para-roraima-diz-ministro.ghtml,"Governo não tem motivo para enviar agora mais recursos para Roraima, diz ministro"," O ministro do Gabinete de Segurança Institucional (GSI), Sergio Etchegoyen, afirmou nesta quarta-feira (22) que não há motivo para o governo federal enviar agora mais recursos para Roraima.  Mais cedo, nesta quarta, a governadora do estado, Suely Campos (PP), enviou um ofício à Presidência pedindo, entre outros pontos, ressarcimento de R$ 184 milhões por gastos com imigrantes venezuelanos.  Segundo Etchegoyen, o governo federal enviou anteriormente ao estado, na área de saúde, R$ 187 milhões. Deste total, acrescentou o ministro, cerca de R$ 70 milhões ainda não foram utilizados pelo governo local.  Roraima é a principal porta de entrada dos venezuelanos no Brasil. A população tem deixado o país diante da grave crise econômica, política e social, com inflação alta e desabastecimento de produtos.  No último sábado (18), a cidade de Pacaraima, na fronteira com a Venezuela, registrou tumulto, com atos de violência em acampamentos de imigrantes.  Diante disso, nesta quarta, aconteceu no Palácio do Planalto uma reunião entre o presidente Michel Temer e ministros para avaliar o trabalho da comissão de representantes de ministérios enviada a Roraima para analisar a situação no estado.  Saiba abaixo todos os pedidos do governo de Roraima à União: ",politica,,,,,,
2018-08-23,https://web.archive.org/web/20180823022551/https://g1.globo.com/politica/noticia/2018/08/22/michel-temer-assina-decreto-que-simplifica-autorizacao-de-retransmissoras-de-tv.ghtml,https://g1.globo.com/politica/noticia/2018/08/22/michel-temer-assina-decreto-que-simplifica-autorizacao-de-retransmissoras-de-tv.ghtml,Michel Temer assina decreto que simplifica autorização de retransmissoras de TV," O presidente Michel Temer assinou nesta quarta-feira (22) um decreto para agilizar, no governo federal, o processo de autorização de retransmissoras de TV.  Segundo o Ministério da Ciência, Tecnologia, Inovações e Comunicações (MCTIC), o decreto vai reduzir o tempo de tramitação das autorizações de retransmissão em “caráter primário” dos atuais seis a oito anos para quatro meses.  O documento foi assinado por Temer durante cerimônia no Palácio do Planalto, com a presença do presidente da Associação Brasileira de Emissoras de Rádio e Televisão (Abert), Paulo Tonet Camargo.  O ministro Gilberto Kassab (MCTIC) destacou em entrevista que a mudança vai trazer mais “segurança” para investidores e espectadores.  “Essa redução vai acontecer de seis anos para quatro meses. Imaginem o ganho para o cidadão que vai ter acesso mais rapidamente ao benefício e para o empreendedor”, disse o ministro.  Diretor de radiodifusão comercial do MCTIC, Samir Nobre explicou a jornalistas, após a cerimônia, que as empresas chamadas de geradoras utilizam retransmissoras para expandir o alcance do sinal das TVs abertas para mais municípios.  A retransmissão em caráter primário é considerada mais segura, já que o sinal fica protegido de interferências de outros meios de radiodifusão. A retransmissão em caráter secundário, cuja autorização era mais simples pelo governo, não tem essa proteção.  Nobre declarou que, a partir do decreto, será possível pedir diretamente ao governo a autorização de retransmissão. Antes, o governo abria uma processo seletivo, que era mais demorado.  ""As entidades vão poder pedir diretamente para o ministério [a autorização]. Antes, ela deveriam aguardar um processo seletivo, e poderia ganhar uma entidade que sequer executa o serviço de radiodifusão"", disse.  Nobre afirmou que novo processo de autorização entrará em vigor em 10 de dezembro deste ano. O ministério também irá publicar uma portaria para regulamentar o decreto.  Nobre informou que o decreto também permitirá que uma emissora utilize sempre o mesmo canal em todo um estado, o que não ocorre em todo o país.  ""A utilização do espectro de forma mais racional vai permitir, com uma emissora utilizando o mesmo canal dentro do estado, uma liberação de oito canais dentro de cada município brasileiro"", disse o diretor. ",politica,,,,,,
2018-08-30,https://web.archive.org/web/20180830024849/https://g1.globo.com/politica/noticia/2018/08/29/bolsonaro-pede-ao-stf-arquivamento-de-acao-penal-em-que-e-reu-por-apologia-ao-estupro.ghtml,https://g1.globo.com/politica/noticia/2018/08/29/bolsonaro-pede-ao-stf-arquivamento-de-acao-penal-em-que-e-reu-por-apologia-ao-estupro.ghtml,Bolsonaro pede ao STF arquivamento de ação penal em que é réu por apologia ao estupro," A defesa do deputado Jair Bolsonaro (PSC-RJ), candidato do PSL à Presidência, pediu ao Supremo Tribunal Federal (STF) o arquivamento de ação penal aberta contra ele por apologia ao crime de estupro e injúria. O documento foi apresentado na terça (28) e disponibilizado no sistema da Suprema Corte nesta quarta (29).  A ação investiga o episódio no qual, em 2014, Bolsonaro afirmou na Câmara e em entrevista ao jornal ""Zero Hora"" que a deputada Maria do Rosário (PT-RS) não merecia ser estuprada porque ele a considera ""muito feia"" e porque ela ""não faz"" seu ""tipo"".  O processo, que foi aberto em 2016, está em fase final, faltando apenas o interrogatório do réu e as alegações finais, última manifestação da defesa e da Procuradoria Geral da República (PGR) antes do julgamento.  A defesa de Bolsonaro apresenta detalhes técnicos para reivindicar a extinção da punibilidade, que, na prática, levaria ao arquivamento do caso.  Segundo os advogados do candidato do PSL, Maria do Rosário deveria ter comparecido a todos os atos processuais fisicamente por ser autora da ação, e não somente por meio de advogado. A defesa alega que o Código de Processo Penal faz essa exigência para evitar ações penais abertas a partir de queixas como forma de evitar vingança privada.  Na terça-feira (4), a Primeira Turma do STF deve retomar a análise de outra ação sobre Bolsonaro. Neste processo, ele foi denunciado pela PGR pelo crime de racismo em razão de declarações sobre quilombolas e índios.  Os ministros da Primeira Turma começaram na última terça (28) a julgar se Bolsonaro vira ou não réu no caso. Quando o placar estava 2 a 2, o ministro Alexandre de Moraes pediu vista (mais tempo para analisar o caso) e, com isso, a decisão do STF foi adiada.  Em abril de 2017, em uma palestra no Clube Hebraica do Rio de janeiro, o presidenciável do PSL disse que, se vencer a corrida pelo Palácio do Planalto, não destinará recursos para ONGs e que não vai ter ""um centímetro demarcado"" para reservas indígenas ou quilombolas.  E acrescentou: ""Onde tem uma terra indígena, tem uma riqueza embaixo dela. Temos que mudar isso daí. [...] Eu fui num quilombo, o afrodescendente mais leve lá pesava sete arrobas. Não fazem nada! Eu acho que nem para procriador ele serve mais. Mais de R$ 1 bilhão por ano é gasto com eles"". ",politica,,,,,,
