data,url_noticia,url_noticia_curto,titulo,conteudo_noticia,assunto,assunto_ex,titulo_ex,subtitulo_ex,local_ex,artigo_ex,n_paragrafos
2018-05-09,https://web.archive.org/web/20180509175455/https://g1.globo.com/politica/noticia/toffoli-propoe-estender-restricao-do-foro-a-todas-as-autoridades.ghtml,https://g1.globo.com/politica/noticia/toffoli-propoe-estender-restricao-do-foro-a-todas-as-autoridades.ghtml,Toffoli propõe estender restrição do foro privilegiado a todas as autoridades," O ministro Dias Toffoli, do Supremo Tribunal Federal (STF), enviou ofício nesta quarta-feira (9) à presidente da Corte, Cármen Lúcia, propondo a aprovação de duas súmulas vinculantes:  O foro por prerrogativa de função, conhecido como foro privilegiado, é o direito que o presidente da República, ministros, deputados, senadores e governadores – entre outras autoridades – têm de ser julgados nas instâncias superiores, como o STF e o Superior Tribunal de Justiça (STJ).  Súmulas vinculantes são regras, baseadas em entendimentos do STF, que devem ser seguidas obrigatoriamente pelas demais instâncias do Judiciário e da administração pública em geral. Para que tenham efeito, precisam ser aprovadas por 8 dos 11 ministros da Corte.  As súmulas vinculantes apresentadas por Toffoli não serão avaliadas de imediato pelos ministros em plenário. Passarão ainda por análise técnica da Secretaria Judiciária do STF e terão de aguardar um parecer da Procuradoria Geral da República (PGR).  Os prazos da tramitação para levar a proposta para decisão final do STF somam mais de 30 dias. Depois disso, cabe à presidente o tribunal, ministra Cármen Lúcia, marcar uma data para votação no plenário.  >> Edição de duas súmulas vinculantes (regras a serem seguidas por todo o Judiciário) sobre a limitação do foro privilegiado de autoridades.  >> Uma das súmulas restringe o foro privilegiado aos casos de supostos crimes cometidos no cargo e em razão do cargo para integrantes de Executivo, Judiciário, Legislativo e Ministério Público.  >> A outra súmula estabelece que são inconstitucionais os dispostivos de constituições estaduais que concecem foro especial a autoridades estaduais e municipais.  A proposta de Toffoli segue o modelo aprovado na semana passada, quando o Supremo restringiu o foro privilegiado de deputados federais e senadores aos crimes cometidos durante o exercício do cargo e ligados ao mandato.  Nessas situações, os parlamentares continuam a ser processados exclusivamente no Supremo. Nas outras situações, serão processados nas primeiras instâncias judiciais.  Durante o julgamento, Toffoli chegou a propor a extensão desse entendimento para demais autoridades, mas não obteve maioria favorável na ocasião. A nova proposta, de teor idêntico, formalizaria a mudança.  No ofício a Cármen Lúcia, Toffoli justificou que a extensão visa eliminar controvérsias entre tribunais que pudessem gerar, segundo ele, ""grave insegurança jurídica"". “Essa prerrogativa, indubitavelmente, constitui uma exceção ao princípio republicano, razão por que deve ser interpretada restritivamente”, escreveu o ministro.  Na segunda-feira (7), com base no entendimento do Supremo sobre restrição do foro, o ministro do Superior Tribunal de Justiça (STJ) Luís Felipe Salomão enviou para a primeira instância uma investigação sobre o governador da Paraíba, Ricardo Coutinho.  Apesar de a decisão do STF não falar sobre governadores, Salomão entendeu que era o caso de aplicar o novo entendimento, pelo princípio da simetria.  Se a proposta de Toffoli for aprovada, será definido que a restrição do foro será aplicada a demais autoridades além de deputados federais e senadores, independentemente da interpretação de ministros e juízes de outros tribunais.  Outro ponto da proposta de Toffoli é manter o foro privilegiado somente para as autoridades que foram contempladas com esse direito na Constituição Federal. O ministro propôs eliminar garantias de foro privilegiado criadas por constituições estaduais.  Segundo cálculos do Senado citados por Toffoli, a restrição em nível federal atingiria 38 mil autoridades. Em nível estadual e municipal, segundo o ministro, há cerca de 16 mil autoridades com foro.  Dependendo do cargo, essas autoridades respondem a tribunais diferentes. Governadores, por exemplo, só são julgados no Superior Tribunal de Justiça (STJ). Prefeitos, por sua vez, começam a ser processados num Tribunal de Justiça estadual, de segunda instância.  A proposta de Toffoli não restringe o foro privilegiado do presidente da República, que obedece a uma regra diferente das demais autoridades.  Pela Constituição Federal, qualquer denúncia contra o chefe do Executivo federal só pode prosseguir se for admitida por dois terços da Câmara dos Deputados.  Se a acusação for de crime de responsabilidade, que pode levar a um impeachment, o julgamento cabe ao Senado. Se for crime comum, o processo tramita no próprio STF.  Atos anteriores ao mandato e não ligados às funções de presidente não podem levar a um processo enquanto durar o mandato. ",politica,,,,,,
2018-05-09,https://web.archive.org/web/20180509175455/https://g1.globo.com/politica/noticia/camara-deve-instalar-nesta-quarta-feira-comissao-que-discutira-pec-do-foro.ghtml,https://g1.globo.com/politica/noticia/camara-deve-instalar-nesta-quarta-feira-comissao-que-discutira-pec-do-foro.ghtml,Câmara deve instalar nesta quarta-feira comissão que discutirá PEC do foro," A Câmara dos Deputados deve instalar nesta quarta-feira (9) a comissão especial que discutirá a proposta de emenda à Constituição (PEC) que restringe o foro privilegiado (entenda todos os detalhes da PEC mais abaixo).  O foro por prerrogativa de função, conhecido como foro privilegiado, é o direito que o presidente da República, ministros, deputados, senadores e governadores – entre outras autoridades – têm de ser julgados nas instâncias superiores, como o Supremo Tribunal Federal (STF) e o Superior Tribunal de Justiça (STJ).  A instalação da comissão foi determinada pelo presidente da Câmara, Rodrigo Maia (DEM-RJ), na última quinta (3), mesmo dia em que o STF limitou o foro privilegiado de deputados e senadores a casos cometidos durante o exercício do mandato e em função da atividade parlamentar.  Para integrantes da comissão ouvidos pelo G1, mesmo com a decisão do STF, caberá ao Congresso Nacional criar a legislação específica, a fim de não deixar ""lacunas"" acerca do benefício.  A proposta em discussão já foi aprovada pelo Senado, em maio do ano passado, e pela Comissão de Constituição e Justiça (CCJ) da Câmara, em novembro. O texto prevê:  Levantamento do Núcleo de Estudos e Pesquisas da Consultoria do Senado Federal indica que, atualmente, 54,9 mil autoridades têm direito ao foro privilegiado no Brasil.  Somente por determinação da Constituição Federal, são mais de 38 mil autoridades com direito ao foro. São integrantes dos poderes Executivo, Legislativo, Judiciário e do Ministério Público, além de comandantes das Forças Armadas.  Há, ainda, mais de 16 mil autoridades, nas esferas federal, estadual e municipal que têm direito ao foro em outros tribunais superiores por determinação das constituições estaduais.  Nesses casos, têm direito ao benefício: vices-governadores, secretários estaduais, vereadores, procuradores estaduais e defensores públicos.  A comissão especial será instalada quatro meses após a criação.  Um dos principais motivos para a demora foi a lentidão dos partidos em indicar os membros. Uma semana antes da decisão do STF, somente 16 nomes tinham sido indicados para a comissão, por exemplo.  Segundo o site da Câmara, nesta segunda-feira (7), havia 27 deputados para os 35 nomes titulares que vão compor a comissão.  Ainda caberá a Rodrigo Maia indicar o presidente da Comissão, que deverá nomear o relator do processo.  Apesar da demora da instalação da Comissão, integrantes dizem que o tema precisa ser legislado com urgência pelo Congresso.  ""A discussão do Supremo é uma discussão que o judiciário faz, de interpretação da lei. Você não pode criar uma lei no Judiciário, você tem que ter amparo e uma lei específica, até para dar amparo às essas medidas que o Supremo vem tomando"", apontou Ricardo Tripoli (PSDB-SP).  Também integrante da comissão, o deputado Carlos Zarattini (PT-SP) avalia que a decisão do STF causará ""confusão"" nos juízes.  ""Esse assunto tem que ser muito melhor tratado do que foi no STF. Todos os juristas dizem que a resolução deles vai causar muito mais confusão, porque fica a critério de cada juiz se a acusação de algum ato criminoso diz respeito ou não a um ato criminoso. Nós vamos ter que tratar melhor essa questão e especificar melhor as situações em que cabe o foro especial e as que não cabem"", declarou.  O relator do texto na CCJ, o deputado Efraim Filho (DEM-PB) diz acreditar que, apesar da decisão da Suprema Corte, a proposta do Congresso não sofrerá muitas alterações.  Concluída a análise pela comissão, a PEC será encaminhada para votação no plenário da Câmara.  Mas, com a intervenção na segurança do Rio de Janeiro, as PECs até poderão tramitar nas comissões, mas não serão votadas pelo plenário.  Isso porque, de acordo com a Constituição, é proibido promover qualquer mudança no texto constitucional enquanto vigorar a intervenção. ",politica,,,,,,
2018-05-10,https://web.archive.org/web/20180510024837/https://g1.globo.com/politica/noticia/tcu-vai-investigar-garantia-dada-as-exportacoes-para-venezuela-e-mocambique.ghtml,https://g1.globo.com/politica/noticia/tcu-vai-investigar-garantia-dada-as-exportacoes-para-venezuela-e-mocambique.ghtml,TCU vai investigar garantia dada às exportações para Venezuela e Moçambique," O Tribunal de Contas da União (TCU) vai investigar a operação pela qual o governo deu garantias a exportações de empresas brasileiras para Venezuela e Moçambique cujo pagamento não foi honrado pelos dois países.  O tribunal quer saber se a operação cumpriu todas as etapas exigidas para a liberação do seguro.  Como Venezuela e Moçambique não pagaram os financiamentos, o Brasil terá que pagar R$ 1,16 bilhão ao o Credit Suisse e ao Banco Nacional de Desenvolvimento Econômico e Social (BNDES), que financiaram as exportações.  No último dia 2, o Congresso aprovou a liberação do dinheiro com essa finalidade (veja no vídeo abaixo).  O Brasil foi obrigado a cobrir o calote de Venezuela e Moçambique porque é uma espécie de fiador das operações de exportação para os dois países. Por meio do Fundo de Garantia à Exportação (FGE), o governo dá garantias às operações, que pagam, por exemplo, por obras de infraestrutura feitas por construtoras brasileiras em outros países.  Essas garantias asseguram que as empresas nacionais receberão pelos serviços e produtos vendidos no exterior mesmo em caso de calote do comprador. Uma auditoria do tribunal encontrou indícios de irregularidade na classificação de risco de alguns países, o que impactou diretamente no valor que eles precisam pagar para ter o seguro (leia mais abaixo).  A garantia é dada dentro do Convênio de Pagamentos e Créditos Recíprocos (CCR) da Associação Latino-americana de Integração (Aladi). Os bancos centrais dos signatários oferecem a garantia de que empresas exportadoras vão receber o pagamento por vendas feitas entre os países. O objetivo do convênio é incentivar o comércio.  A área técnica do TCU destacou que não existe irregularidade no fato de o governo dar garantia a essas operações, mas é preciso verificar se todos os procedimentos foram cumpridos.  A auditoria do TCU apontou indícios de irregularidade na classificação de risco de alguns países nos últimos anos. Essa classificação de risco impacta diretamente no valor do prêmio que esses países precisam pagar para ter o seguro pelo FGE (quanto menor o risco, menor o prêmio que ele precisa pagar) e também no limite de crédito que eles podem receber.  Segundo o TCU, uma resolução da Camex de 2003 estabeleceu uma exceção para precificação do prêmio do Seguro de Crédito à Exportação quando os pagamentos relativos aos financiamentos fossem realizados pelo Convênio de Créditos Recíprocos da Associação Latino-Americana de Integração, formada por Argentina, Bolívia, Brasil, Chile, Colômbia, Equador, México, Paraguai, Peru, Uruguai e Venezuela.  Com essa resolução, esses países teriam sua classificação pré-estabelecida em 1, que é o menor risco, independentemente da sua real situação.  ""A estimativa elaborada pela equipe de auditoria para 30 operações celebradas com países do CCR, concretizadas ou finalizadas, aponta para uma redução significativa na arrecadação em prêmios de SCE, da ordem de R$ 735,72 milhões (redução de R$ 834,82 milhões para R$ 99,1 milhões), em relação aos valores que teriam sido pagos se observada a classificação original"", apontou o acórdão do TCU.  Para a área técnica do TCU, não houve fundamento para a redução do risco e essa mudança decorreu de uma ""decisão de Estado"".  A equipe de auditoria identificou que, a partir de 2010, o BNDES teve prejuízo em quatro operações de crédito à exportação, ou seja, os juros cobrados pelo BNDES não eram suficientes para pagar pelo custo de captação dos recursos.  ""O que se depreende é que ao se praticar uma remuneração básica abaixo de um patamar considerado minimamente necessário para cobrir os custos de captação do BNDES está-se adotando tratamento diferenciado e desarrazoado, em prejuízo da rentabilidade do Banco"", pontou a área técnica do TCU.  Uma auditoria do TCU julgada nesta quarta-feira (9) analisou a concessão do Seguro de Crédito à Exportação (SCE) e de equalização da taxa de juros em 140 operações de financiamento de exportações de serviços de engenharia feito pelo BNDES.  Entre os problemas encontrados pela auditoria e que serão investigados em processos separados está a reclassificação do risco de países. Segundo a auditoria do TCU, nos últimos anos o governo fez reanálises de classificação de risco e limite de garantia para determinados países que não foram adequadamente fundamentadas. ",politica,,,,,,
2018-05-10,https://web.archive.org/web/20180510024837/https://g1.globo.com/politica/noticia/camara-aprova-texto-base-de-projeto-que-altera-regras-do-cadastro-positivo.ghtml,https://g1.globo.com/politica/noticia/camara-aprova-texto-base-de-projeto-que-altera-regras-do-cadastro-positivo.ghtml,Câmara aprova texto-base de projeto que altera regras do cadastro positivo," A Câmara dos Deputados aprovou nesta quarta-feira (9), por 273 votos a 150, o texto-base do projeto que muda as regras para a inclusão de consumidores no cadastro positivo.  Para concluir a análise do projeto, os deputados ainda precisam votar os destaques (propostas que podem alterar o texto original). Essa etapa ficou para a próxima semana. Como foi modificado pelos deputados, depois da votação dos destaques o texto será encaminhado de volta para o Senado, que já havia aprovado a proposta.  A proposta aprovada pelos deputados estende ao cadastro positivo a mesma regra que hoje vale para o negativo: as instituições financeiras podem incluir informações no sistema sem autorização específica dos clientes.  O cadastro positivo existe desde 2011 e é um banco de dados que classifica consumidores com uma espécie de ""selo de bom pagador"".  Entenda abaixo os principais pontos do projeto:  O projeto estava desde março pronto para votação no plenário da Câmara, mas não avançava por falta de consenso entre os deputados.  Para garantir os votos necessários à aprovação do projeto, o relator, deputado Walter Ihoshi (PSD-SP) fez algumas alterações, entre as quais:  Durante a sessão, deputados favoráveis à proposta alegaram que o cadastro positivo deverá facilitar a abertura de empréstimos e a redução de juros.  ""O Brasil está fazendo um debate nesse momento importante para que possamos nos colocar em taxas de juros civilizadas. Nós queremos garantir mais um instrumento que vai reduzir os juros astronômicos, para garantir que o cidadão brasileiro possa ter acesso a um crédito mais barato"", afirmou, por exemplo, Betinho Gomes (PSDB-PE).  Os parlamentares contrários ao projeto, por outro lado, alegaram que a nova lei vai violar a privacidade dos consumidores e beneficiar banqueiros.  ""Isso aqui é inadmissível. Hoje, temos 5 milhões de pessoas no cadastro positivo, eles querem ter 100 milhões através da violação do sigilo bancário, das informações da conta de luz. Isso só interessa aos banqueiros. Eles querem violar o consumidor, inclusive humilhar quem é mau pagador"", afirmou o líder do PSOL, Ivan Valente (RJ).  Em entrevista no Palácio do Planalto, na noite desta quarta, o ministro Carlos Marun (Secretaria de Governo) comemorou a aprovação do texto-base.  Para o ministro, que responde pela articulação política do Planalto governo, foi mais ""uma vitória"" da parceria entre governo e Legislativo.  Segundo Marun, o projeto ""facilita o ambiente de negócios"" e auxilia na queda de taxas de juros para consumidores que estejam no cadastro positivo. Questionado sobre a votação dos destaques na próxima semana, que pode alterar o projeto, Marun afirmou que o governo não ""acredita em mudanças radicais"" no texto.  “Não acreditamos em mudança radical, estamos confiantes de que se houver alguma mudança, não vai conseguir fugir do espírito do projeto, que facilita os negócios e garante que aqueles que não desejarem constar em qualquer tipo de cadastro, mesmo que esse cadastro seja positivo, tenha o direito de expressar essa vontade"", declarou. ",politica,,,,,,
2018-05-10,https://web.archive.org/web/20180510024837/https://g1.globo.com/politica/noticia/apos-argentina-pedir-ajuda-ao-fmi-temer-usa-twitter-para-elogiar-mauricio-macri.ghtml,https://g1.globo.com/politica/noticia/apos-argentina-pedir-ajuda-ao-fmi-temer-usa-twitter-para-elogiar-mauricio-macri.ghtml,"Após Argentina pedir ajuda ao FMI, Temer usa Twitter para elogiar Mauricio Macri"," O presidente Michel Temer usou o Twitter nesta quarta-feira (9) para elogiar a política econômica do governo argentino.  A mensagem (veja acima) foi publicada um dia após o presidente Mauricio Macri anunciar que a Argentina pediu ajuda ao Fundo Monetário Internacional (FMI).  ""A política econômica do Presidente @mauriciomacri é uma política de responsabilidade, de reformas para o crescimento sustentado e o desenvolvimento da Argentina. Temos plena confiança nesse caminho"", publicou Temer na rede social.  Segundo Mauricio Macri, o pedido de ajuda ao FMI foi feito para que a Argentina possa lidar com a recente volatilidade do mercado que levou à queda do peso (moeda local) e ao aumento da taxa de juros para 40%.  ""Isso nos permitirá fortalecer nosso programa de crescimento e desenvolvimento, dando-nos maior suporte para enfrentar este novo cenário global e evitar crises como as que tivemos em nossa história"", disse Macri nesta terça.  O governo da Argentina também anunciou que chegou a um acordo com as grandes empresas do setor de energia que operam no país para congelar os preços dos combustíveis por dois meses. A intenção é amenizar as recentes variações do valor do dólar.  Nesta terça, o ministro da Fazenda, Eduardo Guardia, afirmou que não há risco de o Brasil ser contagiado pela crise na Argentina.  ""Não há canal de contágio. Temos uma situação externa extremamente confortável"", disse Guardia.  O ministro apontou que o Brasil tem déficit das contas externas pequeno e financiado por investimentos estrangeiros diretos, além de possuir reservas internacionais ""extremamente elevadas"", de US$ 383 bilhões.  ""Não vejo nenhum impacto. É uma situação completamente diferente"", completou Guardia. ",politica,,,,,,
2018-05-11,https://web.archive.org/web/20180511012818/https://g1.globo.com/politica/noticia/por-unanimidade-segunda-turma-do-stf-rejeita-conceder-liberdade-a-lula.ghtml,https://g1.globo.com/politica/noticia/por-unanimidade-segunda-turma-do-stf-rejeita-conceder-liberdade-a-lula.ghtml,"Por unanimidade, Segunda Turma do STF rejeita conceder liberdade a Lula"," A Segunda Turma do Supremo Tribunal Federal (STF) rejeitou, por unanimidade, conceder liberdade ao ex-presidente Luiz Inácio Lula da Silva, preso desde o mês passado.  O julgamento do pedido de Lula, em plenário virtual, começou no último dia 4, e os ministros da Turma tinham até as 23h59 desta quinta (10) para apresentar os votos.  Votaram contra conceder liberdade a Lula:  Até esta quarta (9), quatro ministros já haviam votado. O último a entregar o voto foi Celso de Mello, concluindo o julgamento.  Lula foi condenado pelo Tribunal Regional Federal da Quarta Região (TRF-4), segunda instância da Justiça responsável pela Lava Jato, a 12 anos e 1 mês de prisão, em regime inicialmente fechado.  A condenação se deu no processo relacionado ao triplex em Guarujá (SP). Lula se diz inocente.  A defesa do ex-presidente recorreu argumentando que a prisão não poderia ter sido decretada pelo juiz Sérgio Moro em 5 de abril uma vez que ainda havia embargos de declaração pendentes de análise no TRF-4. Os recursos só foram julgados em 18 de abril.  Responsável por analisar o pedido da defesa de Lula, Fachin enviou a decisão para o plenário virtual da Segunda Turma.  Geralmente, os processos incluídos nesse plenário são aqueles que demandam menos discussão e costumam seguir o entendimento consolidado do STF.  Pelas regras, Fachin deveria ser o primeiro a inserir o voto no sistema e, a partir daí, os outros ministros da Turma teriam as seguintes opções:  Antes mesmo de enviar o caso para julgamento, Fachin já havia negado o pedido por considerar que a existência de embargos de declaração pendentes não impedia a execução da pena.  No processo, a procuradora-geral da República, Raquel Dodge, também defendeu que recursos apresentados a tribunais superiores não impedem a prisão. ",politica,,,,,,
