data,url_noticia,url_noticia_curto,titulo,conteudo_noticia,assunto,assunto_ex,titulo_ex,subtitulo_ex,local_ex,artigo_ex,n_paragrafos
2020-03-24,https://web.archive.org/web/20200324052304/https://g1.globo.com/economia/noticia/2020/03/23/tenho-que-pagar-mensalidade-quando-posso-pedir-o-dinheiro-de-volta-veja-direitos-dos-consumidores-diante-da-pandemia-do-coronavirus.ghtml,https://g1.globo.com/economia/noticia/2020/03/23/tenho-que-pagar-mensalidade-quando-posso-pedir-o-dinheiro-de-volta-veja-direitos-dos-consumidores-diante-da-pandemia-do-coronavirus.ghtml,Tenho que pagar mensalidade? Quando posso pedir o dinheiro de volta? Veja direitos dos consumidores diante da pandemia do coronavírus," A pandemia do coronavírus tem fechado escolas e academias, interrompido cursos, cancelado eventos e afetado o comércio e serviços em geral. Mas em que circunstâncias o pagamento ou contrato pode ser suspenso ou o consumidor pode pedir reembolso?  Por se tratar de uma situação excepcional, em que todo o país está sendo prejudicado pelas restrições de circulação, o ideal é que se busque sempre um acordo consensual. Mas é importante que o consumidor conheça os seus direitos.  Veja abaixo as orientações de órgãos de defesa do consumidor e de especialistas em direito civil para questões relacionadas a escolas, cursos, academia, eventos, festas, passagens e comércio eletrônico.  As escolas estão discutindo a flexibilização do calendário letivo. A natureza desse serviço permite a reposição de aulas em outros períodos e até mesmo o adiamento ou cancelamento de férias escolares. Por isso, de forma geral, as escolas estão cobrando normalmente as mensalidades, com muitas delas inclusive desenvolvendo atividades de ensino à distância nesse período de isolamento e fechamento dos estabelecimentos de ensino.  O Instituto Brasileiro de Defesa do Consumidor (Idec), explica, porém, que o consumidor pode pedir o cancelamento da matrícula, sem pagamentos de multas, e até reembolso em casos específicos, como cursos de curta duração, que ficarão prejudicados pela suspensão de aulas e com ""impossibilidade de continuação pelo aluno em períodos posteriores"".  Segundo a Proteste (Associação Brasileira de Defesa do Consumidor), o direito de suspender o pagamento também vale para os cursos de idiomas e para contratos que não possam ser mantidos como o inicialmente previsto.  Ainda que as escolas estejam disponibilizando atividades alternativas online para tentar manter o calendário letivo, os órgãos de defesa do consumidor afirmam que o consumidor pode pedir o abatimento do pagamento de atividades extras e serviços adicionais que não estejam sendo usufruídos como refeição e ensino em período integral.  ""Você não é obrigado a pagar por uma coisa não está usufruindo"", explica o diretor-executivo do Procon São Paulo, Fernando Capez. ""Não é justo a escola continuar cobrando a taxa correspondente a refeição servida porque o aluno não vai estar indo lá"".  O Procon-SP recomenda que, para garantir a manutenção de empregos, os consumidores avaliem, sempre que possível, a opção de crédito a ser utilizado no futuro em vez do pedido de reembolso ou suspensão de pagamentos.  Com a suspensão das atividades, as academias têm informado que o período de fechamento será acrescido ao final dos contratos, sem qualquer prejuízo aos clientes.  “Os consumidores podem tentar negociar a suspensão do contrato durante esse período e compensá-lo depois, quando tudo voltar ao normal. Ou seja, se a situação perdurar por um mês e o contrato está previsto para acabar em julho, o consumidor pode pedir para continuar as aulas até agosto. Se a academia se recusar a negociar, o consumidor pode procurar o Procon”, afirma a advogada civil Amanda Saraiva.  O Instituto Brasileiro de Defesa do Consumidor (Idec), lembra, porém, que o consumidor tem o direito de pedir, se assim desejar, o cancelamento do contrato desse tipo de serviço, sem multa, e sugere às academias que suspendam a cobrança de mensalidades pelo período em que estiverem fechadas para evitar ações judiciais e reclamações nos órgãos de defesa do consumidor.  Por conta da pandemia, vários eventos como festas de aniversários, formatura, casamentos foram cancelados. Segundo os órgãos de defesa do consumidor, tanto o consumidor como os fornecedores podem decidir pelo cancelamento.  O consumidor tem o direito de escolher entre: 1) o reagendamento do serviço contratado; 2) a substituição por outro produto ou serviço equivalente; e 3) a utilização de crédito para ser consumido na mesma empresa.  O Procon-SP sugere como opção preferencial dos consumidores a conversão do serviço em crédito para ser usufruído em momento posterior. Já nas situações em que há direito a reembolso, o Procon-SP recomenda que os consumidores aguardem o encerramento do decreto de calamidade pública para exigir o pagamento.  Segundo a advogada Amanda Saraiva, se as partes não chegarem a um acordo, deve-se buscar a Justiça. ""Por ser uma situação excepcional, os dois lados podem alegar que cancelaram o contrato por força maior. Neste caso, a decisão dependerá do entendimento do juiz”, diz.  Mudanças contratuais precisam sempre ser assinadas pelo consumidor e pelo fornecedor. Mas as partes não precisam se encontrar pessoalmente para ajustar os termos do acordo. Até mesmo porque o momento exige afastamento social.  “Após a empresa e o consumidor chegarem em uma decisão, é preciso formalizar o que ficou acordado para não haver cobranças indevidas. Essa formalização pode ser feita por troca de mensagens por aplicativo de celular, emails, ou qualquer forma de comunicação virtual. Não é preciso que seja pessoalmente. As relações negociais devem ser adaptar a esta nova realidade”, afirma Saraiva.  O preço de produtos como álcool gel e máscaras dispararam no país. Mas a partir de que ponto o valor cobrado pode ser considerado um aumento abusivo?  O Procon São Paulo explica que, de acordo com o Código de Defesa do Consumidor, é caracterizado como prática abusiva elevar sem justa causa o preço de produtos ou serviços a fim de obter vantagem desproporcional. Ou seja, uma margem de lucro excessiva.  Em caso de suspeita ou dúvida sobre o abuso nos preços praticados, o consumidor deve acionar os Procons ou órgãos oficiais de Proteção e Defesa do Consumidor. Constatada a infração, o estabelecimento está sujeito a penalidades que vão desde a aplicação de multa até cassação de licença do estabelecimento ou de atividade.  O governo anunciou um conjunto de medidas para socorrer as empresas aéreas nesse período. Uma medida provisória publicada na quinta-feira (19) permite que as companhias reembolsem as passagens aéreas canceladas em até 12 meses. Até então, o prazo para reembolso de passagem aérea era de 7 dias.  Segundo a Agência Nacional de Aviação Civil (Anac), ainda que a passagem seja do tipo não reembolsável, o valor da tarifa de embarque deve ser reembolsado integralmente no prazo de 12 meses.  A contagem será válida a partir da data de solicitação e o ressarcimento é feito conforme o modo de pagamento usado pela pessoa.  A medida prevê ainda que os consumidores que aceitarem o valor da devolução em forma de crédito ficarão isentos das penalidades contratuais previstas no momento da compra.  Medida provisória publicada pelo governo também dispensou empresas de turismo e cultura de fazer o reembolso imediato de serviços cancelados por causa da pandemia. A prestação do serviço poderá ser remarcada em até um ano após o fim da situação de calamidade pública.  A medida vale para pacotes, hotéis, cinemas, teatros e sites de ingressos, entre outras. Segundo a MP, em vez de devolver o dinheiro, a empresa poderá optar por:  Com o fechamento do comércio em várias regiões do país e recomendação das autoridades para que a população não saia de casa, o entendimento dos órgãos de defesa é que as varejistas não podem exigir que o consumidor compareça ao ponto de venda para exercer o direito de troca de produtos com defeito ou em desacordo com a compra.  ""Nesse caso, recomenda-se que o consumidor encaminhe comunicação por escrito (e-mail com confirmação) apontando o interesse em trocar o produto e questionando os procedimentos e novos prazos da empresa para fazer a troca"", orienta o advogado do Idec Igor Marchetti.  O Código de Defesa do Consumidor assegura que todas as compras realizadas fora do estabelecimento comercial, ou seja, feitas pela internet, catálogos, telefone ou em domicílio, podem ser canceladas no prazo de 7 dias corridos, a partir da data da entrega.  Diante da quarentena, o entendimento é que as empresas serão mais flexíveis quanto ao prazo, mas como não há garantia de prorrogação, a recomendação é que o consumidor procure a central de atendimento e questione as alternativas oferecidas.  ""Não podem ser exigidas medidas impossíveis ou que vão contra a saúde e segurança do consumidor. Isso seria totalmente desproporcional e feriria a boa fé que deve permear as relações de consumo"", afirma Marchetti.  O Idec recomenda, porém, que em caso de necessidade de troca o consumidor manifeste esse interesse dentro do prazo de 7 dias, por e-mail, por exemplo, para que seja garantido o direito.  O Segundo o Procon-SP, alguns prazos ficam devem ficar suspensos em função da crise. O consumidor não deve se deslocar para levar um carro para a revisão prevista na garantia, por exemplo. O serviço deve ser realizado assim que a situação for normalizada, sem que o consumidor tenha prejuízo.  O órgão recomenda, no entanto, fazer o contato por escrito com o fornecedor deixando registrado o motivo pelo não comparecimento.  Em caso de falha na prestação do serviço, o consumidor não pode ser cobrado de nenhum valor para a realização de uma visita de um técnico, ainda que seja culpa exclusiva do consumidor ou de terceiro.  O Idec lembra que resolução da Anatel determina que a prestadora deve garantir a disponibilidade mensal do serviço de 99%, e no mínimo 95%, com velocidade média de 80% do contratado e mínima de 40%.  Em caso de descumprimento de oferta, o consumidor deve primeiro contatar operadora, fazer a reclamação, anotar o número de protocolo, e aguardar a resolução do problema. Se o problema não for resolvido, a reclamação pode ser feita na Anatel (1331) ou no site da plataforma consumidor.gov.  A revisão de contratos de aluguel depende exclusivamente de negociação entre as partes. Mas em tempos de crise, o inquilino que é um bom pagador deve exercer o seu poder de barganha.  Segundo o advogado Mário Inácio Ferreira Filho, da IF Assessoria Empresarial, tem sido cada vez maior os pedidos de descontos ou condições especiais de pagamento, principalmente entre micro e pequenas empresas. ""Este pagamento integral é injusto para a pequena empresa, já que o imóvel ficará fechado neste período. Isto vale para aluguéis em prédios, lojas e shoppings"", afirma.  O consultor e educador financeiro, Uesley Lima, diz que é importante abrir um canal de negociação com o proprietário ou imobiliária antes de qualquer atraso no pagamento.  ""É importante ligar para todos os credores, falar de forma honesta, contar o que está acontecendo e prever a possibilidade de pagamento no futuro. Perguntar se existe a possibilidade de pagar depois e dos juros a serem cobrados serem menores"", orienta. ",economia,,,,,,
2020-03-24,https://web.archive.org/web/20200324052304/https://g1.globo.com/economia/noticia/2020/03/23/cvc-reduzira-jornada-de-funcionarios-em-50-a-partir-de-abril.ghtml,https://g1.globo.com/economia/noticia/2020/03/23/cvc-reduzira-jornada-de-funcionarios-em-50-a-partir-de-abril.ghtml,CVC reduzirá jornada de funcionários em 50% a partir de abril," O maior grupo de turismo do país, CVC, anunciou nesta segunda-feira (23) que vai reduzir a jornada de trabalho de seus funcionários pela metade a partir do início de abril, como parte de plano para garantir sua ""saúde financeira"" em meio à forte queda na demanda por viagens gerada pela pandemia de Covid-19.  A companhia não informou em fato relevante divulgado ao mercado como se dará a remuneração dos funcionários em jornada reduzida.  Além do corte na jornada, a empresa afirmou que as medidas incluem a suspensão de todos os investimentos em marketing previstos para o ano e que está renegociando ""termos e prazos de pagamento"" junto a fornecedores.  As ações da CVC encerraram nesta segunda-feira em queda de 7,3%. Até semana passada, os papéis da empresa acumulavam queda de cerca de 80% neste ano, em meio ao cancelamento de voos e fechamento de fronteiras, além da disparada recente do dólar.  A empresa afirmou que com as medidas anunciadas nesta segunda-feira espera que os gastos recorrentes sejam de cerca de 50 milhões de reais por mês.  A companhia citou que possui ""um balanço sólido"" e que seu caixa no final do ano passado era de 365,4 milhões de reais e que do endividamento total de 1,8 bilhão de reais, 613 milhões vencem em novembro deste ano. ",economia,,,,,,
2020-03-24,https://web.archive.org/web/20200324052304/https://g1.globo.com/economia/noticia/2020/03/23/cosan-afirma-que-nao-fara-nenhuma-demissao-no-grupo.ghtml,https://g1.globo.com/economia/noticia/2020/03/23/cosan-afirma-que-nao-fara-nenhuma-demissao-no-grupo.ghtml,Cosan afirma que não vai reduzir quadro de funcionários," A Cosan informou nesta segunda-feira (23), por meio de nota, que não irá reduzir o quadro de funcionários da companhia e nem de suas empresas controladas (Rumo, Raízen, Comgás e Moove). O grupo emprega cerca de 40 mil pessoas.  Por conta da crise do coronavírus, muitas empresas já começaram a demitir funcionários.  ""Estamos focados em tomar as medidas necessárias para a continuidade das atividades de forma remota e presencial, garantindo as ações pertinentes nas áreas de segurança física, de higiene e suporte psicológico"", afirmou o presidente do grupo, Marcos Lutz, em comunicado interno.  ""Os nossos times que precisam estar fora de casa para que todo o resto da população esteja em quarentena estão recebendo todas as orientações e suporte necessários para que estejam seguros e com as condições de trabalho e saúde adequadas"", acrescentou.  Na nota à imprensa, a companhia reforçou que a manutenção dos empregos tem o objetivo de manter os sistemas logísticos e de energia em funcionamento no país em meio à crise do coronavírus. ",economia,,,,,,
2020-03-24,https://web.archive.org/web/20200324052304/https://g1.globo.com/economia/noticia/2020/03/23/ajuda-aos-estados-representante-dos-secretarios-de-fazenda-aprova-pacote-mas-pede-novas-medidas.ghtml,https://g1.globo.com/economia/noticia/2020/03/23/ajuda-aos-estados-representante-dos-secretarios-de-fazenda-aprova-pacote-mas-pede-novas-medidas.ghtml,"Ajuda aos estados: representante dos secretários de Fazenda aprova pacote, mas pede novas medidas"," O presidente do Comitê Nacional de Secretários de Fazenda (Comsefaz), Rafael Fonteles, afirmou nesta segunda-feira (23) que o pacote anunciado pelo governo de auxílio aos estados, relacionado à pandemia do coronavírus, contém medidas positivas, mas nem todos os pleitos dos governos estaduais foram atendidos.  Após reunião com governadores, o presidente Jair Bolsonaro anunciou um plano de R$ 85,8 bilhões – mais tarde, o secretário especial de Fazenda do Ministério da Economia, Waldery Rodrigues, informou que o montante chega a R$ 88,2 bilhões – para fortalecer estados e os municípios no enfrentamento da crise gerada pela pandemia do novo coronavírus.  ""Atende alguns itens [solicitados pelos estados] integralmente, mas outros ficaram de fora"", declarou ao G1.  Segundo Fonteles, que é secretário da Fazenda do Piauí, o governo atendeu o pedido dos estados de destinar mais recursos para ações em saúde. Foram solicitados R$ 5 bilhões pelos próximos três meses. O governo federal se comprometeu a enviar R$ 8 bilhões para a área de saúde.  Fonteles disse que também foi atendido o pedido de suspensão no pagamento das dívidas estaduais com a União e bancos federais, em valores de R$ 10 bilhões e de R$ 12 bilhões, respectivamente, pelos próximos seis meses.  Entretanto, disse que o pedido de suspensão da dívida com instituições de crédito internacionais, como o Banco Mundial e o Banco Interamericano de Desenvolvimento (BID) ainda não foi atendido.  ""Eles ficaram de analisar a possibilidade com as instituições"", declarou. O valor seria superior a R$ 10 bilhões também em seis meses, estimou.  O presidente do Comsefaz também se mostrou satisfeito com a recomposição de recursos do Fundo de Participação dos Municípios (FPM) e do Fundo de Participação dos Estados (FPE) no valor de R$ 16 bilhões, anunciado pela área econômica para os próximos meses.  Mas, segundo ele, esse valor não é suficiente para fazer frente à perda de arrecadação do estados.  Para Rafael Fonteles, esse valor atende ""parcialmente"" ao pleito dos estados de R$ 14 bilhões por mês buscado pelos estados.  Para o presidente do Comsefaz, o principal pedido que ficou de fora é a possibilidade de ""secutirização"" das dívidas bancárias dos estados – a conversão de empréstimo e outros ativos em títulos, a serem vendidos a investidores.  Esse tipo de operação, segundo ele, aumentaria as ""possibilidades de captação [de recursos] porque os estados poderão vender as dívidas. Pode gerar novas operações que vão reforçar os investimentos. É um dos pleitos"", declarou.  Ele também explicou que, dos R$ 40 bilhões em crédito aos estados, anunciados pela área econômica, R$ 10 bilhões irão para os estados do regime de recuperação fiscal – atualmente só o Rio de Janeiro está no programa, mas Minas Gerais e Rio Grande do Sul estão em negociação –, R$ 10 bilhões para os estados que seriam beneficiados com o Plano Mansueto e outros R$ 20 bilhões para renegociação e reestruturação de dívidas estaduais. ",economia,,,,,,
2020-03-27,https://web.archive.org/web/20200327020513/https://g1.globo.com/economia/noticia/2020/03/26/presidente-da-caixa-economica-federal-anuncia-novas-reducoes-nas-taxas-de-juros.ghtml,https://g1.globo.com/economia/noticia/2020/03/26/presidente-da-caixa-economica-federal-anuncia-novas-reducoes-nas-taxas-de-juros.ghtml,Coronavírus: presidente da Caixa Econômica Federal anuncia novas reduções nas taxas de juros," O presidente da Caixa Econômica Federal, Pedro Guimarães, anunciou nesta quinta-feira (26) uma nova redução na taxa de juros do cheque especial e do parcelamento do cartão de crédito.  É o segundo anúncio de redução de taxas em sete dias, motivado pela crise provocada pela pandemia de coronavírus. O anterior foi no último dia 19.  A taxa do cheque especial do banco passará de 4,9% para 2,9% ao mês.  “Uma taxa recorde em termos de ser menor – 41% de redução em relação à taxa que já era a menor do mercado”, afirmou ao lado do presidente Jair Bolsonaro durante transmissão ao vivo em uma rede social.  Guimarães também anunciou a redução para 2,9% da taxa de juros cobrada no parcelamento do cartão de crédito.  “Este parcelado é aquele que você entra em 36 meses. Ainda estava alta, em 7,7% ao mês. E nós reduzimos mais de 60%. Também foi para 2,9%”, disse.  O presidente da Caixa anunciou ainda o aumento de 60 para 90 dias do prazo da pausa para contratos de empréstimos de pessoas físicas e empresas, incluindo contratos habitacionais.  Segundo Guimarães, até hoje 750 mil clientes já pediram a postergação do pagamento das parcelas da casa própria. Ele afirmou que esse prazo pode aumentar novamente, se necessário.  “Já conversei com o Paulo Guedes [ministro da Economia]. Se necessário, ampliaremos para 120 dias, 150 dias”, afirmou.  Segundo a Caixa, o banco vai reforçar com R$ 33 bilhões o combate aos efeitos da pandemia.  “Os novos recursos serão disponibilizados para capital de giro, compra de carteiras, crédito para santas casas, além do crédito agrícola”, afirmou o banco em nota divulgada à imprensa. ",economia,,,,,,
2020-03-27,https://web.archive.org/web/20200327020513/https://g1.globo.com/economia/noticia/2020/03/26/com-coronavirus-banco-central-passa-a-prever-pib-zero-em-2020.ghtml,https://g1.globo.com/economia/noticia/2020/03/26/com-coronavirus-banco-central-passa-a-prever-pib-zero-em-2020.ghtml,Banco Central passa a prever PIB estável em 2020 em meio à pandemia de coronavírus ," O Banco Central (BC) revisou sua projeção para a economia brasileira em 2020 e passou a projetar estabilidade para o nível de atividade, ou seja, sem alta nem queda do Produto Interno Bruto (PIB). A previsão anterior, divulgada em dezembro, era de expansão de 2,2%.  A nova estimativa consta do relatório trimestral de inflação e foi divulgada nesta quinta-feira (26).  O PIB é a soma de todos os bens e serviços feitos no país, independentemente da nacionalidade de quem os produz, e serve para medir o comportamento da economia brasileira.  A mudança na projeção decorre dos impactos da pandemia do coronavírus, que têm interrompido a atividade econômica ao redor do mundo e aumentado o desemprego.  ""A economia mundial, incluindo a brasileira, passa por momento de elevado grau de incerteza em decorrência da pandemia de coronavírus, que está provocando desaceleração significativa da atividade econômica, queda nos preços das 'commodities' [produtos básicos com cotação internacional, como petróleo e minério de ferros] e aumento da volatilidade nos preços de ativos financeiros"", informou o BC no relatório de inflação.  O Banco Central também reafirmou, no documento, que ""continuará fazendo uso de todo o seu arsenal de medidas de políticas monetária [relativas à taxa básica de juros e injeção e liquidez nos mercados], cambial [evitar distorções no mercado de câmbio] e de estabilidade financeira [acompanhamento da situação das instituições financeiras] no enfrentamento da crise atual"".  A nova previsão do BC ainda é mais otimista do que algumas instituições financeiras que já esperam retração econômica neste ano.  Na semana passada, o Ministério da Economia estimou uma expansão de apenas 0,02% do PIB em 2020, ou seja, um cenário ainda de estabilidade. Porém, a pasta também informou que está sendo previso cenário de recessão técnica em 2020, quando há queda do PIB por dois trimestres seguidos.  O Banco Central avaliou que ""perseverar no processo de reformas e ajustes necessários na economia brasileira é essencial para permitir a recuperação sustentável da economia"".  Em 2019, segundo dados do Instituto Brasileiro de Geografia e Estatística (IBGE), o PIB cresceu 1,1%. Foi o desempenho mais fraco em três anos, com o resultado afetado principalmente pela perda de ritmo do consumo das famílias e dos investimentos privados. Em 2017 e 2018 o crescimento foi de 1,3% em ambos os anos.  O BC também informou que a sua estimativa de inflação para 2020, medida pelo Índice Nacional de Preços ao Consumidor Amplo (IPCA), recuou de 3,5% (em dezembro do ano passado) para 2,6%.  Essa previsão considera a trajetória estimada pelo mercado financeiro para a taxa de juros e de câmbio neste ano e no próximo.  Em outro cenário, que considera taxa de juros (Selic) e câmbio estáveis, por sua vez, a previsão do Banco Central para a inflação oficial deste ano recuou de 3,6% para 3%.  As previsões estão em linha com as metas de inflação. Neste ano, a meta central de inflação é de 4% e terá sido oficialmente cumprida se o IPCA oscilar de 2,5% a 5,5%.  Quando as estimativas para a inflação estão em linha com as metas, o BC pode reduzir os juros. Quando estão acima da trajetória esperada, a taxa Selic é elevada.  O mercado prevê que a inflação oficial fique em 3,10% este ano e em 3,65% para 2021 – projeções em linha com as metas.  Para 2021 e 2022, no cenário de mercado (Selic e câmbio projetados pelos bancos), o Banco Central projetou uma inflação de 3,2% e 3,3%, respectivamente. Em dezembro do ano passado, no relatório de inflação anterior, ambas ass projeções estavam em 3,4%.  Sobre a taxa básica de juros, que está na mínima histórica de 3,75% ao ano, o BC informou que vê como ""adequada"" a manutenção da taxa Selic em seu atual patamar.  ""No entanto, o Comitê [de Política Monetária do BC, que define a taxa Selic] reconhece que se elevou a variância do seu balanço de riscos e novas informações sobre a conjuntura econômica serão essenciais para definir seus próximos passos"", acrescentou a instituição.  Nos últimos dias, a área econômica do governo tem anunciado uma série de medidas para garantir a prestação de serviços de saúde em meio à pandemia e para tentar frear os efeito da crise na economia e no nível de emprego: ",economia,,,,,,
