data,url_noticia,url_noticia_curto,titulo,conteudo_noticia,assunto,assunto_ex,titulo_ex,subtitulo_ex,local_ex,artigo_ex,n_paragrafos
2019-12-30,https://web.archive.org/web/20191230205814/https://g1.globo.com/politica/noticia/2019/12/30/datafolha-aponta-que-57percent-preferem-investimento-na-area-social-para-reduzir-a-violencia-e-41percent-reforco-policial.ghtml,https://g1.globo.com/politica/noticia/2019/12/30/datafolha-aponta-que-57percent-preferem-investimento-na-area-social-para-reduzir-a-violencia-e-41percent-reforco-policial.ghtml,"Datafolha aponta que 57% preferem investimento na área social para reduzir a violência e 41%, reforço policial"," Pesquisa Datafolha divulgada nesta segunda-feira (30) pelo jornal ""Folha de S.Paulo"" mostra que 57% dos brasileiros preferem que o governo invista na área social para reduzir a violência. Para 41%, o governo deve priorizar a segurança, e 2% não souberam responder.  O instituto perguntou ao entrevistado: na sua opinião, para combater a violência o governo deveria priorizar investimentos no social como por exemplo ações de combate ao desemprego e melhorias na educação, ou os investimentos deveriam ser voltados principalmente para segurança como por exemplo aumentar o número de policiais treinados e equipados nas ruas?  A pesquisa ouviu 2.948 pessoas nos dias 5 e 6 de dezembro em 176 municípios de todas as regiões do país.  O índice é mais alto inclusive entre os apoiadores do presidente Jair Bolsonaro: 51% responderam que o o governo deveria investir nas áreas sociais; 47% em segurança. 2% não souberam responder.  A pesquisa mostra ainda que 72% dizem ter medo de sair às ruas à noite e 28% disseram que não têm receio.  Entre as mulheres, o receio é maior: 79% responderam que têm meio. Outros grupos demográficos onde há mais receio são os mais velhos (acima de 60 anos) e os mais pobres.  Veja, abaixo, recortes da pesquisa:  Entre os que avaliam o governo do presidente Bolsonaro como bom ou ótimo:   Entre os que avaliam o governo do presidente Bolsonaro como regular:   Entre os que avaliam o governo ruim/péssimo:  Por gênero  Nas cidades ",politica,,,,,,
2019-01-03,https://web.archive.org/web/20190103202035/https://g1.globo.com/economia/tecnologia/noticia/2019/01/03/acoes-da-apple-despencam-apos-anuncio-de-menor-faturamento.ghtml,https://g1.globo.com/economia/tecnologia/noticia/2019/01/03/acoes-da-apple-despencam-apos-anuncio-de-menor-faturamento.ghtml,Ações da Apple despencam após anúncio de menor faturamento," A Apple atordoou investidores com um anúncio de que não conseguiria atingir a meta de vendas para o último trimestre de 2018. Pela manhã, as ações da empresa caíam 9,1%, uma perda de mais de US$ 65 bilhões em valor de mercado.  A empresa reduziu em US$ 7 bilhões a estimativa de faturamento para o último trimestre do ano passado. O presidente da Apple, Tim Cook, também fez comentários sobre o impacto negativo da guerra comercial entre Estados Unidos e China.  “As tensões comerciais entre Estados Unidos e China colocam pressão adicional na economia desses países”, disse Cook em uma entrevista à rede de TV CNBC na quarta-feira (2).  A Apple afirmou após o fechamento dos mercados na quarta-feira que ""não preveu a magnitude da desaceleração da economia, em especial na Grande China"".  Essa combinação preocupou investidores e derrubou os mercados no exterior. O índice S&P500, um dos principais do mercado americano, caía 0,97% às 13h; os índices Dow Jones e Nasdaq, que são fortemente focados em empresas de tecnologia caíam, respectivamente, 1,43% e 1,8%, no mesmo horário. ",tecnologia,,,,,,
2019-01-03,https://web.archive.org/web/20190103202035/https://g1.globo.com/economia/tecnologia/blog/ronaldo-prass/post/2018/12/31/blockchain-tecnologia-que-ira-revolucionar-a-integracao-de-dados-distribuidos-globalmente-sera-destaque-em-2019.ghtml,https://g1.globo.com/economia/tecnologia/blog/ronaldo-prass/post/2018/12/31/blockchain-tecnologia-que-ira-revolucionar-a-integracao-de-dados-distribuidos-globalmente-sera-destaque-em-2019.ghtml,Blockchain: tecnologia que irá revolucionar a integração de dados distribuídos globalmente será destaque em 2019," O blockchain ganhou notoriedade devido a popularização do Bitcoin, porém essa tecnologia não serve apenas como o ""livro caixa"" virtual para registrar operações envolvendo criptomoedas. O potencial da tecnologia abrange diversas áreas sem qualquer relação com transações financeiras, e por esse motivo é a minha aposta para 2019. Mas por que o blockchain é tão importante?  É uma tecnologia que é vista por especialistas como sendo uma das mais revolucionárias para resolver problemas computacionais que envolvem um grande volume de dados espalhados pelo mundo.  A indústria é um dos segmentos que mais poderão se beneficiar do blockchain, principalmente em projetos envolvendo a cadeia de distribuição de suprimentos e logística. A saúde, um ramo completamente distante dos meios de pagamentos digitais, é uma área que poderá atingir um avanço expressivo, devido à versatilidade de confiabilidade do blockchain. Através dessa tecnologia, será possível desenvolver sistemas seguros para o gerenciamento de prontuários médicos, compartilhamento de pesquisas e o monitoramento de doenças infecciosas. Já existe um programa que combina o blockchain com inteligência artificial (IA), para coletar dados de nível molecular, e realizar uma análise profunda para auxiliar em descobertas médicas.  O Spotify utiliza o blockchain para simplificar o gerenciamento de licenças de direitos autorais espalhadas globalmente; esse mecanismo favorece diretamente os produtores musicais na monetização das suas músicas.  As instituições financeiras também estão atentas ao potencial do blockchain, e não necessariamente para a criação de mais uma moeda virtual, mas como um aprimoramento a segurança dos sistemas bancários atuais. A utilização do blockchain ainda é pequena, dificilmente será identificada pelos usuários, mas certamente receberá uma atenção especial devido ao seu enorme potencial. ",tecnologia,,,,,,
2019-01-03,https://web.archive.org/web/20190103202035/https://g1.globo.com/economia/tecnologia/noticia/2018/12/30/entenda-o-que-e-tecnologia-quantica-novo-campo-de-batalha-entre-eua-e-china.ghtml,https://g1.globo.com/economia/tecnologia/noticia/2018/12/30/entenda-o-que-e-tecnologia-quantica-novo-campo-de-batalha-entre-eua-e-china.ghtml,"Entenda o que é tecnologia quântica, novo campo de batalha entre EUA e China"," A informação circulou apenas em veículos especializados: o Conselho Nacional de Ciência e Tecnologia dos Estados Unidos publicou, em setembro, sua nova estratégia para o desenvolvimento da Ciência da Informação Quântica (CIC).  O relatório de 15 páginas recomenda objetivos que o governo de Donald Trump deve perseguir para desenvolver e fortalecer suas capacidades de tecnologia quântica - que, basicamente, consiste em trocar o sistema binário atual da computação tradicional por um sistema baseado em pequenas moléculas, o que permitiria uma ampliação exponencial na forma como se processa informação.  Para discutir as estratégias apresentadas, foram convidados à Casa Branca funcionários do governo e representantes das grandes empresas tecnológicas e financeiras do país, como Alphabet (holding que engloba o Google), IBM, JP Morgan Chase, Lockheed Martin, Honeywell e Northrop Grumman (essas três últimas dedicadas à indústria aeroespacial e de defesa).  Também foi anunciado um investimento de US$ 249 milhões (R$ 966,5 milhões) para levar a cabo 118 projetos vinculados a esse campo científico.  Do outro lado do mundo, na China, está em curso um movimento similar: o governo de Pequim está construindo um novo Laboratório Nacional de Ciências da Informação Quântica em Hefei, a um custo de US$ 10 bilhões, que deve ser inaugurado em 2020.  Isso ocorre após o lançamento, há dois anos, do que foi descrito como o primeiro satélite quântico de comunicações, e do anúncio, em 2017, da criação de uma rede de comunicações supostamente ""impossível de ser invadida"" e à qual só têm acesso 200 usuários: militares, servidores públicos e funcionários de empresas privadas em cargos sênior.  O fato de as duas maiores potências globais estarem competindo no desenvolvimento de tecnologia quântica demonstra a importância desse campo que, para alguns teóricos, é tão poderoso que pode transformar o mundo.  Em vez de usar ""um"" e ""zero"" em sequências longas, como na computação clássica, um bit quântico - ou qubit - usa as propriedades das partículas subatômicas.  Elétrons ou fótons podem estar, por exemplo, em dois estados ao mesmo tempo - um fenômeno chamado superposição. Como resultado, um computador de qubit pode fazer cálculos muito mais rapidamente que um computador convencional.  ""Se você tem um computador de dois qubits e você adiciona dois qubits, terá um computador de quatro qubits, mas não vai dobrar a potência do computador - vai fazer com que cresça exponencialmente"", explicou à BBC Martin Giles, chefe do escritório de San Francisco da publicação MIT Technology Review.  Dessa forma, as tecnologias quânticas prometem uma revolução na forma como se processa a informação, afirma Alejandro Pozas-Kerstjens, pesquisador do Instituto de Ciências Fotônicas de Barcelona, na Espanha, e do Grupo de Teoria da Informação Quântica.  ""Toda a informação se codifica em um sistema binário - em zeros e uns -, mas, por volta dos anos 1960, descobriu-se que o lugar onde essa informação é armazenada pode levar a diferenças no que se pode fazer com ela"", diz.  ""Ou seja, posso gravar uma informação clássica em um chip de computador, como fazemos atualmente, mas também podemos armanezar esses zeros e uns em outros sistemas menores, a exemplo de átomos únicos ou pequenas moléculas. O comportamento desses átomos e moléculas, por serem tão pequenos, é ditado por outras regras: as do mundo quântico.""  O objetivo da Ciência da Informação Quântica, portanto, é usar essas novas propriedades quânticas para melhorar o processamento e a transmissão da informação, entre outros benefícios.  A promessa é de que a CIC sejam uma revolução na forma como processamos as informações, o que deve abrir milhares de possibilidades em setores como saúde, ciência e sistemas de defesa. É por esses motivos que as nações mais poderosas do mundo têm competido pela dianteira nessa área.  A julgar pelos avanços apresentados até agora no campo da tecnologia quântica, talvez a China esteja um passo à frente.  Em 2016, Pequim anunciou que havia lançado o primeiro satélite de comunicações quântico e, um ano depois, declarou que havia conseguido utilizar esse satélite para estabelecer comunicações criptografadas que não poderiam ser decifradas por agentes externos.  ""Foram dois experimentos: o primeiro conseguiu uma comunicação quântica com o satélite a partir da Terra e, depois, aproveitou-se esse satélite para realizar comunicação entre dois pontos em terra, com sinal criptografado quanticamente"", explica Pozas-Kerstjens.  Essa capacidade de saber se uma informação foi interceptada ou se chegou corretamente a seu destino não pode ser obtida com as tecnologias tradicionais nem com os métodos de transferência de informação que usamos atualmente.  Os experimentos chineses ainda são, no entanto, projetos-piloto. ""Eles provaram que pode ser feito, mas, no momento, não se alcançou a viabilidade para aplicações amplas [em escala] industrial"", diz Pozas-Kerstjens.  Tampouco se alcançou essa viabilidade no campo da computação quântica. Várias empresas de diversos países estão tentando desenvolvê-la - algo que, por enquanto, está no nível experimental, mas não comercial.  ""O computador quântico é, por enquanto, um Santo Graal"", prossegue Pozas-Kerstjens. ""É a direção na qual se movem, direta ou indiretamente, todos os esforços no campo da Ciência da Informação Quântica.""  A computação clássica, que trabalha em bits, opera a informação só em dois estados: zero ou um (aceso ou apagado). Já a quântica, por sua vez, trabalha também com a superposição de ambos estados e usa o movimento de partículas subatômicas para processar dados em quantidades impossíveis para a computação clássica.  Embora atualmente essa tecnologia esteja ainda em nível teórico, a expectativa é de que, em algum momento, sejam concluídos os cálculos que farão os computadores tradicionais parecerem obsoletos.  Nos Estados Unidos, empresas como IBM, Google e Microsoft estão desenvolvendo seus próprios computadores quânticos. O mesmo está acontecendo na China, com empresas locais como Alibaba e Baidu.  Mas não é nada fácil construir computadores quânticos: o principal problema é o número de bits quânticos que um computador será capaz de alcançar. Há relatos de que o Google esteja na dianteira, com o desenvolvimento de um processador com potência de qubits.  Além disso, existem obstáculos de manutenção, uma vez que esses futuros computadores exigem temperaturas extremamente baixas para conseguirem operar. O desenvolvimento de computadores quânticos que funcionem a temperatura ambiente é um dos pontos principais das pesquisas em curso.  Para Pozas-Kerstjens, a tecnologia quântica tem potencial revolucionário semelhante ao dos primeiros computadores pessoais, por mudar a forma como ""fazemos coisas que hoje custam muito caro, como a fabricação de medicamentos ou a otimização de rotas de tráfego para reduzir o gasto com combustíveis"".  ""Esse tipo de coisa será um problema solucionável com um computador quântico"", diz ele.  Mas talvez o maior interesse dos governos seja pelo potencial quântico no âmbito da defesa - desde realizar comunicações mais seguras até conseguir deter aeronaves intrusas.  E será que alguém está de fato ganhando essa disputa? Para Pozas-Kerstjens, é uma ""corrida de muitas cabeças"" competindo bem de perto.  ""Talvez possamos dizer que na computação quântica a dianteira seja dos Estados Unidos, mas, no campo das comunicações quânticas, é a China"". ",tecnologia,,,,,,
2019-01-03,https://web.archive.org/web/20190103202035/https://g1.globo.com/economia/tecnologia/blog/ronaldo-prass/post/2018/12/30/whatsapp-como-visualizar-mensagens-que-foram-apagadas-para-todos.ghtml,https://g1.globo.com/economia/tecnologia/blog/ronaldo-prass/post/2018/12/30/whatsapp-como-visualizar-mensagens-que-foram-apagadas-para-todos.ghtml,WhatsApp: como visualizar mensagens que foram apagadas para todos," (Se você tem alguma dúvida sobre tecnologia, utilize o espaço para comentários abaixo e escreva sua pergunta)  Olá, Ronaldo! É possível recuperar uma mensagem que foi recebida e depois apagada antes que eu tenha conseguido ler? — Muriel  Olá, Muriel! Existe um aplicativo chamado Notification History, através dele é possível coletar todas notificações apresentadas na tela do celular. Entre as notificações exibidas ao usuário, estão as mensagens recebidas pelo WhatsApp e mesmo que o autor tenha apagados as mensagens em seguida, o seu conteúdo é salvo num banco de dados interno do aparelho. Mas existe uma limitação, imagens e vídeos não poderão ser recuperados.  Oi, Ronaldo! Eu recebi através do WhatsApp um documento do Word, mas não estou conseguindo abrir o arquivo. Quando isso acontece eu envio o arquivo para o Google Drive e faço a edição, mas acho esse processo muito demorado. Existe alguma maneira mais simples? — Claudete  Olá, Claudete! Existe uma versão do Office para dispositivos móveis. Você pode instalar individualmente o app correspondente ao formato de arquivo (Word, Excel e PowerPoint). O suíte de escritório está disponível na Google Play, ele também acessa o serviço de armazenamento de arquivos da Microsoft.  Eu vi uma dica sobre uma versão alternativa do WhatsApp, nela vem diversos recursos muito úteis. Mas ouvi dizer que é perigoso usar um app assim porque ele pode conter vírus. Qual o risco de usar o GB WhatsApp? — Daniel  Olá, Daniel! O GB WhatsApp é obtido fora da Play Store, isso significa que para instalar o app será necessário alterar as configurações de segurança do celular para aceitar esse tipo de aplicativo. Não há garantia de que ele não possua um código malicioso para roubar dados os usuários. E se tratando de risco real, usar um aplicativo não oficial para acessar o WhatsApp, pode ser punido com o banimento definitivo da conta do usuário. ",tecnologia,,,,,,
2019-01-05,https://web.archive.org/web/20190105165600/https://g1.globo.com/economia/tecnologia/noticia/2019/01/04/acoes-da-apple-voltam-a-subir-mas-empresa-perdeu-valor-maior-que-o-do-facebook-em-3-meses.ghtml,https://g1.globo.com/economia/tecnologia/noticia/2019/01/04/acoes-da-apple-voltam-a-subir-mas-empresa-perdeu-valor-maior-que-o-do-facebook-em-3-meses.ghtml,"Ações da Apple voltam a subir, mas empresa perdeu valor maior que o do Facebook em 3 meses"," As ações da Apple voltaram a subir nesta sexta-feira (4) na bolsa de Nova York, um dia após recuarem quase 10%, na pior queda em 5 anos. A empresa fechou o último pregão da semana com alta de 4,27%.  No entanto, nos últimos 3 meses, depois de ser a primeira a alcançar o valor de US$ 1 trilhão, a fabricante do iPhone perdeu cerca de US$ 450 bilhões em valor de mercado. Isso é mais do que um Facebook - a rede social é avaliada em aproximadamente US$ 395 bilhões.  Nesse período, a Apple também deixou de ser a empresa mais valiosa do mundo. A Microsoft ocupa esse posto desde 5 de dezembro.  A queda acentuada na última quinta aconteceu depois da divulgação de uma carta do presidente-executivo da empresa, Tim Cook, que assinalou que não conseguiria atingir a meta de vendas para o último trimestre de 2018.  A empresa culpou uma desaceleração econômica mais ""abrupta"" do que a esperada na China e nos mercados emergentes. A Apple também citou os atritos entre Estados Unidos e a China prejudicaram as vendas.  Antes disso, ela já vinha dando sinais de queda no faturamento. Em novembro último, suspendeu o aumento de produção do novo iPhone XR, que seria seu modelo de baixo custo.  Especialistas afiram que a Apple errou ao elevar a mais de mil dólares o preço dos novos iPhones - sobretudo em um mercado muito saturado e repleto de concorrência.  ""Não é uma catástrofe, nem um sinal de que a Apple esteja perdendo seu controle sobre o mercado de smartphones. É apenas um erro de cálculo da Apple sobre quanto as pessoas pagarão por um iPhone"", afirmou.  Patrick Moorhead, da Moor Insights & Strategy, disse também à AFP que a Apple pode estar longe de ter um crescimento de dois dígitos no mercado de telefonia - esperado por muitos em Wall Street.  ""A empresa está crescendo em serviços e na categoria 'vários', o que não é suficiente para alimentar o crescimento geral das receitas"", analisou.  ""Não estou preocupado com a empresa, mas é provável que os investidores não vejam o valor da empresa até que percebam que ela retornou a um caminho de crescimento de dois dígitos"", concluiu. ",tecnologia,,,,,,
2019-01-05,https://web.archive.org/web/20190105165600/https://g1.globo.com/economia/tecnologia/blog/altieres-rohr/post/2019/01/04/dispositivos-usb-poderao-ser-autenticados-com-criptografia-para-detectar-acessorios-originais-anuncia-entidade.ghtml,https://g1.globo.com/economia/tecnologia/blog/altieres-rohr/post/2019/01/04/dispositivos-usb-poderao-ser-autenticados-com-criptografia-para-detectar-acessorios-originais-anuncia-entidade.ghtml,"Dispositivos USB poderão ser autenticados com criptografia para detectar acessórios originais, anuncia entidade"," A USB-IF, uma entidade sem fins lucrativos que determina normas para o funcionamento para a porta USB e suas derivações a fim de garantir a compatibilidade entre todos os equipamentos que usam essa conexão, anunciou nesta terça-feira (2) uma iniciativa de credenciamento de dispositivos por meio de chaves criptográficas. Um sistema operacional poderá se aproveitar dessa medida para reconhecer aparelhos originais ou alertar sobre possíveis adulterações.  A tecnologia deve funcionar apenas para a porta USB tipo C (USB-C), o padrão mais recente que prevê o dobro da velocidade do USB 3.0. Esse conector pode ser encontrado principalmente em celulares e notebooks mais novos, além de acessórios que exigem taxas de transferência de dados elevadas, como telas e armazenamento portátil.  De acordo com a USB-IF, o reconhecimento pode ocorrer tanto para a linha de dados (para autenticar teclados, mouses ou pen drives) como para a linha de energia (para carregadores).  A DigiCert ficará encarregada de emitir os certificados digitais criptográficos que permitirá aos fabricantes deixar uma ""assinatura"" aos periféricos produzidos. Quando algo for conectado à porta USB, o computador ou smartphone poderá reconhecer o fabricante e ser informado sobre as capacidades técnicas detalhadas do dispositivo para atestar sua compatibilidade.  Como a medida ainda está em fase inicial, não se sabe como a tecnologia será usada na prática. Há um temor de que a autenticação aumente o controle dos fabricantes sobre quais aparelhos podem ou não ser usados com seus equipamentos, diminuindo a liberdade do consumidor. A USB-IF, porém, destacou os benefícios de segurança que a certificação digital pode trazer.  Riscos de segurança no USB  Como o USB é compatível com muitos acessórios diferentes (teclados, mouses, som, rede, armazenamento e hubs, que conectam vários dispositivos simultaneamente), hackers podem tirar proveito do USB para disfarçar teclados virtuais em pen drives, por exemplo. Dessa maneira, quando o pen drive falso é conectado, um teclado fantasma digita comandos no computador automaticamente, enquanto uma rede criada pelo mesmo USB pode ser usada para transmitir informações capturadas por Wi-Fi ou Bluetooth.  Em dezembro, com o intuito de evitar alguns desses ataques, o Google acrescentou um recurso de segurança ao sistema Chrome OS, usado em computadores do tipo Chromebook, que impede a conexão de dispositivos USB enquanto o sistema estiver com a tela bloqueada.  Por meio da autenticação criptográfica, um celular ou notebook seria capaz, em teoria, de reconhecer que um pen drive ou teclado realmente é do fabricante que diz ser e que não houve adulteração no seu funcionamento para poder liberar seu uso mais facilmente.  No caso específico do USB tipo C, fabricantes têm enfrentado problemas com carregadores. Enquanto versões anteriores do USB operavam em 5 volts e transmitiam até 7,5 W (potências maiores eram possíveis com tecnologias de fabricantes específicos), o USB tipo C pode operar também em tensões de 12 ou 20 volts e prevê até 100 W de alimentação para carregar notebooks.  Por causa do risco de carregadores de má qualidade não fornecerem a tensão correta (por exemplo, fornecer 20 volts a um aparelho projetado para 12), algumas marcas têm restringido o uso de carregadores de terceiros, o que impede que consumidores usem o mesmo carregador em todos os aparelhos com os quais ele deveria ser compatível.  Em tese, com a possibilidade de credenciar dispositivos, a confiabilidade dos equipamentos com certificação reconhecida será mais elevada que a de acessórios e periféricos genéricos, o que deve facilitar a identificação de carregadores compatíveis, por exemplo.  Dúvidas sobre segurança, hackers e vírus? Envie para g1seguranca@globomail.com ",tecnologia,,,,,,
