data,url_noticia,url_noticia_curto,titulo,conteudo_noticia,assunto,assunto_ex,titulo_ex,subtitulo_ex,local_ex,artigo_ex,n_paragrafos
2019-12-16,https://web.archive.org/web/20191216201411/https://g1.globo.com/politica/noticia/2019/12/16/senado-pode-analisar-projetos-que-recuperam-pontos-retirados-do-pacote-anticrime.ghtml,https://g1.globo.com/politica/noticia/2019/12/16/senado-pode-analisar-projetos-que-recuperam-pontos-retirados-do-pacote-anticrime.ghtml,Senado pode analisar projetos que recuperam pontos retirados do pacote anticrime," O Senado pode analisar quatro projetos que recuperam pontos retirados do pacote anticrime apresentado neste ano pelo ministro da Justiça, Sergio Moro.  Na semana passada, os parlamentares aprovaram um projeto que endurece a legislação penal e reúne propostas do pacote de Moro; da comissão de juristas coordenada pelo ministro Alexandre de Moraes, do Supremo Tribunal Federal; e de parlamentares.  Agora, caberá ao presidente Jair Bolsonaro sancionar o projeto, sancionar com vetos ou vetar integralmente. Segundo Moro, a hipótese de veto integral está ""descartada"", mas Bolsonaro poderá vetar alguns pontos.  Os projetos que retomam pontos do pacote anticrime foram apresentados pelo senador Elmano Férrer (Podemos-PI) e já foram encaminhados à Comissão de Constituição e Justiça (CCJ). Não há data prevista para votação.  Entre os pontos que os projetos retomam estão as audiências por videoconferência; a chamada ""plea bargain"" e novas causas que interromperão o prazo para a prescrição de pena (leia detalhes mais abaixo).  Ao justificar a apresentação das propostas, Elmano Férrer disse que o Senado não teve a oportunidade de discutir alguns aspectos do pacote anticrime enviado por Moro – o Senado aprovou o mesmo texto aprovado pela Câmara.  ""Apresentei para que nós, Senado, como Casa revisora, tenhamos oportunidade de analisar alguns pontos que foram desidratados na Câmara dos Deputados"", afirmou Férrer à TV Globo.  ""Achamos que há pontos importantes do projeto original, do governo e sobretudo do Sergio Moro"", acrescentou.  Os projetos de Elmano Férrer não preveem a ""excludente de ilicitude"", situação em que o policial pode se livrar de punição. O pacote de Moro previa esse item, mas os deputados e os senadores aprovaram o projeto anticrime sem a proposta.  ""Eu mesmo, particularmente, queria apresentá-lo porque acho relevante. [...] Tenho um pensamento pessoal, mas sei que é um tema muito polêmico, vários juristas têm pensamentos diferentes"", afirmou.  A ""excludente de ilicitude"" é tratada em um projeto enviado pelo governo ao Congresso e que atualmente tramita na Câmara. O texto isenta de punição os policiais e os militares que estiverem em operações de Garantia da Lei e da Ordem (GLO).  Saiba os projetos que retomam pontos retirados do pacote anticrime:  Amplia as possibilidades de uso da videoconferência em interrogatórios de presos, além de permitir o uso da tecnologia em audiências de custódia.  Atualmente, a lei prevê que a videoconferência pode ser determinada ""excepcionalmente"" pela Justiça. O projeto retira a limitação e permite videoconferência sempre que a finalidade for ""questão de ordem pública"" ou a diminuição de custos com deslocamento ou escolta de presos.  Além das hipóteses já previstas em lei para videoconferência – como acareação, inquirição da testemunha, tomada de declarações –, o projeto determina que as audiências de custódia também podem ser feitas assim.  Institui o ""plea bargain"", acordo feito após apresentação de denúncia que envolve a confissão dos crimes pelo acusado em troca de uma pena menor.  O acordo poderá ser feito em casos de infração sem violência ou grave ameaça e com pena máxima de quatro anos, seguindo uma série de condições (como o reparo do dano à vítima e a prestação de serviços à comunidade). O projeto prevê restrições ao acordo, por exemplo, caso o investigado for reincidente ou se já tiver sido beneficiado nos últimos cinco anos com outro acordo.  O quarto projeto prevê o regime inicial fechado no cumprimento de pena em caso de reincidência ou para casos de peculato, corrupção passiva, corrupção ativa, roubo com arma de fogo ou explosivo e roubo que resulte em lesão corporal grave.  Prevê novas causas que impedem ou interrompem o curso da prescrição de pena. O senador sugere, como causa impeditiva, o aguardo da análise de embargos de declaração ou de recursos aos tribunais superiores.  Como causas interruptivas, o projeto altera dois artigos do Código Penal para dizer que o curso da prescrição se interrompe já durante a execução provisória de pena. Pelo texto do projeto, a prescrição de pena seria interrompida: ",politica,,,,,,
2019-12-16,https://web.archive.org/web/20191216201411/https://g1.globo.com/politica/noticia/2019/12/16/bolsonaro-diz-que-vetara-mudancas-feitas-por-relator-no-projeto-com-novas-regras-para-cnh.ghtml,https://g1.globo.com/politica/noticia/2019/12/16/bolsonaro-diz-que-vetara-mudancas-feitas-por-relator-no-projeto-com-novas-regras-para-cnh.ghtml,Bolsonaro diz que vetará se Congresso aprovar mudança em projeto do Código de Trânsito," O presidente Jair Bolsonaro afirmou nesta segunda-feira (16) que vetará o projeto com mudanças no Código Brasileiro de Trânsito (CBT) caso o Congresso aprove a versão do texto elaborada pelo relator da proposta, deputado Juscelino Filho (DEM-MA). O presidente, contudo, lembrou que os parlamentares poderão derrubar um eventual veto.  Entregue pessoalmente por Bolsonaro no Congresso em junho, o projeto atualmente tramita em uma comissão especial e terá de ser aprovado por Câmara e Senado para ser enviado à sanção presidencial. Ao blog da jornalista Andréia Sadi, Juscelino Filho informou que a expectativa é votar o projeto na comissão na terça-feira (17).  Entre os pontos do projeto original que o relator alterou estão:  Ao deixar o Ministério da Infraestrutura, onde participou de uma reunião, Bolsonaro foi questionado por jornalistas se vetaria o texto.  “Lógico que vou vetar"", respondeu. ""Mas a última palavra é do parlamento [...] A ideia de desburocratizar, desregulamentar alguma coisa, facilitar a vida de quem produz, que é o motorista, vai ser prejudicada tendo em vista a ação do relator"", disse Bolsonaro.  O presidente disse lamentar a postura do deputado e lembrou que já o procurou para negociar mudanças no relatório.  “Lamento o relator ter se posicionado dessa maneira. Estamos buscando contato com ele, conversei com ele já uma vez. E, no mais, ele acolheu 101 emendas, quer dizer, ele fez um novo Código Nacional de Trânsito, não é assim a intenção nossa, é descomplicar"", afirmou.  O governo propôs elevar a validade do exame de aptidão física e mental, necessário para a renovação da CNH, para 10 anos. A partir de 65 anos de idade, a renovação passaria ser a cada 5 anos.  Atualmente, os exames devem ser feitos a cada 5 anos, e a cada 3 no caso de motoristas acima de 65 anos.  O relator propôs que o exame de aptidão física e mental seja renovável a cada 10 anos para motoristas de 18 a 40 anos. A partir dos 40 anos de idade, a renovação passa a ser exigida a cada 5 anos. Bolsonaro não gostou da proposta.  “O relator entendeu que é exagero isso daí, porque seria a partir dos 65 anos de idade para cinco anos a renovação da carteira. O relator entendeu que com 40 anos de idade a pessoa está velha no Brasil, tem que voltar a ser de cinco em cinco”, afirmou o presidente.  O relator também alterou a proposta sobre o limite de pontos para suspensão da carteira de habilitação.  O governo deseja elevar de 20 pontos para 40 pontos, contudo, o deputado propôs que o teto de 40 pontos só valerá para motorista que não cometer nenhuma infração gravíssima em 12 meses.  No caso de cometer uma infração gravíssima, o teto para suspensão do documento será de 30 pontos. Se cometer duas infrações gravíssimas em 12 meses, o limite fica em 20 pontos. Bolsonaro criticou a mudança no texto.  “Dado a quantidade de radares que tem no Brasil, enfrentamos uma queda de braço com a Justiça, e o relator também entendeu que certas multas, se forem com 20 pontos, dado a gravidade, tem que perder a carteira. Complicou tudo"", disse Bolsonaro.  Bolsonaro ainda afirmou na entrevista que reconhece que o preço dos combustíveis ""está alto"" no país e disse fazer o possível para reduzir o valor.  “Estamos fazendo o possível para baratear o preço do combustível. Reconhecemos que está alto no Brasil”, declarou.  Bolsonaro disse que discute medidas com o ministro da Economia, Paulo Guedes, e o presidente da Petrobras, Roberto Castello Branco.  O presidente foi perguntado se estuda editar uma medida provisória com mudanças na política do etanol. Ele respondeu que o governo tenta permitir que usinas possam vender combustível direto para os postos.  “Questão do etanol nós tentamos, estamos tentando ainda, de modo que, das empresas que produzem o etanol, as usinas possam vender diretamente ao posto de gasolina. Tem caminhões de transporte de etanol que andam 400 quilômetros para entregar o etanol a um quilômetro da usina. Isso é um absurdo"", disse. ",politica,,,,,,
2019-12-16,https://web.archive.org/web/20191216201411/https://g1.globo.com/politica/noticia/2019/12/16/bolsonaro-chama-paulo-freire-de-energumeno-e-diz-que-tv-escola-deseduca.ghtml,https://g1.globo.com/politica/noticia/2019/12/16/bolsonaro-chama-paulo-freire-de-energumeno-e-diz-que-tv-escola-deseduca.ghtml,Bolsonaro chama Paulo Freire de 'energúmeno' e diz que TV Escola 'deseduca'," O presidente Jair Bolsonaro chamou nesta segunda-feira (16) de “energúmeno” o educador Paulo Freire, patrono da educação brasileira, e declarou que a programação da TV Escola “deseduca”.  Bolsonaro fez as afirmações contra Paulo Freire e a TV Escola na saída da residência oficial do Palácio da Alvorada, ao ser questionado sobre o tema enquanto conversava e fazia fotos com apoiadores.  Na última sexta (13), o contrato com a associação responsável por gerir a TV Escola desde 1995 não foi renovado Em nota, o Ministério da Educação (MEC) afirmou que estuda a possibilidade de as atividades do canal serem exercidas por outra instituição da administração pública.  O presidente defendeu a decisão do ministério de não renovar o contrato e disse que a audiência da TV Escola é muito baixa.  “Você conhece a programação da TV Escola? Deseduca”, afirmou o presidente.  Segundo Bolsonaro, a educação do Brasil tem desempenho ruim e avaliações por causa “dessas programações”, com a da TV Escola que, na sua opinião, tinha uma programação “totalmente de esquerda”, que promovia “ideologia de gênero” com recursos públicos.  De acordo com o presidente, as mudanças que a sua gestão implementa terão reflexos na educação do país num prazo entre cinco e 15 anos.  Ao concluir o argumento, ele chamou o educador Paulo Freire de “energúmeno” (ignorante, boçal, imbecil, segundo definição do dicionário Houaiss.  No mês passado, a Coordenação de Aperfeiçoamento de Pessoal do Nível Superior (Capes) alterou a plataforma criada para os professores buscarem cursos de aperfeiçoamento profissional e retirou a homenagem ao educador Paulo Freire do nome. Agora, a ""Plataforma Freire"" se chama ""Plataforma da Educação Básica"".  “Olha a prova do Pisa. Estamos em último lugar no mundo, se eu não me engano, matemática, ciências e português. Acho que em um ou dois itens somos os últimos da América do Sul. Vamos esperar o que desse Brasil com esse tipo de educação?”, completou.  Bolsonaro estava se referindo ao Programa Internacional de Avaliação de Estudantes (Pisa, na sigla em inglês). Na mais recente avaliação, feita em 2018 e divulgada neste mês, o Brasil não ficou em último lugar, embora o desempenho tenha sido baixo. Entre os países da América do Sul, a Argentina ficou em último lugar.  Paulo Freire foi declarado o patrono da educação brasileira em 2012. O educador desenvolveu uma estratégia de ensino baseada nas experiências de vida das pessoas, em especial na alfabetização de adultos.  Uma das obras de Freire, ""Pedagogia do Oprimido"", é o único livro brasileiro a aparecer na lista dos 100 títulos mais pedidos pelas universidades de língua inglesa consideradas pelo projeto Open Syllabus.  A metodologia de Paulo Freire vem sendo criticada por integrantes do governo Jair Bolsonaro, que atribuem ao método o baixo desempenho escolar do país em avaliações da qualidade da educação.  Em janeiro, o programa Arquivo N falou sobre a vida e a obra de Paulo Freire. Confira abaixo:  No início deste mês, o Bom Dia Brasil apresentou os resultados do Pisa, a avaliação internacional de estudantes: ",politica,,,,,,
2019-12-23,https://web.archive.org/web/20191223203913/https://g1.globo.com/politica/noticia/2019/12/23/oab-vai-ao-stf-contra-medida-provisoria-que-libera-hoteis-e-navios-de-pagar-direitos-autorais.ghtml,https://g1.globo.com/politica/noticia/2019/12/23/oab-vai-ao-stf-contra-medida-provisoria-que-libera-hoteis-e-navios-de-pagar-direitos-autorais.ghtml,OAB vai ao STF contra medida provisória que libera hotéis e navios de pagar direitos autorais," O Conselho Federal da Ordem dos Advogados do Brasil (CFOAB) apresentou uma ação ao Supremo Tribunal Federal (STF) para suspender trecho de uma medida provisória (MP) que extingue a cobrança de direitos autorais pela execução de obras literárias, artísticas e científicas em quartos de hotéis e em embarcações turísticas, como navios e cruzeiros.  A ação foi protocolada na sexta-feira (20), mas entrou no sistema do tribunal nesta segunda-feira (23).  Na ação, o conselho pede uma decisão liminar (provisória) para suspender os efeitos do dispositivo que extingue a arrecadação e, posteriormente, solicita que a Corte, ao julgar definitivamente o caso, declare a norma inconstitucional.  A relatora é a ministra Rosa Weber, mas a ação está no gabinete do presidente Dias Toffoli em razão do período de recesso no tribunal. Ele pode decidir, se considerar que há urgência no pedido,ou aguardar o retorno da ministra em fevereiro.  A medida provisória foi editada pelo presidente Jair Bolsonaro e publicada em 27 de novembro no ""Diário Oficial da União"".  A medida provisória é a mesma que transformou a Embratur em agência, criando a Agência Brasileira de Promoção Internacional do Turismo. Esse ponto, no entanto, não foi questionado na ação da OAB.  A ação contesta dispositivos da norma que alteram a legislação sobre direitos autorais. O texto estabelece que:  A OAB argumenta que a extinção da cobrança dos direitos autorais impõe ""graves prejuízos"" ao setor artístico e cultural.  Ainda segundo o órgão, a exploração dos conteúdos de rádio e televisão se traduz em proveito econômico por parte dos hotéis e meios de transporte marítimo e fluvial “configurando também atividade de retransmissão de conteúdo"". De acordo com a ação, ""não seria possível privar os artistas da remuneração ligada à exploração de sua propriedade intelectual”.  O OAB também diz não haver urgência que justifique a edição de uma medida provisória para tratar da questão. Segundo a Constituição, urgência e relevância são requisitos para a edição de uma MP.  “A isenção concedida pela MP já foi amplamente rechaçada pelas cortes superiores, tendo em vista a afronta ao direito autoral, não havendo justificativa para a urgência em superar tal entendimento”, diz a peça judicial. ",politica,,,,,,
2019-12-23,https://web.archive.org/web/20191223203913/https://g1.globo.com/politica/noticia/2019/12/21/pgr-denuncia-deputado-wilson-santiago-por-organizacao-criminosa-e-corrupcao-passiva.ghtml,https://g1.globo.com/politica/noticia/2019/12/21/pgr-denuncia-deputado-wilson-santiago-por-organizacao-criminosa-e-corrupcao-passiva.ghtml,PGR denuncia deputado Wilson Santiago por organização criminosa e corrupção passiva," A Procuradoria-Geral da República (PGR) denunciou neste sábado (21) o deputado federal Wilson Santiago (PTB-PB) e outras seis pessoas pelos crimes de corrupção passiva e organização criminosa. Entre os denunciados, está o prefeito de Uiraúna (PB), João Bosco Nonato Fernandes (PSDB).  O grupo é acusado de desviar recursos destinados à construção da adutora Capivara no sertão paraibano.  Mais cedo, neste sábado, a Polícia Federal deflagrou a operação Pés de Barro, que investiga desvio de recursos dessa obra. Foram cumpridos mandados de busca e apreensão, um deles no gabinete do deputado Wilson Santiago, na Câmara dos Deputados, em Brasília.  O ministro do Supremo Tribunal Federal (STF) Celso de Mello, que autorizou as buscas, também determinou o afastamento de Santiago do mandato.  A defesa de Santiago diz que a operação teve como base informações de um delator que buscou se favorecer e criminalizar o trabalho do deputado. A assessoria de João Bosco Nonato Fernandes afirma que a defesa do prefeito vai provar sua inocência, mas só vai se pronunciar depois de acessar toda a investigação.  Segundo o Ministério Público, investigações revelaram que, entre outubro de 2018 e novembro de 2019, a empresa responsável pela construção da adutora, a Coenco Construções, recebeu R$ 14,7 milhões de dinheiro público e repassou, como propina, R$ 1,2 milhão a Wilson Santiago e R$ 633 mil a João Bosco Fernandes.  Em imagens coletadas pela Polícia Federal, o prefeito João Bosco Nonato Fernandes aparece escondendo propina dentro da cueca.  Em julho de 2017, segundo a PGR, Wilson Santiago propôs a João Bosco e a um empresário o direcionamento da licitação da obra. A construção da adutora, segundo as investigações, foi licitada pelo município e paga com recursos federais.  Pelo acordo, conforme o MP, 15% de todo o investimento seria devolvido aos políticos, sendo 10% para Wilson Santiago e 5% para João Bosco.  Segundo a PGR, o contrato para a realização da obra foi assinado em abril de 2018 e, a partir dessa data, o deputado federal entrou em contato outras pessoas para poder viabilizar o repasse de propina.  A essas pessoas, de acordo com o Ministério Público, coube a coordenação das atividades da organização criminosa, o recolhimento da propina e o transporte de valores. Como contrapartida, participantes do esquema foram, segundo a PGR, nomeados em fevereiro deste ano no gabinete do deputado Wilson Santiago.  A PGR pede a condenação dos integrantes da organização criminosa e também a devolução de R$ 14,8 milhões.  ""[Os integrantes do grupo], de comum acordo e em comunhão de vontades, passaram a integrar organização criminosa, associando-se de forma estruturalmente ordenada e mediante divisão de tarefas, com o objetivo de angariar vantagem patrimonial indevida"", diz trecho da denúncia assinada pelo procurador José Bonifácio de Andrada.  Neste sábado, a Polícia Federal cumpriu quatro mandados de prisão preventiva, mas Wilson Santiago não era um dos alvos. A PF pediu a prisão do parlamentar, mas o ministro Celso de Mello negou.  Em nota, a defesa de Santiago afirmou que ele ""recebe com respeito e acatamento a decisão do ministro Celso de Mello"" e que ""está absolutamente tranquilo e demonstrará, em momento oportuno, a inexistência de qualquer relação com os fatos investigados"".  Já o PTB, partido ao qual deputado é filiado, informou, também em nota, que ""acompanhará o andamento das investigações"" e que ""espera que Wilson Santiago consiga provar sua inocência.""  Além do deputado e do prefeito de Uiraúna, a operação tem outros alvos: três assessores, um funcionário e um empresário de Santiago.  No total, são 13 mandados de busca e apreensão, nas cidades de João Pessoa, São João do Rio do Peixe, Uiraúna (PB) e Brasília (DF).  Há ordens de afastamento das funções públicas para outros seis alvos da operação, além do deputado. ",politica,,,,,,
2019-12-30,https://web.archive.org/web/20191230205814/https://g1.globo.com/politica/noticia/2019/12/30/bolsonaro-decide-retornar-a-brasilia-e-passar-ano-novo-no-alvorada-informa-planalto.ghtml,https://g1.globo.com/politica/noticia/2019/12/30/bolsonaro-decide-retornar-a-brasilia-e-passar-ano-novo-no-alvorada-informa-planalto.ghtml,"Bolsonaro decide retornar a Brasília e passar Ano Novo no Alvorada, informa Planalto"," A Secretaria de Comunicação Social da Presidência informou nesta segunda-feira (30) que o presidente Jair Bolsonaro decidiu retornar nesta terça (31) a Brasília e passar o Ano Novo na residência oficial do Palácio da Alvorada.  Bolsonaro viajou para a Base Naval de Aratu (BA) no último dia 27, e a previsão inicial era ele retornar a Brasília somente em 5 de janeiro.  Conforme a assessoria, o presidente decidiu antecipar o retorno para passar o Ano Novo com a família.  Isso porque a primeira-dama Michelle Bolsonaro não viajou com o presidente, somente a filha deles. Na semana passada, Bolsonaro informou que ela não iria em razão de uma cirurgia.  Segundo a assessoria da Presidência, a cirurgia ainda não foi realizada, e Michelle não será submetida a procedimento antes do réveillon.  Mais cedo, nesta segunda-feira, Bolsonaro esteve em Salvador, onde visitou alguns pontos turísticos, entre os quais o Farol da Barra, um dos principais da capital.  No local, cumprimentou apoiadores e tirou fotos com alguns deles.  A base de Aratu fica na península do Paripe, em Salvador, e funciona como apoio logístico para equipes das três Forças Armadas que atuem nas águas. A construção completou 50 anos em 2019.  O local é vigiado constantemente pela Marinha, e as instalações de lazer incluem uma casa colonial na praia privativa de Inema.  Além da função estratégica, Aratu foi escolhida como local de refúgio e descanso pelos últimos cinco presidentes do Brasil. ",politica,,,,,,
2019-12-30,https://web.archive.org/web/20191230205814/https://g1.globo.com/politica/noticia/2019/12/30/conselho-de-tribunais-diz-que-alguns-estados-terao-dificuldade-em-implementar-juiz-de-garantias.ghtml,https://g1.globo.com/politica/noticia/2019/12/30/conselho-de-tribunais-diz-que-alguns-estados-terao-dificuldade-em-implementar-juiz-de-garantias.ghtml,Conselho de tribunais diz que alguns estados terão dificuldade em implementar juiz de garantias," O presidente do Conselho dos Tribunais de Justiça, desembargador Carlos Eduardo Zietlow Duro, afirmou nesta segunda-feira (30) que alguns estados terão dificuldade em implementar o juiz de garantias.  Incluída pelo Congresso Nacional no projeto anticrime, a criação do juiz de garantias foi sancionada pelo presidente Jair Bolsonaro na semana passada.  Conforme a lei, caberá ao juiz de garantias acompanhar e autorizar etapas do processo, não a sentença, que caberá a outro magistrado. Partidos políticos e entidades já acionaram o Supremo Tribunal Federal contra a medida.  ""Em relação ao Rio Grande do Sul, a situação é contornável e é viável porque podem ser utilizados os plantões regionalizados. No Rio Grande do Sul daria para implantar efetivamente"", disse Zietlow à TV Globo.  ""Mas o Brasil tem vários estados e cada estado tem sua especificidade, temos dimensões continentais. Alguns TJs vão ter dificuldades, eu cito o que foi relatado a mim pelo colega do Amazonas. Existem comarcas a mil quilômetros de distância de Manaus, internet não é adequada. Isso dificulta a implantação, vai gerar gasto a maior para estruturação"", acrescentou.  Mais cedo, nesta segunda-feira, a Ordem dos Advogados do Brasil (OAB) enviou uma manifestação ao STF na qual defendeu a criação do juiz de garantias e afirmou que a medida não aumentará custos.  Também nesta segunda, o Conselho Nacional de Justiça (CNJ) abriu consulta pública para que acadêmicos, juristas, magistrados e entidades se manifestem sobre a questão (veja mais detalhes no vídeo abaixo).  À TV Globo, Carlos Zietlow disse avaliar que não é necessária a figura do juiz de garantias.  ""Minha posição, respeitando as posições em contrário, entendo que não seria necessária a criação. Porque o fato de o juiz ter deferido medida prévia, na investigação, não o torna imparcial, ele é plenamente capaz de julgar o processo. O juiz é imparcial, não importa qual a fase"", afirmou.  Ainda segundo o desembargador, apenas um juiz para investigação e processo torna a Justiça mais rápida. ""Juiz que toma conta da fase anterior quanto da posterior, o processo tramita mais rápido. Na minha opinião, um juiz só dá mais celeridade.""  Ele preferiu não comentar se avalia a medida como inconstitucional, como argumentam as ações apresentadas ao Supremo.  ""Como a matéria está judicializada no Supremo, prefiro deixar a posição sobre se é ou não constitucional a medida para quem detém a competência. Deixa o Supremo decidir"", completou. ",politica,,,,,,
