data,url_noticia,url_noticia_curto,titulo,conteudo_noticia,assunto,assunto_ex,titulo_ex,subtitulo_ex,local_ex,artigo_ex,n_paragrafos
2018-06-06,https://web.archive.org/web/20180607102437/https://gshow.globo.com/Famosos/noticia/elenco-de-belissima-revela-curiosidades-e-relembra-bastidores-de-gravacao.ghtml,https://gshow.globo.com/Famosos/noticia/elenco-de-belissima-revela-curiosidades-e-relembra-bastidores-de-gravacao.ghtml,Elenco de 'Belíssima' revela curiosidades e relembra bastidores de gravação," Há 13 anos, Belíssima fazia sucesso nas TVs em todo o Brasil. A trama, que girava em torno do embate entre a vilã Bia Falcão, interpretada por Fernanda Montenegro, e sua neta Júlia, vivida por Gloria Pires, marcou época. A novela também foi a estreia de Paolla Oliveira nas novelas da Globo e um dos primeiros papeis de Cauã Reymond na telinha. Para efeito de comparação, Marina Ruy Barbosa, que também integrou o elenco, tinha apenas 10 anos na época - hoje, a atriz tem 22.  Bateu saudades? A partir desta segunda-feira, 4 de junho, a trama reestreia no Vale a Pena Ver de Novo! Por isso, o Gshow foi atrás de Cauã, Paolla e Marina - além de Reynaldo Gianecchini - para descobrir curiosidades e histórias dos bastidores de gravação da novela. Confira!  ""Foi o meu segundo trabalho na TV. Eu tinha feito uma novela das sete, 'Começar de Novo', mas era uma personagem que não falava, então passei sete meses esperando uma fala"", diverte-se a atriz. ""Logo depois veio a oportunidade de fazer 'Belíssima'"".  ""Passei para a segunda fase e aí nessa fase estavam a Denise [Saraceni] e o Silvio [de Abreu]. Graças a Deus deu tudo certo e eu passei"", agradece.  ""Me lembro que, quando fui fazer ‘Belíssima’, pensei: ‘acho que vou malhar, né? Se vou ficar de cueca vermelha lá, pelo menos vou estar com o corpinho legal, entendeu?"", brinca Cauã. Brincadeiras à parte, segundo o ator, Belíssima foi uma oportunidade de aprender com alguns dos atores com quem contracenou, como Irene Ravache, Vera Holtz e Fernanda Montenegro.  ""Passei quase um ano contracenando com a Vera [Holtz] e lembro que, em toda gravação, eu chegava e perguntava: 'Vera, como é que eu melhoro?', 'o que eu faço?' e ela sempre respondia que eu estava ótimo"".  Para Cauã, a época das gravações foi um período em que procurou absorver e aprender ao máximo o que estivesse à sua volta.  ""Eu ficava estudando o roteiro de outros atores - no caso, da Irene e da Fernanda, porque elas tinham embates muito fortes - e gostava muito de observar, de entender, ver como se movimentava para a câmera"".  ""Acho que um dos maiores desafios que tive como ator foi entender essas quatro câmeras do estúdio. Demorei alguns anos até entender que uma faz o geral, a outra faz o close, a outra faz o médio, e você tem que 'dar uma giradinha, descansa na direita, descansa na esquerda', e eu via que elas faziam aquilo com uma naturalidade que eu não tinha"", explica.  ""Eu tinha tirado umas férias e estava estudando nos Estados Unidos. Lá, eu estava brincando pela primeira vez de não ser galã porque lá ninguém me olhava assim, até porque eu era praticamente o mais feinho da turma - é verdade!"", relembra o ator.  ""E aí, em uma sincronicidade linda do destino, o Silvio [de Abreu] me chamou em seguida e falou: 'Olha, tenho um personagem para você que é muito louco, muito diferente, de comédia', e eu achei que veio na melhor fase que poderia ter vindo. Primeiro, achei ele um louco de acreditar em mim porque nem eu sabia se podia fazer, mas aceitei na mesma hora"", conta.  ""Foi o meu primeiro trabalho e eu realmente não sabia o que ia acontecer. A expectativa era muito grande, então só tenho a agradecer a esses dois [Silvio de Abreu e Denise Saraceni] desde a época dos testes"", conta.  ""Lembro de dois momentos: um dia, depois de uma cena até com o Cauã, em que a gente tinha um embate, e o Silvio passando e falando: 'você está indo bem, vou dar mais coisa para você'. Minha perna tremeu nessa hora"", conta. ""A segunda cena que tenho na memória é a dona Fernanda entrando no camarim e falando: 'Você fez uma cena muito linda ontem, parabéns'. Fiquei paralisada mais uma vez, não sei nem como eu estou aqui hoje (risos)... São essas pequenas coisas que ficam na memória, sabe?"" ",famosos,,,,,,
2018-06-06,https://web.archive.org/web/20180607102437/https://gshow.globo.com/Famosos/noticia/chandelly-braz-enaltece-o-feminismo-ainda-estamos-lutando-para-ter-poder-e-autonomia-sobre-os-nossos-corpos.ghtml,https://gshow.globo.com/Famosos/noticia/chandelly-braz-enaltece-o-feminismo-ainda-estamos-lutando-para-ter-poder-e-autonomia-sobre-os-nossos-corpos.ghtml,Chandelly Braz enaltece o feminismo: 'Ainda estamos lutando para ter poder e autonomia sobre os nossos corpos'," Em Orgulho e Paixão, as cinco irmãs da família Benedito carregam personalidades fortes e bem distintas entre si. À Mariana, personagem de Chandelly Braz na trama das 6, coube o perfil da jovem aventureira. Fruto de uma família igualmente numerosa, a atriz de 33 anos consegue enxergar algumas semelhanças entre ficção e realidade. ""Na minha família somos quatro irmãos muito diferentes um do outro. O meu irmão mais novo, que tem 16 anos, é músico, então temos uma afinidade artística aí. Mas, dentro desse mosaico, acho que sou a aventureira também"", reflete.  Criada em Ipojuca, pequena cidade da zona metropolitana de Recife com pouco mais de 90 mil habitantes, Chandelly conta que seu interesse pela arte surgiu através da televisão. ""Eu era uma menina do interior que assistia a muita novela, e aquilo causava um certo fascínio em mim"", lembra.  Depois, na adolescência, um professor de literatura teve papel decisivo para que começasse a seguir neste caminho. ""Ele falou que, em ano de vestibular, ninguém deveria se envolver nem com teatro e nem com política. Fui perguntar por que, e ele disse que são coisas muito apaixonantes, que se você se envolve com isso não vai querer saber de mais nada"". E aí eu não passei no vestibular e pensei: 'Sabe do que mais? Vou fazer teatro!'"", diverte-se.  Hoje atuando em uma novela inspirada na obra da prestigiada escritora britânica Jane Austen, a atriz lembra que foi o mesmo professor que despertou seu interesse pela literatura. ""Não fui uma criança muito estimulada a ler, sabe? Mas na minha adolescência tive esse professor que foi um divisor de águas. Hoje leio menos do que gostaria, mas sou uma leitora assídua"", conta ela, que tem entre seus autores favoritos nomes como José Saramago, Machado de Assis e Guimarães Rosa. ""'O Grande Sertão: Veredas' é o livro da minha vida. Sou muito apaixonada por literatura brasileira"", completa.  Realizada com o novo trabalho, Chandelly comemora o fato de estar em uma novela que exalta o poder feminino. ""Acho o máximo, estou muito feliz. Não podemos deixar de perceber que é muito importante ter uma novela em que se fala de cinco mulheres. Isso não é comum"", opina a atriz, que ainda completa: ""É muito interessante olhar para trás e perceber que, em 1910, uma mulher queria só trabalhar, só isso. Como a Elisabeta, que quer ser dona da vida dela, ou minha personagem, que quer escolher o homem que vai casar"".  Engajada na causa feminista, Chandelly acredita que, mesmo hoje, mais de um século depois do período em que se passa a novela, ainda há muito o que ser conquistado pelas mulheres. ""Acho que estamos caminhando. Às vezes damos passos de formiga, às vezes damos passos mais largos. Ainda estamos lutando para ter poder e autonomia sobre os nossos corpos"", diz.  Mesmo mostrando-se tão empoderada em suas ideias e atitudes no dia a dia, Chandelly diz que não chega nem perto da força da personagem do século passado vivida na trama das 6: ""A Mariana é o máximo. Ela é muito mais maneira, muito mais interessante que eu"", diverte-se. ",famosos,,,,,,
2018-06-06,https://web.archive.org/web/20180607102437/https://gshow.globo.com/Famosos/noticia/gleici-e-wagner-do-bbb18-fazem-ensaio-exclusivo-para-o-gshow-veja-a-previa.ghtml,https://gshow.globo.com/Famosos/noticia/gleici-e-wagner-do-bbb18-fazem-ensaio-exclusivo-para-o-gshow-veja-a-previa.ghtml,"Gleici e Wagner, do 'BBB18', fazem ensaio exclusivo para o Gshow; veja a prévia!"," Em uma transmissão ao vivo nas redes sociais do Gshow e do Encontro com Fátima Bernardes, Lair Rennó deu um spoiler: ""Gleici e Wagner vão posar juntos"". O casal que se conheceu no BBB18 esteve nos Estúdios Globo, no Rio de Janeiro, para uma sessão de fotos exclusiva.  Diante das lentes da fotógrafa Isabella Pinheiro, eles mostraram todo o carinho entre os dois e ainda bateram um papo com o Gshow sobre os primeiros meses da relação. O ensaio completo você vai conferir na semana do Dia dos Namorados. Enquanto a data não chega, veja uma prévia! ",famosos,,,,,,
2018-06-07,https://web.archive.org/web/20180607102437/https://gshow.globo.com/Famosos/noticia/leticia-colin-fala-sobre-seu-visual-em-segundo-sol-uma-das-grandes-partes-da-carreira-e-poder-me-ver-diferente.ghtml,https://gshow.globo.com/Famosos/noticia/leticia-colin-fala-sobre-seu-visual-em-segundo-sol-uma-das-grandes-partes-da-carreira-e-poder-me-ver-diferente.ghtml,Letícia Colin fala sobre seu visual em 'Segundo Sol': 'Uma das grandes partes da carreira é poder me ver diferente'," Letícia Colin não tem medo de mudar. Pelo contrário. Só nos últimos doze meses, a atriz se transformou três vezes: após se despedir do visual da imperatriz Leopoldina em Novo Mundo, platinou o cabelo para gravar a série Cine Holliúdy e, na sequência, escureceu os fios para dar vida ao papel atual: a exuberante Rosa de Segundo Sol.  ""Mudar é o que me atrai. Quando o Fernando Torquatto [responsável pela caracterização] falou: 'morena', eu estava com o cabelo louro branco para fazer o 'Cine Holliúdy'. Falei 'cara, vamos fazer porque também acho que tem mais a ver com a personagem'"", conta.  ""Eu imaginava como ia ficar, mas nunca é o que a gente imagina. Passei uns dias tomando susto no espelho, falando 'ah, sou eu!' porque é muito diferente, né? Eu nunca tinha ficado com essa cor, mas eu estou apaixonada"", diz a atriz.  ""Estou achando incrível ser morena, é um novo mundo e as pessoas mudam quando elas se relacionam. Estou achando maravilhoso! Aliás, acho incrível essa coisa de pensar na composição, que vai desde a pele até a voz. E aí a pele mais bronzeada também entra nisso"", explica.  Além das mudanças externas, Letícia revela que Rosa também tem provocado algumas transformações internas também.  ""De repente me cai no colo essa personagem quente, baiana, cheia de opinião e liberdade, de uma fluidez e de uma coragem, então sou muita grata. Cada personagem vem para a gente ser chacoalhado, para fazer pensar, evoluir, desfazer crenças e levar isso para o público. Atravessar as pessoas também com novos pensamentos"", continua.  ""É o que me interessa: mudar de ideia, repensar. A vida é muito ampla e, como ator, a gente pode olhar um pouco mais longe. Você dá um zoom nas suas verdades e nas suas convicções"". ",famosos,,,,,,
2018-06-07,https://web.archive.org/web/20180607102437/https://gshow.globo.com/Famosos/noticia/marco-nanini-completa-70-anos-e-relembra-passagens-marcantes-na-carreira-vivi-momentos-incriveis.ghtml,https://gshow.globo.com/Famosos/noticia/marco-nanini-completa-70-anos-e-relembra-passagens-marcantes-na-carreira-vivi-momentos-incriveis.ghtml,Marco Nanini completa 70 anos e relembra passagens marcantes na carreira: 'Vivi momentos incríveis'," Parabéns! Quem comemora aniversário neste 31 de maio é o ator Marco Nanini. No ar como o rei Augusto em Deus Salve o Rei, o pernambucano comemora a data com o Gshow, relembrando momentos marcantes de sua carreira.  ""Uma das experiências mais fortes foi dar vida ao Lineu, de 'A Grande Família'. Isso é mágico e a arte tem essa função de emocionar a todos"", lembra ele, que dá a receita para manter a saúde e o fôlego.  À frente do Galpão da Gamboa há quase 10 anos, em parceria com o produtor Fernando Libonati, Nanini ressalta que dar oportunidade a jovens carentes e idosos é transformador. ""Acredito que a solidariedade é fundamental para promover a troca de experiências"", resume ele, que se emociona ao falar de seu projeto social no Morro da Providência, na Zona Portuária do Rio de Janeiro.  ""O Galpão veio para alimentar o meu coração, e é um jeito que encontrei de contribuir para um mundo melhor. Promover a arte me dá muito prazer"", diz ele, que se pudesse escolher um presente, destacaria a compaixão. ""Gostaria de ver uma maior solidariedade entre as pessoas. Tem muita gente precisando de muita coisa para diversas atividades. É preciso incentivar alguma coisa, acredito nisso"", afirma Nanini, que estreou na TV há mais de 50 anos. ",famosos,,,,,,
2018-06-14,https://web.archive.org/web/20180614104444/https://gshow.globo.com/Famosos/noticia/jaffar-bambirra-lanca-clipe-com-participacao-de-pally-siqueira.ghtml,https://gshow.globo.com/Famosos/noticia/jaffar-bambirra-lanca-clipe-com-participacao-de-pally-siqueira.ghtml,Jaffar Bambirra lança clipe com participação de Pally Siqueira ," Jaffar Bambirra foi apresentado ao público no ano passado, ao estrear na TV como o romântico Márcio, de Pega Pega. Mas, além da interpretação, este carioca de apenas 19 anos também carrega outros talentos. Apaixonado por música, ele acaba de lançar sua primeira canção autoral, 'Ilustração'. Gravado no sítio de sua família em Cachoeiras de Macacu, no Rio de Janeiro, o clipe da música conta com a participação da atriz Pally Siqueira.  A relação do ator com a música começou cedo. ""Eu praticamente nasci cantando, mas não levei a sério até os 11 anos, que foi quando comecei a tocar violão e compor. A partir daí, isso passou a ser meu foco"", explica Jaffar. O teatro, aliás, só entrou em sua vida por causa da música. “Com 15 anos, comecei a estudar teatro, mas pensando em me soltar mais, melhorar a presença de palco. Só que me apaixonei e agora faço as duas coisas"", diz.  Sua primeira música de trabalho, 'Ilustração' foi composta há cerca de quatro anos. ""Foi em uma época que eu estava há muito tempo sem compor, não saía nada. Estava escutando muito Bob Dylan, uma galera folk, e a música acabou surgindo assim nessa pegada. Quando terminei, vi que tinha ficado legal"", conta.  O primeiro teste da canção com o público foi nas rodinhas de amigos, até que o produtor musical Pedro Mamede sugeriu produzi-la. ""Ele tem um estúdio e começamos a fazer tudo no amor. Fomos captando os músicos, trocando o trabalho deles por hora de estúdio, e a música foi tomando forma de verdade"", lembra Jaffar. Tudo isso aconteceu durante as gravações da reta final de Pega Pega.  Com a música pronta, era hora de lançá-la em grande estilo. E coube à mãe de Jaffar – a atriz e diretora de TV e teatro, Nadia Bambirra – a conceituação do roteiro do clipe. Já a ideia de convidar Pally Siqueira para pintar uma aquarela ao longo da gravação casou com o tema da canção. ""Sempre nos encontros da galera, quando está todo mundo lá conversando, tocando, ela pergunta se pode pintar a parede e faz artes lindas"", conta Jaffar, que conheceu a atriz no ano passado, em um sarau de amigos em comum.  Agora, o quadro pintado pela atriz, que atualmente vive Amanda em Malhação – Vidas Brasileiras, está guardado no sítio da família de Jaffar. ""É muito bom, porque agora tenho uma recordação desse primeiro clipe que vai ficar para sempre"", comemora ele.  Após lançar a primeira música, Jaffar já tem novos planos. Confirmado para um novo trabalho na TV Globo, ele também trabalha na produção de seu próximo single, 'Quando Fui Seu Par'. Se vai conseguir conciliar as carreiras de músico e ator? ""Nem eu sei ainda, só sei que quero fazer os dois e meu sonho é conseguir conciliar. Ainda sou muito jovem, acho que dá para tocar os dois projetos"", acredita. ",famosos,,,,,,
2018-06-14,https://web.archive.org/web/20180614104444/https://gshow.globo.com/Famosos/noticia/gleici-e-wagner-celebram-primeiro-dia-dos-namorados-juntos-e-falam-da-vida-pos-bbb.ghtml,https://gshow.globo.com/Famosos/noticia/gleici-e-wagner-celebram-primeiro-dia-dos-namorados-juntos-e-falam-da-vida-pos-bbb.ghtml,Gleici e Wagner celebram primeiro Dia dos Namorados juntos e falam da vida pós-BBB," Gleici foi a grande campeã do BBB 18 – mas, além do prêmio de um milhão e meio de reais, a acreana saiu do reality show com algo que nem imaginava: um namorado! O romance com Wagner começou devagarzinho e muita gente nem acreditava que iria para frente fora da TV, mas os dois mostraram que têm muito em comum e, quase dois meses depois do fim do programa, a relação vai muito bem, obrigada! Para celebrar o primeiro Dia dos Namorados juntos, eles protagonizaram um ensaio especial para o Gshow e falaram sobre a vida pós-BBB, a relação e os planos para o futuro.  Ao lembrar do início da relação, a estudante de psicologia acha graça em perceber como tudo aconteceu. ""É bem engraçado, né? Porque nos conhecemos morando na mesma casa"", diverte-se ela, que ainda pondera: ""Mas acho que foi uma coisa boa, porque nos acostumamos com os hábitos um do outro. Já sabemos que conseguimos viver juntos"".  Wagner acredita que a cautela no início foi essencial para que o namoro desse certo depois do programa. ""Foi primordial para que a relação tivesse uma base muito sólida. Nesse tempo, nos conhecemos bem, expusemos nossos medos, nossos traumas, nossas falhas. E, a partir daí, construímos uma relação de muita cumplicidade e confiança"", opina.  Gleici conta que um de seus medos antes do programa era não encontrar ninguém com quem se identificasse dentro da casa. ""Olhando de fora, eu imaginava: 'Vou ficar 'tretando' com esse pessoal o tempo todo', porque as opiniões divergem muito"", conta ela, que logo se derrete pelo namorado: ""Mas aí eu conheci o Wagner, que é uma pessoa que tem tudo a ver comigo, que pensa coisas bem parecidas com as que eu penso, e que eu nunca imaginei encontrar"".  Longe das câmeras, o casal tem curtido o namoro com a privacidade que a casa mais vigiada do Brasil não permitia – e Wagner prometeu muitas surpresas para comemorarem seu primeiro Dia dos Namorados. Com a vida ainda muito agitada devido aos compromissos após o programa, é preciso conciliar as agendas para aproveitar os momentos a dois. ""No tempo livre, estamos sempre juntos"", garante o artista visual.  Ele acredita que a distância também ajuda a fortalecer o relacionamento. ""Faz com que a gente tenha tempo para sentir saudade, sentir mais vontade de estar junto e reafirmar os sentimentos. Na ausência da Gleici, eu sinto a falta dela e das coisas que ela me traz. E quando nos vemos é muito mágico"", conta.  Não bastasse a novidade do primeiro namorado, a relação com o curitibano tem outras particularidades para Gleici. Além da diferença de idade de 13 anos, o artista visual tem dois filhos pequenos. ""Nunca fiquei com ninguém que tivesse filhos e aí meu primeiro namorado tem dois! Eu ficava imaginando como ia ser, mas tenho uma boa relação com crianças e as dele são sensacionais. Foi um momento muito legal quando os conheci"", conta ela sobre Benjamin e Giovanna. ""Acho que sou uma boa madrasta"", brinca.  Quando o assunto é encurtar as distâncias que separam o Acre de Curitiba, a campeã do BBB afirma que ainda não estão pensando em morar juntos, mas não descarta a possibilidade. ""A gente se gosta bastante e a distância às vezes é muito ruim, então temos que encontrar um meio termo"", explica a morena, que prefere não se apegar às regras impostas pela sociedade. ""Não ligo para essa questão de 'ah, tem que dar um tempo para morar junto'. Se está com vontade, mora. Se não tem vontade, não mora. Se quiser casar no primeiro dia, casa! Só depende do que você quer e, se quiser, faz!"", acredita.  Por enquanto, os dois só querem saber de curtir todo o tempo que têm juntos – e Gleici é só elogios ao namorado. ""Ele cuida muito de mim, está sempre atento. Qualquer coisa que eu peço, ele está prontinho. É muito bonitinho, acho que isso que fez ele me conquistar"", confessa.  Wagner explica: ""Acho que para tudo na vida temos que estar muito atentos aos sinais, sabe? E eu sou muito observador. Isso me faz estar sempre atento às demandas dela. E as demandas dela dizem respeito às minhas também. Então é uma troca mesmo"", acredita o artista visual, que não perde a chance de apontar as qualidades da namorada. ""Ela é muito empoderada, se comporta de maneira a fazer as pessoas refletirem. Isso para mim é fundamental"".  Ficha técnica  Maquiagem: Fernanda Loge  Cabelo: Tatiane Pomoceno  Figurino: Mara Santos  Fotografia: Isabella Pinheiro  Reportagem: Thaís Meinicke  Mídias sociais: Larissa Kurka  Imagens e edição: Luisinho Silva  Produção: Juliana Pinna ",famosos,,,,,,
2018-06-14,https://web.archive.org/web/20180614104444/https://gshow.globo.com/Famosos/noticia/na-vespera-do-dia-dos-namorados-famosos-relembram-momento-em-que-perceberam-que-estavam-apaixonados.ghtml,https://gshow.globo.com/Famosos/noticia/na-vespera-do-dia-dos-namorados-famosos-relembram-momento-em-que-perceberam-que-estavam-apaixonados.ghtml,"Na véspera do Dia dos Namorados, famosos relembram momento em que perceberam que estavam apaixonados"," Quem já se apaixonou alguma vez na vida, sabe: sempre existe aquele momento em que você percebe que está caidinho de amores pela pessoa que está ao seu lado. Na véspera do Dia dos Namorados, o Gshow bateu um papo com Claudia Leitte, Adriane Galisteu e Lucas Lima e fez a mesma pergunta aos três: ""Qual foi o momento em que você percebeu que estava apaixonado?"" Assista ao vídeo e confira!  Casada com Márcio Pedreira e mãe dos fofíssimos Davi e Rafael, Claudia Leitte diz que, no seu caso, foi paixão à primeira vista - e aos 13 anos, diga-se de passagem.  ""Depois, com uns 20 e poucos anos, a gente sentou junto em um restaurante porque tínhamos amigos em comum e, quando olhei para a pintinha no rosto dele, pensei: 'É o Marcinho da minha escola'. Naquele momento, meu coração disparou de novo. Então acho que me apaixonei aos 13 mesmo.""  No caso de Lucas Lima e Sandy, foram vários momentos. ""Eu e a Sandy nos conhecemos em um show da Família Lima. A gente ficou superamigo e começamos a nos falar bastante pelo telefone. Eu tinha 16 anos. Essa foi a primeira vez que a gente se apaixonou, mas tiveram várias outras"", conta.  Casada há dez anos com o empresário Alexandre Iódice, Galisteu contou que, para ela, uma viagem juntos foi o que selou sua paixão pelo marido. ""Acho que o primeiro sinal da paixão é aquele que você quer falar com a pessoa de qualquer jeito. Essa urgência de querer falar foi o meu primeiro sinal da paixão"", relembra. ",famosos,,,,,,
2018-06-14,https://web.archive.org/web/20180614104444/https://gshow.globo.com/Famosos/noticia/flavia-alessandra-celebra-os-44-anos-e-faz-balanco-da-vida-o-aniversario-deixa-a-gente-mais-reflexiva.ghtml,https://gshow.globo.com/Famosos/noticia/flavia-alessandra-celebra-os-44-anos-e-faz-balanco-da-vida-o-aniversario-deixa-a-gente-mais-reflexiva.ghtml,Flávia Alessandra celebra os 44 anos e faz balanço da vida: 'O aniversário deixa a gente mais reflexiva'," Marque a data: 7 de junho é o dia de Flávia Alessandra! A atriz, que completa 44 anos nesta quinta-feira, só tem motivos para comemorar. Linda, talentosa e recém-chegada de uma viagem de cruzeiro pelo Caribe ao lado das filhas Giulia e Olivia - que incluiu uma parada na Disney, em Orlando - a atriz, que é casada com o apresentador Otaviano Costa, do Vídeo Show, retornou ao Brasil para poder celebrar a data com a família completa.  No dia do aniversário, Flávia bateu um papo com o Gshow e falou sobre família, balanço de vida e cuidados de beleza, entre outros assuntos.  Por conta disso, Flávia garante que não importa o tamanho da comemoração, o importante é estar ao lado das pessoas que são mais próximas de si. ""Hoje, as minhas prioridades são outras e comemorar ao lado da minha família é o mais importante, então, consequentemente, prefiro algo mais discreto. Em momentos assim, estar rodeada de amor e carinho é o ideal"", conta.  A atriz também conta que costuma aproveitar a data para refletir e fazer um balanço da vida. ""Sem dúvida, acho que o aniversário deixa a gente mais reflexiva mesmo. Vivi coisas muito diferentes há dez, 20, 30 anos atrás, então é muito difícil fazer uma comparação"".  ""Acredito que estamos sempre em constante evolução e aprendendo através das nossas experiências"", complementa.  Flávia também dá detalhes sobre sua rotina de cuidados de beleza - e conta que o passo a passo mudou após os 40.  ""Uso produtos específicos para a minha idade e para a minha pele também"", explica. Como complemento, a atriz também mantém uma rotina de exercícios e alimentação saudável. ""Mas sem neuras!"", garante.  ""Faço aula com o Rafa Lund e ele sempre muda a rotina de exercícios. Às vezes, fazemos algo na academia; em outras, pratico os exercícios em casa ou em centros de performance circense para tornar a atividade mais dinâmica e divertida"", explica. ",famosos,,,,,,
