data,url_noticia,url_noticia_curto,titulo,conteudo_noticia,assunto,assunto_ex,titulo_ex,subtitulo_ex,local_ex,artigo_ex,n_paragrafos
2018-09-12,https://web.archive.org/web/20180912040607/https://globoesporte.globo.com/futebol/selecao-brasileira/noticia/tite-foi-a-retomada-de-uma-equipe-alegre-e-agressiva.ghtml,https://globoesporte.globo.com/futebol/selecao-brasileira/noticia/tite-foi-a-retomada-de-uma-equipe-alegre-e-agressiva.ghtml,"Tite minimiza nível do adversário e comemora: ""Foi a retomada de uma equipe alegre e agressiva"""," O técnico da seleção brasileira, Tite, aprovou a atuação da equipe na goleada por 5 a 0 sobre El Salvador na noite desta terça-feira, em Washington. Mesmo com muitas mudanças em relação à vitória anterior, sobre os Estados Unidos, o Brasil dominou toda a partida desde o início e não deu chances ao frágil rival.  - Uma ideia de futebol permanece inalterada e independe de adversário: manter posse de bola e agressividade, infiltração, finalização, é a nossa característica, é um jeito que eu gosto. A gente vai encontrando soluções, para manter verticalidade. Variações de atletas acabam sendo importantes. Foi uma retomada de uma equipe que é alegre e agressiva para jogar. Produz, desempenha e toma a iniciativa independentemente do nível técnico do adversário. Ela tem o DNA do gol, de vertical, de agredir e pressionar. Jogamos constantentemente com a pressão alta e conseguimos trabalhar o tempo todo com essa rotação.  Autor de dois gols em seu primeiro jogo como titular, além de ter sofrido o pênalti convertido por Neymar logo a dois minutos de partida, o atacante Richarlison foi elogiado pela comissão técnica:  - Acompanhamos o Richarlison até antes da Copa. Foi bem no Watford, é difícil começar tão bem na Inglaterra. Agora começou muito bem no Everton. Temos outras boas opções pelo lado, mas surgiu a chance na situação do Pedro (cortado por lesão). Richarlison agrada pelo perfil e sabe fazer gol - completou o auxiliar Sylvinho.  - Richarlison não olha para o lado, olha para o gol. Tem infiltração - completou Tite.  Alguns jogadores deixaram Washington logo depois do jogo e nas primeiras horas desta quarta-feira. O restante da delegação viaja ao longo do dia. A Seleção volta a campo em outubro para enfrentar Arábia Saudita e Argentina.  Confira outros trechos da entrevista de Tite:  NÍVEL DOS ADVERSÁRIOS  - A gente não tem a oportunidade de escolher europeus, é uma informação. As outras estamos procurando, vamos pegar Argentina... Já passei da idade de desconstruir críticas. Os Estados Unidos empataram com a França antes da Copa. São dois estágios nisso. De uma equipe com bola, o que ela busca, e no nível do adversário... Mas ai tu faz o seu papel, pressiona o adversário. Esse estágio com a posse de bola é fundamental.  NOVIDADES NO TIME  - Por mais capacidade que um cara tenha, a equipe por si só é um organismo vivo, ela se mostra. Nós estávamos com a ideia de segurar o Neymar, mas nós temos a opção de deixá-lo em uma função central, para entrar o Paquetá para fazer as combinações, como estava fazendo com o Coutinho. O Arthur ele modula um pouquinho. Esses jogadores jovens vão ganhando corpo e adquirindo confiança. E a comissão técnica vai ter um tempo de observação.  POSSE DE BOLA COM FINALIZAÇÃO  - Muita gente relativiza, mas a equipe manteve o desempenho em 90 minutos. Deve ter tido mais de 70% de posse de bola. Mas não adianta ter posse de bola se não tiver finalizações. O melhor jogador de El Salvador foi o goleiro. Quando a equipe mantém esse padrão...  - Inclusive com Neymar infiltrado, e bem municiados pelos flechas, pelas pontas. Nós estamos muito bem municiados com nomes pelos lados do campo. Até mesmo os que não foram convocados como Malcom, David Neres, Vinícius Júnior...  VERSATILIDADE NA DEFESA  - Os dois jogaram assim no Porto, Felipe e Militão, e trouxe o Marquinhos para a lateral. Eu lembro quando o Marquinhos surgiu no Corinthians e o presidente Mario Gobbi falava que ele era a nossa pérola. Eu só não sabia, Marquinhos ainda com 17 anos, se iria jogar como lateral, zagueiro ou volante. Hoje, cinco anos depois, ele continua jogando nas três funções.  OPÇÕES DE CAMISA 9  - Os três atacantes eles são da posição e fazem movimentos por vezes diferentes. O Firmino, por ter sido meia, ele sai de uma função de nove e vem fazer o meio-campo, como ele faz no Liverpool. E tem presença de área. Tanto Richarlison quanto Gabriel Jesus são parecidos, eles te dão mais profundidade. ",esportes,,,,,,
2018-09-12,https://web.archive.org/web/20180912040607/https://globoesporte.globo.com/futebol/selecao-brasileira/noticia/atuacoes-richarlison-brilha-e-neymar-e-coutinho-vao-bem-como-coadjuvantes.ghtml,https://globoesporte.globo.com/futebol/selecao-brasileira/noticia/atuacoes-richarlison-brilha-e-neymar-e-coutinho-vao-bem-como-coadjuvantes.ghtml,"Atuações: Richarlison brilha, e Neymar e Coutinho vão bem como coadjuvantes"," Neto: Não teve trabalho algum e foi um simples espectador em campo. Difícil até de avaliar. Nota: 6,0  Éder Militão: Defensivamente, El Salvador não deu quase nada de trabalho - e até mudou de posição com Marquinhos no segundo tempo. Ofensivamente, foi bem. Merece elogios pela estreia. Nota: 7  Dedé: Por conta do compromisso com o Cruzeiro nesta quarta pela Copa do Brasil, jogou apenas os primeiros 45 minutos, justamente quando o time de El Salvador menos deu trabalho. Nota: 6,5  Marquinhos: No mesmo patamar de Dedé, com algumas diferenças. O ataque de El Salvador deu um pouco mais de trabalho na etapa final e ainda deixou o seu gol, de cabeça, no apagar das luzes. Foi observado como lateral-direito no fim do jogo. Nota: 7,5  Alex Sandro: No mesmo nível do restante da defesa. Não comprometeu, mas, ofensivamente, poderia ter aproveitado melhor a oportunidade. Nota: 6,5  Casemiro: Como de hábito, atuação segura e confiável. Teve a vida facilitada pela fragilidade do ataque adversário. Nota: 7  Arthur: Foi bem em sua primeira partida pela seleção brasileira. Ganhou bem na defesa e apareceu bem no ataque. Boa estreia como titular. Nota: 7,5  Philippe Coutinho: Não brilhou, como já se viu em outras ocasiões pela Seleção, mas teve seus momentos, inclusive marcando o seu gol e participando diretamente de outro (o segundo de Richarlison). Nota: 7,5  Douglas Costa: Nome do jogo contra os Estados Unidos, voltou a jogar bem. Não foi peça decisiva para a goleada, mas deu muito trabalho para a defesa salvadorenha. Impressionou mais uma vez pela velocidade: alcançou 36,2 km/h no lance em que disparou da pequena área do Brasil e deixou Neymar na cara do gol (o camisa 10 desperdiçou a chance após driblar o goleiro). Nota: 8  Neymar: Assistindo ao jogo, pode ter dado a impressão de que poderia ter jogado mais, sobretudo por cozinhar o jogo com a goleada resolvida no segundo tempo. Mas, aos olhos frios dos números, deu três assistências e ainda deixou o seu, ao abrir o placar de pênalti aos três de jogo. Ganhou a maioria dos lances. Nota: 8  Richarlison: O nome do jogo. Sofreu o pênalti no lance do gol de Neymar e ainda fez dois gols com méritos de atacante oportunista. Saiu aos oito da etapa final com a sensação de que fez o dever de casa com louvor para o professor Tite em sua primeira partida como titular. Nota: 8,5  Felipe: entrou no intervalo, no lugar de Dedé, e viu o adversário dar um pouco mais de trabalho. Nada de muito significativo. Esteve no mesmo nível do companheiro. Nota: 6,5  Fred: Mais um que entrou no intervalo e manteve o nível do companheiro. Nota: 6,5  Paquetá: Entrou com a partida resolvida e pegou a seleção brasileira já acomodada com o resultado. Como destaque, um bom chute rasteiro da entrada da área que deu trabalho ao goleiro. Nota: 7  Willian: Dá para usar exatamente a mesma avaliação de Paquetá. Entrou com a partida resolvida e, apesar de tentar uma jogada ou outra, pegou a seleção brasileira já acomodada com o resultado. Nota: 7  Everton: Dos que entraram na etapa final, foi o melhor. Buscou jogo, teve chances e poderia ter feito o seu. Perdeu duas boas oportunidades. Deve ter agradado a Tite. Nota: 7,5  Andreas Pereira: Entrou basicamente para fazer sua estreia na Seleção. Além do goleiro Hugo, era o único que não tinha mostrado seus serviços até substituir Arthur aos 29 da etapa final. Nota: 6,5 ",esportes,,,,,,
2018-09-12,https://web.archive.org/web/20180912040607/https://globoesporte.globo.com/futebol/times/vasco/noticia/torcedores-do-vasco-vao-ao-ct-e-ameacam-luiz-gustavo-se-perder-para-o-flamengo.ghtml,https://globoesporte.globo.com/futebol/times/vasco/noticia/torcedores-do-vasco-vao-ao-ct-e-ameacam-luiz-gustavo-se-perder-para-o-flamengo.ghtml,"Torcedores do Vasco vão ao CT e fazem ameaça ao elenco: ""Se perder para o Flamengo..."""," Dois grupos de torcedores do Vasco foram ao CT do Almirante, em Vargem Pequena, na tarde desta terça-feira, para protestar contra os maus resultados da equipe no Campeonato Brasileiro (quatro derrotas seguidas) e a proximidade da zona de rebaixamento (16º lugar, com 24 pontos). O zagueiro Luiz Gustavo, como registrou um dos vascaínos, foi um dos que ouviu as ameaças feitas ao time.  + Wagner prova não recolhimento de FGTS, e Justiça determina rescisão de contrato com o Vasco  Com a janela do carro aberta, Luiz Gustavo ouviu gritos de ordem dos cruz-maltinos e avisos de que ""vão quebrar tudo"" se o time não vencer o Flamengo no sábado, às 19h (de Brasília), no Mané Garrincha.  Depois do primeiro grupo, outros vascaínos chegaram ao CT em um ônibus, soltaram fogos e permaneceram na porta.  + Quarteto volta a treinar com elenco e se aproxima de retorno ao Vasco  Enquanto aguardavam a saída de outros atletas, os torcedores interceptaram o carro do auxiliar Valdir Bigode para conversar com ele. Vários outros veículos saíram, mas só com motorista. Os jogadores permaneceram dentro do centro de treinamento aguardando o fim do protesto e deixaram o local quando a situação foi controlada.  Seja Sócio Torcedor Gigante. Confira os novos planos! ",esportes,,,,,,
2018-09-12,https://web.archive.org/web/20180912040607/https://globoesporte.globo.com/futebol/times/flamengo/noticia/insatisfacao-sem-fim-fla-emite-nota-de-repulsa-contra-decisoes-da-cbf-lisura-em-semi-com-o-corinthians.ghtml,https://globoesporte.globo.com/futebol/times/flamengo/noticia/insatisfacao-sem-fim-fla-emite-nota-de-repulsa-contra-decisoes-da-cbf-lisura-em-semi-com-o-corinthians.ghtml,Insatisfação sem fim: Fla emite nota de repulsa contra decisões da CBF e cobra lisura em semi com o Corinthians," O Flamengo escreveu mais um capítulo nas polêmicas que antecedem a semifinal da Copa do Brasil diante do Corinthians, quarta-feira, às 21h50 (de Brasília), no Maracanã.  Depois do presidente, Eduardo Bandeira de Mello, e do treinador Maurício Barbieri manifestarem a insatisfação por episódios diversos, a entidade emitiu nota oficial contra a Confederação Brasileira de Futebol (CBF).  Veja o que já rolou nos bastidores da semifinal:  No texto, publicado no site oficial do clube no início da noite, o Flamengo cita especificamente o imbróglio envolvendo a convocação de Lucas Paquetá para os amistosos da seleção brasileira e o sorteio do árbitro Bráulio da Silva Machado para o duelo com os corintianos. Confira abaixo a íntegra da nota oficial:  Veja a nota na íntegra:  ""O Clube de Regatas do Flamengo vem a público manifestar sua repulsa às recentes decisões da Confederação Brasileira de Futebol (CBF), em especial os fatos que envolveram a convocação do atleta Lucas Paquetá para os amistosos da Seleção Brasileira contra Estados Unidos e El Salvador e a escalação de Bráulio da Silva Machado para apitar a partida contra o Corinthians, nesta quarta-feira, pelas semifinais da Copa do Brasil.  No caso específico dos amistosos da seleção, chama a atenção a intransigência da CBF em relação às alternativas apresentadas pelo Flamengo para que pudesse contar com o atleta convocado. Foram sugeridas a mudança da data do primeiro confronto contra o Corinthians e a liberação da participação de Lucas Paquetá na partida contra El Salvador, um adversário de valor duvidoso para a preparação do Brasil. A entidade, no entanto, manteve-se inflexível. Vale lembrar que o Flamengo teve também as convocações do volante Cuéllar, pela Colômbia, e do lateral-esquerdo Trauco, que, somadas à convocação de Paquetá e à inadequação do calendário, tiraram os jogadores de duas partidas do Campeonato Brasileiro, claramente provocando desequilíbrio técnico na principal competição administrada pela entidade.  Já a escalação do arbitro Bráulio da Silva Machado para a partida desta quarta-feira é absurda. Foi ele quem teve atuação lamentável no jogo entre Palmeiras e Flamengo no primeiro turno do Campeonato Brasileiro. Na ocasião, deixou de expulsar o jogador Felipe Melo após entrada criminosa em Vinicius Jr, ato que poderia ter causado séria lesão ao jovem atleta. Além disso, terminou a partida antes do tempo previsto, sendo que o adversário estava neste momento atuando com um volante no lugar do goleiro que havia sido expulso, impedindo que o Flamengo buscasse os três pontos nos momentos finais do jogo.  Esses fatos e outras ocorrências recentes fazem com que o Flamengo sinta-se sistematicamente prejudicado pela atual gestão da CBF, o que hoje já nos permite concluir ser resultado da postura adotada pelo clube em relação à governança da entidade.  O Flamengo possui uma história de conquistas, tem a maior torcida do Brasil, é dono das maiores audiências em transmissões dos jogos pela televisão, conta com a maior média de público em estádios do ano e, portanto, clube e seus torcedores merecem respeito. Estivesse realmente interessada em mudar a imagem desgastada do nosso futebol, a CBF deveria tratar todos os seus filiados com igualdade e isenção e não fustigar com ações de bastidores aqueles que, como o Flamengo, são incansáveis na busca pela real profissionalização do futebol brasileiro.  Por fim, após todos esses episódios lamentáveis, o Flamengo exige que a classificação à final da Copa do Brasil e as rodadas restantes do Campeonato Brasileiro sejam decididas exclusivamente pela capacidade dos jogadores dentro de campo.  Clube de Regatas do Flamengo""  Sinta a emoção de ser sócio-torcedor do Mengão e tenha muitas vantagens - clique aqui! ",esportes,,,,,,
2018-09-13,https://web.archive.org/web/20180913045001/https://globoesporte.globo.com/futebol/times/flamengo/noticia/mauricio-barbieri-diz-que-flamengo-encurralou-corinthians-e-espera-mais-espacos-no-jogo-de-volta-em-sao-paulo.ghtml,https://globoesporte.globo.com/futebol/times/flamengo/noticia/mauricio-barbieri-diz-que-flamengo-encurralou-corinthians-e-espera-mais-espacos-no-jogo-de-volta-em-sao-paulo.ghtml,"Mauricio Barbieri diz que Flamengo ""encurralou"" Corinthians e espera mais espaços no jogo de volta em São Paulo"," Depois do empate por 0 a 0 com o Corinthians no Maracanã (veja os melhores momentos no vídeo acima), Mauricio Barbieri lamentou não traduzir em gol a superioridade do Flamengo jogando em casa pela semifinal da Copa do Brasil. Para o técnico, sua equipe ""encurralou"" o adversário, porém encontrou poucos espaços. Mas em São Paulo ele espera um jogo diferente.  - Os números refletem o que foi o jogo. Números que tenho são de mais de 70% (de posse de bola), mais de 20 finalizações, adversário quase não finalizou. Encurralamos o time dele, não trocaram mais do que três ou quatro passes, recuperamos rápido, tentamos, finalizamos, cruzamos bola, tentamos mudar o panorama.  Na partida de volta, qualquer empate leva a decisão para a disputa de pênaltis. Quem vencer na Arena Corinthians garante vaga na final da Copa do Brasil e enfrenta o vencedor de Cruzeiro x Palmeiras - os mineiros saíram na frente fora de casa: 1 a 0.  Mais sobre a superioridade rubro-negra- O Cássio não fez defesas milagrosas, mas fez defesas. Não faltou agressividade. Buscamos o gol com inteligência, não adianta desesperar. Tivemos o controle absoluto do jogo, mas não fizemos o gol. Está aberto. Teremos mais 90 minutos para buscar esse gol.  Mudar a forma de jogar- Já usamos o Vitinho para ter mobilidade, já colocamos dois centroavantes. Buscamos variações.  Centroavantes - Temos escolhido em função da característica do adversário. Em função do que o adversário apresenta, podemos usar a potencialidade de um ou outro. Os adversários vêm muito fechados e fica difícil circular dentro da hora. Temos que buscar variações de jogadas. É preciso que saibam que sabemos que temos o que melhorar. São 54 dias sem semana cheia para trabalhar. Agora, vamos pensar no Vasco, que é muito importante, e depois teremos uma semana.  Poucos gols em mata-mata- Se pegar esse recorte, você tem razão. Se pegar o Brasileiro, somos o melhor mandante.  Cogita abrir mão da posse para ter espaços?- É uma pergunta complicada. A partir do momento que eu ofereço a iniciativa ao adversário, tenho menos tempo para criar. É uma questão delicada. Se o jogo fosse um pouco mais franco, no sentido do adversário tentar criar um pouco mais, seria diferente. Temos questões a serem solucionadas e vamos tentar achar no tempo para trabalhar.  Opção de Paquetá mais avançado- Todos os meias têm tido um bom desempenho, o número de gols mostra isso. A possibilidade de usar o Paquetá mais adiantado existe e já usamos, mas vai depender das características do adversário e do jogo.  Insistência na bola aérea- Desespero não é de maneira nenhuma. Nossa ideia não é ter a posse de bola pela posse de bola. É uma posse que tem mérito. Quando o Corinthians tentou jogar, sufocamos e recuperamos. Sobre alçar bola na área, não é desespero. Quando usamos Dourado e Lincoln, homens de área, temos que fazer a bola chegar lá dentro.  Uribe- Não conseguiu ter oportunidades claras. Não fomos capazes de oportunizar e não podemos jogar toda responsabilidade. Vamos seguir analisando a característica do adversário para fazer as escolhas.  Arbitragem- Acho que ele fez um bom jogo, seguro e está de parabéns. Reconheço isso. Não tivemos polêmicas. Mas não mudo o que disse antes de que grandes jogos são para grandes árbitros. E tem que ser com escudo da Fifa.  Flamengo cria pouco para os centroavantes?- Cinco chances claras acho que é um número razoável. Temos que achar soluções para que a bola chegue em melhor condição. Passa também pelo posicionamento deles. Não temos tido tempo para ajustar. Passa também pelo adversário. Por isso, tentamos ajustar de acordo com as características.  Sinta a emoção de ser sócio-torcedor do Mengão e tenha muitas vantagens - clique aqui! ",esportes,,,,,,
2018-09-13,https://web.archive.org/web/20180913045001/https://globoesporte.globo.com/futebol/times/palmeiras/noticia/mattos-reclama-de-lance-determinante-para-derrota-do-palmeiras-e-espera-que-arbitro-seja-punido.ghtml,https://globoesporte.globo.com/futebol/times/palmeiras/noticia/mattos-reclama-de-lance-determinante-para-derrota-do-palmeiras-e-espera-que-arbitro-seja-punido.ghtml,"Mattos reclama de ""lance determinante"" para derrota do Palmeiras e espera que árbitro seja punido"," O Palmeiras não demorou a se posicionar a respeito do lance polêmico no último minuto da derrota por 1 a 0 para o Cruzeiro, na noite desta quarta-feira, na arena, pela primeira semifinal da Copa do Brasil.  O clube reclama de uma falta marcada dentro da área em jogada que terminou com gol invalidado de Antônio Carlos. O árbitro Wagner Reway assinalou falta de Edu Dracena no goleiro Fábio antes de o outro zagueiro palmeirense empurrar a bola à rede (veja mais abaixo).  A recomendação da Fifa é de que os árbitros esperem o decorrer do lance para apitar ou levantar a bandeira, o que permitiria a consulta ao VAR – que tem sido utilizado nesta reta final da Copa do Brasil.  – O que estranhou é o despreparo que eles próprios têm – disse o diretor de futebol do Palmeiras, Alexandre Mattos.  – O Sérgio Corrêa (da Silva, chefe do departamento de arbitragem da CBF) esteve no meu vestiário antes do jogo. Ele disse para mim e para o Felipão: Alexandre, avise seus jogadores que lance capital é para seguir até o fim, depois vamos ver no VAR o que aconteceu – relatou o dirigente.  Mattos cobrou que Reway seja punido pela Confederação Brasileira de Futebol.  – Ele foi contra a própria recomendação da CBF. A gente espera que ele seja punido por isso. Por isso, gera essa confusão toda. Ele (árbitro) parou o lance antes, de maneira precipitada, contra a recomendação deles próprios. Por isso, fazem a gente vir aqui e falar especificamente de um lance que foi determinante, sem dúvida alguma – reclamou o dirigente palmeirense.  Com a derrota por 1 a 0, o Palmeiras precisará vencer por dois gols de diferença no Mineirão, no dia 26, para avançar à final da Copa do Brasil. Se devolver a diferença na capital mineira, a vaga será decidida nos pênaltis. ",esportes,,,,,,
2018-09-13,https://web.archive.org/web/20180913045001/https://globoesporte.globo.com/rj/futebol/noticia/justica-determina-cancelamento-da-concessao-do-maracana-e-suspende-licitacao.ghtml,https://globoesporte.globo.com/rj/futebol/noticia/justica-determina-cancelamento-da-concessao-do-maracana-e-suspende-licitacao.ghtml,Justiça determina cancelamento da concessão do Maracanã e suspende licitação," A 9ª Vara Pública do Rio de Janeiro determinou nesta terça-feira que o processo de licitação do Maracanã seja suspenso. Em decisão assinada pelo juiz Marcello Alvarenga Leite, o magistrado aceita a Ação Civil Pública proposta pelo Ministério Público apontando vícios no processo de concessão por 35 anos. A informação foi revelada pelo portal Uol.  Por enquanto, a concessionária do Maracanã não vai se pronunciar sobre o caso, mas já está ciente e buscando soluções jurídicas.  Em decisão do dia 11 de setembro, o juiz informou que o acordo ""é lesivo aos cofres públicos do Estado do Rio de Janeiro e desnecessário para a viabilidade econômica da concessão"". No documento, explica que a empresa IMX HOLDING S/A, um dos licitantes, teve acesso privilegiado a informação. Por isso, o processo foi suspenso.  Marcello Alvarenga Leite pediu ainda que sejam negados os pedidos para demolições do Estádio Célio de Barros, do Parque Aquático Julio Delamare e da Escola Municipal Friedenreich. ",esportes,,,,,,
2018-09-13,https://web.archive.org/web/20180913045001/https://globoesporte.globo.com/rs/futebol/times/gremio/noticia/com-problema-na-panturrilha-andre-deve-desfalcar-o-gremio-para-a-libertadores.ghtml,https://globoesporte.globo.com/rs/futebol/times/gremio/noticia/com-problema-na-panturrilha-andre-deve-desfalcar-o-gremio-para-a-libertadores.ghtml,"Com problema na panturrilha, André deve desfalcar o Grêmio para a Libertadores"," O Grêmio não terá o centroavante titular por cerca de um mês. E o reserva também. Depois de perder Jael devido a uma artroscopia no joelho direito, a nova baixa é André. Com um problema em uma das panturrilhas, o jogador passou por exame na manhã desta quarta-feira e deve ser desfalque nos próximos jogos pelo Brasileirão e Libertadores.  + Maicon volta a treinar com bola no Grêmio  Junto de Cícero, André já havia ficado fora do treino desta tarde no CT Luiz Carvalho. Assim, o técnico Renato Gaúcho não terá centroavantes inscritos para a primeira partida das quartas de final da Libertadores, na próxima terça-feira, contra o Atlético Tucumán. Não há outro atleta exclusivo para a função no grupo tricolor.  O jovem Thonny Anderson tem sido a opção mais utilizada no comando de ataque quando necessário. No Gre-Nal do último domingo, foi ele quem substituiu André no segundo tempo. Jael passou por uma cirurgia no joelho direito e, apesar de ter aparecido no gramado nesta quarta caminhando, tem retorno previsto pelo clube apenas para daqui um mês.  Na Libertadores, o Grêmio também fica sem um camisa 9 de ofício na lista dos 30 inscritos. Nas vagas de Hernane e Jailson, que deixaram o clube no mês passado, a tendência é pela inscrição dos meio-campistas Matheus Henrique e Jean Pyerre. Luan, mais à frente, Thonny ou mesmo a volta da improvisação de Cícero são as principais opções para o ataque. ",esportes,,,,,,
