data,url_noticia,url_noticia_curto,titulo,conteudo_noticia,assunto,assunto_ex,titulo_ex,subtitulo_ex,local_ex,artigo_ex,n_paragrafos
2018-05-16,https://web.archive.org/web/20180516003256/https://g1.globo.com/politica/noticia/gilmar-mendes-manda-soltar-milton-lyra-suposto-operador-do-mdb.ghtml,https://g1.globo.com/politica/noticia/gilmar-mendes-manda-soltar-milton-lyra-suposto-operador-do-mdb.ghtml,"Gilmar Mendes manda soltar Milton Lyra, suposto operador do MDB"," O ministro Gilmar Mendes, do Supremo Tribunal Federal, mandou nesta terça-feira (15) soltar Milton Lyra, suposto operador do MDB no Senado (leia detalhes sobre a decisão mais abaixo).  Pela decisão do ministro, Milton Lyra:  Após a decisão de Gilmar Mendes, a defesa de Lyra divulgou a seguinte nota:  ""O advogado Pierpaolo Bottini, que representa o empresário Milton Lyra, considerou a decisão do ministro Gilmar Mendes acertada. 'Não havia motivo ou razão para a prisão de alguém que já estava à disposição da justiça para prestar todos os esclarecimentos'"".  Milton Lyra se entregou à Polícia Federal em 12 de abril, após ter a prisão decretada pelo juiz Marcelo Bretas, da Justiça Federal do Rio de Janeiro.  A prisão havia sido determinada no âmbito da Operação Rizoma, que investiga prejuízos no Postalis, fundo de pensão dos funcionários nos Correios.  Citado em delações premiadas devido à relação com políticos do MDB, Lyra é suspeito de envolvimento no esquema que desviou recursos do fundo.  À época em que Milton Lyra foi preso, a defesa dele afirmou à TV Globo que as atividades do cliente são lícitas e que ele está à disposição para colaborar com a Justiça e com a investigação.  Na semana passada, o Superior Tribunal de Justiça (STJ) analisou um pedido de liberdade apresentado pela defesa de Milton Lyra. Por maioria, a Sexta Turma da Corte decidiu manter na cadeia o suposto operador do MDB.  Segundo Gilmar Mendes, a defesa de Lyra argumentou que não havia motivos para prisão preventiva do cliente. Isso porque, de acordo com os advogados, o juiz Bretas não apontou riscos concretos à ordem pública.  Ainda conforme a defesa, as suspeitas contra o cliente se baseiam em informações de delações, e que Lyra não representa obstrução ou risco para as investigações.  Ao analisar o pedido, o ministro do STF escreveu estar ""claro o constrangimento ilegal"" no episódio.  Para Gilmar Mendes, as acusações são de crimes graves, mas que teriam ocorrido até 2016. Para ele, como os fatos estão ""distantes"", não há razão para a prisão.  ""Os supostos crimes são graves, não apenas em abstrato, mas em concreto, tendo em vista as circunstâncias de sua execução. Muito embora graves, esses fatos são consideravelmente distantes no tempo da decretação da prisão. Teriam acontecido entre 2011 e 2016"", escreveu o ministro. ",politica,,,,,,
2018-05-16,https://web.archive.org/web/20180516003256/https://g1.globo.com/politica/noticia/apos-denuncia-de-violencia-domestica-roberto-caldas-renuncia-ao-cargo-de-juiz-da-corte-interamericana-de-direitos-humanos.ghtml,https://g1.globo.com/politica/noticia/apos-denuncia-de-violencia-domestica-roberto-caldas-renuncia-ao-cargo-de-juiz-da-corte-interamericana-de-direitos-humanos.ghtml,"Após denúncia de violência doméstica, Roberto Caldas renuncia ao cargo de juiz da Corte Interamericana de Direitos Humanos"," O advogado Roberto Caldas renunciou ao cargo de juiz da Corte Interamericana de Direitos Humanos após ter sido acusado pela ex-mulher Michella Marys de violência doméstica, caso revelado pela edição da revista ""Veja"" no fim de semana.  Em comunicado oficial, a Corte informou que na sexta (11) recebeu um pedido de licença por tempo indeterminado e, na segunda (14), o juiz renunciou formalmente à função. O tribunal informou que aceitou e deu efeitos imediatos à renúncia.  ""Como é de conhecimento público, Roberto Caldas foi denunciado por supostos atos de violência intrafamiliar em instâncias judiciais brasileiras. Em relação a essas acusações, o Presidente da Corte Interamericana destacou a importância de que os fatos sejam investigados com diligência, prontamente e oportuna no quadro de um processo devido. Não obstante o acima exposto, condena todos os tipos de violência contra as mulheres"", afirma o comunicado.  Roberto Caldas era o representante do Brasil na Corte Intermericana, com sede na Costa Rica. O órgão trata de questões humanitárias e defesa de minorias.  Ele foi indicado para o cargo pela presidente Dilma Rousseff em 2011 e eleito pela 42ª Assembleia Geral da Organização dos Estados Americanos em 2012. Assumiu em 2013. O mandato terminaria em novembro deste ano. Entre 2016 e 2017, Caldas presidiu a corte.  O advogado, com atuação no Supremo Tribunal Federal (STF) e especialista em direito do trabalho, se separou em dezembro do ano passado após um relacionamento de 13 anos.  No último dia 13 de abril, Michela foi à Delegacia Especial de Atendimento à Mulher de Brasília e prestou queixa por injúria, ameaça, e ""vias de fato"", ou seja, agressões físicas.  Segundo Michela, no dia 23 de outubro de 2017, Caldas puxou o cabelo dela e a derrubou na escada de casa. Ele teria ameaçado pegar uma faca e matar a mulher, mas, segundo ela, teria sido impedido por funcionárias e acabou dando socos e empurrões nela.  A mulher disse ter gravado seis anos de conversas com o marido, nas quais ele a agredia fisicamente e verbalmente.  Um processo sobre o caso corre no 1º Juizado de Violência Doméstica e Familiar contra a Mulher, em Brasília.  O Ministério Público chegou a pedir que o Juizado concedesse uma medida protetiva para proibir que o advogado se aproximasse da mulher, mas o juiz negou por considerar que Caldas já saiu de casa e porque, para o magistrado, as questões que envolvem o casal são ""aparentemente"" financeiras.  Em nota divulgada pela assessoria do juiz na última quinta-feira (10), Roberto Caldas afirmou que estava sofrendo ""ameaças de publicização de desavenças conjugais"" e que isso tinha ""objetivo de constranger a aceitar um acordo financeiro absolutamente escorchante"".  ""Tenho agido com o máximo empenho e orientação profissional adequada para preservar os nossos filhos em comum e a filha da minha ex-companheira dos efeitos dessa chantagem. Mas a provável iminência de uma divulgação indevida desse conflito familiar me obriga a dirigir esse alerta aos que conheço e respeito"", disse na ocasião.  No sábado (12), após a reportagem da ""Veja"", o juiz não se manifestou. O advogado dele, Antonio Carlos de Almeida Castro, disse à TV Globo que houve agressões verbais por parte de ambos. Segundo ele, Caldas nega ter agredido fisicamente a ex-mulher.  Sobre um áudio específico, no qual ela teria dito que ""doeu"", o advogado afirmou que a mulher fez seis anos de gravações por interesses financeiros e que ""pinçou"" um áudio mais negativo para o ex-marido.  ""São seis anos de áudio. Ela pegou o áudio que mais lhe interessava. Imagina o que é uma ex-mulher gravar por seis anos um marido, por evidentemente interesses financeiros inconfessáveis. Então, nós não podemos pinçar um áudio e fazer essa análise. Repito: são gravíssimas as agressões verbais entre os dois, muito mais do que ela mostrou. Ela gravou seis anos e pinçou esse áudio"", disse o advogado. A defesa divulgou ainda uma nota em que nega ter havido agressão física. ",politica,,,,,,
2018-05-17,https://web.archive.org/web/20180517091834/https://g1.globo.com/politica/noticia/senado-aprova-mp-sobre-investimentos-de-empresas-de-tecnologia-em-pesquisa-e-inovacao.ghtml,https://g1.globo.com/politica/noticia/senado-aprova-mp-sobre-investimentos-de-empresas-de-tecnologia-em-pesquisa-e-inovacao.ghtml,Senado aprova MP sobre investimentos de empresas de tecnologia em pesquisa e inovação," O Senado aprovou nesta quarta-feira (16) uma medida provisória (MP) que trata de investimentos de empresas de tecnologia em atividades de pesquisa, desenvolvimento e inovação no setor.  A proposta amplia de 3 para 48 meses o prazo para que empresas do setor beneficiadas com incentivos fiscais reinvistam valores pendentes (débitos) em projetos na área.  A medida provisória já estava em vigor desde o fim do ano passado, mas precisava ser aprovada por Câmara e Senado para virar uma lei em definitivo.  Os deputados já haviam aprovado o texto na semana passada. Agora, a proposta vai à sanção presidencial.  ""São recursos que estavam glosados de empresas que não tinham utilizado devidamente esses recursos no P&D [pesquisa e desenvolvimento]. E elas agora vão poder reinvestir esses recursos, não sofrendo sanção de fechar a empresa por não ter investido"", afirmou o senador Omar Aziz (PSD-AM) durante a sessão.  Defensores da medida afirmaram que o projeto tem o objetivo de modernizar duas legislações que regem o setor de informática e que são de 1991.  A Lei da Informática já previa que empresas de desenvolvimento ou produção de bens e serviços de informática e automação teriam direito a incentivos fiscais relacionados ao Imposto sobre Produtos Industrializados (IPI), desde que se comprometessem a investir em atividades de pesquisa e desenvolvimento.  A proposta aprovada nesta quarta atualiza a redação dessa lei e trata de empresas de desenvolvimento ou produção de bens e serviços de tecnologias da informação e comunicação. O texto também inclui investimentos em atividades de inovação.  ""A medida foi editada com o objetivo de aprimorar os mecanismos instituídos na legislação vigente, com vistas a reduzir entraves burocráticos, a modernizar o ambiente de inovação e de fortalecer as atividades de pesquisa e desenvolvimento no setor produtivo das tecnologias da informação e comunicação"", diz o relator da proposta, deputado Thiago Peixoto (PSD-GO).  O parlamentar incorporou ao projeto um trecho que diz que a concessão dos benefícios fiscais também dependerá da comprovação da regularidade das empresas junto ao sistema de seguridade social.  De acordo com Peixoto, a medida provisória aprovada não gera impacto financeiro nos orçamentos da União.  O projeto prevê ainda que uma parte dos recursos das empresas beneficiadas deverá ser investida em Instituições Científica, Tecnológica e de Inovação (ICTs) e também em instituições de pesquisa ou de ensino superior mantidas pelo poder público.  A edição da MP foi feita em um encontro de Michel Temer com empresários do setor em dezembro do ano passado. ",politica,,,,,,
2018-05-17,https://web.archive.org/web/20180517091834/https://g1.globo.com/politica/noticia/stf-derruba-proibicao-a-discursos-de-doutrinacao-em-radios-comunitarias.ghtml,https://g1.globo.com/politica/noticia/stf-derruba-proibicao-a-discursos-de-doutrinacao-em-radios-comunitarias.ghtml,STF derruba proibição a discursos de doutrinação em rádios comunitárias," O Supremo Tribunal Federal derrubou nesta quarta-feira (16) a proibição a discursos doutrinários em rádios comunitárias, seja de conteúdo religioso, partidário ou ideológico, por exemplo.  Na avaliação da maioria dos ministros, a proibição representa censura prévia e ofende o princípio da liberdade de expressão garantido na Constituição.  Os ministros julgaram uma ação apresentada em 2001 pelo então Partido Liberal, hoje Partido da República, contra artigo de lei de 1998 que criou regras para a atuação das rádios comunitárias.  O trecho questionado afirmava que ""é vedado o proselitismo de qualquer natureza na programação das emissoras de radiodifusão comunitária"".  Em 2002, o plenário negou conceder liminar para derrubar esse trecho. Por lei, era proibido o proselitismo, mas algumas rádios adotavam a prática. Agora, com a decisão do Supremo, fica permitida a tentativa de convencimento com conteúdo doutrinário.  Relator da ação, o ministro Alexandre de Moraes votou contra a ação do partido, ou seja, para manter a proibição aos discursos doutriários. Para Moraes, o Estado deve ser neutro e não pode, por exemplo, usar uma concessão para apoiar uma ou outra religião.  ""O proselitismo faz parte da liberdade de expressão, da liberdade religiosa, mas não é isso que estamos discutindo aqui. (...) O que aqui temos é utilizar concessões estatais – rádio comunitária tem finalidade específica – para proselitismo religioso. É inegável o Estado fornecer concessões, o Estado permitir exclusividade, aqui não há competição, exclusividade pra que uma determinada religião utilizasse monopólio na radiodifusão comunitária, pra conversão inclusive de crianças, rádio comunitária as crianças também ouvem"", afirmou o ministro.  Durante o julgamento, o ministro Luiz Edson Fachin abriu divergência, ou seja, a favor de derrubar a proibição. Para ele, não se pode impedir a livre manifestação de pensamento sob pena de censura.  ""Não se pode perder de vista que a liberdade de expressão jamais possui um aspecto meramente individual. Não se trata apenas de direitos que pertencem a quem fala ou de quem está com a palavra, mas também de quem a ouve. O direito a liberdade de expressão abrange, necessariamente, uma dimensão social, que engloba o direito de receber informações e ideias. Da mesma forma, a liberdade de pensamento inclui o discurso persuasivo e o uso de argumentos críticos. (...) Consenso e debate público informado pressupõem a livre troca de ideias e não apenas a divulgação de informações"", entendeu Fachin, seguido por mais seis ministros da Corte.  Luís Roberto Barroso concordou, destacando que o ouvinte poderia mudar de rádio se achasse necessário.  ""No mundo das redes sociais, em que cada um pode se encontrar em seu nicho ideológico, o risco de proselitismo é muito pequeno. Até porque eu confio na possibilidade de se desligar o rádio ou mudar de estação se ela não atender à demanda que cada um tem em relação aos meios de comunicação"", declarou.  Decano da Corte, Celso de Mello também frisou que proibir as rádios a realizar esse tipo de discurso de convencimento ""é bloquear a livre difusão de ideias, ainda que se cuide de ideia que possamos abominar, pois a liberdade de expressão não existe apenas para amparar as ideias com as quais concordamos, mas também para viabilizar e possibilitar o livre exercício, a livre circulação de pensamento"".  Última a votar, Cármen Lúcia também destacou que proibir seria uma forma de censura prévia. ""Além da agressão à liberdade de expressão, há uma desigualdade com outras rádios que não têm esse tipo de vedação"", frisou. ",politica,,,,,,
2018-05-17,https://web.archive.org/web/20180517091834/https://g1.globo.com/politica/noticia/executivo-do-grupo-jf-pede-a-fachin-para-informar-que-acordo-de-delacao-premiada-ainda-esta-em-vigor.ghtml,https://g1.globo.com/politica/noticia/executivo-do-grupo-jf-pede-a-fachin-para-informar-que-acordo-de-delacao-premiada-ainda-esta-em-vigor.ghtml,Executivo do grupo J&F pede a Fachin para informar que acordo de delação premiada ainda está em vigor," O ex-diretor do grupo J&F Francisco de Assis pediu nesta quarta-feira (16) ao ministro Luiz Edson Fachin, relator da Operação Lava Jato no Supremo Tribunal Federal, que informe aos integrantes do Ministério Público e do Judiciário que o acordo de delação premiada firmado por ele ainda está em vigor enquanto o próprio Fachin não decidir sobre a rescisão.  Em setembro do ano passado, o então procurador-geral da República, Rodrigo Janot, informou ao STF sobre a rescisão do acordo de quatro dirigentes da J&F, entre os quais Francisco de Assis, por supostas omissão e má-fé – eles teriam deixado de informar ao MP sobre orientações a respeito das negociações do acordo dadas a eles pelo ex-procurador da República Marcello Miller enquanto ainda integrava o Ministério Público. Originalmente, o acordo previa que, em troca das informações prestadas, os delatores do grupo J&F não poderiam ser denunciados.  Nesta terça-feira, Assis, o empresário Joesley Batista e mais quatro pessoas foram denunciados pelo Ministério Público Federal por participação em esquema de vazamento de informações do MP sobre operação que tratou de fundos de pensão em benefício da J&F.  O ministro Fachin ouviu a defesa e depois pediu parecer da procuradora-geral Raquel Dodge, sucessora de Janot, que concordou com a rescisão definitiva do acordo. Fachin, porém, ainda não deliberou sobre a validade da delação.  No documento desta quarta, Francisco de Assis afirma que, na semana passada, Raquel Dodge pediu para enviar trechos das delações do grupo para diversos locais do país a fim de dar continuidade às investigações.  Segundo ele, como ainda não há decisão final sobre o acordo, é preciso que haja ""comunicação expressa"" ao Judiciário eao MP.  ""É a presente para requerer que, caso Vossa Excelência entenda pelo deferimento dos pleitos da Procuradoria Geral da República aqui indicados, haja comunicação expressa aos órgãos do Ministério Público e Juízos que venham a receber os anexos deste Peticionário Francisco de Assis e Silva que não existe ainda juízo de mérito por parte deste excelentíssimo Relator acerca do pleito de rescisão do acordo de colaboração feito pela PGR"", afirma o texto do pedido a Fachin. ",politica,,,,,,
2018-05-17,https://web.archive.org/web/20180517091834/https://g1.globo.com/politica/noticia/tcu-vai-investigar-contratos-de-empresa-que-levou-a-demissao-de-presidente-do-inss.ghtml,https://g1.globo.com/politica/noticia/tcu-vai-investigar-contratos-de-empresa-que-levou-a-demissao-de-presidente-do-inss.ghtml,TCU decide investigar contratos com o governo de empresa que levou à demissão de presidente do INSS," O Tribunal de Contas da União (TCU) decidiu nesta quarta-feira (16) que vai fiscalizar os contratos da empresa RSX Informática com o governo.  O TCU quer saber se os softwares fornecidos pela RSX são efetivamente utilizados pelos órgãos públicos que contrataram a empresa.  Nesta quarta, o presidente Instituto Nacional do Seguro Social (INSS), Francisco Lopes, foi demitido pelo ministro Alberto Beltrame, do Desenvolvimento Social, pasta à qual o órgão é subordinado.  Segundo reportagem na edição desta quarta-feira (16) de ""O Globo"", o INSS firmou com a empresa um contrato de R$ 8,8 milhões para fornecimento de programas de computador mesmo com parecer contrário da área técnica. De acordo com o jornal, os técnicos apontaram que os softwares oferecidos pela RSX não teriam utilidade para o órgão.  Além do caso do INSS, a fiscalização do TCU também vai verificar o suposto atestado de capacidade técnica da RSX emitido pelo Ministério do Trabalho.  De acordo com o ministro Augusto Sherman, que propôs a fiscalização, uma consulta ao sistema do TCU mostrou que a empresa já fechou contratos com outros entes da federação e que só em 2018 recebeu R$ 1,78 milhão, além de R$ 4 milhões (do contrato de R$ 8,8 milhões) que recebeu do INSS.  O ministro informou que também recebeu informações de que servidores da Embratur teriam sido pressionados a contratar a RSX e que o contrato não foi fechado por causa da resistência dos servidores.  “Ante a negativa dos servidores, a contratação não prosperou no âmbito da Embratur, mas um dos analistas de tecnologia da informação teria sido removido do órgão após essa negativa”, relatou o ministro. ",politica,,,,,,
2018-05-24,https://web.archive.org/web/20180524092701/https://g1.globo.com/politica/noticia/delubio-soares-pede-ao-supremo-para-nao-ser-preso-na-lava-jato.ghtml,https://g1.globo.com/politica/noticia/delubio-soares-pede-ao-supremo-para-nao-ser-preso-na-lava-jato.ghtml,Delúbio Soares pede ao Supremo para não ser preso na Lava Jato," O ex-tesoureiro do PT Delúbio Soares pediu nesta quarta-feira (23) ao Supremo Tribunal Federal (STF) para não ser preso. O caso será analisado pelo ministro Edson Fachin.  Delúbio foi condenado a seis anos de prisão pelo Tribunal Regional Federal da Quarta Região (TRF-4), segunda instância da Justiça responsável pela Lava Jato.  Mais cedo, nesta quarta, o juiz Sérgio Moro decretou a prisão do ex-tesoureiro do PT. Isso porque o TRF-4 negou o último recurso possível apresentado por Delúbio.  Desde 2016, o Supremo entende que a pena pode começar a ser executada após a condenação em segunda instância.  A defesa de Delúbio argumenta que o ex-tesoureiro não pode começar a cumprir pena enquanto não forem analisados os pedidos para dar efeito suspensivo à condenação até julgamento nas instâncias superiores.  ""Requer seja deferida medida liminar para evitar o início de cumprimento de pena imposta ao Paciente, enquanto não analisados (e caso analisados, enquanto não forem negados), pelo TRF4 e subsidiariamente, pelo respectivo Tribunal Superior, os requerimentos que serão formulados pelo Paciente de tutela provisória para dar efeito suspensivo a cada um dos Recursos Especial e Extraordinário, e que seja confirmado no mérito o pleito ora alinhavado"", diz o pedido. ",politica,,,,,,
2018-05-24,https://web.archive.org/web/20180524092701/https://g1.globo.com/politica/noticia/governo-so-discute-diesel-e-nao-cogita-medidas-para-reduzir-preco-da-gasolina-dizem-ministros.ghtml,https://g1.globo.com/politica/noticia/governo-so-discute-diesel-e-nao-cogita-medidas-para-reduzir-preco-da-gasolina-dizem-ministros.ghtml,"Governo só discute diesel e não cogita medidas para reduzir preço da gasolina, dizem ministros"," Os ministros Eliseu Padilha (Casa Civil), Carlos Marun (Secretaria de Governo) e Valter Casimiro (Transportes) disseram durante entrevista coletiva nesta quarta-feira (23) no Palácio do Planalto que, em relação à alta do preço dos combustíveis, o governo busca soluções somente para a redução do preço do diesel.  De acordo com o ministro Eliseu Padilha, neste momento, não estão em cogitação medidas para reduzir o preço da gasolina. Mas, segundo ele, ""o futuro a Deus pertence"".  Segundo Padilha, a proposta do governo é aprovar no Congresso a reoneração da folha de pagamento das empresas como forma de compensar a retirada da Contribuição de Intervenção no Domínio Econômico (Cide) no preço do diesel, o que levaria à redução do preço desse combustível.  Na entrevista, Padilha foi indagado se o governo avalia reduzir ou zerar a Cide também em relação à gasolina. Ele declarou que as conversas desta quarta-feira tratarama somente do óleo diesel.  ""O governo não estuda no momento nenhuma medida com relação à gasolina"", afirmou o ministro. “A discussão que está sendo tratada hoje é com relação ao diesel"", declarou.  A instabilidade no preço dos combustíveis é motivada pela política da Petrobras, adotada em julho, de repassar ao preço do produto vendido para as distribuidores os custos decorrentes das oscilações do mercado internacional do petróleo e da variação do dólar.  Os ministros concederam a entrevista após reunião com lideranças dos caminhoneiros, que paralisaram as atividades e fizeram bloqueios em várias rodovias do país, em protesto contra as frequentes elevações de preço dos combustíveis. Mas a Petrobras já anunciou que não mudará a política de reajustes.  Na entrevista, Padilha disse que a reivindicação dos caminhonheiros é de maior previsibilidade em relação aos reajustes do combustível.  ""Os caminhoneiros, todos eles, querem ter uma previsão, gostariam de trabalhar com período de tempo com preço fixo. É esse tema que está sendo discutido"", disse o ministro-chefe da Casa Civil.  Os ministros acentuaram na entrevista a necessidade de aprovação pelo Congresso do projeto de reoneração para só depois ser publicado o decreto que zera a Cide sobre o óleo diesel.  Padilha e Marun disseram que a Lei de Responsabilidade Fiscal impede a publicação do decreto antes de o projeto virar lei, já que, ao realizar uma renúncia fiscal, o governo precisa indicar a fonte de onde virá a compensação.  Sobre a possibilidade apresentada pelo presidente da Câmara, Rodrigo Maia (DEM-RJ), de utilizar a reoneração para compensar uma redução no PIS-Cofins que incide sobre o preço do óleo diesel, Marun explicou que o valor não seria suficiente.  ""Se o Congresso tomar esta iniciativa, cabe a ele também essa indicação [da compensação]. A reoneração não consegue neste ano nem no ano que vem chegar perto de uma eventual renúncia de PIS-Cofins. Temos que ter valores mais significativos para a compensação"", disse Marun.  Caso a reoneração não seja aprovada, Padilha avisou que o governo não irá zerar a Cide. ""Não vamos ferir a Lei de Responsabilidade Fiscal', declarou. ",politica,,,,,,
