data,url_noticia,url_noticia_curto,titulo,conteudo_noticia,assunto,assunto_ex,titulo_ex,subtitulo_ex,local_ex,artigo_ex,n_paragrafos
2018-05-10,https://web.archive.org/web/20180510085620/https://gshow.globo.com/Famosos/noticia/guilhermina-libanio-fala-de-gordofobia-imposta-pela-sociedade-entrar-em-loja-de-roupa-e-saber-que-nao-tera-o-seu-tamanho.ghtml,https://gshow.globo.com/Famosos/noticia/guilhermina-libanio-fala-de-gordofobia-imposta-pela-sociedade-entrar-em-loja-de-roupa-e-saber-que-nao-tera-o-seu-tamanho.ghtml,Guilhermina Libanio fala de gordofobia imposta pela sociedade: ‘Entrar em loja de roupa e saber que não terá o seu tamanho’," Dona de olhos azuis, cabelo rosa e uma pele perfeita, com um discurso firme, Guilhermina Libanio comemora sua estreia na TV com a personagem Úrsula em Malhação: Vidas Brasileiras. Apontada pelos fãs da novela teen como uma das personagens mais representativas da temporada, a atriz afirma ao Gshow que nunca sofreu nenhum tipo de preconceito por causa de seu corpo ou de suas medidas.  “Meu manequim é 48 ou 50... E a coisa mais triste é olhar ao seu redor e não ter em quem se espelhar ou se identificar nas revistas. É entrar em uma loja de roupa e saber que não terá o seu tamanho. Isso foi um problema para mim porque parecia que o mundo estava certo e que eu era a única pessoa errada”, diz ela, que tem 1,70 m de altura e 90 kg.  Emprestar sua ""embalagem"", como define, para ressaltar a importância do amor-próprio motiva a jovem atriz. “Viver a Úrsula é um presente, porque ela vai sofrer gordofobia e, com a ajuda de pessoas próximas, vai aprender a se amar e se aceitar. É importante mostrar que a mulher gordinha vai além da divertida ou engraçada. Também é sensual, bem-sucedida, inteligente, feliz e amada”, afirma Guilhermina, que acabou de se formar em Artes Cênicas.  Desde que fez sua estreia na dramaturgia diária, Guilhermina cita com carinho as dezenas de mensagens positivas que vem recebendo nas redes sociais: “Muitas meninas me escrevem agradecendo e comemorando a oportunidade de poder ver uma personagem gorda na TV. As mulheres de 30 a 40 anos afirmam que, ao ver a história na novela, talvez teriam se aceitado mais facilmente”.  Virginiana, Guilhermina sempre buscar manter sua opinião quando é alvo de comentários em relação ao seu peso. “É sempre assim: ‘Seu rosto é tão lindo, podia emagrecer...’. Não, né? Seu rosto lindo não é um elogio. Meu corpo assim, do jeito que está, é lindo também, e ele só precisa estar funcionando bem para que eu possa usá-lo.”  Aos 20 anos, ela lembra que começou a engordar e passou a se aceitar em momentos diferentes. “Comecei a ganhar peso aos 13 anos, na adolescência. Até os meus 18 anos, não me aceitava e fiz todos os tipos de dieta. Hoje, se eu pudesse dar um conselho para as meninas, é que elas tenham calma e se olhem com mais amor ao espelho”, resume Guilhermina, garantindo que a vontade de emagrecer precisa vir de dentro para fora, para não gerar frustração.  O momento da ""virada de chave"" na vida da carioca ocorreu quando ela entrou para a faculdade: “Foi revolucionário porque passei a conhecer pessoas que se amam muito e que demostram muito afeto. Hoje sou feliz com o meu corpo e com as minhas medidas”.  Mas conquistar o amor-próprio não foi tarefa fácil. O processo foi longo e demorado, segundo Guilhermina. “Levei cinco anos e, é claro, ninguém passa a se amar de um dia para o outro. É uma construção diária, todos os dias. Quando isso acontecer, pode ter certeza de que será revolucionário, e ninguém mais vai te tirar isso”, comemora ela.  Agradecimeto: Hotel Windsor Barra ",famosos,,,,,,
2018-05-10,https://web.archive.org/web/20180510085620/https://gshow.globo.com/Famosos/noticia/adriane-galisteu-muda-visual-para-papel-em-nova-novela-das-7-ser-morena-da-menos-trabalho.ghtml,https://gshow.globo.com/Famosos/noticia/adriane-galisteu-muda-visual-para-papel-em-nova-novela-das-7-ser-morena-da-menos-trabalho.ghtml,Adriane Galisteu muda visual para papel em nova novela das 7: 'Ser morena dá menos trabalho'," Trabalho inédito, visual exclusivo! 💖 Adriane Galisteu é a mais nova morena do pedaço! A atriz deu adeus às famosas madeixas loiras e aderiu ao castanho escuro nos fios, além de diminuir o comprimento dos cabelos. Toda essa transformação é para marcar sua estreia como atriz na Globo!  Na próxima novela das 7, O Tempo Não Para, ela dará vida à personagem Zelda. E qual a primeira impressão da mais nova morena do pedaço sobre seu novo visual?  ""Tem uma frase que adoro que é: 'Às vezes temos medo da mudança, mas deveríamos ter medo de fazer sempre a mesma coisa e não de sair do lugar'”, filosofa Galisteu.  ""Vou me transformar em morena após 45 anos na mão de um cara que não conheço, que é o Anderson. Ainda bem que sei que ele é muito bom"", disse a atriz, ao Gshow, minutos antes de dar adeus aos fios claros.  O Tempo Não Para é a nova novela das 7. Escrita por Mario Teixeira, a trama conta com colaboração de Bíbi Da Pieve, Marcos Lazarini e Tarcísio Lara Puiati, pesquisa de texto Yara Eleodora, direção artística de Leonardo Nogueira e direção geral de Marcelo Travesso e Adriano Melo. Estreia dia 31/7. ",famosos,,,,,,
2018-05-10,https://web.archive.org/web/20180510085620/https://gshow.globo.com/Famosos/noticia/projota-estreia-como-ator-e-fala-de-seu-despertar-para-a-dramaturgia-quando-fui-ao-teatro-a-primeira-vez-ja-ia-fazer-30-anos.ghtml,https://gshow.globo.com/Famosos/noticia/projota-estreia-como-ator-e-fala-de-seu-despertar-para-a-dramaturgia-quando-fui-ao-teatro-a-primeira-vez-ja-ia-fazer-30-anos.ghtml,"Projota estreia como ator e fala de seu despertar para a dramaturgia: 'Quando fui ao teatro a primeira vez, já ia fazer 30 anos'"," Ele é um dos principais nomes da música brasileira na atualidade, mas sempre encontra uma forma de se reinventar. Projota brilha com suas canções nas rádios e, agora, aposta também na dramaturgia. O cantor faz uma participação na série Carcereiros como Tuinho, um dos detentos do presídio em que trabalha o protagonista vivido por Rodrigo Lombardi. ""Meu empresário me deu a notícia e levei um susto. Fiz o teste e foi a primeira vez que brinquei de atuar na vida, mas gostei e pensei: 'Agora eu quero, me dá um papel aí!'"", diverte-se.  Nascido José Tiago Sabino e criado na periferia de São Paulo, o rapper lembra que a mãe foi uma figura importante para que despertasse seu interesse pela arte. Apesar de ter falecido vítima de um AVC quando ele ainda era criança, Dirce transmitiu sua sensibilidade para o filho. ""Minha mãe foi atriz, escreveu peça de teatro. Era cantora e compositora também. Acho que isso passou no sangue, foi hereditário"", acredita ele, lembrando que seu primeiro contato com o teatro foi tardio, mas transformador.  Satisfeito com a primeira experiência como ator, Projota agora pretende seguir os mesmos passos de outros cantores que conseguem conciliar os palcos com as câmeras. ""Hoje em dia, nos meus videoclipes mesmo, já penso em algo em que possa atuar, já me sinto mais capaz. Tenho vontade de fazer cursos, oficinas, mas ainda não tive tempo"", conta ele, que depois das gravações de Carcereiros com um elenco de peso, também participou do filme 'Sequestro Relâmpago', em que contracenou com ninguém menos que Marina Ruy Barbosa. ""Só gente gigante"", resume.  Mas os fãs da rima de Projota não precisam se preocupar: o cantor está trabalhando em um projeto robusto para os próximos meses. ""Tenho várias músicas, estamos em fase de finalização e vou lançar uma série de videoclipes. Cada música é um single, terá seu clipe e, no final, vamos juntar tudo em um álbum"", explica. A primeira delas, chamada 'Mayday', já está pronta e tem lançamento previsto para maio.  O novo projeto marca uma forma diferente de produzir suas músicas. ""Montei um estúdio em casa e eu mesmo estou produzindo, então as músicas voltaram a ter aquela pureza do meu trabalho de alguns anos atrás, misturado com o aprendizado que tive"", ressalta ele, que ainda conta com o trabalho de novos produtores da cena rap. ""Soltei um vídeo na internet falando que estava aberto para me mandarem batidas. Recebi quase 600 e-mails e tem cada cara incrível, uma batida melhor que a outra"", completa.  Olhando o artista que se tornou hoje, é até difícil ter uma noção concreta da caminhada que teve até aqui. ""É muito doido, porque não pisquei o olho e cheguei aqui. Acompanhei cada degrauzinho que foi conquistado. Valorizo tanto a minha cara na lata de refrigerante quanto meu primeiro DVD, que fiz em 2011, botei na rua por conta própria e vendi 25 mil cópias, quando nem imaginava estar em uma série da Globo"", reflete.  De tudo o que conquistou, um dos seus maiores prazeres é poder servir de inspiração para milhares de jovens da periferia que acompanham sua carreira. ""Isso é muito importante. Para um moleque da periferia, você só vai ganhar dinheiro, só vai melhorar a vida da sua família, se for jogador de futebol ou ladrão. Eu nunca usei droga na minha vida. Aprendi em casa a ser educado, a conquistar o respeito, e não ir pela violência"", afirma. ",famosos,,,,,,
2018-05-17,https://web.archive.org/web/20180517091822/https://gshow.globo.com/Famosos/noticia/juliana-paiva-sera-protagonista-da-nova-novela-das-7-veja-primeira-foto-de-marocas.ghtml,https://gshow.globo.com/Famosos/noticia/juliana-paiva-sera-protagonista-da-nova-novela-das-7-veja-primeira-foto-de-marocas.ghtml,Juliana Paiva será protagonista da nova novela das 7; veja primeira foto de Marocas," Que linda! Após dar show como Simone em A Força do Querer, Juliana Paiva já está pronta para seu próximo desafio! A atriz será a protagonista de O Tempo Não Para, a nova novela das 7, que acompanha a história de uma família congelada em 1886, que desperta nos dias de hoje e precisa lidar com os choques temporais.  Para viver Maria Marcolina, a Marocas, Ju Paiva precisou alongar e escurecer as madeixas. Continuou maravilhosa, não concordam?  A protagonista da trama das 7 é uma menina divertida, inteligente, curiosa e corajosa. E nada frágil, apesar de ser uma moça do século XIX. Ela tem uma relação afetuosa com o pai, que sonha em casar a filha com um bom partido, apesar de ter criado a menina para ser independente.  A personagem de Ju Paiva vai se adaptar rapidamente ao século XXI, exceto no que se refere ao amor. Contudo, mais do que se readaptar, ela terá que reaprender a sentir.  E como aqui no Gshow você fica sabendo de TUDO antes, a gente aproveita e mostra também as primeiras imagens de Dom Sabino (Edson Celulari) e Dona Agustina (Rosi Campos), os pais da nossa heroína. A família de Marocas mora na fazenda Nossa Senhora do Ó, situada onde depois foi construído o largo da matriz da Freguesia do Ó e as demais construções do bairro de São Paulo.  Sabino é um empresário vitorioso do Brasil Imperial, descendente de bandeirantes, um homem íntegro e zeloso. É pai também de Nico (Raphaela Alvitos) e Kiki (Nathalia Rodrigues), e trata os escravos e agregados com respeito. Considera-se um fiel súdito da monarquia e sonha com um título da nobreza. Já Agustina é uma crédula dona de casa e mãe de família do século XIX, que crê em Deus e nos mistérios da fé, e leva a família, principalmente o marido, com mão de ferro.  Ele sentirá dificuldade em se adaptar ao século XXI, especialmente diante das novas tecnologias e da ética contemporânea. E ela vai morrer de ciúmes do marido e terá grande resistência em aceitar os novos modos. Quem por aí já está ansioso para conhecer melhor essa galera? _o/  O Tempo Não Para é a nova novela das 7. Escrita por Mario Teixeira, a trama conta com colaboração de Bíbi Da Pieve, Marcos Lazarini e Tarcísio Lara Puiati, pesquisa de texto Yara Eleodora, direção artística de Leonardo Nogueira e direção geral de Marcelo Travesso e Adriano Melo. Estreia dia 31/7. ",famosos,,,,,,
2018-05-17,https://web.archive.org/web/20180517091822/https://gshow.globo.com/Famosos/noticia/mariana-ximenes-abre-album-de-viagem-sempre-quis-conhecer-melhor-a-asia.ghtml,https://gshow.globo.com/Famosos/noticia/mariana-ximenes-abre-album-de-viagem-sempre-quis-conhecer-melhor-a-asia.ghtml,Mariana Ximenes abre álbum de viagem: ‘Sempre quis conhecer melhor a Ásia’," Antes de arrumar as malas, Mariana Ximenes gosta de estudar e preparar roteiro especial do local que vai visitar e passar as férias. Além de pontos turísticos famosos, a atriz gosta de mergulhar no estilo de vida e viver como se fosse uma local. De férias, a paulistana conversou com o Gshow enquanto esperava um voo para França, onde participa de eventos de cinema.  ""Além da Tailândia, fui para a Indonésia porque a minha comadre se mudou para Bali para minha afilhada estudar na escola Green School”, resume ela, destacando que a formação do colégio, todo construído com bambu, é baseada na visão holística e na consciência ambiental. “Eu sempre tive a maior curiosidade de conhecer esse projeto por conta da sua filosofia de ensino. Então, juntei os destinos e os motivos”, diz.  Com belas paisagens e fotos sensacionais, Mari fica até na dúvida na hora de eleger os lugares mais impressionantes. “Difícil falar de uma só, foram tantas aventuras! Tudo é tão diferente: a cultura, a geografia, a gastronomia, os costumes... Especial e mágico. Tudo mexe com os sentidos”, afirma ela, que mostra alguns registros.  “Posso falar que adorei uma ilha chamada Yao Noi, na Tailândia. É relax total e com uma paisagem deslumbrante. Também amei Luang Prabang, no Laos, onde visitei templos incríveis. Adorei conhecer a ilha de Flores, na Indonésia. Fiz mergulhos alucinantes e o lifestyle de Bali me encantou”, diz ela, que resolveu comemorar aniversário no meio da natureza e participar de uma cerimônia de purificação, com direito a meditação.  Dessa vez, Mari resolveu montar uma viagem com clima praiano. “Montei roteiro que prezava praia e roupas confortáveis”, lembra ela, que deu dicas para montar visual sempre estiloso e prático. “Sabia que iria andar muito e que iria visitar lugares religiosos, onde seria necessário cobrir ombros e pernas. Por isso, optei por itens frescos por conta do calor”, ponderou ela, que sempre usa pashminas para deixar o look mais formal. ",famosos,,,,,,
2018-05-17,https://web.archive.org/web/20180517091822/https://gshow.globo.com/Famosos/noticia/otaviano-costa-comemora-45-anos-e-diz-receita-para-a-felicidade-e-viver-o-presente.ghtml,https://gshow.globo.com/Famosos/noticia/otaviano-costa-comemora-45-anos-e-diz-receita-para-a-felicidade-e-viver-o-presente.ghtml,Otaviano Costa comemora 45 anos e diz: 'Receita para a felicidade é viver o presente'," Otaviano Costa sempre gostou de comemorar seus aniversários e, neste domingo, 13, a festa não poderia ser diferente. Por isso, o Gshow foi até os bastidores do Vídeo Show para perguntar ao apresentador qual o aniversário mais marcante e saber o segredo para chegar aos 45 anos esbanjando jovialidade:  “Os quarentões de antigamente são bem diferentes dos de hoje em dia. A idade nunca foi um problema para mim e acredito que a receita para a felicidade é viver o presente, ser feliz com o que se tem no momento e com quem está ao seu redor. Isso vale para a vida pessoal e profissional. Não gosto de ficar pensando no futuro e nem de olhar para trás”  Neste aniversário, Ota dispensa os presentes. ""O presente que peço neste aniversário é para as minhas filhas. Quero que elas ganhem por mim. Eu só quero saúde. O resto, a gente vai atrás e busca. Não quero mais nada e já tenho tudo que sempre sonhei. A paternidade traz essa generosidade”, diz ele, que é pai de Olivia e Giulia, filhas de Flávia Alessandra.  Ao relembrar comemorações inesquecíveis, Ota faz retrospectiva especial da infância. “Eu me lembro de tantos aniversários na minha querida Cuiabá, ao lado da minha família e dos meus amigos. A minha mãe preparava com o maior carinho as festas de aniversário com meu pai e minha irmã. Era sempre lá em casa”, conta ele. ",famosos,,,,,,
2018-05-17,https://web.archive.org/web/20180517091822/https://gshow.globo.com/Famosos/noticia/no-dia-das-maes-fatima-bernardes-ana-furtado-cissa-guimaraes-e-patricia-poeta-emocionam-em-homenagem-a-data.ghtml,https://gshow.globo.com/Famosos/noticia/no-dia-das-maes-fatima-bernardes-ana-furtado-cissa-guimaraes-e-patricia-poeta-emocionam-em-homenagem-a-data.ghtml,"No Dia das Mães, Fátima Bernardes, Ana Furtado, Cissa Guimarães e Patrícia Poeta emocionam em homenagem à data"," Já diz o ditado: ""mãe é tudo igual, só muda de endereço"". A bem da verdade, mães quase sempre têm os mesmos medos e preocupações - muitos dos quais, inclusive, os filhos só conseguem compreender quando eles mesmos se tornam pais. Por isso, em homenagem ao Dia das Mães, celebrado neste domingo, 13/5, o Gshow convidou as apresentadoras do Encontro e do É de Casa para uma homenagem a todas as mães.  Fátima Bernardes, Ana Furtado, Patrícia Poeta e Cissa Guimarães revelam como a maternidade mudou suas vidas, o que ouviam das próprias mães e só foram entender após terem filhos e o que fazem hoje em dia que é igual ao comportamento de suas mães. Assista ao vídeo! ",famosos,,,,,,
2018-05-24,https://web.archive.org/web/20180524092712/https://gshow.globo.com/Famosos/noticia/gabriel-fuentes-relembra-trajetoria-dificil-antes-de-conseguir-papel-em-malhacao.ghtml,https://gshow.globo.com/Famosos/noticia/gabriel-fuentes-relembra-trajetoria-dificil-antes-de-conseguir-papel-em-malhacao.ghtml,Gabriel Fuentes relembra trajetória difícil antes de conseguir papel em 'Malhação'," Não se engane pela pouca idade ou o rosto jovem: Gabriel Fuentes sabe bem o que quer. Aos 22 anos, o ator, que interpreta Érico, protagonista da sexta quinzena de Malhação: Vidas Brasileiras, tem colhido os primeiros frutos na busca de seu sonho: viver da arte.  Natural de Pedro Leopoldo, no interior de Minas Gerais, Gabriel diz que a veia artística sempre esteve presente em sua vida. ""Sempre fui artista, desde pequeno"", conta ele, durante o papo com o Gshow. Confira o vídeo acima!  ""Minha avó é muito católica e, desde cedo, sempre fui o menino Jesus na nossa igreja. Ela é costureira, então pegava panos e retalhos e fazia fantasias para eu reunir meus amigos e primos e brincar de faz de conta. Minha mãe também sonhava em ser atriz e costumava desfilar como baliza nas celebrações de 7 de Setembro na minha cidade. Cresci tendo elas como minhas referências"".  Apesar disso, a trajetória até aqui não foi fácil. ""Não tenho meu pai presente, só a minha mãe. E perdi meu avô muito cedo também. Minha mãe me ajudou, investiu, apostou e sempre esteve comigo. Ela é a minha Mulher-Maravilha. Sempre falo que ela só não sonha comigo, mas vive essa realidade"".  ""Durante um ano, morei com a minha tia na Zona Norte, mas não tinha noção da realidade da cidade. Passei por muita coisa, mas precisei voltar para a minha cidade devido às minhas condições financeiras"", admite.  ""Quando cheguei na minha cidade, conversei com a minha mãe e falei: 'Olha só, a realidade é muito diferente, mas preciso voltar. Quero viver no Rio, fazer teatro, tentar televisão, experimentar cinema... Quero viver da arte'. Comecei a correr atrás"".  ""Consegui um emprego no shopping como vendedor em uma loja de calçados e passei em um curso de processos administrativos para começar a juntar uma grana. Depois de dois meses, achei que não era suficiente e resolvi começar a vender sanduíche natural também. Em seis meses, consegui juntar um dinheiro, voltei para o Rio e fui correr atrás como qualquer outro artista: batendo em porta de agência e produção de elenco"", recorda.  ""A gente busca tanto, tanto, tanto, que quando acontece o momento, a gente não acredita. Quando a novela estreou, fiquei em um estado meio de êxtase"", analisa o ator. ""Mas tenho meus pés no chão e acho que tudo é consequência de um trabalho bem feito, de entrega e dedicação. E essa oportunidade chegou na hora em que eu mais queria."" ",famosos,,,,,,
2018-05-24,https://web.archive.org/web/20180524092712/https://gshow.globo.com/Famosos/noticia/lazaro-ramos-lanca-livro-para-criancas-e-se-declara-aos-filhos-a-maior-inspiracao-hoje-em-dia-e-a-existencia-deles.ghtml,https://gshow.globo.com/Famosos/noticia/lazaro-ramos-lanca-livro-para-criancas-e-se-declara-aos-filhos-a-maior-inspiracao-hoje-em-dia-e-a-existencia-deles.ghtml,Lázaro Ramos lança livro para crianças e se declara aos filhos: ‘A maior inspiração hoje em dia é a existência deles'," Criança é um ser fantástico: de tanta curiosidade, tira suas próprias conclusões; dia a dia vai criando seu “dialeto”, sua forma de classificar e explicar as coisas. Daí nascem palavras cheias de cabimento e que não existem no dicionário adulto. É assim, inspirado na convivência com seus dois filhos, João Vicente, de 7 anos, e Maria Antônia, de 3, que Lázaro Ramos criou mais um mundo – seu novo livro “Caderno Sem Rimas da Maria” – onde “atrapalhante” é uma menina que quer copiar o irmão mais velho!  “O primeiro verbete do livro não fui eu quem criei, foi João. Um dia ele estava reclamando que a irmã ficava querendo fazer tudo o que ele fazia e ele falou que ela era “atrapalhante”. E eu disse: ‘Nossa, essa palavra faz todo sentido e ela não existe!’. E foi isso que me inspirou a criar outras palavras”, conta Lázaro, que faz o lançamento da sua terceira obra de literatura infantil neste sábado, 19/5, no Rio de Janeiro, e domingo, 20/5, em São Paulo. Veja detalhes sobre os eventos abaixo.  “O livro é uma tentativa de criar nomes para sensações que ainda não tem nome, como um carinho feito na cabeça de um filho ou a liberdade e o direito de brincar com o que quiser ou “jubula”, que é um verbete que eu gosto muito, que é a descrição de uma sensação de quando você ouve uma palavra e se emociona só de ouvir”, completa.  Com a fórmula de explicar esse jeito das crianças de verem o mundo, Lázaro acaba abordando temas importantes para a formação e empoderamento dos pequenos como cidadãos e pessoas afetuosas no futuro.  “A primeira mensagem que eu quero passar é de que a leitura é um lugar de prazer e que nesse lugar que é o encontro com o livro, você pode falar dos mais variados assuntos - se você tiver afeto e permitir que o humor e a ludicidade se façam presentes para a gente debater sobre aquilo que forma o caráter dos nossos filhos e que preparam eles para a vida adulta. Esse é o desejo”.  E na casa dele e de Taís Araújo, não tem essa de “espeto de pau”. O ator conta que, no seu lar, fala-se sobre tudo. “Claro que na linguagem que seja acessível para a idade dos nossos filhos”, pondera.  “Acho que uma coisa muito bonita é que eles sempre acessam a gente para perguntar coisas e tirar dúvidas e, a partir daí, a gente vai construindo o nosso universo em cima dos valores que a gente acredita: a afetividade, ter consciência dos direitos e deveres, a importância da família, do olhar sem preconceito, de brincar, do tempo de brincar e de vivenciar a sua idade plenamente, sem tentar antecipar nada”.  Apesar de experiente no ofício de escritor e com mais dois livros infantis assinados por ele – “A Velha Sentada” e “Caderno de Rimas do João” – este lançamento é o primeiro que Lázaro escreveu já pensando em ser para as crianças.  “Os outros, eu ia colocando no papel apenas os assuntos que eu queria comunicar com o mundo, os valores que eu queria passar para as crianças - o tema da autoestima é um tema muito presente, poder falar sobre brincadeira, de como é importante o tempo de brincar da criança -, mas eu não sabia que era uma linguagem para o público infantil”, detalha o artista.  “Como não tenho encomendas de texto, eu escrevo muito livremente. E claro que meus filhos me inspiram. Acho que a maior inspiração hoje em dia é a existência deles e a relação que a gente vem construindo”.  “O primeiro livro, eu não tinha filho e convivia com muitas crianças e escrevi um pouco para a criança que eu fui, pegando temas da minha infância e da observação que eu fazia delas. Depois que meus filhos nasceram, o aprendizado que eles me trouxeram é o que me inspira. No caso do João, a criar explicações lúdicas através de rimas de coisas do mundo; e no caso de Maria, criar nomes para sensações da nossa convivência, da convivência dentro na nossa casa com o mundo e que ainda não tem nome”.  *Colaborou Victor Hugo Camara ",famosos,,,,,,
