data,url_noticia,url_noticia_curto,titulo,conteudo_noticia,assunto,assunto_ex,titulo_ex,subtitulo_ex,local_ex,artigo_ex,n_paragrafos
2018-06-14,https://web.archive.org/web/20180614104431/https://g1.globo.com/politica/noticia/quatro-ministros-votam-a-favor-da-conducao-coercitiva-e-2-contra-stf-adia-decisao.ghtml,https://g1.globo.com/politica/noticia/quatro-ministros-votam-a-favor-da-conducao-coercitiva-e-2-contra-stf-adia-decisao.ghtml,Quatro ministros votam a favor da condução coercitiva e dois contra; STF adia decisão," O plenário do Supremo Tribunal Federal (STF) retomou nesta quarta-feira (13) a discussão acerca da possibilidade de juízes obrigarem investigados e réus a serem levados para depor, a chamada ""condução coercitiva"".  Ao fim da sessão, formou-se placar de 4 votos favoráveis à condução coercitiva e 2 contra – o julgamento foi interrompido e será retomado nesta quinta (14) para a decisão final, que depende do mínimo de 6 votos entre os 11 ministros da Corte.  O assunto começou a ser analisado pelo plenário do STF na semana passada, quando Gilmar Mendes votou pela proibição definitiva do instrumento. Em dezembro do ano passado, ele concedeu liminar (decisão provisória) proibindo as conduções coercitivas em todo o país.  Para o ministro, há exposição e coação arbitrárias na condução coercitiva, que interfere no direito de locomoção, liberdade, dignidade, defesa e na garantia de não haver autoincriminação.  Na retomada do julgamento, nesta quarta (13), o ministro Alexandre de Moraes divergiu e defendeu a condução coercitiva, mas desde que o investigado ou réu seja intimado antes para comparecer ao interrogatório (veja detalhes de cada voto ao final da reportagem).  As ações contra as conduções coercitivas foram propostas pelo PT e pela Ordem dos Advogados do Brasil (OAB) sob alegação de ofensa à Constituição, por supostamente ferir o direito da pessoa de não se autoincriminar.  Segundo o Código de Processo Penal, a condução coercitiva pode ser decretada pelo juiz quando o suspeito “não atender à intimação para o interrogatório, reconhecimento ou qualquer outro ato que, sem ele, não possa ser realizado”.  Na sessão desta quarta, entre os ministros que votaram em favor da condução coercitiva, formaram-se duas correntes internas.  Para Alexandre de Moraes, o instrumento pode ser usado somente depois que o suspeito se recusa a depor quando previamente intimado.  Para Edson Fachin, Luís Roberto Barroso e Luiz Fux, porém, a medida também pode ser aplicada em substituição à prisão preventiva – aquela decretada antes de eventual condenação (entenda melhor abaixo na descrição de cada voto).  Caso a condução venha a ser permitida pela maioria, a definição exata das condições em que poderá ser decretada só deve ser delineada ao final do julgamento.  Usado com frequência na Operação Lava Jato, o instrumento foi utilizado, por exemplo, para ouvir o ex-presidente Luiz Inácio Lula da Silva, em 2016.  No final do ano passado, Gilmar Mendes proibiu provisoriamente a medida, mantendo, porém, a validade das investigações que até então a haviam utilizado. A decisão a ser tomada pelo plenário vai manter ou derrubar essa proibição.  Gilmar Mendes - Primeiro a votar no julgamento, no último dia 7, Gilmar Mendes disse que a condução coercitiva passou tornou-se um meio para a “espetacularização da investigação” e que o STF deveria restringi-la somente para situações em que um suspeito seja levado contra sua vontade à delegacia para identificação por exemplo, mas não para interrogatórios.  “Não há contraposição entre respeito aos direitos fundamentais e combate à corrupção. Combate a corrupção tem de ser feito nos termos estritos da lei. Quem defende um direito alternativo para combater a corrupção já não está no Estado de Direito. Mas é bom lembrar: assim se fez o nazi-facismo”, disse o ministro.  Alexandre de Moraes - Foi o primeiro a divergir. Em seu voto, considerou válida a obrigação de uma pessoa depor, mas somente na hipótese de a pessoa recusar uma intimação prévia. Para ele, a Constituição garante ao suspeito somente o direito ao silêncio e à não autoincriminação, mas não prevê a possibilidade de ele recusar participação no processo penal.  “O que há é a possibilidade de perante o Estado se manifestar e aí sim exercer seu direito ao silêncio. Não há a meu ver previsão de cláusula que permita ao investigado de optar por participar da persecução penal presencialmente. O que não se pode exigir é que produza provas contra si mesmo, que seja obrigado a falar, não que ignore os instrumentos previstos no CPP na persecução penal”, disse Moraes.  Edson Fachin - Relator da Operação Lava Jato no STF, Edson Fachin também admitiu a possibilidade de conduções coercitivas. Mas para o ministro, a medida poderá ser feita sem intimação prévia se houver motivos para levar o suspeito à prisão preventiva – aquela decretada antes de eventual condenação, para evitar fuga, prejuízo às investigações ou risco de novos crimes, por exemplo.  Assim, para Fachin, a condução coercitiva torna-se uma medida favorável ao investigado, menos drástica, na medida que pode ser decretada em substituição à prisão. “Não se impede que o magistrado, diante de hipótese em que cabível prisão temporária ou preventiva, medidas mais graves, a substitua por condução coercitiva caso constate que é suficiente para os fins propostos por conveniência da instrução penal”, afirmou o ministro.  Luís Roberto Barroso - Também admitiu a condução coercitiva, concordando com os critérios estipulados por Moraes e Fachin: deve ser precedida de recusa do investigado em comparecer quando intimado, podendo ser usada em substituição à prisão preventiva.  “Se há modo menos severo de atender à demanda da justiça e menos restritivo do direito fundamental de ir e vir, por qual razão deveríamos impor a prisão cautelar, que é um meio mais gravoso? Se há medida menos gravosa para o réu, por que abdicaria dela?”. Além disso, Barroso ressaltou demais direitos do investigado ao ser levado para depor: pode permanecer em silêncio, ter preservada sua integridade física e moral, ser assistido por advogados e saber a identificação de responsáveis pela condução coercitiva.  Rosa Weber - Votou contra a condução coercitiva, junto com Gilmar Mendes, por considerar que a medida é restritiva da liberdade da pessoa, já que a Constituição garante à pessoa o direito ao silêncio.  “O interrogatório apresenta a oportunidade de o investigado apresentar sua versão dos fatos. Enquanto faculdade, só ao investigado ou réu cabe exercê-la ou não. A garantia constitucional de permanecer em silêncio impede qualquer imposição legal ou judicial ao investigado ou réu para efeito de interrogatório a qualquer autoridade"". Segundo a ministra, ""nenhuma consequência a ele desfavorável pode advir dessa opção”.  Luiz Fux - Último a votar nesta quarta, Luiz Fux votou em favor da condução coercitiva. Argumentou que eventuais excessos e medidas arbitrárias por parte do Estado numa investigação não devem servir de pretexto para proibir a condução coercitiva, especialmente de integrantes de organizações criminosas que praticam crimes contra a administração pública.  “O direito ao silêncio foi instituído para impedir a mentira, as falsas versões. Não significa dizer que se erige o direito à mentira. O direito ao silêncio é o direito de ficar calado. Agora, o Estado tem o direito de evitar que determinado investigado combine versões que possam frustrar a atividade estatal”, afirmou o ministro durante o julgamento. ",politica,,,,,,
2018-06-14,https://web.archive.org/web/20180614104431/https://g1.globo.com/politica/noticia/pf-confirma-que-geddel-vieira-lima-esteve-em-local-de-entrega-de-propina-apontado-por-delator.ghtml,https://g1.globo.com/politica/noticia/pf-confirma-que-geddel-vieira-lima-esteve-em-local-de-entrega-de-propina-apontado-por-delator.ghtml,PF afirma que Geddel Vieira Lima esteve em local de entrega de propina apontado por delator," A Polícia Federal (PF) concluiu que o ex-ministro Geddel Vieira Lima (MDB-BA) esteve no local apontado como ponto de entrega de propina pelo delator Lúcio Funaro, doleiro e suposto operador financeiro do MDB.  Segundo a PF, o celular do ex-ministro foi rastreado por antena de telefonia móvel no local, nas datas e nos horários em que Funaro dizia estar levando malas de dinheiro para Geddel. A TV Globo procurou a defesa de Geddel e aguardava resposta até a última atualização desta reportagem.  De acordo com a PF, Geddel estava nas proximidades do aeroporto de Salvador onde, segundo Funaro, havia um hangar usado pelo ministro para receber o dinheiro.  O rastreamento foi um dos motivos que levaram a a PF a indiciar ex-ministro por corrupção na Operação Cui Bono, que investiga fraudes na liberação de empréstimos da Caixa Econômica Federal.  Os investigadores descobriram a localização de Geddel porque ele usou o celular para fazer ligações, parte para o deputado cassado Eduardo Cunha (MDB-RJ), que usava Funaro como operador de propinas, segundo as investigações.  A PF consegue rastrear a localização de um investigado quando ele usa o celular porque o aparelho 'se comunica' com a torre de telefonia móvel de cada região.  A revelação está no relatório da Operação Cui Bono remetido na semana passada à Justiça Federal em Brasília ao qual a TV Globo teve acesso.  No relatório, o delegado Marlon Cajado detalha que ""[...] a análise do terminal utilizado por Lúcio Funaro – (11) xxxx xxxx – , onde é possível verificar que seu telefone utilizou a antena ou estação rádio-base (ERB) das proximidades do Aeroporto de Salvador/BA, no dia 29/01/2014, precisamente às 19:39:52h. De outro lado, às 19:00h da mesma data de 29/01/2014, a ERB do terminal utilizado por Geddel Vieira Lima, (71) xxxx xxxx, também foi registrada nas proximidades do aeroporto de Salvador/BA"".  A PF cruzou informações obtidas pelo rastreamento das ligações com material aprendido durante a operação. Uma planilha de Funaro aponta ""saída"" de dinheiro para Geddel no dia 17 de fevereiro de 2014. No dia seguinte, a PF rastreou a ida de Funaro para o hangar, no aeroporto de Salvador, e localizou Geddel. A polícia cita varias outras datas em que essa situação se repetiu.  Geddel foi indiciado na Operação Cui Bono por corrupção passiva, lavagem de dinheiro, organização criminosa e obstrução de investigação.  A PF concluiu que há indício de repasse de R$ 16,9 milhões a Geddel Vieira Lima entre 2012 e 2015.  O delegado chama a atenção para o fato de que a maioria dos pagamentos foi em 2014, “ano que Geddel foi candidato a Senador da República pelo Estado da Bahia. Desse modo, a hipótese criminal identificada é a de que Geddel Quadros Vieira Lima se utilizou da sistemática ilícita engendrada por Lucio Bolonha Funaro visando a ocultação, dissimulação e distribuição de recursos de origem ilícita [...]”.  Dezesseis pessoas foram indiciadas pela PF a partir das investigações da Operação Cui Bono, entre políticos, operadores e ex-dirigentes da Caixa.  O grupo é suspeito participar de um esquema de concessão de empréstimos da Caixa a empresas em troca de propina.  Além de Geddel Vieira Lima foram indiciados Eduardo Cunha e Lúcio Funaro.  Em nota divulgada à imprensa, a PF afirmou que o relatório final das investigações se baseou em provas obtidas em ações de busca e apreensão, depoimentos e análise de dados.  O relatório final foi encaminhado à 10ª Vara da Justiça Federal em Brasília, responsável pelo processo. ",politica,,,,,,
2018-06-24,https://web.archive.org/web/20180624101320/https://g1.globo.com/politica/noticia/eleitores-de-sete-cidades-e-do-to-voltam-as-urnas-neste-domingo-para-eleicoes-suplementares.ghtml,https://g1.globo.com/politica/noticia/eleitores-de-sete-cidades-e-do-to-voltam-as-urnas-neste-domingo-para-eleicoes-suplementares.ghtml,Eleitores de sete cidades e do Tocantins voltam às urnas neste domingo para eleições suplementares," Eleitores de sete cidades voltarão às urnas neste domingo (22) para eleger prefeitos e vice-prefeitos (consulte aqui a situação do seu título).  Além disso, o estado de Tocantins também terá neste domingo o segundo turno da eleição suplementar para governador.  Saiba abaixo as cidades onde haverá eleição neste domingo (por ordem alfabética):  Os prefeitos e vice-prefeitos eleitos cumprirão mandato até 31 de dezembro de 2020.  As eleições suplementares são determinadas pela Justiça Eleitoral quando os eleitos tiveram o mandato cassado ou o registro de candidatura indeferido.  Ao todo, segundo o Tribunal Superior Eleitoral (TSE), cerca de 1,5 milhão de eleitores voltarão às urnas neste domingo.  Saiba abaixo quais candidatos disputarão as eleições deste domingo:  Tocantins (governador)  Cabo Frio (prefeito)  Itanhomi (prefeito)  Moju (prefeito)  Rio das Ostras (prefeito)  Santa Cruz das Palmeiras (prefeito)  Santa Luzia (prefeito)  Timóteo (prefeito) ",politica,,,,,,
2018-06-24,https://web.archive.org/web/20180624101320/https://g1.globo.com/politica/noticia/fachin-arquiva-pedido-de-liberdade-de-lula.ghtml,https://g1.globo.com/politica/noticia/fachin-arquiva-pedido-de-liberdade-de-lula.ghtml,Fachin arquiva pedido de liberdade de Lula; defesa do ex-presidente diz que recorrerá," O ministro Luiz Edson Fachin, do Supremo Tribunal Federal (STF), arquivou nesta sexta-feira (22) o pedido de liberdade apresentado pela defesa do ex-presidente Luiz Inácio Lula da Silva.  Após a decisão, a defesa de Lula informou à GloboNews que recorrerá da decisão (leia a íntegra da nota ao final desta reportagem).  Lula está preso desde abril, após ter sido condenado na Lava Jato, e o pedido seria julgado na próxima terça (26). O recurso já foi retirado da pauta de julgamentos da Segunda Turma do Supremo.  Fachin decidiu pelo arquivamento após o Tribunal Regional Federal da Quarta Região (TRF-4), responsável pela Lava Jato em segunda instância, enviar o caso de Lula para o Superior Tribunal de Justiça (STJ), e não para o STF.  Para o ministro, desta forma, o pedido de liberdade ficou ""prejudicado"".  A defesa do ex-presidente chegou a pedir ao STF que, se a liberdade fosse rejeitada, o petista passasse a cumprir a pena em prisão domiciliar.  Condenado a 12 anos e 1 mês, em regime inicialmente fechado, Lula está preso na Superintendência da Polícia Federal em Curitiba (PR). Ele foi condenado em segunda instância pelos crimes de corrupção passiva e lavagem de dinheiro.  A prisão foi decretada porque, no entendimento do TRF-4, Lula recebeu da OAS um triplex em Guarujá (SP) em retribuição a contratos firmados pela construtora com a Petrobras.  Desde o começo das investigações, Lula nega a acusação, afirmando que o imóvel não é dele e que ele não praticou crimes. A defesa do ex-presidente também afirma que a acusação do Ministério Público não apresentou provas.  A defesa de Lula apresentou ao STF um pedido de efeito suspensivo da execução da pena, ou seja, para o ex-presidente aguardar em liberdade enquanto os recursos são julgados nas instâncias superiores.  A defesa também pediu a suspensão da inelegibilidade gerada com a condenação na segunda instância da Justiça, conforme prevê a Lei da Ficha Limpa.  Para isso, a defesa entregou memoriais aos ministros da Segunda Turma nesta quinta (21) e fez também um pedido alternativo: para Lula cumprir prisão domiciliar se o pedido de liberdade fosse rejeitado.  No pedido para suspender a prisão e a inelegibilidade, a defesa reiterou argumentos já apresentados ao TRF-4 que apontam supostas irregularidades no processo, entre as quais:  Os advogados de Lula alegam que a soltura do ex-presidente ""não causará nenhum dano à Justiça Pública ou à sociedade"", acrescentando que a manutenção dele na cadeia causa ""lesão grave de difícil reparação"".  Leia abaixo a íntegra da nota divulgada pela defesa do ex-presidente Lula:  A defesa do ex-presidente Lula recorrerá das decisões proferidas hoje (22/06) e estranha que o TRF4 tenha analisado a admissibilidade do recurso extraordinário às vésperas do julgamento marcado pela presidência da 2a. Turma do STF para analisar o pedido de liberdade do ex-presidente.  A decisão do TRF4 foi proferida poucas horas após a defesa de Lula haver apresentado à vice-presidência da Corte, em audiência, memorial demonstrando a presença de todos os requisitos para a admissibilidade dos recursos especial e extraordinário interpostos em 23/04  CRISTIANO ZANIN MARTINS ",politica,,,,,,
2018-06-24,https://web.archive.org/web/20180624101320/https://g1.globo.com/politica/noticia/pgr-diz-que-testemunha-da-lava-jato-foi-ameacada-de-morte-a-mando-de-ciro-nogueira-e-eduardo-da-fonte.ghtml,https://g1.globo.com/politica/noticia/pgr-diz-que-testemunha-da-lava-jato-foi-ameacada-de-morte-a-mando-de-ciro-nogueira-e-eduardo-da-fonte.ghtml,PGR diz que testemunha da Lava Jato foi ameaçada de morte a mando de Ciro Nogueira e Eduardo da Fonte," A Procuradoria Geral da República (PGR) apontou ameaça de morte a uma testemunha da Operação Lava Jato supostamente a mando do presidente do PP, o senador Ciro Nogueira (PP-PI), e pelo deputado Eduardo da Fonte (PP-PE).  Ciro Nogueira e Eduardo da Fonte foram denunciados nesta semana por suposta obstrução de Justiça, segundo a PGR, por ordenar o ex-deputado Márcio Junqueira (ex-filiado ao PP) a pressionar um ex-assessor e motorista a desmentir depoimentos prestados à Polícia Federal.  Procurada, a assessoria do deputado enviou a seguinte nota: ""Eduardo da Fonte reitera que a acusação é completamente mentirosa e absurda e que ele está à disposição da justiça para que os fatos sejam esclarecidos rapidamente"".  Ao G1, o advogado de Ciro Nogueira, Antônio Carlos de Almeida Castro, disse que a acusação contra o parlamentar é ""fantasiosa"", ""criminosa"" e de uma ""irresponsabilidade enorme"".  ""Não existe nada nos autos que leve – sequer 'en passant' – a qualquer hipótese de o senador Ciro estar envolvido nisso. Então, é muito grave. Tem quer ver os autos, tem que ler e distanciar profundamente quem são os investigados"", declarou o advogado.  Considerado um ""arquivo vivo"", José Expedito trabalhou para Ciro e Eduardo da Fonte por mais de dez anos, sendo ""pessoa próxima e de confiança"" dos parlamentares, incumbido de transportar dinheiro para eles em diversas ocasiões, segundo a PGR.  Em setembro de 2016, José Expedito confessou os crimes à PF e entregou o que diz serem provas. Segundo a PGR, em 2017, a mando de Ciro Nogueira e de Eduardo da Fonte, Márcio Junqueira passou a exigir de José Expedito uma ""retratação"" das revelações que fez nos depoimentos.  ""A mando dos parlamentares, a partir de outubro de 2017, nos termos retratados nesta denúncia, Márcio Junqueira ameaçou José Expedito de morte, exigiu dele uma retratação em cartório do conteúdo dos depoimentos que prestou à PF em 2016 (declaração ideologicamente falsa), prometeu-lhe cargo público, casa, pagou-lhe despesas e fez entregas de dinheiro —, tudo para comprar seu silêncio e, assim, prejudicar investigações em curso"", diz a denúncia.  A ""intimidação"" da testemunha, diz a PGR, durou de outubro do ano passado até março deste ano. Os pagamentos a Expedito, ainda segundo a procuradoria, passaram de R$ 100 mil, por meio de quitação de boletos e entrega de dinheiro, além de uma promessa de mais de R$ 150 mil e cargo público.  A denúncia da PGR detalha os encontros de Márcio Junqueira com José Expedito, um deles acompanhado e fotografado pela PF num shopping em Brasília. Na ocasião, houve entrega de dinheiro e boletos para pagamento de contas.  Em depoimento durante a investigação, Ciro Nogueira negou relação com José Expedito. Disse que o demitiu de seu gabinete em 2010 ""porque não tinha postura adequada"" e que depois não teve mais qualquer relação funcional ou profissional.  Na denúncia, além de pedir a condenação pelo crime de embaraçar investigação que envolva organização criminosa, cuja pena vai até 8 anos de prisão, a PGR pede também a perda dos mandatos de Ciro e Dudu da Fonte.  O oferecimento da denúncia não representa condenação. A partir de agora, caberá ao STF decidir se acolhe ou não a acusação do Ministério Público.  Se o tribunal acolher a denúncia, eles se tornarão réus, e uma ação penal será aberta. Somente depois da etapa de coleta de provas e depoimentos de testemunhas é que o STF decidirá se os condena ou os absolve.  Quando a denúncia da PGR foi apresentada, a defesa de Ciro Nogueira se disse ""perplexa"" com a acusação, acrescentando que não existe ""qualquer indício que justifique esta acusação tão grave"".  À TV Globo, o advogado de Márcio Junqueira, Roberto Bertholdo, declarou que ""surpreende, mais uma vez, que a imprensa tenha tomado conhecimento da denúncia antes da defesa e, também, o fato de a PGR oferecer a denúncia já que não existe nenhum elemento que comprove a alegada obstrução de Justiça.""  * Colaborou Gustavo Garcia, do G1, em Brasília ",politica,,,,,,
2018-07-03,https://web.archive.org/web/20180703163624/https://g1.globo.com/politica/noticia/presidente-do-bndes-afirma-que-discute-com-o-governo-antecipar-pagamentos-de-emprestimos-ao-tesouro-nacional.ghtml,https://g1.globo.com/politica/noticia/presidente-do-bndes-afirma-que-discute-com-o-governo-antecipar-pagamentos-de-emprestimos-ao-tesouro-nacional.ghtml,Presidente do BNDES afirma que discute com o governo antecipar pagamentos de empréstimos ao Tesouro Nacional," O presidente do Banco Nacional de Desenvolvimento Econômico e Social (BNDES), Dyogo Oliveira, afirmou nesta terça-feira (3) que discute com o governo federal como antecipar o pagamento de empréstimos feitos pelo Tesouro Nacional ao banco. Segundo ele, faz parte de um esforço para reduzir a dependência do banco do Tesouro Nacional.  Dyogo comentou a negociação durante entrevista no Palácio do Planalto, após reunião com o presidente Michel Temer. Segundo ele, pelos contratos em vigor, o pagamento de R$ 250 bilhões deveria ser concluído por volta de 2060.  A possibilidade do BNDES antecipar o pagamento dos empréstimos do Tesouro ao banco foi noticiada nesta terça pelo jornal ""O Estado de S. Paulo"".  Segundo a reportagem, o banco poderia devolver cerca de R$ 25 bilhões até 2040. A outra opção seria antecipar o pagamento em 15 anos, até 2045.  Na entrevista, Dyogo foi questionado sobre a reportagem. O presidente do BNDES confirmou a negociação.  “Dentro dessa visão é que nós estamos discutindo com o Ministério da Fazenda uma aceleração da devolução dos recursos remanescentes”, disse Dyogo.  Ele informou ainda que o banco acertou a devolução para este ano de R$ 130 bilhões ao Tesouro – R$ 60 bilhões já foram pagos e outros R$ 70 bilhões têm previsão de pagamento em agosto.  “Após esses pagamentos restariam R$ 250 bilhões no BNDES, que, pelos contratos atuais, seriam pagos nos últimos anos do contrato por volta de 2060"", informou.  ""Nós estamos ajustando com o Tesouro, ainda não há uma conclusão, mas nós estamos discutindo como antecipar esse pagamento e ter um fluxo mais equilibrado ao longo do período, porque o contrato atual o fluxo de pagamentos é todo muito próximo do final”, completou Dyogo. ",politica,,,,,,
