data,url_noticia,url_noticia_curto,titulo,conteudo_noticia,assunto,assunto_ex,titulo_ex,subtitulo_ex,local_ex,artigo_ex,n_paragrafos
2020-02-10,https://web.archive.org/web/20200210000017/https://globoesporte.globo.com/futebol/times/corinthians/noticia/tiago-nunes-cogita-mudancas-no-corinthians-para-a-libertadores-temos-de-dar-resposta-imediata.ghtml,https://globoesporte.globo.com/futebol/times/corinthians/noticia/tiago-nunes-cogita-mudancas-no-corinthians-para-a-libertadores-temos-de-dar-resposta-imediata.ghtml,"Tiago Nunes cogita mudanças no Corinthians para a Libertadores: ""Temos de dar resposta imediata"""," O técnico Tiago Nunes admite que o momento do Corinthians é de oscilação, principalmente depois da derrota deste domingo por 1 a 0 para a Inter de Limeira, em Itaquera, pelo Campeonato Paulista.  Às vésperas do jogo decisivo contra o Guaraní, do Paraguai, pela segunda fase da Copa Libertadores, o técnico ressaltou o processo de evolução da equipe, mas também lembrou que o resultado é necessário nesta quarta-feira – o Timão precisa vencer por dois gols de diferença para avançar na competição internacional.  + Leia mais notícias do Corinthians  – A gente oscilou performance, em uns momentos bons e outros ruins. É um processo natural, mas para o Corinthians a gente sabe que precisa de mais. Precisa vencer também. Não adianta jogar bonito e não ganhar. É um jogo de eficiência. Temos sabedoria que estamos em processo de evolução, e vamos evoluir. Mas ao mesmo tempo também temos de entregar resultado imediato. O torcedor nos apoiou o tempo todo, independentemente da circunstância do resultado, tomou chuva e merece um resultado melhor – disse Tiago Nunes.  Por essa ""resposta imediata"", Tiago Nunes cogita fazer mudanças na equipe para o duelo de quarta-feira. Dois dos nomes possíveis são Lucas Piton, concorrente de Sidcley na lateral esquerda e titular contra a Inter de Limeira, e Pedrinho, que voltará da seleção brasileira sub-23.  – O que me preocupa é a sequência de jogos, o acúmulo de jogos. Alguns jogadores pagaram um preço um pouco mais caro hoje. Com a alternância do Piton como titular e suplente pode sim jogar na quarta-feira. Mas ainda vou avaliar nos próximos dois dias – destacou Tiago.  + Atuações: as notas dos jogadores do Timão  – Estou esperando o Pedrinho retornar da Seleção. (...) A partir do retorno a gente conversa, vou tentar conversar antes via telefone para ver em que condições chega para ver se vai estar à disposição na quarta-feira. A partir da conversa e de ver como ele vai chegar, a gente decide se joga ou não – completou.  O Corinthians volta a treinar nesta segunda-feira, no CT Joaquim Grava. ",esportes,,,,,,
2020-02-10,https://web.archive.org/web/20200210000017/https://globoesporte.globo.com/rs/futebol/times/gremio/noticia/renato-explica-trocas-em-derrota-do-gremio-e-diz-que-nao-e-treinador-covarde.ghtml,https://globoesporte.globo.com/rs/futebol/times/gremio/noticia/renato-explica-trocas-em-derrota-do-gremio-e-diz-que-nao-e-treinador-covarde.ghtml,"Renato explica trocas em derrota do Grêmio e diz que não é ""treinador covarde"" "," O Grêmio perdeu para o Aimoré por 2 a 1 na tarde deste domingo, no Cristo Rei, e terminou a fase de grupos do primeiro turno do Campeonato Gaúcho na segunda colocação do Grupo B. Na semifinal, encara o rival Inter no Beira-Rio, ainda sem datas e horários definidos. O técnico Renato Gaúcho admitiu atuação abaixo do time gremista e explicou as trocas ao deixar só Maicon como volante no meio-campo.  + Veja as notas dos jogadores do Grêmio na derrota  Lucas Silva deixou o time depois do primeiro gol do Aimoré para a entrada de Thiago Neves. Na sequência, saíram Luciano para a entrada de Patrick e Cortez para Ferreira ir para o jogo. Maicon ficou como único volante e estiveram em campo ao mesmo tempo Alisson, Diego Souza, Everton, Thiago Neves, Patrick e Ferreira. O segundo gol do Índio Capilé saiu em contra-ataque.  – Serve para treinador covarde, que tem medo de colocar o time para frente. Improvisei na última substituição o Patrick na lateral, porque o Cortez não fez uma boa partida. Não adiantava tirar um lateral pelo outro, procurei colocar a equipe para frente. Fizemos um gol, mas não chegamos ao resultado que a gente esperava. Agora é trabalhar, levantar a cabeça e pensar no próximo jogo. Vamos jogar o Gre-Nal – explicou o treinador.  A derrota foi a primeira partida de Diego Souza como titular do Grêmio em seu retorno. O camisa 29 anotou o gol do Grêmio, seu segundo nesta passagem. Luciano foi o jogador centralizado, um segundo atacante. O treinador explicou a opção e disse que não quis escalar Diego Souza e Thiago Neves juntos pela falta de ritmo de jogo da dupla.  – Já previa durante a semana, calor muito forte, gramado não dos melhores. Mas acima de tudo a falta de ritmo de jogo do Diego e do próprio Thiago. Não adianta colocar em um calor desse e em campo desse, jogadores longe do 100%. O Luciano já jogou várias vezes por ali, por isso coloquei o Diego e não o Thiago com ele.  O Grêmio volta a treinar na tarde desta segunda-feira, no CT Luiz Carvalho, e terá o retorno de Matheus Henrique, Phelipe Megiolaro e Pepê, convocados pela seleção sub-23, e a chegada do reforço Caio Henrique, que tem desembarque previsto para terça-feira em Porto Alegre. O treinador terá uma semana para preparar o time para o clássico Gre-Nal no fim de semana. ",esportes,,,,,,
2020-02-11,https://web.archive.org/web/20200211000008/https://globoesporte.globo.com/futebol/futebol-internacional/futebol-frances/noticia/unai-emery-diz-que-tentou-tirar-thiago-silva-da-zona-de-conforto-e-elogia-neymar-facil-de-treinar.ghtml,https://globoesporte.globo.com/futebol/futebol-internacional/futebol-frances/noticia/unai-emery-diz-que-tentou-tirar-thiago-silva-da-zona-de-conforto-e-elogia-neymar-facil-de-treinar.ghtml,"Unai Emery diz que tentou tirar Thiago Silva da zona de conforto e elogia Neymar: ""Fácil de treinar"""," Sem clube desde novembro, quando foi demitido do Arsenal, o técnico espanhol Unai Emery é capa da próxima edição da revista “France Football” e, claro, fez vários comentários sobre seu período à frente do PSG. Dentre eles, o ex-comandante da equipe francesa fez questão de elogiar Neymar. E afirmou que ainda espera que o brasileiro seja o melhor jogador do mundo.  – Com um jogador tão fenomenal, você não pode dizer a ele que já existe um time, e que ele tem que se adaptar. Você tem que fazer o time para ele – declarou o técnico.  + Em papo com Beckham, Neymar diz que se inspira em inglês e brinca: ""Pedi para jogar no time dele""  Emery foi o primeiro treinador de Neymar no PSG. O espanhol deixou o clube no fim da temporada 2017/18, depois de dois anos na equipe e sete títulos, entre eles o Campeonato Francês.  À “France Football”, ele também disse por que chegou a deixar Thiago Silva, capitão do PSG, no banco. Na partida de ida das oitavas de final da Liga dos Campeões contra o Real Madrid em 2018, o defensor foi reserva.  – Thiago Silva é um grande jogador, mas eu queria que ele fosse maior e eu não conseguia fazê-lo aceitar isso. Queria tirá-lo da zona de conforto, a ousar a se defender mais acima para que a pressão geral do time no oponente fosse mais efetiva. Eu trabalhei com ele para fazê-lo aceitar isso, mas não tive sucesso.  Unai Emery: ""No Paris, eu poderia me tornar o melhor treinador do mundo. Perdi a oportunidade""  Técnico do PSG na fatídica derrota para o Barcelona por 6 a 1 nas oitavas de final da Liga dos Campeões em 2017, Emery não se esquivou do assunto. E garantiu: o Paris não seria eliminado naquela noite se houvesse árbitro de vídeo na ocasião.  – Na primeira temporada, no mata-mata contra o Barcelona, estávamos jogando em grande nível na partida de ida. Mas na volta, fomos eliminados porque o VAR não existia. Fomos claramente eliminados por decisões da arbitragem – disse o treinador, que havia vencido o Barça por 4 a 0 no jogo de ida, em Paris.  Tricampeão da Liga Europa com o Sevilla, Unai Emery ficou dois anos no PSG, entre 2016 e 2018. Foi anunciado no Arsenal para a temporada 2018/19 e foi demitido em novembro do ano passado, após sete jogos seguidos sem vencer. Desde então, o espanhol, de 48 anos, está sem clube. ",esportes,,,,,,
2020-02-11,https://web.archive.org/web/20200211000008/https://globoesporte.globo.com/pe/futebol/noticia/estudo-aponta-quais-clubes-mais-utilizaram-a-base-nos-cinco-ultimos-anos-santos-athletico-e-flu-lideram.ghtml,https://globoesporte.globo.com/pe/futebol/noticia/estudo-aponta-quais-clubes-mais-utilizaram-a-base-nos-cinco-ultimos-anos-santos-athletico-e-flu-lideram.ghtml,"Estudo aponta quais clubes mais utilizaram a base nos cinco últimos anos: Santos, Athletico e Flu lideram"," Seja por melhoria técnica, filosofia de desenvolvimento ou necessidade financeira, a utilização de atletas da base é vista como algo fundamental para os clubes brasileiros. No entanto, um estudo da Pluri Consultoria, que avaliou a utilização da base no futebol nacional nas últimas cinco temporadas, mostra que os jogadores formados por seus clubes atuaram uma média de 19,4% dos minutos jogados pelas 22 equipes analisadas.  + Seu time usou as joias da Copa São Paulo? Levantamento mostra que chance no profissional é exceção  Pelo recorte, o Santos aparece em primeiro lugar da lista, com 39,6% do tempo de jogo sendo disputados por atletas da base. A elevada média ainda poderia ser um pouco maior, se o uso da base não tivesse sido drasticamente reduzido em 2019, quando os pratas da casa atuaram por 22,9%. Número bem inferior aos 45,5% registrado na temporada de 2018.  Athletico (33,8%), Fluminense (29,4%), Coritiba (27,1%) e Goiás (24,7%) completam as cinco primeiras posições. No Nordeste, o Vitória aparece à frente dos outros quatro clubes da região analisados, com 18,3%, porcentagem que o coloca na 13ª posição geral. Quando se observa o recorte do Sul, o estado do Paraná lidera, com a dupla Athletico, 33,8 e Coritiba, 27,1%. Logo atrás vem o Internacional, com 24,4%, ocupando o sétimo lugar no ranking geral, com 24,4%, seguido pelo Grêmio, em oitavo no Brasil, com 23,4%.  Outro ponto que chama a atenção é o fato de que, apesar da fama de país que forma atacantes, o Brasil tem na defesa a posição mais utilizada, com 38% dos minutos jogados por esses atletas. O setor de criação vem logo na sequência, com 33%, enquanto atacantes só aparecem na terceira posição, com 19%. Os goleiros, por sua vez, saem por último na lista. E com base na pesquisa, no Brasil, os números indicam que a promoção para o profissional tem sido algo difícil. Isso porque apenas 9% dos minutos jogados pelas equipes foram disputados por goleiros vindos da base.  O estudo é mais um indicativo da baixa utilização dos atletas da base no futebol nacional. Em janeiro deste ano, o GloboEsporte.com publicou um levantamento sobre o aproveitamento de atletas que disputaram a Copa São Paulo de Futebol Júnior de 2019 e foram utilizados em seus clubes de origem na mesma temporada. Na ocasião, dos 1028 jogadores analisados, apenas 137 entraram em campo pelo profissional do clube - o que representa 13,3% do montante. ",esportes,,,,,,
2020-02-11,https://web.archive.org/web/20200211000008/https://globoesporte.globo.com/futebol/selecao-brasileira/noticia/fora-da-cbf-washington-pede-desculpas-e-admite-erro-meu-afastamento-foi-resposta-necessaria.ghtml,https://globoesporte.globo.com/futebol/selecao-brasileira/noticia/fora-da-cbf-washington-pede-desculpas-e-admite-erro-meu-afastamento-foi-resposta-necessaria.ghtml,"Fora da CBF, Washington pede desculpas e admite erro: ""Meu afastamento foi resposta necessária"""," Demitido pela CBF na última semana, Washington se manifestou pela primeira vez nesta segunda-feira. Pela rede social, o ex-jogador admitiu que errou e pediu desculpas publicamente. O Coração Valente disse que a entidade máxima do futebol foi coerente na decisão e admitiu que a resposta com seu afastamento era necessária.  Washington disse que não deveria ter entrado em campo a partir do momento em que ocupava o cargo de Diretor de Desenvolvimento da entidade, mas afirmou que foi ingênuo ao tomar a atitude naquele instante, sem pensar nas consequências.  - Preciso também compartilhar com todos meu desapontamento não só com a minha atitude. Mas, sobretudo, com minha ingenuidade. Eu estava indo para o camarote do estádio e o caminho para o mesmo é por trás do banco do Caxias. A coincidência temporal dos acontecimentos combinada com minha ligação ao clube, me fez realizar o erro. Inadmissível, eu repito. Estou muito triste e decepcionado com esta minha falta de tato - comentou o ex-jogador.  Confira a mensagem de Washington no Instagram:  ""Gostaria de me retratar publicamente pelo episódio da última quarta-feira no jogo entre Caxias e Botafogo, pela Copa do Brasil. Não cabe à um Diretor de Desenvolvimento da CBF estar presente no banco de reservas de qualquer clube, seja qual for a partida. Além disso, eu não deveria ter mostrado o vídeo do polêmico lance de arbitragem à comissao técnica do Caxias.  A Confederação Brasileira de Futebol foi coerente. Nesses novos tempos que a sociedade tenta implantar ética e transparência em todos os setores em que vivemos, meu asfatamento foi uma resposta necessária. Dura para mim, mas perfeitamente compreensível.  Posto isso, preciso também compartilhar com todos meu desapontamento nao só com a minha atitude. Mas, sobretudo, com minha ingenuidade. Eu estava indo para o camarote do estádio e o caminho para o mesmo é por trás do banco do Caxias. A coincidência temporal dos acontecimentos combinada com minha ligação ao clube, me fez realizar o erro. Inadmissível, eu repito.  Estou muito triste e decepcionado com esta minha falta de tato. Após anos e anos militando no mundo do futebol, pude construir uma imagem sólida de correção e entendo que uma considerável parte das pessoas que vivem no esporte tenham em mim bons exemplos.  Mas eu vou dar a volta por cima. Já passei por problemas mais sérios e tive nas pessoas que confio e amo o meu porto seguro. Encaro esse momento como mais uma oportunidade de continuar evoluindo, pois tenham a certeza que eu aprendi com este erro.  À todos do esporte, envolvendo torcida, dirigentes, atletas, árbitros, imprensa... peço reiteradamente as mais sinceras desculpas! Ao Botafogo já o fiz pessoalmente para o presidente Nelson Murrafej, inclusive.  À CBF, agradeço a oportunidade de trabalhar em um projeto sério de reformulação da entidade. Tenho a mais absoluta certeza de que estão no caminho certo. E não poderia deixar de destacar como a entidade foi franca e limpa comigo no episódio, culminando com minha demissão.  É hora e vez do coração ficar triste, mas nunca deixar de ser valente. Obrigado aos que me apoiaram e reafirmo que as críticas servirão para me aperfeiçoar como profissional e pessoa!!!  Washington"" ",esportes,,,,,,
2020-02-12,https://web.archive.org/web/20200212000033/https://globoesporte.globo.com/futebol/futebol-internacional/noticia/de-ronaldinho-a-adebayor-confira-10-contratacoes-incomuns-dos-ultimos-anos.ghtml,https://globoesporte.globo.com/futebol/futebol-internacional/noticia/de-ronaldinho-a-adebayor-confira-10-contratacoes-incomuns-dos-ultimos-anos.ghtml,De Ronaldinho a Adebayor: confira 10 contratações aleatórias dos últimos anos," Achou a contratação do atacante Adebayor pelo Olimpia aleatória? O reforço do time paraguaio para a disputa da Libertadores não foi o mais incomum nos últimos anos. Pelo contrário. O togolês não é o primeiro jogador que construiu a carreira na Europa a vir para o mercado latino-americano.  Na última Libertadores, o espanhol Pablo Marí foi campeão com o Flamengo e nesta edição o Peñarol contratou o volante húngaro Krisztián Vadócz. O GloboEsporte.com fez uma lista de outros 10 jogadores que resolveram tentar a sorte no futebol da latino-americano depois de terem algum sucesso no Velho Continente. Confira:  + Confira a tabela da Libertadores  Nascido em Rouen, na França, o atacante foi com três anos para a Argentina, onde viveu a infância e boa parte da adolescência. Ele, inclusive, começou a carreira no Platense, antes de ir para o Monaco. Torcedor do River quando criança, o atacante foi para o clube do coração no fim de 2011 – à época os Millonarios estavam na segunda divisão local. O francês, inclusive, foi responsável por fazer os dois gols da vitória de 2 a 0 sobre o Almirante Brown que garantiu a volta do River à primeira divisão. Além disso, Trezeguet tembém jogou no Newell’s Old Boys em 2013 e 2014.  Talvez a maior contratação de um europeu no futebol sul-americano, o holandês nascido em Suriname Clarence Seedorf ganhou todos os títulos possíveis que um jogador pode conquistar por clubes na Europa, tendo atuado em times históricos do Ajax, Real Madrid e Milan. Casado com uma brasileira, ele chegou ao Botafogo em 2012, jogando dois anos pelo alvinegro. No clube, Seedorf foi campeão carioca em 2013 e ajudou o Botafogo a retornar a uma Libertadores – competição que o time carioca não disputava fazia 18 anos. Em 2014, decidiu se aposentar como jogador para ir treinar o Milan.  + Lista GE: os 21 maiores jogadores que o futebol brasileiro repatriou  Campeão da Eurocopa em 2008 pela Espanha, o centroavante Dani Güiza fez carreira quase toda em clubes de seu país. No campeonato europeu de seleções, ele era reserva, mas entrava com frequência e fez dois gols na competição. Em 2013, o atacante estava no Johor FA, da Malásia, quando aceitou o convite do Cerro Porteño. Em três anos no clube paraguaio, Güiza marcou 20 gols em 59 jogos e atuou ao lado de Ángel Romero, que jogou nos anos seguintes no Corinthians.  Em 2011, a contratação de Ronaldinho pelo Flamengo causou euforia. No entanto, a transferência mais “aleatória” do meia foi em 2014, quando saiu do Atlético-MG – clube no qual foi campeão da Libertadores e eleito melhor jogador da América em 2013 – e foi para o Querétaro, clube mediano do México. No novo time, ele fez 29 jogos, marcou oito gols e foi vice-campeão nacional.  Na temporada 2014-15, o centroavante Gignac foi vice-artilheiro do campeonato francês, à frente de nomes como Ibrahimovic e Cavani. No entanto, ele decidiu sair do Olympique de Marselha para ir para o Tigres, do México. Àquela altura, o atacante era presença constante nas convocações da França e tinha o maior salário do futebol mexicano. Gignac continua no Tigres até hoje, clube no qual foi vice-campeão da Libertadores e tetracampeão mexicano.  O atacante inglês naturalizado turco chegou ao Coritiba em 2016. Kâzim veio ao Brasil por indicação do meia Alex, com quem ele tinha jogado no Fenerbaçe. À época, ele estava no Celtic, da Escócia. Pelo Coxa, o atacante fez 25 jogos e três gols. No ano seguinte, ele foi para o Corinthians, onde teve uma passagem apagada. Atualmente, ele está no Pachuca, do México.  + Ronaldo? Ronaldinho? Romário? Jornalistas elegem a maior contratação do futebol brasileiro  Uma das principais peças da seleção de Costa Rica que surpreendeu o mundo na Copa de 2014, o meia Bryan Ruiz estava no Sporting de Portugal quando foi contratado pelo Santos, em 2018. No entanto, ele não chegou nem perto de ser o jogador que um dia foi na Europa com a camisa do clube paulista. Por conta de problemas físicos, o meia atuou apenas em 13 partidas e não marcou nenhum gol. Ele ainda faz parte do elenco do Peixe, mas está há mais de um ano sem entrar em campo.  O volante italiano só havia defendido as cores da Roma e da seleção italiana durante toda a sua carreira. Assim como Totti, ele poderia ter se aposentado jogando por um único clube, mas resolveu ir a Buenos Aires jogar pelo Boca Juniors, clube pelo qual sempre teve admiração. No entanto, apesar de fazer um gol na estreia, o volante passou a maior parte do tempo machucado e fez apenas sete partidas. Depois da passagem pelo clube Xenize, o volante anunciou a aposentadoria.  Depois de oito anos no Atlético de Madrid, o lateral direito espanhol Juanfran decidiu ir para o São Paulo ano passado. Na Espanha, ele foi campeão espanhol em 2014, bicampeão da Copa do Rei duas vezes vice campeão da Champions League, em 2014 e 2016 - nessa última, Juanfran perdeu o pênalti decisivo que culminou no vice-campeonato do Atleti. Ele é o segundo espanhol a vestir a camisa do São Paulo: o primeiro foi Carazzo, em 1936.  Antes de desembarcar esse ano no Rio de Janeiro para assinar com o Botafogo, o japonês já tinha no currículo passagens por clubes alternativos, como a ida para o Pachuca, do México, em 2017 e para o Melbourne Victory, da Austrália, em 2018. Além disso, ele dirigiu a seleção de Camboja durante sua passagem no clube australiano. Dessa lista, o japonês ex-jogador do Milan é talvez aquele com a carreira mais “aleatória”. ",esportes,,,,,,
2020-02-12,https://web.archive.org/web/20200212000033/https://globoesporte.globo.com/sp/santos-e-regiao/futebol/times/santos/noticia/santos-renova-com-soteldo.ghtml,https://globoesporte.globo.com/sp/santos-e-regiao/futebol/times/santos/noticia/santos-renova-com-soteldo.ghtml,Santos resiste à pressão do Atlético-MG e renova com Soteldo," Soteldo vai continuar no Santos. Depois da reunião da última segunda-feira com o empresário do jogador, a diretoria do Peixe fechou nesta terça a permanência do atacante venezuelano. Ele assinou um novo contrato até dezembro de 2023.  Decisivo na vitória por 2 a 0 sobre o Botafogo-SP, na Vila Belmiro, pelo Paulistão, Soteldo tinha uma proposta de R$ 51 milhões do Atlético-MG. O Huachipato, dono de 50% dos direitos econômicos do atacante, tinha interesse em negociá-lo, mas o Santos resistiu à pressão.  + Santos tem prejuízo financeiro em vitória na Vila  Na última segunda-feira, pouco antes de o Santos entrar em campo pelo Campeonato Paulista, o presidente José Carlos Peres e o departamento jurídico se reuniram com um empresário de Soteldo para discutir a situação.  + PVC: Jesualdo não seduz, mas há pontos a se destacar  Em pauta, esteve o valor que o Santos ainda precisa pagar ao Huachipato, do Chile, pela compra do atacante - e que interessa a ele. De acordo com o Alvinegro, os 3,3 milhões de dólares (cerca de R$ 13 milhões, à época) foram divididos em três parcelas (uma paga no ato e outras duas a vencer), mas os chilenos alegam que há uma dívida.  + Titular em ""rodízio"" com Everson, Vladimir vibra com chance no Santos: ""Minha casa""  O Huachipato, portanto, ainda não repassou cerca de 350 mil dólares (algo em torno de R$ 1,5 milhão) aos quais Soteldo teria direito pela transferência, como apurado pelo GloboEsporte.com. O atacante venezuelano está decidido a permanecer na Vila Belmiro, mas pediu para seus empresários buscarem uma solução para receber o valor. ",esportes,,,,,,
