data,url_noticia,url_noticia_curto,titulo,conteudo_noticia,assunto,assunto_ex,titulo_ex,subtitulo_ex,local_ex,artigo_ex,n_paragrafos
2018-05-12,https://web.archive.org/web/20180512223004/https://g1.globo.com/politica/noticia/em-dois-anos-de-governo-temer-teve-encontros-oficiais-com-mais-da-metade-do-congresso.ghtml,https://g1.globo.com/politica/noticia/em-dois-anos-de-governo-temer-teve-encontros-oficiais-com-mais-da-metade-do-congresso.ghtml,"Em dois anos de governo, Temer teve encontros oficiais com mais da metade do Congresso"," O presidente Michel Temer teve encontros oficiais com 55% do Congresso desde que assumiu a Presidência da República, em maio de 2016, quando Dilma Rousseff foi afastada do cargo. Ele recebeu 269 deputados e 57 senadores em exercício. Os dados são resultado de um levantamento feito pelo G1 com base na análise dos mais de 3.500 registros da agenda no site do Palácio do Planalto. O governo de Michel Temer completa dois anos neste sábado (12).  Temer teve compromissos com 52% dos 513 deputados e com 70% dos 81 senadores. Nesses dois anos, os nomes mais frequentes na agenda do Palácio do Planalto foram: Eliseu Padilha, ministro-chefe da Casa Civil; Moreira Franco, ministro de Minas e Energia; e Henrique Meirelles, ex-ministro da Fazenda.  A análise realizada pelo G1 identificou ainda que o presidente não esteve, desde que assumiu a Presidência, em apenas seis estados do Brasil: Acre, Amapá, Amazonas, Piauí, Rio Grande do Norte e Sergipe. Os governadores de quatro deles (Acre, Amapá, Amazonas e Piauí) são do PT e do PDT, que não participam de sua base. Já os governadores de Rio Grande do Norte e Sergipe são do PSD.  Apesar de não ter viajado aos seis estados, Temer teve compromissos oficiais com parte deles em Brasília. Os governadores mais assíduos do Palácio do Planalto foram os do Rio de Janeiro, Luiz Fernando Pezão (MDB), e do Rio Grande do Norte, Robinson Faria (PSD).  A Secretaria de Comunicação da Presidência da República diz que o presidente se reúne rotineiramente com os representantes de todas as unidades da federação. ""O presidente tem a disposição, até o fim do seu governo, de comparecer a todos os estados do país, porque a retomada da economia e as obras do governo federal beneficiam todos os brasileiros, de todos os estados"", afirma a nota.  Nos dois anos de governo, o estado mais visitado foi São Paulo, onde Temer também tem uma casa, em Alto de Pinheiros, na Zona Oeste. A agenda do presidente mostra compromissos oficiais em 14 municípios do estado: Americana, Barretos, Campinas, Caraguatatuba, Itu, Jaguariúna, Limeira, Mogi das Cruzes, Praia Grande, Ribeirão Preto, Santos, São José do Rio Preto, São Paulo e Sorocaba.  Desde 12 de maio de 2016, quando assumiu a Presidência, ele visitou 13 países. Em 2016, por exemplo, o presidente esteve na China, nos Estados Unidos, na Argentina, no Paraguai, na Índia e no Japão. Na América do Sul, desde o começo do governo, as viagens foram para Argentina (Mendoza e Buenos Aires), Chile (Viña del Mar), Peru (Lima) e Paraguai (Assunção).  Os deputados que estiveram com Michel Temer são filiados principalmente a MDB, PSDB, PP, DEM e PR – partidos que compõem a base do governo. Os mais assíduos da Câmara dos Deputados foram o presidente da Casa, Rodrigo Maia; o líder do governo, Aguinaldo Ribeiro (PP-PB); e o ex-ministro e deputado Antonio Imbassahy (PSDB-BA). Cada um teve mais de 80 encontros com Michel Temer nos dois anos de governo.  Para o cientista político Cláudio Couto, a agenda intensa com políticos do Congresso se deve a proposições que o governo definiu como prioritárias. Entre elas, a PEC do Teto dos Gastos (promulgada em dezembro de 2016), a Reforma Trabalhista (sancionada em julho de 2017) e a Reforma da Previdência (ainda em tramitação).  Couto diz, porém, que, em ano eleitoral, muitos dos candidatos podem evitar Temer, já que a proximidade com ele pode ser prejudicial. ""Há um contraste crucial. Michel Temer é um presidente tão bem resolvido com o Congresso e tão mal resolvido com a população, a ponto de ele ser tão impopular que ninguém leva a sério uma candidatura Temer"", afirma o coordenador do mestrado de gestão e políticas públicas da FGV-SP.  Pelo menos 57 dos 81 senadores estiveram com Temer – o que equivale a 70% do Senado Federal. O recordista de agendas com o presidente foi Romero Jucá (MDB-RR), líder do governo no Senado. O senador de Roraima também teve papel ativo nos governos de Dilma Rousseff e Lula. Em ambos os governos, Jucá também atuou como interlocutor do Planalto com o Congresso, na função de líder do governo no Senado. No governo Lula, ainda foi ministro da Previdência Social.  Depois de Jucá, os senadores Eunício Oliveira (MDB-CE), Aécio Neves (PSDB-MG), José Serra (PSDB-SP) e Ciro Nogueira (PP-PI) foram os que mais tiveram compromissos oficiais com Michel Temer. Nos dois anos de governo, Jucá esteve pelo menos 78 vezes com Temer; Eunício Oliveira, 34 vezes; Aécio Neves, 23 vezes; José Serra, 19; e Ciro Nogueira, 16.  Por enquanto, o mês com o maior número de agendas foi julho de 2017. Foram 284 compromissos oficiais. O presidente da República esteve em Hamburgo, na Alemanha, para a reunião dos chefes de Estado do G20, e viajou para Mendoza, na Argentina, onde se encontrou com representantes do Mercosul. Também foi ao Rio de Janeiro e se reuniu em Brasília com deputados, senadores e ministros.  Isso não significa necessariamente, no entanto, que o presidente tenha se reunindo com mais pessoas naquele momento. Um registro na agenda do Palácio do Planalto pode informar tanto ""despacho interno"" quanto ""bancada feminina da Câmara dos Deputados"". Na maioria dos registros, porém, a Presidência da República costuma publicar os nomes de quem foi recebido pelo presidente.  No levantamento do G1, é possível constatar ainda que o presidente da consultoria Arko Advice, Murillo Aragão, por exemplo, esteve pelo menos oito vezes com Michel Temer. Já Denis Rosenfield, filósofo que foi cotado para o Ministério da Defesa, registrou 13 compromissos com o presidente.  Nos dois anos de governo, Temer ainda recebeu no Palácio do Planalto presidentes de variadas empresas, como montadoras de veículos (Volkswagen, Mercedes-Benz, Hyundai, MAN, Fiat, GM Motors etc) e telefonias (TIM e Claro).  O cientista político Cláudio Couto afirma que Temer é um ""representante orgânico da classe política tradicional"" e tem mais habilidades com o Congresso que sua antecessora, Dilma Rousseff. Couto lembra ainda que Temer já comandou a Câmara dos Deputados e presidiu o MDB por mais de uma década.  ""A Dilma [Rousseff], diferentemente, não era uma política profissional. Muito pelo contrário. A Dilma tinha muita dificuldade de negociação, de conversar com os parlamentares. E isso ficou explícito, foi uma das dificuldades que ela enfrentou"", diz Couto, referindo-se ao processo de impeachment.  O desenvolvedor de software Álvaro Justen, do Brasil.io, projeto que disponibiliza dados públicos em formato acessível, extraiu as agendas da ex-presidente Dilma Rousseff do site da Presidência da República. O período analisado engloba os compromissos oficiais de 1º de janeiro de 2011 a 1º de janeiro de 2013 – ou seja, dois anos do primeiro mandato da petista.  Foram 2.455 registros de agendas oficiais em dois anos do governo de Dilma Rousseff – cerca de mil a menos que Michel Temer. A ex-presidente, porém, viajou a mais países em comparação a seu sucessor. Dilma esteve em 23 países durante o período – o que inclui África do Sul, Moçambique e Angola. Temer, por enquanto, não visitou o continente.  Por outro lado, a ex-presidente esteve em menos estados do Brasil que Michel Temer. Nos dois primeiros anos de governo, Dilma Rousseff deixou de ir a Acre, Amapá, Espírito Santo, Mato Grosso, Mato Grosso do Sul, Pará, Paraíba, Piauí e Roraima. Na época, os governadores de Pará e Roraima eram do PSDB; e os de Mato Grosso e Mato Grosso do Sul, do PMDB.  Já os governadores de Amapá, Espírito Santo, Paraíba e Piauí eram do PSB. O Acre já era governado na época por Tião Viana, do PT.  A análise identificou ainda que a agenda da ex-presidente Dilma registrou menos encontros com deputados e senadores que a de Michel Temer. As pessoas mais próximas à ex-presidente foram, em ordem:  A divulgação da ""agenda de reuniões com pessoas físicas e jurídicas"" é uma das orientações do Código de Ética dos agentes públicos em exercício na Presidência e na Vice-Presidência da República, em vigor desde 2002. O internauta pode consultar, por dia, na agenda da Palácio do Planalto os nomes dos participantes, o horário e o local do encontro.  Não há informação sobre o assunto tratado em cada compromisso. O site também não permite a consulta por nome nem apresenta um arquivo consolidado com as agendas da semana, do mês ou do ano.  O G1 enviou um ""requerimento de adoção de providência por parte da administração"" em que pede para a Presidência da República passar a oferecer o download dos dados da agenda em seu site, com o objetivo de facilitar análises e consultas de cidadãos. Ainda não houve resposta.  Segundo a Secretaria de Comunicação, o site com as agendas da Presidência da República é atualizado diariamente em três momentos: às 13h, às 18h e no fim do expediente. Uma prévia da agenda é enviada aos jornalistas por e-mail, na véspera.  ""Para dar máxima transparência, toda vez que há alteração, seja inclusão ou exclusão na agenda presidencial – o que ocorre com frequência, várias vezes ao dia –, a Secretaria de Imprensa adotou a boa prática de informar os novos nomes aos jornalistas lotados no Comitê de Imprensa, antes mesmo de as atualizações serem publicadas [no site]"", diz a nota.  Em 7 de março de 2017, porém, Michel Temer se encontrou com o empresário Joesley Batista numa reunião secreta, já que a agenda não constava do site da Presidência da República. A conversa foi gravada pelo empresário da JBS, que fez delação premiada na época. No áudio, Temer dizia ""Tem que manter isso, viu?"", depois que Joesley disse ""Tô de bem com Eduardo"", referindo-se ao ex-deputado Eduardo Cunha, preso desde 19 de outubro de 2016.  O conteúdo da delação dos executivos da JBS ajudou a embasar a primeira denúncia, por corrupção passiva, contra Michel Temer. ",politica,,,,,,
2018-05-12,https://web.archive.org/web/20180512223004/https://g1.globo.com/politica/noticia/gilmar-mendes-manda-soltar-paulo-vieira-de-souza-apontado-como-operador-do-psdb.ghtml,https://g1.globo.com/politica/noticia/gilmar-mendes-manda-soltar-paulo-vieira-de-souza-apontado-como-operador-do-psdb.ghtml,"Gilmar Mendes manda soltar Paulo Vieira de Souza, apontado como operador do PSDB"," O ministro Gilmar Mendes, do Supremo Tribunal Federal (STF), determinou nesta sexta-feira (11) a soltura de Paulo Vieira de Souza, ex-diretor da Dersa - empresa paulista de infraestrutura rodoviária. Ele estava preso desde 6 de abril em razão das suspeitas de desvios nas obras do Rodoanel Sul, Jacu Pêssego e Nova Marginal Tietê.  Paulo Vieira deixou a Penitenciária de Tremembé, no interior de São Paulo, pouco depois das 22h. Ele é suspeito de participar de desvio de recursos públicos em obras do governo estadual entre os anos de 2009 e 2011. Neste período, o governo paulista foi comandado por José Serra, Alberto Goldman e Geraldo Alckmin, todos do PSDB.  ""Defiro a medida liminar para suspender a eficácia do decreto de prisão preventiva de Paulo Vieira de Souza, o qual deverá ser posto em liberdade, se por outro motivo não estiver preso"", afirmou o ministro em sua decisão.  Em nota, o PSDB afirmou: ""O PSDB de São Paulo não tem qualquer relação com o investigado nem com os fatos a ele imputados. O partido reitera seu total apoio às investigações em curso.""  No dia 22 de março, a força tarefa da operação Lava Jato em São Paulo ofereceu denúncia contra Souza e mais 4 suspeitos de desviar R$ 7,7 milhões de 2009 a 2011 (valores da época) de obras públicas.  Eles foram denunciados pelo MPF pelos crimes de formação de quadrilha, inserção de dados falsos em sistema público e peculato, que é a apropriação de recursos públicos.  Segundo a denúncia,, Paulo Vieira de Souza, conhecido como Paulo Preto, comandou o desvio de dinheiro como o destinado ao reassentamento de desalojados por obras do trecho Sul do Rodoanel, o prolongamento da avenida Jacu Pêssego e a Nova Marginal Tietê, na região metropolitana de São Paulo.  A denúncia foi feita após uma investigação iniciada no Ministério Público Estadual de São Paulo pelos desvios de apartamentos e de pagamentos de indenizações. Durante as investigações, a Promotoria da Suíça informou que Souza mantinha o equivalente a R$ 113 milhões em contas fora do Brasil.  Os documentos suíços revelaram que o dinheiro estava em quatro contas bancárias, abertas em 2007, por uma offshore sediada no Panamá, cujo beneficiário é Paulo Vieira de Souza e que, em fevereiro de 2017, o dinheiro foi transferido da Suíça para um banco nas Bahamas.  Paulo Vieira de Souza foi diretor da estatal que administra as rodovias em São Paulo entre 2005 e 2010. Os procuradores pediram a quebra do sigilo bancário dele. A Justiça determinou o bloqueio dos eventuais saldos que existam nas contas dele no exterior.  Gilmar Mendes relatou na decisão que o Ministério Público Federal pediu a prisão preventiva de Paulo Vieira ""para garantia da instrução criminal, em razão de supostas ameaças à integridade física"" de uma acusada na ação.  Ela afirma que o ex-diretor da Dersa de incluir pessoas ilegalmente no cadastro, entre elas ex-empregadas domésticas da filha e da mulher, além de babas dos netos e uma secretária do genro. Nenhuma delas morava no traçado das obras do Rodoanel.  A defesa recorreu ao Tribunal Regional Federal da Terceira Região e ao Superior Tribunal de Justiça, mas teve pedidos negados naqueles tribunais. Os advogados argumentam que as supostas ameaças não formam comprovadas e se referem a fatos antigos.  Gilmar Mendes concordou que não há razão para prisão preventiva porque a denúncia de ameaça era antiga, embora a pessoa estivesse indo à juízo somente agora relatar os fatos.  ""As três ameaças teriam ocorrido nos anos de 2015 e 2016 e a prisão preventiva foi decretada em abril de 2018. De acordo com os fundamentos da prisão preventiva, a atualidade do interesse em ameaçar decorria da nova denúncia, baseada em depoimentos prestados pela corré ao Ministério Público, até então sem o conhecimento do paciente. A prisão preventiva não se justifica para permitir o depoimento da corré em juízo"", diz Mendes na decisão.  O ministro acrescenta que as novas suspeitas de ameaça foram informadas à defesa de Paulo Vieira em janeiro deste ano, antes de ele ser preso, mas que, nesse período, não há notícias de supostas intimidações. Por isso, considerou que ele não representa um risco às investigações.  ""Por fim, muito embora isso não esteja comprovado, a defesa sustenta que teve acesso aos novos depoimentos da colaboradora ainda em janeiro deste ano, quase três meses antes do decreto de prisão. Em tese, esse intervalo seria tempo hábil para a prática de outros atos de intimidação. Não há, no entanto, qualquer notícia de que a corré tenha sofrido constrangimentos no período."" ",politica,,,,,,
2018-05-13,https://web.archive.org/web/20180513225409/https://g1.globo.com/politica/noticia/aos-2-anos-governo-temer-festeja-economia-mas-enfrenta-impopularidade-denuncias-e-crise-politica-relembre.ghtml,https://g1.globo.com/politica/noticia/aos-2-anos-governo-temer-festeja-economia-mas-enfrenta-impopularidade-denuncias-e-crise-politica-relembre.ghtml,"Aos 2 anos, governo Temer festeja economia, mas enfrenta impopularidade, denúncias e crise política; relembre"," Eram 11h25 do dia 12 de maio de 2016. Vice-presidente da República, Michel Temer estava no Palácio do Jaburu, em Brasília, quando foi notificado sobre a decisão do Senado de abrir o processo de impeachment de Dilma Rousseff.  Naquele dia, Temer tomou posse, nomeou os novos 24 ministros do governo (atualmente são 29) e fez o primeiro discurso como presidente em exercício em um dos salões do Palácio do Planalto.  Diferentemente dos presidentes eleitos, que discursam ao povo no parlatório do palácio, Temer se dirigiu a uma plateia formada majoritariamente por políticos convidados e afirmou que o Brasil vivia a ""pior crise econômica"" da história.  Na ocasião, o recém-empossado presidente em exercício apontou a necessidade de proteger a Lava Jato contra ""qualquer tentativa de enfraquecê-la""; disse que manteria os programas sociais; defendeu a urgência de fazer um ""governo de salvação nacional""; e lembrou uma placa que viu em um posto de gasolina com a seguinte mensagem: ""Não fale em crise, trabalhe"".  Passados dois anos desde o afastamento de Dilma (o impeachment só foi aprovado em 31 de agosto de 2016), Temer lidera um governo que ostenta queda da inflação e a redução da taxa de juros, mas que tenta lidar com o aumento no número de desempregados e com os altos índices de rejeição.  Hoje, Temer conduz um governo alvo de denúncias da Procuradoria Geral da República (PGR), envolvido em crises políticas e no foco de investigações criminais.  Nove meses após tomar posse para o segundo mandato como vice-presidente, Temer afirmou num evento, em setembro de 2015, que seria ""difícil"" Dilma Rousseff aguentar mais três anos no Palácio do Planalto em razão da baixa popularidade. À época, ela tinha 8% de aprovação.  Temer assumiu a Presidência de maneira interina em maio de 2016 e no primeiro discurso afirmou que, para governar, precisaria do ""apoio do povo"", que, por sua vez, precisaria ""aplaudir"" as medidas adotadas.  Hoje, a aprovação do presidente, segundo o Datafolha, é de 6% - 70% consideram o governo ruim ou péssimo.  Em recente entrevista, Temer afirmou que um publicitário disse a ele que ""aproveite a impopularidade"" para fazer as reformas necessárias ao país (leia detalhes sobre as reformas mais abaixo).  Passava das 18h do dia 12 de maio de 2016 quando Temer falou pela primeira vez como presidente em exercício. No Planalto, ele afirmou:  O presidente apontou como maior desafio ""estancar o processo de queda livre na atividade econômica"".  Em dois anos, Temer acostumou-se a badalar índices alcançados em sua gestão, como a alta do PIB em 2017 (1%) após dois anos de retração e as quedas da inflação e da taxa básica de juros (6,5% ao ano), a menor da série histórica do Banco Central, iniciada em 1986.  No mercado de trabalho, contudo, o governo não conseguiu reduzir o número de desempregados, pelo contrário. Segundo o IBGE, quando Temer assumiu eram 11,4 milhões e hoje, 13,7 milhões.  Assista abaixo às análises dos comentaristas Valdo Cruz e Natuza Nery sobre os dois anos do governo Temer:  Nesses dois anos à frente do Planalto, Temer enfrentou uma série de polêmicas causadas por denúncias, delações, prisões de assessores mais próximos e investigações da Polícia Federal.  No ano passado, o presidente foi denunciado duas vezes ao Supremo Tribunal Federal (STF) pela Procuradoria Geral da República (PGR). Os crimes: corrupção passiva, organização criminosa e obstrução de Justiça.  As denúncias, baseadas nas delações da JBS, fizeram Temer viver seu momento mais dramático no governo.  Segundo o Ministério Público, numa conversa com o dono da empresa, Joesley Batista, Temer deu aval ao pagamento de dinheiro para a compra do silêncio do ex-deputado Eduardo Cunha, o que o presidente nega. O encontro aconteceu no fim da noite, fora da agenda, e foi gravado por Joesley.  O STF só poderia analisar as denúncias, porém, se a Câmara autorizasse. Nos dois casos, a maioria dos deputados votou contra o prosseguimento dos processos e, com isso, as acusações contra Temer só poderão ser analisadas após ele deixar o Planalto.  Hoje, Temer é alvo de dois inquéritos que tramitam no STF. Com base nas delações de executivos da JBS e da Obderecht, o presidente passou a ser investigado por suposto recebimento de propina na edição do decreto dos portos e em contratos da Secretaria de Aviação Civil.  A pasta da Aviação foi comandada por Moreira Franco, atual ministro de Minas e Energia, e Eliseu Padilha, atual chefe da Casa Civil, ambos do MDB, principais conselheiros de Temer e formalmente denunciados pelo Ministério Público ao STF.  Além dos dois, outras pessoas muito próximas ao presidente passaram a ser investigadas e até foram presas, entre as quais:  O presidente nega qualquer tipo de envolvimento com irregularidades. Afirma ser vítima de uma ""campanha oposicionista"" para enfraquecer o governo, acrescentando que é alvo de ""vazamentos irresponsáveis"" de dados relacionados às investigações sobre ele.  Sobre se tem medo de ser preso ao deixar o cargo, o presidente diz que não, acrescentando que isso seria uma ""indignidade"". Ao assumir a Presidência, em 12 de maio de 2016, Temer afirmou em pronunciamento:  Em junho de 2017, o Tribunal Superior Eleitoral (TSE) garantiu a continuidade do governo de Michel Temer ao absolver, por 4 votos a 3, a chapa formada por ele e por Dilma da acusação de abuso de poder político e econômico na campanha de 2014 (relembre no vídeo acima).  A ação foi apresentada pelo PSDB após a eleição e apontava mais de 20 infrações supostamente cometidas pela coligação encabeçada por PT e PMDB (hoje MDB).  Com o placar apertado, cujo voto decisivo foi dado pelo ministro Gilmar Mendes, então presidente do TSE, Temer escapou da perda do atual mandato e Dilma, da inelegibilidade por 8 anos.  Temer chegou ao poder com discurso em favor das reformas trabalhista e previdenciária, tendo como objetivo ""o pagamento das aposentadorias e a geração de emprego"".  Nesses dois anos:  Temer também defendeu, ao assumir o governo, o incentivo às parcerias público-privadas (PPPs). O presidente lançou um programa de concessões e privatizações.  Segundo dados oficiais, 74 projetos foram concluídos, o que inclui quatro aeroportos, linhas de transmissão, terminais portuários e blocos para exploração de óleo e gás.  Dentro do programa de concessões, uma das principais apostas do governo para 2018 é a privatização da Eletrobras, que ainda precisa ser aprovada pelo Congresso Nacional.  Quando Temer assumiu, afirmou ser preciso restaurar o equilíbrio das contas públicas ""trazendo a evolução do endividamento no setor público de volta ao patamar de sustentabilidade ao longo do tempo"".  Desde então, foram anunciadas algumas medidas, como a instituição de um teto para os gastos públicos; o aumento da tributação sobre a gasolina; a aprovação da Taxa de Longo Prazo (TLP) – que diminui, com o passar do tempo, o pagamento de subsídios pelo governo.  Também foram anunciados programas de parcelamento de tributos vencidos para empresas, produtores rurais e estados e municípios. Esses parcelamentos, mesmo criticados pela área técnica da Receita Federal – pois influenciam para baixo o recolhimento mensal dos impostos –, contribuem para elevar a arrecadação no curto prazo.  Em 16 de fevereiro, o presidente decretou a intervenção federal na área de segurança pública do Rio de Janeiro, a primeira desde a Constituição de 1988.  Com a decisão, o governador Luiz Fernando Pezão (MDB) deixou de responder pela área, que ficou sob a gestão do general do Exército Walter Braga Netto, escolhido por Temer como interventor.  No período, o fato de maior repercussão no Rio foi o assassinato da vereadora Marielle Franco (PSOL), cuja investigação segue em curso.  Temer também criou, neste ano, o Ministério da Segurança Pública. Com isso, a Polícia Federal saiu da alçada do Ministério da Justiça e passou a ser subordinada à nova pasta.  Raul Jungmann, então ministro da Defesa, assumiu a Segurança Pública. Para o lugar dele, Temer nomeou Joaquim Silva e Luna, primeiro militar a comandar a Defesa.  Em seu primeiro discurso, em maio de 2016, Temer afirmou:  Nos dois anos de Temer à frente do Planalto:  No Minha Casa, Minha Vida, de acordo com Ministério das Cidades, em 2016 foram contratadas 382.311 unidades habitacionais. Em 2017, o governo traçou como meta contratar 610 mil unidades habitacionais, mas entregou 500 mil.  A meta para este ano é contratar 650 mil unidades – até agora, foram contratadas 125 mil unidades.  Relembre abaixo outros temas que marcaram os dois anos de Temer:  FOTO DO TOPO: ALAN SANTOS/PR ",politica,,,,,,
