data,url_noticia,url_noticia_curto,titulo,conteudo_noticia,assunto,assunto_ex,titulo_ex,subtitulo_ex,local_ex,artigo_ex,n_paragrafos
2020-04-06,https://web.archive.org/web/20200406000024/https://globoesporte.globo.com/futebol/times/atletico-mg/noticia/lembra-atletico-mg-completa-20-anos-da-maior-goleada-pela-copa-libertadores-reveja-os-gols.ghtml,https://globoesporte.globo.com/futebol/times/atletico-mg/noticia/lembra-atletico-mg-completa-20-anos-da-maior-goleada-pela-copa-libertadores-reveja-os-gols.ghtml,Lembra? Atlético-MG completa 20 anos da maior goleada pela Copa Libertadores; reveja os gols," Um time que marcou história no mais que centenário Atlético-MG, com Marques, Guilherme e cia, também está na história como aquele que conseguiu a maior goleada do clube pela Libertadores. Há 20 anos, o Galo, comandado por Guilherme (autor de quatro gols naquela noite), goleou o Cobreloa, do Chile, por 6 a 0, no Mineirão, resultado que garantiu a classificação para as oitavas de final daquela edição (relembre os gols no vídeo abaixo).  + Notícias do Atlético-MG  A noite naquele 05 de abril de 2000 foi do atacante Guilherme, artilheiro daquele time. O jogador fez quatro gols (aos cinco do primeiro tempo e aos 11, 29 e 30 do segundo tempo). Um deles de trivela, de fora da área. O meia Ramón, hoje técnico do Vasco, marcou um aos cinco da primeira etapa, enquanto Cairo, que entrou no lugar de Guilherme, marcou o sexto pelo time alvinegro aos 45 do tempo final.  Naquela noite, o Galo entrou em campo com: Velloso; Bruno, Célio Silva (Paulão), Gilberto Silva e Vitor; Cleisson, Gallo, Lincoln e Ramón (Irênio); Marques e Guilherme (Cairo). A partida foi no Mineirão e teve público pagante de 32.558. O jogo foi válido pela quinta rodada do Grupo 8. A partida foi relembrada pela Conmebol.  O Galo terminou em segundo lugar no Grupo 8, com nove pontos, ganhando todos os jogos em casa e perdendo todos fora. Nas oitavas de final, o time passou pelo Athletico-PR, nos pênaltis, após vitória em casa por 1 a 0 e derrota, na Arena da Baixada, em Curitiba, por 2 a 1. Nos pênaltis, vitória por 5 a 3. A eliminação ocorreu nas quartas de final para o Corinthians, após empate por 1 a 1, no Mineirão, e derrota por 2 a 1, no Morumbi.  Na edição de 2000, Guilherme terminou como terceiro jogador com mais gols, junto com Ángel (River Plate) e Rodríguez (Atlas), todos com nove marcados. Luizão, do Corinthians, foi o artilheiro com 15 gols. Cuauhtémoc Blanco, do América do México, fez 13 e foi o segundo com mais gols.  Conheça os novos planos e faça o seu ",esportes,,,,,,
2020-04-06,https://web.archive.org/web/20200406000024/https://globoesporte.globo.com/futebol/times/corinthians/noticia/cantora-britanica-cher-lloyd-posta-fotos-com-camisa-do-corinthians-e-agita-as-redes-sociais.ghtml,https://globoesporte.globo.com/futebol/times/corinthians/noticia/cantora-britanica-cher-lloyd-posta-fotos-com-camisa-do-corinthians-e-agita-as-redes-sociais.ghtml,Cantora britânica Cher Lloyd posta fotos com camisa do Corinthians e agita as redes sociais," A cantora britânica Cher Lloyd surpreendeu seus fãs do Brasil neste domingo ao aparecer em fotos com a camisa do Corinthians e agitou as redes sociais.  Cher Lloyd, que também ficou famosa ao participar do reality show ""The X Factor"", divulgou imagens no Instagram e no Twitter em que está vestida com o segundo uniforme do Corinthians, listrado em preto e branco. Na legenda, porém, ela não fez nenhuma menção ao clube, tendo apenas escrito:  – Espero que vocês estejam ""ok"" e encontrando razões para sorrir.  + CLIQUE AQUI e veja mais notícias do Corinthians  Imediatamente, diversos seguidores do Brasil reagiram às fotos. Alguns corintianos festejaram a aparição da britânica com a camisa alvinegra. Confira alguns dos comentários: ",esportes,,,,,,
2020-04-07,https://web.archive.org/web/20200407000015/https://globoesporte.globo.com/sp/futebol/noticia/brasileiro-do-barcelona-relata-caos-no-equador-nao-esta-tendo-como-retirar-os-corpos-das-residencias.ghtml,https://globoesporte.globo.com/sp/futebol/noticia/brasileiro-do-barcelona-relata-caos-no-equador-nao-esta-tendo-como-retirar-os-corpos-das-residencias.ghtml,"Brasileiro do Barcelona relata caos no Equador: ""Não está tendo como retirar os corpos das residências"""," O Equador vive uma guerra. Na maior cidade do pais, Guayaquil, o serviço funerário entrou em colapso com os inúmeros casos de coronavírus. Corpos são vistos nas ruas. Segundo o governo, já são 191 mortes por causa do covid-19 e mais de 3.700 casos confirmados.  O brasileiro Gabriel Marques, jogador do Barcelona de Quayaquil, relatou o momento difícil vivido na cidade no restante do país.  – A situação aqui está muito feia. Muito complicada. As pessoas estão morrendo. Não está tendo como retirar os corpos das residências. Então, os familiares estão colocando os corpos na rua, no passeio, sem saber a causa, porque quando a pessoa morre não sabe se é por coronavírus ou por outro tipo de morte. Pessoas colocam fora de casa (os corpos) porque já não aguentam mais o cheiro da decomposição do cadáver. Colapsou tudo aqui, hospitais.  – Eu tive agora um companheiro do meu time que o pai está com o coronavírus. Ele tem chamado hospitais, ambulância, polícia, e nada, ninguém responde. É uma situação muito difícil que passa o Equador – contou Gabriel Marques.  Gabriel ainda se recorda de como a população não levou a sério as recomendações no começo da pandemia.  – Guayaquil, onde nós estamos, com minha família, é o lugar que mais tem contaminados. Foi o lugar também que não acatou as autoridades, não respeitou o ficar em casa. Eu lembro, 20 dias atrás, cancelou futebol, cancelou tudo, e pessoas continuavam andando na rua, sem proteção, sem usar máscara, sem usar luva, e aconteceu o que aconteceu.  – Eu tenho passado para os meus amigos, para meus familiares que estão no Brasil, para se cuidar muito. Esse vírus é um vírus que mata mesmo e que é muito perigoso. Escutei que o presidente falou que é uma gripezinha, escutei outras coisas, não é bem assim. O negócio é violento – disse Gabriel, de 32 anos, que no futebol brasileiro defendeu Ponte Preta, Campinas, Athletico e Paraná Clube.  Em Cuenca, a brasileira Erica Sena, profissional da marcha atlética, conta que governo tem feito de tudo para as pessoas ficarem em casa, como rodízio de veículos e até toque de recolher.  – Tem toque de recolher às 2h da tarde. Se for pego depois desse horário na rua é preso, e só pode sair de carro duas vezes por semana, através da placa eles controlam. E a entrada nos supermercados também é controlada pelo RG dos moradores. - explicou a atleta Erica Sena, da marcha atlética, que mora em Cuenca.  A situação de calamidade é tamanha que a cidade recebeu uma doação de mil caixões de papelão da Associação de Papeliros equatoriana, que foi entregue a dois cemitérios. ",esportes,,,,,,
2020-04-07,https://web.archive.org/web/20200407000015/https://globoesporte.globo.com/tenis/noticia/serena-no-us-open-ataques-de-kyrgios-e-john-mcenroe-veja-os-10-maiores-chiliques-do-tenis.ghtml,https://globoesporte.globo.com/tenis/noticia/serena-no-us-open-ataques-de-kyrgios-e-john-mcenroe-veja-os-10-maiores-chiliques-do-tenis.ghtml,"Serena no US Open, ataques de Kyrgios e John McEnroe: veja os 10 maiores chiliques do tênis"," O tênis é um esporte marcado pelo silêncio durante os pontos e pelo respeito dos jogadores em quadra. Há nas regras a possibilidade de jogadores serem penalizados em casos de xingamentos ou desrespeito perante o adversário ou o público. Assim, quebrar esse protocolo normalmente chama a atenção e causa momentos memoráveis - ainda que por um lado negativo.  O GloboEsporte.com reuniu 10 momentos na história do tênis em que os jogadores promoveram verdadeiros chiliques em quadra, revoltados com a própria atuação, com rivais, torcida ou até mesmo o juiz. Confira a lista abaixo.  +Leia mais sobre tênis  A lista começa há 39 anos, em 1981. John McEnroe, ainda cabeludo e no auge de sua carreira, como número 1 do mundo. O americano basicamente surtou na primeira rodada de Wimbledon daquele ano, em jogo contra Tom Gullikson. Após um saque em que a bola pareceu ter ido dentro, a chamada do juiz foi de que a bolinha teria ido fora. Foi o suficiente para soltar a ira de McEnroe, que depois de argumentar berrou em alto bom som: ""Você não pode estar falando sério"". Esse, inclusive, foi o título do livro autobiográfico do ex-tenista, lançado em 2002.  A revolta de Pablo Carreño Busta foi grande após a derrota para Kei Nishikori no Aberto da Austrália de 2019 em 5h05 de partida. O espanhol vencia por 8-5 no match tie-break do quinto set, quando o juiz de linha cantou bola fora de forma equivocada. O ponto, que deveria ter sido repetido, acabou indo para o japonês - que completou a jogada na sequência - por decisão do juiz de cadeira, gerando a fúria do tenista europeu. Irritado, ele se perdeu na sequência e permitiu a virada do rival e fez isso aí que você pode conferir acima.  Ainda no Aberto da Austrália, mas em 2013, Jerzy Janowicz também não ficou nada satisfeito com a decisão dos juizes. O polonês, na época com apenas 22 anos, ficou irado após deixar uma bola do rival quicar na quadra, imaginando que ela tinha ido fora. Porém, a arbitragem considerou que o lance foi bom. De joelhos, Janowicz berrou ""Quantas vezes?"", indagando pelo que ele considerava uma sequência de erros.  Com 23 títulos de Grand Slam na carreira, Serena Williams definitivamente não gosta de perder. E, talvez por isso, suas reações em situações adversas não são das melhores. Em 2009, na semifinal do US Open contra Kim Clijsters, a americana estava em situação delicada no segundo set, com 5/6 e 15/30 para se manter no jogo. Pois, a juíza de linha deu um ""foot fault"" (falta por tocar o pé na linha) em seu segundo saque, deixando a rival com dois match points.  Serena não concordou com a marcação e partiu para cima da juíza de linha, que se levantou e avisou à juíza de cadeira que a tenista teria dito ""Eu te mato"". Depois de uma grande confusão, os supervisores foram chamados em quadra e decidiram pela penalidade de um ponto perdido, algo que definiu o placar e a vitória de Clijsters na ocasião.  Muita gente imaginou que a ATP Cup, torneio entre nações e disputado logo no início de janeiro deste ano, teria um caráter quase que amistoso, de preparação para a temporada. Pois o clima não foi bem esse. Tanto que Medvedev, defendendo a Rússia, provocou o público que o vaiava após vencer o primeiro set contra Schwartzman, da Argentina (veja o primeiro lance no vídeo acima) e foi repreendido pelo juiz de cadeira, levando uma advertência na sequência. Irritando, o russo desferiu vários golpes com sua raquete próximo de onde estava Mo Lahyani. Pra que isso?  Você estava sentindo falta dele. Mas, guardamos o melhor para o final. Nick Kyrgios, é claro, o ""bad boy"" do tênis está nessa lista. Em 2019, o australiano estava inspirado em armar barracos em quadra. No Masters 1000 de Roma, irritado com movimentação do público próximo a ele, resolveu bater boca com a torcida e tomou sua terceira advertência no jogo, perdendo um game inteiro. Foi o estopim para chutar as coisas, arremessar a cadeira no meio da quadra e ir embora, sendo desclassificado do torneio. Que papelão!  Um dos chiliques mais lembrados pelos fãs de tênis aconteceu no Aberto da Austrália de 2013. Marcos Baghdatis se irritou com a própria atuação diante de Stan Wawrinka e resolveu descontar a raiva destruindo suas raquetes. Sobrou até mesmo para duas delas que ainda estavam dentro do plástico, causando a quebra de quatro raquetes no total. O vídeo ficou tão popular que já foi visto mais de 2,7 milhões de vezes no canal oficial do Grand Slam.  A violência ficou séria quando Mikhail Youzhny se revoltou com a própria atuação no Masters 1000 de Miami em 2008. O russo desferiu vários golpes com a raquete na sua testa e, com isso, começou a sangrar após abrir um ferimento. Uma cena das cenas mais bizarras e chocantes na história do tênis mundial.  Como foi dito, o ano de 2019 foi marcado por ataques de Nick Kyrgios em quadra. O ápice do australiano foi no Masters 1000 de Cincinnati, quando ele perdia para o russo Karen Khachanov. Saiu de quadra, quebrou várias raquetes no vestiário, voltou, continuou batendo boca com o juiz e quis recomeçar a partida ainda colocando a fita na sua raquete. Após a derrota, a cereja do bolo: cuspiu em direção do juiz de cadeira.  Diante da sua torcida, em Nova York, e numa final de Grand Slam, Serena Williams protagonizou uma das histórias mais surreais do tênis em 2018. A americana, incomodada com a boa atuação de Naomi Osaka, resolveu descontar sua frustração no juiz de cadeira, Carlos Ramos. Serena levou três advertências, chegou a acusá-lo de ""ladrão"" e perdeu um game inteiro no segundo set, algo que a fez até chamar o supervisor do torneio em quadra.  A japonesa venceu a partida no fim das contas e se sagrou campeã do US Open, mas foi às lágrimas enquanto recebia o troféu por causa das vaias do público em Nova York. Um papelão de Serena que ofuscou a brilhante vitória da então jovem de 20 anos. ",esportes,,,,,,
2020-04-07,https://web.archive.org/web/20200407000015/https://globoesporte.globo.com/futebol/futebol-internacional/futebol-ingles/noticia/e-impossivel-para-o-liverpool-terminar-sem-titulo-ingles-diz-presidente-da-uefa.ghtml,https://globoesporte.globo.com/futebol/futebol-internacional/futebol-ingles/noticia/e-impossivel-para-o-liverpool-terminar-sem-titulo-ingles-diz-presidente-da-uefa.ghtml,"""É impossível para o Liverpool terminar sem título inglês"", diz presidente da Uefa"," No que depender da vontade do presidente da Uefa, Aleksander Ceferin, o Liverpool será coroado campeão inglês mesmo que a Premier League não tenha mais jogos até o fim da temporada. A opinião do dirigente foi dada ao jornal esportivo esloveno “Ekipa” nesta segunda-feira.  - É impossível para o Liverpool terminar sem título. Se os jogos forem disputados, eles certamente o vencerão em campo. (...) No caso de as partidas não poderem ser disputadas, a maneira e os critérios devem ser encontrados com base nos quais de acordo com os resultados, ele será declarado campeão.  O Liverpool, que não conquista o Campeonato Inglês há 30 anos, estava com a mão na taça, com 25 pontos de vantagem sobre o segundo colocado, o Manchester City, quando o torneio foi suspenso após a 29ª rodada, devido à pandemia do novo coronavírus.  A Uefa não se pronunciou sobre um eventual calendário de retomada da temporada, alegando trabalhar com vários cenários, embora tenha decidido o adiamento da Eurocopa para 2021.  Questionado sobre a possibilidade de organizar jogos no próximo verão (europeu, em julho), o líder esloveno respondeu simplesmente que ele é ""um otimista em geral"".  - É claro que não posso conceder ou prometer nada. Tudo dependerá de saber se a situação será segura o suficiente para que uma pessoa não corra perigo jogando futebol. ",esportes,,,,,,
2020-04-07,https://web.archive.org/web/20200407000015/https://globoesporte.globo.com/futebol/futebol-internacional/noticia/justica-dos-eua-acusa-ricardo-teixeira-de-ter-recebido-suborno-para-votar-no-catar-como-sede-da-copa.ghtml,https://globoesporte.globo.com/futebol/futebol-internacional/noticia/justica-dos-eua-acusa-ricardo-teixeira-de-ter-recebido-suborno-para-votar-no-catar-como-sede-da-copa.ghtml,Justiça dos EUA acusa Ricardo Teixeira de ter recebido suborno para votar no Catar como sede da Copa," O Departamento de Justiça dos Estados Unidos (DOJ, na sigla em inglês), em documento tornado público nesta segunda-feira, acusa o ex-presidente da CBF, Ricardo Teixeira, de ter recebido subornos para votar no Catar como sede da Copa do Mundo de 2022. A acusação está num novo indiciamento do ""Caso Fifa"", a maior investigação da história sobre corrupção no futebol. O valor da propina não foi divulgado.  + Libertado pela Justiça dos EUA, José Maria Marín desembarca sozinho em São Paulo  É a primeira vez que a justiça norte-americana acusa dirigentes nominalmente de terem recebido suborno nas votações para eleger as sedes da Copa do Mundo de 2018, na Rússia, e de 2022, no Catar. A denúncia, no entanto, não cita a origem das propinas.  A defesa de Ricardo Teixeira nega as acusações. Em entrevista recente à CNN Brasil, o ex-dirigente afirmou que as acusações do DOJ contra ele eram ""perseguição"" por ele ter votado no Catar e não nos EUA, que também queria ter sido sede da Copa de 2022.  RELEMBRE: Grampos revelam como funcionava distribuição de propina no ""Caso Fifa""  O ex-presidente da Conmebol, Nicolas Leoz (morto no ano passado) e o ex-presidente da AFA, Julio Grondona (morto em 2014) também foram acusados de trocar seus votos no Catar por dinheiro. O DOJ acusa ainda o ex-presidente da Concacaf , Jack Warner, de ter recebido US$ 5 milhões para ter votado na Rússia como sede da Copa de 2022.  É a primeira vez que Teixeira recebe uma acusação formal de suborno no processo de votação para eleger a sede da Copa do Mundo de 2022, feita em 2010. O nome do ex-dirigente brasileiro já havia sido citado em denúncias feitas pela revista ""World Soccer"" e pelo jornal ""Folha de São Paulo"".  O ex-presidente da CBF também é citado no relatório de Michael Garcia, investigador independente responsável por analisar o processo de votação dos Mundiais de 2018 e 2022. O documento aponta que um total de US$ 2 milhões teriam sido pagos à filha de 10 anos, à época, de um membro da Fifa antes da escolha do Catar. Tal dirigente seria Teixeira.  O relatório Garcia, como ficou conhecido, também apontou que Teixeira recebeu tratamento ""top vip"" e se hospedou por quatro noites na suíte presidencial do hotel Four Seasons, em Doha, ao custo diário de US$ 5.490 durante um amistoso entre Brasil e Argentina em 2010. O valor foi 18 vezes maior aos quartos destinados aos jogadores.  Teixeira está entre os acusados da justiça norte-americana desde o início do ""Caso Fifa"", em 2015. Ele foi denunciado também por receber suborno por contratos ligados a competições da Conmebol e da CBF.  Ele também foi acusado de receber propina pelo contrato de patrocínio estabelecido pela entidade em 1996 com uma empresa americano de material esportivo (a Nike). No caso desse contrato, a acusação é que Teixeira recebeu cerca de 20 milhões de dólares de propina (metade da comissão que a Traffic, empresa de marketing, teria direito) ",esportes,,,,,,
2020-04-07,https://web.archive.org/web/20200407000015/https://globoesporte.globo.com/pi/futebol/brasileirao-serie-d/noticia/lider-dos-capitaes-da-serie-d-comemora-cota-de-r-81-milhoes-aos-clubes-e-desabafa-a-gente-recebeu-criticas-de-que-nao-daria-certo.ghtml,https://globoesporte.globo.com/pi/futebol/brasileirao-serie-d/noticia/lider-dos-capitaes-da-serie-d-comemora-cota-de-r-81-milhoes-aos-clubes-e-desabafa-a-gente-recebeu-criticas-de-que-nao-daria-certo.ghtml,"Após manifesto à CBF, goleiro vibra com cota de R$ 8,1 milhões aos times da Série D: ""É inédito"""," O aporte financeiro de R$ 8,1 milhões da CBF distribuído aos 68 clubes da Série D do Campeonato Brasileiro, anunciado nesta segunda-feira, foi bem recebido pelos capitães das equipes. Há uma semana, os jogadores se uniram e encaminharam à entidade uma carta de reivindicações, entre elas, o pedido de uma cota de ajuda para os clubes resistirem ao período sem competições devido à pandemia do novo coronavírus. O goleiro Rodrigo Ramos, do Altos, um dos líderes do movimento, desabafou ao descobrir sobre a verba aos times assegurada pela CBF.  Rodrigo relatou que o movimento sofreu críticas e questionamentos se iria ter sucesso. Além dele, o goleiro Eder, do São Raimundo-RR, idealizou a união dos capitães dos times da Séries D.  - É uma conquista, estou feliz. Quando o grupo foi formado, dos capitães da Série D, muito se falou que nós talvez não conseguíssemos chamar a atenção da CBF. E olha aí o que aconteceu, algo inédito na Série D. Desde 2009, na sua criação, a gente nunca viu algo sobre cota financeira à competição – comentou o jogador.  O goleiro parabenizou a união dos jogadores e acredita ser esse o caminho para um futebol melhor.  - A gente recebeu algumas críticas de que não daria certo, que a CBF não iria ouvir os apelos das equipes da Quarta Divisão. E a gente acreditou, nos organizamos. Isso é importante, e está aí a prova. Estamos felizes, é uma coisa inédita. Com união, podemos conquistar as coisas. Os clubes têm que se unir para passar nesse momento difícil. Esperamos conquistar mais coisas juntos – acrescentou o goleiro do Altos.  No pedido à CBF, os capitães solicitaram a ajuda financeira e a manutenção da fórmula da Série D em 2020, com 26 datas no total, e uma fase de grupos com 14 rodadas. Na carta, os jogadores argumentaram que essas medidas iriam evitar demissões de 2 mil atletas, número estimado de profissionais na competição. Relembre no vídeo abaixo o que os jogadores pediram à Confederação.  Nesta segunda-feira, a CBF garantiu que cada clube da Série D vai receber R$ 120 mil – com pagamento a partir desta terça-feira. Além disso, no comunicado, a entidade disse estar flexível para atender todo o calendário de competições de 2020. A CBF também anunciou verbas para os times da Série C, Brasileirão feminino e as federações estaduais.  - Claro que não é um valor exorbitante, que vai resolver os problemas daqui para frente, mas sem sombra de dúvida, é uma grande ajuda para que a CBF possa dar uma olhada para esses clubes e mais de dois mil atletas que sofrem, lutam e dependem muito dessa contribuição da CBF nesse momento de crise - considerou Rodrigo.  Em 2020, a Série D conta com uma fase preliminar com oito times. Quatro avançam à fase de grupos, quando 64 equipes ficam divididas em oito grupos. Os quatro de cada chave se classificam ao mata-mata, até a definição do campeão. Os semifinalistas garantem o acesso à Série C de 2021. ",esportes,,,,,,
