,data,url_noticia,url_noticia_curto,titulo,conteudo_noticia,assunto,assunto_ex,titulo_ex,subtitulo_ex,local_ex,artigo_ex,n_paragrafos
0,2016-01-13,https://web.archive.org/web/20160113005502/http://sportv.globo.com/site/combate/noticia/2016/01/weidman-surpreende-e-diz-que-ficou-feliz-por-ter-perdido-para-rockhold.html,http://sportv.globo.com/site/combate/noticia/2016/01/weidman-surpreende-e-diz-que-ficou-feliz-por-ter-perdido-para-rockhold.html,Weidman surpreende e diz que ficou feliz por ter perdido para Rockhold ,"Acostumado a deixar o octógono sob aplausos da torcida, abraçando os familiares e celebrando a vitória, Chris Weidman viveu o outro lado da moeda no UFC 194, em dezembro do ano passado. O americano perdeu não só o cinturão do peso-médio do Ultimate para Luke Rockhold, como experimentou pela primeira vez o sabor amargo da derrota. A dureza do resultado, porém, é encarada como experiência de vida para ""All American"", que garante ter ficado feliz com o revés.Em entrevista ao podcast ""MMA Hour"", na segunda-feira, o ex-campeão do UFC afirmou que, caso não tivesse sucumbido, não estaria corrigindo erros, como pretende fazer neste processo de recomeço.- O jeito como eu me senti depois da derrota foi, de longe, a sensação mais surreal da minha vida. Senti como se fosse um sonho ruim, eu só quis voltar a dormir e fazer com que isso não acontecesse de novo. Foi uma coisa surreal. Agora, emocional e mentalmente, sinto que estou no melhor lugar que eu poderia estar. Foi uma grande experiência. Poderia fazer diferente um milhão de coisas na luta, porém, estou realmente feliz que eu perdi. Sinto como se eu tivesse vencido. Se eu tivesse arrumado uma maneira de vencê-lo, eu não teria a oportunidade que tenho agora de crescer como lutador e alcançar o meu potencial. Tenho a liberdade para mudar as coisas que eu quis durante anos. Você não quer corrigir coisas que não estão quebradas, então é nessa situação que você para e produz mudanças. Estou empolgado com o futuro. Sinto como se fosse criar um monstro diferente dentro de mim, estou motivado para lutar de novo.Famoso por destronar Anderson Silva - a quem derrotou em duas oportunidades - Weidman defendia o cinturão pela quarta vez, mas revela que não sentiu tanta empolgação desta vez durante a preparação para o embate.- Eu me senti estranho no camp. Não é desculpa, treinei duro, mas senti uma falta de motivação. Não consegui alcançar essa motivação por alguma razão. Foi estranho perder. Mas depois, você percebe: isso era para acontecer, ele (Rockhold) foi um cara melhor aquela noite e há milhões de coisas na minha cabeça que eu sei que poderia ter feito diferente durante a preparação e na luta. Entretanto, não tenho arrependimentos, porque tenho a capacidade de voltar melhor. Quando se é invicto durante um longo tempo, você simplesmente não sente necessidade de mudar as coisas. Agora, é diferente.Sobre o embate com Rockhold, Weidman sabe que o chute rodado desferido de maneira atabalhoada contribuiu para sua derrota. Entretanto, ele minimiza o golpe.- Todo mundo tem falado sobre o chute. Eu sinto que estava ganhando a luta, mas correndo com dois cilindros. Eu senti que mereci perder, e estou feliz que tenha sido assim. Ele estava circulando e achei que pudesse dar um chute giratório. Ele capitalizou e me levou para baixo, mas isso não significa que deveria ter sido o fim da luta para mim. Foi um bom chute giratório? Isso mudou a dinâmica da luta? Com certeza, mas há coisas que eu deveria ter feito assim que eu caí no chão. E eu não as fiz. Estou motivado para mudar algumas coisas, para fazer coisas diferentes. ",esportes,,Weidman surpreende e diz que ficou feliz por ter perdido para Rockhold ,"Americano, que estava invicto no MMA, assegura que derrota para Luke Rockhold o fará evoluir, revela que se sentiu estranho no camp, mas frisa: ""Não é desculpa""","Las Vegas, EUA","Acostumado a deixar o octógono sob aplausos da torcida, abraçando os familiares e celebrando a vitória, Chris Weidman viveu o outro lado da moeda no UFC 194, em dezembro do ano passado. O americano perdeu não só o cinturão do peso-médio do Ultimate para Luke Rockhold, como experimentou pela primeira vez o sabor amargo da derrota. A dureza do resultado, porém, é encarada como experiência de vida para ""All American"", que garante ter ficado feliz com o revés.Em entrevista ao podcast ""MMA Hour"", na segunda-feira, o ex-campeão do UFC afirmou que, caso não tivesse sucumbido, não estaria corrigindo erros, como pretende fazer neste processo de recomeço.- O jeito como eu me senti depois da derrota foi, de longe, a sensação mais surreal da minha vida. Senti como se fosse um sonho ruim, eu só quis voltar a dormir e fazer com que isso não acontecesse de novo. Foi uma coisa surreal. Agora, emocional e mentalmente, sinto que estou no melhor lugar que eu poderia estar. Foi uma grande experiência. Poderia fazer diferente um milhão de coisas na luta, porém, estou realmente feliz que eu perdi. Sinto como se eu tivesse vencido. Se eu tivesse arrumado uma maneira de vencê-lo, eu não teria a oportunidade que tenho agora de crescer como lutador e alcançar o meu potencial. Tenho a liberdade para mudar as coisas que eu quis durante anos. Você não quer corrigir coisas que não estão quebradas, então é nessa situação que você para e produz mudanças. Estou empolgado com o futuro. Sinto como se fosse criar um monstro diferente dentro de mim, estou motivado para lutar de novo.Famoso por destronar Anderson Silva - a quem derrotou em duas oportunidades - Weidman defendia o cinturão pela quarta vez, mas revela que não sentiu tanta empolgação desta vez durante a preparação para o embate.- Eu me senti estranho no camp. Não é desculpa, treinei duro, mas senti uma falta de motivação. Não consegui alcançar essa motivação por alguma razão. Foi estranho perder. Mas depois, você percebe: isso era para acontecer, ele (Rockhold) foi um cara melhor aquela noite e há milhões de coisas na minha cabeça que eu sei que poderia ter feito diferente durante a preparação e na luta. Entretanto, não tenho arrependimentos, porque tenho a capacidade de voltar melhor. Quando se é invicto durante um longo tempo, você simplesmente não sente necessidade de mudar as coisas. Agora, é diferente.Sobre o embate com Rockhold, Weidman sabe que o chute rodado desferido de maneira atabalhoada contribuiu para sua derrota. Entretanto, ele minimiza o golpe.- Todo mundo tem falado sobre o chute. Eu sinto que estava ganhando a luta, mas correndo com dois cilindros. Eu senti que mereci perder, e estou feliz que tenha sido assim. Ele estava circulando e achei que pudesse dar um chute giratório. Ele capitalizou e me levou para baixo, mas isso não significa que deveria ter sido o fim da luta para mim. Foi um bom chute giratório? Isso mudou a dinâmica da luta? Com certeza, mas há coisas que eu deveria ter feito assim que eu caí no chão. E eu não as fiz. Estou motivado para mudar algumas coisas, para fazer coisas diferentes. 
    Os comentários são de responsabilidade exclusiva de seus autores e não representam a opinião deste site. Se achar algo que viole os
    termos de uso, denuncie. Leia as perguntas mais frequentes para saber o que é impróprio ou ilegal.
recentespopularesEu já disse aqui, sempre torcerei pelo Weidman, justamente por causa dos Tupins descontrolados que o odeiam. Isso pelo fato dele ter distribuído a porrada para todos brasileiros da divisão. O Weidman é talentoso, mas o Luke está um degrau acima. Vamos ver se o Weidman evolui depois disso e retoma a cinta. Ele já provou que pode chocar o mundo.recentespopularesNunca ameace um psicopata!recentespopulareskkkkkkkkkkk psicopata o grande l.adrão de wifi.Cadê aquele otario tal de psicopata que o weidman era o rei kkkkkkkrecentespopularesO chôro é livre, sem mimimi kkkkkkkkkkkkkkkk Olha a cara dele após a luta, levou uma SURRA e que SURRA KKKKKKKKKKKKKKKKKKKKKKKKKKKKKKKKKKKKKKrecentespopularesO fetiche em psicopata é tanto, que até colocam dados que não condizem com a verdade! Não é mesmo, Gabriel Tenorio???!!!Quer apanhar mas mediano? gostou de apanhar, cara sem gás e todo lentoGanhou em uma bobeira do Spider e na canela quebrada .... Nunca convenceu Esse só ganha de idoso, contra lutador top faz o fez contra o luke, quem entendia de mma e não era modinha sabia quem era o weidman.Anderson Silva no auge tiraria pra nada todos esses lutadores da nova geração dos médios, tal qual ele fez com todos os outros que ele enfrentou no Ultimate. Porque eu digo isso? Todo mundo achava o Weidman invencível, mas eles são todos nivelados. Assistam o primeiro round da primeiro luta entre Anderson e Weidman, o brasileiro já tinha quebrado o americano psicologicamente, ele terminou o round perdido, o erro do Anderson foi ter exagerado nas brincadeiras. Mas se não fosse isso, continuaria reinando absolutamente. Minha opinião.recentespopularesDC é monstrão, um dos maiores que já vi sem dúvida! 3 lutas em 9 meses, é sinistro (os que eu admiro atualmente, além dele, é o Edgar, Jones, Weidman e Lawler, esse também é monstrão!). Desceu para não enfrentar Cain, seu amigo (não foi por altura, hunt tem 1.77 e Cain 1.85), se Werdum ganhar a revanche, não duvido DC subir para uma super luta! recentespopularesO lutador que mais admiro atualmente é Lawler, o Wanderlei Silva do boxe e dos meio médio! show de ver! O Weidman nao so perdeu apanhou muito feio ,vem dizer que ficou feliz lutador fraco nem reagiu na luta recentespopularesIsaias, volta pra casinha....recentespopularestheo pfv esta no lugar errado volte  para seus sites de novela fofocas essas coisas Pra mim nunca foi um campeão de verdade, e volto a dizer tudo o que disse anteriormente, venceu o anderson na primeira luta porque o brasileiro tava brincando, na segunda houve a fatalidade da perna quebrar, na luta contra o machida, se o brasileiro tivesse mais punch tinha nocauteado ele, quem viu o combate viu o lyoto atordoando ele algumas vezes, contra o belfort, pegou ele sem o uso do TRT e.. finalmente o Rockhold no seu auge e em plena forma, tomou um atraso !!! Vai enfrentar o jacare e tomar outro atropelo !recentespopularesPois olha, depois de o Romero ser pego no antidoping há uma grande chance de o Jacaré conseguir o Title Shot. recentespopularesEntao o papo que ta rolando e que os caras estão querendo casar essa luta pro ufc 200 e os nomes que ta na fila e o do Vítor e Anderson sao mais vendavais pode ser que eles coloquem o jaca contra o weidman vamos ver mas esse cubano ai não merece lutar pelo titulo e trapaceiro e antiesportista nao gosto desse cara O Weidman é humilde e sábio! Assim que perdeu ele já disse: ""Merecido e justo!"". Venceu o primeiro round e vencia o terceiro quando errou! E não dá nenhuma desculpa. Mas a Kyra antes da luta já dizia que o Weidman não treinou legal por um problema no tornozelo. Kyra é sobrinha do treinador do Weidman! Mas enfim, Jaca x Weidman para pega o Luke que esmagará o Romero. recentespopularesTim Kennedy já tem luta marcada com Lyoto, acho que o UFC ainda não anunciou mas já ta fechadorecentespopularesVamos ver se o Lyoto se recupera, enfim. o bichin gosta de apanhar né, zulivreE o próximo lutador da mídia a cair levando uma surra, vai ser o Conor McGregor, podem me cobrar depois!! recentespopularessimWeidman afirmou: ""Se eu tivesse encontrado um meio de vencê-lo (Hockhold) não teria oportunidade para crescer"". (!!!) Acabei de compreender que o Chris não é essa fortaleza psicológica. Ele tem Spider na cabeça. Referiu de forma velada a primeira vitória de AS sobre Sonnen, tentando desconstruir. Ao dizer que ficou contente com a derrota, foi uma máscara hipócrita que denota insegurança. Diz que não quer dar desculpas,  porém, não fez um camp ideal. Muita antítese para uma fortaleza psicológica. É só um bom, mas simples lutador. Mais nada.esse cara é o segundo maior de todos os tempos...perdeu por puro azar; melhor que ele, apenas o mcgregorrecentespopularesPoncio?O que aconteceu com a Ronda e com o Weidman, vai acontecer com o McGregor: depois da derrota, vai aparecer a humildade...recentespopularesTo na torcida! recentespopularesBoa Sandro concordo com vc vai apanhar para aprender a ser humilde.Dos Anjos desde sempre...Oss!!!!!!!!!!!!!!Eu só queria saber aonde está o técnico gordo do Weidman que falava pelos cotovelos... onde ele está? não dá mais entrevista???recentespopularesRapaz é mesmo cadê aquele arrogante? recentespopularesCade a faixa preta que ele ganhou do Gracie hahaha Falou tudo. O cara é formado e muito inteligente mesmo.
O chute foi só o inicio. Mas ele não levou um nockdown a luta foi para o chão e ficou vários minutos lá e ele simplesmente não conseguia raspar, inverter ou pelo menos proteger. Levou uma sova no chão.
Mas é um TOP com certeza!Falou tudo. O cara é formado e muito inteligente mesmo.
O chute foi só o inicio. Mas ele não levou um nockdown a luta foi para o chão e ficou vários minutos lá e ele simplesmente não conseguia raspar, inverter ou pelo menos proteger. Levou uma sova no chão.
Mas é um TOP com certeza!nunca gostei do weidman. Um cara que ganhava, mas não passava confiança alguma. E ainda tomou um a surra do luckese eu não estou enganado esse disse que queria lutar com o Jon Jone?será que agora ele vai parar com  o fetiche de colar as fotos dos oponentes na geladeira? , kkkkkkkkkkkkkke eu acredito em papai noel !!!!Não é desculpa o ""nariz"" dele, parece o Cigano com a desculpa do  tal de ""overtraining"" ninguém que perdeu alguma luta de titulo tem humildade de aceitar que o adversário foi melhor, independente do motivo seja ele qual for, um golpe de sorte, ou superioridade na luta, esta faltando humildade para alguns lutadores.recentespopularesverdade admitiu que levou uma surra cerrone recentespopularesO Anderson também quando perdeu da primeira vez para o próprio cwCW teve seu jogo  de chão anulado quando percebeu que poderia acabar numa guilhotina.. Em pé, seu boxe não deu conta para os chutes baixos. Teve sua movimentação atrapalhada.
No final das contas, Rockhold fez a estrategia para a vitoria. Embora CW seja muito forte, acho dificil ele fazer reinado na categoria. Não duvido numa derrota contra Jacaré, Romero ou numa revanche contra AS.Reparem  na cara de alegria da criança na foto do post da matéria !Weidman masoquista recentespopularesEu já disse aqui, sempre torcerei pelo Weidman, justamente por causa dos Tupins descontrolados que o odeiam. Isso pelo fato dele ter distribuído a porrada para todos brasileiros da divisão. O Weidman é talentoso, mas o Luke está um degrau acima. Vamos ver se o Weidman evolui depois disso e retoma a cinta. Ele já provou que pode chocar o mundo.recentespopularesNunca ameace um psicopata!recentespopulareskkkkkkkkkkk psicopata o grande l.adrão de wifi.Cadê aquele otario tal de psicopata que o weidman era o rei kkkkkkkrecentespopularesO chôro é livre, sem mimimi kkkkkkkkkkkkkkkk Olha a cara dele após a luta, levou uma SURRA e que SURRA KKKKKKKKKKKKKKKKKKKKKKKKKKKKKKKKKKKKKKrecentespopularesO fetiche em psicopata é tanto, que até colocam dados que não condizem com a verdade! Não é mesmo, Gabriel Tenorio???!!!Quer apanhar mas mediano? gostou de apanhar, cara sem gás e todo lentoGanhou em uma bobeira do Spider e na canela quebrada .... Nunca convenceu Esse só ganha de idoso, contra lutador top faz o fez contra o luke, quem entendia de mma e não era modinha sabia quem era o weidman.Anderson Silva no auge tiraria pra nada todos esses lutadores da nova geração dos médios, tal qual ele fez com todos os outros que ele enfrentou no Ultimate. Porque eu digo isso? Todo mundo achava o Weidman invencível, mas eles são todos nivelados. Assistam o primeiro round da primeiro luta entre Anderson e Weidman, o brasileiro já tinha quebrado o americano psicologicamente, ele terminou o round perdido, o erro do Anderson foi ter exagerado nas brincadeiras. Mas se não fosse isso, continuaria reinando absolutamente. Minha opinião.recentespopularesDC é monstrão, um dos maiores que já vi sem dúvida! 3 lutas em 9 meses, é sinistro (os que eu admiro atualmente, além dele, é o Edgar, Jones, Weidman e Lawler, esse também é monstrão!). Desceu para não enfrentar Cain, seu amigo (não foi por altura, hunt tem 1.77 e Cain 1.85), se Werdum ganhar a revanche, não duvido DC subir para uma super luta! recentespopularesO lutador que mais admiro atualmente é Lawler, o Wanderlei Silva do boxe e dos meio médio! show de ver! O Weidman nao so perdeu apanhou muito feio ,vem dizer que ficou feliz lutador fraco nem reagiu na luta recentespopularesIsaias, volta pra casinha....recentespopularestheo pfv esta no lugar errado volte  para seus sites de novela fofocas essas coisas Pra mim nunca foi um campeão de verdade, e volto a dizer tudo o que disse anteriormente, venceu o anderson na primeira luta porque o brasileiro tava brincando, na segunda houve a fatalidade da perna quebrar, na luta contra o machida, se o brasileiro tivesse mais punch tinha nocauteado ele, quem viu o combate viu o lyoto atordoando ele algumas vezes, contra o belfort, pegou ele sem o uso do TRT e.. finalmente o Rockhold no seu auge e em plena forma, tomou um atraso !!! Vai enfrentar o jacare e tomar outro atropelo !recentespopularesPois olha, depois de o Romero ser pego no antidoping há uma grande chance de o Jacaré conseguir o Title Shot. recentespopularesEntao o papo que ta rolando e que os caras estão querendo casar essa luta pro ufc 200 e os nomes que ta na fila e o do Vítor e Anderson sao mais vendavais pode ser que eles coloquem o jaca contra o weidman vamos ver mas esse cubano ai não merece lutar pelo titulo e trapaceiro e antiesportista nao gosto desse cara O Weidman é humilde e sábio! Assim que perdeu ele já disse: ""Merecido e justo!"". Venceu o primeiro round e vencia o terceiro quando errou! E não dá nenhuma desculpa. Mas a Kyra antes da luta já dizia que o Weidman não treinou legal por um problema no tornozelo. Kyra é sobrinha do treinador do Weidman! Mas enfim, Jaca x Weidman para pega o Luke que esmagará o Romero. recentespopularesTim Kennedy já tem luta marcada com Lyoto, acho que o UFC ainda não anunciou mas já ta fechadorecentespopularesVamos ver se o Lyoto se recupera, enfim. o bichin gosta de apanhar né, zulivreE o próximo lutador da mídia a cair levando uma surra, vai ser o Conor McGregor, podem me cobrar depois!! recentespopularessimWeidman afirmou: ""Se eu tivesse encontrado um meio de vencê-lo (Hockhold) não teria oportunidade para crescer"". (!!!) Acabei de compreender que o Chris não é essa fortaleza psicológica. Ele tem Spider na cabeça. Referiu de forma velada a primeira vitória de AS sobre Sonnen, tentando desconstruir. Ao dizer que ficou contente com a derrota, foi uma máscara hipócrita que denota insegurança. Diz que não quer dar desculpas,  porém, não fez um camp ideal. Muita antítese para uma fortaleza psicológica. É só um bom, mas simples lutador. Mais nada.esse cara é o segundo maior de todos os tempos...perdeu por puro azar; melhor que ele, apenas o mcgregorrecentespopularesPoncio?O que aconteceu com a Ronda e com o Weidman, vai acontecer com o McGregor: depois da derrota, vai aparecer a humildade...recentespopularesTo na torcida! recentespopularesBoa Sandro concordo com vc vai apanhar para aprender a ser humilde.Dos Anjos desde sempre...Oss!!!!!!!!!!!!!!Eu só queria saber aonde está o técnico gordo do Weidman que falava pelos cotovelos... onde ele está? não dá mais entrevista???recentespopularesRapaz é mesmo cadê aquele arrogante? recentespopularesCade a faixa preta que ele ganhou do Gracie hahaha Falou tudo. O cara é formado e muito inteligente mesmo.
O chute foi só o inicio. Mas ele não levou um nockdown a luta foi para o chão e ficou vários minutos lá e ele simplesmente não conseguia raspar, inverter ou pelo menos proteger. Levou uma sova no chão.
Mas é um TOP com certeza!Falou tudo. O cara é formado e muito inteligente mesmo.
O chute foi só o inicio. Mas ele não levou um nockdown a luta foi para o chão e ficou vários minutos lá e ele simplesmente não conseguia raspar, inverter ou pelo menos proteger. Levou uma sova no chão.
Mas é um TOP com certeza!nunca gostei do weidman. Um cara que ganhava, mas não passava confiança alguma. E ainda tomou um a surra do luckese eu não estou enganado esse disse que queria lutar com o Jon Jone?será que agora ele vai parar com  o fetiche de colar as fotos dos oponentes na geladeira? , kkkkkkkkkkkkkke eu acredito em papai noel !!!!Não é desculpa o ""nariz"" dele, parece o Cigano com a desculpa do  tal de ""overtraining"" ninguém que perdeu alguma luta de titulo tem humildade de aceitar que o adversário foi melhor, independente do motivo seja ele qual for, um golpe de sorte, ou superioridade na luta, esta faltando humildade para alguns lutadores.recentespopularesverdade admitiu que levou uma surra cerrone recentespopularesO Anderson também quando perdeu da primeira vez para o próprio cwCW teve seu jogo  de chão anulado quando percebeu que poderia acabar numa guilhotina.. Em pé, seu boxe não deu conta para os chutes baixos. Teve sua movimentação atrapalhada.
No final das contas, Rockhold fez a estrategia para a vitoria. Embora CW seja muito forte, acho dificil ele fazer reinado na categoria. Não duvido numa derrota contra Jacaré, Romero ou numa revanche contra AS.Reparem  na cara de alegria da criança na foto do post da matéria !Weidman masoquista 14Jan17:5217:4017:3817:1516:5616:5416:5216:2915:4914:4914Jan17:4017:1516:5414:4913:2712:3911:1510:0009:0008:4314Jan17:4017:1516:5415:2314:4913:2712:3911:1510:1110:0018Dez12:0216Dez10:0015Dez19:4014Dez22:1913Dez08:0710Dez21:1719:5509:0008Dez19:3907Dez10:0013Jan11:5805Jan13:0001:0030Dez16:4118Dez12:0201:0015Dez19:4014Dez22:1913Dez",268.0
