,data,url_noticia,url_noticia_curto,titulo,conteudo_noticia,assunto,assunto_ex,titulo_ex,subtitulo_ex,local_ex,artigo_ex,n_paragrafos
37,2016-10-21,https://web.archive.org/web/20161021002538/http://sportv.globo.com/site/combate/noticia/2016/10/ufc-planeja-realizar-cruz-x-garbrandt-pelo-cinturao-dos-galos-na-edicao-207.html,http://sportv.globo.com/site/combate/noticia/2016/10/ufc-planeja-realizar-cruz-x-garbrandt-pelo-cinturao-dos-galos-na-edicao-207.html,UFC planeja realizar Cruz x Garbrandt pelo cinturão dos galos na edição 207,"Tudo indica que o desafiante de Dominick Cruz pelo cinturão dos galos do Ultimate será Cody Garbrandt. De acordo com o site ""MMA Fighting"", a organização planeja realizar ao duelo no UFC 207, que acontece no dia 30 de dezembro, em Las Vegas (EUA). O ex-campeão TJ Dillashaw concorria com Garbrandt pela chance de desafiar Cruz. A franquia ainda não anunciou a peleja oficialmente. Com 22 vitórias e apenas uma derrota no cartel, Cruz não perde desde março de 2007, quando foi finalizado por Urijah Faber - a quem derrotou em sua última luta, em junho deste ano.Invicto na carreira, com 10 vitórias, Garbrant venceu nove de seus combates por nocaute ou nocaute técnico. No UFC, o americano tem cinco triunfos - dois deles contra os brasileiros Thomas Almeida e Augusto Tanquinho. UFC 20730 de dezembro em Las Vegas, EUACARD DO EVENTO (até o momento):Peso-galo: Amanda Nunes x Ronda RouseyPeso-galo: Dominick Cruz x Cody GarbrandtPeso-pesado: Fabricio Werdum x Cain VelásquezPeso-meio-médio: Mike Pyle x Alex GarciaPeso-meio-médio: Brandon Thatch x Sabah Homasi Peso-meio-médio: Tim Means x Alex CowboyPeso-meio-médio: Matt Brown x Tarec SaffiedinePeso-meio-médio: Johny Hendricks x Neil Magny",esportes,,UFC planeja realizar Cruz x Garbrandt pelo cinturão dos galos na edição 207,"Garbrandt vence ""cabo de guerra"" com TJ Dillashaw e vai desafiar Cruz, diz site","Las Vegas, EUA","Tudo indica que o desafiante de Dominick Cruz pelo cinturão dos galos do Ultimate será Cody Garbrandt. De acordo com o site ""MMA Fighting"", a organização planeja realizar ao duelo no UFC 207, que acontece no dia 30 de dezembro, em Las Vegas (EUA). O ex-campeão TJ Dillashaw concorria com Garbrandt pela chance de desafiar Cruz. A franquia ainda não anunciou a peleja oficialmente. Com 22 vitórias e apenas uma derrota no cartel, Cruz não perde desde março de 2007, quando foi finalizado por Urijah Faber - a quem derrotou em sua última luta, em junho deste ano.Invicto na carreira, com 10 vitórias, Garbrant venceu nove de seus combates por nocaute ou nocaute técnico. No UFC, o americano tem cinco triunfos - dois deles contra os brasileiros Thomas Almeida e Augusto Tanquinho. UFC 20730 de dezembro em Las Vegas, EUACARD DO EVENTO (até o momento):Peso-galo: Amanda Nunes x Ronda RouseyPeso-galo: Dominick Cruz x Cody GarbrandtPeso-pesado: Fabricio Werdum x Cain VelásquezPeso-meio-médio: Mike Pyle x Alex GarciaPeso-meio-médio: Brandon Thatch x Sabah Homasi Peso-meio-médio: Tim Means x Alex CowboyPeso-meio-médio: Matt Brown x Tarec SaffiedinePeso-meio-médio: Johny Hendricks x Neil Magny
    Os comentários são de responsabilidade exclusiva de seus autores e não representam a opinião deste site. Se achar algo que viole os
    termos de uso, denuncie. Leia as perguntas mais frequentes para saber o que é impróprio ou ilegal.
recentespopularesTotalmente errado! Tj deveria lutar contra o Cruz, e o Cody Garbrandt deveria lutar contra o Lineker pra ver quem deveria lutar pela cinta!! Agr Lineker tem q lutar mais uma luta contra Jimmie Rivera para disputar a cinta dps do vencedor de Dillashaw contra o Caraway!! E pra mim a luta do Thominhas deveria ser contra o Sterling n contra aquele cara q n sei o nome e n ta entre os tops! E o Raphael tem q enfrentar o Dodson!! MAIORIA N VAI LER!!recentespopularesCoerente!!!
Cody nocauteia, podem apostar!recentespopularesO quase nocaute foi por medorecentespopularesSeu idiota chamado de rei conor não entendi de nada Faz mais sentido que o Dillashaw. Por mais que o Garbrandt ainda tem um cartel pequeno, vem impressionando com seus nocautes. Dillashaw já teve sua chance e não foi acima da média contra o Rafael.recentespopularesPelo seu apelido, tu deve ter 4 cm.... kkkkkkkkkkkk. recentespopularesSó a cabecinha. kkkkkkkkkkkkDeixaram o Lineker de escanteio!!!Me diga, o Cody é bom e tals, mas venceu dos ''grandes'' Thominhas Almeida e Takeya e tem ts, é quase o mesmo que fizeram com Cejudo, o cara tá cruzinho, vai ser um repeteco do que Cruz fez com Faber. Até Lineker merece mais que esse cara.recentespopularesAs pessoas falam muito da revanche do Aldo, mas o TJ era um dos caras que merecia pelo que foi a luta uma revanche imediata...recentespopularesTJ, Linker e Jimmie Rivera tem motivos para um TS, mas Cody, não.Faber com 3 vitórias disputou a cinta. Wodley vinha de 1 derrota e 1 vitória e disputou a cinta. Conor vem de 1 derrota e 1 vitória e vai disputar a cinta. Alvarez com 1 derrota e 2 vitórias disputou a cinta. Gustafson veio de 1 derrota e disputou a cinta. Miocic ganhou 2 vezes e foi disputar a cinta. Aí eu pergunto: será que isso não está errado não? Jacaré tem 27 vitórias seguidas. Demian tem 52 vitórias. Lineker vem de 65 vitórias. Desrespeito da cebola, rapaz!recentespopularesCacá, ele não venceu nenhum atleta de ponta ainda para merecer o TS, teria que ter um pouco mais de rodagem, vencer um top 5 e tal.recentespopularesContra o Cody, não existe queixo duro.Certo seria Cruz X Tj, e cody X Lineker, e o vencedor de cody X Lineker disputar o cinturão Acho o Garbrant ainda sem currículo para enfrentar o Cruz, o mais correto seria mesmo o TJ. Mais um indício que o Cruz está evitando o TJ.recentespopularesConcordo que TJ mereça mais, pela derrota apertada, mas Cody precisa fazer no máximo mais uma luta, com.um top 3, pq o cara vem aniquilando todo mundo.recentespopularesSim sim, Cody teria que enfrentar Assunção ou o próprio Lineker.O Cody merece a chance, agora precisam casar a luta entre dillashaw vs Lineker pra saber quem será o proximo desafiante.recentespopularesDisse tudo, vandersonQue sacanagem com o Tidiei Dilachó. Esse Cody realmente é bom, mostrou isso contra o pequeno Thomas, mas o Cruz ganhou numa decisão apertadíssima dele. Merecia a revanche, mais um injustiçado.recentespopularessó venceu o barão 2 vezes e o Rafael Assunção É POUCO!!! te de brincadeira!recentespopularesFalando dessa forma, parece até que ele defendeu o cinturão 3 vezes só contra Barão e Raphael Assunção. Ele venceu o Barão com méritos e conquistou o cinturão, depois venceu o mesmo Barão totalmente sem confiança (aliás, Barão permanece assim até hoje), e depois perdeu o cinturão. Pro cara disputar cinturão depois de UMA única vitória, só se a categoria for muito rasa e o lutador em questão ter varrido a categoria, e sabemos que nenhum dos dois fatos é verdade.Absurdo!!! Dillashaw, merece está revanche, pois a luta foi parelha! e depois venceu 9 terceiro do ranking q vinha de ótima sequência de vitórias, Cody só venceu um top 15! em uma luta em que tomas não lutou entrou irreconhecível poderia perder mais não daquele jeito! tirando o Dillashaw quem merece é só o lineker! pois vem travando querias com grandes nomes!
Ufc vergonha jhon liniki na frente do cody e olha o que o ufc fazD.cruz é o maior do MMAEsse modinha ganhou esse disputa no gritoluta que vai vender muito, porem Cruz é muito chato e Cody tem chances clara de ganhar, porem vai ter que saber anular o jogo de Cruz... lineker sofreu para achar  Dodson .. imagine Cruz. se Cody manter a agressividade durante dois Rounds, no final do segundo ele ganha por nocaute.recentespopularesChance onde foi acorda cruz ta muito longe deleCruz vai amassar esse modinha esse mersinha achar q é alguma coisaSó  uma pergunta vcs já viram o Garbrandt lutar 5 rounds ......Se passar do 2  ele não ganha mais vai ficar frustrado  ...mais msm assim não vejo o Garbrandt com chances.....Sobrou TJ VS Lineker !!!!!!!!!!!! kkkkkkk Coitado do Cody.... Essa cinderela além de perder seu sapatinho, não irá achar o Cruz dentro do cage !!!!!!!! A galera reclama que jacaré é esquecido, mas Holloway e Dillashaw são prejudicados da mesma forma ! Cadê o AposentAldo para dar chance ao havaiano !!!! Que luta seria ??? Mas BobAldo não quer mais brincar !!!!!!!!!! C'omo dizia o velho Spider. nunca serão ...  Se casarem realmente TJ x Lineker, serão duas lutas insanas, mas não é nem de longe o correto a se fazer mais uma vez. Por méritos TJ deveria ter essa revanche, mas méritos e UFC são duas coisas antagônicas . Eu nunca vi um gestor que gosta tanto de ver seus colaboradores irritados quanto esse Dana Uaite.recentespopularesPor mérito, o Aldo devia ter ganhado a revanche imediata. Então, essa ideia não cola.recentespopularesHá contrapartida. Cody Garbrandt é bom lutador, mas não o quanto é Cruz, que por sinal é muito mais experiente, e isso vai ser fator primordial. Espero ver o Lineker disputando essa cinta em breve.Depois de 2 eventos principais o Lineker merecia a chance. De novo os americanos saem na frente. Poderia ser o Thominhas se não tivesse aquele atropelo do Cody.Loucura do ufc, o cara não era nem top 15,quando enfrentou o Thominhas,,qualquer top 10 merece mais do que ele,principalmente
Dilashaw,Lineker e o namorado da miesha tate.Excelente Card!Sensacional o card!TJ deveria ser o cara, mas por alguma razão Dominick não quer enfrenta-lo. Diz que não tem motivos para enfrenta-lo, mas tem motivos para uma trilogia com Faber... ta bom! Acredita quem quiser. No mais, é uma boa luta também, Cody tem mão pesada e envergadura, finalmente vou ver Dominick numa desvantagem de envergadura e tomando um supapo no rosto pra ver a forma que reage. TJ x Lineker. recentespopularesTotalmente errado! Tj deveria lutar contra o Cruz, e o Cody Garbrandt deveria lutar contra o Lineker pra ver quem deveria lutar pela cinta!! Agr Lineker tem q lutar mais uma luta contra Jimmie Rivera para disputar a cinta dps do vencedor de Dillashaw contra o Caraway!! E pra mim a luta do Thominhas deveria ser contra o Sterling n contra aquele cara q n sei o nome e n ta entre os tops! E o Raphael tem q enfrentar o Dodson!! MAIORIA N VAI LER!!recentespopularesCoerente!!!
Cody nocauteia, podem apostar!recentespopularesO quase nocaute foi por medorecentespopularesSeu idiota chamado de rei conor não entendi de nada Faz mais sentido que o Dillashaw. Por mais que o Garbrandt ainda tem um cartel pequeno, vem impressionando com seus nocautes. Dillashaw já teve sua chance e não foi acima da média contra o Rafael.recentespopularesPelo seu apelido, tu deve ter 4 cm.... kkkkkkkkkkkk. recentespopularesSó a cabecinha. kkkkkkkkkkkkDeixaram o Lineker de escanteio!!!Me diga, o Cody é bom e tals, mas venceu dos ''grandes'' Thominhas Almeida e Takeya e tem ts, é quase o mesmo que fizeram com Cejudo, o cara tá cruzinho, vai ser um repeteco do que Cruz fez com Faber. Até Lineker merece mais que esse cara.recentespopularesAs pessoas falam muito da revanche do Aldo, mas o TJ era um dos caras que merecia pelo que foi a luta uma revanche imediata...recentespopularesTJ, Linker e Jimmie Rivera tem motivos para um TS, mas Cody, não.Faber com 3 vitórias disputou a cinta. Wodley vinha de 1 derrota e 1 vitória e disputou a cinta. Conor vem de 1 derrota e 1 vitória e vai disputar a cinta. Alvarez com 1 derrota e 2 vitórias disputou a cinta. Gustafson veio de 1 derrota e disputou a cinta. Miocic ganhou 2 vezes e foi disputar a cinta. Aí eu pergunto: será que isso não está errado não? Jacaré tem 27 vitórias seguidas. Demian tem 52 vitórias. Lineker vem de 65 vitórias. Desrespeito da cebola, rapaz!recentespopularesCacá, ele não venceu nenhum atleta de ponta ainda para merecer o TS, teria que ter um pouco mais de rodagem, vencer um top 5 e tal.recentespopularesContra o Cody, não existe queixo duro.Certo seria Cruz X Tj, e cody X Lineker, e o vencedor de cody X Lineker disputar o cinturão Acho o Garbrant ainda sem currículo para enfrentar o Cruz, o mais correto seria mesmo o TJ. Mais um indício que o Cruz está evitando o TJ.recentespopularesConcordo que TJ mereça mais, pela derrota apertada, mas Cody precisa fazer no máximo mais uma luta, com.um top 3, pq o cara vem aniquilando todo mundo.recentespopularesSim sim, Cody teria que enfrentar Assunção ou o próprio Lineker.O Cody merece a chance, agora precisam casar a luta entre dillashaw vs Lineker pra saber quem será o proximo desafiante.recentespopularesDisse tudo, vandersonQue sacanagem com o Tidiei Dilachó. Esse Cody realmente é bom, mostrou isso contra o pequeno Thomas, mas o Cruz ganhou numa decisão apertadíssima dele. Merecia a revanche, mais um injustiçado.recentespopularessó venceu o barão 2 vezes e o Rafael Assunção É POUCO!!! te de brincadeira!recentespopularesFalando dessa forma, parece até que ele defendeu o cinturão 3 vezes só contra Barão e Raphael Assunção. Ele venceu o Barão com méritos e conquistou o cinturão, depois venceu o mesmo Barão totalmente sem confiança (aliás, Barão permanece assim até hoje), e depois perdeu o cinturão. Pro cara disputar cinturão depois de UMA única vitória, só se a categoria for muito rasa e o lutador em questão ter varrido a categoria, e sabemos que nenhum dos dois fatos é verdade.Absurdo!!! Dillashaw, merece está revanche, pois a luta foi parelha! e depois venceu 9 terceiro do ranking q vinha de ótima sequência de vitórias, Cody só venceu um top 15! em uma luta em que tomas não lutou entrou irreconhecível poderia perder mais não daquele jeito! tirando o Dillashaw quem merece é só o lineker! pois vem travando querias com grandes nomes!
Ufc vergonha jhon liniki na frente do cody e olha o que o ufc fazD.cruz é o maior do MMAEsse modinha ganhou esse disputa no gritoluta que vai vender muito, porem Cruz é muito chato e Cody tem chances clara de ganhar, porem vai ter que saber anular o jogo de Cruz... lineker sofreu para achar  Dodson .. imagine Cruz. se Cody manter a agressividade durante dois Rounds, no final do segundo ele ganha por nocaute.recentespopularesChance onde foi acorda cruz ta muito longe deleCruz vai amassar esse modinha esse mersinha achar q é alguma coisaSó  uma pergunta vcs já viram o Garbrandt lutar 5 rounds ......Se passar do 2  ele não ganha mais vai ficar frustrado  ...mais msm assim não vejo o Garbrandt com chances.....Sobrou TJ VS Lineker !!!!!!!!!!!! kkkkkkk Coitado do Cody.... Essa cinderela além de perder seu sapatinho, não irá achar o Cruz dentro do cage !!!!!!!! A galera reclama que jacaré é esquecido, mas Holloway e Dillashaw são prejudicados da mesma forma ! Cadê o AposentAldo para dar chance ao havaiano !!!! Que luta seria ??? Mas BobAldo não quer mais brincar !!!!!!!!!! C'omo dizia o velho Spider. nunca serão ...  Se casarem realmente TJ x Lineker, serão duas lutas insanas, mas não é nem de longe o correto a se fazer mais uma vez. Por méritos TJ deveria ter essa revanche, mas méritos e UFC são duas coisas antagônicas . Eu nunca vi um gestor que gosta tanto de ver seus colaboradores irritados quanto esse Dana Uaite.recentespopularesPor mérito, o Aldo devia ter ganhado a revanche imediata. Então, essa ideia não cola.recentespopularesHá contrapartida. Cody Garbrandt é bom lutador, mas não o quanto é Cruz, que por sinal é muito mais experiente, e isso vai ser fator primordial. Espero ver o Lineker disputando essa cinta em breve.Depois de 2 eventos principais o Lineker merecia a chance. De novo os americanos saem na frente. Poderia ser o Thominhas se não tivesse aquele atropelo do Cody.Loucura do ufc, o cara não era nem top 15,quando enfrentou o Thominhas,,qualquer top 10 merece mais do que ele,principalmente
Dilashaw,Lineker e o namorado da miesha tate.Excelente Card!Sensacional o card!TJ deveria ser o cara, mas por alguma razão Dominick não quer enfrenta-lo. Diz que não tem motivos para enfrenta-lo, mas tem motivos para uma trilogia com Faber... ta bom! Acredita quem quiser. No mais, é uma boa luta também, Cody tem mão pesada e envergadura, finalmente vou ver Dominick numa desvantagem de envergadura e tomando um supapo no rosto pra ver a forma que reage. TJ x Lineker. 23Out10:0007:3004:4102:1222Out23:1022:3620:0019:1216:1816:0223Out10:0022Out16:0215:0212:0010:0008:0001:0021Out21:4215:2514:0623Out10:0022Out16:0215:3515:0212:0010:0009:0008:0001:0021Out21:4228Set08:0024Ago10:4622Ago10:0020Ago22:5212:0011:0016Ago18:1714Ago09:0008Jul16:3004Jul19:1611Out01:0027Set08:0714Set10:0024Ago10:4622Ago10:0020Ago11:0016Ago18:1714Ago09:0005Ago",263.0
38,2016-10-21,https://web.archive.org/web/20161021002538/http://globoesporte.globo.com/futebol/liga-europa/noticia/2016/10/brasileiros-deitam-e-rolam-e-shakhtar-atropela-o-gent-pela-liga-europa.html,http://globoesporte.globo.com/futebol/liga-europa/noticia/2016/10/brasileiros-deitam-e-rolam-e-shakhtar-atropela-o-gent-pela-liga-europa.html,"Grupo H: brasileiros deitam e rolam, e Shakhtar Donetsk atropela o Gent ","O Shakhtar Donetsk deitou e rolou sobre o Gent nesta
quinta-feira, em jogo válido pelo Grupo H da Liga Europa, e atropelou por 5 a
0. Mas vamos acertar a informação. Os brasileiros do clube ucraniano é que deitaram
e rolaram no time belga. Gols, assistências e jogadas de efeito. O repertório de lances importantes e decisivos foi completo. Bernard e Taison
marcaram, e Marlos e Dentinho deram assistências na partida que foi disputada
na cidade de Lviv.Com o resultado em casa, o Shakhtar Donetsk soma nove pontos
no Grupo H e fica perto da classificação à próxima fase da competição. O time
belga, com quatro pontos, ocupa a segunda posição na chance, seguido de Braga
(2) e Konyaspor (1).+ Clique aqui e confira a tabela completa da Liga EuropaO baile do Shakhtar Donetsk começou cedo, e com ajuda do
goleiro Rinne, do Gent. Aos 12 minutos ele saiu da área para jogar com os pés,
mas entregou a bola para Kovalenko, que dominou e fez um belo gol por cobertura.
Ainda no primeiro tempo Marlos fez uma jogada sensacional, avançou pelo meio de campo em direção ao ataque e tocou para Facundo Ferreyra bater e ampliar o placar.+ Pato comanda reação do Villarreal, que arranca empate com o Osmanlispor na Turquia + Mariano entra na seleção da rodada do fantasy game da ChampionsNa etapa final, mais show dos brasileiros. Em uma jogada
pela direita, Dentinho foi ao fundo e cruzou para Bernard estufar a rede. Em um
lance muito parecido, Taison marcou após assistência de Facundo Ferreyra. E
ainda teve tempo para o quinto. Marlos, mais uma vez, desequilibrou ao
encontrar Malyshev livre na área. O meia ucraniano só teve o trabalho de
empurrar para a rede.Dentinho, que deu uma assistência na partida, deixou claro
que a vitória foi fundamental para deixar o Shakhtar muito perto da próxima
fase da Liga Europa.- Foi um grande jogo da nossa equipe. Desde o primeiro
minuto, mostramos a nossa força, criamos chances de gol e conquistamos uma
importante vitória. Com esse resultado, o Shakhtar ficou em uma boa posição
para avançar à próxima fase, mas sabemos que não podemos nos descuidar. Toda
equipe que disputa a Liga Europa tem qualidade, mas mostramos que temos chances
de vencer esta competição - disse.Outro destaque do Shakhtar, o meia Marlos deixou claro que a
equipe está preparada para disputar o título da Liga Europa e superar a
campanha da temporada passada, quando caiu na semifinal para o Sevilla:- Nosso time foi muito bem. Enfrentamos uma equipe perigosa,
acostumada a disputar as competições europeias, e conseguimos impor o nosso
ritmo de jogo desde o começo da partida. Essa goleada demonstra que temos
condições de repetir a campanha do ano passado e, quem sabe, disputar o título.",esportes,,"Grupo H: brasileiros deitam e rolam, e Shakhtar Donetsk atropela o Gent ","Bernard e Taison marcam, e Dentinho e Marlos brilham com assistências em Lviv","Lviv, Ucrânia","O Shakhtar Donetsk deitou e rolou sobre o Gent nesta
quinta-feira, em jogo válido pelo Grupo H da Liga Europa, e atropelou por 5 a
0. Mas vamos acertar a informação. Os brasileiros do clube ucraniano é que deitaram
e rolaram no time belga. Gols, assistências e jogadas de efeito. O repertório de lances importantes e decisivos foi completo. Bernard e Taison
marcaram, e Marlos e Dentinho deram assistências na partida que foi disputada
na cidade de Lviv.Com o resultado em casa, o Shakhtar Donetsk soma nove pontos
no Grupo H e fica perto da classificação à próxima fase da competição. O time
belga, com quatro pontos, ocupa a segunda posição na chance, seguido de Braga
(2) e Konyaspor (1).+ Clique aqui e confira a tabela completa da Liga EuropaO baile do Shakhtar Donetsk começou cedo, e com ajuda do
goleiro Rinne, do Gent. Aos 12 minutos ele saiu da área para jogar com os pés,
mas entregou a bola para Kovalenko, que dominou e fez um belo gol por cobertura.
Ainda no primeiro tempo Marlos fez uma jogada sensacional, avançou pelo meio de campo em direção ao ataque e tocou para Facundo Ferreyra bater e ampliar o placar.+ Pato comanda reação do Villarreal, que arranca empate com o Osmanlispor na Turquia + Mariano entra na seleção da rodada do fantasy game da ChampionsNa etapa final, mais show dos brasileiros. Em uma jogada
pela direita, Dentinho foi ao fundo e cruzou para Bernard estufar a rede. Em um
lance muito parecido, Taison marcou após assistência de Facundo Ferreyra. E
ainda teve tempo para o quinto. Marlos, mais uma vez, desequilibrou ao
encontrar Malyshev livre na área. O meia ucraniano só teve o trabalho de
empurrar para a rede.Dentinho, que deu uma assistência na partida, deixou claro
que a vitória foi fundamental para deixar o Shakhtar muito perto da próxima
fase da Liga Europa.- Foi um grande jogo da nossa equipe. Desde o primeiro
minuto, mostramos a nossa força, criamos chances de gol e conquistamos uma
importante vitória. Com esse resultado, o Shakhtar ficou em uma boa posição
para avançar à próxima fase, mas sabemos que não podemos nos descuidar. Toda
equipe que disputa a Liga Europa tem qualidade, mas mostramos que temos chances
de vencer esta competição - disse.Outro destaque do Shakhtar, o meia Marlos deixou claro que a
equipe está preparada para disputar o título da Liga Europa e superar a
campanha da temporada passada, quando caiu na semifinal para o Sevilla:- Nosso time foi muito bem. Enfrentamos uma equipe perigosa,
acostumada a disputar as competições europeias, e conseguimos impor o nosso
ritmo de jogo desde o começo da partida. Essa goleada demonstra que temos
condições de repetir a campanha do ano passado e, quem sabe, disputar o título.
    Os comentários são de responsabilidade exclusiva de seus autores e não representam a opinião deste site. Se achar algo que viole os
    termos de uso, denuncie. Leia as perguntas mais frequentes para saber o que é impróprio ou ilegal.
recentespopularesrecentespopulares27Mai11:0902Mar13:0201Mar16:5914Dez09:1929Set18:1729Set16:0506:0021Set12:0019Set10:0018Set17:2316Set13:4409Set21:0425Ago19:2021Ago13:5312Ago16:4129Jul15:2526Jul18:3422Jul14:5230Out17:1609Set21:0421Ago13:5315Jul16:4721Jun15:0510Abr17:1822Jan13:3021Jan13:5620Jan11:3307Dez09:2729Nov06:0021Out12:1829Set06:0016Set13:4421Ago13:5312Ago16:4128Jul14:5020Mai16:0407Mai11:2429Abr18:2128Abr06:0029Set16:0521Set14:1712:0018Set17:2331Ago11:0030Ago11:0529Ago21:5222Ago17:25",155.0
