,data,url_noticia,url_noticia_curto,titulo,conteudo_noticia,assunto,assunto_ex,titulo_ex,subtitulo_ex,local_ex,artigo_ex,n_paragrafos
23,2019-03-05,https://web.archive.org/web/20190305214524/https://sportv.globo.com/site/combate/noticia/roy-jones-jr-aceita-desafio-de-vitor-belfort-por-luta-no-one-basta-dizer-onde-e-quando-irmao.ghtml,https://sportv.globo.com/site/combate/noticia/roy-jones-jr-aceita-desafio-de-vitor-belfort-por-luta-no-one-basta-dizer-onde-e-quando-irmao.ghtml,"Roy Jones Jr. aceita desafio de Vitor Belfort por luta no ONE: ""Basta dizer onde e quando"""," O primeiro desafio feito por Vitor Belfort como lutador do ONE Championship surtiu efeito, e é uma ""rasteira"" em Anderson Silva. O atleta carioca declarou na semana passada, durante coletiva de imprensa de apresentação de sua contratação pela organização asiática, que gostaria de fazer um duelo com regras mistas contra o boxeador Roy Jones Jr, multicampeão mundial e recentemente aposentado. Jones é um velho ""sonho de consumo"" do ""Spider"" para uma superluta, mas o confronto jamais aconteceu.  Pois Jones aceitou o convite de Vitor Belfort. Apesar de ter declarado em dezembro passado que não lutaria mais, o pugilista de 50 anos de idade publicou um vídeo, compartilhado também nas mídias sociais do ONE e de Belfort, em que se mostra disponível para enfrentar o ""Fenômeno"".  - Vitor Belfort, você já sabe, irmão. Apenas me ligue, me diga qual vai ser, basta dizer onde e quando, e em qual peso! Eu topo! - declarou Jones Jr.  Jones também deu entrevista ao site ""TMZ Sports"" sobre o desafio, e estipulou que precisaria apenas de seis semanas para se preparar para a luta.  - Eu gostaria de oito semanas para me ajeitar, porque eu preciso de duas semanas extras só para ter certeza que posso fazer graça. Mas com seis semanas, posso te dar uma surra! Oito semanas é para o extra, tenho muitas coisas extras que faço, mas em seis semanas eu luto, oito semanas dou o show inteiro, ouviu? Me diga o que você quer, mas se quiser só lutar, é fácil de produzir em seis semanas - provocou.  Roy Jones Jr. foi medalhista de prata olímpico em 1988 como pugilista amador, e foi campeão mundial em quatro categorias diferentes de peso. Conhecido por seu estilo elusivo, com muitas esquivas e contragolpes, Jones Jr. é um dos grandes ídolos de Anderson Silva, que pediu por anos ao UFC para fazer uma superluta contra ele. A organização, porém, sempre negou o pedido.  Vitor Belfort, 41, anunciou na semana passada seu retorno ao MMA e a assinatura de contrato com o ONE Championship, maior organização do esporte na Ásia na atualidade. Na ocasião, Belfort listou lutas contra Anderson Silva e Wanderlei Silva na sua lista de desejos, e incluiu também um confronto de boxe com Roy Jones Jr, mas com regras adaptadas para permitirem o ""dirty boxing"" (técnica usada no MMA com socos dentro do clinche). Diferentemente do UFC, o ONE também realiza lutas de boxe e de outras disciplinas de artes marciais disputadas em pé, em sua divisão ""Super Series"".  Resta agora a organização negociar os termos do combate e oficializar sua realização.  Assine o Combate Play e assista ao Combate em qualquer lugar ",esportes,         é o seu time do coração?   Sim Não  ,,"Pugilista aposentado ainda provoca em entrevista e diz que precisa de oito semanas para ""fazer graça"", mas ""em seis semanas te dou uma surra""",," Obrigado pela participação.  Nós usaremos esta informação para trazer mais novidades para você.  Por Combate.com — Las Vegas   05/03/2019 16h29    Atualizado  05/03/2019     Vitor Belfort (esq.) pode ter o pugilista Roy Jones Jr. à sua frente no ringue em breve — Foto: Info Esporte  O primeiro desafio feito por Vitor Belfort como lutador do ONE Championship surtiu efeito, e é uma ""rasteira"" em Anderson Silva. O atleta carioca declarou na semana passada, durante coletiva de imprensa de apresentação de sua contratação pela organização asiática, que gostaria de fazer um duelo com regras mistas contra o boxeador Roy Jones Jr, multicampeão mundial e recentemente aposentado. Jones é um velho ""sonho de consumo"" do ""Spider"" para uma superluta, mas o confronto jamais aconteceu.  Pois Jones aceitou o convite de Vitor Belfort. Apesar de ter declarado em dezembro passado que não lutaria mais, o pugilista de 50 anos de idade publicou um vídeo, compartilhado também nas mídias sociais do ONE e de Belfort, em que se mostra disponível para enfrentar o ""Fenômeno"".  - Vitor Belfort, você já sabe, irmão. Apenas me ligue, me diga qual vai ser, basta dizer onde e quando, e em qual peso! Eu topo! - declarou Jones Jr.  Jones também deu entrevista ao site ""TMZ Sports"" sobre o desafio, e estipulou que precisaria apenas de seis semanas para se preparar para a luta.  - Eu gostaria de oito semanas para me ajeitar, porque eu preciso de duas semanas extras só para ter certeza que posso fazer graça. Mas com seis semanas, posso te dar uma surra! Oito semanas é para o extra, tenho muitas coisas extras que faço, mas em seis semanas eu luto, oito semanas dou o show inteiro, ouviu? Me diga o que você quer, mas se quiser só lutar, é fácil de produzir em seis semanas - provocou.  Roy Jones Jr. foi medalhista de prata olímpico em 1988 como pugilista amador, e foi campeão mundial em quatro categorias diferentes de peso. Conhecido por seu estilo elusivo, com muitas esquivas e contragolpes, Jones Jr. é um dos grandes ídolos de Anderson Silva, que pediu por anos ao UFC para fazer uma superluta contra ele. A organização, porém, sempre negou o pedido.  Vitor Belfort, 41, anunciou na semana passada seu retorno ao MMA e a assinatura de contrato com o ONE Championship, maior organização do esporte na Ásia na atualidade. Na ocasião, Belfort listou lutas contra Anderson Silva e Wanderlei Silva na sua lista de desejos, e incluiu também um confronto de boxe com Roy Jones Jr, mas com regras adaptadas para permitirem o ""dirty boxing"" (técnica usada no MMA com socos dentro do clinche). Diferentemente do UFC, o ONE também realiza lutas de boxe e de outras disciplinas de artes marciais disputadas em pé, em sua divisão ""Super Series"".  Resta agora a organização negociar os termos do combate e oficializar sua realização.  Assine o Combate Play e assista ao Combate em qualquer lugar — Foto: Combate  Assine o Combate Play e assista ao Combate em qualquer lugar 
Combate.com: veja as últimas notícias do MMA

Veja a programação completa do UFC em 2022

Assine o Combate Play e tenha acesso a todos eventos ao vivo e um acervo especial (exclusivo para assinantes)
Veja também",18.0
24,2019-03-06,https://web.archive.org/web/20190306020812/https://globoesporte.globo.com/futebol/times/flamengo/noticia/atuacoes-diego-alves-fecha-o-gol-e-bruno-henrique-esbanja-folego-em-vitoria-do-flamengo-na-bolivia.ghtml,https://globoesporte.globo.com/futebol/times/flamengo/noticia/atuacoes-diego-alves-fecha-o-gol-e-bruno-henrique-esbanja-folego-em-vitoria-do-flamengo-na-bolivia.ghtml,"Atuações: Diego Alves fecha o gol, e Bruno Henrique esbanja fôlego em vitória do Flamengo na Bolívia"," Eleito o melhor em campo pela Conmebol e decisivo para a vitória. Superou as dificuldades impostas pela velocidade da bola na altitude e parou o ataque do San Jose em chutes de longa distância ou finalizações dentro da área. Os bolivianos concluíram 14 vezes na direção correta, mas o goleiro do Flamengo esteve em dia inspirado.  Outro que teve uma atuação impecável. Decisivo com a bela assistência para o gol de Gabriel, foi de longe a melhor opção ofensiva do Flamengo durante todo tempo em que esteve em campo. Melhorou com a entrada de Everton Ribeiro no segundo tempo, se movimentou muito e ainda teve fôlego para ajudar na marcação. Nem aí para a altitude!  Atuação discreta, assim como Arrascaeta. Até parecia que teria uma boa exibição ao finalizar com perigo de fora da área logo no começo, mas caiu de produção após receber cartão amarelo com 11 minutos. Nem conseguiu ser efetivo na marcação, nem conseguiu ser perigoso no ataque. Foi substituído por Ronaldo.  Pará - 5.5Rodrigo Caio - 7.5Léo Duarte - 7Renê - 5Cuellar - 5Willian Arão - 5.5Vitinho - 5Ronaldo - 5De Arrascaeta - 4.5Gabriel - 7 ",esportes,         é o seu time do coração?   Sim Não  ,,"Dupla é decisiva no 1 a 0 sobre o San Jose nos 3.750m de Oruro. Rodrigo Caio também tem exibição impecável, enquanto Diego e Arrascaeta são discretos",," Obrigado pela participação.  Nós usaremos esta informação para trazer mais novidades para você.  Por GloboEsporte.com — Oruro, Bolívia   05/03/2019 22h06    Atualizado  05/03/2019    Diego Alves - 8 Eleito o melhor em campo pela Conmebol e decisivo para a vitória. Superou as dificuldades impostas pela velocidade da bola na altitude e parou o ataque do San Jose em chutes de longa distância ou finalizações dentro da área. Os bolivianos concluíram 14 vezes na direção correta, mas o goleiro do Flamengo esteve em dia inspirado.  Diego Alves comemora vitória sobre o San José com Ronaldo e Léo Duarte — Foto: David Mercado/Reuters Bruno Henrique - 8 Outro que teve uma atuação impecável. Decisivo com a bela assistência para o gol de Gabriel, foi de longe a melhor opção ofensiva do Flamengo durante todo tempo em que esteve em campo. Melhorou com a entrada de Everton Ribeiro no segundo tempo, se movimentou muito e ainda teve fôlego para ajudar na marcação. Nem aí para a altitude!  gol gabigol bruno henrique flamengo oruro — Foto: Alexandre Vidal / Flamengo Diego - 4.5 Atuação discreta, assim como Arrascaeta. Até parecia que teria uma boa exibição ao finalizar com perigo de fora da área logo no começo, mas caiu de produção após receber cartão amarelo com 11 minutos. Nem conseguiu ser efetivo na marcação, nem conseguiu ser perigoso no ataque. Foi substituído por Ronaldo.  Diego em campo contra o San José — Foto: Alexandre Vidal/Flamengo  Pará - 5.5Rodrigo Caio - 7.5Léo Duarte - 7Renê - 5Cuellar - 5Willian Arão - 5.5Vitinho - 5Ronaldo - 5De Arrascaeta - 4.5Gabriel - 7  Flamengo vence San José-BOL na estreia da Libertadores Veja tambémAtacante Werton responde declaração dada pelo lateral Matheus Julião no Carioca da categoriaGoleiro pega pênalti em disputa com o Palmeiras após empate por 0 a 0 no tempo normalGoleiro Dyogo Alves se tornou titular há menos de um mês, mas defendeu uma cobrança de pênalti no título do Flamengo na catergoriaLateral foi ao Marrocos, mas ficou fora da lista de inscritos; uma semana antes de chegar à África, atleta havia recebido proposta do BarcelonaVice-artilheiro da competição na categoria sub-20, com sete gols, o atacante de 19 anos marcou o do título conquistado em 2021, no sub-17",24.0
25,2019-03-06,https://web.archive.org/web/20190306020812/https://globoesporte.globo.com/futebol/futebol-internacional/liga-dos-campeoes/noticia/vinicius-junior-diz-que-tornozelo-esta-doendo-demais-mas-indica-que-lesao-nao-e-grave.ghtml,https://globoesporte.globo.com/futebol/futebol-internacional/liga-dos-campeoes/noticia/vinicius-junior-diz-que-tornozelo-esta-doendo-demais-mas-indica-que-lesao-nao-e-grave.ghtml,"Vinicius Junior diz que tornozelo está ""doendo muito"", mas indica que lesão não é grave"," A eliminação da Liga dos Campeões diante do Ajax nesta terça-feira trouxe ainda outra notícia para lá de ruim para a torcida do Real Madrid. Xodó dos fãs desde o começo de 2019, Vinicius Junior sofreu uma lesão no tornozelo direito e deixou o campo ainda no primeiro tempo, chorando bastante. Após a partida, o brasileiro se mostrou mais tranquilo, dizendo ter sido acalmado pelo departamento médico do clube, e afirmou que o local está doendo bastante.  - A lesão foi no lance que ganhei a corrida. Tentei sair da falta e não consegui. Está doendo muito. Mas os doutores me acalmaram - disse o atacante do Real Madrid, citando a arrancada aos 30 do primeiro tempo na qual quase chegou ao gol, em entrevista ao Esporte Interativo.  Vinicius Junior machuca o tornozelo contra o Ajax e deixa o campo chorando bastante  Convocado na semana passada por Tite para os amistosos no fim do mês contra Panamá e República Tcheca, o brasileiro disse ainda que passará por exames para saber a gravidade do problema.  A derrota para o Ajax não só dá fim ao sonho do tetracampeonato europeu, mas também praticamente põe um ponto final a temporada do Real Madrid. Em uma semana, com três derrotas em casa, o time merengue caiu diante do Barça na Copa do Rei, viu o rival abrir 12 pontos no Campeonato Espanhol e foi eliminado na Liga dos Campeões. O clima é de fim de festa para os merengues, com Solari na berlinda.  - Todo mundo muito triste. É muito triste um time acostumado a ganhar sair nas oitavas da Champions, mas serve de aprendizado. É algo que nunca queremos. Na hora de dormir, temos que pensar e repensar no que temos a melhorar - completou.  Questionado sobre a ausência de gols, o atacante minimizou e destacou o fato de ter virado titular do Real Madrid em sua primeira temporada no clube, aos 18 anos.  - Venho trabalhando muito e fazendo tudo que o pessoal do clube me diz de melhor para fazer. Tenho só 18 anos e já sou titular do Real Madrid. Sei que tenho que trabalhar para evoluir. Quando o gol sair, vai ser mais fácil. ",esportes,,,"Convocado por Tite para os amistosos deste mês da Seleção, atacante fala que foi acalmado pelos médicos do Real Madrid e diz que passará por exames para saber gravidade da lesão",," A eliminação da Liga dos Campeões diante do Ajax nesta terça-feira trouxe ainda outra notícia para lá de ruim para a torcida do Real Madrid. Xodó dos fãs desde o começo de 2019, Vinicius Junior sofreu uma lesão no tornozelo direito e deixou o campo ainda no primeiro tempo, chorando bastante. Após a partida, o brasileiro se mostrou mais tranquilo, dizendo ter sido acalmado pelo departamento médico do clube, e afirmou que o local está doendo bastante.  - A lesão foi no lance que ganhei a corrida. Tentei sair da falta e não consegui. Está doendo muito. Mas os doutores me acalmaram - disse o atacante do Real Madrid, citando a arrancada aos 30 do primeiro tempo na qual quase chegou ao gol, em entrevista ao Esporte Interativo.  Vinicius Junior machuca o tornozelo contra o Ajax e deixa o campo chorando bastante  Convocado na semana passada por Tite para os amistosos no fim do mês contra Panamá e República Tcheca, o brasileiro disse ainda que passará por exames para saber a gravidade do problema. ""Vou dormir e ver como acordo amanhã. Mesmo se não tiver nada, faremos exames para ver se foi algo muito grave ou não"".  Vinicius Junior sentiu após arranca em que quase fez o gol aos 30 minutos de jogo — Foto: EFE/Rodrigo Jiménez  A derrota para o Ajax não só dá fim ao sonho do tetracampeonato europeu, mas também praticamente põe um ponto final a temporada do Real Madrid. Em uma semana, com três derrotas em casa, o time merengue caiu diante do Barça na Copa do Rei, viu o rival abrir 12 pontos no Campeonato Espanhol e foi eliminado na Liga dos Campeões. O clima é de fim de festa para os merengues, com Solari na berlinda. ",7.0
26,2019-03-07,https://web.archive.org/web/20190307190031/https://sportv.globo.com/site/programas/selecao-sportv/noticia/rizek-critica-desempenho-de-luan-do-gremio-qual-foi-o-planeta-que-abduziu-o-rei-da-america.ghtml,https://sportv.globo.com/site/programas/selecao-sportv/noticia/rizek-critica-desempenho-de-luan-do-gremio-qual-foi-o-planeta-que-abduziu-o-rei-da-america.ghtml,"Rizek critica desempenho de Luan, do Grêmio: ""Qual foi o planeta que abduziu o Rei da América?"""," O Grêmio estreou na Copa Libertadores empatando por 1 a 1 com Rosário Central, na Argentina. No Seleção SporTV desta quinta-feira, o apresentador André Rizek comentou o baixo rendimento do atacante Luan.  – Eu quero saber, qual foi o planeta que abduziu o Rei da América? Esse Luan que está jogando não é o Luan que foi o melhor jogador da América, não é o Luan que ganhou medalha de ouro com uma ótima participação no time olímpico – afirmou Rizek.  O apresentador ainda acrescentou sobre o comportamento do atacante.  – O Luan que erra um passe desse e mantém a cabeça baixa. O Luan aceita perder a bola tão facilmente, como a bola que ele perdeu ontem, não é o Luan que a gente viu surgiu e arrebentar no Grêmio – reforçou o apresentador.  Luan foi eleito o melhor jogador da América do Sul em 2017 em votação do jornal uruguaio El País, ano em que o Grêmio conquistou o título da Libertadores. O jogador, porém, caiu de rendimento na temporada passada por causa de problemas físicos e quase chegou a ser negociado com o Cruzeiro na última janela de transferências.   + Veja mais vídeos do Seleção SporTV ",esportes,,,Grêmio empata por 1 a 1 fora de casa na estreia na Copa Libertadores,," Comentaristas enxergam má atuação do Luan, na estreia do Grêmio na Libertadores: ""Apagado""  O Grêmio estreou na Copa Libertadores empatando por 1 a 1 com Rosário Central, na Argentina. No Seleção SporTV desta quinta-feira, o apresentador André Rizek comentou o baixo rendimento do atacante Luan.  – Eu quero saber, qual foi o planeta que abduziu o Rei da América? Esse Luan que está jogando não é o Luan que foi o melhor jogador da América, não é o Luan que ganhou medalha de ouro com uma ótima participação no time olímpico – afirmou Rizek.  Luan, Rosário x Grêmio, Libertadores — Foto: Eduardo Moura/GloboEsporte.com  O apresentador ainda acrescentou sobre o comportamento do atacante.  – O Luan que erra um passe desse e mantém a cabeça baixa. O Luan aceita perder a bola tão facilmente, como a bola que ele perdeu ontem, não é o Luan que a gente viu surgiu e arrebentar no Grêmio – reforçou o apresentador.  Luan foi eleito o melhor jogador da América do Sul em 2017 em votação do jornal uruguaio El País, ano em que o Grêmio conquistou o título da Libertadores. O jogador, porém, caiu de rendimento na temporada passada por causa de problemas físicos e quase chegou a ser negociado com o Cruzeiro na última janela de transferências.  Seleção SporTV desta quinta-feira — Foto: Reprodução ",8.0
27,2019-03-07,https://web.archive.org/web/20190307190031/https://globoesporte.globo.com/futebol/times/palmeiras/noticia/com-tempo-curto-e-libertadores-na-terca-feira-palmeiras-pode-ter-escalacao-inedita-em-mirassol.ghtml,https://globoesporte.globo.com/futebol/times/palmeiras/noticia/com-tempo-curto-e-libertadores-na-terca-feira-palmeiras-pode-ter-escalacao-inedita-em-mirassol.ghtml,"Com tempo curto e Libertadores na terça-feira, Palmeiras pode ter escalação inédita em Mirassol"," Devido ao pouco tempo de recuperação física, aliado ao compromisso de terça-feira contra o Melgar (Peru), pela segunda rodada da Libertadores, a escalação do Palmeiras diante do Mirassol, no sábado, deverá ser inédita.  O atacante Dudu, único a começar jogando todas as dez partidas da temporada até aqui, dificilmente será titular no duelo válido pelo Campeonato Paulista.  Na metade do segundo tempo da vitória por 2 a 0 sobre o Junior Barranquilla, na última quarta-feira, o camisa 7 dobrou os joelhos, pediu água e então foi substituído pelo meia Hyoran, que passou a atuar pela ponta esquerda.  – Realmente é um momento cansativo. Não vamos dormir bem essa noite. É importante descansar, dormir, infelizmente vamos estar voltando para casa. Acredito que o Felipão e toda a comissão estão pensando nisso – comentou o goleiro Weverton, ainda em Barranquilla.  – Temos um elenco forte, vamos ver quem ele vai querer usar no sábado, porque temos um jogo importante na terça-feira. Se a gente não fizer nosso dever de casa na terça-feira, talvez essa vitória tenha um gosto diferente depois.  + Leia mais notícias do Palmeiras  Além de jogadores pouco utilizados até o momento em 2019, é provável que garotos das divisões de base, inscritos na lista B do Campeonato Paulista, sejam relacionados ao menos para ficar no banco de reservas em Mirassol. ",esportes,         é o seu time do coração?   Sim Não  ,,Jogadores que atuaram em Barranquilla devem ser poupados no sábado,," Obrigado pela participação.  Nós usaremos esta informação para trazer mais novidades para você.  Por Tossiro Neto — Barranquilla, Colômbia   07/03/2019 11h00    Atualizado  07/03/2019     Devido ao pouco tempo de recuperação física, aliado ao compromisso de terça-feira contra o Melgar (Peru), pela segunda rodada da Libertadores, a escalação do Palmeiras diante do Mirassol, no sábado, deverá ser inédita.  O atacante Dudu, único a começar jogando todas as dez partidas da temporada até aqui, dificilmente será titular no duelo válido pelo Campeonato Paulista.  Na metade do segundo tempo da vitória por 2 a 0 sobre o Junior Barranquilla, na última quarta-feira, o camisa 7 dobrou os joelhos, pediu água e então foi substituído pelo meia Hyoran, que passou a atuar pela ponta esquerda.  Bruno Henrique e Dudu são os únicos a terem atuado nos dez jogos da temporada — Foto: Cesar Greco/Ag. Palmeiras A única atividade em preparação para a partida de sábado será na sexta-feira, um dia depois de todo o elenco ter passado horas em viagem de volta ao Brasil. – Realmente é um momento cansativo. Não vamos dormir bem essa noite. É importante descansar, dormir, infelizmente vamos estar voltando para casa. Acredito que o Felipão e toda a comissão estão pensando nisso – comentou o goleiro Weverton, ainda em Barranquilla.  – Temos um elenco forte, vamos ver quem ele vai querer usar no sábado, porque temos um jogo importante na terça-feira. Se a gente não fizer nosso dever de casa na terça-feira, talvez essa vitória tenha um gosto diferente depois.  + Leia mais notícias do Palmeiras  Além de jogadores pouco utilizados até o momento em 2019, é provável que garotos das divisões de base, inscritos na lista B do Campeonato Paulista, sejam relacionados ao menos para ficar no banco de reservas em Mirassol. Veja também",13.0
