,data,url_noticia,url_noticia_curto,titulo,conteudo_noticia,assunto,assunto_ex,titulo_ex,subtitulo_ex,local_ex,artigo_ex,n_paragrafos
0,2016-10-11,https://web.archive.org/web/20161011060034/http://sportv.globo.com/site/combate/noticia/2016/10/curtinhas-cruz-diz-que-e-capaz-de-vencer-mcgregor-nos-penas-ou-leves.html,http://sportv.globo.com/site/combate/noticia/2016/10/curtinhas-cruz-diz-que-e-capaz-de-vencer-mcgregor-nos-penas-ou-leves.html,Curtinhas: Cruz diz que é capaz de vencer McGregor nos penas ou leves,"Enfrentar Conor McGregor é o desejo de boa parte dos lutadores do Ultimate. Não só por ele ser o campeão do peso-pena (até 66kg), mas também pelo retorno financeiro que um duelo contra o irlandês é capaz de trazer. Questionado sobre a possibilidade de enfrentar o Notório, Dominick Cruz não só deixou claro de que aceitaria, como garantiu que é capaz de batê-lo na categoria que McGregor preferir. Seja nos penas ou no peso-leve (até 70kg), divisão na qual Conor vai lutar pelo título contra Eddie Alvarez, dia 12 de novembro, no evento principal do UFC 205, em Nova York (EUA).- McGregor está escolhendo suas lutas, então isso não cabe a mim. Isso não cabe ao UFC, isso cabe ao McGregor. Conheço este esporte tanto quanto McGregor e parece que o único caminho para você vencer McGregor está na sua mente. Sei que posso fazer isso. Também posso batê-lo tecnicamente. Adoraria lutar com ele nos penas ou leves, caso ele ganhe o título. Não me importo. Sou o campeão e meu estilo é construído para subir de categoria porque eu não sofro danos - analisou, em entrevista para a ""Fox Sports"".bellator promove eventos em dias seguidos pela 1ª vezO Bellator marcou eventos para dois dias seguidos pela primeira vez na história da organização. A edição de número 166 será no dia 2 de dezembro e, no dia seguinte, acontecerá o Bellator 167. Nos dois eventos, brasileiros farão lutas principais. No primeiro, Dudu Dantas defenderá seu cinturão do peso-galo (até 61kg) em revanche contra Joe Warren, que é o único a ter lhe derrotado dentro da companhia. Já no dia 3 de dezembro, John Macapá terá o maior desafio de sua carreira diante do ex-campeão peso-pena (até 66kg) Pat Curran.Warren tirou o cinturão de Dudu por decisão unânime há dois anos, mas perdeu para Marcos Loro na sequência. Dantas recuperou o título no começo deste ano ao bater Loro também por decisão unânime. Entre os penas, Curran vem de duas vitórias seguidas, contra Emmanuel Sanchez e Georgi Karakhanyan, enquanto Macapá tenta engatar o quarto triunfo consecutivo, desta vez contra um rival de peso na companhia.",esportes,,Curtinhas: Cruz diz que é capaz de vencer McGregor nos penas ou leves,"Campeão dos galos, porém, afirma que isso cabe ao irlandês: ""Ele escolhe suas lutas""",Rio de Janeiro,"Enfrentar Conor McGregor é o desejo de boa parte dos lutadores do Ultimate. Não só por ele ser o campeão do peso-pena (até 66kg), mas também pelo retorno financeiro que um duelo contra o irlandês é capaz de trazer. Questionado sobre a possibilidade de enfrentar o Notório, Dominick Cruz não só deixou claro de que aceitaria, como garantiu que é capaz de batê-lo na categoria que McGregor preferir. Seja nos penas ou no peso-leve (até 70kg), divisão na qual Conor vai lutar pelo título contra Eddie Alvarez, dia 12 de novembro, no evento principal do UFC 205, em Nova York (EUA).- McGregor está escolhendo suas lutas, então isso não cabe a mim. Isso não cabe ao UFC, isso cabe ao McGregor. Conheço este esporte tanto quanto McGregor e parece que o único caminho para você vencer McGregor está na sua mente. Sei que posso fazer isso. Também posso batê-lo tecnicamente. Adoraria lutar com ele nos penas ou leves, caso ele ganhe o título. Não me importo. Sou o campeão e meu estilo é construído para subir de categoria porque eu não sofro danos - analisou, em entrevista para a ""Fox Sports"".bellator promove eventos em dias seguidos pela 1ª vezO Bellator marcou eventos para dois dias seguidos pela primeira vez na história da organização. A edição de número 166 será no dia 2 de dezembro e, no dia seguinte, acontecerá o Bellator 167. Nos dois eventos, brasileiros farão lutas principais. No primeiro, Dudu Dantas defenderá seu cinturão do peso-galo (até 61kg) em revanche contra Joe Warren, que é o único a ter lhe derrotado dentro da companhia. Já no dia 3 de dezembro, John Macapá terá o maior desafio de sua carreira diante do ex-campeão peso-pena (até 66kg) Pat Curran.Warren tirou o cinturão de Dudu por decisão unânime há dois anos, mas perdeu para Marcos Loro na sequência. Dantas recuperou o título no começo deste ano ao bater Loro também por decisão unânime. Entre os penas, Curran vem de duas vitórias seguidas, contra Emmanuel Sanchez e Georgi Karakhanyan, enquanto Macapá tenta engatar o quarto triunfo consecutivo, desta vez contra um rival de peso na companhia.
    Os comentários são de responsabilidade exclusiva de seus autores e não representam a opinião deste site. Se achar algo que viole os
    termos de uso, denuncie. Leia as perguntas mais frequentes para saber o que é impróprio ou ilegal.
recentespopularesQuero ver agora, chover de comentários dizendo que o mão pluma do Cruz venceria o Conor. Cruz nunca recebeu uma pancada no rosto (até por isso gostaria de ver um confronto com Cody ou Lineker, já que insisti em não dá uma revanche pro Dillashaw após vencê-lo por, doa a quem doer, dividida). O primeiro soco que Cruz tomasse na velocidade 0,5 segundos (Aldo sabe do que digo) era lona. recentespopularesQue ficha é essa? Em nenhum momento eu ofendi, vc que ja vem chamando por outros nomes e dando bobeira, o conor fez suas ultimas duas lutas nos meio medios o cruz ja vem lutando nos galos a anos vc acha mesmo que existe so 5 kilos de diferença entre os dois?recentespopularesOs 5 kilos sao a diferença entre os galos e os penas, mas o conor deixou de ser um pena a tempo se vc não sabe...A verdade é que ninguém quer saber de UFC. O negócio é futebol, futebol e futebol.recentespopularesVc sabe o tamanho da r.la dos lutadores???? Suma daki homoafetivo!!!recentespopulares...Fisicamente o conor é 2cm mais alto e 5 Kg mais pesado, ou seja, são quase iguais. O conor é mais atlético e mais forte. Os estilos são diferentes. Luta boa de ver e sem favorito .......recentespopularesEntão para de comentar coisa que nao existe, o Conor chega aos 80kilos, o Cruz consegue então bater 75? Analisa os seus comentários primeiro.recentespopularesEles tem quase o mesmo tamanho e peso. Onde está errado ? Qualquer um chega aos 80 Kg, 100 kg etc. Estilos diferentes. Onde está errado ? Não tem favorito. Onde está o erro ?A verdade é que qualque lutador top dos Galos, Penas, Leves e Meio-Médio venceria a farsa Gregor com facilidade. Alvarez irá destruir Gregor. Se Anthony Pettis que é um ótimo trocador e possuí um jiu jitsu mediano, mas perdeu para o Alvarez, imagina o que vai acontecer com o Gregor que não é melhor trocador que Pettis e não sabe nada de jiu jitsu?recentespopularesNão é melhor trocador que Pettis? Parei mesmo.Esse Cruz tá de graça,  é óbvio  que  ele espancaria  o Mckrigor. Tá querendo moleza Cruz? Quero ver ganhar do John Hands of Stone Linekerrrr!recentespopularesIgor Silva ""olhem o resultado da luta"".... decisão dividida recentespopularesCruz vence Lineker. Fato!Um site de futebol pra vocês acompanhar o futebol, galera:  Radar do Futebol: radardofutebol . com . br (junta link). Times e torneios num só lugar. Irão achar maneiro. Só seguir!jyjyjDominick Cruz, você vai perder o cinturão na próxima luta! Não adianta, você nunca vai lutar contra o Deus Conor.recentespopularesNão tenho nada contra homo ou hetero, só queria saber porque você é apaixonado (a) pelo Connor. E é só você, viu amigo (a).recentespopularesAndré Balada, saia do armário mais devagar...assim você escorrega no quiabo e bate abundinha no chão!!!Talvez Cruz tenha o pior estilo de jogo para Mcgregor no UFC. Tem um wrestling de altíssimo nível, o terror do irlandês, e um esquiva descomunal, capaz de se desvencilhar da única arma de Conor, o boxe.Seria a melhor e mais técnica luta da história. Patriotismo à parte, são dois prodígios!Virou uma loucura isso aqui... primeiro que não existem critérios para disputa se cinturões mais... segundo que agora o pessoal só quer lutar com o frango.... terceiro que nem os comentários aqui tem mais graça... só um monte de fake de 15 anos falando besteirarecentespopularesSe for fake, denunciem sempre! no lado direito do comentário tem um ícone para denúncia.recentespopularesUm monte não... por enquanto tem 5... é só contar os dedos vermelhos. São as crianças que os pais deixam acessar Internet sem restrição.Conor só vai ser campeão de verdade no dia em que defender seu título dos penas pelo menos uma vez. Fica correndo dos caras dos penas com chancela do careca ganancioso.recentespopularesDaqui a pouco o Connor vai lutar sumô na média de 66Kg. O Danna vai dar um jeitinho...Com certeza não iria achar o Cruz no octagon fora q todos viram q ele não tem gás pra uma luta de rounds não mentiu no seu relato o Cruz...Não da pra correr do McGregor 25 minutos não Cruz, ele te acha no primeiro round e ai é lona do mesmo jeito que foi com os outros 7 pesos penas.recentespopularesO RDA é um fanfarrão! Menti O.o?recentespopularesMas a galera esquece que se o Rafael não tivesse corrido o Nate nem tinha entrado nessa história, conor ja teria dois cinturões e ja teria dedicado mais uns 13 segundos pro Aldo.Cruz é tecnicamente melhor que o McFrango, mas enfrentaria o mesmo problema que o irlandês teve com o Nate de bater num cara bem maior e esse cara não sentir muito o dano, acho o Cruz um dos melhores tecnicamente do UFC mas o Conor venceria por esse motivo, acertando um ou dois botaria pra dormir.Cruz é o cara mais completo do UFC, excepcional no chão tanto quanto de pé. A chance do Macfrango feliz ganhar é 0.Cruz é MUIIIIITO mais talentoso que McPropagandaGregorrecentespopulares13 segundos.recentespopularesRespeito sua opinião. Sim, o Cruz é muito talentoso, mas o Mcgregor também é.
Oxxx esse chibatero leva um no queixo e lona ta pensando  qui e os galos qui o queixo dele pode aguentar mccançado xega ate nos meios medios i tem queixo duro....Um campeão admirado correndo atrás de luta fácil só por causa da grana que pode ganhar? Não faz isso não Cruz... Continue sendo uma das exceções e limpe a categoria antes. Tem bons desafios nos galos, e o Lineker é o próximo!recentespopularesLineker, não! O próximo é o Cody ""sem amor"".Connor, o notório, iria mastigar Cruz e depois defecá-lo em sua privada de ouro.Pela mesma lógica que o McGregor não se cria nos meio-médios, Cruz não vence o mesmo nos penas ou nos leves. Tamanho, massa e alcance completamente desproporcional. recentespopularesVINICIUS WINS! FLAWLESS VICTORY! BRUTALITY!recentespopularesahyahahahahahahahahhaha, boa essa.Mais um querendo se promover às custas de Conor McRei. Também, né, é o melhor do mundo. Todos querem tirar uma casquinha. Artista marcial do século, personalidade da década.... Uma lenda.recentespopularesPerfeito  comentário Sinhô Disgrassa, só faltou o ''menti?O.O''recentespopularesEm  Star Wars VIII surgirá LordMcGregor, o mais poderoso de todos os tempos!kkkkkkkkkkkkkkk Esse Cruz é um palhaço de primeira kkkkkkkk nunca ri tanto kkkkkkkkkkkkkkkkkkkDominick está entre a Cruz e a espada!Com essas mãos de alfaces que não nocauteia nem peso mosca,  acha que vai ganha de um peso leve, msm tupiniquim eu tenho que ser realista, os socos desse cara seriam c.om-o massagem no conor, mal apanha na cara de peso galo, o dia que apanha de um peso leve, fica igual o Erick Silva concertando o rosto no hospital depois.O UFC está virando uma palhaçada não estão mais respeitando os lutadores de suas categorias só pra fazer montante em dinheiro o Dana não se perdeu ele simplesmente largou de mão as lutas pelo o dinheiro. Falta de respeito recentespopularesQuero ver agora, chover de comentários dizendo que o mão pluma do Cruz venceria o Conor. Cruz nunca recebeu uma pancada no rosto (até por isso gostaria de ver um confronto com Cody ou Lineker, já que insisti em não dá uma revanche pro Dillashaw após vencê-lo por, doa a quem doer, dividida). O primeiro soco que Cruz tomasse na velocidade 0,5 segundos (Aldo sabe do que digo) era lona. recentespopularesQue ficha é essa? Em nenhum momento eu ofendi, vc que ja vem chamando por outros nomes e dando bobeira, o conor fez suas ultimas duas lutas nos meio medios o cruz ja vem lutando nos galos a anos vc acha mesmo que existe so 5 kilos de diferença entre os dois?recentespopularesOs 5 kilos sao a diferença entre os galos e os penas, mas o conor deixou de ser um pena a tempo se vc não sabe...A verdade é que ninguém quer saber de UFC. O negócio é futebol, futebol e futebol.recentespopularesVc sabe o tamanho da r.la dos lutadores???? Suma daki homoafetivo!!!recentespopulares...Fisicamente o conor é 2cm mais alto e 5 Kg mais pesado, ou seja, são quase iguais. O conor é mais atlético e mais forte. Os estilos são diferentes. Luta boa de ver e sem favorito .......recentespopularesEntão para de comentar coisa que nao existe, o Conor chega aos 80kilos, o Cruz consegue então bater 75? Analisa os seus comentários primeiro.recentespopularesEles tem quase o mesmo tamanho e peso. Onde está errado ? Qualquer um chega aos 80 Kg, 100 kg etc. Estilos diferentes. Onde está errado ? Não tem favorito. Onde está o erro ?A verdade é que qualque lutador top dos Galos, Penas, Leves e Meio-Médio venceria a farsa Gregor com facilidade. Alvarez irá destruir Gregor. Se Anthony Pettis que é um ótimo trocador e possuí um jiu jitsu mediano, mas perdeu para o Alvarez, imagina o que vai acontecer com o Gregor que não é melhor trocador que Pettis e não sabe nada de jiu jitsu?recentespopularesNão é melhor trocador que Pettis? Parei mesmo.Esse Cruz tá de graça,  é óbvio  que  ele espancaria  o Mckrigor. Tá querendo moleza Cruz? Quero ver ganhar do John Hands of Stone Linekerrrr!recentespopularesIgor Silva ""olhem o resultado da luta"".... decisão dividida recentespopularesCruz vence Lineker. Fato!Um site de futebol pra vocês acompanhar o futebol, galera:  Radar do Futebol: radardofutebol . com . br (junta link). Times e torneios num só lugar. Irão achar maneiro. Só seguir!jyjyjDominick Cruz, você vai perder o cinturão na próxima luta! Não adianta, você nunca vai lutar contra o Deus Conor.recentespopularesNão tenho nada contra homo ou hetero, só queria saber porque você é apaixonado (a) pelo Connor. E é só você, viu amigo (a).recentespopularesAndré Balada, saia do armário mais devagar...assim você escorrega no quiabo e bate abundinha no chão!!!Talvez Cruz tenha o pior estilo de jogo para Mcgregor no UFC. Tem um wrestling de altíssimo nível, o terror do irlandês, e um esquiva descomunal, capaz de se desvencilhar da única arma de Conor, o boxe.Seria a melhor e mais técnica luta da história. Patriotismo à parte, são dois prodígios!Virou uma loucura isso aqui... primeiro que não existem critérios para disputa se cinturões mais... segundo que agora o pessoal só quer lutar com o frango.... terceiro que nem os comentários aqui tem mais graça... só um monte de fake de 15 anos falando besteirarecentespopularesSe for fake, denunciem sempre! no lado direito do comentário tem um ícone para denúncia.recentespopularesUm monte não... por enquanto tem 5... é só contar os dedos vermelhos. São as crianças que os pais deixam acessar Internet sem restrição.Conor só vai ser campeão de verdade no dia em que defender seu título dos penas pelo menos uma vez. Fica correndo dos caras dos penas com chancela do careca ganancioso.recentespopularesDaqui a pouco o Connor vai lutar sumô na média de 66Kg. O Danna vai dar um jeitinho...Com certeza não iria achar o Cruz no octagon fora q todos viram q ele não tem gás pra uma luta de rounds não mentiu no seu relato o Cruz...Não da pra correr do McGregor 25 minutos não Cruz, ele te acha no primeiro round e ai é lona do mesmo jeito que foi com os outros 7 pesos penas.recentespopularesO RDA é um fanfarrão! Menti O.o?recentespopularesMas a galera esquece que se o Rafael não tivesse corrido o Nate nem tinha entrado nessa história, conor ja teria dois cinturões e ja teria dedicado mais uns 13 segundos pro Aldo.Cruz é tecnicamente melhor que o McFrango, mas enfrentaria o mesmo problema que o irlandês teve com o Nate de bater num cara bem maior e esse cara não sentir muito o dano, acho o Cruz um dos melhores tecnicamente do UFC mas o Conor venceria por esse motivo, acertando um ou dois botaria pra dormir.Cruz é o cara mais completo do UFC, excepcional no chão tanto quanto de pé. A chance do Macfrango feliz ganhar é 0.Cruz é MUIIIIITO mais talentoso que McPropagandaGregorrecentespopulares13 segundos.recentespopularesRespeito sua opinião. Sim, o Cruz é muito talentoso, mas o Mcgregor também é.
Oxxx esse chibatero leva um no queixo e lona ta pensando  qui e os galos qui o queixo dele pode aguentar mccançado xega ate nos meios medios i tem queixo duro....Um campeão admirado correndo atrás de luta fácil só por causa da grana que pode ganhar? Não faz isso não Cruz... Continue sendo uma das exceções e limpe a categoria antes. Tem bons desafios nos galos, e o Lineker é o próximo!recentespopularesLineker, não! O próximo é o Cody ""sem amor"".Connor, o notório, iria mastigar Cruz e depois defecá-lo em sua privada de ouro.Pela mesma lógica que o McGregor não se cria nos meio-médios, Cruz não vence o mesmo nos penas ou nos leves. Tamanho, massa e alcance completamente desproporcional. recentespopularesVINICIUS WINS! FLAWLESS VICTORY! BRUTALITY!recentespopularesahyahahahahahahahahhaha, boa essa.Mais um querendo se promover às custas de Conor McRei. Também, né, é o melhor do mundo. Todos querem tirar uma casquinha. Artista marcial do século, personalidade da década.... Uma lenda.recentespopularesPerfeito  comentário Sinhô Disgrassa, só faltou o ''menti?O.O''recentespopularesEm  Star Wars VIII surgirá LordMcGregor, o mais poderoso de todos os tempos!kkkkkkkkkkkkkkk Esse Cruz é um palhaço de primeira kkkkkkkk nunca ri tanto kkkkkkkkkkkkkkkkkkkDominick está entre a Cruz e a espada!Com essas mãos de alfaces que não nocauteia nem peso mosca,  acha que vai ganha de um peso leve, msm tupiniquim eu tenho que ser realista, os socos desse cara seriam c.om-o massagem no conor, mal apanha na cara de peso galo, o dia que apanha de um peso leve, fica igual o Erick Silva concertando o rosto no hospital depois.O UFC está virando uma palhaçada não estão mais respeitando os lutadores de suas categorias só pra fazer montante em dinheiro o Dana não se perdeu ele simplesmente largou de mão as lutas pelo o dinheiro. Falta de respeito 13Out16:1816:0514:0414:0313:5813:4513:3613:1913:0913:0913Out14:0312:0010:0010:0008:0007:0000:0512Out16:2415:5715:3413Out14:0312:0010:0010:0008:0007:0000:0512Out16:2415:5715:3413Out10:0008:0011Out08:2610Out14:5206Out01:0003Out17:5001Out01:0030Set19:5916:0410:0027Set08:0714Set10:0024Ago10:4622Ago10:0020Ago11:0016Ago18:1714Ago09:0005Ago11:3120Jul09:0014Jul12:5202Jul01:0022Jun07:0018Jun00:4317Jun07:0013Jun09:0021Mar13:5025Fev17:3413:4824Fev12:0020Nov12:5111Out10:4029Set09:4628Set14:1416Set12:3413Abr11:2810Abr08:0009Abr17:0608:00",346.0
