,data,url_noticia,url_noticia_curto,titulo,conteudo_noticia,assunto,assunto_ex,titulo_ex,subtitulo_ex,local_ex,artigo_ex,n_paragrafos
37,2016-01-24,https://web.archive.org/web/20160124090509/http://sportv.globo.com/site/combate/noticia/2016/01/miesha-celebra-distancia-de-ronda-e-clima-leve-contra-holm-e-um-alivio.html,http://sportv.globo.com/site/combate/noticia/2016/01/miesha-celebra-distancia-de-ronda-e-clima-leve-contra-holm-e-um-alivio.html,"Miesha celebra distância de Ronda e clima leve contra Holm: ""É um alívio""","Quando Ronda Rousey ainda era dominante no Ultimate, Miesha Tate foi a responsável por criar uma das principais rivalidade na categoria. Após ser finalizada pela ex-campeã, ""Cupcake"" engatou sequência de quatro vitórias e, finalmente, pôde comemorar uma nova oportunidade de disputar o título no UFC 197, dia 5 de março, em Las Vegas, nos EUA, dessa vez contra Holly Holm, motivo de comemoração para a desafiante.Em entrevista ao Combate, Tate admitiu que não ter Ronda como adversária é algo positivo, tanto nos bastidores, quanto no octógono. A desafiante, inclusive, revelou toda a admiração e respeito pela campeã. - É, acho que é um alívio, sinceramente. Ela é uma campeã humilde, ela é muito educada, muito boa. Gosto do jeito que ela se porta e a equipe dela tem sido muito respeitosa. Então acho que pode ser uma frequência diferente para os fãs. Acho que é interessante que você possa gostar tanto de alguém... E eu realmente gosto dela e acho que é uma pessoa maravilhosa e campeã maravilhosa. Tenho muito respeito por ela e fico feliz ao vê-la, fico feliz por ela, mas ao mesmo tempo isso não vai mudar nada. Uma vez que o octógono se fecha, não importa o quanto eu respeite ou goste de alguém, ou admire suas conquistas, ainda é inevitável. Vou sair pra bater em alguém.A relação entre Miesha Tate e Ultimate não foi sempre um mar de rosas. Quando Holly Holm ganhou a chance de disputar o título contra Ronda, no UFC 193, em Melbourne, na Austrália, ""Cupcake"" se sentiu desprestigiada e chegou a pensar em aposentadoria. O novo momento, contudo, abriu os horizontes da lutadora, que promete aproveitar a oportunidade de brilhar.- Me deu uma nova perspectiva. De que essas oportunidades não são garantidas, e que isso não significa que você nunca vai ter outra. Você precisa agarrá-las. Fiquei mais humilde no processo. E agora acho que essa é uma nova oportunidade de brilhar, quero sair lá e fazer isso.Apesar da admiração por Holm, o resultado obtido pela compatriota em Melbourne surpreendeu Miesha, que acreditava que a loira resolveria o duelo no chão, como já havia feito em várias lutas anteriores. - Acho que chocou a quase todos. E isso só prova a lutadora perigosa que ela é. Ela tem uma luta de pé muito poderosa, e calcula muito bem como manter a distância e alcance. Uma lutadora fenomenal, e acho que ela surpreendeu muita gente. Eu sabia que ela era melhor na luta de pé que a Ronda, mas eu achei que a Ronda iria conseguir achá-la em algum momento. E ela simplesmente não deixou, foi impressionante.",esportes,,"Miesha celebra distância de Ronda e clima leve contra Holm: ""É um alívio""","Americana comemora oportunidade de disputar o título contra adversária diferente de ""Rowdy"" e não poupa elogios à dona do cinturão dos galos: ""Campeã maravilhosa""","Direto de Las Vegas, EUA","Quando Ronda Rousey ainda era dominante no Ultimate, Miesha Tate foi a responsável por criar uma das principais rivalidade na categoria. Após ser finalizada pela ex-campeã, ""Cupcake"" engatou sequência de quatro vitórias e, finalmente, pôde comemorar uma nova oportunidade de disputar o título no UFC 197, dia 5 de março, em Las Vegas, nos EUA, dessa vez contra Holly Holm, motivo de comemoração para a desafiante.Em entrevista ao Combate, Tate admitiu que não ter Ronda como adversária é algo positivo, tanto nos bastidores, quanto no octógono. A desafiante, inclusive, revelou toda a admiração e respeito pela campeã. - É, acho que é um alívio, sinceramente. Ela é uma campeã humilde, ela é muito educada, muito boa. Gosto do jeito que ela se porta e a equipe dela tem sido muito respeitosa. Então acho que pode ser uma frequência diferente para os fãs. Acho que é interessante que você possa gostar tanto de alguém... E eu realmente gosto dela e acho que é uma pessoa maravilhosa e campeã maravilhosa. Tenho muito respeito por ela e fico feliz ao vê-la, fico feliz por ela, mas ao mesmo tempo isso não vai mudar nada. Uma vez que o octógono se fecha, não importa o quanto eu respeite ou goste de alguém, ou admire suas conquistas, ainda é inevitável. Vou sair pra bater em alguém.A relação entre Miesha Tate e Ultimate não foi sempre um mar de rosas. Quando Holly Holm ganhou a chance de disputar o título contra Ronda, no UFC 193, em Melbourne, na Austrália, ""Cupcake"" se sentiu desprestigiada e chegou a pensar em aposentadoria. O novo momento, contudo, abriu os horizontes da lutadora, que promete aproveitar a oportunidade de brilhar.- Me deu uma nova perspectiva. De que essas oportunidades não são garantidas, e que isso não significa que você nunca vai ter outra. Você precisa agarrá-las. Fiquei mais humilde no processo. E agora acho que essa é uma nova oportunidade de brilhar, quero sair lá e fazer isso.Apesar da admiração por Holm, o resultado obtido pela compatriota em Melbourne surpreendeu Miesha, que acreditava que a loira resolveria o duelo no chão, como já havia feito em várias lutas anteriores. - Acho que chocou a quase todos. E isso só prova a lutadora perigosa que ela é. Ela tem uma luta de pé muito poderosa, e calcula muito bem como manter a distância e alcance. Uma lutadora fenomenal, e acho que ela surpreendeu muita gente. Eu sabia que ela era melhor na luta de pé que a Ronda, mas eu achei que a Ronda iria conseguir achá-la em algum momento. E ela simplesmente não deixou, foi impressionante.
    Os comentários são de responsabilidade exclusiva de seus autores e não representam a opinião deste site. Se achar algo que viole os
    termos de uso, denuncie. Leia as perguntas mais frequentes para saber o que é impróprio ou ilegal.
recentespopularesTIVE UMA LEVE EREÇÃO...recentespopularesSão Nação.. Não! Fundo de campo é só sua mamãezinha que adora tomar.recentespopulareskkkkk...só figura...Quando Ronda era campeão, a pergunta era: ""Quantos minutos até finalizar?"" Com Holly, há quem ache que Miesha ganhe. Veremos! Sucesso a Holly, merece! Mas ainda quero a revanche com Ronda. 12 lutas em pouco mais de 20 minutos, merece a revanche. recentespopularesSempre escrevendo asneiras senhor Felipe. A Ronda finalizava amadoras, quando pegou uma profissional levou um sacode, só isso.recentespopularesCaramba, ainda tem gente chorando por DerrubAldo?ronda só perdeu porque estava abalada com a morte do pai...mas irá voltar destruindo essas  V   A   D   I   A    Srecentespopulareskkkkkkkkkkk isso é uma b.ichona recentespopularesTô ficando com a Miesha Tate.Miesha Tate é gata demais brother!Cara ela é muito gostosa mesmo estamos juntos parceiros , Além do mais é uma lutadora ! Só não dá sorte com a Ronda Delicinha demais essa miesha tete, hmmmmm.recentespopularesAgora vc falou algo que presta! A mais gata do UFCrecentespopularesJá viu a raba dela numa das ultimas fotos do insta? Eu perdia uma noite toda fácilA lutadora que bater no rosto da Miesha tinha que perder um ponto por cada tapa que der. Muito perfeitinha! Ja abri umas 5 vezes esta reportagem só por causa das fotos ,principalmente esta deste rosto perfeito da miesha.esta mulher é perfeita.Tem alguém aí que ainda não gosta de MMA feminino?  Holm é Miesha são excelentes motivos pra gostar de MMA feminino.  Lutadoras de alto nível técnico. Ah,  As duas são muito bonitas também,  mas isso é apenas detalhe. 
recentespopularesso li o ""muito bonitas"" e acho que vc deveria dizer gostosas mesmorecentespopularesKkkk.... é quase impossível não fazer essa observação,  são muito gostosas mesmo,  principalmente a Miesha Tate. a ronda chegou a achar a holly em um momento,mas perdeu novamente e perdeu também o rumo de casa! gosto dessas duas,embora a raça e fibra da miesha são impressionante,a tecnica e calma da holly deve prevalecer, novamente só a cyborg pra  vencer todas! Infelizmente, Despeito e inveja de ronda!!Essa miesha é top, muito gata deixaria ela me finalizar várias vezes com uma chave de buce..Gata de mais, aguentaria uns 100 rounds contigo mulher!gostosa d++++++++++++++++++++++++++++++++++++++++++++++
deve mamar legal! Engraçado que ninguém fala da Amanda Nunes nessa categoria, pois ela é muito perigosa e tem boas condições de chegar ao titulo....recentespopularesCaro, penso nisso toda vez que leio uma reportagem dessa categoria. Acho que já está na hora dela disputar o cinturão.recentespopularesAqui tem muita gente poser que só acompanham as lutas por disputa de cinturão. Falei em outra matéria que Amanda nocauteiaria Ronda em uma luta em pé e teve uma enxurrada de negativos.Povo tem muito recalque da Ronda mano na moral. Faz sua luta ae moça, dê o seu melhor e ganhe o título se puder. Esquece da outra que já não tem nada a ver com esse evento.recentespopularesProvavelmente essa fala dela foi uma resposta a alguma pergunta do repórter sobre enfrentar outra adversária diferente de Ronda pelo cinturãoConor ganharia de miesha holm e ronda ao mesmo temporecentespopularesColírio  a taterecentespopularescyborg mataria jose aldo kkkkkkkkkkk Gina Carano e Ronda.Duas farsas.recentespopulareskk gina carano era monstra lutou ate com a cyborg Duas delícias. Mais gatas que a carinha de bolacha Rousey. Holm leva a luta.declaração de perdedora, porem é uma deliciagostosa!Alívio, imagino...tomar outro couro da Ronda seria péssimo. E provavelmente vai ser amassada pela Holm. recentespopularesboa sua análise, só trocaria a palavra amassada por espancada...recentespopularesQuem levo coro e espancamento foi a Kasinsky. Até hoje tem q tomar papinha de bebê por conta da mandíbula esbagaçada. eu monto na honda todo dia e toda hora.E UM DESPERDÍCIO UMA MULHER GATA DESSA QUE NEM A MIESHA FICAR LEVANDO SOCO NA CARA, FILHA PAGO MUITO MELHOR QUE O UFC.
recentespopularesTIVE UMA LEVE EREÇÃO...recentespopularesSão Nação.. Não! Fundo de campo é só sua mamãezinha que adora tomar.recentespopulareskkkkk...só figura...Quando Ronda era campeão, a pergunta era: ""Quantos minutos até finalizar?"" Com Holly, há quem ache que Miesha ganhe. Veremos! Sucesso a Holly, merece! Mas ainda quero a revanche com Ronda. 12 lutas em pouco mais de 20 minutos, merece a revanche. recentespopularesSempre escrevendo asneiras senhor Felipe. A Ronda finalizava amadoras, quando pegou uma profissional levou um sacode, só isso.recentespopularesCaramba, ainda tem gente chorando por DerrubAldo?ronda só perdeu porque estava abalada com a morte do pai...mas irá voltar destruindo essas  V   A   D   I   A    Srecentespopulareskkkkkkkkkkk isso é uma b.ichona recentespopularesTô ficando com a Miesha Tate.Miesha Tate é gata demais brother!Cara ela é muito gostosa mesmo estamos juntos parceiros , Além do mais é uma lutadora ! Só não dá sorte com a Ronda Delicinha demais essa miesha tete, hmmmmm.recentespopularesAgora vc falou algo que presta! A mais gata do UFCrecentespopularesJá viu a raba dela numa das ultimas fotos do insta? Eu perdia uma noite toda fácilA lutadora que bater no rosto da Miesha tinha que perder um ponto por cada tapa que der. Muito perfeitinha! Ja abri umas 5 vezes esta reportagem só por causa das fotos ,principalmente esta deste rosto perfeito da miesha.esta mulher é perfeita.Tem alguém aí que ainda não gosta de MMA feminino?  Holm é Miesha são excelentes motivos pra gostar de MMA feminino.  Lutadoras de alto nível técnico. Ah,  As duas são muito bonitas também,  mas isso é apenas detalhe. 
recentespopularesso li o ""muito bonitas"" e acho que vc deveria dizer gostosas mesmorecentespopularesKkkk.... é quase impossível não fazer essa observação,  são muito gostosas mesmo,  principalmente a Miesha Tate. a ronda chegou a achar a holly em um momento,mas perdeu novamente e perdeu também o rumo de casa! gosto dessas duas,embora a raça e fibra da miesha são impressionante,a tecnica e calma da holly deve prevalecer, novamente só a cyborg pra  vencer todas! Infelizmente, Despeito e inveja de ronda!!Essa miesha é top, muito gata deixaria ela me finalizar várias vezes com uma chave de buce..Gata de mais, aguentaria uns 100 rounds contigo mulher!gostosa d++++++++++++++++++++++++++++++++++++++++++++++
deve mamar legal! Engraçado que ninguém fala da Amanda Nunes nessa categoria, pois ela é muito perigosa e tem boas condições de chegar ao titulo....recentespopularesCaro, penso nisso toda vez que leio uma reportagem dessa categoria. Acho que já está na hora dela disputar o cinturão.recentespopularesAqui tem muita gente poser que só acompanham as lutas por disputa de cinturão. Falei em outra matéria que Amanda nocauteiaria Ronda em uma luta em pé e teve uma enxurrada de negativos.Povo tem muito recalque da Ronda mano na moral. Faz sua luta ae moça, dê o seu melhor e ganhe o título se puder. Esquece da outra que já não tem nada a ver com esse evento.recentespopularesProvavelmente essa fala dela foi uma resposta a alguma pergunta do repórter sobre enfrentar outra adversária diferente de Ronda pelo cinturãoConor ganharia de miesha holm e ronda ao mesmo temporecentespopularesColírio  a taterecentespopularescyborg mataria jose aldo kkkkkkkkkkk Gina Carano e Ronda.Duas farsas.recentespopulareskk gina carano era monstra lutou ate com a cyborg Duas delícias. Mais gatas que a carinha de bolacha Rousey. Holm leva a luta.declaração de perdedora, porem é uma deliciagostosa!Alívio, imagino...tomar outro couro da Ronda seria péssimo. E provavelmente vai ser amassada pela Holm. recentespopularesboa sua análise, só trocaria a palavra amassada por espancada...recentespopularesQuem levo coro e espancamento foi a Kasinsky. Até hoje tem q tomar papinha de bebê por conta da mandíbula esbagaçada. eu monto na honda todo dia e toda hora.E UM DESPERDÍCIO UMA MULHER GATA DESSA QUE NEM A MIESHA FICAR LEVANDO SOCO NA CARA, FILHA PAGO MUITO MELHOR QUE O UFC.
25Jan06:0002:4100:0024Jan23:3521:3621:2120:3220:0019:0018:1124Jan21:3619:0017:1315:0812:0010:0008:0007:0004:2323Jan19:0424Jan21:3619:0017:1315:0813:2012:0010:0008:0007:0004:2324Jan04:2321Jan14:0008:0020Jan12:0318Jan18:2915Jan10:0013Jan12:2201:3312Jan09:0011Jan09:0021Jan14:0008:0020Jan12:0313Jan12:2212Jan09:0008Jan01:0604Jan18:2422Dez16:1711Dez19:2403Dez01:1024Jan07:0004:2323Jan12:0010:0001:0021Jan14:0010:5608:0018Jan",284.0
38,2016-01-24,https://web.archive.org/web/20160124090509/http://globoesporte.globo.com/df/volei/noticia/2016/01/brasilia-domina-o-terceiro-set-e-bate-flamengo-pela-superliga-b.html,http://globoesporte.globo.com/df/volei/noticia/2016/01/brasilia-domina-o-terceiro-set-e-bate-flamengo-pela-superliga-b.html,"Com reação incrível no segundo set, Brasília vence o Fla pela Superliga B","Em mais um dia em que as chuvas e os ventos castigaram a capital 
federal, Brasília e Flamengo fizeram um bom jogo pela segunda rodada da 
Superliga B. Em um duelo recheado de alternativas, mas o com o Brasília dominante no terceiro set, os donos da casa venceram por 3 sets a 0, com parciais de 
26/24, 25/22 e 25/17. Na segunda parcial, o Brasília chegou a estar perdendo por 20/12, mas conseguiu uma reação improvável para fechar o set com vitória por 25/22 e pavimentar o caminho do segundo triunfo consecutivo na competição.Para o técnico Flávio Thiessen, a reação no segundo set foi fundamental para que seus comandados saíssem de quadra com a vitória:- Foi um jogo em que conseguimos nos manter no jogo mesmo com as adversidades. Acho que o segundo set foi ainda pior, é muito difícil que um time consiga tirar a desvantagem que a gente tinha (oito pontos), ainda mais com o adversário já com 20 pontos. Essa reação foi determinante para a nossa vitória. O Flamengo começou a 
partida imprimindo um ritmo forte, com respostas a praticamente todas as
 investidas ofensivas do Brasília. Com bons ""rallies"", eram os visitantes 
que comandavam o placar, seguidos de perto pelos donos da casa, que 
conseguiam manter a diferença próxima, sempre na casa dos dois pontos 
até o primeiro tempo técnico. A parada fez bem ao Flamengo, que 
conseguiu desgarrar no marcador. A vantagem chegou a ser de 
cinco pontos (15/10). A tranquilidade dos visitantes, entretanto, durou 
pouco. Logo depois do segundo tempo técnico, o Brasília cresceu de 
produção e chegou a anotar quatro pontos seguidos e ameaçou a liderança 
rubro-negra (15/16). Os erros, porém, impediam os brasilienses de tomar a
 dianteira, dando pontos de graça aos cariocas. A primeira vez à frente 
no placar veio nos momentos decisivos, quando o Brasília anotou 21/20. 
Daí em diante, as equipes passaram a trocar pontos, mas os donos da casa
 conseguiram manter a tranquilidade para fechar a parcial em 26/24. A
 exemplo do primeiro set, o Flamengo começou a segunda parcial em um 
ritmo arrasador. Empurrado por sua barulhenta torcida, o time carioca 
não teve maiores trabalhos para abrir seis pontos de vantagem (9/3). 
Apesar das trocas promovidas pelo técnico Flávio Thiessen, o Brasília 
parecia não ter antídoto para o ímpeto rubro-negro. Preciso no ataque e 
firme na defesa, o Flamengo chegou a ter 20/12 a favor, quando, mais uma
 vez, viu o poder de reação do Brasília. O time da capital federal fez 
sete pontos seguidos e pulverizou a desvantagem. Foi a chave para que os
 jogadores do Flamengo perdessem a cabeça. Nervoso, o levantador Gabriel
 reclamou muito com a arbitragem em dois momentos, inclusive no último 
ponto, quando levou um cartão vermelho, suficiente para que o Brasília 
fechasse o set em 25/22, abrindo 2 sets a 0 na partida. Tão logo os 
donos da casa selaram o destino da segunda parcial, uma bomba estourou 
em um dos setores exclusivos a uma das torcidas organizadas do Flamengo,
 o que parou a partida por alguns minutos. A 
parada forçada não incomodou o Brasília. Com a vantagem, os donos da casa voltaram à quadra determinados a fechar a 
partida. A equipe conseguiu se manter à frente 
durante todo o set, o que não ocorreu durante o restante do encontro. Os
 donos da casa chegaram a abrir oito pontos de vantagem, quando o placar
 apontava 16/8. A partir do segundo tempo técnico, o Flamengo ensaiou 
uma reação, mas o Brasília, inspirado, brecou o ímpeto dos rubro-negros e
 fechou o set em 25/17 e a partida em três sets a zero, conquistando a 
segunda vitória na Superliga B. O Flamengo, que vinha de vitória dia do 
Botafogo, conheceu a primeira derrota na competição. O próximo compromisso do Brasília é fora de casa, diante do Goiânia, no próximo sábado, às 17h. O Flamengo recebe o Cruzeiro, na próxima quarta-feira, às 17h. ",esportes,,"Com reação incrível no segundo set, Brasília vence o Fla pela Superliga B","Fortes chuvas na capital federal não espantam público, que comparece em bom número ao Ginásio da AABB, onde equipe local leva a melhor sobre cariocas",Brasilia,"Em mais um dia em que as chuvas e os ventos castigaram a capital 
federal, Brasília e Flamengo fizeram um bom jogo pela segunda rodada da 
Superliga B. Em um duelo recheado de alternativas, mas o com o Brasília dominante no terceiro set, os donos da casa venceram por 3 sets a 0, com parciais de 
26/24, 25/22 e 25/17. Na segunda parcial, o Brasília chegou a estar perdendo por 20/12, mas conseguiu uma reação improvável para fechar o set com vitória por 25/22 e pavimentar o caminho do segundo triunfo consecutivo na competição.Para o técnico Flávio Thiessen, a reação no segundo set foi fundamental para que seus comandados saíssem de quadra com a vitória:- Foi um jogo em que conseguimos nos manter no jogo mesmo com as adversidades. Acho que o segundo set foi ainda pior, é muito difícil que um time consiga tirar a desvantagem que a gente tinha (oito pontos), ainda mais com o adversário já com 20 pontos. Essa reação foi determinante para a nossa vitória. ",3.0
