,data,url_noticia,url_noticia_curto,titulo,conteudo_noticia,assunto,assunto_ex,titulo_ex,subtitulo_ex,local_ex,artigo_ex,n_paragrafos
13,2019-02-27,https://web.archive.org/web/20190227130032/https://globoesporte.globo.com/futebol/times/corinthians/noticia/romarinho-admite-chance-de-voltar-ao-corinthians-no-meio-do-ano-novo-momento.ghtml,https://globoesporte.globo.com/futebol/times/corinthians/noticia/romarinho-admite-chance-de-voltar-ao-corinthians-no-meio-do-ano-novo-momento.ghtml,"Romarinho admite chance de voltar ao Corinthians no meio do ano: ""Novo momento"""," A volta de Romarinho ao Corinthians não se concretizou no começo deste ano, mas ainda pode acontecer em 2019. A possibilidade é confirmada pelo próprio atacante, que após cinco temporadas jogando no Oriente Médio diz estar em ""um novo momento"" e avaliar ""com carinho"" o retorno ao Brasil.  Para contratar Romarinho, o Corinthians ofereceu cerca de R$ 18,8 milhões ao Al-Ittihad, da Arábia Saudita, clube que tem contrato com o jogador por mais dois anos. O Timão, porém, foi informado que a liberação pode ser mais fácil em junho e planeja nova investida.  – Eu ainda tenho contrato com o Al-Ittihad, então fica complicado falar se gostaria de voltar. O que posso dizer é que hoje, depois de quase cinco anos fora, eu já avalio a possibilidade de retornar ao Brasil com carinho. Já recebi outras sondagens desde que deixei o Corinthians, mas sempre descartei. Hoje é um novo momento, mas as coisas precisam ser boas e corretas para todos os lados. Sei que existe essa possibilidade para o meio do ano, quando termina a temporada aqui, então vamos aguardar. Quem sabe aí pode dar certo, né?! – afirmou Romarinho, ao GloboEsporte.com, por meio de assessoria de imprensa.  Ficar mais próximo da família é um dos principais motivos para Romarinho cogitar a volta.  – Hoje sou pai, meu filho nasceu ano passado e já são quase cinco anos fora. Mas para isso se concretizar sei que não é simples e envolve muito coisa. Eu costumo respeitar muito isso e as coisas têm que ser boas para todos os lados - disse o jogador, que está com 28 anos.  Pelo Corinthians, Romarinho fez 141 partidas e 25 gols. Ele foi Campeão da Libertadores, do Mundial, da Recopa e do Paulistão pelo Timão.  Mesmo tendo deixado o clube em 2014, ele nunca se desligou totalmente. O jogador mantém contato com membros da comissão técnica alvinegra, a quem manifestou o interesse de retornar.  – Eu falo com algumas pessoas no Corinthians, sim, pois temos uma boa relação. Sempre que posso, nas férias, vou ao clube. Temos um carinho legal e sempre estamos falando. O que passei foi que eu me sinto à vontade hoje para retornar, algo que antes não passava pela minha cabeça. Mas que precisaria ser conversado entre os clubes e foi feito – comentou.  Romarinho conta que chegou a falar com dirigentes do Al-Ittihad sobre a possibilidade de ser vendido ao Corinthians, mas alega que, por ser profissional, não quis forçar a saída:  – Eles sabiam que era uma boa proposta, das minhas intenções, mas existe um contrato. Deixei isso para os clubes e para os meus empresários tratarem.  Mesmo tendo contratado 12 reforços para esta temporada, o Corinthians ainda está de olho no mercado em busca de jogadores que possam atuar pelos lados do ataque. André Luis, um dos contratados para esta posição, não agradou em seu início e pode já ser emprestado.  Apesar das dificuldades por conta do fuso-horário de seis horas, Romarinho diz acompanhar os jogos do Corinthians e está animado com o começo de temporada.  – É uma equipe que mudou muito, com uma comissão técnica que retornou, várias contratações, então natural que demore um pouco para embalar. Mas são muitos jogadores de qualidade. Já ganhou do Palmeiras e do São Paulo, então já dá para ver que o ano tem tudo para ser bom (risos). ",esportes,         é o seu time do coração?   Sim Não  ,,"Atacante destaca carinho pelo Timão e mostra interesse em retornar ao Brasil: “Hoje sou pai""",," Obrigado pela participação.  Nós usaremos esta informação para trazer mais novidades para você.  Por Bruno Cassucci — Buenos Aires, Argentina   27/02/2019 08h00    Atualizado  27/02/2019     A volta de Romarinho ao Corinthians não se concretizou no começo deste ano, mas ainda pode acontecer em 2019. A possibilidade é confirmada pelo próprio atacante, que após cinco temporadas jogando no Oriente Médio diz estar em ""um novo momento"" e avaliar ""com carinho"" o retorno ao Brasil.  Para contratar Romarinho, o Corinthians ofereceu cerca de R$ 18,8 milhões ao Al-Ittihad, da Arábia Saudita, clube que tem contrato com o jogador por mais dois anos. O Timão, porém, foi informado que a liberação pode ser mais fácil em junho e planeja nova investida.  – Eu ainda tenho contrato com o Al-Ittihad, então fica complicado falar se gostaria de voltar. O que posso dizer é que hoje, depois de quase cinco anos fora, eu já avalio a possibilidade de retornar ao Brasil com carinho. Já recebi outras sondagens desde que deixei o Corinthians, mas sempre descartei. Hoje é um novo momento, mas as coisas precisam ser boas e corretas para todos os lados. Sei que existe essa possibilidade para o meio do ano, quando termina a temporada aqui, então vamos aguardar. Quem sabe aí pode dar certo, né?! – afirmou Romarinho, ao GloboEsporte.com, por meio de assessoria de imprensa.  Romarinho vê com bons olhos retorno ao Corinthians no meio do ano — Foto: Daniel Augusto Jr/Ag. Corinthians  Ficar mais próximo da família é um dos principais motivos para Romarinho cogitar a volta.  – Hoje sou pai, meu filho nasceu ano passado e já são quase cinco anos fora. Mas para isso se concretizar sei que não é simples e envolve muito coisa. Eu costumo respeitar muito isso e as coisas têm que ser boas para todos os lados - disse o jogador, que está com 28 anos.  Pelo Corinthians, Romarinho fez 141 partidas e 25 gols. Ele foi Campeão da Libertadores, do Mundial, da Recopa e do Paulistão pelo Timão.  Mesmo tendo deixado o clube em 2014, ele nunca se desligou totalmente. O jogador mantém contato com membros da comissão técnica alvinegra, a quem manifestou o interesse de retornar.  – Eu falo com algumas pessoas no Corinthians, sim, pois temos uma boa relação. Sempre que posso, nas férias, vou ao clube. Temos um carinho legal e sempre estamos falando. O que passei foi que eu me sinto à vontade hoje para retornar, algo que antes não passava pela minha cabeça. Mas que precisaria ser conversado entre os clubes e foi feito – comentou.  Romarinho conta que chegou a falar com dirigentes do Al-Ittihad sobre a possibilidade de ser vendido ao Corinthians, mas alega que, por ser profissional, não quis forçar a saída:  – Eles sabiam que era uma boa proposta, das minhas intenções, mas existe um contrato. Deixei isso para os clubes e para os meus empresários tratarem.  Romarinho está no Al-Ittihad, da Arábia Saudita, e interessa ao Corinthians — Foto: Divulgação  Mesmo tendo contratado 12 reforços para esta temporada, o Corinthians ainda está de olho no mercado em busca de jogadores que possam atuar pelos lados do ataque. André Luis, um dos contratados para esta posição, não agradou em seu início e pode já ser emprestado.  Apesar das dificuldades por conta do fuso-horário de seis horas, Romarinho diz acompanhar os jogos do Corinthians e está animado com o começo de temporada.  – É uma equipe que mudou muito, com uma comissão técnica que retornou, várias contratações, então natural que demore um pouco para embalar. Mas são muitos jogadores de qualidade. Já ganhou do Palmeiras e do São Paulo, então já dá para ver que o ano tem tudo para ser bom (risos). Veja também",19.0
14,2019-02-28,https://web.archive.org/web/20190228231356/https://sportv.globo.com/site/combate/noticia/jon-jones-passa-em-tres-exames-antidoping-mas-apresenta-tracos-de-turinabol-em-dois-testes.ghtml,https://sportv.globo.com/site/combate/noticia/jon-jones-passa-em-tres-exames-antidoping-mas-apresenta-tracos-de-turinabol-em-dois-testes.ghtml,"Jon Jones passa em três exames antidoping, mas apresenta traços de turinabol em dois testes"," A substância turinabol voltou a ser notícia atrelada a Jon Jones, nesta quinta-feira, em Las Vegas (EUA), na antevéspera do UFC 235. A Comissão Atlética de Nevada divulgou cinco exames feitos por ""Bones"" para esta luta contra Anthony Smith, programada para sábado, e em dois dos testes aparecem metabólitos da substância, proibida pela USADA (Agência Antidoping dos EUA) e causadora do doping do americano em 2017. O combate, porém, está confirmado.  As duas amostras apresentam 40 e 20 picogramas (um grama dividido por um trilhão) de turinabol, que seriam um resquício do que foi encontrado no organismo do campeão do peso-meio-pesado dois anos atrás, quando superou Daniel Cormier no UFC 214 - a vitória foi transformada em ""No Contest"" (luta sem resultado).  - O que esses experts estão nos dizendo é que não houve nova administração desta substância, e nenhum benefício de melhora de performance. Agora temos - estou vendo o release de Nevada - temos dois positivos de nível muito baixo, de picogramas, no meio de dois exames negativos, num espaço de uma semana e meia. Se houvesse uma nova administração desta substância, certamente veríamos o composto de origem, metabólitos de curto e médio prazo, que a ciência mostra que existiriam por várias semanas. Então, apesar de ser infeliz para o Jon, baseado na quantidade de exames, acho que é a melhor evidência que já vi - declarou o vice-presidente de Saúde e Performance dos Atletas do UFC, Jeff Novitzky.  Novitzky garante que situações desta natureza não estão acontecendo apenas com Jon Jones, mas não soube explicar por que os picogramas seguem surgindo no organismo.  - Não é o único atleta do UFC, e certamente há atletas - eu conversei com outras entidades de esportes, outras ligas, que já aconteceram com eles também. Está se tornando muito comum, e é uma circunstância em que este nível de sensibilidade de testes aumentou nos últimos anos 100 vezes. Há outra liga esportiva detectando um picograma do metabólito de entrada. Acho que em breve, e não sei qual é o próximo nível mais baixo de medição, mas logo vamos ver isso.  Destronado pelo UFC após o episódio de doping contra Daniel Cormier, Jon Jones cumpriu 15 meses de suspensão e, em 29 de dezembro de 2018, no UFC 232, retomou o título vago da categoria ao vencer Alexander Gustafsson por nocaute técnico no terceiro round. O detalhe é que o embate aconteceria em Las Vegas, porém, por conta dos picogramas de turinabol, ""Bones"" não conseguiu licença para atuar em Nevada e o evento foi transferido para Los Angeles.  Na próxima sexta-feira, a partir de 14h (de Brasília), o Combate.com transmite ao vivo a pesagem oficial do UFC 235, e às 21h (de Brasília) acontece a pesagem cerimonial, com as encaradas, em que terá transmissões ao vivo no Combate, Combate.com e SporTV 3.  Já no sábado, o Combate transmite todo o card com exclusividade, a partir de 20h30 (de Brasília), e o Combate.com e SporTV 3 exibem as duas primeiras lutas.  UFC 2352 de março de 2019, em Las Vegas (EUA)CARD PRINCIPAL (0h, horário de Brasília):Peso-meio-pesado: Jon Jones x Anthony SmithPeso-meio-médio: Tyron Woodley x Kamaru UsmanPeso-meio-médio: Ben Askren x Robbie LawlerPeso-palha: Tecia Torres x Weili ZhangPeso-galo: Cody Garbrandt x Pedro MunhozCARD PRELIMINAR (20h30, horário de Brasília):Peso-pena: Jeremy Stephens x Zabit MagomedsharipovPeso-meio-pesado: Misha Cirkunov x Johnny WalkerPeso-galo: Alejandro Perez x Cody StamannPeso-meio-médio: Diego Sanchez x Mickey GallPeso-médio: Charles Byrd x Edmen ShahbazyanPeso-galo: Gina Mazany x Macy ChiassonPeso-palha: Polyana Viana x Hannah Cifers  Assine o Combate Play e assista ao Combate em qualquer lugar ",esportes,         é o seu time do coração?   Sim Não  ,,"Resquício da substância proibida, que provocou a suspensão do campeão dos meio-pesados em 2017, depois da luta contra Daniel Cormier, volta a surgir em exames feitos pela USADA",," Obrigado pela participação.  Nós usaremos esta informação para trazer mais novidades para você.  Por Combate.com — Las Vegas, EUA   28/02/2019 17h55    Atualizado  28/02/2019     A substância turinabol voltou a ser notícia atrelada a Jon Jones, nesta quinta-feira, em Las Vegas (EUA), na antevéspera do UFC 235. A Comissão Atlética de Nevada divulgou cinco exames feitos por ""Bones"" para esta luta contra Anthony Smith, programada para sábado, e em dois dos testes aparecem metabólitos da substância, proibida pela USADA (Agência Antidoping dos EUA) e causadora do doping do americano em 2017. O combate, porém, está confirmado.  Jon Jones é o atual campeão dos meio-pesados — Foto: Getty Images  As duas amostras apresentam 40 e 20 picogramas (um grama dividido por um trilhão) de turinabol, que seriam um resquício do que foi encontrado no organismo do campeão do peso-meio-pesado dois anos atrás, quando superou Daniel Cormier no UFC 214 - a vitória foi transformada em ""No Contest"" (luta sem resultado).  - O que esses experts estão nos dizendo é que não houve nova administração desta substância, e nenhum benefício de melhora de performance. Agora temos - estou vendo o release de Nevada - temos dois positivos de nível muito baixo, de picogramas, no meio de dois exames negativos, num espaço de uma semana e meia. Se houvesse uma nova administração desta substância, certamente veríamos o composto de origem, metabólitos de curto e médio prazo, que a ciência mostra que existiriam por várias semanas. Então, apesar de ser infeliz para o Jon, baseado na quantidade de exames, acho que é a melhor evidência que já vi - declarou o vice-presidente de Saúde e Performance dos Atletas do UFC, Jeff Novitzky.  Jeff Novitzky declarou que os testes estão cada vez mais avançados — Foto: Zeca Azevedo  Novitzky garante que situações desta natureza não estão acontecendo apenas com Jon Jones, mas não soube explicar por que os picogramas seguem surgindo no organismo.  - Não é o único atleta do UFC, e certamente há atletas - eu conversei com outras entidades de esportes, outras ligas, que já aconteceram com eles também. Está se tornando muito comum, e é uma circunstância em que este nível de sensibilidade de testes aumentou nos últimos anos 100 vezes. Há outra liga esportiva detectando um picograma do metabólito de entrada. Acho que em breve, e não sei qual é o próximo nível mais baixo de medição, mas logo vamos ver isso.  Destronado pelo UFC após o episódio de doping contra Daniel Cormier, Jon Jones cumpriu 15 meses de suspensão e, em 29 de dezembro de 2018, no UFC 232, retomou o título vago da categoria ao vencer Alexander Gustafsson por nocaute técnico no terceiro round. O detalhe é que o embate aconteceria em Las Vegas, porém, por conta dos picogramas de turinabol, ""Bones"" não conseguiu licença para atuar em Nevada e o evento foi transferido para Los Angeles. Serviço do UFC 235 Na próxima sexta-feira, a partir de 14h (de Brasília), o Combate.com transmite ao vivo a pesagem oficial do UFC 235, e às 21h (de Brasília) acontece a pesagem cerimonial, com as encaradas, em que terá transmissões ao vivo no Combate, Combate.com e SporTV 3.  Já no sábado, o Combate transmite todo o card com exclusividade, a partir de 20h30 (de Brasília), e o Combate.com e SporTV 3 exibem as duas primeiras lutas.  UFC 2352 de março de 2019, em Las Vegas (EUA)CARD PRINCIPAL (0h, horário de Brasília):Peso-meio-pesado: Jon Jones x Anthony SmithPeso-meio-médio: Tyron Woodley x Kamaru UsmanPeso-meio-médio: Ben Askren x Robbie LawlerPeso-palha: Tecia Torres x Weili ZhangPeso-galo: Cody Garbrandt x Pedro MunhozCARD PRELIMINAR (20h30, horário de Brasília):Peso-pena: Jeremy Stephens x Zabit MagomedsharipovPeso-meio-pesado: Misha Cirkunov x Johnny WalkerPeso-galo: Alejandro Perez x Cody StamannPeso-meio-médio: Diego Sanchez x Mickey GallPeso-médio: Charles Byrd x Edmen ShahbazyanPeso-galo: Gina Mazany x Macy ChiassonPeso-palha: Polyana Viana x Hannah Cifers  Assine o Combate Play e assista ao Combate em qualquer lugar — Foto: Combate  Assine o Combate Play e assista ao Combate em qualquer lugar 
Combate.com: veja as últimas notícias do MMA

Veja a programação completa do UFC em 2022

Assine o Combate Play e tenha acesso a todos eventos ao vivo e um acervo especial (exclusivo para assinantes)
Veja também",21.0
15,2019-02-28,https://web.archive.org/web/20190228231356/https://globoesporte.globo.com/futebol/noticia/ronaldinho-gaucho-inaugura-exposicao-sobre-a-carreira-no-maracana.ghtml,https://globoesporte.globo.com/futebol/noticia/ronaldinho-gaucho-inaugura-exposicao-sobre-a-carreira-no-maracana.ghtml,Ronaldinho ganha homenagem do Maracanã e inaugura exposição sobre a carreira," Um craque que uniu futebol e arte como poucos nos gramados do mundo, Ronaldinho Gaúcho ganhou nesta quinta-feira um reconhecimento especial no Maracanã. Com a presença do ex-jogador da seleção brasileira, foram inauguradas uma estação dedicada à sua carreira na área de visitação do estádio e uma exposição com 11 quadros do artista mineiro Camaleão, que ficará em cartaz até 10 de março.  - É maravilhoso ser lembrado nesse estádio. É uma das tristezas da época do Flamengo, de não ter jogado no Maracanã. Mesmo assim, ser homenageado é um presente que poucos têm oportunidade. Fico feliz - continuou.  A estação sobre a carreira de Ronaldinho Gaúcho conta com um par de chuteiras usadas pelo jogador, uma camisa do Barcelona, onde ele brilhou entre 2003 e 2008, e as marcas dos pés do craque. Registradas em janeiro, as pegadas passaram as últimas semanas em processo de finalização para entrar na Calçada da Fama do estádio. Além de Ronaldinho, apenas outras três personalidades do futebol brasileiro contam com uma estação própria por lá: Pelé, Garrincha e Marta.  Sobre a exposição, Camaleão detalhou o desafio de registrar o craque. Os quadros não foram feitos com base em lances que de fato ocorreram. O artista deixou a imaginação fluir e demorou mais de um ano para finalizar o trabalho. Depois do Brasil, as obras devem passar uma temporada na Europa. Os destinos prováveis são Alemanha e Espanha.  + Maracanã quer Neymar, Messi e outros astros internacionais na Calçada da Fama  + Fim do mistério: 73 peças perdidas são recuperadas e voltarão à Calçada da Fama  Na entrevista coletiva, o craque também falou sobre um assunto delicado: o passaporte retido pela Justiça. Acusados de crime ambiental, Ronaldinho e o irmão, Roberto Assis, tiveram os documentos apreendidos em novembro de 2018, em decisão da 1ª Câmara Cível do Tribunal de Justiça do Rio Grande do Sul (TJ-RS), a pedido do Ministério Público. O ex-jogador se esquivou:  - Tudo normal, tudo tranquilo.  Na seleção brasileira, Ronaldinho Gaúcho foi campeão mundial em 2002, na Copa do Mundo do Japão e da Coreia do Sul, e ganhou também a Copa América de 1999 e a Copa das Confederações de 2005, além do Mundial Sub-17, em 1997.  Revelado pelo Grêmio, Ronaldinho chegou ao futebol europeu em 2001 para jogar no Paris Saint-Germain, mas foi no Barcelona que seu futebol ganhou reconhecimento mundial. Com jogadas mágicas, conduziu o time a dois títulos espanhóis (2005 e 2006), duas Supercopas da Espanha (2005 e 2006) e à sonhada Liga dos Campeões da Uefa, em 2006. Como jogador do Barcelona, R10 foi eleito duas vezes pela Fifa o melhor do mundo, em 2004 e 2005.  Também foi campeão italiano pelo Milan (2011), antes de voltar ao futebol brasileiro, para atuar no Flamengo, sem o mesmo sucesso obtido na Europa. Já no Atlético-MG, viveu seu último grande momento na carreira, com as conquistas da Copa Libertadores de 2013 e da Recopa Sul-Americana de 2014. ",esportes,         é o seu time do coração?   Sim Não  ,,"Ex-craque apresenta ""Fragmentos de um gaúcho"", com obras do artista mineiro Camaleão. Visitação do estádio terá um setor especial dedicado ao ex-craque",," Obrigado pela participação.  Nós usaremos esta informação para trazer mais novidades para você.  Por Allan Caldas e Thales Soares — Rio de Janeiro   28/02/2019 15h30    Atualizado  28/02/2019     Um craque que uniu futebol e arte como poucos nos gramados do mundo, Ronaldinho Gaúcho ganhou nesta quinta-feira um reconhecimento especial no Maracanã. Com a presença do ex-jogador da seleção brasileira, foram inauguradas uma estação dedicada à sua carreira na área de visitação do estádio e uma exposição com 11 quadros do artista mineiro Camaleão, que ficará em cartaz até 10 de março. - Feliz de voltar ao Maracanã recebendo esse presentão do meu amigo. É difícil até encontrar palavras para descrever essa emoção. Nunca pensei que isso fosse acontecer comigo quando eu parasse. É mais um presente - disse o craque.  - É maravilhoso ser lembrado nesse estádio. É uma das tristezas da época do Flamengo, de não ter jogado no Maracanã. Mesmo assim, ser homenageado é um presente que poucos têm oportunidade. Fico feliz - continuou.  Estação dedicada a Ronaldinho Gaúcho no tour do Maracanã — Foto: Allan Caldas  A estação sobre a carreira de Ronaldinho Gaúcho conta com um par de chuteiras usadas pelo jogador, uma camisa do Barcelona, onde ele brilhou entre 2003 e 2008, e as marcas dos pés do craque. Registradas em janeiro, as pegadas passaram as últimas semanas em processo de finalização para entrar na Calçada da Fama do estádio. Além de Ronaldinho, apenas outras três personalidades do futebol brasileiro contam com uma estação própria por lá: Pelé, Garrincha e Marta.  Sobre a exposição, Camaleão detalhou o desafio de registrar o craque. Os quadros não foram feitos com base em lances que de fato ocorreram. O artista deixou a imaginação fluir e demorou mais de um ano para finalizar o trabalho. Depois do Brasil, as obras devem passar uma temporada na Europa. Os destinos prováveis são Alemanha e Espanha. - A ideia da exposição foi não focar na história, na carreira, mas sim nos fragmentos do gênio. A primeira coisa que veio foi criar lances que não aconteceram, mas que nos pés do Ronaldo poderiam acontecer - explicou.  Quadros de Camaleão têm imagens de Ronaldinho em diversos clubes — Foto: Thales Soares/GloboEsporte.com  + Maracanã quer Neymar, Messi e outros astros internacionais na Calçada da Fama  + Fim do mistério: 73 peças perdidas são recuperadas e voltarão à Calçada da Fama  Na entrevista coletiva, o craque também falou sobre um assunto delicado: o passaporte retido pela Justiça. Acusados de crime ambiental, Ronaldinho e o irmão, Roberto Assis, tiveram os documentos apreendidos em novembro de 2018, em decisão da 1ª Câmara Cível do Tribunal de Justiça do Rio Grande do Sul (TJ-RS), a pedido do Ministério Público. O ex-jogador se esquivou:  - Tudo normal, tudo tranquilo.  Na seleção brasileira, Ronaldinho Gaúcho foi campeão mundial em 2002, na Copa do Mundo do Japão e da Coreia do Sul, e ganhou também a Copa América de 1999 e a Copa das Confederações de 2005, além do Mundial Sub-17, em 1997.  Ronaldinho Gaúcho Maracanã — Foto: Allan Caldas  Revelado pelo Grêmio, Ronaldinho chegou ao futebol europeu em 2001 para jogar no Paris Saint-Germain, mas foi no Barcelona que seu futebol ganhou reconhecimento mundial. Com jogadas mágicas, conduziu o time a dois títulos espanhóis (2005 e 2006), duas Supercopas da Espanha (2005 e 2006) e à sonhada Liga dos Campeões da Uefa, em 2006. Como jogador do Barcelona, R10 foi eleito duas vezes pela Fifa o melhor do mundo, em 2004 e 2005.  Também foi campeão italiano pelo Milan (2011), antes de voltar ao futebol brasileiro, para atuar no Flamengo, sem o mesmo sucesso obtido na Europa. Já no Atlético-MG, viveu seu último grande momento na carreira, com as conquistas da Copa Libertadores de 2013 e da Recopa Sul-Americana de 2014. Veja também",20.0
