,data,url_noticia,url_noticia_curto,titulo,conteudo_noticia,assunto,assunto_ex,titulo_ex,subtitulo_ex,local_ex,artigo_ex,n_paragrafos
15,2016-10-15,https://web.archive.org/web/20161015060035/http://globoesporte.globo.com/futebol/futebol-internacional/futebol-portugues/noticia/2016/10/helton-esclarece-rescisao-com-o-porto-em-momento-algum-houve-ma-fe.html,http://globoesporte.globo.com/futebol/futebol-internacional/futebol-portugues/noticia/2016/10/helton-esclarece-rescisao-com-o-porto-em-momento-algum-houve-ma-fe.html,Helton esclarece rescisão com o Porto e anuncia que deve encerrar carreira,"Helton da Silva Arruda, conhecido apenas pelo primeiro nome no universo do futebol, usou as redes sociais no início da noite desta quinta-feira para esclarecer a polêmica rescisão com o Porto - clube que defendia há 11 anos. E, em um vídeo com mais de seis minutos de duração (assista acima), anunciou que sua carreira como jogador de futebol provavelmente chegou ao fim.Na quinta, tornou-se pública a notícia de que o Porto não contava mais com o goleiro de 38 anos em seus planos. Tanto que, rapidamente, torcedores lotaram a página de Helton com mensagens de agradecimento. Em uma delas, ele respondeu dizendo que estava ""assustado por saber pelos jornais"" e cobrou o valor de 1,25 milhão de euros (cerca de R$ 4 milhões) declarado pelo clube pela quebra de contrato.+ Porto anuncia rescisão do contrato de Helton, e goleiro é pego de surpresaNesta sexta, no entanto, o discurso foi outro. O brasileiro fez questão de afirmar que não houve ""má fé"" por parte do clube português e disse, inclusive, que sabia da rescisão desde o final de junho.- Acho que depois disso tudo que vem acontecendo, chegou a hora de eu também poder colocar ainda melhor a minha ideia. Penso que, depois do dia 27 de junho, que foi quando fui informado que realmente não fazia parte dos planos, procurei me manter de lado. Infelizmente, mediante um comentário que eu fiz depois de me reunir algumas vezes, acabou por soar mal. A intenção foi de simplesmente vir aqui hoje para agradecer a vocês. Estive ontem, quinta-feira, numa conversa onde, mais uma vez, fui muito bem recebido pelo senhor presidente. Foi de uma forma mais que espontânea a conversa que nós tivemos, onde, graças a Deus, consegui ser esclarecido de várias situações que eu realmente não tinha conhecimento. Pode parecer que, com essas declarações do Helton, pode ter havido má fé. Não, em momento algum houve má fé, acredito eu. A única coisa que eu queria saber eram detalhes, quando realmente isso iria ser apresentado - dizia um pedaço da declaração.Aposentadoria?No fim do vídeo, Helton ainda reconhece que não pretende defender outro clube e que, portanto, provavelmente vai pendurar as chuteiras.- A princípio, não devo continuar no futebol enquanto jogador, mas tenho muita vontade de terminar o meu curso, muita vontade de dar continuidade dentro do futebol. Não, obviamente, nas quatro linhas - disse.Helton, até por ser goleiro, é um daqueles poucos jogadores com o número reduzido de clubes no currículo. Ele deu os primeiros passos no São Cristóvão, mas se transferiu para o Vasco da Gama ainda nas categorias de base. Pelo Cruz-Maltino, atuou profissionalmente entre 1998 e 2002. Antes de chegar ao Porto em 2005, ainda teve uma passagem de três anos pelo Leiria, também de Portugal. Tem, na bagagem, títulos como o do Brasileiro e da Copa Mercosul de 2000, o heptacampeonato da Primeira Liga e a Liga Europa da temporada 2010-11. Também vestiu a camisa da seleção brasileira e conquistou, por exemplo, a Copa América de 2007.",esportes,,Helton esclarece rescisão com o Porto e anuncia que deve encerrar carreira,"Goleiro de 38 anos conta que havia sido comunicado sobre dispensa, nega ""má fé"" por parte do clube português e diz que, ""a princípio, não deve continuar no futebol""","Porto, Portugal","Helton da Silva Arruda, conhecido apenas pelo primeiro nome no universo do futebol, usou as redes sociais no início da noite desta quinta-feira para esclarecer a polêmica rescisão com o Porto - clube que defendia há 11 anos. E, em um vídeo com mais de seis minutos de duração (assista acima), anunciou que sua carreira como jogador de futebol provavelmente chegou ao fim.Na quinta, tornou-se pública a notícia de que o Porto não contava mais com o goleiro de 38 anos em seus planos. Tanto que, rapidamente, torcedores lotaram a página de Helton com mensagens de agradecimento. Em uma delas, ele respondeu dizendo que estava ""assustado por saber pelos jornais"" e cobrou o valor de 1,25 milhão de euros (cerca de R$ 4 milhões) declarado pelo clube pela quebra de contrato.+ Porto anuncia rescisão do contrato de Helton, e goleiro é pego de surpresaNesta sexta, no entanto, o discurso foi outro. O brasileiro fez questão de afirmar que não houve ""má fé"" por parte do clube português e disse, inclusive, que sabia da rescisão desde o final de junho.- Acho que depois disso tudo que vem acontecendo, chegou a hora de eu também poder colocar ainda melhor a minha ideia. Penso que, depois do dia 27 de junho, que foi quando fui informado que realmente não fazia parte dos planos, procurei me manter de lado. Infelizmente, mediante um comentário que eu fiz depois de me reunir algumas vezes, acabou por soar mal. A intenção foi de simplesmente vir aqui hoje para agradecer a vocês. Estive ontem, quinta-feira, numa conversa onde, mais uma vez, fui muito bem recebido pelo senhor presidente. Foi de uma forma mais que espontânea a conversa que nós tivemos, onde, graças a Deus, consegui ser esclarecido de várias situações que eu realmente não tinha conhecimento. Pode parecer que, com essas declarações do Helton, pode ter havido má fé. Não, em momento algum houve má fé, acredito eu. A única coisa que eu queria saber eram detalhes, quando realmente isso iria ser apresentado - dizia um pedaço da declaração.Aposentadoria?No fim do vídeo, Helton ainda reconhece que não pretende defender outro clube e que, portanto, provavelmente vai pendurar as chuteiras.- A princípio, não devo continuar no futebol enquanto jogador, mas tenho muita vontade de terminar o meu curso, muita vontade de dar continuidade dentro do futebol. Não, obviamente, nas quatro linhas - disse.Helton, até por ser goleiro, é um daqueles poucos jogadores com o número reduzido de clubes no currículo. Ele deu os primeiros passos no São Cristóvão, mas se transferiu para o Vasco da Gama ainda nas categorias de base. Pelo Cruz-Maltino, atuou profissionalmente entre 1998 e 2002. Antes de chegar ao Porto em 2005, ainda teve uma passagem de três anos pelo Leiria, também de Portugal. Tem, na bagagem, títulos como o do Brasileiro e da Copa Mercosul de 2000, o heptacampeonato da Primeira Liga e a Liga Europa da temporada 2010-11. Também vestiu a camisa da seleção brasileira e conquistou, por exemplo, a Copa América de 2007.
    Os comentários são de responsabilidade exclusiva de seus autores e não representam a opinião deste site. Se achar algo que viole os
    termos de uso, denuncie. Leia as perguntas mais frequentes para saber o que é impróprio ou ilegal.
recentespopularesUm site de futebol pra vocês acompanharem o futebol, galera: Radar do Futebol: radardofutebol . com . br (junta link). Mais de 3000 seguidores! O site Fala por si! Valeu. Só em janeiro volto aqui!. Aproveitem pra seguir e conhecer!.UKUKU Petkovic lhe manda lembranças, vascaído!...kkkkkkkrecentespopularesAinda tá nessa filha? recentespopularesMarcos Alves. Não dá para esquecer, a tristeza do bacalhau é alegria nossa!Não volta pro Brasil por trauma de um gol aos 43 minutos do PET. Mengooooooooo nosso VASCÃO, ta de parabéns!!! é o único site que mais tem flamenguista, curtindo, comentando na nossa pagina, uma inveja horrível, do único que tem estadio próprio no rio. vascaino de verdade não curte pagina de urubu mulambento. sdvrecentespopularesMãs....????Pet mandou lembranças.Gol de Pet, 43 minutos do segundo tempo, isso nunca ele vai esquecer, kkkrecentespopularesJá deve ter esquecido, olha o currículo do cara p ficar lembrando de campeonato carioca kkk recentespopularesgoll do pet de novo de novo de novo kkkkk cara prefere para de joga para nao jogar a serie b kkkkkkkkkkk piada e jogar no vasco vai o flamengo chamar ele que vem louco mais flamengo nao quer essa bosta kkkkkkkkkParabéns pela brilhante carreira. Pena que não tenha dado continuidade no Vasco da Gama, mas com certeza alcançou conquistas brilhantes e grandes amizades. Tenha certeza de que obterá o mesmo sucesso fora das quatro linhas.Eles se esqueceram do principal item do currículo do Helton! O gol do Pet no segundo jogo da final do carioca de 2001!!!!recentespopularesDe falta! No ângulo! Tricampeão! 3x1...Aposto q esse cara ve o pet na rua virar a cara kkkkkrecentespopularesSEU C U Não foi esse que fez o gol do Pet ficar mais bonito em 2001?!recentespopularesSou mengo, porem grande goleiro, realmente a pintura do gol contou com a ponte dele, pra mim o lance em si completo foi um espetaculo, goleiro nunca sera lembrado apenas por frangos ou grandes defesas, mas sim tb por tentativas.
Sou flamenguista, mas esse se encerrar carreira posso dizer q foi um grande goleiro e profissional, uns q gostaria que tivesse defendido meu time, o gol do PET nao seria tao lindo se nao tivesse ele no gol devido a elasticidade do proprio na bola, essas coisas hj o futebol esta ficando carente, exemplo o muralha onde defende o time no qual eu torço ser convocado, isso e vergonha, futebol de empresario,  parabens ELTON pela sua carreira.elton vem pro verdao na liberta guerreiro e encerra em grande estilo campeao mundial.Foi um grande goleiro, so um grande defeito era em faltas, sempre ficava escondido atras da barreira e sempre levava os gols.Teve uma carreira digna, jogou 11 anos em uma Clube de ponta da Europa, não é pra qualquer um.recentespopularesclaro tem perdido na semi final pro vasco ate nisso vcs sao sujos ganha jogo com ajuda do juiz.recentespopulares1988Grande goleiro. Aos 43...lá vai Pet pra bola...gooollll...o Helton vai encerrar a carreira e está até hoje procurando a bola...kkkkVolta pra casa..... SVrecentespopularesAbraço do Pet.recentespopularesDoente !!!.PENSAVA  QUE JÁ TINHA MORRIDO...Quem é esse? Aquele que tomou o gol do Pet no Tri Vice?Helton , aquela bola do Pet nem o Muralha pegaria Uma bonita historia no futebol! Uma bandeira  no FC Porto. Parabéns Helton!Tá  ricasso . Pode parar e viver a vida tranqüilamente  . Sem se preocupar com a reforma da previdencia . Ou aposentar aos 65 .recentespopularesEntrou na vida do futebol. Encarou a ""loteria"" e venceu. Excelente profissional. Se aposentar agora, será mais do que merecido.Podia vir jogar no Vasquim asilo da colina e ser vice de novo ano que vem. Mas com gol de falta aos 43 do segundo tempoPelé do GOL, essa lenda vai fazer falta.recentespopularesPiada do Século  kkkkkkkkkkkkkkkkkkkkkrecentespopularesKkkk... Lenda??? Por que??? Quem é Helton na fila do pão??? Um bom goleiro. Mais nada.vai pro sao paulorecentespopularesUm site de futebol pra vocês acompanharem o futebol, galera: Radar do Futebol: radardofutebol . com . br (junta link). Mais de 3000 seguidores! O site Fala por si! Valeu. Só em janeiro volto aqui!. Aproveitem pra seguir e conhecer!.UKUKU Petkovic lhe manda lembranças, vascaído!...kkkkkkkrecentespopularesAinda tá nessa filha? recentespopularesMarcos Alves. Não dá para esquecer, a tristeza do bacalhau é alegria nossa!Não volta pro Brasil por trauma de um gol aos 43 minutos do PET. Mengooooooooo nosso VASCÃO, ta de parabéns!!! é o único site que mais tem flamenguista, curtindo, comentando na nossa pagina, uma inveja horrível, do único que tem estadio próprio no rio. vascaino de verdade não curte pagina de urubu mulambento. sdvrecentespopularesMãs....????Pet mandou lembranças.Gol de Pet, 43 minutos do segundo tempo, isso nunca ele vai esquecer, kkkrecentespopularesJá deve ter esquecido, olha o currículo do cara p ficar lembrando de campeonato carioca kkk recentespopularesgoll do pet de novo de novo de novo kkkkk cara prefere para de joga para nao jogar a serie b kkkkkkkkkkk piada e jogar no vasco vai o flamengo chamar ele que vem louco mais flamengo nao quer essa bosta kkkkkkkkkParabéns pela brilhante carreira. Pena que não tenha dado continuidade no Vasco da Gama, mas com certeza alcançou conquistas brilhantes e grandes amizades. Tenha certeza de que obterá o mesmo sucesso fora das quatro linhas.Eles se esqueceram do principal item do currículo do Helton! O gol do Pet no segundo jogo da final do carioca de 2001!!!!recentespopularesDe falta! No ângulo! Tricampeão! 3x1...Aposto q esse cara ve o pet na rua virar a cara kkkkkrecentespopularesSEU C U Não foi esse que fez o gol do Pet ficar mais bonito em 2001?!recentespopularesSou mengo, porem grande goleiro, realmente a pintura do gol contou com a ponte dele, pra mim o lance em si completo foi um espetaculo, goleiro nunca sera lembrado apenas por frangos ou grandes defesas, mas sim tb por tentativas.
Sou flamenguista, mas esse se encerrar carreira posso dizer q foi um grande goleiro e profissional, uns q gostaria que tivesse defendido meu time, o gol do PET nao seria tao lindo se nao tivesse ele no gol devido a elasticidade do proprio na bola, essas coisas hj o futebol esta ficando carente, exemplo o muralha onde defende o time no qual eu torço ser convocado, isso e vergonha, futebol de empresario,  parabens ELTON pela sua carreira.elton vem pro verdao na liberta guerreiro e encerra em grande estilo campeao mundial.Foi um grande goleiro, so um grande defeito era em faltas, sempre ficava escondido atras da barreira e sempre levava os gols.Teve uma carreira digna, jogou 11 anos em uma Clube de ponta da Europa, não é pra qualquer um.recentespopularesclaro tem perdido na semi final pro vasco ate nisso vcs sao sujos ganha jogo com ajuda do juiz.recentespopulares1988Grande goleiro. Aos 43...lá vai Pet pra bola...gooollll...o Helton vai encerrar a carreira e está até hoje procurando a bola...kkkkVolta pra casa..... SVrecentespopularesAbraço do Pet.recentespopularesDoente !!!.PENSAVA  QUE JÁ TINHA MORRIDO...Quem é esse? Aquele que tomou o gol do Pet no Tri Vice?Helton , aquela bola do Pet nem o Muralha pegaria Uma bonita historia no futebol! Uma bandeira  no FC Porto. Parabéns Helton!Tá  ricasso . Pode parar e viver a vida tranqüilamente  . Sem se preocupar com a reforma da previdencia . Ou aposentar aos 65 .recentespopularesEntrou na vida do futebol. Encarou a ""loteria"" e venceu. Excelente profissional. Se aposentar agora, será mais do que merecido.Podia vir jogar no Vasquim asilo da colina e ser vice de novo ano que vem. Mas com gol de falta aos 43 do segundo tempoPelé do GOL, essa lenda vai fazer falta.recentespopularesPiada do Século  kkkkkkkkkkkkkkkkkkkkkrecentespopularesKkkk... Lenda??? Por que??? Quem é Helton na fila do pão??? Um bom goleiro. Mais nada.vai pro sao paulo18Out19:0115Out18:4913Out17:0511:1206Out10:2601Out09:0527Set17:4826Set16:4008:5923Set17:0613Out17:0528Jun10:3720Jan20:3414Jan18:25",193.0
