,data,url_noticia,url_noticia_curto,titulo,conteudo_noticia,assunto,assunto_ex,titulo_ex,subtitulo_ex,local_ex,artigo_ex,n_paragrafos
10,2016-01-17,https://web.archive.org/web/20160118042634/http://sportv.globo.com/site/combate/noticia/2016/01/dominick-cruz-provoca-dillashaw-que-nao-responde-na-pesagem-em-boston.html,http://sportv.globo.com/site/combate/noticia/2016/01/dominick-cruz-provoca-dillashaw-que-nao-responde-na-pesagem-em-boston.html,"Dominick Cruz provoca Dillashaw, que não responde na pesagem em Boston","Se as encaradas não foram tão quentes, a provocação levantou o público na pesagem do ""UFC: Dillashaw x Cruz"", que aconteceu neste sábado, em Boston (EUA). Protagonistas da luta principal, que vale o cinturão dos pesos-galos da organização, TJ Dillashaw e Dominick Cruz adotaram posturas diferentes após descerem da balança e se encararem. Enquanto Cruz olhava Dillashaw de cima, por ser mais alto, e o provocava verbalmente, o campeão apenas sorria e mascava chicletes sem dizer uma palavra. Ambos os lutadores bateram o peso, e Cruz foi muito aplaudido pelo público presente ao evento, enquanto Dillashaw recebeu muitas vaias.Famoso por suas brincadeiras durante as encaradas pós-pesagem, o meio-pesado Sean O'Connell surpreendeu e ofereceu flores ao rival, o sueco Ilir Laitifi. Latifi devolveu a gentileza dando de presente a O'Connell um saco de salgadinhos, que ambos saborearam ainda no palco, arrancando risos de Dana White.No co-evento principal da noite, Anthony Pettis e Eddie Alvarez fizeram uma encarada dura, mas sem provocações ou agressões. O momento mais tenso da pesagem foi a encarada entre Charles Rosa e Kyle Bochniak. O segundo, estreante no UFC, empolgou-se e chegou a tocar a testa do rival, sendo necessário que Dana White os separasse.Os dois representantes brasileiros no evento, Francimar Bodão e Francisco Massaranduba, bateram o peso sem problemas e garantiram presença nos duelos contra, respectivamente, Elvis Mutapcic e Ross Pearson.Confira os demais vídeos da pesagem:O Combate transmite com exclusividade, na íntegra e ao vivo o ""UFC: Dillashaw x Cruz"" neste domingo, a partir de 20h45m (de Brasília). O Combate.com acompanha o torneio em Tempo Real, e transmite em vídeo as duas primeiras lutas do card preliminar, entre os meio-pesados Francimar Bodão e Elvis Mutapcic, e os pesos-galos Rob Font e Joey Gomez.Confira os pesos dos atletas:CARD PRINCIPALPeso-galo (até 61,2kg) *: TJ Dillashaw (61,2kg) x Dominick Cruz (61,2kg)Peso-leve (até 70,8kg): Anthony Pettis (70,5kg) x Eddie Alvarez (70,5kg)Peso-pesado (até 120,7kg): Travis Browne (108kg) x Matt Mitrione (112,9kg)Peso-leve (até 70,8kg): Ross Pearson (70,3kg) x Francisco Massaranduba (70,5kg)CARD PRELIMINARPeso-meio-médio (até 77,6kg): Patrick Côté (77,6kg) x Ben Saunders (77,1kg)Peso-meio-pesado (até 93,4kg): Tim Boetsch (93,4kg) x Ed Herman (92,8kg)Peso-leve (até 70,8kg): Chris Wade (70,5kg) x Mehdi Baghdad (70,8kg)Peso-pena (até 66,2kg): Maximo Blanco (66,2kg) x Luke Sanders (66kg)Peso-leve (até 70,8kg): Paul Felder (70,5kg) x Daron Cruickshank (70,3kg)Peso-meio-pesado (até 93,4kg): Ilir Latifi (93kg) x Sean O'Connell (93,2kg)Peso-pena (até 66,2kg): Charles Rosa (66kg) x Kyle Bochniak (65,8kg)Peso-galo (até 61,7kg): Rob Font (61,2kg) x Joey Gomez (61,2kg)Peso-meio-pesado (até 93,4kg): Francimar Bodão (93kg) x Elvis Mutapcic (91,2kg)* Não há tolerância de uma libra (ou 0,454kg) por ser uma disputa de cinturão",esportes,,"Dominick Cruz provoca Dillashaw, que não responde na pesagem em Boston","Peso-meio-pesado Sean O'Connell, famoso por surpreender nas encaradas, oferece flores a Ilir Latifi, que retribui com salgadinhos. Massaranduba e Bodão batem o peso","Boston, EUA","Se as encaradas não foram tão quentes, a provocação levantou o público na pesagem do ""UFC: Dillashaw x Cruz"", que aconteceu neste sábado, em Boston (EUA). Protagonistas da luta principal, que vale o cinturão dos pesos-galos da organização, TJ Dillashaw e Dominick Cruz adotaram posturas diferentes após descerem da balança e se encararem. Enquanto Cruz olhava Dillashaw de cima, por ser mais alto, e o provocava verbalmente, o campeão apenas sorria e mascava chicletes sem dizer uma palavra. Ambos os lutadores bateram o peso, e Cruz foi muito aplaudido pelo público presente ao evento, enquanto Dillashaw recebeu muitas vaias.Famoso por suas brincadeiras durante as encaradas pós-pesagem, o meio-pesado Sean O'Connell surpreendeu e ofereceu flores ao rival, o sueco Ilir Laitifi. Latifi devolveu a gentileza dando de presente a O'Connell um saco de salgadinhos, que ambos saborearam ainda no palco, arrancando risos de Dana White.No co-evento principal da noite, Anthony Pettis e Eddie Alvarez fizeram uma encarada dura, mas sem provocações ou agressões. O momento mais tenso da pesagem foi a encarada entre Charles Rosa e Kyle Bochniak. O segundo, estreante no UFC, empolgou-se e chegou a tocar a testa do rival, sendo necessário que Dana White os separasse.Os dois representantes brasileiros no evento, Francimar Bodão e Francisco Massaranduba, bateram o peso sem problemas e garantiram presença nos duelos contra, respectivamente, Elvis Mutapcic e Ross Pearson.Confira os demais vídeos da pesagem:O Combate transmite com exclusividade, na íntegra e ao vivo o ""UFC: Dillashaw x Cruz"" neste domingo, a partir de 20h45m (de Brasília). O Combate.com acompanha o torneio em Tempo Real, e transmite em vídeo as duas primeiras lutas do card preliminar, entre os meio-pesados Francimar Bodão e Elvis Mutapcic, e os pesos-galos Rob Font e Joey Gomez.Confira os pesos dos atletas:CARD PRINCIPALPeso-galo (até 61,2kg) *: TJ Dillashaw (61,2kg) x Dominick Cruz (61,2kg)Peso-leve (até 70,8kg): Anthony Pettis (70,5kg) x Eddie Alvarez (70,5kg)Peso-pesado (até 120,7kg): Travis Browne (108kg) x Matt Mitrione (112,9kg)Peso-leve (até 70,8kg): Ross Pearson (70,3kg) x Francisco Massaranduba (70,5kg)CARD PRELIMINARPeso-meio-médio (até 77,6kg): Patrick Côté (77,6kg) x Ben Saunders (77,1kg)Peso-meio-pesado (até 93,4kg): Tim Boetsch (93,4kg) x Ed Herman (92,8kg)Peso-leve (até 70,8kg): Chris Wade (70,5kg) x Mehdi Baghdad (70,8kg)Peso-pena (até 66,2kg): Maximo Blanco (66,2kg) x Luke Sanders (66kg)Peso-leve (até 70,8kg): Paul Felder (70,5kg) x Daron Cruickshank (70,3kg)Peso-meio-pesado (até 93,4kg): Ilir Latifi (93kg) x Sean O'Connell (93,2kg)Peso-pena (até 66,2kg): Charles Rosa (66kg) x Kyle Bochniak (65,8kg)Peso-galo (até 61,7kg): Rob Font (61,2kg) x Joey Gomez (61,2kg)Peso-meio-pesado (até 93,4kg): Francimar Bodão (93kg) x Elvis Mutapcic (91,2kg)* Não há tolerância de uma libra (ou 0,454kg) por ser uma disputa de cinturão
    Os comentários são de responsabilidade exclusiva de seus autores e não representam a opinião deste site. Se achar algo que viole os
    termos de uso, denuncie. Leia as perguntas mais frequentes para saber o que é impróprio ou ilegal.
recentespopularesFala galera! Temos um grupo no Whats sobre MMA, quem tiver interesse em participar sera muito bem vindo, deixem os numeros abaixo... recentespopulares(073) 981268955recentespopulares(61) 8568-0203Será que o Cruz para o Dillashaw?recentespopularesPara e parou tranquilamente, porque o tal Dillashaw é uma piada, ganhou do Barão porque o brasileiro tem dificuldades em descer de peso.bodao fez uma luta meia boca com um cara que aceitou a luta em cima da hr. SE APOSENTA DEDÉ vc ja esta ultrapassadoVOTE: Quem é o maior ""brazilian killer""? 1) Jon Jones, 2) Weidman, 3) Dillashaw, 4) McGregor, 5) Schumacher, 6) Lewis Hamilton, 7x1) Thomas Muller, 8) Zinedine ZidanerecentespopularesSem dúvida é Zidane. Mas McMagrelo nessa lista não faz o menor sentido, melhor troca-lo por Romero bombadãorecentespopularesweidman sem duvidasvou verr ainda Pettis vs CruzrecentespopularesImprovável. existe um oceano de peso entre galos e leves, parceirorecentespopularesmais um mongoloide... nao quer ver connor vs werdum tbm?WWE tem mais verdade que a farsa do UFC...kkkkrecentespopularesSim sim,  a canela do Anderson Silva quebrada era da Barbie,  ele pegou emprestado pra quebrar no meio quando ele chutou! UFC é farsa, até WWE tem mais verdade...kkkkJohnson, Cruz, Aldo, Dos Anjos, Lawler, Spider, Jones e Werdum. Campeões em Janeiro/2017 podem anotar!recentespopularesJohnson, Dillashaw, Edgar, Conor, Lawler, Weidman, Jones, Cain. recentespopularesTiago espero q sejá assim ! E fulano tal,  você está pensando igual eu,  essa luta do Anderson vai dizer se ele pode ter esperança oi se aposentar,  porque o Bisping é mediano e de ele ser muito superior ele tem chances sim Quem viu a ultima luta do Cruz (também depois de um tempo parado por contusão) não tem duvida que ele vai passar por cima do Dillashaw hoje...Alem de ser tao rápido, ele e' maior e mais forte...Essa luta nao passa do primeiro round.Os rancorosos tupiniquins se travestem de cheerleaders de Cruz, na expectativa deste lavar com sangue a honra baronesca, depois deste ter sido mutilado duas vezes por Dillashaw. É isso mesmo tupiniquins, calcem seu arco e flecha, coloquem seu protetor genital e vão nessa!recentespopularesO destruidor que esteve ""machucado"" eNquanto Renan do Cajueiro reinou na categoria. Agora que Dillashaw fez o servicinho sujo por ele, o Souza Cruz volta com força total sem nenhum lesão. Coincidências!!!recentespopularesesse card de hj ta fera. As lutas do Cruz sao feras. Dj tilashow tbm ta lutando bem tomara que um arranque a cabeça do outroDillashaw fez o imenso favor de eliminar a farsa Renan Barão. Então minha torcida é pra elerecentespopularesmais um brasileiro baba-ka...recentespopularesEliminar do que cara?O poderosíssimo nocauteador e finalizador Michael Bisping - mais um adversário escolhido a dedo por Anderson Silva - deveria ofertá-lo uma caixa de viagra na pesagem. Aliás um dos seus dificílimos oponentes - Patrick Côté - vai lutar amanhã e se perder, Silva cogitará fortemente ceder a revanche a ele, já que gosta tanto de reais desafios!recentespopularesficou histérico, acusou o golpe rsrsrsrsrsrecentespopularesE você ficou excitado: acusou a chu.pa.da!galera boa tarde quem quiser participar de um grupo de mma e esportes em geral é só deixar o número nos comentários o principal foco é o mma!Comentário de ""O Proctologista"": ""Meu na moral, vou organizar uma luta minha contra o chimpanzé que meu vizinho tem. Dizem que um chimpanzé pode ser até 3 vezes mais forte que um ser humano e estou determinado a mostrar que não. Realizaremos a luta em uma rinha de briga de galo mesmo, já que não achei um octógono pra alugar. Quem quiser participar, o ingresso tem um custo de R$30,00. E será transmitido ao vivo pelo HitBox. Compareça!"".recentespopularescácácácáaaaarecentespopularesPoncio Pilatos, o rei dos comentários deste site, pra desespero das ufanistas politicamente corretas que ainda imperam por aqui, por enquanto!MMA NÃO PASSA DE UMA RINHA HUMANA, GENTE PSICOPATA TENTANDO SE MATAR PARA UMA AUDIÊNCIA DE ADOLESCESTES PROBLEMÁTICOS !!!!!!!!!!!!!!!!!!!!recentespopularesESSE PROCTOLOGISTA NÃO AGUENTA VER UMA C  A  C   Ê   TA DURArecentespopularesKkkkkkkkkkkkkkkkkkkkkkkkkkkkkkEssa balança é do PT. recentespopularesKkkkkkkk boa mano...Já ouviu falar em g.oz.ar com o p.au dos outros? Pois é... é isso que os BRs estão fazendo torcendo pro CruzrecentespopularesPERFEITO SUZANO, ELES PRECISAM G   O   Z  A   R COM OS P   A   U   S   ALHEIOS, POIS SUAS VIDAS DESGRAÇADAS TORNAM-SE MENOS SOFRIDAS...MAS EU NÃO IREI ME CALAR...ESSES DESGRAÇADOS PRECISAM OUVIR A VERDADE...O MMA NACIONAL TEM QUE ACABARrecentespopularesNão pode torcer pro Cruz não?
Geral ta falando de quanto o Cruz é bom e tudo... Mas o TJ não chegou lá a toa,grande campeão e tem um footwork mt bom Tbm , vai ser um lutaço,mas torço pra ele cruz e t.j. tem um jogo muito parecido!!! sendo q o atual momento de t.j. ta excelente!!! e torcerei pra massaranduba , q parece ser um cara bem simples e humilde!!!Dominick FTW,  piriquito suck upque balança maais sem vergonha essa da  pesagem do ufc  kkkkkkHoje tem luta da Cyborg e o combate não vai transmitir que legal.recentespopularesLuta da Cyborg com 2 canais para escolher: wp.me/p6LiKs-8nrecentespopularesSó se for o canal do seu reto!!!!!!!!!Aposto no Cruz, lutadoraço!recentespopulares""Pedro Santos"" n quer dizer nada, tem milhares...recentespopularesMas esse tal de 'Pôncio' é o mais engraçado, véi. Não sabe (ou finge não saber) de nada e fica polemizando. Pedrão, relaxa...as viúva do renan bobão pira quando vê o dillashow lutando com a guarda baixa humilhando seus adversários...porém, cruz é demais. A luta terminará com um empate no 2 roundrecentespopularesParei no ""as viúva"". Com certeza o resto é m4rda!!recentespopularesmarcelo sousa, vá a M   E    R    D   ANão torcemos para o Cruz porque T.J ganhou o Barão,torcemos pq o Dominick é o melhor,é o verdadeiro campeão dessa categoria.recentespopularesFalou tudo cara.recentespopularesFala galera! Temos um grupo no Whats sobre MMA, quem tiver interesse em participar sera muito bem vindo, deixem os numeros abaixo... recentespopulares(073) 981268955recentespopulares(61) 8568-0203Será que o Cruz para o Dillashaw?recentespopularesPara e parou tranquilamente, porque o tal Dillashaw é uma piada, ganhou do Barão porque o brasileiro tem dificuldades em descer de peso.bodao fez uma luta meia boca com um cara que aceitou a luta em cima da hr. SE APOSENTA DEDÉ vc ja esta ultrapassadoVOTE: Quem é o maior ""brazilian killer""? 1) Jon Jones, 2) Weidman, 3) Dillashaw, 4) McGregor, 5) Schumacher, 6) Lewis Hamilton, 7x1) Thomas Muller, 8) Zinedine ZidanerecentespopularesSem dúvida é Zidane. Mas McMagrelo nessa lista não faz o menor sentido, melhor troca-lo por Romero bombadãorecentespopularesweidman sem duvidasvou verr ainda Pettis vs CruzrecentespopularesImprovável. existe um oceano de peso entre galos e leves, parceirorecentespopularesmais um mongoloide... nao quer ver connor vs werdum tbm?WWE tem mais verdade que a farsa do UFC...kkkkrecentespopularesSim sim,  a canela do Anderson Silva quebrada era da Barbie,  ele pegou emprestado pra quebrar no meio quando ele chutou! UFC é farsa, até WWE tem mais verdade...kkkkJohnson, Cruz, Aldo, Dos Anjos, Lawler, Spider, Jones e Werdum. Campeões em Janeiro/2017 podem anotar!recentespopularesJohnson, Dillashaw, Edgar, Conor, Lawler, Weidman, Jones, Cain. recentespopularesTiago espero q sejá assim ! E fulano tal,  você está pensando igual eu,  essa luta do Anderson vai dizer se ele pode ter esperança oi se aposentar,  porque o Bisping é mediano e de ele ser muito superior ele tem chances sim Quem viu a ultima luta do Cruz (também depois de um tempo parado por contusão) não tem duvida que ele vai passar por cima do Dillashaw hoje...Alem de ser tao rápido, ele e' maior e mais forte...Essa luta nao passa do primeiro round.Os rancorosos tupiniquins se travestem de cheerleaders de Cruz, na expectativa deste lavar com sangue a honra baronesca, depois deste ter sido mutilado duas vezes por Dillashaw. É isso mesmo tupiniquins, calcem seu arco e flecha, coloquem seu protetor genital e vão nessa!recentespopularesO destruidor que esteve ""machucado"" eNquanto Renan do Cajueiro reinou na categoria. Agora que Dillashaw fez o servicinho sujo por ele, o Souza Cruz volta com força total sem nenhum lesão. Coincidências!!!recentespopularesesse card de hj ta fera. As lutas do Cruz sao feras. Dj tilashow tbm ta lutando bem tomara que um arranque a cabeça do outroDillashaw fez o imenso favor de eliminar a farsa Renan Barão. Então minha torcida é pra elerecentespopularesmais um brasileiro baba-ka...recentespopularesEliminar do que cara?O poderosíssimo nocauteador e finalizador Michael Bisping - mais um adversário escolhido a dedo por Anderson Silva - deveria ofertá-lo uma caixa de viagra na pesagem. Aliás um dos seus dificílimos oponentes - Patrick Côté - vai lutar amanhã e se perder, Silva cogitará fortemente ceder a revanche a ele, já que gosta tanto de reais desafios!recentespopularesficou histérico, acusou o golpe rsrsrsrsrsrecentespopularesE você ficou excitado: acusou a chu.pa.da!galera boa tarde quem quiser participar de um grupo de mma e esportes em geral é só deixar o número nos comentários o principal foco é o mma!Comentário de ""O Proctologista"": ""Meu na moral, vou organizar uma luta minha contra o chimpanzé que meu vizinho tem. Dizem que um chimpanzé pode ser até 3 vezes mais forte que um ser humano e estou determinado a mostrar que não. Realizaremos a luta em uma rinha de briga de galo mesmo, já que não achei um octógono pra alugar. Quem quiser participar, o ingresso tem um custo de R$30,00. E será transmitido ao vivo pelo HitBox. Compareça!"".recentespopularescácácácáaaaarecentespopularesPoncio Pilatos, o rei dos comentários deste site, pra desespero das ufanistas politicamente corretas que ainda imperam por aqui, por enquanto!MMA NÃO PASSA DE UMA RINHA HUMANA, GENTE PSICOPATA TENTANDO SE MATAR PARA UMA AUDIÊNCIA DE ADOLESCESTES PROBLEMÁTICOS !!!!!!!!!!!!!!!!!!!!recentespopularesESSE PROCTOLOGISTA NÃO AGUENTA VER UMA C  A  C   Ê   TA DURArecentespopularesKkkkkkkkkkkkkkkkkkkkkkkkkkkkkkEssa balança é do PT. recentespopularesKkkkkkkk boa mano...Já ouviu falar em g.oz.ar com o p.au dos outros? Pois é... é isso que os BRs estão fazendo torcendo pro CruzrecentespopularesPERFEITO SUZANO, ELES PRECISAM G   O   Z  A   R COM OS P   A   U   S   ALHEIOS, POIS SUAS VIDAS DESGRAÇADAS TORNAM-SE MENOS SOFRIDAS...MAS EU NÃO IREI ME CALAR...ESSES DESGRAÇADOS PRECISAM OUVIR A VERDADE...O MMA NACIONAL TEM QUE ACABARrecentespopularesNão pode torcer pro Cruz não?
Geral ta falando de quanto o Cruz é bom e tudo... Mas o TJ não chegou lá a toa,grande campeão e tem um footwork mt bom Tbm , vai ser um lutaço,mas torço pra ele cruz e t.j. tem um jogo muito parecido!!! sendo q o atual momento de t.j. ta excelente!!! e torcerei pra massaranduba , q parece ser um cara bem simples e humilde!!!Dominick FTW,  piriquito suck upque balança maais sem vergonha essa da  pesagem do ufc  kkkkkkHoje tem luta da Cyborg e o combate não vai transmitir que legal.recentespopularesLuta da Cyborg com 2 canais para escolher: wp.me/p6LiKs-8nrecentespopularesSó se for o canal do seu reto!!!!!!!!!Aposto no Cruz, lutadoraço!recentespopulares""Pedro Santos"" n quer dizer nada, tem milhares...recentespopularesMas esse tal de 'Pôncio' é o mais engraçado, véi. Não sabe (ou finge não saber) de nada e fica polemizando. Pedrão, relaxa...as viúva do renan bobão pira quando vê o dillashow lutando com a guarda baixa humilhando seus adversários...porém, cruz é demais. A luta terminará com um empate no 2 roundrecentespopularesParei no ""as viúva"". Com certeza o resto é m4rda!!recentespopularesmarcelo sousa, vá a M   E    R    D   ANão torcemos para o Cruz porque T.J ganhou o Barão,torcemos pq o Dominick é o melhor,é o verdadeiro campeão dessa categoria.recentespopularesFalou tudo cara.18Jan13:4813:1312:0711:5711:3711:1511:1210:0009:4705:2018Jan11:3710:0005:2004:4403:5002:1600:4417Jan14:0508:0015Jan08:0018Jan11:3710:0005:2004:4403:5002:3002:1600:4417Jan20:3414:0518Jan11:3711:3110:0007:3005:2004:4403:5002:3002:1600:4418Jan03:5017Jan08:0011Jan12:1311:3110Jan08:0006Jan09:0017Dez11:4610Out08:0029Set11:3128Set09:2518Jan10:0005:2004:4403:5015Jan08:0013Jan08:0012Jan16:1311:2810:0009Jan12:0018Jan03:5017Jan08:0011Jan12:1310Jan08:0009Set16:5615Jun19:0514Jun01:1812Jun08:0023Fev20:1318Jan11:3117Jan14:0514Jan15:2311Jan17:5008Jan11:4514Dez15:2222Nov13:0023Out16:0000:4801Out10:0018Jan02:1613Jan14:0931Dez01:0030Out00:3025Ago22:3422Ago19:5418Ago09:0018Jun13:0630Mai11:0022Mai19:1818Jan10:0005:2004:4403:5015Jan08:0013Jan08:0012Jan16:1311:28",471.0
