,data,url_noticia,url_noticia_curto,titulo,conteudo_noticia,assunto,assunto_ex,titulo_ex,subtitulo_ex,local_ex,artigo_ex,n_paragrafos
33,2019-03-09,https://web.archive.org/web/20190309213407/https://globoesporte.globo.com/go/futebol/times/goias/noticia/barbieri-explica-perfil-de-contratacoes-do-goias-e-da-aval-para-chegada-de-giovanni-augusto.ghtml,https://globoesporte.globo.com/go/futebol/times/goias/noticia/barbieri-explica-perfil-de-contratacoes-do-goias-e-da-aval-para-chegada-de-giovanni-augusto.ghtml,Barbieri explica perfil de contratações do Goiás e dá aval para chegada de Giovanni Augusto," Sidão, Renatinho, Marlone, Yago... Jogadores que já haviam mostrado potencial, mas que não foram bem em 2018 e ganharam uma oportunidade de dar a volta por cima pelo Goiás. O próximo a ter essa chance deve ser Giovanni Augusto. Encostado no Corinhians, o meia de 29 anos tem o aval do técnico Maurício Barbieri, que falou sobre a política de contratações do verdão nesta temporada.  - Giovanni é um jogador que interessa pela qualidade que sabemos que tem. Teve um ano difícil no ano passado em função das lesões, e acaba que temos conseguido trazer jogadores mais com esse perfil. Com o intuito de recuperar a boa forma deles. Acho que temos feito isso bem. Os exemplos são os jogadores que estão se destacando no elenco. Se formos lembrar, nenhum deles fez um grande ano em 2018, tirando o Rafael Vaz, que foi eleito o melhor zagueiro do futebol chileno. Os outros vieram com essa expectativa de recuperar seu espaço e o bom futebol. Isso é positivo, ter jogadores com ambição e que querem mostrar. O Giovanni se encaixa nisso. Se vier, vai ser uma grande aquisição.  Enquanto Giovanni Augusto está próximo de chegar ao clube, Elyeser já partiu. Após se recuperar de uma lesão que o tirou dos gramados por quase todo o ano de 2018, o volante teve poucas chances com Barbieri e rescindiu para fechar em definitivo com o Coritiba.  - Foi um consenso. Elyeser não vinha jogando. Temos jogadores que vêm tendo um desempenho à frente dele. Para ele, era importante jogar. Estava em final de contrato, e foi de comum acordo de todas as partes. Ele seguiu a vida dele e vai ser feliz no Coritiba. Abrimos lacuna até para buscar mais reforços e trazer jogadores que possam ajudar o Goiás.  Neste domingo o Goiás busca a 10ª vitória em 10 partidas no Campeonato Goiano. O Verdão visita o Novo Horizonte, em Ipameri. A provável escalação é: Sidão; Kevin, David Duarte, Rafael Vaz e Marcelo Hermes; Geovane, Léo Sena, Renatinho e Marlone; Michael e Brenner. ",esportes,         é o seu time do coração?   Sim Não  ,,"Segundo o técnico esmeraldino, clube busca atletas que não vinham bem, mas que ""têm ambição e que querem mostrar"" serviço. Ele também comentou sobre a saída de Elyeser",," Obrigado pela participação.  Nós usaremos esta informação para trazer mais novidades para você.  Por Guilherme Gonçalves — Goiânia   09/03/2019 17h27    Atualizado  09/03/2019     Sidão, Renatinho, Marlone, Yago... Jogadores que já haviam mostrado potencial, mas que não foram bem em 2018 e ganharam uma oportunidade de dar a volta por cima pelo Goiás. O próximo a ter essa chance deve ser Giovanni Augusto. Encostado no Corinhians, o meia de 29 anos tem o aval do técnico Maurício Barbieri, que falou sobre a política de contratações do verdão nesta temporada.  - Giovanni é um jogador que interessa pela qualidade que sabemos que tem. Teve um ano difícil no ano passado em função das lesões, e acaba que temos conseguido trazer jogadores mais com esse perfil. Com o intuito de recuperar a boa forma deles. Acho que temos feito isso bem. Os exemplos são os jogadores que estão se destacando no elenco. Se formos lembrar, nenhum deles fez um grande ano em 2018, tirando o Rafael Vaz, que foi eleito o melhor zagueiro do futebol chileno. Os outros vieram com essa expectativa de recuperar seu espaço e o bom futebol. Isso é positivo, ter jogadores com ambição e que querem mostrar. O Giovanni se encaixa nisso. Se vier, vai ser uma grande aquisição.  Maurício Barbieri fala sobre o interesse em Giovanni Augusto — Foto: Rosiron Rodrigues  Enquanto Giovanni Augusto está próximo de chegar ao clube, Elyeser já partiu. Após se recuperar de uma lesão que o tirou dos gramados por quase todo o ano de 2018, o volante teve poucas chances com Barbieri e rescindiu para fechar em definitivo com o Coritiba.  - Foi um consenso. Elyeser não vinha jogando. Temos jogadores que vêm tendo um desempenho à frente dele. Para ele, era importante jogar. Estava em final de contrato, e foi de comum acordo de todas as partes. Ele seguiu a vida dele e vai ser feliz no Coritiba. Abrimos lacuna até para buscar mais reforços e trazer jogadores que possam ajudar o Goiás.  Neste domingo o Goiás busca a 10ª vitória em 10 partidas no Campeonato Goiano. O Verdão visita o Novo Horizonte, em Ipameri. A provável escalação é: Sidão; Kevin, David Duarte, Rafael Vaz e Marcelo Hermes; Geovane, Léo Sena, Renatinho e Marlone; Michael e Brenner. Feliz no Goiás, Marlone diz para Giovanni Augusto: ""Pode vir de olhos fechados""Veja também",11.0
34,2019-03-12,https://web.archive.org/web/20190312090041/https://globoesporte.globo.com/sp/santos-e-regiao/futebol/times/santos/noticia/idolo-do-santos-e-campeao-do-mundo-em-1962-coutinho-morre-aos-75-anos.ghtml,https://globoesporte.globo.com/sp/santos-e-regiao/futebol/times/santos/noticia/idolo-do-santos-e-campeao-do-mundo-em-1962-coutinho-morre-aos-75-anos.ghtml,"Ídolo do Santos e campeão do mundo em 1962, Coutinho morre aos 75 anos"," Morreu nesta segunda-feira o ex-atacante Coutinho, um dos maiores ídolos da história do Santos e campeão do mundo em 1962, na Copa do Mundo disputada no Chile. Ele tinha 75 anos.  Segundo o médico Milton Mattozinho, a causa foi um infarto agudo do miocárdio em decorrência de diabetes e hipertensão arterial sistêmica.  O velório será realizado a partir das primeiras horas desta terça-feira no salão de mármore da Vila Belmiro. O sepultamento está marcado para 18h, no cemitério Memorial.  O Santos prestou homenagem ao ex-jogador com uma postagem nas redes sociais:  Coutinho tinha diabetes, doença que levou à amputação de três dedos do pé esquerdo. Em janeiro, ele foi internado em Santos com uma pneumonia.  Antônio Wilson Honório nasceu em Piracicaba em 11 de junho de 1943. Ele estreou no Santos em 1958, quando tinha apenas 14 anos. Defendeu o time até 1967 e depois entre 1969 e 1970.  É o terceiro maior artilheiro da história do clube, com 368 gols em 457 jogos, atrás de Pepe, com 403 gols, e Pelé, com 1.091 gols.  O Rei do Futebol afirmou a dupla com Coutinho fez o Brasil ficar mais conhecido no mundo. E disse que um dia fará ""tabelinha"" com o ex-companheiro ""no céu"".  No Santos, Coutinho formou o lendário ataque com Dorval, Mengálvio, Coutinho, Pelé e Pepe. Foi campeão paulista em 1960, 1961, 1962, 1964, 1965 e 1967, venceu cinco vezes a Taça Brasil, de 1961 a 1965, depois reconhecida como Brasileiro, além das Libertadores e dos Mundiais de Clubes de 1962 e 1963.  À Rádio Bandeirantes, Pepe comentou sobre a morte de Coutinho:  – Encontrei o Coutinho há pouco tempo. Ele era sempre muito feliz. Eu sabia que não estava bem tem um tempo. Tínhamos contato quase que diariamente. Ele tinha problemas de estômago e Alzheimer, mas era sempre alegre. Sempre o encontrava no bar tomando a cervejinha perto da Vila Belmiro. Onde ele estava, estava a alegria. Foi um cara feliz. Vai fazer muita falta o eterno Coutinho.  Parceiro de Coutinho, Mengálvio se manifestou no Instagram:  O atacante Rodrygo, mais recente revelação do Santos, afirmou em postagem que Coutinho era uma ""referência"":  Rival do Santos, o Corinthians lamentou a morte de Coutinho no Twitter:  O Palmeiras também homenageou o ex-jogador:  Em 2014, a Santos TV reeditou a dupla Pelé e Coutinho para um desafio de videogame:  A Fifa, no perfil da Copa do Mundo em espanhol, chamou Coutinho de ""o grande parceiro de Pelé"": ",esportes,,,"Parceiro de Pelé, ex-atacante marcou 368 gols pelo clube alvinegro",," Coutinho, eterno camisa 9 do Santos, morre aos 75 anos  Morreu nesta segunda-feira o ex-atacante Coutinho, um dos maiores ídolos da história do Santos e campeão do mundo em 1962, na Copa do Mundo disputada no Chile. Ele tinha 75 anos.  Segundo o médico Milton Mattozinho, a causa foi um infarto agudo do miocárdio em decorrência de diabetes e hipertensão arterial sistêmica.  O velório será realizado a partir das primeiras horas desta terça-feira no salão de mármore da Vila Belmiro. O sepultamento está marcado para 18h, no cemitério Memorial.  O Santos prestou homenagem ao ex-jogador com uma postagem nas redes sociais:  A pequena área perdeu um dos seus professores. pic.twitter.com/XeTO3y4CZb  Coutinho tinha diabetes, doença que levou à amputação de três dedos do pé esquerdo. Em janeiro, ele foi internado em Santos com uma pneumonia.  Antônio Wilson Honório nasceu em Piracicaba em 11 de junho de 1943. Ele estreou no Santos em 1958, quando tinha apenas 14 anos. Defendeu o time até 1967 e depois entre 1969 e 1970.  É o terceiro maior artilheiro da história do clube, com 368 gols em 457 jogos, atrás de Pepe, com 403 gols, e Pelé, com 1.091 gols.  O Rei do Futebol afirmou a dupla com Coutinho fez o Brasil ficar mais conhecido no mundo. E disse que um dia fará ""tabelinha"" com o ex-companheiro ""no céu"".  Nesse momento de imensa tristeza, o que nos fará lembrar eternamente de Coutinho são suas glórias, gols e histórias marcantes. Como neste vídeo que conta sobre sua trajetória na carreira até a Copa do Mundo. Fique em paz, Coutinho!https://t.co/F2DQ793ROt  No Santos, Coutinho formou o lendário ataque com Dorval, Mengálvio, Coutinho, Pelé e Pepe. Foi campeão paulista em 1960, 1961, 1962, 1964, 1965 e 1967, venceu cinco vezes a Taça Brasil, de 1961 a 1965, depois reconhecida como Brasileiro, além das Libertadores e dos Mundiais de Clubes de 1962 e 1963.  À Rádio Bandeirantes, Pepe comentou sobre a morte de Coutinho:  – Encontrei o Coutinho há pouco tempo. Ele era sempre muito feliz. Eu sabia que não estava bem tem um tempo. Tínhamos contato quase que diariamente. Ele tinha problemas de estômago e Alzheimer, mas era sempre alegre. Sempre o encontrava no bar tomando a cervejinha perto da Vila Belmiro. Onde ele estava, estava a alegria. Foi um cara feliz. Vai fazer muita falta o eterno Coutinho.  Adão, esse apelido só você entende, quero agora só lembrar dos momentos felizes. Dos abraços depois dos gols, das festas das vitórias e das risadas nos nossos muitos encontros. Vá em paz...😢  Parceiro de Coutinho, Mengálvio se manifestou no Instagram:  Hoje não é só o @santosfc e o Futebol que estão tristes, pois acabo de perder um dos meus melhores amigos dentro e fora de campo, uma pessoa extraordinária como ser humano, meu coração está de luto por você #Couto vai fazer muita falta😭😭😭🖤  O atacante Rodrygo, mais recente revelação do Santos, afirmou em postagem que Coutinho era uma ""referência"":  Descanse em paz, Coutinho. Que Deus possa confortar os familiares e amigos neste momento tão difícil. Ídolo da história do @SantosFC e do futebol mundial, uma referência para nós mais jovens no clube.  Rival do Santos, o Corinthians lamentou a morte de Coutinho no Twitter:  Muita força aos familiares, amigos e torcedores santistas. Estamos juntos neste momento tão difícil.  O Palmeiras também homenageou o ex-jogador:  Ele não jogou por aqui, mas já vestiu a nossa camisa enquanto jogava pela Seleção Brasileira. Coutinho, que foi grande personagem nos clássicos históricos entre Palmeiras x Santos, faleceu na noite desta segunda-feira. Desejamos toda força aos amigos e familiares. pic.twitter.com/GaKbB03daf ",23.0
35,2019-03-12,https://web.archive.org/web/20190312090041/https://globoesporte.globo.com/futebol/futebol-internacional/futebol-espanhol/noticia/neymar-ou-mbappe-presidente-do-real-madrid-e-questionado-sobre-qual-prefere-e-diz-os-dois.ghtml,https://globoesporte.globo.com/futebol/futebol-internacional/futebol-espanhol/noticia/neymar-ou-mbappe-presidente-do-real-madrid-e-questionado-sobre-qual-prefere-e-diz-os-dois.ghtml,"Neymar ou Mbappé? Presidente do Real Madrid é questionado sobre qual prefere e diz: ""Os dois"" "," O retorno de Zinedine Zidane deve ser apenas o início de uma mudança geral no Real Madrid. A revolução no elenco também passará por contratações. Grandes contratações. E o presidente do clube, Florentino Pérez, não se esquivou quando questionado sobre o assunto. Quando questionado sobre dois possíveis reforços especificamente: Neymar e Mbappé. O dirigente foi perguntado com qual dos atacantes ele ficaria. Florentino foi categórico na resposta.  – Os dois – respondeu Florentino, que depois deixou a zona mista onde dava entrevista aos jornalistas (veja a declaração no vídeo abaixo).  Veja mais:  O presidente merengue antes respondia especificamente sobre o atacante francês. E reforçou que agora espera contar com a ajuda de Zindane para tentar tirar o jovem jogador do PSG.  “(Zidane) É francês... com Mbappé poderia fazer algo”, disse Florentino, que depois reforçou não se preocupar muito com aquisições no momento.  – Agora, o que queremos é acabar bem a temporada e preparar para a próxima – declarou.  O Real Madrid esteve perto de fechar com Mbappé antes da ida do francês para o PSG. No entanto, o jovem atacante preferiu o acerto com a equipe parisiense. O clube merengue também sonha com Neymar e chegou a sondá-lo para a atual temporada, segundo publicações da imprensa espanhola.  Anunciado nesta segunda-feira, Zidane volta ao Real Madrid com um projeto de reestruturar a equipe. Eliminado da Copa do Rei e da Liga dos Campeões da Europa, o time merengue tem apenas mais 11 jogos a disputar na atual temporada, todos pelo Campeonato Espanhol. O Real é o terceiro colocado no torneio, com 51 pontos, 12 a menos que o líder Barcelona. A estreia de Zidane deve ser neste sábado, contra o Celta de Vigo, no Santiago Bernabéu. ",esportes,         é o seu time do coração?   Sim Não  ,,"Após apresentação do técnico Zinedine Zidane, Florentino Pérez não se esquiva e diz que ficaria com os dois atacantes do PSG",," Obrigado pela participação.  Nós usaremos esta informação para trazer mais novidades para você.  Por GloboEsporte.com — Madri, Espanha   11/03/2019 18h21    Atualizado  11/03/2019     O retorno de Zinedine Zidane deve ser apenas o início de uma mudança geral no Real Madrid. A revolução no elenco também passará por contratações. Grandes contratações. E o presidente do clube, Florentino Pérez, não se esquivou quando questionado sobre o assunto. Quando questionado sobre dois possíveis reforços especificamente: Neymar e Mbappé. O dirigente foi perguntado com qual dos atacantes ele ficaria. Florentino foi categórico na resposta.  – Os dois – respondeu Florentino, que depois deixou a zona mista onde dava entrevista aos jornalistas (veja a declaração no vídeo abaixo).  Veja mais: Zidane diz que não se sente em dívida com Real e evita falar de Cristiano Ronaldo: ""Não é tema""De volta! Real Madrid anuncia Zidane para substituir Solari no comando do clube O presidente merengue antes respondia especificamente sobre o atacante francês. E reforçou que agora espera contar com a ajuda de Zindane para tentar tirar o jovem jogador do PSG.  “(Zidane) É francês... com Mbappé poderia fazer algo”, disse Florentino, que depois reforçou não se preocupar muito com aquisições no momento.  – Agora, o que queremos é acabar bem a temporada e preparar para a próxima – declarou.  Neymar ou Mbappé no Real? Por que não os dois... — Foto: AFP  O Real Madrid esteve perto de fechar com Mbappé antes da ida do francês para o PSG. No entanto, o jovem atacante preferiu o acerto com a equipe parisiense. O clube merengue também sonha com Neymar e chegou a sondá-lo para a atual temporada, segundo publicações da imprensa espanhola.  Anunciado nesta segunda-feira, Zidane volta ao Real Madrid com um projeto de reestruturar a equipe. Eliminado da Copa do Rei e da Liga dos Campeões da Europa, o time merengue tem apenas mais 11 jogos a disputar na atual temporada, todos pelo Campeonato Espanhol. O Real é o terceiro colocado no torneio, com 51 pontos, 12 a menos que o líder Barcelona. A estreia de Zidane deve ser neste sábado, contra o Celta de Vigo, no Santiago Bernabéu. Veja também",14.0
36,2019-03-13,https://web.archive.org/web/20190312230023/https://globoesporte.globo.com/futebol/futebol-internacional/noticia/mensagens-misteriosas-de-alexandre-pato-nas-redes-sinalizam-saida-do-futebol-chines.ghtml,https://globoesporte.globo.com/futebol/futebol-internacional/noticia/mensagens-misteriosas-de-alexandre-pato-nas-redes-sinalizam-saida-do-futebol-chines.ghtml,Mensagens misteriosas de Alexandre Pato nas redes sinalizam saída do futebol chinês," Alexandre Pato pode estar perto de encerrar sua passagem no Tianjin Quanjian, sobretudo, se forem levadas em conta as misteriosas mensagens publicadas nesta terça-feira pelo jogador brasileiro. Fora de combate por questões contratuais, ele surpreendeu a torcida publicando uma série de mensagens esotéricas na rede social Weibo, onde é seguido por 753 mil pessoas, segundo informou a AFP.  - O que significa a felicidade? A verdade acaba sempre triunfando, não importa o quanto tentam escondê-la ou pará-la. As mentiras são apenas um atraso temporário do inevitável - diz a enigmática mensagem de Pato - acrescentou.  O artilheiro de 29 anos viveu um verdadeiro renascimento desde sua chegada há dois anos ao clube de Tianjin Quanjian vindo do Villarreal (Espanha) por € 18 milhões, após uma série de lesões e má forma física. Mas, ao voltar de férias nesta temporada, o ex-jogador do Milan descobriu que sua equipe havia mudado de nome e se chamava agora Tianjin Tianhai, após um escândalo que envolvia o dono do clube.  Das tribunas, Pato observa o Tianjin levar virada nos acréscimos diante do Shenzen  Pato não disputou os dois primeiros jogos, que foram perdidos por sua equipe, e os rumores falam de um possível retorno ao Brasil. Considerado um dos melhores jogadores da primeira divisão chinesa, o jogador havia se tornado um dos preferidos dos torcedores do país asiático, que apreciam sua boa adaptação aos costumes locais. ",esportes,,,"Fora de combate por questões contratuais, Pato publica série de mensagens esotéricas em rede social chinesa: ""As mentiras são apenas um atraso temporário do inevitável""",," Alexandre Pato pode estar perto de encerrar sua passagem no Tianjin Quanjian, sobretudo, se forem levadas em conta as misteriosas mensagens publicadas nesta terça-feira pelo jogador brasileiro. Fora de combate por questões contratuais, ele surpreendeu a torcida publicando uma série de mensagens esotéricas na rede social Weibo, onde é seguido por 753 mil pessoas, segundo informou a AFP.  - O que significa a felicidade? A verdade acaba sempre triunfando, não importa o quanto tentam escondê-la ou pará-la. As mentiras são apenas um atraso temporário do inevitável - diz a enigmática mensagem de Pato - acrescentou. ",2.0
37,2019-03-13,https://web.archive.org/web/20190312230023/https://globoesporte.globo.com/futebol/noticia/ligado-na-telinha-confira-os-jogos-do-meio-de-semana-com-transmissao-ao-vivo.ghtml,https://globoesporte.globo.com/futebol/noticia/ligado-na-telinha-confira-os-jogos-do-meio-de-semana-com-transmissao-ao-vivo.ghtml,Ligado na telinha: confira os jogos do meio de semana com transmissão ao vivo," TERÇA, 12  Taça Libertadores  19h15 Boca Juniors-ARG x Tolima-COLTransmissão: SporTV (com Jader Rocha e Raphael Rezende)  19h15 Olimpia-PAR x Universidad Concepción-CHITransmissão: SporTV 2 (com Julio Oliveira e André Loffredo)  21h15 Sporting Cristal-PER x Godoy Cruz-ARGTransmissão: SporTV 2 (com Eduardo Moreno e Carlos Eduardo Lino)  21h30 Grêmio x Libertad-PARTransmissão: SporTV (com Gustavo Villani e Lédio Carmona)  QUARTA, 13  Taça Libertadores  19h15 Cerro Porteño-PAR x Zamora-VENTransmissão: SporTV 2 (com Julio Oliveira e Carlos Eduardo Lino)  21h30 Flamengo x LDU-EQUTransmissão: TV Globo para RJ, SC, MG, ES, GO, TO, MS, MT, BA, SE, PE, PB, RN, PI, MA, PA, AM, RO, AC, RR, AP e DF (com Luis Roberto, Junior, Roger Flores e Leonardo Gaciba) e SporTV (com Luiz Carlos Júnior e Lédio Carmona)  21h30 Inter x Alianza Lima-PERTransmissão: TV Globo para RS e GloboEsporte.com (com Luciano Périco, Maurício Saraiva, Márcio Chagas da Silva e o meia Alex Raphael)  Copa do Brasil  18h Botafogo-PB x LondrinaTransmissão: GloboEsporte.com (com Linhares Jr. e Wagner Vilaron)  21h45 Ceará x CorinthiansTransmissão: TV Globo para SP, PR e CE (com Cleber Machado, Casagrande e Paulo César Oliveira) e SporTV 2 e PFCI (com Milton Leite e Mauricio Noriega)  Campeonato Pernambucano  18h55 Sport x SalgueiroTransmissão: Premiere e Premiere Play (com Rembrandt Junior e Cabral Neto)  Campeonato Alagoano  21h30 CSA x ASATransmissão: TV Globo para AL e GloboEsporte.com (com Madson Delano, Antônio Torres e Flávio Feijó de Omena)  QUINTA, 14  Copa do Brasil  21h15 Vasco x AvaíTransmissão: SporTV e PFCI (com Gustavo Villani e Raphael Rezende)  Campeonato Carioca  20h Boavista x FluminenseTransmissão: Premiere e Premiere Play (com Julio Oliveira e Carlos Eduardo Lino)  Campeonato Pernambucano  19h30 Santa Cruz x CentralTransmissão: SporTV e PFCI (com Rembrandt Junior e Cabral Neto)  SEXTA, 15  Campeonato Carioca  16h30 Bangu x PortuguesaTransmissão: GloboEsporte.com (com Guto Nejaim e Ricardo Gonzalez)  Campeonato Paulista  16h45 Bragantino x ItuanoTransmissão: SporTV 2 e PFCI (com Henrique Guidi e Alexandre Lozetti)  18h45 RB Brasil x São BentoTransmissão: SporTV (com Odinei Ribeiro e Wagner Vilaron)  20h30 Santos x NovorizontinoTransmissão: Premiere, Premiere Play e PFCI (com Jota Júnior e Ricardinho)  21h Ferroviária x São CaetanoTransmissão: SporTV (com Linhares Junior e Sérgio Xavier) ",esportes,,,"Destaque para as partidas pela Taça Libertadores e Copa do Brasil, entre elas Grêmio x Libertad-PAR, Fla x LDU-EQU, Inter x Alianza-PER, Ceará x Corinthians e Vasco x Avaí, além dos estaduais",," TERÇA, 12  Taça Libertadores  19h15 Boca Juniors-ARG x Tolima-COLTransmissão: SporTV (com Jader Rocha e Raphael Rezende)  19h15 Olimpia-PAR x Universidad Concepción-CHITransmissão: SporTV 2 (com Julio Oliveira e André Loffredo)  21h15 Sporting Cristal-PER x Godoy Cruz-ARGTransmissão: SporTV 2 (com Eduardo Moreno e Carlos Eduardo Lino)  21h30 Grêmio x Libertad-PARTransmissão: SporTV (com Gustavo Villani e Lédio Carmona)  QUARTA, 13  Taça Libertadores  19h15 Cerro Porteño-PAR x Zamora-VENTransmissão: SporTV 2 (com Julio Oliveira e Carlos Eduardo Lino)  21h30 Flamengo x LDU-EQUTransmissão: TV Globo para RJ, SC, MG, ES, GO, TO, MS, MT, BA, SE, PE, PB, RN, PI, MA, PA, AM, RO, AC, RR, AP e DF (com Luis Roberto, Junior, Roger Flores e Leonardo Gaciba) e SporTV (com Luiz Carlos Júnior e Lédio Carmona)  21h30 Inter x Alianza Lima-PERTransmissão: TV Globo para RS e GloboEsporte.com (com Luciano Périco, Maurício Saraiva, Márcio Chagas da Silva e o meia Alex Raphael)  Copa do Brasil  18h Botafogo-PB x LondrinaTransmissão: GloboEsporte.com (com Linhares Jr. e Wagner Vilaron)  21h45 Ceará x CorinthiansTransmissão: TV Globo para SP, PR e CE (com Cleber Machado, Casagrande e Paulo César Oliveira) e SporTV 2 e PFCI (com Milton Leite e Mauricio Noriega)  Campeonato Pernambucano  18h55 Sport x SalgueiroTransmissão: Premiere e Premiere Play (com Rembrandt Junior e Cabral Neto)  Campeonato Alagoano  21h30 CSA x ASATransmissão: TV Globo para AL e GloboEsporte.com (com Madson Delano, Antônio Torres e Flávio Feijó de Omena)  QUINTA, 14  Copa do Brasil  21h15 Vasco x AvaíTransmissão: SporTV e PFCI (com Gustavo Villani e Raphael Rezende)  Campeonato Carioca  20h Boavista x FluminenseTransmissão: Premiere e Premiere Play (com Julio Oliveira e Carlos Eduardo Lino)  Campeonato Pernambucano  19h30 Santa Cruz x CentralTransmissão: SporTV e PFCI (com Rembrandt Junior e Cabral Neto)  SEXTA, 15  Campeonato Carioca  16h30 Bangu x PortuguesaTransmissão: GloboEsporte.com (com Guto Nejaim e Ricardo Gonzalez)  Campeonato Paulista ",29.0
